benchmark/micro/kernels/tuner_record_bmm_8_34_512_1024.json
{"i": [["[\"32a5ff201401d5600f77ced9f22defaa\", [8, 34, 512], [8, 1024, 512], [8, 34, 1024]]", "cuda -keys=cuda,gpu -arch=sm_80 -max_num_threads=1024 -thread_warp_size=32", [-1, 16, 64, 49152, 2147483647, 1024, 8, 32], "", 0, []], [[], [["CHW", 2, "local"], ["SP", 2, 0, 8, [1, 1, 1, 2], 1], ["SP", 2, 5, 34, [1, 2, 1, 17], 1], ["SP", 2, 10, 1024, [4, 16, 1, 1], 1], ["SP", 2, 15, 512, [2, 8], 1], ["RE", 2, [0, 5, 10, 1, 6, 11, 2, 7, 12, 15, 16, 3, 8, 13, 17, 4, 9, 14]], ["FSP", 3, 0, 1, 3], ["FSP", 3, 4, 2, 3], ["FSP", 3, 8, 3, 3], ["RE", 3, [0, 4, 8, 1, 5, 9, 2, 6, 10, 3, 7, 11]], ["CA", 2, 3, 8], ["CHR", 1, "shared", [2]], ["CA", 2, 3, 9], ["CHR", 0, "shared", [3]], ["CA", 1, 4, 9], ["FU", 5, [0, 1, 2]], ["AN", 5, 0, 5], ["FU", 5, [1, 2, 3]], ["AN", 5, 1, 4], ["FU", 5, [2, 3, 4]], ["AN", 5, 2, 6], ["FU", 3, [0, 1, 2]], ["SP", 3, 0, 32, [1], 1], ["AN", 3, 1, 2], ["FFSP", 3, 0, [3, 2, 1], 1, 1], ["AN", 3, 1, 6], ["FU", 1, [0, 1, 2]], ["SP", 1, 0, 544, [1], 1], ["AN", 1, 1, 2], ["FFSP", 1, 0, [3, 2, 1], 1, 1], ["AN", 1, 1, 6], ["PR", 4, 0, "auto_unroll_max_step$0"]]]], "r": [[0.000185918], 0, 2.58166, 1670453332], "v": "v0.6"}
{"i": [["[\"32a5ff201401d5600f77ced9f22defaa\", [8, 34, 512], [8, 1024, 512], [8, 34, 1024]]", "cuda -keys=cuda,gpu -arch=sm_80 -max_num_threads=1024 -thread_warp_size=32", [-1, 16, 64, 49152, 2147483647, 1024, 8, 32], "", 0, []], [[], [["CHW", 2, "local"], ["SP", 2, 0, 8, [2, 2, 1, 2], 1], ["SP", 2, 5, 34, [1, 1, 17, 2], 1], ["SP", 2, 10, 1024, [1, 64, 4, 1], 1], ["SP", 2, 15, 512, [1, 2], 1], ["RE", 2, [0, 5, 10, 1, 6, 11, 2, 7, 12, 15, 16, 3, 8, 13, 17, 4, 9, 14]], ["FSP", 3, 0, 1, 3], ["FSP", 3, 4, 2, 3], ["FSP", 3, 8, 3, 3], ["RE", 3, [0, 4, 8, 1, 5, 9, 2, 6, 10, 3, 7, 11]], ["CA", 2, 3, 8], ["CHR", 1, "shared", [2]], ["CA", 2, 3, 9], ["CHR", 0, "shared", [3]], ["CA", 1, 4, 9], ["FU", 5, [0, 1, 2]], ["AN", 5, 0, 5], ["FU", 5, [1, 2, 3]], ["AN", 5, 1, 4], ["FU", 5, [2, 3, 4]], ["AN", 5, 2, 6], ["FU", 3, [0, 1, 2]], ["SP", 3, 0, 32, [1], 1], ["AN", 3, 1, 2], ["FFSP", 3, 0, [3, 2, 1], 1, 1], ["AN", 3, 1, 6], ["FU", 1, [0, 1, 2]], ["SP", 1, 0, 272, [1], 1], ["AN", 1, 1, 2], ["FFSP", 1, 0, [3, 2, 1], 1, 1], ["AN", 1, 1, 6], ["PR", 4, 0, "auto_unroll_max_step$512"]]]], "r": [[0.00457994], 0, 2.53177, 1670453333], "v": "v0.6"}
{"i": [["[\"32a5ff201401d5600f77ced9f22defaa\", [8, 34, 512], [8, 1024, 512], [8, 34, 1024]]", "cuda -keys=cuda,gpu -arch=sm_80 -max_num_threads=1024 -thread_warp_size=32", [-1, 16, 64, 49152, 2147483647, 1024, 8, 32], "", 0, []], [[], [["CHW", 2, "local"], ["SP", 2, 0, 8, [1, 2, 1, 2], 1], ["SP", 2, 5, 34, [1, 1, 1, 17], 1], ["SP", 2, 10, 1024, [1, 256, 1, 1], 1], ["SP", 2, 15, 512, [2, 2], 1], ["RE", 2, [0, 5, 10, 1, 6, 11, 2, 7, 12, 15, 16, 3, 8, 13, 17, 4, 9, 14]], ["FSP", 3, 0, 1, 3], ["FSP", 3, 4, 2, 3], ["FSP", 3, 8, 3, 3], ["RE", 3, [0, 4, 8, 1, 5, 9, 2, 6, 10, 3, 7, 11]], ["CA", 2, 3, 8], ["CHR", 1, "shared", [2]], ["CA", 2, 3, 9], ["CHR", 0, "shared", [3]], ["CA", 1, 4, 9], ["FU", 5, [0, 1, 2]], ["AN", 5, 0, 5], ["FU", 5, [1, 2, 3]], ["AN", 5, 1, 4], ["FU", 5, [2, 3, 4]], ["AN", 5, 2, 6], ["FU", 3, [0, 1, 2]], ["SP", 3, 0, 8, [1], 1], ["AN", 3, 1, 2], ["FFSP", 3, 0, [3, 2, 1], 1, 1], ["AN", 3, 1, 6], ["FU", 1, [0, 1, 2]], ["SP", 1, 0, 136, [1], 1], ["AN", 1, 1, 2], ["FFSP", 1, 0, [3, 2, 1], 1, 1], ["AN", 1, 1, 6], ["PR", 4, 0, "auto_unroll_max_step$16"]]]], "r": [[0.000291257], 0, 2.09838, 1670453335], "v": "v0.6"}
{"i": [["[\"32a5ff201401d5600f77ced9f22defaa\", [8, 34, 512], [8, 1024, 512], [8, 34, 1024]]", "cuda -keys=cuda,gpu -arch=sm_80 -max_num_threads=1024 -thread_warp_size=32", [-1, 16, 64, 49152, 2147483647, 1024, 8, 32], "", 0, []], [[], [["CHW", 2, "local"], ["SP", 2, 0, 8, [1, 4, 1, 1], 1], ["SP", 2, 5, 34, [1, 1, 34, 1], 1], ["SP", 2, 10, 1024, [1, 32, 16, 1], 1], ["SP", 2, 15, 512, [1, 2], 1], ["RE", 2, [0, 5, 10, 1, 6, 11, 2, 7, 12, 15, 16, 3, 8, 13, 17, 4, 9, 14]], ["FSP", 3, 0, 1, 3], ["FSP", 3, 4, 2, 3], ["FSP", 3, 8, 3, 3], ["RE", 3, [0, 4, 8, 1, 5, 9, 2, 6, 10, 3, 7, 11]], ["CA", 2, 3, 8], ["CHR", 1, "shared", [2]], ["CA", 2, 3, 9], ["CHR", 0, "shared", [3]], ["CA", 1, 4, 9], ["FU", 5, [0, 1, 2]], ["AN", 5, 0, 5], ["FU", 5, [1, 2, 3]], ["AN", 5, 1, 4], ["FU", 5, [2, 3, 4]], ["AN", 5, 2, 6], ["FU", 3, [0, 1, 2]], ["SP", 3, 0, 32, [2], 1], ["AN", 3, 1, 2], ["FFSP", 3, 0, [3, 2, 1], 1, 1], ["AN", 3, 1, 6], ["FU", 1, [0, 1, 2]], ["SP", 1, 0, 68, [2], 1], ["AN", 1, 1, 2], ["FFSP", 1, 0, [3, 2, 1], 1, 1], ["AN", 1, 1, 6], ["PR", 4, 0, "auto_unroll_max_step$1024"]]]], "r": [[0.00415185], 0, 2.43034, 1670453336], "v": "v0.6"}
{"i": [["[\"32a5ff201401d5600f77ced9f22defaa\", [8, 34, 512], [8, 1024, 512], [8, 34, 1024]]", "cuda -keys=cuda,gpu -arch=sm_80 -max_num_threads=1024 -thread_warp_size=32", [-1, 16, 64, 49152, 2147483647, 1024, 8, 32], "", 0, []], [[], [["CHW", 2, "local"], ["SP", 2, 0, 8, [1, 2, 1, 1], 1], ["SP", 2, 5, 34, [1, 17, 1, 2], 1], ["SP", 2, 10, 1024, [2, 1, 8, 32], 1], ["SP", 2, 15, 512, [2, 1], 1], ["RE", 2, [0, 5, 10, 1, 6, 11, 2, 7, 12, 15, 16, 3, 8, 13, 17, 4, 9, 14]], ["FSP", 3, 0, 1, 3], ["FSP", 3, 4, 2, 3], ["FSP", 3, 8, 3, 3], ["RE", 3, [0, 4, 8, 1, 5, 9, 2, 6, 10, 3, 7, 11]], ["CA", 2, 3, 8], ["CHR", 1, "shared", [2]], ["CA", 2, 3, 9], ["CHR", 0, "shared", [3]], ["CA", 1, 4, 9], ["FU", 5, [0, 1, 2]], ["AN", 5, 0, 5], ["FU", 5, [1, 2, 3]], ["AN", 5, 1, 4], ["FU", 5, [2, 3, 4]], ["AN", 5, 2, 6], ["FU", 3, [0, 1, 2]], ["SP", 3, 0, 512, [1], 1], ["AN", 3, 1, 2], ["FFSP", 3, 0, [3, 2, 1], 1, 1], ["AN", 3, 1, 6], ["FU", 1, [0, 1, 2]], ["SP", 1, 0, 4, [1], 1], ["AN", 1, 1, 2], ["FFSP", 1, 0, [3, 2, 1], 1, 1], ["AN", 1, 1, 6], ["PR", 4, 0, "auto_unroll_max_step$64"]]]], "r": [[0.00699245], 0, 2.6419, 1670453337], "v": "v0.6"}
{"i": [["[\"32a5ff201401d5600f77ced9f22defaa\", [8, 34, 512], [8, 1024, 512], [8, 34, 1024]]", "cuda -keys=cuda,gpu -arch=sm_80 -max_num_threads=1024 -thread_warp_size=32", [-1, 16, 64, 49152, 2147483647, 1024, 8, 32], "", 0, []], [[], [["CHW", 2, "local"], ["SP", 2, 0, 8, [1, 1, 2, 1], 1], ["SP", 2, 5, 34, [1, 17, 2, 1], 1], ["SP", 2, 10, 1024, [1, 2, 32, 1], 1], ["SP", 2, 15, 512, [1, 1], 1], ["RE", 2, [0, 5, 10, 1, 6, 11, 2, 7, 12, 15, 16, 3, 8, 13, 17, 4, 9, 14]], ["FSP", 3, 0, 1, 3], ["FSP", 3, 4, 2, 3], ["FSP", 3, 8, 3, 3], ["RE", 3, [0, 4, 8, 1, 5, 9, 2, 6, 10, 3, 7, 11]], ["CA", 2, 3, 8], ["CHR", 1, "shared", [2]], ["CA", 2, 3, 9], ["CHR", 0, "shared", [3]], ["CA", 1, 4, 9], ["FU", 5, [0, 1, 2]], ["AN", 5, 0, 5], ["FU", 5, [1, 2, 3]], ["AN", 5, 1, 4], ["FU", 5, [2, 3, 4]], ["AN", 5, 2, 6], ["FU", 3, [0, 1, 2]], ["SP", 3, 0, 64, [1], 1], ["AN", 3, 1, 2], ["FFSP", 3, 0, [3, 2, 1], 1, 1], ["AN", 3, 1, 6], ["FU", 1, [0, 1, 2]], ["SP", 1, 0, 4, [1], 1], ["AN", 1, 1, 2], ["FFSP", 1, 0, [3, 2, 1], 1, 1], ["AN", 1, 1, 6], ["PR", 4, 0, "auto_unroll_max_step$64"]]]], "r": [[0.000289257], 0, 2.2588, 1670453338], "v": "v0.6"}
{"i": [["[\"32a5ff201401d5600f77ced9f22defaa\", [8, 34, 512], [8, 1024, 512], [8, 34, 1024]]", "cuda -keys=cuda,gpu -arch=sm_80 -max_num_threads=1024 -thread_warp_size=32", [-1, 16, 64, 49152, 2147483647, 1024, 8, 32], "", 0, []], [[], [["CHW", 2, "local"], ["SP", 2, 0, 8, [2, 1, 4, 1], 1], ["SP", 2, 5, 34, [1, 1, 1, 1], 1], ["SP", 2, 10, 1024, [2, 8, 2, 16], 1], ["SP", 2, 15, 512, [2, 1], 1], ["RE", 2, [0, 5, 10, 1, 6, 11, 2, 7, 12, 15, 16, 3, 8, 13, 17, 4, 9, 14]], ["FSP", 3, 0, 1, 3], ["FSP", 3, 4, 2, 3], ["FSP", 3, 8, 3, 3], ["RE", 3, [0, 4, 8, 1, 5, 9, 2, 6, 10, 3, 7, 11]], ["CA", 2, 3, 8], ["CHR", 1, "shared", [2]], ["CA", 2, 3, 9], ["CHR", 0, "shared", [3]], ["CA", 1, 4, 9], ["FU", 5, [0, 1, 2]], ["AN", 5, 0, 5], ["FU", 5, [1, 2, 3]], ["AN", 5, 1, 4], ["FU", 5, [2, 3, 4]], ["AN", 5, 2, 6], ["FU", 3, [0, 1, 2]], ["SP", 3, 0, 1024, [1], 1], ["AN", 3, 1, 2], ["FFSP", 3, 0, [3, 2, 1], 1, 1], ["AN", 3, 1, 6], ["FU", 1, [0, 1, 2]], ["SP", 1, 0, 8, [1], 1], ["AN", 1, 1, 2], ["FFSP", 1, 0, [3, 2, 1], 1, 1], ["AN", 1, 1, 6], ["PR", 4, 0, "auto_unroll_max_step$1024"]]]], "r": [[0.00867234], 0, 11.4883, 1670453339], "v": "v0.6"}
{"i": [["[\"32a5ff201401d5600f77ced9f22defaa\", [8, 34, 512], [8, 1024, 512], [8, 34, 1024]]", "cuda -keys=cuda,gpu -arch=sm_80 -max_num_threads=1024 -thread_warp_size=32", [-1, 16, 64, 49152, 2147483647, 1024, 8, 32], "", 0, []], [[], [["CHW", 2, "local"], ["SP", 2, 0, 8, [2, 2, 2, 1], 1], ["SP", 2, 5, 34, [1, 34, 1, 1], 1], ["SP", 2, 10, 1024, [4, 8, 1, 4], 1], ["SP", 2, 15, 512, [1, 1], 1], ["RE", 2, [0, 5, 10, 1, 6, 11, 2, 7, 12, 15, 16, 3, 8, 13, 17, 4, 9, 14]], ["FSP", 3, 0, 1, 3], ["FSP", 3, 4, 2, 3], ["FSP", 3, 8, 3, 3], ["RE", 3, [0, 4, 8, 1, 5, 9, 2, 6, 10, 3, 7, 11]], ["CA", 2, 3, 8], ["CHR", 1, "shared", [2]], ["CA", 2, 3, 9], ["CHR", 0, "shared", [3]], ["CA", 1, 4, 9], ["FU", 5, [0, 1, 2]], ["AN", 5, 0, 5], ["FU", 5, [1, 2, 3]], ["AN", 5, 1, 4], ["FU", 5, [2, 3, 4]], ["AN", 5, 2, 6], ["FU", 3, [0, 1, 2]], ["SP", 3, 0, 16, [4], 1], ["AN", 3, 1, 2], ["FFSP", 3, 0, [3, 2, 1], 1, 1], ["AN", 3, 1, 6], ["FU", 1, [0, 1, 2]], ["SP", 1, 0, 2, [1], 1], ["AN", 1, 1, 2], ["FFSP", 1, 0, [3, 2, 1], 1, 1], ["AN", 1, 1, 6], ["PR", 4, 0, "auto_unroll_max_step$16"]]]], "r": [[0.00107709], 0, 1.5285, 1670453340], "v": "v0.6"}
{"i": [["[\"32a5ff201401d5600f77ced9f22defaa\", [8, 34, 512], [8, 1024, 512], [8, 34, 1024]]", "cuda -keys=cuda,gpu -arch=sm_80 -max_num_threads=1024 -thread_warp_size=32", [-1, 16, 64, 49152, 2147483647, 1024, 8, 32], "", 0, []], [[], [["CHW", 2, "local"], ["SP", 2, 0, 8, [4, 1, 1, 1], 1], ["SP", 2, 5, 34, [2, 1, 1, 1], 1], ["SP", 2, 10, 1024, [1, 64, 1, 8], 1], ["SP", 2, 15, 512, [2, 2], 1], ["RE", 2, [0, 5, 10, 1, 6, 11, 2, 7, 12, 15, 16, 3, 8, 13, 17, 4, 9, 14]], ["FSP", 3, 0, 1, 3], ["FSP", 3, 4, 2, 3], ["FSP", 3, 8, 3, 3], ["RE", 3, [0, 4, 8, 1, 5, 9, 2, 6, 10, 3, 7, 11]], ["CA", 2, 3, 8], ["CHR", 1, "shared", [2]], ["CA", 2, 3, 9], ["CHR", 0, "shared", [3]], ["CA", 1, 4, 9], ["FU", 5, [0, 1, 2]], ["AN", 5, 0, 5], ["FU", 5, [1, 2, 3]], ["AN", 5, 1, 4], ["FU", 5, [2, 3, 4]], ["AN", 5, 2, 6], ["FU", 3, [0, 1, 2]], ["SP", 3, 0, 32, [1], 1], ["AN", 3, 1, 2], ["FFSP", 3, 0, [3, 2, 1], 1, 1], ["AN", 3, 1, 6], ["FU", 1, [0, 1, 2]], ["SP", 1, 0, 4, [1], 1], ["AN", 1, 1, 2], ["FFSP", 1, 0, [3, 2, 1], 1, 1], ["AN", 1, 1, 6], ["PR", 4, 0, "auto_unroll_max_step$512"]]]], "r": [[0.000523403], 0, 2.43259, 1670453342], "v": "v0.6"}
{"i": [["[\"32a5ff201401d5600f77ced9f22defaa\", [8, 34, 512], [8, 1024, 512], [8, 34, 1024]]", "cuda -keys=cuda,gpu -arch=sm_80 -max_num_threads=1024 -thread_warp_size=32", [-1, 16, 64, 49152, 2147483647, 1024, 8, 32], "", 0, []], [[], [["CHW", 2, "local"], ["SP", 2, 0, 8, [1, 2, 1, 1], 1], ["SP", 2, 5, 34, [1, 1, 1, 17], 1], ["SP", 2, 10, 1024, [4, 16, 2, 2], 1], ["SP", 2, 15, 512, [2, 1], 1], ["RE", 2, [0, 5, 10, 1, 6, 11, 2, 7, 12, 15, 16, 3, 8, 13, 17, 4, 9, 14]], ["FSP", 3, 0, 1, 3], ["FSP", 3, 4, 2, 3], ["FSP", 3, 8, 3, 3], ["RE", 3, [0, 4, 8, 1, 5, 9, 2, 6, 10, 3, 7, 11]], ["CA", 2, 3, 8], ["CHR", 1, "shared", [2]], ["CA", 2, 3, 9], ["CHR", 0, "shared", [3]], ["CA", 1, 4, 9], ["FU", 5, [0, 1, 2]], ["AN", 5, 0, 5], ["FU", 5, [1, 2, 3]], ["AN", 5, 1, 4], ["FU", 5, [2, 3, 4]], ["AN", 5, 2, 6], ["FU", 3, [0, 1, 2]], ["SP", 3, 0, 8, [2], 1], ["AN", 3, 1, 2], ["FFSP", 3, 0, [3, 2, 1], 1, 1], ["AN", 3, 1, 6], ["FU", 1, [0, 1, 2]], ["SP", 1, 0, 34, [1], 1], ["AN", 1, 1, 2], ["FFSP", 1, 0, [3, 2, 1], 1, 1], ["AN", 1, 1, 6], ["PR", 4, 0, "auto_unroll_max_step$64"]]]], "r": [[0.00072937], 0, 2.14063, 1670453343], "v": "v0.6"}
{"i": [["[\"32a5ff201401d5600f77ced9f22defaa\", [8, 34, 512], [8, 1024, 512], [8, 34, 1024]]", "cuda -keys=cuda,gpu -arch=sm_80 -max_num_threads=1024 -thread_warp_size=32", [-1, 16, 64, 49152, 2147483647, 1024, 8, 32], "", 0, []], [[], [["CHW", 2, "local"], ["SP", 2, 0, 8, [1, 1, 1, 1], 1], ["SP", 2, 5, 34, [1, 17, 1, 1], 1], ["SP", 2, 10, 1024, [1, 4, 2, 16], 1], ["SP", 2, 15, 512, [1, 32], 1], ["RE", 2, [0, 5, 10, 1, 6, 11, 2, 7, 12, 15, 16, 3, 8, 13, 17, 4, 9, 14]], ["FSP", 3, 0, 1, 3], ["FSP", 3, 4, 2, 3], ["FSP", 3, 8, 3, 3], ["RE", 3, [0, 4, 8, 1, 5, 9, 2, 6, 10, 3, 7, 11]], ["CA", 2, 3, 8], ["CHR", 1, "shared", [2]], ["CA", 2, 3, 9], ["CHR", 0, "shared", [3]], ["CA", 1, 4, 9], ["FU", 5, [0, 1, 2]], ["AN", 5, 0, 5], ["FU", 5, [1, 2, 3]], ["AN", 5, 1, 4], ["FU", 5, [2, 3, 4]], ["AN", 5, 2, 6], ["FU", 3, [0, 1, 2]], ["SP", 3, 0, 2048, [8], 1], ["AN", 3, 1, 2], ["FFSP", 3, 0, [3, 2, 1], 1, 1], ["AN", 3, 1, 6], ["FU", 1, [0, 1, 2]], ["SP", 1, 0, 64, [1], 1], ["AN", 1, 1, 2], ["FFSP", 1, 0, [3, 2, 1], 1, 1], ["AN", 1, 1, 6], ["PR", 4, 0, "auto_unroll_max_step$0"]]]], "r": [[0.000261921], 0, 1.86814, 1670453344], "v": "v0.6"}
{"i": [["[\"32a5ff201401d5600f77ced9f22defaa\", [8, 34, 512], [8, 1024, 512], [8, 34, 1024]]", "cuda -keys=cuda,gpu -arch=sm_80 -max_num_threads=1024 -thread_warp_size=32", [-1, 16, 64, 49152, 2147483647, 1024, 8, 32], "", 0, []], [[], [["CHW", 2, "local"], ["SP", 2, 0, 8, [1, 4, 2, 1], 1], ["SP", 2, 5, 34, [1, 17, 1, 2], 1], ["SP", 2, 10, 1024, [2, 1, 8, 32], 1], ["SP", 2, 15, 512, [2, 1], 1], ["RE", 2, [0, 5, 10, 1, 6, 11, 2, 7, 12, 15, 16, 3, 8, 13, 17, 4, 9, 14]], ["FSP", 3, 0, 1, 3], ["FSP", 3, 4, 2, 3], ["FSP", 3, 8, 3, 3], ["RE", 3, [0, 4, 8, 1, 5, 9, 2, 6, 10, 3, 7, 11]], ["CA", 2, 3, 8], ["CHR", 1, "shared", [2]], ["CA", 2, 3, 9], ["CHR", 0, "shared", [3]], ["CA", 1, 4, 9], ["FU", 5, [0, 1, 2]], ["AN", 5, 0, 5], ["FU", 5, [1, 2, 3]], ["AN", 5, 1, 4], ["FU", 5, [2, 3, 4]], ["AN", 5, 2, 6], ["FU", 3, [0, 1, 2]], ["SP", 3, 0, 512, [1], 1], ["AN", 3, 1, 2], ["FFSP", 3, 0, [3, 2, 1], 1, 1], ["AN", 3, 1, 6], ["FU", 1, [0, 1, 2]], ["SP", 1, 0, 4, [1], 1], ["AN", 1, 1, 2], ["FFSP", 1, 0, [3, 2, 1], 1, 1], ["AN", 1, 1, 6], ["PR", 4, 0, "auto_unroll_max_step$64"]]]], "r": [[0.0154731], 0, 2.4523, 1670453345], "v": "v0.6"}
{"i": [["[\"32a5ff201401d5600f77ced9f22defaa\", [8, 34, 512], [8, 1024, 512], [8, 34, 1024]]", "cuda -keys=cuda,gpu -arch=sm_80 -max_num_threads=1024 -thread_warp_size=32", [-1, 16, 64, 49152, 2147483647, 1024, 8, 32], "", 0, []], [[], [["CHW", 2, "local"], ["SP", 2, 0, 8, [1, 1, 1, 1], 1], ["SP", 2, 5, 34, [1, 17, 1, 1], 1], ["SP", 2, 10, 1024, [1, 4, 2, 16], 1], ["SP", 2, 15, 512, [4, 16], 1], ["RE", 2, [0, 5, 10, 1, 6, 11, 2, 7, 12, 15, 16, 3, 8, 13, 17, 4, 9, 14]], ["FSP", 3, 0, 1, 3], ["FSP", 3, 4, 2, 3], ["FSP", 3, 8, 3, 3], ["RE", 3, [0, 4, 8, 1, 5, 9, 2, 6, 10, 3, 7, 11]], ["CA", 2, 3, 8], ["CHR", 1, "shared", [2]], ["CA", 2, 3, 9], ["CHR", 0, "shared", [3]], ["CA", 1, 4, 9], ["FU", 5, [0, 1, 2]], ["AN", 5, 0, 5], ["FU", 5, [1, 2, 3]], ["AN", 5, 1, 4], ["FU", 5, [2, 3, 4]], ["AN", 5, 2, 6], ["FU", 3, [0, 1, 2]], ["SP", 3, 0, 2048, [1], 1], ["AN", 3, 1, 2], ["FFSP", 3, 0, [3, 2, 1], 1, 1], ["AN", 3, 1, 6], ["FU", 1, [0, 1, 2]], ["SP", 1, 0, 64, [1], 1], ["AN", 1, 1, 2], ["FFSP", 1, 0, [3, 2, 1], 1, 1], ["AN", 1, 1, 6], ["PR", 4, 0, "auto_unroll_max_step$0"]]]], "r": [[0.000353261], 0, 2.21091, 1670453347], "v": "v0.6"}
{"i": [["[\"32a5ff201401d5600f77ced9f22defaa\", [8, 34, 512], [8, 1024, 512], [8, 34, 1024]]", "cuda -keys=cuda,gpu -arch=sm_80 -max_num_threads=1024 -thread_warp_size=32", [-1, 16, 64, 49152, 2147483647, 1024, 8, 32], "", 0, []], [[], [["CHW", 2, "local"], ["SP", 2, 0, 8, [1, 2, 1, 1], 1], ["SP", 2, 5, 34, [1, 34, 1, 1], 1], ["SP", 2, 10, 1024, [2, 2, 2, 16], 1], ["SP", 2, 15, 512, [16, 1], 1], ["RE", 2, [0, 5, 10, 1, 6, 11, 2, 7, 12, 15, 16, 3, 8, 13, 17, 4, 9, 14]], ["FSP", 3, 0, 1, 3], ["FSP", 3, 4, 2, 3], ["FSP", 3, 8, 3, 3], ["RE", 3, [0, 4, 8, 1, 5, 9, 2, 6, 10, 3, 7, 11]], ["CA", 2, 3, 8], ["CHR", 1, "shared", [2]], ["CA", 2, 3, 9], ["CHR", 0, "shared", [3]], ["CA", 1, 4, 9], ["FU", 5, [0, 1, 2]], ["AN", 5, 0, 5], ["FU", 5, [1, 2, 3]], ["AN", 5, 1, 4], ["FU", 5, [2, 3, 4]], ["AN", 5, 2, 6], ["FU", 3, [0, 1, 2]], ["SP", 3, 0, 128, [1], 1], ["AN", 3, 1, 2], ["FFSP", 3, 0, [3, 2, 1], 1, 1], ["AN", 3, 1, 6], ["FU", 1, [0, 1, 2]], ["SP", 1, 0, 32, [1], 1], ["AN", 1, 1, 2], ["FFSP", 1, 0, [3, 2, 1], 1, 1], ["AN", 1, 1, 6], ["PR", 4, 0, "auto_unroll_max_step$512"]]]], "r": [[0.000360282], 0, 2.04422, 1670453348], "v": "v0.6"}
{"i": [["[\"32a5ff201401d5600f77ced9f22defaa\", [8, 34, 512], [8, 1024, 512], [8, 34, 1024]]", "cuda -keys=cuda,gpu -arch=sm_80 -max_num_threads=1024 -thread_warp_size=32", [-1, 16, 64, 49152, 2147483647, 1024, 8, 32], "", 0, []], [[], [["CHW", 2, "local"], ["SP", 2, 0, 8, [1, 1, 4, 2], 1], ["SP", 2, 5, 34, [2, 17, 1, 1], 1], ["SP", 2, 10, 1024, [4, 8, 8, 1], 1], ["SP", 2, 15, 512, [4, 1], 1], ["RE", 2, [0, 5, 10, 1, 6, 11, 2, 7, 12, 15, 16, 3, 8, 13, 17, 4, 9, 14]], ["FSP", 3, 0, 1, 3], ["FSP", 3, 4, 2, 3], ["FSP", 3, 8, 3, 3], ["RE", 3, [0, 4, 8, 1, 5, 9, 2, 6, 10, 3, 7, 11]], ["CA", 2, 3, 8], ["CHR", 1, "shared", [2]], ["CA", 2, 3, 9], ["CHR", 0, "shared", [3]], ["CA", 1, 4, 9], ["FU", 5, [0, 1, 2]], ["AN", 5, 0, 5], ["FU", 5, [1, 2, 3]], ["AN", 5, 1, 4], ["FU", 5, [2, 3, 4]], ["AN", 5, 2, 6], ["FU", 3, [0, 1, 2]], ["SP", 3, 0, 256, [1], 1], ["AN", 3, 1, 2], ["FFSP", 3, 0, [3, 2, 1], 1, 1], ["AN", 3, 1, 6], ["FU", 1, [0, 1, 2]], ["SP", 1, 0, 32, [1], 1], ["AN", 1, 1, 2], ["FFSP", 1, 0, [3, 2, 1], 1, 1], ["AN", 1, 1, 6], ["PR", 4, 0, "auto_unroll_max_step$64"]]]], "r": [[0.00684257], 0, 1.94318, 1670453349], "v": "v0.6"}
{"i": [["[\"32a5ff201401d5600f77ced9f22defaa\", [8, 34, 512], [8, 1024, 512], [8, 34, 1024]]", "cuda -keys=cuda,gpu -arch=sm_80 -max_num_threads=1024 -thread_warp_size=32", [-1, 16, 64, 49152, 2147483647, 1024, 8, 32], "", 0, []], [[], [["CHW", 2, "local"], ["SP", 2, 0, 8, [2, 2, 1, 1], 1], ["SP", 2, 5, 34, [1, 17, 1, 2], 1], ["SP", 2, 10, 1024, [2, 1, 16, 32], 1], ["SP", 2, 15, 512, [2, 1], 1], ["RE", 2, [0, 5, 10, 1, 6, 11, 2, 7, 12, 15, 16, 3, 8, 13, 17, 4, 9, 14]], ["FSP", 3, 0, 1, 3], ["FSP", 3, 4, 2, 3], ["FSP", 3, 8, 3, 3], ["RE", 3, [0, 4, 8, 1, 5, 9, 2, 6, 10, 3, 7, 11]], ["CA", 2, 3, 8], ["CHR", 1, "shared", [2]], ["CA", 2, 3, 9], ["CHR", 0, "shared", [3]], ["CA", 1, 4, 9], ["FU", 5, [0, 1, 2]], ["AN", 5, 0, 5], ["FU", 5, [1, 2, 3]], ["AN", 5, 1, 4], ["FU", 5, [2, 3, 4]], ["AN", 5, 2, 6], ["FU", 3, [0, 1, 2]], ["SP", 3, 0, 512, [8], 1], ["AN", 3, 1, 2], ["FFSP", 3, 0, [3, 2, 1], 1, 1], ["AN", 3, 1, 6], ["FU", 1, [0, 1, 2]], ["SP", 1, 0, 4, [4], 1], ["AN", 1, 1, 2], ["FFSP", 1, 0, [3, 2, 1], 1, 1], ["AN", 1, 1, 6], ["PR", 4, 0, "auto_unroll_max_step$64"]]]], "r": [[0.0193965], 0, 2.0814, 1670453350], "v": "v0.6"}
{"i": [["[\"32a5ff201401d5600f77ced9f22defaa\", [8, 34, 512], [8, 1024, 512], [8, 34, 1024]]", "cuda -keys=cuda,gpu -arch=sm_80 -max_num_threads=1024 -thread_warp_size=32", [-1, 16, 64, 49152, 2147483647, 1024, 8, 32], "", 0, []], [[], [["CHW", 2, "local"], ["SP", 2, 0, 8, [1, 1, 2, 1], 1], ["SP", 2, 5, 34, [1, 17, 2, 1], 1], ["SP", 2, 10, 1024, [1, 2, 32, 1], 1], ["SP", 2, 15, 512, [1, 1], 1], ["RE", 2, [0, 5, 10, 1, 6, 11, 2, 7, 12, 15, 16, 3, 8, 13, 17, 4, 9, 14]], ["FSP", 3, 0, 1, 3], ["FSP", 3, 4, 2, 3], ["FSP", 3, 8, 3, 3], ["RE", 3, [0, 4, 8, 1, 5, 9, 2, 6, 10, 3, 7, 11]], ["CA", 2, 3, 8], ["CHR", 1, "shared", [2]], ["CA", 2, 3, 9], ["CHR", 0, "shared", [3]], ["CA", 1, 4, 9], ["FU", 5, [0, 1, 2]], ["AN", 5, 0, 5], ["FU", 5, [1, 2, 3]], ["AN", 5, 1, 4], ["FU", 5, [2, 3, 4]], ["AN", 5, 2, 6], ["FU", 3, [0, 1, 2]], ["SP", 3, 0, 64, [1], 1], ["AN", 3, 1, 2], ["FFSP", 3, 0, [3, 2, 1], 1, 1], ["AN", 3, 1, 6], ["FU", 1, [0, 1, 2]], ["SP", 1, 0, 4, [2], 1], ["AN", 1, 1, 2], ["FFSP", 1, 0, [3, 2, 1], 1, 1], ["AN", 1, 1, 6], ["PR", 4, 0, "auto_unroll_max_step$64"]]]], "r": [[0.000287975], 0, 1.98052, 1670453351], "v": "v0.6"}
{"i": [["[\"32a5ff201401d5600f77ced9f22defaa\", [8, 34, 512], [8, 1024, 512], [8, 34, 1024]]", "cuda -keys=cuda,gpu -arch=sm_80 -max_num_threads=1024 -thread_warp_size=32", [-1, 16, 64, 49152, 2147483647, 1024, 8, 32], "", 0, []], [[], [["CHW", 2, "local"], ["SP", 2, 0, 8, [1, 2, 1, 1], 1], ["SP", 2, 5, 34, [1, 1, 2, 1], 1], ["SP", 2, 10, 1024, [1, 32, 2, 4], 1], ["SP", 2, 15, 512, [1, 16], 1], ["RE", 2, [0, 5, 10, 1, 6, 11, 2, 7, 12, 15, 16, 3, 8, 13, 17, 4, 9, 14]], ["FSP", 3, 0, 1, 3], ["FSP", 3, 4, 2, 3], ["FSP", 3, 8, 3, 3], ["RE", 3, [0, 4, 8, 1, 5, 9, 2, 6, 10, 3, 7, 11]], ["CA", 2, 3, 8], ["CHR", 1, "shared", [2]], ["CA", 2, 3, 9], ["CHR", 0, "shared", [3]], ["CA", 1, 4, 9], ["FU", 5, [0, 1, 2]], ["AN", 5, 0, 5], ["FU", 5, [1, 2, 3]], ["AN", 5, 1, 4], ["FU", 5, [2, 3, 4]], ["AN", 5, 2, 6], ["FU", 3, [0, 1, 2]], ["SP", 3, 0, 128, [1], 1], ["AN", 3, 1, 2], ["FFSP", 3, 0, [3, 2, 1], 1, 1], ["AN", 3, 1, 6], ["FU", 1, [0, 1, 2]], ["SP", 1, 0, 32, [1], 1], ["AN", 1, 1, 2], ["FFSP", 1, 0, [3, 2, 1], 1, 1], ["AN", 1, 1, 6], ["PR", 4, 0, "auto_unroll_max_step$1024"]]]], "r": [[0.000218107], 0, 2.17411, 1670453353], "v": "v0.6"}
{"i": [["[\"32a5ff201401d5600f77ced9f22defaa\", [8, 34, 512], [8, 1024, 512], [8, 34, 1024]]", "cuda -keys=cuda,gpu -arch=sm_80 -max_num_threads=1024 -thread_warp_size=32", [-1, 16, 64, 49152, 2147483647, 1024, 8, 32], "", 0, []], [[], [["CHW", 2, "local"], ["SP", 2, 0, 8, [1, 4, 1, 1], 1], ["SP", 2, 5, 34, [1, 1, 17, 2], 1], ["SP", 2, 10, 1024, [1, 8, 8, 16], 1], ["SP", 2, 15, 512, [1, 1], 1], ["RE", 2, [0, 5, 10, 1, 6, 11, 2, 7, 12, 15, 16, 3, 8, 13, 17, 4, 9, 14]], ["FSP", 3, 0, 1, 3], ["FSP", 3, 4, 2, 3], ["FSP", 3, 8, 3, 3], ["RE", 3, [0, 4, 8, 1, 5, 9, 2, 6, 10, 3, 7, 11]], ["CA", 2, 3, 8], ["CHR", 1, "shared", [2]], ["CA", 2, 3, 9], ["CHR", 0, "shared", [3]], ["CA", 1, 4, 9], ["FU", 5, [0, 1, 2]], ["AN", 5, 0, 5], ["FU", 5, [1, 2, 3]], ["AN", 5, 1, 4], ["FU", 5, [2, 3, 4]], ["AN", 5, 2, 6], ["FU", 3, [0, 1, 2]], ["SP", 3, 0, 16, [1], 1], ["AN", 3, 1, 2], ["FFSP", 3, 0, [3, 2, 1], 1, 1], ["AN", 3, 1, 6], ["FU", 1, [0, 1, 2]], ["SP", 1, 0, 34, [1], 1], ["AN", 1, 1, 2], ["FFSP", 1, 0, [3, 2, 1], 1, 1], ["AN", 1, 1, 6], ["PR", 4, 0, "auto_unroll_max_step$512"]]]], "r": [[0.0261595], 0, 4.72728, 1670453354], "v": "v0.6"}
{"i": [["[\"32a5ff201401d5600f77ced9f22defaa\", [8, 34, 512], [8, 1024, 512], [8, 34, 1024]]", "cuda -keys=cuda,gpu -arch=sm_80 -max_num_threads=1024 -thread_warp_size=32", [-1, 16, 64, 49152, 2147483647, 1024, 8, 32], "", 0, []], [[], [["CHW", 2, "local"], ["SP", 2, 0, 8, [1, 1, 2, 1], 1], ["SP", 2, 5, 34, [1, 17, 1, 2], 1], ["SP", 2, 10, 1024, [2, 2, 1, 2], 1], ["SP", 2, 15, 512, [4, 32], 1], ["RE", 2, [0, 5, 10, 1, 6, 11, 2, 7, 12, 15, 16, 3, 8, 13, 17, 4, 9, 14]], ["FSP", 3, 0, 1, 3], ["FSP", 3, 4, 2, 3], ["FSP", 3, 8, 3, 3], ["RE", 3, [0, 4, 8, 1, 5, 9, 2, 6, 10, 3, 7, 11]], ["CA", 2, 3, 8], ["CHR", 1, "shared", [2]], ["CA", 2, 3, 9], ["CHR", 0, "shared", [3]], ["CA", 1, 4, 9], ["FU", 5, [0, 1, 2]], ["AN", 5, 0, 5], ["FU", 5, [1, 2, 3]], ["AN", 5, 1, 4], ["FU", 5, [2, 3, 4]], ["AN", 5, 2, 6], ["FU", 3, [0, 1, 2]], ["SP", 3, 0, 512, [4], 1], ["AN", 3, 1, 2], ["FFSP", 3, 0, [3, 2, 1], 1, 1], ["AN", 3, 1, 6], ["FU", 1, [0, 1, 2]], ["SP", 1, 0, 512, [4], 1], ["AN", 1, 1, 2], ["FFSP", 1, 0, [3, 2, 1], 1, 1], ["AN", 1, 1, 6], ["PR", 4, 0, "auto_unroll_max_step$64"]]]], "r": [[0.000108724], 0, 2.52888, 1670453355], "v": "v0.6"}
{"i": [["[\"32a5ff201401d5600f77ced9f22defaa\", [8, 34, 512], [8, 1024, 512], [8, 34, 1024]]", "cuda -keys=cuda,gpu -arch=sm_80 -max_num_threads=1024 -thread_warp_size=32", [-1, 16, 64, 49152, 2147483647, 1024, 8, 32], "", 0, []], [[], [["CHW", 2, "local"], ["SP", 2, 0, 8, [4, 2, 1, 1], 1], ["SP", 2, 5, 34, [1, 1, 1, 34], 1], ["SP", 2, 10, 1024, [1, 16, 8, 1], 1], ["SP", 2, 15, 512, [2, 1], 1], ["RE", 2, [0, 5, 10, 1, 6, 11, 2, 7, 12, 15, 16, 3, 8, 13, 17, 4, 9, 14]], ["FSP", 3, 0, 1, 3], ["FSP", 3, 4, 2, 3], ["FSP", 3, 8, 3, 3], ["RE", 3, [0, 4, 8, 1, 5, 9, 2, 6, 10, 3, 7, 11]], ["CA", 2, 3, 8], ["CHR", 1, "shared", [2]], ["CA", 2, 3, 9], ["CHR", 0, "shared", [3]], ["CA", 1, 4, 9], ["FU", 5, [0, 1, 2]], ["AN", 5, 0, 5], ["FU", 5, [1, 2, 3]], ["AN", 5, 1, 4], ["FU", 5, [2, 3, 4]], ["AN", 5, 2, 6], ["FU", 3, [0, 1, 2]], ["SP", 3, 0, 64, [1], 1], ["AN", 3, 1, 2], ["FFSP", 3, 0, [3, 2, 1], 1, 1], ["AN", 3, 1, 6], ["FU", 1, [0, 1, 2]], ["SP", 1, 0, 272, [1], 1], ["AN", 1, 1, 2], ["FFSP", 1, 0, [3, 2, 1], 1, 1], ["AN", 1, 1, 6], ["PR", 4, 0, "auto_unroll_max_step$1024"]]]], "r": [[0.0102772], 0, 3.22357, 1670453357], "v": "v0.6"}
{"i": [["[\"32a5ff201401d5600f77ced9f22defaa\", [8, 34, 512], [8, 1024, 512], [8, 34, 1024]]", "cuda -keys=cuda,gpu -arch=sm_80 -max_num_threads=1024 -thread_warp_size=32", [-1, 16, 64, 49152, 2147483647, 1024, 8, 32], "", 0, []], [[], [["CHW", 2, "local"], ["SP", 2, 0, 8, [2, 1, 1, 2], 1], ["SP", 2, 5, 34, [1, 2, 17, 1], 1], ["SP", 2, 10, 1024, [1, 32, 2, 16], 1], ["SP", 2, 15, 512, [2, 1], 1], ["RE", 2, [0, 5, 10, 1, 6, 11, 2, 7, 12, 15, 16, 3, 8, 13, 17, 4, 9, 14]], ["FSP", 3, 0, 1, 3], ["FSP", 3, 4, 2, 3], ["FSP", 3, 8, 3, 3], ["RE", 3, [0, 4, 8, 1, 5, 9, 2, 6, 10, 3, 7, 11]], ["CA", 2, 3, 8], ["CHR", 1, "shared", [2]], ["CA", 2, 3, 9], ["CHR", 0, "shared", [3]], ["CA", 1, 4, 9], ["FU", 5, [0, 1, 2]], ["AN", 5, 0, 5], ["FU", 5, [1, 2, 3]], ["AN", 5, 1, 4], ["FU", 5, [2, 3, 4]], ["AN", 5, 2, 6], ["FU", 3, [0, 1, 2]], ["SP", 3, 0, 32, [1], 1], ["AN", 3, 1, 2], ["FFSP", 3, 0, [3, 2, 1], 1, 1], ["AN", 3, 1, 6], ["FU", 1, [0, 1, 2]], ["SP", 1, 0, 68, [1], 1], ["AN", 1, 1, 2], ["FFSP", 1, 0, [3, 2, 1], 1, 1], ["AN", 1, 1, 6], ["PR", 4, 0, "auto_unroll_max_step$16"]]]], "r": [[0.0142094], 0, 2.0259, 1670453358], "v": "v0.6"}
{"i": [["[\"32a5ff201401d5600f77ced9f22defaa\", [8, 34, 512], [8, 1024, 512], [8, 34, 1024]]", "cuda -keys=cuda,gpu -arch=sm_80 -max_num_threads=1024 -thread_warp_size=32", [-1, 16, 64, 49152, 2147483647, 1024, 8, 32], "", 0, []], [[], [["CHW", 2, "local"], ["SP", 2, 0, 8, [1, 1, 1, 2], 1], ["SP", 2, 5, 34, [1, 17, 2, 1], 1], ["SP", 2, 10, 1024, [2, 2, 2, 32], 1], ["SP", 2, 15, 512, [2, 1], 1], ["RE", 2, [0, 5, 10, 1, 6, 11, 2, 7, 12, 15, 16, 3, 8, 13, 17, 4, 9, 14]], ["FSP", 3, 0, 1, 3], ["FSP", 3, 4, 2, 3], ["FSP", 3, 8, 3, 3], ["RE", 3, [0, 4, 8, 1, 5, 9, 2, 6, 10, 3, 7, 11]], ["CA", 2, 3, 8], ["CHR", 1, "shared", [2]], ["CA", 2, 3, 9], ["CHR", 0, "shared", [3]], ["CA", 1, 4, 9], ["FU", 5, [0, 1, 2]], ["AN", 5, 0, 5], ["FU", 5, [1, 2, 3]], ["AN", 5, 1, 4], ["FU", 5, [2, 3, 4]], ["AN", 5, 2, 6], ["FU", 3, [0, 1, 2]], ["SP", 3, 0, 128, [1], 1], ["AN", 3, 1, 2], ["FFSP", 3, 0, [3, 2, 1], 1, 1], ["AN", 3, 1, 6], ["FU", 1, [0, 1, 2]], ["SP", 1, 0, 8, [1], 1], ["AN", 1, 1, 2], ["FFSP", 1, 0, [3, 2, 1], 1, 1], ["AN", 1, 1, 6], ["PR", 4, 0, "auto_unroll_max_step$512"]]]], "r": [[0.0154217], 0, 3.44193, 1670453359], "v": "v0.6"}
{"i": [["[\"32a5ff201401d5600f77ced9f22defaa\", [8, 34, 512], [8, 1024, 512], [8, 34, 1024]]", "cuda -keys=cuda,gpu -arch=sm_80 -max_num_threads=1024 -thread_warp_size=32", [-1, 16, 64, 49152, 2147483647, 1024, 8, 32], "", 0, []], [[], [["CHW", 2, "local"], ["SP", 2, 0, 8, [2, 1, 2, 1], 1], ["SP", 2, 5, 34, [1, 34, 1, 1], 1], ["SP", 2, 10, 1024, [1, 4, 4, 32], 1], ["SP", 2, 15, 512, [1, 1], 1], ["RE", 2, [0, 5, 10, 1, 6, 11, 2, 7, 12, 15, 16, 3, 8, 13, 17, 4, 9, 14]], ["FSP", 3, 0, 1, 3], ["FSP", 3, 4, 2, 3], ["FSP", 3, 8, 3, 3], ["RE", 3, [0, 4, 8, 1, 5, 9, 2, 6, 10, 3, 7, 11]], ["CA", 2, 3, 8], ["CHR", 1, "shared", [2]], ["CA", 2, 3, 9], ["CHR", 0, "shared", [3]], ["CA", 1, 4, 9], ["FU", 5, [0, 1, 2]], ["AN", 5, 0, 5], ["FU", 5, [1, 2, 3]], ["AN", 5, 1, 4], ["FU", 5, [2, 3, 4]], ["AN", 5, 2, 6], ["FU", 3, [0, 1, 2]], ["SP", 3, 0, 128, [1], 1], ["AN", 3, 1, 2], ["FFSP", 3, 0, [3, 2, 1], 1, 1], ["AN", 3, 1, 6], ["FU", 1, [0, 1, 2]], ["SP", 1, 0, 2, [1], 1], ["AN", 1, 1, 2], ["FFSP", 1, 0, [3, 2, 1], 1, 1], ["AN", 1, 1, 6], ["PR", 4, 0, "auto_unroll_max_step$0"]]]], "r": [[0.00751394], 0, 2.48143, 1670453360], "v": "v0.6"}
{"i": [["[\"32a5ff201401d5600f77ced9f22defaa\", [8, 34, 512], [8, 1024, 512], [8, 34, 1024]]", "cuda -keys=cuda,gpu -arch=sm_80 -max_num_threads=1024 -thread_warp_size=32", [-1, 16, 64, 49152, 2147483647, 1024, 8, 32], "", 0, []], [[], [["CHW", 2, "local"], ["SP", 2, 0, 8, [1, 2, 1, 4], 1], ["SP", 2, 5, 34, [1, 17, 1, 1], 1], ["SP", 2, 10, 1024, [2, 1, 8, 32], 1], ["SP", 2, 15, 512, [2, 1], 1], ["RE", 2, [0, 5, 10, 1, 6, 11, 2, 7, 12, 15, 16, 3, 8, 13, 17, 4, 9, 14]], ["FSP", 3, 0, 1, 3], ["FSP", 3, 4, 2, 3], ["FSP", 3, 8, 3, 3], ["RE", 3, [0, 4, 8, 1, 5, 9, 2, 6, 10, 3, 7, 11]], ["CA", 2, 3, 8], ["CHR", 1, "shared", [2]], ["CA", 2, 3, 9], ["CHR", 0, "shared", [3]], ["CA", 1, 4, 9], ["FU", 5, [0, 1, 2]], ["AN", 5, 0, 5], ["FU", 5, [1, 2, 3]], ["AN", 5, 1, 4], ["FU", 5, [2, 3, 4]], ["AN", 5, 2, 6], ["FU", 3, [0, 1, 2]], ["SP", 3, 0, 512, [1], 1], ["AN", 3, 1, 2], ["FFSP", 3, 0, [3, 2, 1], 1, 1], ["AN", 3, 1, 6], ["FU", 1, [0, 1, 2]], ["SP", 1, 0, 4, [2], 1], ["AN", 1, 1, 2], ["FFSP", 1, 0, [3, 2, 1], 1, 1], ["AN", 1, 1, 6], ["PR", 4, 0, "auto_unroll_max_step$64"]]]], "r": [[0.0160564], 0, 3.15982, 1670453361], "v": "v0.6"}
{"i": [["[\"32a5ff201401d5600f77ced9f22defaa\", [8, 34, 512], [8, 1024, 512], [8, 34, 1024]]", "cuda -keys=cuda,gpu -arch=sm_80 -max_num_threads=1024 -thread_warp_size=32", [-1, 16, 64, 49152, 2147483647, 1024, 8, 32], "", 0, []], [[], [["CHW", 2, "local"], ["SP", 2, 0, 8, [1, 1, 1, 8], 1], ["SP", 2, 5, 34, [1, 1, 17, 2], 1], ["SP", 2, 10, 1024, [1, 4, 16, 4], 1], ["SP", 2, 15, 512, [1, 2], 1], ["RE", 2, [0, 5, 10, 1, 6, 11, 2, 7, 12, 15, 16, 3, 8, 13, 17, 4, 9, 14]], ["FSP", 3, 0, 1, 3], ["FSP", 3, 4, 2, 3], ["FSP", 3, 8, 3, 3], ["RE", 3, [0, 4, 8, 1, 5, 9, 2, 6, 10, 3, 7, 11]], ["CA", 2, 3, 8], ["CHR", 1, "shared", [2]], ["CA", 2, 3, 9], ["CHR", 0, "shared", [3]], ["CA", 1, 4, 9], ["FU", 5, [0, 1, 2]], ["AN", 5, 0, 5], ["FU", 5, [1, 2, 3]], ["AN", 5, 1, 4], ["FU", 5, [2, 3, 4]], ["AN", 5, 2, 6], ["FU", 3, [0, 1, 2]], ["SP", 3, 0, 128, [1], 1], ["AN", 3, 1, 2], ["FFSP", 3, 0, [3, 2, 1], 1, 1], ["AN", 3, 1, 6], ["FU", 1, [0, 1, 2]], ["SP", 1, 0, 68, [4], 1], ["AN", 1, 1, 2], ["FFSP", 1, 0, [3, 2, 1], 1, 1], ["AN", 1, 1, 6], ["PR", 4, 0, "auto_unroll_max_step$16"]]]], "r": [[0.0456186], 0, 2.03807, 1670453362], "v": "v0.6"}
{"i": [["[\"32a5ff201401d5600f77ced9f22defaa\", [8, 34, 512], [8, 1024, 512], [8, 34, 1024]]", "cuda -keys=cuda,gpu -arch=sm_80 -max_num_threads=1024 -thread_warp_size=32", [-1, 16, 64, 49152, 2147483647, 1024, 8, 32], "", 0, []], [[], [["CHW", 2, "local"], ["SP", 2, 0, 8, [1, 2, 2, 2], 1], ["SP", 2, 5, 34, [1, 2, 1, 17], 1], ["SP", 2, 10, 1024, [4, 32, 2, 2], 1], ["SP", 2, 15, 512, [1, 2], 1], ["RE", 2, [0, 5, 10, 1, 6, 11, 2, 7, 12, 15, 16, 3, 8, 13, 17, 4, 9, 14]], ["FSP", 3, 0, 1, 3], ["FSP", 3, 4, 2, 3], ["FSP", 3, 8, 3, 3], ["RE", 3, [0, 4, 8, 1, 5, 9, 2, 6, 10, 3, 7, 11]], ["CA", 2, 3, 8], ["CHR", 1, "shared", [2]], ["CA", 2, 3, 9], ["CHR", 0, "shared", [3]], ["CA", 1, 4, 9], ["FU", 5, [0, 1, 2]], ["AN", 5, 0, 5], ["FU", 5, [1, 2, 3]], ["AN", 5, 1, 4], ["FU", 5, [2, 3, 4]], ["AN", 5, 2, 6], ["FU", 3, [0, 1, 2]], ["SP", 3, 0, 32, [1], 1], ["AN", 3, 1, 2], ["FFSP", 3, 0, [3, 2, 1], 1, 1], ["AN", 3, 1, 6], ["FU", 1, [0, 1, 2]], ["SP", 1, 0, 8, [1], 1], ["AN", 1, 1, 2], ["FFSP", 1, 0, [3, 2, 1], 1, 1], ["AN", 1, 1, 6], ["PR", 4, 0, "auto_unroll_max_step$0"]]]], "r": [[0.00645085], 0, 3.36827, 1670453363], "v": "v0.6"}
{"i": [["[\"32a5ff201401d5600f77ced9f22defaa\", [8, 34, 512], [8, 1024, 512], [8, 34, 1024]]", "cuda -keys=cuda,gpu -arch=sm_80 -max_num_threads=1024 -thread_warp_size=32", [-1, 16, 64, 49152, 2147483647, 1024, 8, 32], "", 0, []], [[], [["CHW", 2, "local"], ["SP", 2, 0, 8, [2, 2, 1, 2], 1], ["SP", 2, 5, 34, [1, 17, 1, 2], 1], ["SP", 2, 10, 1024, [2, 1, 8, 32], 1], ["SP", 2, 15, 512, [2, 1], 1], ["RE", 2, [0, 5, 10, 1, 6, 11, 2, 7, 12, 15, 16, 3, 8, 13, 17, 4, 9, 14]], ["FSP", 3, 0, 1, 3], ["FSP", 3, 4, 2, 3], ["FSP", 3, 8, 3, 3], ["RE", 3, [0, 4, 8, 1, 5, 9, 2, 6, 10, 3, 7, 11]], ["CA", 2, 3, 8], ["CHR", 1, "shared", [2]], ["CA", 2, 3, 9], ["CHR", 0, "shared", [3]], ["CA", 1, 4, 9], ["FU", 5, [0, 1, 2]], ["AN", 5, 0, 5], ["FU", 5, [1, 2, 3]], ["AN", 5, 1, 4], ["FU", 5, [2, 3, 4]], ["AN", 5, 2, 6], ["FU", 3, [0, 1, 2]], ["SP", 3, 0, 512, [4], 1], ["AN", 3, 1, 2], ["FFSP", 3, 0, [3, 2, 1], 1, 1], ["AN", 3, 1, 6], ["FU", 1, [0, 1, 2]], ["SP", 1, 0, 4, [1], 1], ["AN", 1, 1, 2], ["FFSP", 1, 0, [3, 2, 1], 1, 1], ["AN", 1, 1, 6], ["PR", 4, 0, "auto_unroll_max_step$0"]]]], "r": [[0.0223462], 0, 2.66852, 1670453364], "v": "v0.6"}
{"i": [["[\"32a5ff201401d5600f77ced9f22defaa\", [8, 34, 512], [8, 1024, 512], [8, 34, 1024]]", "cuda -keys=cuda,gpu -arch=sm_80 -max_num_threads=1024 -thread_warp_size=32", [-1, 16, 64, 49152, 2147483647, 1024, 8, 32], "", 0, []], [[], [["CHW", 2, "local"], ["SP", 2, 0, 8, [2, 1, 1, 1], 1], ["SP", 2, 5, 34, [1, 1, 1, 17], 1], ["SP", 2, 10, 1024, [4, 16, 2, 2], 1], ["SP", 2, 15, 512, [2, 1], 1], ["RE", 2, [0, 5, 10, 1, 6, 11, 2, 7, 12, 15, 16, 3, 8, 13, 17, 4, 9, 14]], ["FSP", 3, 0, 1, 3], ["FSP", 3, 4, 2, 3], ["FSP", 3, 8, 3, 3], ["RE", 3, [0, 4, 8, 1, 5, 9, 2, 6, 10, 3, 7, 11]], ["CA", 2, 3, 8], ["CHR", 1, "shared", [2]], ["CA", 2, 3, 9], ["CHR", 0, "shared", [3]], ["CA", 1, 4, 9], ["FU", 5, [0, 1, 2]], ["AN", 5, 0, 5], ["FU", 5, [1, 2, 3]], ["AN", 5, 1, 4], ["FU", 5, [2, 3, 4]], ["AN", 5, 2, 6], ["FU", 3, [0, 1, 2]], ["SP", 3, 0, 8, [1], 1], ["AN", 3, 1, 2], ["FFSP", 3, 0, [3, 2, 1], 1, 1], ["AN", 3, 1, 6], ["FU", 1, [0, 1, 2]], ["SP", 1, 0, 34, [1], 1], ["AN", 1, 1, 2], ["FFSP", 1, 0, [3, 2, 1], 1, 1], ["AN", 1, 1, 6], ["PR", 4, 0, "auto_unroll_max_step$16"]]]], "r": [[0.00410889], 0, 2.40974, 1670453365], "v": "v0.6"}
{"i": [["[\"32a5ff201401d5600f77ced9f22defaa\", [8, 34, 512], [8, 1024, 512], [8, 34, 1024]]", "cuda -keys=cuda,gpu -arch=sm_80 -max_num_threads=1024 -thread_warp_size=32", [-1, 16, 64, 49152, 2147483647, 1024, 8, 32], "", 0, []], [[], [["CHW", 2, "local"], ["SP", 2, 0, 8, [1, 4, 2, 1], 1], ["SP", 2, 5, 34, [1, 34, 1, 1], 1], ["SP", 2, 10, 1024, [2, 1, 8, 32], 1], ["SP", 2, 15, 512, [2, 1], 1], ["RE", 2, [0, 5, 10, 1, 6, 11, 2, 7, 12, 15, 16, 3, 8, 13, 17, 4, 9, 14]], ["FSP", 3, 0, 1, 3], ["FSP", 3, 4, 2, 3], ["FSP", 3, 8, 3, 3], ["RE", 3, [0, 4, 8, 1, 5, 9, 2, 6, 10, 3, 7, 11]], ["CA", 2, 3, 8], ["CHR", 1, "shared", [2]], ["CA", 2, 3, 9], ["CHR", 0, "shared", [3]], ["CA", 1, 4, 9], ["FU", 5, [0, 1, 2]], ["AN", 5, 0, 5], ["FU", 5, [1, 2, 3]], ["AN", 5, 1, 4], ["FU", 5, [2, 3, 4]], ["AN", 5, 2, 6], ["FU", 3, [0, 1, 2]], ["SP", 3, 0, 512, [1], 1], ["AN", 3, 1, 2], ["FFSP", 3, 0, [3, 2, 1], 1, 1], ["AN", 3, 1, 6], ["FU", 1, [0, 1, 2]], ["SP", 1, 0, 4, [1], 1], ["AN", 1, 1, 2], ["FFSP", 1, 0, [3, 2, 1], 1, 1], ["AN", 1, 1, 6], ["PR", 4, 0, "auto_unroll_max_step$64"]]]], "r": [[0.0115685], 0, 2.78572, 1670453366], "v": "v0.6"}
{"i": [["[\"32a5ff201401d5600f77ced9f22defaa\", [8, 34, 512], [8, 1024, 512], [8, 34, 1024]]", "cuda -keys=cuda,gpu -arch=sm_80 -max_num_threads=1024 -thread_warp_size=32", [-1, 16, 64, 49152, 2147483647, 1024, 8, 32], "", 0, []], [[], [["CHW", 2, "local"], ["SP", 2, 0, 8, [2, 1, 4, 1], 1], ["SP", 2, 5, 34, [1, 17, 1, 2], 1], ["SP", 2, 10, 1024, [2, 4, 32, 1], 1], ["SP", 2, 15, 512, [4, 1], 1], ["RE", 2, [0, 5, 10, 1, 6, 11, 2, 7, 12, 15, 16, 3, 8, 13, 17, 4, 9, 14]], ["FSP", 3, 0, 1, 3], ["FSP", 3, 4, 2, 3], ["FSP", 3, 8, 3, 3], ["RE", 3, [0, 4, 8, 1, 5, 9, 2, 6, 10, 3, 7, 11]], ["CA", 2, 3, 8], ["CHR", 1, "shared", [2]], ["CA", 2, 3, 9], ["CHR", 0, "shared", [3]], ["CA", 1, 4, 9], ["FU", 5, [0, 1, 2]], ["AN", 5, 0, 5], ["FU", 5, [1, 2, 3]], ["AN", 5, 1, 4], ["FU", 5, [2, 3, 4]], ["AN", 5, 2, 6], ["FU", 3, [0, 1, 2]], ["SP", 3, 0, 512, [64], 1], ["AN", 3, 1, 2], ["FFSP", 3, 0, [3, 2, 1], 1, 1], ["AN", 3, 1, 6], ["FU", 1, [0, 1, 2]], ["SP", 1, 0, 32, [1], 1], ["AN", 1, 1, 2], ["FFSP", 1, 0, [3, 2, 1], 1, 1], ["AN", 1, 1, 6], ["PR", 4, 0, "auto_unroll_max_step$512"]]]], "r": [[0.00708873], 0, 5.9218, 1670453367], "v": "v0.6"}
{"i": [["[\"32a5ff201401d5600f77ced9f22defaa\", [8, 34, 512], [8, 1024, 512], [8, 34, 1024]]", "cuda -keys=cuda,gpu -arch=sm_80 -max_num_threads=1024 -thread_warp_size=32", [-1, 16, 64, 49152, 2147483647, 1024, 8, 32], "", 0, []], [[], [["CHW", 2, "local"], ["SP", 2, 0, 8, [1, 4, 1, 1], 1], ["SP", 2, 5, 34, [2, 17, 1, 1], 1], ["SP", 2, 10, 1024, [1, 1, 8, 1], 1], ["SP", 2, 15, 512, [4, 16], 1], ["RE", 2, [0, 5, 10, 1, 6, 11, 2, 7, 12, 15, 16, 3, 8, 13, 17, 4, 9, 14]], ["FSP", 3, 0, 1, 3], ["FSP", 3, 4, 2, 3], ["FSP", 3, 8, 3, 3], ["RE", 3, [0, 4, 8, 1, 5, 9, 2, 6, 10, 3, 7, 11]], ["CA", 2, 3, 8], ["CHR", 1, "shared", [2]], ["CA", 2, 3, 9], ["CHR", 0, "shared", [3]], ["CA", 1, 4, 9], ["FU", 5, [0, 1, 2]], ["AN", 5, 0, 5], ["FU", 5, [1, 2, 3]], ["AN", 5, 1, 4], ["FU", 5, [2, 3, 4]], ["AN", 5, 2, 6], ["FU", 3, [0, 1, 2]], ["SP", 3, 0, 128, [4], 1], ["AN", 3, 1, 2], ["FFSP", 3, 0, [3, 2, 1], 1, 1], ["AN", 3, 1, 6], ["FU", 1, [0, 1, 2]], ["SP", 1, 0, 128, [1], 1], ["AN", 1, 1, 2], ["FFSP", 1, 0, [3, 2, 1], 1, 1], ["AN", 1, 1, 6], ["PR", 4, 0, "auto_unroll_max_step$0"]]]], "r": [[0.00012651], 0, 2.66602, 1670453369], "v": "v0.6"}
{"i": [["[\"32a5ff201401d5600f77ced9f22defaa\", [8, 34, 512], [8, 1024, 512], [8, 34, 1024]]", "cuda -keys=cuda,gpu -arch=sm_80 -max_num_threads=1024 -thread_warp_size=32", [-1, 16, 64, 49152, 2147483647, 1024, 8, 32], "", 0, []], [[], [["CHW", 2, "local"], ["SP", 2, 0, 8, [2, 1, 1, 4], 1], ["SP", 2, 5, 34, [1, 17, 1, 2], 1], ["SP", 2, 10, 1024, [2, 4, 32, 1], 1], ["SP", 2, 15, 512, [4, 1], 1], ["RE", 2, [0, 5, 10, 1, 6, 11, 2, 7, 12, 15, 16, 3, 8, 13, 17, 4, 9, 14]], ["FSP", 3, 0, 1, 3], ["FSP", 3, 4, 2, 3], ["FSP", 3, 8, 3, 3], ["RE", 3, [0, 4, 8, 1, 5, 9, 2, 6, 10, 3, 7, 11]], ["CA", 2, 3, 8], ["CHR", 1, "shared", [2]], ["CA", 2, 3, 9], ["CHR", 0, "shared", [3]], ["CA", 1, 4, 9], ["FU", 5, [0, 1, 2]], ["AN", 5, 0, 5], ["FU", 5, [1, 2, 3]], ["AN", 5, 1, 4], ["FU", 5, [2, 3, 4]], ["AN", 5, 2, 6], ["FU", 3, [0, 1, 2]], ["SP", 3, 0, 512, [1], 1], ["AN", 3, 1, 2], ["FFSP", 3, 0, [3, 2, 1], 1, 1], ["AN", 3, 1, 6], ["FU", 1, [0, 1, 2]], ["SP", 1, 0, 32, [4], 1], ["AN", 1, 1, 2], ["FFSP", 1, 0, [3, 2, 1], 1, 1], ["AN", 1, 1, 6], ["PR", 4, 0, "auto_unroll_max_step$512"]]]], "r": [[0.00957273], 0, 2.43092, 1670453370], "v": "v0.6"}
{"i": [["[\"32a5ff201401d5600f77ced9f22defaa\", [8, 34, 512], [8, 1024, 512], [8, 34, 1024]]", "cuda -keys=cuda,gpu -arch=sm_80 -max_num_threads=1024 -thread_warp_size=32", [-1, 16, 64, 49152, 2147483647, 1024, 8, 32], "", 0, []], [[], [["CHW", 2, "local"], ["SP", 2, 0, 8, [1, 2, 1, 1], 1], ["SP", 2, 5, 34, [1, 17, 2, 1], 1], ["SP", 2, 10, 1024, [1, 2, 32, 1], 1], ["SP", 2, 15, 512, [1, 1], 1], ["RE", 2, [0, 5, 10, 1, 6, 11, 2, 7, 12, 15, 16, 3, 8, 13, 17, 4, 9, 14]], ["FSP", 3, 0, 1, 3], ["FSP", 3, 4, 2, 3], ["FSP", 3, 8, 3, 3], ["RE", 3, [0, 4, 8, 1, 5, 9, 2, 6, 10, 3, 7, 11]], ["CA", 2, 3, 8], ["CHR", 1, "shared", [2]], ["CA", 2, 3, 9], ["CHR", 0, "shared", [3]], ["CA", 1, 4, 9], ["FU", 5, [0, 1, 2]], ["AN", 5, 0, 5], ["FU", 5, [1, 2, 3]], ["AN", 5, 1, 4], ["FU", 5, [2, 3, 4]], ["AN", 5, 2, 6], ["FU", 3, [0, 1, 2]], ["SP", 3, 0, 64, [1], 1], ["AN", 3, 1, 2], ["FFSP", 3, 0, [3, 2, 1], 1, 1], ["AN", 3, 1, 6], ["FU", 1, [0, 1, 2]], ["SP", 1, 0, 4, [1], 1], ["AN", 1, 1, 2], ["FFSP", 1, 0, [3, 2, 1], 1, 1], ["AN", 1, 1, 6], ["PR", 4, 0, "auto_unroll_max_step$64"]]]], "r": [[0.000209809], 0, 1.75893, 1670453371], "v": "v0.6"}
{"i": [["[\"32a5ff201401d5600f77ced9f22defaa\", [8, 34, 512], [8, 1024, 512], [8, 34, 1024]]", "cuda -keys=cuda,gpu -arch=sm_80 -max_num_threads=1024 -thread_warp_size=32", [-1, 16, 64, 49152, 2147483647, 1024, 8, 32], "", 0, []], [[], [["CHW", 2, "local"], ["SP", 2, 0, 8, [1, 1, 1, 1], 1], ["SP", 2, 5, 34, [1, 2, 1, 17], 1], ["SP", 2, 10, 1024, [8, 16, 1, 2], 1], ["SP", 2, 15, 512, [16, 1], 1], ["RE", 2, [0, 5, 10, 1, 6, 11, 2, 7, 12, 15, 16, 3, 8, 13, 17, 4, 9, 14]], ["FSP", 3, 0, 1, 3], ["FSP", 3, 4, 2, 3], ["FSP", 3, 8, 3, 3], ["RE", 3, [0, 4, 8, 1, 5, 9, 2, 6, 10, 3, 7, 11]], ["CA", 2, 3, 8], ["CHR", 1, "shared", [2]], ["CA", 2, 3, 9], ["CHR", 0, "shared", [3]], ["CA", 1, 4, 9], ["FU", 5, [0, 1, 2]], ["AN", 5, 0, 5], ["FU", 5, [1, 2, 3]], ["AN", 5, 1, 4], ["FU", 5, [2, 3, 4]], ["AN", 5, 2, 6], ["FU", 3, [0, 1, 2]], ["SP", 3, 0, 128, [1], 1], ["AN", 3, 1, 2], ["FFSP", 3, 0, [3, 2, 1], 1, 1], ["AN", 3, 1, 6], ["FU", 1, [0, 1, 2]], ["SP", 1, 0, 1088, [1], 1], ["AN", 1, 1, 2], ["FFSP", 1, 0, [3, 2, 1], 1, 1], ["AN", 1, 1, 6], ["PR", 4, 0, "auto_unroll_max_step$0"]]]], "r": [[0.000827821], 0, 1.49918, 1670453372], "v": "v0.6"}
{"i": [["[\"32a5ff201401d5600f77ced9f22defaa\", [8, 34, 512], [8, 1024, 512], [8, 34, 1024]]", "cuda -keys=cuda,gpu -arch=sm_80 -max_num_threads=1024 -thread_warp_size=32", [-1, 16, 64, 49152, 2147483647, 1024, 8, 32], "", 0, []], [[], [["CHW", 2, "local"], ["SP", 2, 0, 8, [1, 2, 4, 1], 1], ["SP", 2, 5, 34, [1, 1, 34, 1], 1], ["SP", 2, 10, 1024, [8, 2, 4, 16], 1], ["SP", 2, 15, 512, [1, 1], 1], ["RE", 2, [0, 5, 10, 1, 6, 11, 2, 7, 12, 15, 16, 3, 8, 13, 17, 4, 9, 14]], ["FSP", 3, 0, 1, 3], ["FSP", 3, 4, 2, 3], ["FSP", 3, 8, 3, 3], ["RE", 3, [0, 4, 8, 1, 5, 9, 2, 6, 10, 3, 7, 11]], ["CA", 2, 3, 8], ["CHR", 1, "shared", [2]], ["CA", 2, 3, 9], ["CHR", 0, "shared", [3]], ["CA", 1, 4, 9], ["FU", 5, [0, 1, 2]], ["AN", 5, 0, 5], ["FU", 5, [1, 2, 3]], ["AN", 5, 1, 4], ["FU", 5, [2, 3, 4]], ["AN", 5, 2, 6], ["FU", 3, [0, 1, 2]], ["SP", 3, 0, 256, [1], 1], ["AN", 3, 1, 2], ["FFSP", 3, 0, [3, 2, 1], 1, 1], ["AN", 3, 1, 6], ["FU", 1, [0, 1, 2]], ["SP", 1, 0, 4, [1], 1], ["AN", 1, 1, 2], ["FFSP", 1, 0, [3, 2, 1], 1, 1], ["AN", 1, 1, 6], ["PR", 4, 0, "auto_unroll_max_step$64"]]]], "r": [[0.245155], 0, 3.29044, 1670453374], "v": "v0.6"}
{"i": [["[\"32a5ff201401d5600f77ced9f22defaa\", [8, 34, 512], [8, 1024, 512], [8, 34, 1024]]", "cuda -keys=cuda,gpu -arch=sm_80 -max_num_threads=1024 -thread_warp_size=32", [-1, 16, 64, 49152, 2147483647, 1024, 8, 32], "", 0, []], [[], [["CHW", 2, "local"], ["SP", 2, 0, 8, [2, 1, 4, 1], 1], ["SP", 2, 5, 34, [1, 2, 1, 17], 1], ["SP", 2, 10, 1024, [2, 16, 1, 4], 1], ["SP", 2, 15, 512, [2, 2], 1], ["RE", 2, [0, 5, 10, 1, 6, 11, 2, 7, 12, 15, 16, 3, 8, 13, 17, 4, 9, 14]], ["FSP", 3, 0, 1, 3], ["FSP", 3, 4, 2, 3], ["FSP", 3, 8, 3, 3], ["RE", 3, [0, 4, 8, 1, 5, 9, 2, 6, 10, 3, 7, 11]], ["CA", 2, 3, 8], ["CHR", 1, "shared", [2]], ["CA", 2, 3, 9], ["CHR", 0, "shared", [3]], ["CA", 1, 4, 9], ["FU", 5, [0, 1, 2]], ["AN", 5, 0, 5], ["FU", 5, [1, 2, 3]], ["AN", 5, 1, 4], ["FU", 5, [2, 3, 4]], ["AN", 5, 2, 6], ["FU", 3, [0, 1, 2]], ["SP", 3, 0, 16, [4], 1], ["AN", 3, 1, 2], ["FFSP", 3, 0, [3, 2, 1], 1, 1], ["AN", 3, 1, 6], ["FU", 1, [0, 1, 2]], ["SP", 1, 0, 272, [4], 1], ["AN", 1, 1, 2], ["FFSP", 1, 0, [3, 2, 1], 1, 1], ["AN", 1, 1, 6], ["PR", 4, 0, "auto_unroll_max_step$64"]]]], "r": [[0.00210985], 0, 3.26049, 1670453376], "v": "v0.6"}
{"i": [["[\"32a5ff201401d5600f77ced9f22defaa\", [8, 34, 512], [8, 1024, 512], [8, 34, 1024]]", "cuda -keys=cuda,gpu -arch=sm_80 -max_num_threads=1024 -thread_warp_size=32", [-1, 16, 64, 49152, 2147483647, 1024, 8, 32], "", 0, []], [[], [["CHW", 2, "local"], ["SP", 2, 0, 8, [1, 1, 1, 1], 1], ["SP", 2, 5, 34, [1, 17, 2, 1], 1], ["SP", 2, 10, 1024, [4, 1, 1, 1], 1], ["SP", 2, 15, 512, [16, 4], 1], ["RE", 2, [0, 5, 10, 1, 6, 11, 2, 7, 12, 15, 16, 3, 8, 13, 17, 4, 9, 14]], ["FSP", 3, 0, 1, 3], ["FSP", 3, 4, 2, 3], ["FSP", 3, 8, 3, 3], ["RE", 3, [0, 4, 8, 1, 5, 9, 2, 6, 10, 3, 7, 11]], ["CA", 2, 3, 8], ["CHR", 1, "shared", [2]], ["CA", 2, 3, 9], ["CHR", 0, "shared", [3]], ["CA", 1, 4, 9], ["FU", 5, [0, 1, 2]], ["AN", 5, 0, 5], ["FU", 5, [1, 2, 3]], ["AN", 5, 1, 4], ["FU", 5, [2, 3, 4]], ["AN", 5, 2, 6], ["FU", 3, [0, 1, 2]], ["SP", 3, 0, 128, [1], 1], ["AN", 3, 1, 2], ["FFSP", 3, 0, [3, 2, 1], 1, 1], ["AN", 3, 1, 6], ["FU", 1, [0, 1, 2]], ["SP", 1, 0, 128, [1], 1], ["AN", 1, 1, 2], ["FFSP", 1, 0, [3, 2, 1], 1, 1], ["AN", 1, 1, 6], ["PR", 4, 0, "auto_unroll_max_step$64"]]]], "r": [[0.000151027], 0, 1.35303, 1670453377], "v": "v0.6"}
{"i": [["[\"32a5ff201401d5600f77ced9f22defaa\", [8, 34, 512], [8, 1024, 512], [8, 34, 1024]]", "cuda -keys=cuda,gpu -arch=sm_80 -max_num_threads=1024 -thread_warp_size=32", [-1, 16, 64, 49152, 2147483647, 1024, 8, 32], "", 0, []], [[], [["CHW", 2, "local"], ["SP", 2, 0, 8, [4, 2, 1, 1], 1], ["SP", 2, 5, 34, [1, 1, 1, 17], 1], ["SP", 2, 10, 1024, [1, 16, 2, 2], 1], ["SP", 2, 15, 512, [1, 8], 1], ["RE", 2, [0, 5, 10, 1, 6, 11, 2, 7, 12, 15, 16, 3, 8, 13, 17, 4, 9, 14]], ["FSP", 3, 0, 1, 3], ["FSP", 3, 4, 2, 3], ["FSP", 3, 8, 3, 3], ["RE", 3, [0, 4, 8, 1, 5, 9, 2, 6, 10, 3, 7, 11]], ["CA", 2, 3, 8], ["CHR", 1, "shared", [2]], ["CA", 2, 3, 9], ["CHR", 0, "shared", [3]], ["CA", 1, 4, 9], ["FU", 5, [0, 1, 2]], ["AN", 5, 0, 5], ["FU", 5, [1, 2, 3]], ["AN", 5, 1, 4], ["FU", 5, [2, 3, 4]], ["AN", 5, 2, 6], ["FU", 3, [0, 1, 2]], ["SP", 3, 0, 4, [1], 1], ["AN", 3, 1, 2], ["FFSP", 3, 0, [3, 2, 1], 1, 1], ["AN", 3, 1, 6], ["FU", 1, [0, 1, 2]], ["SP", 1, 0, 17, [1], 1], ["AN", 1, 1, 2], ["FFSP", 1, 0, [3, 2, 1], 1, 1], ["AN", 1, 1, 6], ["PR", 4, 0, "auto_unroll_max_step$16"]]]], "r": [[0.00217631], 0, 2.04308, 1670453378], "v": "v0.6"}
{"i": [["[\"32a5ff201401d5600f77ced9f22defaa\", [8, 34, 512], [8, 1024, 512], [8, 34, 1024]]", "cuda -keys=cuda,gpu -arch=sm_80 -max_num_threads=1024 -thread_warp_size=32", [-1, 16, 64, 49152, 2147483647, 1024, 8, 32], "", 0, []], [[], [["CHW", 2, "local"], ["SP", 2, 0, 8, [2, 1, 1, 1], 1], ["SP", 2, 5, 34, [1, 1, 34, 1], 1], ["SP", 2, 10, 1024, [2, 32, 16, 1], 1], ["SP", 2, 15, 512, [1, 2], 1], ["RE", 2, [0, 5, 10, 1, 6, 11, 2, 7, 12, 15, 16, 3, 8, 13, 17, 4, 9, 14]], ["FSP", 3, 0, 1, 3], ["FSP", 3, 4, 2, 3], ["FSP", 3, 8, 3, 3], ["RE", 3, [0, 4, 8, 1, 5, 9, 2, 6, 10, 3, 7, 11]], ["CA", 2, 3, 8], ["CHR", 1, "shared", [2]], ["CA", 2, 3, 9], ["CHR", 0, "shared", [3]], ["CA", 1, 4, 9], ["FU", 5, [0, 1, 2]], ["AN", 5, 0, 5], ["FU", 5, [1, 2, 3]], ["AN", 5, 1, 4], ["FU", 5, [2, 3, 4]], ["AN", 5, 2, 6], ["FU", 3, [0, 1, 2]], ["SP", 3, 0, 32, [1], 1], ["AN", 3, 1, 2], ["FFSP", 3, 0, [3, 2, 1], 1, 1], ["AN", 3, 1, 6], ["FU", 1, [0, 1, 2]], ["SP", 1, 0, 68, [1], 1], ["AN", 1, 1, 2], ["FFSP", 1, 0, [3, 2, 1], 1, 1], ["AN", 1, 1, 6], ["PR", 4, 0, "auto_unroll_max_step$1024"]]]], "r": [[0.00733876], 0, 1.99369, 1670453379], "v": "v0.6"}
{"i": [["[\"32a5ff201401d5600f77ced9f22defaa\", [8, 34, 512], [8, 1024, 512], [8, 34, 1024]]", "cuda -keys=cuda,gpu -arch=sm_80 -max_num_threads=1024 -thread_warp_size=32", [-1, 16, 64, 49152, 2147483647, 1024, 8, 32], "", 0, []], [[], [["CHW", 2, "local"], ["SP", 2, 0, 8, [1, 2, 2, 1], 1], ["SP", 2, 5, 34, [1, 34, 1, 1], 1], ["SP", 2, 10, 1024, [8, 4, 1, 4], 1], ["SP", 2, 15, 512, [16, 1], 1], ["RE", 2, [0, 5, 10, 1, 6, 11, 2, 7, 12, 15, 16, 3, 8, 13, 17, 4, 9, 14]], ["FSP", 3, 0, 1, 3], ["FSP", 3, 4, 2, 3], ["FSP", 3, 8, 3, 3], ["RE", 3, [0, 4, 8, 1, 5, 9, 2, 6, 10, 3, 7, 11]], ["CA", 2, 3, 8], ["CHR", 1, "shared", [2]], ["CA", 2, 3, 9], ["CHR", 0, "shared", [3]], ["CA", 1, 4, 9], ["FU", 5, [0, 1, 2]], ["AN", 5, 0, 5], ["FU", 5, [1, 2, 3]], ["AN", 5, 1, 4], ["FU", 5, [2, 3, 4]], ["AN", 5, 2, 6], ["FU", 3, [0, 1, 2]], ["SP", 3, 0, 128, [1], 1], ["AN", 3, 1, 2], ["FFSP", 3, 0, [3, 2, 1], 1, 1], ["AN", 3, 1, 6], ["FU", 1, [0, 1, 2]], ["SP", 1, 0, 32, [1], 1], ["AN", 1, 1, 2], ["FFSP", 1, 0, [3, 2, 1], 1, 1], ["AN", 1, 1, 6], ["PR", 4, 0, "auto_unroll_max_step$1024"]]]], "r": [[0.0011462], 0, 5.17604, 1670453380], "v": "v0.6"}
{"i": [["[\"32a5ff201401d5600f77ced9f22defaa\", [8, 34, 512], [8, 1024, 512], [8, 34, 1024]]", "cuda -keys=cuda,gpu -arch=sm_80 -max_num_threads=1024 -thread_warp_size=32", [-1, 16, 64, 49152, 2147483647, 1024, 8, 32], "", 0, []], [[], [["CHW", 2, "local"], ["SP", 2, 0, 8, [2, 2, 2, 1], 1], ["SP", 2, 5, 34, [1, 1, 17, 2], 1], ["SP", 2, 10, 1024, [1, 64, 4, 1], 1], ["SP", 2, 15, 512, [1, 4], 1], ["RE", 2, [0, 5, 10, 1, 6, 11, 2, 7, 12, 15, 16, 3, 8, 13, 17, 4, 9, 14]], ["FSP", 3, 0, 1, 3], ["FSP", 3, 4, 2, 3], ["FSP", 3, 8, 3, 3], ["RE", 3, [0, 4, 8, 1, 5, 9, 2, 6, 10, 3, 7, 11]], ["CA", 2, 3, 8], ["CHR", 1, "shared", [2]], ["CA", 2, 3, 9], ["CHR", 0, "shared", [3]], ["CA", 1, 4, 9], ["FU", 5, [0, 1, 2]], ["AN", 5, 0, 5], ["FU", 5, [1, 2, 3]], ["AN", 5, 1, 4], ["FU", 5, [2, 3, 4]], ["AN", 5, 2, 6], ["FU", 3, [0, 1, 2]], ["SP", 3, 0, 32, [1], 1], ["AN", 3, 1, 2], ["FFSP", 3, 0, [3, 2, 1], 1, 1], ["AN", 3, 1, 6], ["FU", 1, [0, 1, 2]], ["SP", 1, 0, 272, [1], 1], ["AN", 1, 1, 2], ["FFSP", 1, 0, [3, 2, 1], 1, 1], ["AN", 1, 1, 6], ["PR", 4, 0, "auto_unroll_max_step$1024"]]]], "r": [[0.00176934], 0, 2.54551, 1670453382], "v": "v0.6"}
{"i": [["[\"32a5ff201401d5600f77ced9f22defaa\", [8, 34, 512], [8, 1024, 512], [8, 34, 1024]]", "cuda -keys=cuda,gpu -arch=sm_80 -max_num_threads=1024 -thread_warp_size=32", [-1, 16, 64, 49152, 2147483647, 1024, 8, 32], "", 0, []], [[], [["CHW", 2, "local"], ["SP", 2, 0, 8, [2, 1, 1, 1], 1], ["SP", 2, 5, 34, [1, 34, 1, 1], 1], ["SP", 2, 10, 1024, [1, 4, 1, 32], 1], ["SP", 2, 15, 512, [2, 2], 1], ["RE", 2, [0, 5, 10, 1, 6, 11, 2, 7, 12, 15, 16, 3, 8, 13, 17, 4, 9, 14]], ["FSP", 3, 0, 1, 3], ["FSP", 3, 4, 2, 3], ["FSP", 3, 8, 3, 3], ["RE", 3, [0, 4, 8, 1, 5, 9, 2, 6, 10, 3, 7, 11]], ["CA", 2, 3, 8], ["CHR", 1, "shared", [2]], ["CA", 2, 3, 9], ["CHR", 0, "shared", [3]], ["CA", 1, 4, 9], ["FU", 5, [0, 1, 2]], ["AN", 5, 0, 5], ["FU", 5, [1, 2, 3]], ["AN", 5, 1, 4], ["FU", 5, [2, 3, 4]], ["AN", 5, 2, 6], ["FU", 3, [0, 1, 2]], ["SP", 3, 0, 128, [1], 1], ["AN", 3, 1, 2], ["FFSP", 3, 0, [3, 2, 1], 1, 1], ["AN", 3, 1, 6], ["FU", 1, [0, 1, 2]], ["SP", 1, 0, 4, [1], 1], ["AN", 1, 1, 2], ["FFSP", 1, 0, [3, 2, 1], 1, 1], ["AN", 1, 1, 6], ["PR", 4, 0, "auto_unroll_max_step$1024"]]]], "r": [[0.000502463], 0, 2.03703, 1670453383], "v": "v0.6"}
{"i": [["[\"32a5ff201401d5600f77ced9f22defaa\", [8, 34, 512], [8, 1024, 512], [8, 34, 1024]]", "cuda -keys=cuda,gpu -arch=sm_80 -max_num_threads=1024 -thread_warp_size=32", [-1, 16, 64, 49152, 2147483647, 1024, 8, 32], "", 0, []], [[], [["CHW", 2, "local"], ["SP", 2, 0, 8, [1, 1, 2, 1], 1], ["SP", 2, 5, 34, [1, 17, 1, 2], 1], ["SP", 2, 10, 1024, [8, 2, 32, 1], 1], ["SP", 2, 15, 512, [1, 2], 1], ["RE", 2, [0, 5, 10, 1, 6, 11, 2, 7, 12, 15, 16, 3, 8, 13, 17, 4, 9, 14]], ["FSP", 3, 0, 1, 3], ["FSP", 3, 4, 2, 3], ["FSP", 3, 8, 3, 3], ["RE", 3, [0, 4, 8, 1, 5, 9, 2, 6, 10, 3, 7, 11]], ["CA", 2, 3, 8], ["CHR", 1, "shared", [2]], ["CA", 2, 3, 9], ["CHR", 0, "shared", [3]], ["CA", 1, 4, 9], ["FU", 5, [0, 1, 2]], ["AN", 5, 0, 5], ["FU", 5, [1, 2, 3]], ["AN", 5, 1, 4], ["FU", 5, [2, 3, 4]], ["AN", 5, 2, 6], ["FU", 3, [0, 1, 2]], ["SP", 3, 0, 128, [1], 1], ["AN", 3, 1, 2], ["FFSP", 3, 0, [3, 2, 1], 1, 1], ["AN", 3, 1, 6], ["FU", 1, [0, 1, 2]], ["SP", 1, 0, 8, [1], 1], ["AN", 1, 1, 2], ["FFSP", 1, 0, [3, 2, 1], 1, 1], ["AN", 1, 1, 6], ["PR", 4, 0, "auto_unroll_max_step$16"]]]], "r": [[0.00728627], 0, 2.2803, 1670453384], "v": "v0.6"}
{"i": [["[\"32a5ff201401d5600f77ced9f22defaa\", [8, 34, 512], [8, 1024, 512], [8, 34, 1024]]", "cuda -keys=cuda,gpu -arch=sm_80 -max_num_threads=1024 -thread_warp_size=32", [-1, 16, 64, 49152, 2147483647, 1024, 8, 32], "", 0, []], [[], [["CHW", 2, "local"], ["SP", 2, 0, 8, [2, 1, 1, 1], 1], ["SP", 2, 5, 34, [1, 1, 1, 17], 1], ["SP", 2, 10, 1024, [4, 16, 2, 2], 1], ["SP", 2, 15, 512, [2, 1], 1], ["RE", 2, [0, 5, 10, 1, 6, 11, 2, 7, 12, 15, 16, 3, 8, 13, 17, 4, 9, 14]], ["FSP", 3, 0, 1, 3], ["FSP", 3, 4, 2, 3], ["FSP", 3, 8, 3, 3], ["RE", 3, [0, 4, 8, 1, 5, 9, 2, 6, 10, 3, 7, 11]], ["CA", 2, 3, 8], ["CHR", 1, "shared", [2]], ["CA", 2, 3, 9], ["CHR", 0, "shared", [3]], ["CA", 1, 4, 9], ["FU", 5, [0, 1, 2]], ["AN", 5, 0, 5], ["FU", 5, [1, 2, 3]], ["AN", 5, 1, 4], ["FU", 5, [2, 3, 4]], ["AN", 5, 2, 6], ["FU", 3, [0, 1, 2]], ["SP", 3, 0, 8, [1], 1], ["AN", 3, 1, 2], ["FFSP", 3, 0, [3, 2, 1], 1, 1], ["AN", 3, 1, 6], ["FU", 1, [0, 1, 2]], ["SP", 1, 0, 34, [1], 1], ["AN", 1, 1, 2], ["FFSP", 1, 0, [3, 2, 1], 1, 1], ["AN", 1, 1, 6], ["PR", 4, 0, "auto_unroll_max_step$64"]]]], "r": [[0.00410765], 0, 3.56611, 1670453403], "v": "v0.6"}
{"i": [["[\"32a5ff201401d5600f77ced9f22defaa\", [8, 34, 512], [8, 1024, 512], [8, 34, 1024]]", "cuda -keys=cuda,gpu -arch=sm_80 -max_num_threads=1024 -thread_warp_size=32", [-1, 16, 64, 49152, 2147483647, 1024, 8, 32], "", 0, []], [[], [["CHW", 2, "local"], ["SP", 2, 0, 8, [1, 2, 1, 1], 1], ["SP", 2, 5, 34, [2, 1, 17, 1], 1], ["SP", 2, 10, 1024, [4, 1, 1, 1], 1], ["SP", 2, 15, 512, [2, 64], 1], ["RE", 2, [0, 5, 10, 1, 6, 11, 2, 7, 12, 15, 16, 3, 8, 13, 17, 4, 9, 14]], ["FSP", 3, 0, 1, 3], ["FSP", 3, 4, 2, 3], ["FSP", 3, 8, 3, 3], ["RE", 3, [0, 4, 8, 1, 5, 9, 2, 6, 10, 3, 7, 11]], ["CA", 2, 3, 8], ["CHR", 1, "shared", [2]], ["CA", 2, 3, 9], ["CHR", 0, "shared", [3]], ["CA", 1, 4, 9], ["FU", 5, [0, 1, 2]], ["AN", 5, 0, 5], ["FU", 5, [1, 2, 3]], ["AN", 5, 1, 4], ["FU", 5, [2, 3, 4]], ["AN", 5, 2, 6], ["FU", 3, [0, 1, 2]], ["SP", 3, 0, 128, [1], 1], ["AN", 3, 1, 2], ["FFSP", 3, 0, [3, 2, 1], 1, 1], ["AN", 3, 1, 6], ["FU", 1, [0, 1, 2]], ["SP", 1, 0, 128, [1], 1], ["AN", 1, 1, 2], ["FFSP", 1, 0, [3, 2, 1], 1, 1], ["AN", 1, 1, 6], ["PR", 4, 0, "auto_unroll_max_step$64"]]]], "r": [[0.00129559], 0, 2.11599, 1670453405], "v": "v0.6"}
{"i": [["[\"32a5ff201401d5600f77ced9f22defaa\", [8, 34, 512], [8, 1024, 512], [8, 34, 1024]]", "cuda -keys=cuda,gpu -arch=sm_80 -max_num_threads=1024 -thread_warp_size=32", [-1, 16, 64, 49152, 2147483647, 1024, 8, 32], "", 0, []], [[], [["CHW", 2, "local"], ["SP", 2, 0, 8, [1, 1, 4, 2], 1], ["SP", 2, 5, 34, [1, 2, 17, 1], 1], ["SP", 2, 10, 1024, [1, 16, 1, 8], 1], ["SP", 2, 15, 512, [2, 2], 1], ["RE", 2, [0, 5, 10, 1, 6, 11, 2, 7, 12, 15, 16, 3, 8, 13, 17, 4, 9, 14]], ["FSP", 3, 0, 1, 3], ["FSP", 3, 4, 2, 3], ["FSP", 3, 8, 3, 3], ["RE", 3, [0, 4, 8, 1, 5, 9, 2, 6, 10, 3, 7, 11]], ["CA", 2, 3, 8], ["CHR", 1, "shared", [2]], ["CA", 2, 3, 9], ["CHR", 0, "shared", [3]], ["CA", 1, 4, 9], ["FU", 5, [0, 1, 2]], ["AN", 5, 0, 5], ["FU", 5, [1, 2, 3]], ["AN", 5, 1, 4], ["FU", 5, [2, 3, 4]], ["AN", 5, 2, 6], ["FU", 3, [0, 1, 2]], ["SP", 3, 0, 256, [4], 1], ["AN", 3, 1, 2], ["FFSP", 3, 0, [3, 2, 1], 1, 1], ["AN", 3, 1, 6], ["FU", 1, [0, 1, 2]], ["SP", 1, 0, 544, [1], 1], ["AN", 1, 1, 2], ["FFSP", 1, 0, [3, 2, 1], 1, 1], ["AN", 1, 1, 6], ["PR", 4, 0, "auto_unroll_max_step$16"]]]], "r": [[0.00506629], 0, 2.58906, 1670453406], "v": "v0.6"}
{"i": [["[\"32a5ff201401d5600f77ced9f22defaa\", [8, 34, 512], [8, 1024, 512], [8, 34, 1024]]", "cuda -keys=cuda,gpu -arch=sm_80 -max_num_threads=1024 -thread_warp_size=32", [-1, 16, 64, 49152, 2147483647, 1024, 8, 32], "", 0, []], [[], [["CHW", 2, "local"], ["SP", 2, 0, 8, [1, 2, 4, 1], 1], ["SP", 2, 5, 34, [1, 34, 1, 1], 1], ["SP", 2, 10, 1024, [1, 1, 1, 64], 1], ["SP", 2, 15, 512, [1, 1], 1], ["RE", 2, [0, 5, 10, 1, 6, 11, 2, 7, 12, 15, 16, 3, 8, 13, 17, 4, 9, 14]], ["FSP", 3, 0, 1, 3], ["FSP", 3, 4, 2, 3], ["FSP", 3, 8, 3, 3], ["RE", 3, [0, 4, 8, 1, 5, 9, 2, 6, 10, 3, 7, 11]], ["CA", 2, 3, 8], ["CHR", 1, "shared", [2]], ["CA", 2, 3, 9], ["CHR", 0, "shared", [3]], ["CA", 1, 4, 9], ["FU", 5, [0, 1, 2]], ["AN", 5, 0, 5], ["FU", 5, [1, 2, 3]], ["AN", 5, 1, 4], ["FU", 5, [2, 3, 4]], ["AN", 5, 2, 6], ["FU", 3, [0, 1, 2]], ["SP", 3, 0, 256, [1], 1], ["AN", 3, 1, 2], ["FFSP", 3, 0, [3, 2, 1], 1, 1], ["AN", 3, 1, 6], ["FU", 1, [0, 1, 2]], ["SP", 1, 0, 4, [1], 1], ["AN", 1, 1, 2], ["FFSP", 1, 0, [3, 2, 1], 1, 1], ["AN", 1, 1, 6], ["PR", 4, 0, "auto_unroll_max_step$0"]]]], "r": [[0.00173581], 0, 2.16091, 1670453407], "v": "v0.6"}
{"i": [["[\"32a5ff201401d5600f77ced9f22defaa\", [8, 34, 512], [8, 1024, 512], [8, 34, 1024]]", "cuda -keys=cuda,gpu -arch=sm_80 -max_num_threads=1024 -thread_warp_size=32", [-1, 16, 64, 49152, 2147483647, 1024, 8, 32], "", 0, []], [[], [["CHW", 2, "local"], ["SP", 2, 0, 8, [1, 4, 1, 2], 1], ["SP", 2, 5, 34, [1, 2, 1, 17], 1], ["SP", 2, 10, 1024, [1, 1, 2, 16], 1], ["SP", 2, 15, 512, [1, 1], 1], ["RE", 2, [0, 5, 10, 1, 6, 11, 2, 7, 12, 15, 16, 3, 8, 13, 17, 4, 9, 14]], ["FSP", 3, 0, 1, 3], ["FSP", 3, 4, 2, 3], ["FSP", 3, 8, 3, 3], ["RE", 3, [0, 4, 8, 1, 5, 9, 2, 6, 10, 3, 7, 11]], ["CA", 2, 3, 8], ["CHR", 1, "shared", [2]], ["CA", 2, 3, 9], ["CHR", 0, "shared", [3]], ["CA", 1, 4, 9], ["FU", 5, [0, 1, 2]], ["AN", 5, 0, 5], ["FU", 5, [1, 2, 3]], ["AN", 5, 1, 4], ["FU", 5, [2, 3, 4]], ["AN", 5, 2, 6], ["FU", 3, [0, 1, 2]], ["SP", 3, 0, 8, [1], 1], ["AN", 3, 1, 2], ["FFSP", 3, 0, [3, 2, 1], 1, 1], ["AN", 3, 1, 6], ["FU", 1, [0, 1, 2]], ["SP", 1, 0, 34, [1], 1], ["AN", 1, 1, 2], ["FFSP", 1, 0, [3, 2, 1], 1, 1], ["AN", 1, 1, 6], ["PR", 4, 0, "auto_unroll_max_step$512"]]]], "r": [[0.00479534], 0, 5.30887, 1670453408], "v": "v0.6"}
{"i": [["[\"32a5ff201401d5600f77ced9f22defaa\", [8, 34, 512], [8, 1024, 512], [8, 34, 1024]]", "cuda -keys=cuda,gpu -arch=sm_80 -max_num_threads=1024 -thread_warp_size=32", [-1, 16, 64, 49152, 2147483647, 1024, 8, 32], "", 0, []], [[], [["CHW", 2, "local"], ["SP", 2, 0, 8, [1, 2, 4, 1], 1], ["SP", 2, 5, 34, [1, 34, 1, 1], 1], ["SP", 2, 10, 1024, [8, 1, 2, 64], 1], ["SP", 2, 15, 512, [1, 1], 1], ["RE", 2, [0, 5, 10, 1, 6, 11, 2, 7, 12, 15, 16, 3, 8, 13, 17, 4, 9, 14]], ["FSP", 3, 0, 1, 3], ["FSP", 3, 4, 2, 3], ["FSP", 3, 8, 3, 3], ["RE", 3, [0, 4, 8, 1, 5, 9, 2, 6, 10, 3, 7, 11]], ["CA", 2, 3, 8], ["CHR", 1, "shared", [2]], ["CA", 2, 3, 9], ["CHR", 0, "shared", [3]], ["CA", 1, 4, 9], ["FU", 5, [0, 1, 2]], ["AN", 5, 0, 5], ["FU", 5, [1, 2, 3]], ["AN", 5, 1, 4], ["FU", 5, [2, 3, 4]], ["AN", 5, 2, 6], ["FU", 3, [0, 1, 2]], ["SP", 3, 0, 256, [2], 1], ["AN", 3, 1, 2], ["FFSP", 3, 0, [3, 2, 1], 1, 1], ["AN", 3, 1, 6], ["FU", 1, [0, 1, 2]], ["SP", 1, 0, 4, [4], 1], ["AN", 1, 1, 2], ["FFSP", 1, 0, [3, 2, 1], 1, 1], ["AN", 1, 1, 6], ["PR", 4, 0, "auto_unroll_max_step$0"]]]], "r": [[0.0383147], 0, 2.46794, 1670453409], "v": "v0.6"}
{"i": [["[\"32a5ff201401d5600f77ced9f22defaa\", [8, 34, 512], [8, 1024, 512], [8, 34, 1024]]", "cuda -keys=cuda,gpu -arch=sm_80 -max_num_threads=1024 -thread_warp_size=32", [-1, 16, 64, 49152, 2147483647, 1024, 8, 32], "", 0, []], [[], [["CHW", 2, "local"], ["SP", 2, 0, 8, [1, 8, 1, 1], 1], ["SP", 2, 5, 34, [1, 17, 2, 1], 1], ["SP", 2, 10, 1024, [4, 4, 2, 1], 1], ["SP", 2, 15, 512, [2, 8], 1], ["RE", 2, [0, 5, 10, 1, 6, 11, 2, 7, 12, 15, 16, 3, 8, 13, 17, 4, 9, 14]], ["FSP", 3, 0, 1, 3], ["FSP", 3, 4, 2, 3], ["FSP", 3, 8, 3, 3], ["RE", 3, [0, 4, 8, 1, 5, 9, 2, 6, 10, 3, 7, 11]], ["CA", 2, 3, 8], ["CHR", 1, "shared", [2]], ["CA", 2, 3, 9], ["CHR", 0, "shared", [3]], ["CA", 1, 4, 9], ["FU", 5, [0, 1, 2]], ["AN", 5, 0, 5], ["FU", 5, [1, 2, 3]], ["AN", 5, 1, 4], ["FU", 5, [2, 3, 4]], ["AN", 5, 2, 6], ["FU", 3, [0, 1, 2]], ["SP", 3, 0, 32, [1], 1], ["AN", 3, 1, 2], ["FFSP", 3, 0, [3, 2, 1], 1, 1], ["AN", 3, 1, 6], ["FU", 1, [0, 1, 2]], ["SP", 1, 0, 32, [1], 1], ["AN", 1, 1, 2], ["FFSP", 1, 0, [3, 2, 1], 1, 1], ["AN", 1, 1, 6], ["PR", 4, 0, "auto_unroll_max_step$512"]]]], "r": [[0.000274404], 0, 2.15691, 1670453411], "v": "v0.6"}
{"i": [["[\"32a5ff201401d5600f77ced9f22defaa\", [8, 34, 512], [8, 1024, 512], [8, 34, 1024]]", "cuda -keys=cuda,gpu -arch=sm_80 -max_num_threads=1024 -thread_warp_size=32", [-1, 16, 64, 49152, 2147483647, 1024, 8, 32], "", 0, []], [[], [["CHW", 2, "local"], ["SP", 2, 0, 8, [1, 4, 1, 2], 1], ["SP", 2, 5, 34, [2, 1, 1, 1], 1], ["SP", 2, 10, 1024, [2, 64, 4, 1], 1], ["SP", 2, 15, 512, [2, 1], 1], ["RE", 2, [0, 5, 10, 1, 6, 11, 2, 7, 12, 15, 16, 3, 8, 13, 17, 4, 9, 14]], ["FSP", 3, 0, 1, 3], ["FSP", 3, 4, 2, 3], ["FSP", 3, 8, 3, 3], ["RE", 3, [0, 4, 8, 1, 5, 9, 2, 6, 10, 3, 7, 11]], ["CA", 2, 3, 8], ["CHR", 1, "shared", [2]], ["CA", 2, 3, 9], ["CHR", 0, "shared", [3]], ["CA", 1, 4, 9], ["FU", 5, [0, 1, 2]], ["AN", 5, 0, 5], ["FU", 5, [1, 2, 3]], ["AN", 5, 1, 4], ["FU", 5, [2, 3, 4]], ["AN", 5, 2, 6], ["FU", 3, [0, 1, 2]], ["SP", 3, 0, 16, [4], 1], ["AN", 3, 1, 2], ["FFSP", 3, 0, [3, 2, 1], 1, 1], ["AN", 3, 1, 6], ["FU", 1, [0, 1, 2]], ["SP", 1, 0, 4, [1], 1], ["AN", 1, 1, 2], ["FFSP", 1, 0, [3, 2, 1], 1, 1], ["AN", 1, 1, 6], ["PR", 4, 0, "auto_unroll_max_step$1024"]]]], "r": [[0.00171347], 0, 2.08744, 1670453412], "v": "v0.6"}
{"i": [["[\"32a5ff201401d5600f77ced9f22defaa\", [8, 34, 512], [8, 1024, 512], [8, 34, 1024]]", "cuda -keys=cuda,gpu -arch=sm_80 -max_num_threads=1024 -thread_warp_size=32", [-1, 16, 64, 49152, 2147483647, 1024, 8, 32], "", 0, []], [[], [["CHW", 2, "local"], ["SP", 2, 0, 8, [1, 1, 4, 2], 1], ["SP", 2, 5, 34, [1, 17, 2, 1], 1], ["SP", 2, 10, 1024, [4, 2, 4, 1], 1], ["SP", 2, 15, 512, [2, 8], 1], ["RE", 2, [0, 5, 10, 1, 6, 11, 2, 7, 12, 15, 16, 3, 8, 13, 17, 4, 9, 14]], ["FSP", 3, 0, 1, 3], ["FSP", 3, 4, 2, 3], ["FSP", 3, 8, 3, 3], ["RE", 3, [0, 4, 8, 1, 5, 9, 2, 6, 10, 3, 7, 11]], ["CA", 2, 3, 8], ["CHR", 1, "shared", [2]], ["CA", 2, 3, 9], ["CHR", 0, "shared", [3]], ["CA", 1, 4, 9], ["FU", 5, [0, 1, 2]], ["AN", 5, 0, 5], ["FU", 5, [1, 2, 3]], ["AN", 5, 1, 4], ["FU", 5, [2, 3, 4]], ["AN", 5, 2, 6], ["FU", 3, [0, 1, 2]], ["SP", 3, 0, 512, [4], 1], ["AN", 3, 1, 2], ["FFSP", 3, 0, [3, 2, 1], 1, 1], ["AN", 3, 1, 6], ["FU", 1, [0, 1, 2]], ["SP", 1, 0, 256, [1], 1], ["AN", 1, 1, 2], ["FFSP", 1, 0, [3, 2, 1], 1, 1], ["AN", 1, 1, 6], ["PR", 4, 0, "auto_unroll_max_step$0"]]]], "r": [[0.00081542], 0, 2.56361, 1670453413], "v": "v0.6"}
{"i": [["[\"32a5ff201401d5600f77ced9f22defaa\", [8, 34, 512], [8, 1024, 512], [8, 34, 1024]]", "cuda -keys=cuda,gpu -arch=sm_80 -max_num_threads=1024 -thread_warp_size=32", [-1, 16, 64, 49152, 2147483647, 1024, 8, 32], "", 0, []], [[], [["CHW", 2, "local"], ["SP", 2, 0, 8, [2, 2, 1, 1], 1], ["SP", 2, 5, 34, [1, 1, 34, 1], 1], ["SP", 2, 10, 1024, [1, 32, 16, 1], 1], ["SP", 2, 15, 512, [1, 2], 1], ["RE", 2, [0, 5, 10, 1, 6, 11, 2, 7, 12, 15, 16, 3, 8, 13, 17, 4, 9, 14]], ["FSP", 3, 0, 1, 3], ["FSP", 3, 4, 2, 3], ["FSP", 3, 8, 3, 3], ["RE", 3, [0, 4, 8, 1, 5, 9, 2, 6, 10, 3, 7, 11]], ["CA", 2, 3, 8], ["CHR", 1, "shared", [2]], ["CA", 2, 3, 9], ["CHR", 0, "shared", [3]], ["CA", 1, 4, 9], ["FU", 5, [0, 1, 2]], ["AN", 5, 0, 5], ["FU", 5, [1, 2, 3]], ["AN", 5, 1, 4], ["FU", 5, [2, 3, 4]], ["AN", 5, 2, 6], ["FU", 3, [0, 1, 2]], ["SP", 3, 0, 32, [1], 1], ["AN", 3, 1, 2], ["FFSP", 3, 0, [3, 2, 1], 1, 1], ["AN", 3, 1, 6], ["FU", 1, [0, 1, 2]], ["SP", 1, 0, 68, [1], 1], ["AN", 1, 1, 2], ["FFSP", 1, 0, [3, 2, 1], 1, 1], ["AN", 1, 1, 6], ["PR", 4, 0, "auto_unroll_max_step$1024"]]]], "r": [[0.00502441], 0, 1.57692, 1670453414], "v": "v0.6"}
{"i": [["[\"32a5ff201401d5600f77ced9f22defaa\", [8, 34, 512], [8, 1024, 512], [8, 34, 1024]]", "cuda -keys=cuda,gpu -arch=sm_80 -max_num_threads=1024 -thread_warp_size=32", [-1, 16, 64, 49152, 2147483647, 1024, 8, 32], "", 0, []], [[], [["CHW", 2, "local"], ["SP", 2, 0, 8, [1, 8, 1, 1], 1], ["SP", 2, 5, 34, [1, 1, 34, 1], 1], ["SP", 2, 10, 1024, [4, 4, 2, 1], 1], ["SP", 2, 15, 512, [1, 2], 1], ["RE", 2, [0, 5, 10, 1, 6, 11, 2, 7, 12, 15, 16, 3, 8, 13, 17, 4, 9, 14]], ["FSP", 3, 0, 1, 3], ["FSP", 3, 4, 2, 3], ["FSP", 3, 8, 3, 3], ["RE", 3, [0, 4, 8, 1, 5, 9, 2, 6, 10, 3, 7, 11]], ["CA", 2, 3, 8], ["CHR", 1, "shared", [2]], ["CA", 2, 3, 9], ["CHR", 0, "shared", [3]], ["CA", 1, 4, 9], ["FU", 5, [0, 1, 2]], ["AN", 5, 0, 5], ["FU", 5, [1, 2, 3]], ["AN", 5, 1, 4], ["FU", 5, [2, 3, 4]], ["AN", 5, 2, 6], ["FU", 3, [0, 1, 2]], ["SP", 3, 0, 4, [1], 1], ["AN", 3, 1, 2], ["FFSP", 3, 0, [3, 2, 1], 1, 1], ["AN", 3, 1, 6], ["FU", 1, [0, 1, 2]], ["SP", 1, 0, 2, [1], 1], ["AN", 1, 1, 2], ["FFSP", 1, 0, [3, 2, 1], 1, 1], ["AN", 1, 1, 6], ["PR", 4, 0, "auto_unroll_max_step$512"]]]], "r": [[0.00084044], 0, 1.97336, 1670453416], "v": "v0.6"}
{"i": [["[\"32a5ff201401d5600f77ced9f22defaa\", [8, 34, 512], [8, 1024, 512], [8, 34, 1024]]", "cuda -keys=cuda,gpu -arch=sm_80 -max_num_threads=1024 -thread_warp_size=32", [-1, 16, 64, 49152, 2147483647, 1024, 8, 32], "", 0, []], [[], [["CHW", 2, "local"], ["SP", 2, 0, 8, [1, 1, 1, 2], 1], ["SP", 2, 5, 34, [1, 17, 1, 1], 1], ["SP", 2, 10, 1024, [1, 4, 128, 1], 1], ["SP", 2, 15, 512, [1, 4], 1], ["RE", 2, [0, 5, 10, 1, 6, 11, 2, 7, 12, 15, 16, 3, 8, 13, 17, 4, 9, 14]], ["FSP", 3, 0, 1, 3], ["FSP", 3, 4, 2, 3], ["FSP", 3, 8, 3, 3], ["RE", 3, [0, 4, 8, 1, 5, 9, 2, 6, 10, 3, 7, 11]], ["CA", 2, 3, 8], ["CHR", 1, "shared", [2]], ["CA", 2, 3, 9], ["CHR", 0, "shared", [3]], ["CA", 1, 4, 9], ["FU", 5, [0, 1, 2]], ["AN", 5, 0, 5], ["FU", 5, [1, 2, 3]], ["AN", 5, 1, 4], ["FU", 5, [2, 3, 4]], ["AN", 5, 2, 6], ["FU", 3, [0, 1, 2]], ["SP", 3, 0, 1024, [1], 1], ["AN", 3, 1, 2], ["FFSP", 3, 0, [3, 2, 1], 1, 1], ["AN", 3, 1, 6], ["FU", 1, [0, 1, 2]], ["SP", 1, 0, 8, [1], 1], ["AN", 1, 1, 2], ["FFSP", 1, 0, [3, 2, 1], 1, 1], ["AN", 1, 1, 6], ["PR", 4, 0, "auto_unroll_max_step$64"]]]], "r": [[0.00179088], 0, 1.64339, 1670453417], "v": "v0.6"}
