.cache/log/kernel_tune/Linear_GELU_1_512_1024.json
{"i": [["[\"f1f88c1ddcda2fdfed7a61ba0c29695c\", [1, 512], [1024, 512], [1, 1024], [1, 1024]]", "cuda -keys=cuda,gpu -arch=sm_80 -max_num_threads=1024 -thread_warp_size=32", [-1, 16, 64, 49152, 2147483647, 1024, 8, 32], "", 0, []], [[], [["CI", 11], ["CI", 10], ["CI", 9], ["CI", 8], ["CI", 7], ["CI", 6], ["CI", 5], ["CI", 4], ["CHW", 2, "local"], ["SP", 2, 0, 1, [1, 1, 1, 1], 1], ["SP", 2, 5, 1024, [2, 64, 2, 4], 1], ["SP", 2, 10, 512, [4, 1], 1], ["RE", 2, [0, 5, 1, 6, 2, 7, 10, 11, 3, 8, 12, 4, 9]], ["FSP", 3, 0, 9, 3], ["FSP", 3, 4, 10, 3], ["RE", 3, [0, 4, 1, 5, 2, 6, 3, 7]], ["CA", 2, 3, 5], ["CHR", 1, "shared", [2]], ["CA", 2, 3, 6], ["CHR", 0, "shared", [3]], ["CA", 1, 4, 6], ["FU", 15, [0, 1]], ["SP", 15, 0, 1024, [1], 1], ["AN", 15, 0, 5], ["AN", 15, 1, 6], ["FU", 5, [0, 1]], ["AN", 5, 0, 5], ["FU", 5, [1, 2]], ["AN", 5, 1, 4], ["FU", 5, [2, 3]], ["AN", 5, 2, 6], ["FU", 3, [0, 1]], ["SP", 3, 0, 32, [1], 1], ["AN", 3, 1, 2], ["FFSP", 3, 0, [10, 9], 1, 1], ["AN", 3, 1, 6], ["FU", 1, [0, 1]], ["SP", 1, 0, 4, [1], 1], ["AN", 1, 1, 2], ["FFSP", 1, 0, [10, 9], 1, 1], ["AN", 1, 1, 6], ["PR", 4, 0, "auto_unroll_max_step$1024"]]]], "r": [[0.000477825, 0.000477921], 0, 3.89752, 1653061421], "v": "v0.6"}
{"i": [["[\"f1f88c1ddcda2fdfed7a61ba0c29695c\", [1, 512], [1024, 512], [1, 1024], [1, 1024]]", "cuda -keys=cuda,gpu -arch=sm_80 -max_num_threads=1024 -thread_warp_size=32", [-1, 16, 64, 49152, 2147483647, 1024, 8, 32], "", 0, []], [[], [["CI", 11], ["CI", 10], ["CI", 9], ["CI", 8], ["CI", 7], ["CI", 6], ["CI", 5], ["CI", 4], ["CHW", 2, "local"], ["SP", 2, 0, 1, [1, 1, 1, 1], 1], ["SP", 2, 5, 1024, [1, 32, 16, 2], 1], ["SP", 2, 10, 512, [1, 1], 1], ["RE", 2, [0, 5, 1, 6, 2, 7, 10, 11, 3, 8, 12, 4, 9]], ["FSP", 3, 0, 9, 3], ["FSP", 3, 4, 10, 3], ["RE", 3, [0, 4, 1, 5, 2, 6, 3, 7]], ["CA", 2, 3, 5], ["CHR", 1, "shared", [2]], ["CA", 2, 3, 6], ["CHR", 0, "shared", [3]], ["CA", 1, 4, 6], ["FU", 15, [0, 1]], ["SP", 15, 0, 1024, [64], 1], ["AN", 15, 0, 5], ["AN", 15, 1, 6], ["FU", 5, [0, 1]], ["AN", 5, 0, 5], ["FU", 5, [1, 2]], ["AN", 5, 1, 4], ["FU", 5, [2, 3]], ["AN", 5, 2, 6], ["FU", 3, [0, 1]], ["SP", 3, 0, 32, [1], 1], ["AN", 3, 1, 2], ["FFSP", 3, 0, [10, 9], 1, 1], ["AN", 3, 1, 6], ["FU", 1, [0, 1]], ["SP", 1, 0, 1, [1], 1], ["AN", 1, 1, 2], ["FFSP", 1, 0, [10, 9], 1, 1], ["AN", 1, 1, 6], ["PR", 4, 0, "auto_unroll_max_step$16"]]]], "r": [[0.00254114, 0.00254156], 0, 3.59227, 1653061423], "v": "v0.6"}
{"i": [["[\"f1f88c1ddcda2fdfed7a61ba0c29695c\", [1, 512], [1024, 512], [1, 1024], [1, 1024]]", "cuda -keys=cuda,gpu -arch=sm_80 -max_num_threads=1024 -thread_warp_size=32", [-1, 16, 64, 49152, 2147483647, 1024, 8, 32], "", 0, []], [[], [["CI", 11], ["CI", 10], ["CI", 9], ["CI", 8], ["CI", 7], ["CI", 6], ["CI", 5], ["CI", 4], ["CHW", 2, "local"], ["SP", 2, 0, 1, [1, 1, 1, 1], 1], ["SP", 2, 5, 1024, [2, 64, 1, 1], 1], ["SP", 2, 10, 512, [2, 4], 1], ["RE", 2, [0, 5, 1, 6, 2, 7, 10, 11, 3, 8, 12, 4, 9]], ["FSP", 3, 0, 9, 3], ["FSP", 3, 4, 10, 3], ["RE", 3, [0, 4, 1, 5, 2, 6, 3, 7]], ["CA", 2, 3, 5], ["CHR", 1, "shared", [2]], ["CA", 2, 3, 6], ["CHR", 0, "shared", [3]], ["CA", 1, 4, 6], ["FU", 15, [0, 1]], ["SP", 15, 0, 1024, [32], 1], ["AN", 15, 0, 5], ["AN", 15, 1, 6], ["FU", 5, [0, 1]], ["AN", 5, 0, 5], ["FU", 5, [1, 2]], ["AN", 5, 1, 4], ["FU", 5, [2, 3]], ["AN", 5, 2, 6], ["FU", 3, [0, 1]], ["SP", 3, 0, 8, [2], 1], ["AN", 3, 1, 2], ["FFSP", 3, 0, [10, 9], 1, 1], ["AN", 3, 1, 6], ["FU", 1, [0, 1]], ["SP", 1, 0, 8, [2], 1], ["AN", 1, 1, 2], ["FFSP", 1, 0, [10, 9], 1, 1], ["AN", 1, 1, 6], ["PR", 4, 0, "auto_unroll_max_step$512"]]]], "r": [[5.50861e-05, 5.50747e-05], 0, 3.21153, 1653061425], "v": "v0.6"}
{"i": [["[\"f1f88c1ddcda2fdfed7a61ba0c29695c\", [1, 512], [1024, 512], [1, 1024], [1, 1024]]", "cuda -keys=cuda,gpu -arch=sm_80 -max_num_threads=1024 -thread_warp_size=32", [-1, 16, 64, 49152, 2147483647, 1024, 8, 32], "", 0, []], [[], [["CI", 11], ["CI", 10], ["CI", 9], ["CI", 8], ["CI", 7], ["CI", 6], ["CI", 5], ["CI", 4], ["CHW", 2, "local"], ["SP", 2, 0, 1, [1, 1, 1, 1], 1], ["SP", 2, 5, 1024, [4, 32, 2, 4], 1], ["SP", 2, 10, 512, [2, 2], 1], ["RE", 2, [0, 5, 1, 6, 2, 7, 10, 11, 3, 8, 12, 4, 9]], ["FSP", 3, 0, 9, 3], ["FSP", 3, 4, 10, 3], ["RE", 3, [0, 4, 1, 5, 2, 6, 3, 7]], ["CA", 2, 3, 5], ["CHR", 1, "shared", [2]], ["CA", 2, 3, 6], ["CHR", 0, "shared", [3]], ["CA", 1, 4, 6], ["FU", 15, [0, 1]], ["SP", 15, 0, 1024, [32], 1], ["AN", 15, 0, 5], ["AN", 15, 1, 6], ["FU", 5, [0, 1]], ["AN", 5, 0, 5], ["FU", 5, [1, 2]], ["AN", 5, 1, 4], ["FU", 5, [2, 3]], ["AN", 5, 2, 6], ["FU", 3, [0, 1]], ["SP", 3, 0, 32, [2], 1], ["AN", 3, 1, 2], ["FFSP", 3, 0, [10, 9], 1, 1], ["AN", 3, 1, 6], ["FU", 1, [0, 1]], ["SP", 1, 0, 4, [1], 1], ["AN", 1, 1, 2], ["FFSP", 1, 0, [10, 9], 1, 1], ["AN", 1, 1, 6], ["PR", 4, 0, "auto_unroll_max_step$16"]]]], "r": [[0.000680411, 0.00068038], 0, 3.81352, 1653061426], "v": "v0.6"}
{"i": [["[\"f1f88c1ddcda2fdfed7a61ba0c29695c\", [1, 512], [1024, 512], [1, 1024], [1, 1024]]", "cuda -keys=cuda,gpu -arch=sm_80 -max_num_threads=1024 -thread_warp_size=32", [-1, 16, 64, 49152, 2147483647, 1024, 8, 32], "", 0, []], [[], [["CI", 11], ["CI", 10], ["CI", 9], ["CI", 8], ["CI", 7], ["CI", 6], ["CI", 5], ["CI", 4], ["CHW", 2, "local"], ["SP", 2, 0, 1, [1, 1, 1, 1], 1], ["SP", 2, 5, 1024, [2, 32, 8, 2], 1], ["SP", 2, 10, 512, [2, 4], 1], ["RE", 2, [0, 5, 1, 6, 2, 7, 10, 11, 3, 8, 12, 4, 9]], ["FSP", 3, 0, 9, 3], ["FSP", 3, 4, 10, 3], ["RE", 3, [0, 4, 1, 5, 2, 6, 3, 7]], ["CA", 2, 3, 5], ["CHR", 1, "shared", [2]], ["CA", 2, 3, 6], ["CHR", 0, "shared", [3]], ["CA", 1, 4, 6], ["FU", 15, [0, 1]], ["SP", 15, 0, 1024, [32], 1], ["AN", 15, 0, 5], ["AN", 15, 1, 6], ["FU", 5, [0, 1]], ["AN", 5, 0, 5], ["FU", 5, [1, 2]], ["AN", 5, 1, 4], ["FU", 5, [2, 3]], ["AN", 5, 2, 6], ["FU", 3, [0, 1]], ["SP", 3, 0, 128, [1], 1], ["AN", 3, 1, 2], ["FFSP", 3, 0, [10, 9], 1, 1], ["AN", 3, 1, 6], ["FU", 1, [0, 1]], ["SP", 1, 0, 8, [1], 1], ["AN", 1, 1, 2], ["FFSP", 1, 0, [10, 9], 1, 1], ["AN", 1, 1, 6], ["PR", 4, 0, "auto_unroll_max_step$0"]]]], "r": [[0.00071409, 0.00071423], 0, 3.98778, 1653061428], "v": "v0.6"}
{"i": [["[\"f1f88c1ddcda2fdfed7a61ba0c29695c\", [1, 512], [1024, 512], [1, 1024], [1, 1024]]", "cuda -keys=cuda,gpu -arch=sm_80 -max_num_threads=1024 -thread_warp_size=32", [-1, 16, 64, 49152, 2147483647, 1024, 8, 32], "", 0, []], [[], [["CI", 11], ["CI", 10], ["CI", 9], ["CI", 8], ["CI", 7], ["CI", 6], ["CI", 5], ["CI", 4], ["CHW", 2, "local"], ["SP", 2, 0, 1, [1, 1, 1, 1], 1], ["SP", 2, 5, 1024, [1, 32, 4, 1], 1], ["SP", 2, 10, 512, [1, 16], 1], ["RE", 2, [0, 5, 1, 6, 2, 7, 10, 11, 3, 8, 12, 4, 9]], ["FSP", 3, 0, 9, 3], ["FSP", 3, 4, 10, 3], ["RE", 3, [0, 4, 1, 5, 2, 6, 3, 7]], ["CA", 2, 3, 5], ["CHR", 1, "shared", [2]], ["CA", 2, 3, 6], ["CHR", 0, "shared", [3]], ["CA", 1, 4, 6], ["FU", 15, [0, 1]], ["SP", 15, 0, 1024, [32], 1], ["AN", 15, 0, 5], ["AN", 15, 1, 6], ["FU", 5, [0, 1]], ["AN", 5, 0, 5], ["FU", 5, [1, 2]], ["AN", 5, 1, 4], ["FU", 5, [2, 3]], ["AN", 5, 2, 6], ["FU", 3, [0, 1]], ["SP", 3, 0, 16, [1], 1], ["AN", 3, 1, 2], ["FFSP", 3, 0, [10, 9], 1, 1], ["AN", 3, 1, 6], ["FU", 1, [0, 1]], ["SP", 1, 0, 4, [2], 1], ["AN", 1, 1, 2], ["FFSP", 1, 0, [10, 9], 1, 1], ["AN", 1, 1, 6], ["PR", 4, 0, "auto_unroll_max_step$0"]]]], "r": [[8.78115e-05, 8.78126e-05], 0, 2.87892, 1653061430], "v": "v0.6"}
{"i": [["[\"f1f88c1ddcda2fdfed7a61ba0c29695c\", [1, 512], [1024, 512], [1, 1024], [1, 1024]]", "cuda -keys=cuda,gpu -arch=sm_80 -max_num_threads=1024 -thread_warp_size=32", [-1, 16, 64, 49152, 2147483647, 1024, 8, 32], "", 0, []], [[], [["CI", 11], ["CI", 10], ["CI", 9], ["CI", 8], ["CI", 7], ["CI", 6], ["CI", 5], ["CI", 4], ["CHW", 2, "local"], ["SP", 2, 0, 1, [1, 1, 1, 1], 1], ["SP", 2, 5, 1024, [1, 256, 2, 1], 1], ["SP", 2, 10, 512, [4, 2], 1], ["RE", 2, [0, 5, 1, 6, 2, 7, 10, 11, 3, 8, 12, 4, 9]], ["FSP", 3, 0, 9, 3], ["FSP", 3, 4, 10, 3], ["RE", 3, [0, 4, 1, 5, 2, 6, 3, 7]], ["CA", 2, 3, 5], ["CHR", 1, "shared", [2]], ["CA", 2, 3, 6], ["CHR", 0, "shared", [3]], ["CA", 1, 4, 6], ["FU", 15, [0, 1]], ["SP", 15, 0, 1024, [32], 1], ["AN", 15, 0, 5], ["AN", 15, 1, 6], ["FU", 5, [0, 1]], ["AN", 5, 0, 5], ["FU", 5, [1, 2]], ["AN", 5, 1, 4], ["FU", 5, [2, 3]], ["AN", 5, 2, 6], ["FU", 3, [0, 1]], ["SP", 3, 0, 16, [1], 1], ["AN", 3, 1, 2], ["FFSP", 3, 0, [10, 9], 1, 1], ["AN", 3, 1, 6], ["FU", 1, [0, 1]], ["SP", 1, 0, 8, [1], 1], ["AN", 1, 1, 2], ["FFSP", 1, 0, [10, 9], 1, 1], ["AN", 1, 1, 6], ["PR", 4, 0, "auto_unroll_max_step$512"]]]], "r": [[0.000134573, 0.000134589], 0, 3.18412, 1653061432], "v": "v0.6"}
{"i": [["[\"f1f88c1ddcda2fdfed7a61ba0c29695c\", [1, 512], [1024, 512], [1, 1024], [1, 1024]]", "cuda -keys=cuda,gpu -arch=sm_80 -max_num_threads=1024 -thread_warp_size=32", [-1, 16, 64, 49152, 2147483647, 1024, 8, 32], "", 0, []], [[], [["CI", 11], ["CI", 10], ["CI", 9], ["CI", 8], ["CI", 7], ["CI", 6], ["CI", 5], ["CI", 4], ["CHW", 2, "local"], ["SP", 2, 0, 1, [1, 1, 1, 1], 1], ["SP", 2, 5, 1024, [1, 32, 16, 2], 1], ["SP", 2, 10, 512, [1, 4], 1], ["RE", 2, [0, 5, 1, 6, 2, 7, 10, 11, 3, 8, 12, 4, 9]], ["FSP", 3, 0, 9, 3], ["FSP", 3, 4, 10, 3], ["RE", 3, [0, 4, 1, 5, 2, 6, 3, 7]], ["CA", 2, 3, 5], ["CHR", 1, "shared", [2]], ["CA", 2, 3, 6], ["CHR", 0, "shared", [3]], ["CA", 1, 4, 6], ["FU", 15, [0, 1]], ["SP", 15, 0, 1024, [8], 1], ["AN", 15, 0, 5], ["AN", 15, 1, 6], ["FU", 5, [0, 1]], ["AN", 5, 0, 5], ["FU", 5, [1, 2]], ["AN", 5, 1, 4], ["FU", 5, [2, 3]], ["AN", 5, 2, 6], ["FU", 3, [0, 1]], ["SP", 3, 0, 128, [1], 1], ["AN", 3, 1, 2], ["FFSP", 3, 0, [10, 9], 1, 1], ["AN", 3, 1, 6], ["FU", 1, [0, 1]], ["SP", 1, 0, 4, [4], 1], ["AN", 1, 1, 2], ["FFSP", 1, 0, [10, 9], 1, 1], ["AN", 1, 1, 6], ["PR", 4, 0, "auto_unroll_max_step$512"]]]], "r": [[0.000768897, 0.000768906], 0, 3.5429, 1653061433], "v": "v0.6"}
{"i": [["[\"f1f88c1ddcda2fdfed7a61ba0c29695c\", [1, 512], [1024, 512], [1, 1024], [1, 1024]]", "cuda -keys=cuda,gpu -arch=sm_80 -max_num_threads=1024 -thread_warp_size=32", [-1, 16, 64, 49152, 2147483647, 1024, 8, 32], "", 0, []], [[], [["CI", 11], ["CI", 10], ["CI", 9], ["CI", 8], ["CI", 7], ["CI", 6], ["CI", 5], ["CI", 4], ["CHW", 2, "local"], ["SP", 2, 0, 1, [1, 1, 1, 1], 1], ["SP", 2, 5, 1024, [1, 256, 1, 1], 1], ["SP", 2, 10, 512, [1, 1], 1], ["RE", 2, [0, 5, 1, 6, 2, 7, 10, 11, 3, 8, 12, 4, 9]], ["FSP", 3, 0, 9, 3], ["FSP", 3, 4, 10, 3], ["RE", 3, [0, 4, 1, 5, 2, 6, 3, 7]], ["CA", 2, 3, 5], ["CHR", 1, "shared", [2]], ["CA", 2, 3, 6], ["CHR", 0, "shared", [3]], ["CA", 1, 4, 6], ["FU", 15, [0, 1]], ["SP", 15, 0, 1024, [4], 1], ["AN", 15, 0, 5], ["AN", 15, 1, 6], ["FU", 5, [0, 1]], ["AN", 5, 0, 5], ["FU", 5, [1, 2]], ["AN", 5, 1, 4], ["FU", 5, [2, 3]], ["AN", 5, 2, 6], ["FU", 3, [0, 1]], ["SP", 3, 0, 1, [1], 1], ["AN", 3, 1, 2], ["FFSP", 3, 0, [10, 9], 1, 1], ["AN", 3, 1, 6], ["FU", 1, [0, 1]], ["SP", 1, 0, 1, [1], 1], ["AN", 1, 1, 2], ["FFSP", 1, 0, [10, 9], 1, 1], ["AN", 1, 1, 6], ["PR", 4, 0, "auto_unroll_max_step$1024"]]]], "r": [[0.000267828, 0.00026779], 0, 2.61912, 1653061435], "v": "v0.6"}
{"i": [["[\"f1f88c1ddcda2fdfed7a61ba0c29695c\", [1, 512], [1024, 512], [1, 1024], [1, 1024]]", "cuda -keys=cuda,gpu -arch=sm_80 -max_num_threads=1024 -thread_warp_size=32", [-1, 16, 64, 49152, 2147483647, 1024, 8, 32], "", 0, []], [[], [["CI", 11], ["CI", 10], ["CI", 9], ["CI", 8], ["CI", 7], ["CI", 6], ["CI", 5], ["CI", 4], ["CHW", 2, "local"], ["SP", 2, 0, 1, [1, 1, 1, 1], 1], ["SP", 2, 5, 1024, [1, 32, 2, 2], 1], ["SP", 2, 10, 512, [2, 2], 1], ["RE", 2, [0, 5, 1, 6, 2, 7, 10, 11, 3, 8, 12, 4, 9]], ["FSP", 3, 0, 9, 3], ["FSP", 3, 4, 10, 3], ["RE", 3, [0, 4, 1, 5, 2, 6, 3, 7]], ["CA", 2, 3, 5], ["CHR", 1, "shared", [2]], ["CA", 2, 3, 6], ["CHR", 0, "shared", [3]], ["CA", 1, 4, 6], ["FU", 15, [0, 1]], ["SP", 15, 0, 1024, [32], 1], ["AN", 15, 0, 5], ["AN", 15, 1, 6], ["FU", 5, [0, 1]], ["AN", 5, 0, 5], ["FU", 5, [1, 2]], ["AN", 5, 1, 4], ["FU", 5, [2, 3]], ["AN", 5, 2, 6], ["FU", 3, [0, 1]], ["SP", 3, 0, 16, [1], 1], ["AN", 3, 1, 2], ["FFSP", 3, 0, [10, 9], 1, 1], ["AN", 3, 1, 6], ["FU", 1, [0, 1]], ["SP", 1, 0, 4, [1], 1], ["AN", 1, 1, 2], ["FFSP", 1, 0, [10, 9], 1, 1], ["AN", 1, 1, 6], ["PR", 4, 0, "auto_unroll_max_step$0"]]]], "r": [[0.000109905, 0.000109893], 0, 2.99018, 1653061436], "v": "v0.6"}
{"i": [["[\"f1f88c1ddcda2fdfed7a61ba0c29695c\", [1, 512], [1024, 512], [1, 1024], [1, 1024]]", "cuda -keys=cuda,gpu -arch=sm_80 -max_num_threads=1024 -thread_warp_size=32", [-1, 16, 64, 49152, 2147483647, 1024, 8, 32], "", 0, []], [[], [["CI", 11], ["CI", 10], ["CI", 9], ["CI", 8], ["CI", 7], ["CI", 6], ["CI", 5], ["CI", 4], ["CHW", 2, "local"], ["SP", 2, 0, 1, [1, 1, 1, 1], 1], ["SP", 2, 5, 1024, [2, 128, 4, 1], 1], ["SP", 2, 10, 512, [2, 1], 1], ["RE", 2, [0, 5, 1, 6, 2, 7, 10, 11, 3, 8, 12, 4, 9]], ["FSP", 3, 0, 9, 3], ["FSP", 3, 4, 10, 3], ["RE", 3, [0, 4, 1, 5, 2, 6, 3, 7]], ["CA", 2, 3, 5], ["CHR", 1, "shared", [2]], ["CA", 2, 3, 6], ["CHR", 0, "shared", [3]], ["CA", 1, 4, 6], ["FU", 15, [0, 1]], ["SP", 15, 0, 1024, [64], 1], ["AN", 15, 0, 5], ["AN", 15, 1, 6], ["FU", 5, [0, 1]], ["AN", 5, 0, 5], ["FU", 5, [1, 2]], ["AN", 5, 1, 4], ["FU", 5, [2, 3]], ["AN", 5, 2, 6], ["FU", 3, [0, 1]], ["SP", 3, 0, 32, [1], 1], ["AN", 3, 1, 2], ["FFSP", 3, 0, [10, 9], 1, 1], ["AN", 3, 1, 6], ["FU", 1, [0, 1]], ["SP", 1, 0, 8, [1], 1], ["AN", 1, 1, 2], ["FFSP", 1, 0, [10, 9], 1, 1], ["AN", 1, 1, 6], ["PR", 4, 0, "auto_unroll_max_step$1024"]]]], "r": [[0.000607693, 0.000607721], 0, 3.35859, 1653061438], "v": "v0.6"}
{"i": [["[\"f1f88c1ddcda2fdfed7a61ba0c29695c\", [1, 512], [1024, 512], [1, 1024], [1, 1024]]", "cuda -keys=cuda,gpu -arch=sm_80 -max_num_threads=1024 -thread_warp_size=32", [-1, 16, 64, 49152, 2147483647, 1024, 8, 32], "", 0, []], [[], [["CI", 11], ["CI", 10], ["CI", 9], ["CI", 8], ["CI", 7], ["CI", 6], ["CI", 5], ["CI", 4], ["CHW", 2, "local"], ["SP", 2, 0, 1, [1, 1, 1, 1], 1], ["SP", 2, 5, 1024, [1, 256, 1, 1], 1], ["SP", 2, 10, 512, [1, 4], 1], ["RE", 2, [0, 5, 1, 6, 2, 7, 10, 11, 3, 8, 12, 4, 9]], ["FSP", 3, 0, 9, 3], ["FSP", 3, 4, 10, 3], ["RE", 3, [0, 4, 1, 5, 2, 6, 3, 7]], ["CA", 2, 3, 5], ["CHR", 1, "shared", [2]], ["CA", 2, 3, 6], ["CHR", 0, "shared", [3]], ["CA", 1, 4, 6], ["FU", 15, [0, 1]], ["SP", 15, 0, 1024, [64], 1], ["AN", 15, 0, 5], ["AN", 15, 1, 6], ["FU", 5, [0, 1]], ["AN", 5, 0, 5], ["FU", 5, [1, 2]], ["AN", 5, 1, 4], ["FU", 5, [2, 3]], ["AN", 5, 2, 6], ["FU", 3, [0, 1]], ["SP", 3, 0, 1, [1], 1], ["AN", 3, 1, 2], ["FFSP", 3, 0, [10, 9], 1, 1], ["AN", 3, 1, 6], ["FU", 1, [0, 1]], ["SP", 1, 0, 1, [1], 1], ["AN", 1, 1, 2], ["FFSP", 1, 0, [10, 9], 1, 1], ["AN", 1, 1, 6], ["PR", 4, 0, "auto_unroll_max_step$1024"]]]], "r": [[8.72756e-05, 8.72833e-05], 0, 2.76101, 1653061440], "v": "v0.6"}
{"i": [["[\"f1f88c1ddcda2fdfed7a61ba0c29695c\", [1, 512], [1024, 512], [1, 1024], [1, 1024]]", "cuda -keys=cuda,gpu -arch=sm_80 -max_num_threads=1024 -thread_warp_size=32", [-1, 16, 64, 49152, 2147483647, 1024, 8, 32], "", 0, []], [[], [["CI", 11], ["CI", 10], ["CI", 9], ["CI", 8], ["CI", 7], ["CI", 6], ["CI", 5], ["CI", 4], ["CHW", 2, "local"], ["SP", 2, 0, 1, [1, 1, 1, 1], 1], ["SP", 2, 5, 1024, [1, 64, 1, 2], 1], ["SP", 2, 10, 512, [1, 8], 1], ["RE", 2, [0, 5, 1, 6, 2, 7, 10, 11, 3, 8, 12, 4, 9]], ["FSP", 3, 0, 9, 3], ["FSP", 3, 4, 10, 3], ["RE", 3, [0, 4, 1, 5, 2, 6, 3, 7]], ["CA", 2, 3, 5], ["CHR", 1, "shared", [2]], ["CA", 2, 3, 6], ["CHR", 0, "shared", [3]], ["CA", 1, 4, 6], ["FU", 15, [0, 1]], ["SP", 15, 0, 1024, [2], 1], ["AN", 15, 0, 5], ["AN", 15, 1, 6], ["FU", 5, [0, 1]], ["AN", 5, 0, 5], ["FU", 5, [1, 2]], ["AN", 5, 1, 4], ["FU", 5, [2, 3]], ["AN", 5, 2, 6], ["FU", 3, [0, 1]], ["SP", 3, 0, 8, [1], 1], ["AN", 3, 1, 2], ["FFSP", 3, 0, [10, 9], 1, 1], ["AN", 3, 1, 6], ["FU", 1, [0, 1]], ["SP", 1, 0, 4, [1], 1], ["AN", 1, 1, 2], ["FFSP", 1, 0, [10, 9], 1, 1], ["AN", 1, 1, 6], ["PR", 4, 0, "auto_unroll_max_step$16"]]]], "r": [[6.32894e-05, 6.32917e-05], 0, 3.08971, 1653061441], "v": "v0.6"}
{"i": [["[\"f1f88c1ddcda2fdfed7a61ba0c29695c\", [1, 512], [1024, 512], [1, 1024], [1, 1024]]", "cuda -keys=cuda,gpu -arch=sm_80 -max_num_threads=1024 -thread_warp_size=32", [-1, 16, 64, 49152, 2147483647, 1024, 8, 32], "", 0, []], [[], [["CI", 11], ["CI", 10], ["CI", 9], ["CI", 8], ["CI", 7], ["CI", 6], ["CI", 5], ["CI", 4], ["CHW", 2, "local"], ["SP", 2, 0, 1, [1, 1, 1, 1], 1], ["SP", 2, 5, 1024, [2, 32, 2, 4], 1], ["SP", 2, 10, 512, [8, 1], 1], ["RE", 2, [0, 5, 1, 6, 2, 7, 10, 11, 3, 8, 12, 4, 9]], ["FSP", 3, 0, 9, 3], ["FSP", 3, 4, 10, 3], ["RE", 3, [0, 4, 1, 5, 2, 6, 3, 7]], ["CA", 2, 3, 5], ["CHR", 1, "shared", [2]], ["CA", 2, 3, 6], ["CHR", 0, "shared", [3]], ["CA", 1, 4, 6], ["FU", 15, [0, 1]], ["SP", 15, 0, 1024, [64], 1], ["AN", 15, 0, 5], ["AN", 15, 1, 6], ["FU", 5, [0, 1]], ["AN", 5, 0, 5], ["FU", 5, [1, 2]], ["AN", 5, 1, 4], ["FU", 5, [2, 3]], ["AN", 5, 2, 6], ["FU", 3, [0, 1]], ["SP", 3, 0, 64, [1], 1], ["AN", 3, 1, 2], ["FFSP", 3, 0, [10, 9], 1, 1], ["AN", 3, 1, 6], ["FU", 1, [0, 1]], ["SP", 1, 0, 8, [1], 1], ["AN", 1, 1, 2], ["FFSP", 1, 0, [10, 9], 1, 1], ["AN", 1, 1, 6], ["PR", 4, 0, "auto_unroll_max_step$64"]]]], "r": [[0.000377542, 0.000377507], 0, 3.10907, 1653061443], "v": "v0.6"}
{"i": [["[\"f1f88c1ddcda2fdfed7a61ba0c29695c\", [1, 512], [1024, 512], [1, 1024], [1, 1024]]", "cuda -keys=cuda,gpu -arch=sm_80 -max_num_threads=1024 -thread_warp_size=32", [-1, 16, 64, 49152, 2147483647, 1024, 8, 32], "", 0, []], [[], [["CI", 11], ["CI", 10], ["CI", 9], ["CI", 8], ["CI", 7], ["CI", 6], ["CI", 5], ["CI", 4], ["CHW", 2, "local"], ["SP", 2, 0, 1, [1, 1, 1, 1], 1], ["SP", 2, 5, 1024, [4, 64, 1, 4], 1], ["SP", 2, 10, 512, [1, 4], 1], ["RE", 2, [0, 5, 1, 6, 2, 7, 10, 11, 3, 8, 12, 4, 9]], ["FSP", 3, 0, 9, 3], ["FSP", 3, 4, 10, 3], ["RE", 3, [0, 4, 1, 5, 2, 6, 3, 7]], ["CA", 2, 3, 5], ["CHR", 1, "shared", [2]], ["CA", 2, 3, 6], ["CHR", 0, "shared", [3]], ["CA", 1, 4, 6], ["FU", 15, [0, 1]], ["SP", 15, 0, 1024, [32], 1], ["AN", 15, 0, 5], ["AN", 15, 1, 6], ["FU", 5, [0, 1]], ["AN", 5, 0, 5], ["FU", 5, [1, 2]], ["AN", 5, 1, 4], ["FU", 5, [2, 3]], ["AN", 5, 2, 6], ["FU", 3, [0, 1]], ["SP", 3, 0, 16, [1], 1], ["AN", 3, 1, 2], ["FFSP", 3, 0, [10, 9], 1, 1], ["AN", 3, 1, 6], ["FU", 1, [0, 1]], ["SP", 1, 0, 4, [1], 1], ["AN", 1, 1, 2], ["FFSP", 1, 0, [10, 9], 1, 1], ["AN", 1, 1, 6], ["PR", 4, 0, "auto_unroll_max_step$1024"]]]], "r": [[0.000385148, 0.000385201], 0, 3.18042, 1653061444], "v": "v0.6"}
{"i": [["[\"f1f88c1ddcda2fdfed7a61ba0c29695c\", [1, 512], [1024, 512], [1, 1024], [1, 1024]]", "cuda -keys=cuda,gpu -arch=sm_80 -max_num_threads=1024 -thread_warp_size=32", [-1, 16, 64, 49152, 2147483647, 1024, 8, 32], "", 0, []], [[], [["CI", 11], ["CI", 10], ["CI", 9], ["CI", 8], ["CI", 7], ["CI", 6], ["CI", 5], ["CI", 4], ["CHW", 2, "local"], ["SP", 2, 0, 1, [1, 1, 1, 1], 1], ["SP", 2, 5, 1024, [1, 32, 4, 2], 1], ["SP", 2, 10, 512, [2, 2], 1], ["RE", 2, [0, 5, 1, 6, 2, 7, 10, 11, 3, 8, 12, 4, 9]], ["FSP", 3, 0, 9, 3], ["FSP", 3, 4, 10, 3], ["RE", 3, [0, 4, 1, 5, 2, 6, 3, 7]], ["CA", 2, 3, 5], ["CHR", 1, "shared", [2]], ["CA", 2, 3, 6], ["CHR", 0, "shared", [3]], ["CA", 1, 4, 6], ["FU", 15, [0, 1]], ["SP", 15, 0, 1024, [32], 1], ["AN", 15, 0, 5], ["AN", 15, 1, 6], ["FU", 5, [0, 1]], ["AN", 5, 0, 5], ["FU", 5, [1, 2]], ["AN", 5, 1, 4], ["FU", 5, [2, 3]], ["AN", 5, 2, 6], ["FU", 3, [0, 1]], ["SP", 3, 0, 64, [1], 1], ["AN", 3, 1, 2], ["FFSP", 3, 0, [10, 9], 1, 1], ["AN", 3, 1, 6], ["FU", 1, [0, 1]], ["SP", 1, 0, 8, [1], 1], ["AN", 1, 1, 2], ["FFSP", 1, 0, [10, 9], 1, 1], ["AN", 1, 1, 6], ["PR", 4, 0, "auto_unroll_max_step$0"]]]], "r": [[0.000218213, 0.000218203], 0, 2.61642, 1653061446], "v": "v0.6"}
{"i": [["[\"f1f88c1ddcda2fdfed7a61ba0c29695c\", [1, 512], [1024, 512], [1, 1024], [1, 1024]]", "cuda -keys=cuda,gpu -arch=sm_80 -max_num_threads=1024 -thread_warp_size=32", [-1, 16, 64, 49152, 2147483647, 1024, 8, 32], "", 0, []], [[], [["CI", 11], ["CI", 10], ["CI", 9], ["CI", 8], ["CI", 7], ["CI", 6], ["CI", 5], ["CI", 4], ["CHW", 2, "local"], ["SP", 2, 0, 1, [1, 1, 1, 1], 1], ["SP", 2, 5, 1024, [1, 128, 2, 2], 1], ["SP", 2, 10, 512, [2, 1], 1], ["RE", 2, [0, 5, 1, 6, 2, 7, 10, 11, 3, 8, 12, 4, 9]], ["FSP", 3, 0, 9, 3], ["FSP", 3, 4, 10, 3], ["RE", 3, [0, 4, 1, 5, 2, 6, 3, 7]], ["CA", 2, 3, 5], ["CHR", 1, "shared", [2]], ["CA", 2, 3, 6], ["CHR", 0, "shared", [3]], ["CA", 1, 4, 6], ["FU", 15, [0, 1]], ["SP", 15, 0, 1024, [32], 1], ["AN", 15, 0, 5], ["AN", 15, 1, 6], ["FU", 5, [0, 1]], ["AN", 5, 0, 5], ["FU", 5, [1, 2]], ["AN", 5, 1, 4], ["FU", 5, [2, 3]], ["AN", 5, 2, 6], ["FU", 3, [0, 1]], ["SP", 3, 0, 8, [1], 1], ["AN", 3, 1, 2], ["FFSP", 3, 0, [10, 9], 1, 1], ["AN", 3, 1, 6], ["FU", 1, [0, 1]], ["SP", 1, 0, 2, [1], 1], ["AN", 1, 1, 2], ["FFSP", 1, 0, [10, 9], 1, 1], ["AN", 1, 1, 6], ["PR", 4, 0, "auto_unroll_max_step$0"]]]], "r": [[0.000329585, 0.000329576], 0, 3.27899, 1653061448], "v": "v0.6"}
{"i": [["[\"f1f88c1ddcda2fdfed7a61ba0c29695c\", [1, 512], [1024, 512], [1, 1024], [1, 1024]]", "cuda -keys=cuda,gpu -arch=sm_80 -max_num_threads=1024 -thread_warp_size=32", [-1, 16, 64, 49152, 2147483647, 1024, 8, 32], "", 0, []], [[], [["CI", 11], ["CI", 10], ["CI", 9], ["CI", 8], ["CI", 7], ["CI", 6], ["CI", 5], ["CI", 4], ["CHW", 2, "local"], ["SP", 2, 0, 1, [1, 1, 1, 1], 1], ["SP", 2, 5, 1024, [8, 32, 1, 2], 1], ["SP", 2, 10, 512, [1, 16], 1], ["RE", 2, [0, 5, 1, 6, 2, 7, 10, 11, 3, 8, 12, 4, 9]], ["FSP", 3, 0, 9, 3], ["FSP", 3, 4, 10, 3], ["RE", 3, [0, 4, 1, 5, 2, 6, 3, 7]], ["CA", 2, 3, 5], ["CHR", 1, "shared", [2]], ["CA", 2, 3, 6], ["CHR", 0, "shared", [3]], ["CA", 1, 4, 6], ["FU", 15, [0, 1]], ["SP", 15, 0, 1024, [16], 1], ["AN", 15, 0, 5], ["AN", 15, 1, 6], ["FU", 5, [0, 1]], ["AN", 5, 0, 5], ["FU", 5, [1, 2]], ["AN", 5, 1, 4], ["FU", 5, [2, 3]], ["AN", 5, 2, 6], ["FU", 3, [0, 1]], ["SP", 3, 0, 4, [1], 1], ["AN", 3, 1, 2], ["FFSP", 3, 0, [10, 9], 1, 1], ["AN", 3, 1, 6], ["FU", 1, [0, 1]], ["SP", 1, 0, 2, [1], 1], ["AN", 1, 1, 2], ["FFSP", 1, 0, [10, 9], 1, 1], ["AN", 1, 1, 6], ["PR", 4, 0, "auto_unroll_max_step$64"]]]], "r": [[0.000507016, 0.00050704], 0, 3.16951, 1653061449], "v": "v0.6"}
{"i": [["[\"f1f88c1ddcda2fdfed7a61ba0c29695c\", [1, 512], [1024, 512], [1, 1024], [1, 1024]]", "cuda -keys=cuda,gpu -arch=sm_80 -max_num_threads=1024 -thread_warp_size=32", [-1, 16, 64, 49152, 2147483647, 1024, 8, 32], "", 0, []], [[], [["CI", 11], ["CI", 10], ["CI", 9], ["CI", 8], ["CI", 7], ["CI", 6], ["CI", 5], ["CI", 4], ["CHW", 2, "local"], ["SP", 2, 0, 1, [1, 1, 1, 1], 1], ["SP", 2, 5, 1024, [1, 256, 1, 1], 1], ["SP", 2, 10, 512, [1, 16], 1], ["RE", 2, [0, 5, 1, 6, 2, 7, 10, 11, 3, 8, 12, 4, 9]], ["FSP", 3, 0, 9, 3], ["FSP", 3, 4, 10, 3], ["RE", 3, [0, 4, 1, 5, 2, 6, 3, 7]], ["CA", 2, 3, 5], ["CHR", 1, "shared", [2]], ["CA", 2, 3, 6], ["CHR", 0, "shared", [3]], ["CA", 1, 4, 6], ["FU", 15, [0, 1]], ["SP", 15, 0, 1024, [16], 1], ["AN", 15, 0, 5], ["AN", 15, 1, 6], ["FU", 5, [0, 1]], ["AN", 5, 0, 5], ["FU", 5, [1, 2]], ["AN", 5, 1, 4], ["FU", 5, [2, 3]], ["AN", 5, 2, 6], ["FU", 3, [0, 1]], ["SP", 3, 0, 1, [1], 1], ["AN", 3, 1, 2], ["FFSP", 3, 0, [10, 9], 1, 1], ["AN", 3, 1, 6], ["FU", 1, [0, 1]], ["SP", 1, 0, 1, [1], 1], ["AN", 1, 1, 2], ["FFSP", 1, 0, [10, 9], 1, 1], ["AN", 1, 1, 6], ["PR", 4, 0, "auto_unroll_max_step$1024"]]]], "r": [[6.0456e-05, 6.04538e-05], 0, 2.52244, 1653061451], "v": "v0.6"}
{"i": [["[\"f1f88c1ddcda2fdfed7a61ba0c29695c\", [1, 512], [1024, 512], [1, 1024], [1, 1024]]", "cuda -keys=cuda,gpu -arch=sm_80 -max_num_threads=1024 -thread_warp_size=32", [-1, 16, 64, 49152, 2147483647, 1024, 8, 32], "", 0, []], [[], [["CI", 11], ["CI", 10], ["CI", 9], ["CI", 8], ["CI", 7], ["CI", 6], ["CI", 5], ["CI", 4], ["CHW", 2, "local"], ["SP", 2, 0, 1, [1, 1, 1, 1], 1], ["SP", 2, 5, 1024, [2, 64, 1, 4], 1], ["SP", 2, 10, 512, [2, 1], 1], ["RE", 2, [0, 5, 1, 6, 2, 7, 10, 11, 3, 8, 12, 4, 9]], ["FSP", 3, 0, 9, 3], ["FSP", 3, 4, 10, 3], ["RE", 3, [0, 4, 1, 5, 2, 6, 3, 7]], ["CA", 2, 3, 5], ["CHR", 1, "shared", [2]], ["CA", 2, 3, 6], ["CHR", 0, "shared", [3]], ["CA", 1, 4, 6], ["FU", 15, [0, 1]], ["SP", 15, 0, 1024, [2], 1], ["AN", 15, 0, 5], ["AN", 15, 1, 6], ["FU", 5, [0, 1]], ["AN", 5, 0, 5], ["FU", 5, [1, 2]], ["AN", 5, 1, 4], ["FU", 5, [2, 3]], ["AN", 5, 2, 6], ["FU", 3, [0, 1]], ["SP", 3, 0, 64, [1], 1], ["AN", 3, 1, 2], ["FFSP", 3, 0, [10, 9], 1, 1], ["AN", 3, 1, 6], ["FU", 1, [0, 1]], ["SP", 1, 0, 16, [1], 1], ["AN", 1, 1, 2], ["FFSP", 1, 0, [10, 9], 1, 1], ["AN", 1, 1, 6], ["PR", 4, 0, "auto_unroll_max_step$1024"]]]], "r": [[0.000420859, 0.000421256], 0, 2.79931, 1653061453], "v": "v0.6"}
{"i": [["[\"f1f88c1ddcda2fdfed7a61ba0c29695c\", [1, 512], [1024, 512], [1, 1024], [1, 1024]]", "cuda -keys=cuda,gpu -arch=sm_80 -max_num_threads=1024 -thread_warp_size=32", [-1, 16, 64, 49152, 2147483647, 1024, 8, 32], "", 0, []], [[], [["CI", 11], ["CI", 10], ["CI", 9], ["CI", 8], ["CI", 7], ["CI", 6], ["CI", 5], ["CI", 4], ["CHW", 2, "local"], ["SP", 2, 0, 1, [1, 1, 1, 1], 1], ["SP", 2, 5, 1024, [1, 64, 4, 4], 1], ["SP", 2, 10, 512, [8, 1], 1], ["RE", 2, [0, 5, 1, 6, 2, 7, 10, 11, 3, 8, 12, 4, 9]], ["FSP", 3, 0, 9, 3], ["FSP", 3, 4, 10, 3], ["RE", 3, [0, 4, 1, 5, 2, 6, 3, 7]], ["CA", 2, 3, 5], ["CHR", 1, "shared", [2]], ["CA", 2, 3, 6], ["CHR", 0, "shared", [3]], ["CA", 1, 4, 6], ["FU", 15, [0, 1]], ["SP", 15, 0, 1024, [32], 1], ["AN", 15, 0, 5], ["AN", 15, 1, 6], ["FU", 5, [0, 1]], ["AN", 5, 0, 5], ["FU", 5, [1, 2]], ["AN", 5, 1, 4], ["FU", 5, [2, 3]], ["AN", 5, 2, 6], ["FU", 3, [0, 1]], ["SP", 3, 0, 32, [1], 1], ["AN", 3, 1, 2], ["FFSP", 3, 0, [10, 9], 1, 1], ["AN", 3, 1, 6], ["FU", 1, [0, 1]], ["SP", 1, 0, 8, [4], 1], ["AN", 1, 1, 2], ["FFSP", 1, 0, [10, 9], 1, 1], ["AN", 1, 1, 6], ["PR", 4, 0, "auto_unroll_max_step$0"]]]], "r": [[0.000402744, 0.000402697], 0, 2.98471, 1653061454], "v": "v0.6"}
{"i": [["[\"f1f88c1ddcda2fdfed7a61ba0c29695c\", [1, 512], [1024, 512], [1, 1024], [1, 1024]]", "cuda -keys=cuda,gpu -arch=sm_80 -max_num_threads=1024 -thread_warp_size=32", [-1, 16, 64, 49152, 2147483647, 1024, 8, 32], "", 0, []], [[], [["CI", 11], ["CI", 10], ["CI", 9], ["CI", 8], ["CI", 7], ["CI", 6], ["CI", 5], ["CI", 4], ["CHW", 2, "local"], ["SP", 2, 0, 1, [1, 1, 1, 1], 1], ["SP", 2, 5, 1024, [4, 32, 2, 4], 1], ["SP", 2, 10, 512, [2, 2], 1], ["RE", 2, [0, 5, 1, 6, 2, 7, 10, 11, 3, 8, 12, 4, 9]], ["FSP", 3, 0, 9, 3], ["FSP", 3, 4, 10, 3], ["RE", 3, [0, 4, 1, 5, 2, 6, 3, 7]], ["CA", 2, 3, 5], ["CHR", 1, "shared", [2]], ["CA", 2, 3, 6], ["CHR", 0, "shared", [3]], ["CA", 1, 4, 6], ["FU", 15, [0, 1]], ["SP", 15, 0, 1024, [32], 1], ["AN", 15, 0, 5], ["AN", 15, 1, 6], ["FU", 5, [0, 1]], ["AN", 5, 0, 5], ["FU", 5, [1, 2]], ["AN", 5, 1, 4], ["FU", 5, [2, 3]], ["AN", 5, 2, 6], ["FU", 3, [0, 1]], ["SP", 3, 0, 32, [1], 1], ["AN", 3, 1, 2], ["FFSP", 3, 0, [10, 9], 1, 1], ["AN", 3, 1, 6], ["FU", 1, [0, 1]], ["SP", 1, 0, 4, [1], 1], ["AN", 1, 1, 2], ["FFSP", 1, 0, [10, 9], 1, 1], ["AN", 1, 1, 6], ["PR", 4, 0, "auto_unroll_max_step$64"]]]], "r": [[0.000787181, 0.000787488], 0, 2.88047, 1653061456], "v": "v0.6"}
{"i": [["[\"f1f88c1ddcda2fdfed7a61ba0c29695c\", [1, 512], [1024, 512], [1, 1024], [1, 1024]]", "cuda -keys=cuda,gpu -arch=sm_80 -max_num_threads=1024 -thread_warp_size=32", [-1, 16, 64, 49152, 2147483647, 1024, 8, 32], "", 0, []], [[], [["CI", 11], ["CI", 10], ["CI", 9], ["CI", 8], ["CI", 7], ["CI", 6], ["CI", 5], ["CI", 4], ["CHW", 2, "local"], ["SP", 2, 0, 1, [1, 1, 1, 1], 1], ["SP", 2, 5, 1024, [2, 32, 1, 1], 1], ["SP", 2, 10, 512, [64, 1], 1], ["RE", 2, [0, 5, 1, 6, 2, 7, 10, 11, 3, 8, 12, 4, 9]], ["FSP", 3, 0, 9, 3], ["FSP", 3, 4, 10, 3], ["RE", 3, [0, 4, 1, 5, 2, 6, 3, 7]], ["CA", 2, 3, 5], ["CHR", 1, "shared", [2]], ["CA", 2, 3, 6], ["CHR", 0, "shared", [3]], ["CA", 1, 4, 6], ["FU", 15, [0, 1]], ["SP", 15, 0, 1024, [32], 1], ["AN", 15, 0, 5], ["AN", 15, 1, 6], ["FU", 5, [0, 1]], ["AN", 5, 0, 5], ["FU", 5, [1, 2]], ["AN", 5, 1, 4], ["FU", 5, [2, 3]], ["AN", 5, 2, 6], ["FU", 3, [0, 1]], ["SP", 3, 0, 128, [1], 1], ["AN", 3, 1, 2], ["FFSP", 3, 0, [10, 9], 1, 1], ["AN", 3, 1, 6], ["FU", 1, [0, 1]], ["SP", 1, 0, 64, [4], 1], ["AN", 1, 1, 2], ["FFSP", 1, 0, [10, 9], 1, 1], ["AN", 1, 1, 6], ["PR", 4, 0, "auto_unroll_max_step$512"]]]], "r": [[4.6654e-05, 4.66559e-05], 0, 3.43399, 1653061457], "v": "v0.6"}
{"i": [["[\"f1f88c1ddcda2fdfed7a61ba0c29695c\", [1, 512], [1024, 512], [1, 1024], [1, 1024]]", "cuda -keys=cuda,gpu -arch=sm_80 -max_num_threads=1024 -thread_warp_size=32", [-1, 16, 64, 49152, 2147483647, 1024, 8, 32], "", 0, []], [[], [["CI", 11], ["CI", 10], ["CI", 9], ["CI", 8], ["CI", 7], ["CI", 6], ["CI", 5], ["CI", 4], ["CHW", 2, "local"], ["SP", 2, 0, 1, [1, 1, 1, 1], 1], ["SP", 2, 5, 1024, [4, 32, 2, 1], 1], ["SP", 2, 10, 512, [2, 2], 1], ["RE", 2, [0, 5, 1, 6, 2, 7, 10, 11, 3, 8, 12, 4, 9]], ["FSP", 3, 0, 9, 3], ["FSP", 3, 4, 10, 3], ["RE", 3, [0, 4, 1, 5, 2, 6, 3, 7]], ["CA", 2, 3, 5], ["CHR", 1, "shared", [2]], ["CA", 2, 3, 6], ["CHR", 0, "shared", [3]], ["CA", 1, 4, 6], ["FU", 15, [0, 1]], ["SP", 15, 0, 1024, [64], 1], ["AN", 15, 0, 5], ["AN", 15, 1, 6], ["FU", 5, [0, 1]], ["AN", 5, 0, 5], ["FU", 5, [1, 2]], ["AN", 5, 1, 4], ["FU", 5, [2, 3]], ["AN", 5, 2, 6], ["FU", 3, [0, 1]], ["SP", 3, 0, 8, [1], 1], ["AN", 3, 1, 2], ["FFSP", 3, 0, [10, 9], 1, 1], ["AN", 3, 1, 6], ["FU", 1, [0, 1]], ["SP", 1, 0, 4, [4], 1], ["AN", 1, 1, 2], ["FFSP", 1, 0, [10, 9], 1, 1], ["AN", 1, 1, 6], ["PR", 4, 0, "auto_unroll_max_step$16"]]]], "r": [[0.000153574, 0.000153574], 0, 2.75577, 1653061459], "v": "v0.6"}
{"i": [["[\"f1f88c1ddcda2fdfed7a61ba0c29695c\", [1, 512], [1024, 512], [1, 1024], [1, 1024]]", "cuda -keys=cuda,gpu -arch=sm_80 -max_num_threads=1024 -thread_warp_size=32", [-1, 16, 64, 49152, 2147483647, 1024, 8, 32], "", 0, []], [[], [["CI", 11], ["CI", 10], ["CI", 9], ["CI", 8], ["CI", 7], ["CI", 6], ["CI", 5], ["CI", 4], ["CHW", 2, "local"], ["SP", 2, 0, 1, [1, 1, 1, 1], 1], ["SP", 2, 5, 1024, [1, 128, 8, 1], 1], ["SP", 2, 10, 512, [1, 4], 1], ["RE", 2, [0, 5, 1, 6, 2, 7, 10, 11, 3, 8, 12, 4, 9]], ["FSP", 3, 0, 9, 3], ["FSP", 3, 4, 10, 3], ["RE", 3, [0, 4, 1, 5, 2, 6, 3, 7]], ["CA", 2, 3, 5], ["CHR", 1, "shared", [2]], ["CA", 2, 3, 6], ["CHR", 0, "shared", [3]], ["CA", 1, 4, 6], ["FU", 15, [0, 1]], ["SP", 15, 0, 1024, [64], 1], ["AN", 15, 0, 5], ["AN", 15, 1, 6], ["FU", 5, [0, 1]], ["AN", 5, 0, 5], ["FU", 5, [1, 2]], ["AN", 5, 1, 4], ["FU", 5, [2, 3]], ["AN", 5, 2, 6], ["FU", 3, [0, 1]], ["SP", 3, 0, 32, [1], 1], ["AN", 3, 1, 2], ["FFSP", 3, 0, [10, 9], 1, 1], ["AN", 3, 1, 6], ["FU", 1, [0, 1]], ["SP", 1, 0, 4, [1], 1], ["AN", 1, 1, 2], ["FFSP", 1, 0, [10, 9], 1, 1], ["AN", 1, 1, 6], ["PR", 4, 0, "auto_unroll_max_step$512"]]]], "r": [[0.000442696, 0.000442586], 0, 2.74955, 1653061461], "v": "v0.6"}
{"i": [["[\"f1f88c1ddcda2fdfed7a61ba0c29695c\", [1, 512], [1024, 512], [1, 1024], [1, 1024]]", "cuda -keys=cuda,gpu -arch=sm_80 -max_num_threads=1024 -thread_warp_size=32", [-1, 16, 64, 49152, 2147483647, 1024, 8, 32], "", 0, []], [[], [["CI", 11], ["CI", 10], ["CI", 9], ["CI", 8], ["CI", 7], ["CI", 6], ["CI", 5], ["CI", 4], ["CHW", 2, "local"], ["SP", 2, 0, 1, [1, 1, 1, 1], 1], ["SP", 2, 5, 1024, [1, 32, 1, 2], 1], ["SP", 2, 10, 512, [2, 1], 1], ["RE", 2, [0, 5, 1, 6, 2, 7, 10, 11, 3, 8, 12, 4, 9]], ["FSP", 3, 0, 9, 3], ["FSP", 3, 4, 10, 3], ["RE", 3, [0, 4, 1, 5, 2, 6, 3, 7]], ["CA", 2, 3, 5], ["CHR", 1, "shared", [2]], ["CA", 2, 3, 6], ["CHR", 0, "shared", [3]], ["CA", 1, 4, 6], ["FU", 15, [0, 1]], ["SP", 15, 0, 1024, [32], 1], ["AN", 15, 0, 5], ["AN", 15, 1, 6], ["FU", 5, [0, 1]], ["AN", 5, 0, 5], ["FU", 5, [1, 2]], ["AN", 5, 1, 4], ["FU", 5, [2, 3]], ["AN", 5, 2, 6], ["FU", 3, [0, 1]], ["SP", 3, 0, 128, [1], 1], ["AN", 3, 1, 2], ["FFSP", 3, 0, [10, 9], 1, 1], ["AN", 3, 1, 6], ["FU", 1, [0, 1]], ["SP", 1, 0, 64, [1], 1], ["AN", 1, 1, 2], ["FFSP", 1, 0, [10, 9], 1, 1], ["AN", 1, 1, 6], ["PR", 4, 0, "auto_unroll_max_step$16"]]]], "r": [[8.01884e-05, 8.01608e-05], 0, 2.59751, 1653061462], "v": "v0.6"}
{"i": [["[\"f1f88c1ddcda2fdfed7a61ba0c29695c\", [1, 512], [1024, 512], [1, 1024], [1, 1024]]", "cuda -keys=cuda,gpu -arch=sm_80 -max_num_threads=1024 -thread_warp_size=32", [-1, 16, 64, 49152, 2147483647, 1024, 8, 32], "", 0, []], [[], [["CI", 11], ["CI", 10], ["CI", 9], ["CI", 8], ["CI", 7], ["CI", 6], ["CI", 5], ["CI", 4], ["CHW", 2, "local"], ["SP", 2, 0, 1, [1, 1, 1, 1], 1], ["SP", 2, 5, 1024, [1, 2, 2, 4], 1], ["SP", 2, 10, 512, [1, 2], 1], ["RE", 2, [0, 5, 1, 6, 2, 7, 10, 11, 3, 8, 12, 4, 9]], ["FSP", 3, 0, 9, 3], ["FSP", 3, 4, 10, 3], ["RE", 3, [0, 4, 1, 5, 2, 6, 3, 7]], ["CA", 2, 3, 5], ["CHR", 1, "shared", [2]], ["CA", 2, 3, 6], ["CHR", 0, "shared", [3]], ["CA", 1, 4, 6], ["FU", 15, [0, 1]], ["SP", 15, 0, 1024, [64], 1], ["AN", 15, 0, 5], ["AN", 15, 1, 6], ["FU", 5, [0, 1]], ["AN", 5, 0, 5], ["FU", 5, [1, 2]], ["AN", 5, 1, 4], ["FU", 5, [2, 3]], ["AN", 5, 2, 6], ["FU", 3, [0, 1]], ["SP", 3, 0, 128, [1], 1], ["AN", 3, 1, 2], ["FFSP", 3, 0, [10, 9], 1, 1], ["AN", 3, 1, 6], ["FU", 1, [0, 1]], ["SP", 1, 0, 16, [1], 1], ["AN", 1, 1, 2], ["FFSP", 1, 0, [10, 9], 1, 1], ["AN", 1, 1, 6], ["PR", 4, 0, "auto_unroll_max_step$512"]]]], "r": [[0.000120307, 0.000120314], 0, 2.39067, 1653061464], "v": "v0.6"}
{"i": [["[\"f1f88c1ddcda2fdfed7a61ba0c29695c\", [1, 512], [1024, 512], [1, 1024], [1, 1024]]", "cuda -keys=cuda,gpu -arch=sm_80 -max_num_threads=1024 -thread_warp_size=32", [-1, 16, 64, 49152, 2147483647, 1024, 8, 32], "", 0, []], [[], [["CI", 11], ["CI", 10], ["CI", 9], ["CI", 8], ["CI", 7], ["CI", 6], ["CI", 5], ["CI", 4], ["CHW", 2, "local"], ["SP", 2, 0, 1, [1, 1, 1, 1], 1], ["SP", 2, 5, 1024, [2, 512, 1, 1], 1], ["SP", 2, 10, 512, [8, 1], 1], ["RE", 2, [0, 5, 1, 6, 2, 7, 10, 11, 3, 8, 12, 4, 9]], ["FSP", 3, 0, 9, 3], ["FSP", 3, 4, 10, 3], ["RE", 3, [0, 4, 1, 5, 2, 6, 3, 7]], ["CA", 2, 3, 5], ["CHR", 1, "shared", [2]], ["CA", 2, 3, 6], ["CHR", 0, "shared", [3]], ["CA", 1, 4, 6], ["FU", 15, [0, 1]], ["SP", 15, 0, 1024, [1], 1], ["AN", 15, 0, 5], ["AN", 15, 1, 6], ["FU", 5, [0, 1]], ["AN", 5, 0, 5], ["FU", 5, [1, 2]], ["AN", 5, 1, 4], ["FU", 5, [2, 3]], ["AN", 5, 2, 6], ["FU", 3, [0, 1]], ["SP", 3, 0, 8, [1], 1], ["AN", 3, 1, 2], ["FFSP", 3, 0, [10, 9], 1, 1], ["AN", 3, 1, 6], ["FU", 1, [0, 1]], ["SP", 1, 0, 8, [1], 1], ["AN", 1, 1, 2], ["FFSP", 1, 0, [10, 9], 1, 1], ["AN", 1, 1, 6], ["PR", 4, 0, "auto_unroll_max_step$16"]]]], "r": [[0.000190998, 0.000191001], 0, 2.70451, 1653061466], "v": "v0.6"}
{"i": [["[\"f1f88c1ddcda2fdfed7a61ba0c29695c\", [1, 512], [1024, 512], [1, 1024], [1, 1024]]", "cuda -keys=cuda,gpu -arch=sm_80 -max_num_threads=1024 -thread_warp_size=32", [-1, 16, 64, 49152, 2147483647, 1024, 8, 32], "", 0, []], [[], [["CI", 11], ["CI", 10], ["CI", 9], ["CI", 8], ["CI", 7], ["CI", 6], ["CI", 5], ["CI", 4], ["CHW", 2, "local"], ["SP", 2, 0, 1, [1, 1, 1, 1], 1], ["SP", 2, 5, 1024, [2, 64, 1, 1], 1], ["SP", 2, 10, 512, [1, 1], 1], ["RE", 2, [0, 5, 1, 6, 2, 7, 10, 11, 3, 8, 12, 4, 9]], ["FSP", 3, 0, 9, 3], ["FSP", 3, 4, 10, 3], ["RE", 3, [0, 4, 1, 5, 2, 6, 3, 7]], ["CA", 2, 3, 5], ["CHR", 1, "shared", [2]], ["CA", 2, 3, 6], ["CHR", 0, "shared", [3]], ["CA", 1, 4, 6], ["FU", 15, [0, 1]], ["SP", 15, 0, 1024, [64], 1], ["AN", 15, 0, 5], ["AN", 15, 1, 6], ["FU", 5, [0, 1]], ["AN", 5, 0, 5], ["FU", 5, [1, 2]], ["AN", 5, 1, 4], ["FU", 5, [2, 3]], ["AN", 5, 2, 6], ["FU", 3, [0, 1]], ["SP", 3, 0, 8, [1], 1], ["AN", 3, 1, 2], ["FFSP", 3, 0, [10, 9], 1, 1], ["AN", 3, 1, 6], ["FU", 1, [0, 1]], ["SP", 1, 0, 8, [1], 1], ["AN", 1, 1, 2], ["FFSP", 1, 0, [10, 9], 1, 1], ["AN", 1, 1, 6], ["PR", 4, 0, "auto_unroll_max_step$1024"]]]], "r": [[0.000163323, 0.000163322], 0, 2.56238, 1653061467], "v": "v0.6"}
{"i": [["[\"f1f88c1ddcda2fdfed7a61ba0c29695c\", [1, 512], [1024, 512], [1, 1024], [1, 1024]]", "cuda -keys=cuda,gpu -arch=sm_80 -max_num_threads=1024 -thread_warp_size=32", [-1, 16, 64, 49152, 2147483647, 1024, 8, 32], "", 0, []], [[], [["CI", 11], ["CI", 10], ["CI", 9], ["CI", 8], ["CI", 7], ["CI", 6], ["CI", 5], ["CI", 4], ["CHW", 2, "local"], ["SP", 2, 0, 1, [1, 1, 1, 1], 1], ["SP", 2, 5, 1024, [4, 128, 1, 2], 1], ["SP", 2, 10, 512, [2, 2], 1], ["RE", 2, [0, 5, 1, 6, 2, 7, 10, 11, 3, 8, 12, 4, 9]], ["FSP", 3, 0, 9, 3], ["FSP", 3, 4, 10, 3], ["RE", 3, [0, 4, 1, 5, 2, 6, 3, 7]], ["CA", 2, 3, 5], ["CHR", 1, "shared", [2]], ["CA", 2, 3, 6], ["CHR", 0, "shared", [3]], ["CA", 1, 4, 6], ["FU", 15, [0, 1]], ["SP", 15, 0, 1024, [1], 1], ["AN", 15, 0, 5], ["AN", 15, 1, 6], ["FU", 5, [0, 1]], ["AN", 5, 0, 5], ["FU", 5, [1, 2]], ["AN", 5, 1, 4], ["FU", 5, [2, 3]], ["AN", 5, 2, 6], ["FU", 3, [0, 1]], ["SP", 3, 0, 8, [1], 1], ["AN", 3, 1, 2], ["FFSP", 3, 0, [10, 9], 1, 1], ["AN", 3, 1, 6], ["FU", 1, [0, 1]], ["SP", 1, 0, 4, [4], 1], ["AN", 1, 1, 2], ["FFSP", 1, 0, [10, 9], 1, 1], ["AN", 1, 1, 6], ["PR", 4, 0, "auto_unroll_max_step$1024"]]]], "r": [[0.000321491, 0.000321486], 0, 2.61618, 1653061469], "v": "v0.6"}
{"i": [["[\"f1f88c1ddcda2fdfed7a61ba0c29695c\", [1, 512], [1024, 512], [1, 1024], [1, 1024]]", "cuda -keys=cuda,gpu -arch=sm_80 -max_num_threads=1024 -thread_warp_size=32", [-1, 16, 64, 49152, 2147483647, 1024, 8, 32], "", 0, []], [[], [["CI", 11], ["CI", 10], ["CI", 9], ["CI", 8], ["CI", 7], ["CI", 6], ["CI", 5], ["CI", 4], ["CHW", 2, "local"], ["SP", 2, 0, 1, [1, 1, 1, 1], 1], ["SP", 2, 5, 1024, [1, 256, 2, 1], 1], ["SP", 2, 10, 512, [2, 2], 1], ["RE", 2, [0, 5, 1, 6, 2, 7, 10, 11, 3, 8, 12, 4, 9]], ["FSP", 3, 0, 9, 3], ["FSP", 3, 4, 10, 3], ["RE", 3, [0, 4, 1, 5, 2, 6, 3, 7]], ["CA", 2, 3, 5], ["CHR", 1, "shared", [2]], ["CA", 2, 3, 6], ["CHR", 0, "shared", [3]], ["CA", 1, 4, 6], ["FU", 15, [0, 1]], ["SP", 15, 0, 1024, [64], 1], ["AN", 15, 0, 5], ["AN", 15, 1, 6], ["FU", 5, [0, 1]], ["AN", 5, 0, 5], ["FU", 5, [1, 2]], ["AN", 5, 1, 4], ["FU", 5, [2, 3]], ["AN", 5, 2, 6], ["FU", 3, [0, 1]], ["SP", 3, 0, 32, [1], 1], ["AN", 3, 1, 2], ["FFSP", 3, 0, [10, 9], 1, 1], ["AN", 3, 1, 6], ["FU", 1, [0, 1]], ["SP", 1, 0, 16, [1], 1], ["AN", 1, 1, 2], ["FFSP", 1, 0, [10, 9], 1, 1], ["AN", 1, 1, 6], ["PR", 4, 0, "auto_unroll_max_step$1024"]]]], "r": [[0.000162704, 0.000162712], 0, 2.59399, 1653061470], "v": "v0.6"}
{"i": [["[\"f1f88c1ddcda2fdfed7a61ba0c29695c\", [1, 512], [1024, 512], [1, 1024], [1, 1024]]", "cuda -keys=cuda,gpu -arch=sm_80 -max_num_threads=1024 -thread_warp_size=32", [-1, 16, 64, 49152, 2147483647, 1024, 8, 32], "", 0, []], [[], [["CI", 11], ["CI", 10], ["CI", 9], ["CI", 8], ["CI", 7], ["CI", 6], ["CI", 5], ["CI", 4], ["CHW", 2, "local"], ["SP", 2, 0, 1, [1, 1, 1, 1], 1], ["SP", 2, 5, 1024, [4, 32, 2, 4], 1], ["SP", 2, 10, 512, [1, 2], 1], ["RE", 2, [0, 5, 1, 6, 2, 7, 10, 11, 3, 8, 12, 4, 9]], ["FSP", 3, 0, 9, 3], ["FSP", 3, 4, 10, 3], ["RE", 3, [0, 4, 1, 5, 2, 6, 3, 7]], ["CA", 2, 3, 5], ["CHR", 1, "shared", [2]], ["CA", 2, 3, 6], ["CHR", 0, "shared", [3]], ["CA", 1, 4, 6], ["FU", 15, [0, 1]], ["SP", 15, 0, 1024, [32], 1], ["AN", 15, 0, 5], ["AN", 15, 1, 6], ["FU", 5, [0, 1]], ["AN", 5, 0, 5], ["FU", 5, [1, 2]], ["AN", 5, 1, 4], ["FU", 5, [2, 3]], ["AN", 5, 2, 6], ["FU", 3, [0, 1]], ["SP", 3, 0, 32, [1], 1], ["AN", 3, 1, 2], ["FFSP", 3, 0, [10, 9], 1, 1], ["AN", 3, 1, 6], ["FU", 1, [0, 1]], ["SP", 1, 0, 4, [1], 1], ["AN", 1, 1, 2], ["FFSP", 1, 0, [10, 9], 1, 1], ["AN", 1, 1, 6], ["PR", 4, 0, "auto_unroll_max_step$64"]]]], "r": [[0.000958113, 0.000958327], 0, 2.64074, 1653061472], "v": "v0.6"}
{"i": [["[\"f1f88c1ddcda2fdfed7a61ba0c29695c\", [1, 512], [1024, 512], [1, 1024], [1, 1024]]", "cuda -keys=cuda,gpu -arch=sm_80 -max_num_threads=1024 -thread_warp_size=32", [-1, 16, 64, 49152, 2147483647, 1024, 8, 32], "", 0, []], [[], [["CI", 11], ["CI", 10], ["CI", 9], ["CI", 8], ["CI", 7], ["CI", 6], ["CI", 5], ["CI", 4], ["CHW", 2, "local"], ["SP", 2, 0, 1, [1, 1, 1, 1], 1], ["SP", 2, 5, 1024, [1, 2, 1, 64], 1], ["SP", 2, 10, 512, [1, 4], 1], ["RE", 2, [0, 5, 1, 6, 2, 7, 10, 11, 3, 8, 12, 4, 9]], ["FSP", 3, 0, 9, 3], ["FSP", 3, 4, 10, 3], ["RE", 3, [0, 4, 1, 5, 2, 6, 3, 7]], ["CA", 2, 3, 5], ["CHR", 1, "shared", [2]], ["CA", 2, 3, 6], ["CHR", 0, "shared", [3]], ["CA", 1, 4, 6], ["FU", 15, [0, 1]], ["SP", 15, 0, 1024, [64], 1], ["AN", 15, 0, 5], ["AN", 15, 1, 6], ["FU", 5, [0, 1]], ["AN", 5, 0, 5], ["FU", 5, [1, 2]], ["AN", 5, 1, 4], ["FU", 5, [2, 3]], ["AN", 5, 2, 6], ["FU", 3, [0, 1]], ["SP", 3, 0, 8, [1], 1], ["AN", 3, 1, 2], ["FFSP", 3, 0, [10, 9], 1, 1], ["AN", 3, 1, 6], ["FU", 1, [0, 1]], ["SP", 1, 0, 4, [1], 1], ["AN", 1, 1, 2], ["FFSP", 1, 0, [10, 9], 1, 1], ["AN", 1, 1, 6], ["PR", 4, 0, "auto_unroll_max_step$1024"]]]], "r": [[0.000755596, 0.000755564], 0, 4.08876, 1653061474], "v": "v0.6"}
{"i": [["[\"f1f88c1ddcda2fdfed7a61ba0c29695c\", [1, 512], [1024, 512], [1, 1024], [1, 1024]]", "cuda -keys=cuda,gpu -arch=sm_80 -max_num_threads=1024 -thread_warp_size=32", [-1, 16, 64, 49152, 2147483647, 1024, 8, 32], "", 0, []], [[], [["CI", 11], ["CI", 10], ["CI", 9], ["CI", 8], ["CI", 7], ["CI", 6], ["CI", 5], ["CI", 4], ["CHW", 2, "local"], ["SP", 2, 0, 1, [1, 1, 1, 1], 1], ["SP", 2, 5, 1024, [8, 32, 1, 2], 1], ["SP", 2, 10, 512, [1, 2], 1], ["RE", 2, [0, 5, 1, 6, 2, 7, 10, 11, 3, 8, 12, 4, 9]], ["FSP", 3, 0, 9, 3], ["FSP", 3, 4, 10, 3], ["RE", 3, [0, 4, 1, 5, 2, 6, 3, 7]], ["CA", 2, 3, 5], ["CHR", 1, "shared", [2]], ["CA", 2, 3, 6], ["CHR", 0, "shared", [3]], ["CA", 1, 4, 6], ["FU", 15, [0, 1]], ["SP", 15, 0, 1024, [32], 1], ["AN", 15, 0, 5], ["AN", 15, 1, 6], ["FU", 5, [0, 1]], ["AN", 5, 0, 5], ["FU", 5, [1, 2]], ["AN", 5, 1, 4], ["FU", 5, [2, 3]], ["AN", 5, 2, 6], ["FU", 3, [0, 1]], ["SP", 3, 0, 4, [2], 1], ["AN", 3, 1, 2], ["FFSP", 3, 0, [10, 9], 1, 1], ["AN", 3, 1, 6], ["FU", 1, [0, 1]], ["SP", 1, 0, 2, [1], 1], ["AN", 1, 1, 2], ["FFSP", 1, 0, [10, 9], 1, 1], ["AN", 1, 1, 6], ["PR", 4, 0, "auto_unroll_max_step$64"]]]], "r": [[0.000378109, 0.00037836], 0, 2.63879, 1653061475], "v": "v0.6"}
{"i": [["[\"f1f88c1ddcda2fdfed7a61ba0c29695c\", [1, 512], [1024, 512], [1, 1024], [1, 1024]]", "cuda -keys=cuda,gpu -arch=sm_80 -max_num_threads=1024 -thread_warp_size=32", [-1, 16, 64, 49152, 2147483647, 1024, 8, 32], "", 0, []], [[], [["CI", 11], ["CI", 10], ["CI", 9], ["CI", 8], ["CI", 7], ["CI", 6], ["CI", 5], ["CI", 4], ["CHW", 2, "local"], ["SP", 2, 0, 1, [1, 1, 1, 1], 1], ["SP", 2, 5, 1024, [2, 2, 32, 8], 1], ["SP", 2, 10, 512, [2, 1], 1], ["RE", 2, [0, 5, 1, 6, 2, 7, 10, 11, 3, 8, 12, 4, 9]], ["FSP", 3, 0, 9, 3], ["FSP", 3, 4, 10, 3], ["RE", 3, [0, 4, 1, 5, 2, 6, 3, 7]], ["CA", 2, 3, 5], ["CHR", 1, "shared", [2]], ["CA", 2, 3, 6], ["CHR", 0, "shared", [3]], ["CA", 1, 4, 6], ["FU", 15, [0, 1]], ["SP", 15, 0, 1024, [32], 1], ["AN", 15, 0, 5], ["AN", 15, 1, 6], ["FU", 5, [0, 1]], ["AN", 5, 0, 5], ["FU", 5, [1, 2]], ["AN", 5, 1, 4], ["FU", 5, [2, 3]], ["AN", 5, 2, 6], ["FU", 3, [0, 1]], ["SP", 3, 0, 32, [1], 1], ["AN", 3, 1, 2], ["FFSP", 3, 0, [10, 9], 1, 1], ["AN", 3, 1, 6], ["FU", 1, [0, 1]], ["SP", 1, 0, 2, [1], 1], ["AN", 1, 1, 2], ["FFSP", 1, 0, [10, 9], 1, 1], ["AN", 1, 1, 6], ["PR", 4, 0, "auto_unroll_max_step$0"]]]], "r": [[0.0103094, 0.0103105], 0, 2.31324, 1653061477], "v": "v0.6"}
{"i": [["[\"f1f88c1ddcda2fdfed7a61ba0c29695c\", [1, 512], [1024, 512], [1, 1024], [1, 1024]]", "cuda -keys=cuda,gpu -arch=sm_80 -max_num_threads=1024 -thread_warp_size=32", [-1, 16, 64, 49152, 2147483647, 1024, 8, 32], "", 0, []], [[], [["CI", 11], ["CI", 10], ["CI", 9], ["CI", 8], ["CI", 7], ["CI", 6], ["CI", 5], ["CI", 4], ["CHW", 2, "local"], ["SP", 2, 0, 1, [1, 1, 1, 1], 1], ["SP", 2, 5, 1024, [1, 256, 1, 1], 1], ["SP", 2, 10, 512, [2, 1], 1], ["RE", 2, [0, 5, 1, 6, 2, 7, 10, 11, 3, 8, 12, 4, 9]], ["FSP", 3, 0, 9, 3], ["FSP", 3, 4, 10, 3], ["RE", 3, [0, 4, 1, 5, 2, 6, 3, 7]], ["CA", 2, 3, 5], ["CHR", 1, "shared", [2]], ["CA", 2, 3, 6], ["CHR", 0, "shared", [3]], ["CA", 1, 4, 6], ["FU", 15, [0, 1]], ["SP", 15, 0, 1024, [64], 1], ["AN", 15, 0, 5], ["AN", 15, 1, 6], ["FU", 5, [0, 1]], ["AN", 5, 0, 5], ["FU", 5, [1, 2]], ["AN", 5, 1, 4], ["FU", 5, [2, 3]], ["AN", 5, 2, 6], ["FU", 3, [0, 1]], ["SP", 3, 0, 1, [1], 1], ["AN", 3, 1, 2], ["FFSP", 3, 0, [10, 9], 1, 1], ["AN", 3, 1, 6], ["FU", 1, [0, 1]], ["SP", 1, 0, 1, [1], 1], ["AN", 1, 1, 2], ["FFSP", 1, 0, [10, 9], 1, 1], ["AN", 1, 1, 6], ["PR", 4, 0, "auto_unroll_max_step$16"]]]], "r": [[0.000148209, 0.000148198], 0, 2.21164, 1653061479], "v": "v0.6"}
{"i": [["[\"f1f88c1ddcda2fdfed7a61ba0c29695c\", [1, 512], [1024, 512], [1, 1024], [1, 1024]]", "cuda -keys=cuda,gpu -arch=sm_80 -max_num_threads=1024 -thread_warp_size=32", [-1, 16, 64, 49152, 2147483647, 1024, 8, 32], "", 0, []], [[], [["CI", 11], ["CI", 10], ["CI", 9], ["CI", 8], ["CI", 7], ["CI", 6], ["CI", 5], ["CI", 4], ["CHW", 2, "local"], ["SP", 2, 0, 1, [1, 1, 1, 1], 1], ["SP", 2, 5, 1024, [4, 32, 2, 1], 1], ["SP", 2, 10, 512, [2, 2], 1], ["RE", 2, [0, 5, 1, 6, 2, 7, 10, 11, 3, 8, 12, 4, 9]], ["FSP", 3, 0, 9, 3], ["FSP", 3, 4, 10, 3], ["RE", 3, [0, 4, 1, 5, 2, 6, 3, 7]], ["CA", 2, 3, 5], ["CHR", 1, "shared", [2]], ["CA", 2, 3, 6], ["CHR", 0, "shared", [3]], ["CA", 1, 4, 6], ["FU", 15, [0, 1]], ["SP", 15, 0, 1024, [32], 1], ["AN", 15, 0, 5], ["AN", 15, 1, 6], ["FU", 5, [0, 1]], ["AN", 5, 0, 5], ["FU", 5, [1, 2]], ["AN", 5, 1, 4], ["FU", 5, [2, 3]], ["AN", 5, 2, 6], ["FU", 3, [0, 1]], ["SP", 3, 0, 8, [2], 1], ["AN", 3, 1, 2], ["FFSP", 3, 0, [10, 9], 1, 1], ["AN", 3, 1, 6], ["FU", 1, [0, 1]], ["SP", 1, 0, 4, [4], 1], ["AN", 1, 1, 2], ["FFSP", 1, 0, [10, 9], 1, 1], ["AN", 1, 1, 6], ["PR", 4, 0, "auto_unroll_max_step$16"]]]], "r": [[0.000144156, 0.000144158], 0, 2.40009, 1653061481], "v": "v0.6"}
{"i": [["[\"f1f88c1ddcda2fdfed7a61ba0c29695c\", [1, 512], [1024, 512], [1, 1024], [1, 1024]]", "cuda -keys=cuda,gpu -arch=sm_80 -max_num_threads=1024 -thread_warp_size=32", [-1, 16, 64, 49152, 2147483647, 1024, 8, 32], "", 0, []], [[], [["CI", 11], ["CI", 10], ["CI", 9], ["CI", 8], ["CI", 7], ["CI", 6], ["CI", 5], ["CI", 4], ["CHW", 2, "local"], ["SP", 2, 0, 1, [1, 1, 1, 1], 1], ["SP", 2, 5, 1024, [2, 16, 4, 4], 1], ["SP", 2, 10, 512, [2, 8], 1], ["RE", 2, [0, 5, 1, 6, 2, 7, 10, 11, 3, 8, 12, 4, 9]], ["FSP", 3, 0, 9, 3], ["FSP", 3, 4, 10, 3], ["RE", 3, [0, 4, 1, 5, 2, 6, 3, 7]], ["CA", 2, 3, 5], ["CHR", 1, "shared", [2]], ["CA", 2, 3, 6], ["CHR", 0, "shared", [3]], ["CA", 1, 4, 6], ["FU", 15, [0, 1]], ["SP", 15, 0, 1024, [8], 1], ["AN", 15, 0, 5], ["AN", 15, 1, 6], ["FU", 5, [0, 1]], ["AN", 5, 0, 5], ["FU", 5, [1, 2]], ["AN", 5, 1, 4], ["FU", 5, [2, 3]], ["AN", 5, 2, 6], ["FU", 3, [0, 1]], ["SP", 3, 0, 64, [1], 1], ["AN", 3, 1, 2], ["FFSP", 3, 0, [10, 9], 1, 1], ["AN", 3, 1, 6], ["FU", 1, [0, 1]], ["SP", 1, 0, 16, [1], 1], ["AN", 1, 1, 2], ["FFSP", 1, 0, [10, 9], 1, 1], ["AN", 1, 1, 6], ["PR", 4, 0, "auto_unroll_max_step$1024"]]]], "r": [[0.000394329, 0.00039435], 0, 5.41217, 1653061482], "v": "v0.6"}
{"i": [["[\"f1f88c1ddcda2fdfed7a61ba0c29695c\", [1, 512], [1024, 512], [1, 1024], [1, 1024]]", "cuda -keys=cuda,gpu -arch=sm_80 -max_num_threads=1024 -thread_warp_size=32", [-1, 16, 64, 49152, 2147483647, 1024, 8, 32], "", 0, []], [[], [["CI", 11], ["CI", 10], ["CI", 9], ["CI", 8], ["CI", 7], ["CI", 6], ["CI", 5], ["CI", 4], ["CHW", 2, "local"], ["SP", 2, 0, 1, [1, 1, 1, 1], 1], ["SP", 2, 5, 1024, [8, 32, 1, 4], 1], ["SP", 2, 10, 512, [1, 2], 1], ["RE", 2, [0, 5, 1, 6, 2, 7, 10, 11, 3, 8, 12, 4, 9]], ["FSP", 3, 0, 9, 3], ["FSP", 3, 4, 10, 3], ["RE", 3, [0, 4, 1, 5, 2, 6, 3, 7]], ["CA", 2, 3, 5], ["CHR", 1, "shared", [2]], ["CA", 2, 3, 6], ["CHR", 0, "shared", [3]], ["CA", 1, 4, 6], ["FU", 15, [0, 1]], ["SP", 15, 0, 1024, [64], 1], ["AN", 15, 0, 5], ["AN", 15, 1, 6], ["FU", 5, [0, 1]], ["AN", 5, 0, 5], ["FU", 5, [1, 2]], ["AN", 5, 1, 4], ["FU", 5, [2, 3]], ["AN", 5, 2, 6], ["FU", 3, [0, 1]], ["SP", 3, 0, 8, [1], 1], ["AN", 3, 1, 2], ["FFSP", 3, 0, [10, 9], 1, 1], ["AN", 3, 1, 6], ["FU", 1, [0, 1]], ["SP", 1, 0, 2, [2], 1], ["AN", 1, 1, 2], ["FFSP", 1, 0, [10, 9], 1, 1], ["AN", 1, 1, 6], ["PR", 4, 0, "auto_unroll_max_step$16"]]]], "r": [[0.000791483, 0.000791628], 0, 2.81412, 1653061484], "v": "v0.6"}
{"i": [["[\"f1f88c1ddcda2fdfed7a61ba0c29695c\", [1, 512], [1024, 512], [1, 1024], [1, 1024]]", "cuda -keys=cuda,gpu -arch=sm_80 -max_num_threads=1024 -thread_warp_size=32", [-1, 16, 64, 49152, 2147483647, 1024, 8, 32], "", 0, []], [[], [["CI", 11], ["CI", 10], ["CI", 9], ["CI", 8], ["CI", 7], ["CI", 6], ["CI", 5], ["CI", 4], ["CHW", 2, "local"], ["SP", 2, 0, 1, [1, 1, 1, 1], 1], ["SP", 2, 5, 1024, [4, 16, 2, 8], 1], ["SP", 2, 10, 512, [4, 1], 1], ["RE", 2, [0, 5, 1, 6, 2, 7, 10, 11, 3, 8, 12, 4, 9]], ["FSP", 3, 0, 9, 3], ["FSP", 3, 4, 10, 3], ["RE", 3, [0, 4, 1, 5, 2, 6, 3, 7]], ["CA", 2, 3, 5], ["CHR", 1, "shared", [2]], ["CA", 2, 3, 6], ["CHR", 0, "shared", [3]], ["CA", 1, 4, 6], ["FU", 15, [0, 1]], ["SP", 15, 0, 1024, [32], 1], ["AN", 15, 0, 5], ["AN", 15, 1, 6], ["FU", 5, [0, 1]], ["AN", 5, 0, 5], ["FU", 5, [1, 2]], ["AN", 5, 1, 4], ["FU", 5, [2, 3]], ["AN", 5, 2, 6], ["FU", 3, [0, 1]], ["SP", 3, 0, 32, [1], 1], ["AN", 3, 1, 2], ["FFSP", 3, 0, [10, 9], 1, 1], ["AN", 3, 1, 6], ["FU", 1, [0, 1]], ["SP", 1, 0, 4, [1], 1], ["AN", 1, 1, 2], ["FFSP", 1, 0, [10, 9], 1, 1], ["AN", 1, 1, 6], ["PR", 4, 0, "auto_unroll_max_step$16"]]]], "r": [[0.00212417, 0.00212407], 0, 2.01823, 1653061485], "v": "v0.6"}
{"i": [["[\"f1f88c1ddcda2fdfed7a61ba0c29695c\", [1, 512], [1024, 512], [1, 1024], [1, 1024]]", "cuda -keys=cuda,gpu -arch=sm_80 -max_num_threads=1024 -thread_warp_size=32", [-1, 16, 64, 49152, 2147483647, 1024, 8, 32], "", 0, []], [[], [["CI", 11], ["CI", 10], ["CI", 9], ["CI", 8], ["CI", 7], ["CI", 6], ["CI", 5], ["CI", 4], ["CHW", 2, "local"], ["SP", 2, 0, 1, [1, 1, 1, 1], 1], ["SP", 2, 5, 1024, [2, 64, 1, 4], 1], ["SP", 2, 10, 512, [2, 1], 1], ["RE", 2, [0, 5, 1, 6, 2, 7, 10, 11, 3, 8, 12, 4, 9]], ["FSP", 3, 0, 9, 3], ["FSP", 3, 4, 10, 3], ["RE", 3, [0, 4, 1, 5, 2, 6, 3, 7]], ["CA", 2, 3, 5], ["CHR", 1, "shared", [2]], ["CA", 2, 3, 6], ["CHR", 0, "shared", [3]], ["CA", 1, 4, 6], ["FU", 15, [0, 1]], ["SP", 15, 0, 1024, [32], 1], ["AN", 15, 0, 5], ["AN", 15, 1, 6], ["FU", 5, [0, 1]], ["AN", 5, 0, 5], ["FU", 5, [1, 2]], ["AN", 5, 1, 4], ["FU", 5, [2, 3]], ["AN", 5, 2, 6], ["FU", 3, [0, 1]], ["SP", 3, 0, 64, [1], 1], ["AN", 3, 1, 2], ["FFSP", 3, 0, [10, 9], 1, 1], ["AN", 3, 1, 6], ["FU", 1, [0, 1]], ["SP", 1, 0, 16, [16], 1], ["AN", 1, 1, 2], ["FFSP", 1, 0, [10, 9], 1, 1], ["AN", 1, 1, 6], ["PR", 4, 0, "auto_unroll_max_step$1024"]]]], "r": [[0.000417118, 0.000417153], 0, 2.48372, 1653061487], "v": "v0.6"}
{"i": [["[\"f1f88c1ddcda2fdfed7a61ba0c29695c\", [1, 512], [1024, 512], [1, 1024], [1, 1024]]", "cuda -keys=cuda,gpu -arch=sm_80 -max_num_threads=1024 -thread_warp_size=32", [-1, 16, 64, 49152, 2147483647, 1024, 8, 32], "", 0, []], [[], [["CI", 11], ["CI", 10], ["CI", 9], ["CI", 8], ["CI", 7], ["CI", 6], ["CI", 5], ["CI", 4], ["CHW", 2, "local"], ["SP", 2, 0, 1, [1, 1, 1, 1], 1], ["SP", 2, 5, 1024, [8, 32, 1, 1], 1], ["SP", 2, 10, 512, [16, 2], 1], ["RE", 2, [0, 5, 1, 6, 2, 7, 10, 11, 3, 8, 12, 4, 9]], ["FSP", 3, 0, 9, 3], ["FSP", 3, 4, 10, 3], ["RE", 3, [0, 4, 1, 5, 2, 6, 3, 7]], ["CA", 2, 3, 5], ["CHR", 1, "shared", [2]], ["CA", 2, 3, 6], ["CHR", 0, "shared", [3]], ["CA", 1, 4, 6], ["FU", 15, [0, 1]], ["SP", 15, 0, 1024, [2], 1], ["AN", 15, 0, 5], ["AN", 15, 1, 6], ["FU", 5, [0, 1]], ["AN", 5, 0, 5], ["FU", 5, [1, 2]], ["AN", 5, 1, 4], ["FU", 5, [2, 3]], ["AN", 5, 2, 6], ["FU", 3, [0, 1]], ["SP", 3, 0, 32, [1], 1], ["AN", 3, 1, 2], ["FFSP", 3, 0, [10, 9], 1, 1], ["AN", 3, 1, 6], ["FU", 1, [0, 1]], ["SP", 1, 0, 32, [1], 1], ["AN", 1, 1, 2], ["FFSP", 1, 0, [10, 9], 1, 1], ["AN", 1, 1, 6], ["PR", 4, 0, "auto_unroll_max_step$512"]]]], "r": [[0.000156123, 0.000156123], 0, 3.53751, 1653061488], "v": "v0.6"}
{"i": [["[\"f1f88c1ddcda2fdfed7a61ba0c29695c\", [1, 512], [1024, 512], [1, 1024], [1, 1024]]", "cuda -keys=cuda,gpu -arch=sm_80 -max_num_threads=1024 -thread_warp_size=32", [-1, 16, 64, 49152, 2147483647, 1024, 8, 32], "", 0, []], [[], [["CI", 11], ["CI", 10], ["CI", 9], ["CI", 8], ["CI", 7], ["CI", 6], ["CI", 5], ["CI", 4], ["CHW", 2, "local"], ["SP", 2, 0, 1, [1, 1, 1, 1], 1], ["SP", 2, 5, 1024, [1, 32, 2, 8], 1], ["SP", 2, 10, 512, [8, 1], 1], ["RE", 2, [0, 5, 1, 6, 2, 7, 10, 11, 3, 8, 12, 4, 9]], ["FSP", 3, 0, 9, 3], ["FSP", 3, 4, 10, 3], ["RE", 3, [0, 4, 1, 5, 2, 6, 3, 7]], ["CA", 2, 3, 5], ["CHR", 1, "shared", [2]], ["CA", 2, 3, 6], ["CHR", 0, "shared", [3]], ["CA", 1, 4, 6], ["FU", 15, [0, 1]], ["SP", 15, 0, 1024, [32], 1], ["AN", 15, 0, 5], ["AN", 15, 1, 6], ["FU", 5, [0, 1]], ["AN", 5, 0, 5], ["FU", 5, [1, 2]], ["AN", 5, 1, 4], ["FU", 5, [2, 3]], ["AN", 5, 2, 6], ["FU", 3, [0, 1]], ["SP", 3, 0, 128, [1], 1], ["AN", 3, 1, 2], ["FFSP", 3, 0, [10, 9], 1, 1], ["AN", 3, 1, 6], ["FU", 1, [0, 1]], ["SP", 1, 0, 8, [1], 1], ["AN", 1, 1, 2], ["FFSP", 1, 0, [10, 9], 1, 1], ["AN", 1, 1, 6], ["PR", 4, 0, "auto_unroll_max_step$16"]]]], "r": [[0.000376986, 0.000377039], 0, 2.58994, 1653061490], "v": "v0.6"}
{"i": [["[\"f1f88c1ddcda2fdfed7a61ba0c29695c\", [1, 512], [1024, 512], [1, 1024], [1, 1024]]", "cuda -keys=cuda,gpu -arch=sm_80 -max_num_threads=1024 -thread_warp_size=32", [-1, 16, 64, 49152, 2147483647, 1024, 8, 32], "", 0, []], [[], [["CI", 11], ["CI", 10], ["CI", 9], ["CI", 8], ["CI", 7], ["CI", 6], ["CI", 5], ["CI", 4], ["CHW", 2, "local"], ["SP", 2, 0, 1, [1, 1, 1, 1], 1], ["SP", 2, 5, 1024, [2, 64, 1, 1], 1], ["SP", 2, 10, 512, [2, 4], 1], ["RE", 2, [0, 5, 1, 6, 2, 7, 10, 11, 3, 8, 12, 4, 9]], ["FSP", 3, 0, 9, 3], ["FSP", 3, 4, 10, 3], ["RE", 3, [0, 4, 1, 5, 2, 6, 3, 7]], ["CA", 2, 3, 5], ["CHR", 1, "shared", [2]], ["CA", 2, 3, 6], ["CHR", 0, "shared", [3]], ["CA", 1, 4, 6], ["FU", 15, [0, 1]], ["SP", 15, 0, 1024, [4], 1], ["AN", 15, 0, 5], ["AN", 15, 1, 6], ["FU", 5, [0, 1]], ["AN", 5, 0, 5], ["FU", 5, [1, 2]], ["AN", 5, 1, 4], ["FU", 5, [2, 3]], ["AN", 5, 2, 6], ["FU", 3, [0, 1]], ["SP", 3, 0, 8, [1], 1], ["AN", 3, 1, 2], ["FFSP", 3, 0, [10, 9], 1, 1], ["AN", 3, 1, 6], ["FU", 1, [0, 1]], ["SP", 1, 0, 8, [4], 1], ["AN", 1, 1, 2], ["FFSP", 1, 0, [10, 9], 1, 1], ["AN", 1, 1, 6], ["PR", 4, 0, "auto_unroll_max_step$1024"]]]], "r": [[5.75541e-05, 5.7581e-05], 0, 2.29128, 1653061492], "v": "v0.6"}
{"i": [["[\"f1f88c1ddcda2fdfed7a61ba0c29695c\", [1, 512], [1024, 512], [1, 1024], [1, 1024]]", "cuda -keys=cuda,gpu -arch=sm_80 -max_num_threads=1024 -thread_warp_size=32", [-1, 16, 64, 49152, 2147483647, 1024, 8, 32], "", 0, []], [[], [["CI", 11], ["CI", 10], ["CI", 9], ["CI", 8], ["CI", 7], ["CI", 6], ["CI", 5], ["CI", 4], ["CHW", 2, "local"], ["SP", 2, 0, 1, [1, 1, 1, 1], 1], ["SP", 2, 5, 1024, [2, 32, 2, 4], 1], ["SP", 2, 10, 512, [8, 1], 1], ["RE", 2, [0, 5, 1, 6, 2, 7, 10, 11, 3, 8, 12, 4, 9]], ["FSP", 3, 0, 9, 3], ["FSP", 3, 4, 10, 3], ["RE", 3, [0, 4, 1, 5, 2, 6, 3, 7]], ["CA", 2, 3, 5], ["CHR", 1, "shared", [2]], ["CA", 2, 3, 6], ["CHR", 0, "shared", [3]], ["CA", 1, 4, 6], ["FU", 15, [0, 1]], ["SP", 15, 0, 1024, [64], 1], ["AN", 15, 0, 5], ["AN", 15, 1, 6], ["FU", 5, [0, 1]], ["AN", 5, 0, 5], ["FU", 5, [1, 2]], ["AN", 5, 1, 4], ["FU", 5, [2, 3]], ["AN", 5, 2, 6], ["FU", 3, [0, 1]], ["SP", 3, 0, 64, [1], 1], ["AN", 3, 1, 2], ["FFSP", 3, 0, [10, 9], 1, 1], ["AN", 3, 1, 6], ["FU", 1, [0, 1]], ["SP", 1, 0, 8, [2], 1], ["AN", 1, 1, 2], ["FFSP", 1, 0, [10, 9], 1, 1], ["AN", 1, 1, 6], ["PR", 4, 0, "auto_unroll_max_step$64"]]]], "r": [[0.000377516, 0.000377443], 0, 2.43667, 1653061493], "v": "v0.6"}
{"i": [["[\"f1f88c1ddcda2fdfed7a61ba0c29695c\", [1, 512], [1024, 512], [1, 1024], [1, 1024]]", "cuda -keys=cuda,gpu -arch=sm_80 -max_num_threads=1024 -thread_warp_size=32", [-1, 16, 64, 49152, 2147483647, 1024, 8, 32], "", 0, []], [[], [["CI", 11], ["CI", 10], ["CI", 9], ["CI", 8], ["CI", 7], ["CI", 6], ["CI", 5], ["CI", 4], ["CHW", 2, "local"], ["SP", 2, 0, 1, [1, 1, 1, 1], 1], ["SP", 2, 5, 1024, [8, 32, 2, 1], 1], ["SP", 2, 10, 512, [4, 1], 1], ["RE", 2, [0, 5, 1, 6, 2, 7, 10, 11, 3, 8, 12, 4, 9]], ["FSP", 3, 0, 9, 3], ["FSP", 3, 4, 10, 3], ["RE", 3, [0, 4, 1, 5, 2, 6, 3, 7]], ["CA", 2, 3, 5], ["CHR", 1, "shared", [2]], ["CA", 2, 3, 6], ["CHR", 0, "shared", [3]], ["CA", 1, 4, 6], ["FU", 15, [0, 1]], ["SP", 15, 0, 1024, [32], 1], ["AN", 15, 0, 5], ["AN", 15, 1, 6], ["FU", 5, [0, 1]], ["AN", 5, 0, 5], ["FU", 5, [1, 2]], ["AN", 5, 1, 4], ["FU", 5, [2, 3]], ["AN", 5, 2, 6], ["FU", 3, [0, 1]], ["SP", 3, 0, 8, [1], 1], ["AN", 3, 1, 2], ["FFSP", 3, 0, [10, 9], 1, 1], ["AN", 3, 1, 6], ["FU", 1, [0, 1]], ["SP", 1, 0, 4, [1], 1], ["AN", 1, 1, 2], ["FFSP", 1, 0, [10, 9], 1, 1], ["AN", 1, 1, 6], ["PR", 4, 0, "auto_unroll_max_step$0"]]]], "r": [[0.000255364, 0.000255516], 0, 2.43586, 1653061495], "v": "v0.6"}
{"i": [["[\"f1f88c1ddcda2fdfed7a61ba0c29695c\", [1, 512], [1024, 512], [1, 1024], [1, 1024]]", "cuda -keys=cuda,gpu -arch=sm_80 -max_num_threads=1024 -thread_warp_size=32", [-1, 16, 64, 49152, 2147483647, 1024, 8, 32], "", 0, []], [[], [["CI", 11], ["CI", 10], ["CI", 9], ["CI", 8], ["CI", 7], ["CI", 6], ["CI", 5], ["CI", 4], ["CHW", 2, "local"], ["SP", 2, 0, 1, [1, 1, 1, 1], 1], ["SP", 2, 5, 1024, [2, 128, 1, 1], 1], ["SP", 2, 10, 512, [16, 2], 1], ["RE", 2, [0, 5, 1, 6, 2, 7, 10, 11, 3, 8, 12, 4, 9]], ["FSP", 3, 0, 9, 3], ["FSP", 3, 4, 10, 3], ["RE", 3, [0, 4, 1, 5, 2, 6, 3, 7]], ["CA", 2, 3, 5], ["CHR", 1, "shared", [2]], ["CA", 2, 3, 6], ["CHR", 0, "shared", [3]], ["CA", 1, 4, 6], ["FU", 15, [0, 1]], ["SP", 15, 0, 1024, [32], 1], ["AN", 15, 0, 5], ["AN", 15, 1, 6], ["FU", 5, [0, 1]], ["AN", 5, 0, 5], ["FU", 5, [1, 2]], ["AN", 5, 1, 4], ["FU", 5, [2, 3]], ["AN", 5, 2, 6], ["FU", 3, [0, 1]], ["SP", 3, 0, 32, [1], 1], ["AN", 3, 1, 2], ["FFSP", 3, 0, [10, 9], 1, 1], ["AN", 3, 1, 6], ["FU", 1, [0, 1]], ["SP", 1, 0, 32, [1], 1], ["AN", 1, 1, 2], ["FFSP", 1, 0, [10, 9], 1, 1], ["AN", 1, 1, 6], ["PR", 4, 0, "auto_unroll_max_step$16"]]]], "r": [[7.59821e-05, 7.59681e-05], 0, 2.32018, 1653061497], "v": "v0.6"}
{"i": [["[\"f1f88c1ddcda2fdfed7a61ba0c29695c\", [1, 512], [1024, 512], [1, 1024], [1, 1024]]", "cuda -keys=cuda,gpu -arch=sm_80 -max_num_threads=1024 -thread_warp_size=32", [-1, 16, 64, 49152, 2147483647, 1024, 8, 32], "", 0, []], [[], [["CI", 11], ["CI", 10], ["CI", 9], ["CI", 8], ["CI", 7], ["CI", 6], ["CI", 5], ["CI", 4], ["CHW", 2, "local"], ["SP", 2, 0, 1, [1, 1, 1, 1], 1], ["SP", 2, 5, 1024, [1, 32, 1, 1], 1], ["SP", 2, 10, 512, [1, 32], 1], ["RE", 2, [0, 5, 1, 6, 2, 7, 10, 11, 3, 8, 12, 4, 9]], ["FSP", 3, 0, 9, 3], ["FSP", 3, 4, 10, 3], ["RE", 3, [0, 4, 1, 5, 2, 6, 3, 7]], ["CA", 2, 3, 5], ["CHR", 1, "shared", [2]], ["CA", 2, 3, 6], ["CHR", 0, "shared", [3]], ["CA", 1, 4, 6], ["FU", 15, [0, 1]], ["SP", 15, 0, 1024, [32], 1], ["AN", 15, 0, 5], ["AN", 15, 1, 6], ["FU", 5, [0, 1]], ["AN", 5, 0, 5], ["FU", 5, [1, 2]], ["AN", 5, 1, 4], ["FU", 5, [2, 3]], ["AN", 5, 2, 6], ["FU", 3, [0, 1]], ["SP", 3, 0, 2, [2], 1], ["AN", 3, 1, 2], ["FFSP", 3, 0, [10, 9], 1, 1], ["AN", 3, 1, 6], ["FU", 1, [0, 1]], ["SP", 1, 0, 2, [1], 1], ["AN", 1, 1, 2], ["FFSP", 1, 0, [10, 9], 1, 1], ["AN", 1, 1, 6], ["PR", 4, 0, "auto_unroll_max_step$0"]]]], "r": [[3.09202e-05, 3.09214e-05], 0, 2.19283, 1653061498], "v": "v0.6"}
{"i": [["[\"f1f88c1ddcda2fdfed7a61ba0c29695c\", [1, 512], [1024, 512], [1, 1024], [1, 1024]]", "cuda -keys=cuda,gpu -arch=sm_80 -max_num_threads=1024 -thread_warp_size=32", [-1, 16, 64, 49152, 2147483647, 1024, 8, 32], "", 0, []], [[], [["CI", 11], ["CI", 10], ["CI", 9], ["CI", 8], ["CI", 7], ["CI", 6], ["CI", 5], ["CI", 4], ["CHW", 2, "local"], ["SP", 2, 0, 1, [1, 1, 1, 1], 1], ["SP", 2, 5, 1024, [2, 128, 1, 4], 1], ["SP", 2, 10, 512, [8, 1], 1], ["RE", 2, [0, 5, 1, 6, 2, 7, 10, 11, 3, 8, 12, 4, 9]], ["FSP", 3, 0, 9, 3], ["FSP", 3, 4, 10, 3], ["RE", 3, [0, 4, 1, 5, 2, 6, 3, 7]], ["CA", 2, 3, 5], ["CHR", 1, "shared", [2]], ["CA", 2, 3, 6], ["CHR", 0, "shared", [3]], ["CA", 1, 4, 6], ["FU", 15, [0, 1]], ["SP", 15, 0, 1024, [32], 1], ["AN", 15, 0, 5], ["AN", 15, 1, 6], ["FU", 5, [0, 1]], ["AN", 5, 0, 5], ["FU", 5, [1, 2]], ["AN", 5, 1, 4], ["FU", 5, [2, 3]], ["AN", 5, 2, 6], ["FU", 3, [0, 1]], ["SP", 3, 0, 32, [4], 1], ["AN", 3, 1, 2], ["FFSP", 3, 0, [10, 9], 1, 1], ["AN", 3, 1, 6], ["FU", 1, [0, 1]], ["SP", 1, 0, 8, [1], 1], ["AN", 1, 1, 2], ["FFSP", 1, 0, [10, 9], 1, 1], ["AN", 1, 1, 6], ["PR", 4, 0, "auto_unroll_max_step$0"]]]], "r": [[0.000318748, 0.000318637], 0, 2.32994, 1653061500], "v": "v0.6"}
{"i": [["[\"f1f88c1ddcda2fdfed7a61ba0c29695c\", [1, 512], [1024, 512], [1, 1024], [1, 1024]]", "cuda -keys=cuda,gpu -arch=sm_80 -max_num_threads=1024 -thread_warp_size=32", [-1, 16, 64, 49152, 2147483647, 1024, 8, 32], "", 0, []], [[], [["CI", 11], ["CI", 10], ["CI", 9], ["CI", 8], ["CI", 7], ["CI", 6], ["CI", 5], ["CI", 4], ["CHW", 2, "local"], ["SP", 2, 0, 1, [1, 1, 1, 1], 1], ["SP", 2, 5, 1024, [1, 128, 2, 1], 1], ["SP", 2, 10, 512, [16, 2], 1], ["RE", 2, [0, 5, 1, 6, 2, 7, 10, 11, 3, 8, 12, 4, 9]], ["FSP", 3, 0, 9, 3], ["FSP", 3, 4, 10, 3], ["RE", 3, [0, 4, 1, 5, 2, 6, 3, 7]], ["CA", 2, 3, 5], ["CHR", 1, "shared", [2]], ["CA", 2, 3, 6], ["CHR", 0, "shared", [3]], ["CA", 1, 4, 6], ["FU", 15, [0, 1]], ["SP", 15, 0, 1024, [64], 1], ["AN", 15, 0, 5], ["AN", 15, 1, 6], ["FU", 5, [0, 1]], ["AN", 5, 0, 5], ["FU", 5, [1, 2]], ["AN", 5, 1, 4], ["FU", 5, [2, 3]], ["AN", 5, 2, 6], ["FU", 3, [0, 1]], ["SP", 3, 0, 32, [1], 1], ["AN", 3, 1, 2], ["FFSP", 3, 0, [10, 9], 1, 1], ["AN", 3, 1, 6], ["FU", 1, [0, 1]], ["SP", 1, 0, 32, [1], 1], ["AN", 1, 1, 2], ["FFSP", 1, 0, [10, 9], 1, 1], ["AN", 1, 1, 6], ["PR", 4, 0, "auto_unroll_max_step$512"]]]], "r": [[7.64079e-05, 7.64061e-05], 0, 2.52417, 1653061501], "v": "v0.6"}
{"i": [["[\"f1f88c1ddcda2fdfed7a61ba0c29695c\", [1, 512], [1024, 512], [1, 1024], [1, 1024]]", "cuda -keys=cuda,gpu -arch=sm_80 -max_num_threads=1024 -thread_warp_size=32", [-1, 16, 64, 49152, 2147483647, 1024, 8, 32], "", 0, []], [[], [["CI", 11], ["CI", 10], ["CI", 9], ["CI", 8], ["CI", 7], ["CI", 6], ["CI", 5], ["CI", 4], ["CHW", 2, "local"], ["SP", 2, 0, 1, [1, 1, 1, 1], 1], ["SP", 2, 5, 1024, [2, 32, 2, 2], 1], ["SP", 2, 10, 512, [2, 2], 1], ["RE", 2, [0, 5, 1, 6, 2, 7, 10, 11, 3, 8, 12, 4, 9]], ["FSP", 3, 0, 9, 3], ["FSP", 3, 4, 10, 3], ["RE", 3, [0, 4, 1, 5, 2, 6, 3, 7]], ["CA", 2, 3, 5], ["CHR", 1, "shared", [2]], ["CA", 2, 3, 6], ["CHR", 0, "shared", [3]], ["CA", 1, 4, 6], ["FU", 15, [0, 1]], ["SP", 15, 0, 1024, [64], 1], ["AN", 15, 0, 5], ["AN", 15, 1, 6], ["FU", 5, [0, 1]], ["AN", 5, 0, 5], ["FU", 5, [1, 2]], ["AN", 5, 1, 4], ["FU", 5, [2, 3]], ["AN", 5, 2, 6], ["FU", 3, [0, 1]], ["SP", 3, 0, 16, [1], 1], ["AN", 3, 1, 2], ["FFSP", 3, 0, [10, 9], 1, 1], ["AN", 3, 1, 6], ["FU", 1, [0, 1]], ["SP", 1, 0, 4, [4], 1], ["AN", 1, 1, 2], ["FFSP", 1, 0, [10, 9], 1, 1], ["AN", 1, 1, 6], ["PR", 4, 0, "auto_unroll_max_step$64"]]]], "r": [[0.000175315, 0.000175318], 0, 2.24226, 1653061503], "v": "v0.6"}
{"i": [["[\"f1f88c1ddcda2fdfed7a61ba0c29695c\", [1, 512], [1024, 512], [1, 1024], [1, 1024]]", "cuda -keys=cuda,gpu -arch=sm_80 -max_num_threads=1024 -thread_warp_size=32", [-1, 16, 64, 49152, 2147483647, 1024, 8, 32], "", 0, []], [[], [["CI", 11], ["CI", 10], ["CI", 9], ["CI", 8], ["CI", 7], ["CI", 6], ["CI", 5], ["CI", 4], ["CHW", 2, "local"], ["SP", 2, 0, 1, [1, 1, 1, 1], 1], ["SP", 2, 5, 1024, [8, 32, 2, 2], 1], ["SP", 2, 10, 512, [1, 8], 1], ["RE", 2, [0, 5, 1, 6, 2, 7, 10, 11, 3, 8, 12, 4, 9]], ["FSP", 3, 0, 9, 3], ["FSP", 3, 4, 10, 3], ["RE", 3, [0, 4, 1, 5, 2, 6, 3, 7]], ["CA", 2, 3, 5], ["CHR", 1, "shared", [2]], ["CA", 2, 3, 6], ["CHR", 0, "shared", [3]], ["CA", 1, 4, 6], ["FU", 15, [0, 1]], ["SP", 15, 0, 1024, [32], 1], ["AN", 15, 0, 5], ["AN", 15, 1, 6], ["FU", 5, [0, 1]], ["AN", 5, 0, 5], ["FU", 5, [1, 2]], ["AN", 5, 1, 4], ["FU", 5, [2, 3]], ["AN", 5, 2, 6], ["FU", 3, [0, 1]], ["SP", 3, 0, 32, [1], 1], ["AN", 3, 1, 2], ["FFSP", 3, 0, [10, 9], 1, 1], ["AN", 3, 1, 6], ["FU", 1, [0, 1]], ["SP", 1, 0, 8, [4], 1], ["AN", 1, 1, 2], ["FFSP", 1, 0, [10, 9], 1, 1], ["AN", 1, 1, 6], ["PR", 4, 0, "auto_unroll_max_step$64"]]]], "r": [[0.000717335, 0.000717238], 0, 2.39678, 1653061505], "v": "v0.6"}
