.cache/log/kernel_tune/Linear_GELU_32_512_1024.json
{"i": [["[\"626fb653e298f4cd4434364b5f2ed39c\", [32, 512], [1024, 512], [1, 1024], [32, 1024]]", "cuda -keys=cuda,gpu -arch=sm_80 -max_num_threads=1024 -thread_warp_size=32", [-1, 16, 64, 49152, 2147483647, 1024, 8, 32], "", 0, []], [[], [["CI", 11], ["CI", 10], ["CI", 9], ["CI", 8], ["CI", 7], ["CI", 6], ["CI", 5], ["CI", 4], ["CHW", 2, "local"], ["SP", 2, 0, 32, [1, 2, 2, 4], 1], ["SP", 2, 5, 1024, [1, 8, 8, 1], 1], ["SP", 2, 10, 512, [2, 8], 1], ["RE", 2, [0, 5, 1, 6, 2, 7, 10, 11, 3, 8, 12, 4, 9]], ["FSP", 3, 0, 9, 3], ["FSP", 3, 4, 10, 3], ["RE", 3, [0, 4, 1, 5, 2, 6, 3, 7]], ["CA", 2, 3, 5], ["CHR", 1, "shared", [2]], ["CA", 2, 3, 6], ["CHR", 0, "shared", [3]], ["CA", 1, 4, 6], ["FU", 15, [0, 1]], ["SP", 15, 0, 32768, [32], 1], ["AN", 15, 0, 5], ["AN", 15, 1, 6], ["FU", 5, [0, 1]], ["AN", 5, 0, 5], ["FU", 5, [1, 2]], ["AN", 5, 1, 4], ["FU", 5, [2, 3]], ["AN", 5, 2, 6], ["FU", 3, [0, 1]], ["SP", 3, 0, 1024, [1], 1], ["AN", 3, 1, 2], ["FFSP", 3, 0, [10, 9], 1, 1], ["AN", 3, 1, 6], ["FU", 1, [0, 1]], ["SP", 1, 0, 512, [2], 1], ["AN", 1, 1, 2], ["FFSP", 1, 0, [10, 9], 1, 1], ["AN", 1, 1, 6], ["PR", 4, 0, "auto_unroll_max_step$16"]]]], "r": [[0.000176706, 0.000176713], 0, 4.11647, 1653070915], "v": "v0.6"}
{"i": [["[\"626fb653e298f4cd4434364b5f2ed39c\", [32, 512], [1024, 512], [1, 1024], [32, 1024]]", "cuda -keys=cuda,gpu -arch=sm_80 -max_num_threads=1024 -thread_warp_size=32", [-1, 16, 64, 49152, 2147483647, 1024, 8, 32], "", 0, []], [[], [["CI", 11], ["CI", 10], ["CI", 9], ["CI", 8], ["CI", 7], ["CI", 6], ["CI", 5], ["CI", 4], ["CHW", 2, "local"], ["SP", 2, 0, 32, [2, 4, 1, 1], 1], ["SP", 2, 5, 1024, [1, 32, 2, 4], 1], ["SP", 2, 10, 512, [1, 4], 1], ["RE", 2, [0, 5, 1, 6, 2, 7, 10, 11, 3, 8, 12, 4, 9]], ["FSP", 3, 0, 9, 3], ["FSP", 3, 4, 10, 3], ["RE", 3, [0, 4, 1, 5, 2, 6, 3, 7]], ["CA", 2, 3, 5], ["CHR", 1, "shared", [2]], ["CA", 2, 3, 6], ["CHR", 0, "shared", [3]], ["CA", 1, 4, 6], ["FU", 15, [0, 1]], ["SP", 15, 0, 32768, [32], 1], ["AN", 15, 0, 5], ["AN", 15, 1, 6], ["FU", 5, [0, 1]], ["AN", 5, 0, 5], ["FU", 5, [1, 2]], ["AN", 5, 1, 4], ["FU", 5, [2, 3]], ["AN", 5, 2, 6], ["FU", 3, [0, 1]], ["SP", 3, 0, 64, [1], 1], ["AN", 3, 1, 2], ["FFSP", 3, 0, [10, 9], 1, 1], ["AN", 3, 1, 6], ["FU", 1, [0, 1]], ["SP", 1, 0, 8, [1], 1], ["AN", 1, 1, 2], ["FFSP", 1, 0, [10, 9], 1, 1], ["AN", 1, 1, 6], ["PR", 4, 0, "auto_unroll_max_step$64"]]]], "r": [[0.000265548, 0.000265548], 0, 2.72728, 1653070917], "v": "v0.6"}
{"i": [["[\"626fb653e298f4cd4434364b5f2ed39c\", [32, 512], [1024, 512], [1, 1024], [32, 1024]]", "cuda -keys=cuda,gpu -arch=sm_80 -max_num_threads=1024 -thread_warp_size=32", [-1, 16, 64, 49152, 2147483647, 1024, 8, 32], "", 0, []], [[], [["CI", 11], ["CI", 10], ["CI", 9], ["CI", 8], ["CI", 7], ["CI", 6], ["CI", 5], ["CI", 4], ["CHW", 2, "local"], ["SP", 2, 0, 32, [1, 2, 2, 8], 1], ["SP", 2, 5, 1024, [2, 32, 2, 1], 1], ["SP", 2, 10, 512, [1, 1], 1], ["RE", 2, [0, 5, 1, 6, 2, 7, 10, 11, 3, 8, 12, 4, 9]], ["FSP", 3, 0, 9, 3], ["FSP", 3, 4, 10, 3], ["RE", 3, [0, 4, 1, 5, 2, 6, 3, 7]], ["CA", 2, 3, 5], ["CHR", 1, "shared", [2]], ["CA", 2, 3, 6], ["CHR", 0, "shared", [3]], ["CA", 1, 4, 6], ["FU", 15, [0, 1]], ["SP", 15, 0, 32768, [64], 1], ["AN", 15, 0, 5], ["AN", 15, 1, 6], ["FU", 5, [0, 1]], ["AN", 5, 0, 5], ["FU", 5, [1, 2]], ["AN", 5, 1, 4], ["FU", 5, [2, 3]], ["AN", 5, 2, 6], ["FU", 3, [0, 1]], ["SP", 3, 0, 2, [1], 1], ["AN", 3, 1, 2], ["FFSP", 3, 0, [10, 9], 1, 1], ["AN", 3, 1, 6], ["FU", 1, [0, 1]], ["SP", 1, 0, 16, [1], 1], ["AN", 1, 1, 2], ["FFSP", 1, 0, [10, 9], 1, 1], ["AN", 1, 1, 6], ["PR", 4, 0, "auto_unroll_max_step$1024"]]]], "r": [[0.000315938, 0.00031592], 0, 2.67271, 1653070918], "v": "v0.6"}
{"i": [["[\"626fb653e298f4cd4434364b5f2ed39c\", [32, 512], [1024, 512], [1, 1024], [32, 1024]]", "cuda -keys=cuda,gpu -arch=sm_80 -max_num_threads=1024 -thread_warp_size=32", [-1, 16, 64, 49152, 2147483647, 1024, 8, 32], "", 0, []], [[], [["CI", 11], ["CI", 10], ["CI", 9], ["CI", 8], ["CI", 7], ["CI", 6], ["CI", 5], ["CI", 4], ["CHW", 2, "local"], ["SP", 2, 0, 32, [1, 4, 2, 4], 1], ["SP", 2, 5, 1024, [1, 16, 2, 8], 1], ["SP", 2, 10, 512, [2, 16], 1], ["RE", 2, [0, 5, 1, 6, 2, 7, 10, 11, 3, 8, 12, 4, 9]], ["FSP", 3, 0, 9, 3], ["FSP", 3, 4, 10, 3], ["RE", 3, [0, 4, 1, 5, 2, 6, 3, 7]], ["CA", 2, 3, 5], ["CHR", 1, "shared", [2]], ["CA", 2, 3, 6], ["CHR", 0, "shared", [3]], ["CA", 1, 4, 6], ["FU", 15, [0, 1]], ["SP", 15, 0, 32768, [32], 1], ["AN", 15, 0, 5], ["AN", 15, 1, 6], ["FU", 5, [0, 1]], ["AN", 5, 0, 5], ["FU", 5, [1, 2]], ["AN", 5, 1, 4], ["FU", 5, [2, 3]], ["AN", 5, 2, 6], ["FU", 3, [0, 1]], ["SP", 3, 0, 512, [1], 1], ["AN", 3, 1, 2], ["FFSP", 3, 0, [10, 9], 1, 1], ["AN", 3, 1, 6], ["FU", 1, [0, 1]], ["SP", 1, 0, 256, [1], 1], ["AN", 1, 1, 2], ["FFSP", 1, 0, [10, 9], 1, 1], ["AN", 1, 1, 6], ["PR", 4, 0, "auto_unroll_max_step$512"]]]], "r": [[0.000473626, 0.000473612], 0, 6.85692, 1653070920], "v": "v0.6"}
{"i": [["[\"626fb653e298f4cd4434364b5f2ed39c\", [32, 512], [1024, 512], [1, 1024], [32, 1024]]", "cuda -keys=cuda,gpu -arch=sm_80 -max_num_threads=1024 -thread_warp_size=32", [-1, 16, 64, 49152, 2147483647, 1024, 8, 32], "", 0, []], [[], [["CI", 11], ["CI", 10], ["CI", 9], ["CI", 8], ["CI", 7], ["CI", 6], ["CI", 5], ["CI", 4], ["CHW", 2, "local"], ["SP", 2, 0, 32, [1, 16, 1, 2], 1], ["SP", 2, 5, 1024, [1, 32, 4, 4], 1], ["SP", 2, 10, 512, [16, 1], 1], ["RE", 2, [0, 5, 1, 6, 2, 7, 10, 11, 3, 8, 12, 4, 9]], ["FSP", 3, 0, 9, 3], ["FSP", 3, 4, 10, 3], ["RE", 3, [0, 4, 1, 5, 2, 6, 3, 7]], ["CA", 2, 3, 5], ["CHR", 1, "shared", [2]], ["CA", 2, 3, 6], ["CHR", 0, "shared", [3]], ["CA", 1, 4, 6], ["FU", 15, [0, 1]], ["SP", 15, 0, 32768, [1], 1], ["AN", 15, 0, 5], ["AN", 15, 1, 6], ["FU", 5, [0, 1]], ["AN", 5, 0, 5], ["FU", 5, [1, 2]], ["AN", 5, 1, 4], ["FU", 5, [2, 3]], ["AN", 5, 2, 6], ["FU", 3, [0, 1]], ["SP", 3, 0, 256, [1], 1], ["AN", 3, 1, 2], ["FFSP", 3, 0, [10, 9], 1, 1], ["AN", 3, 1, 6], ["FU", 1, [0, 1]], ["SP", 1, 0, 32, [1], 1], ["AN", 1, 1, 2], ["FFSP", 1, 0, [10, 9], 1, 1], ["AN", 1, 1, 6], ["PR", 4, 0, "auto_unroll_max_step$1024"]]]], "r": [[0.00152041, 0.00152045], 0, 4.36012, 1653070921], "v": "v0.6"}
{"i": [["[\"626fb653e298f4cd4434364b5f2ed39c\", [32, 512], [1024, 512], [1, 1024], [32, 1024]]", "cuda -keys=cuda,gpu -arch=sm_80 -max_num_threads=1024 -thread_warp_size=32", [-1, 16, 64, 49152, 2147483647, 1024, 8, 32], "", 0, []], [[], [["CI", 11], ["CI", 10], ["CI", 9], ["CI", 8], ["CI", 7], ["CI", 6], ["CI", 5], ["CI", 4], ["CHW", 2, "local"], ["SP", 2, 0, 32, [1, 8, 4, 1], 1], ["SP", 2, 5, 1024, [8, 4, 16, 2], 1], ["SP", 2, 10, 512, [1, 4], 1], ["RE", 2, [0, 5, 1, 6, 2, 7, 10, 11, 3, 8, 12, 4, 9]], ["FSP", 3, 0, 9, 3], ["FSP", 3, 4, 10, 3], ["RE", 3, [0, 4, 1, 5, 2, 6, 3, 7]], ["CA", 2, 3, 5], ["CHR", 1, "shared", [2]], ["CA", 2, 3, 6], ["CHR", 0, "shared", [3]], ["CA", 1, 4, 6], ["FU", 15, [0, 1]], ["SP", 15, 0, 32768, [32], 1], ["AN", 15, 0, 5], ["AN", 15, 1, 6], ["FU", 5, [0, 1]], ["AN", 5, 0, 5], ["FU", 5, [1, 2]], ["AN", 5, 1, 4], ["FU", 5, [2, 3]], ["AN", 5, 2, 6], ["FU", 3, [0, 1]], ["SP", 3, 0, 128, [1], 1], ["AN", 3, 1, 2], ["FFSP", 3, 0, [10, 9], 1, 1], ["AN", 3, 1, 6], ["FU", 1, [0, 1]], ["SP", 1, 0, 16, [1], 1], ["AN", 1, 1, 2], ["FFSP", 1, 0, [10, 9], 1, 1], ["AN", 1, 1, 6], ["PR", 4, 0, "auto_unroll_max_step$0"]]]], "r": [[0.00836798, 0.00836826], 0, 4.2813, 1653070922], "v": "v0.6"}
{"i": [["[\"626fb653e298f4cd4434364b5f2ed39c\", [32, 512], [1024, 512], [1, 1024], [32, 1024]]", "cuda -keys=cuda,gpu -arch=sm_80 -max_num_threads=1024 -thread_warp_size=32", [-1, 16, 64, 49152, 2147483647, 1024, 8, 32], "", 0, []], [[], [["CI", 11], ["CI", 10], ["CI", 9], ["CI", 8], ["CI", 7], ["CI", 6], ["CI", 5], ["CI", 4], ["CHW", 2, "local"], ["SP", 2, 0, 32, [1, 1, 16, 2], 1], ["SP", 2, 5, 1024, [1, 32, 1, 32], 1], ["SP", 2, 10, 512, [8, 1], 1], ["RE", 2, [0, 5, 1, 6, 2, 7, 10, 11, 3, 8, 12, 4, 9]], ["FSP", 3, 0, 9, 3], ["FSP", 3, 4, 10, 3], ["RE", 3, [0, 4, 1, 5, 2, 6, 3, 7]], ["CA", 2, 3, 5], ["CHR", 1, "shared", [2]], ["CA", 2, 3, 6], ["CHR", 0, "shared", [3]], ["CA", 1, 4, 6], ["FU", 15, [0, 1]], ["SP", 15, 0, 32768, [32], 1], ["AN", 15, 0, 5], ["AN", 15, 1, 6], ["FU", 5, [0, 1]], ["AN", 5, 0, 5], ["FU", 5, [1, 2]], ["AN", 5, 1, 4], ["FU", 5, [2, 3]], ["AN", 5, 2, 6], ["FU", 3, [0, 1]], ["SP", 3, 0, 64, [2], 1], ["AN", 3, 1, 2], ["FFSP", 3, 0, [10, 9], 1, 1], ["AN", 3, 1, 6], ["FU", 1, [0, 1]], ["SP", 1, 0, 128, [1], 1], ["AN", 1, 1, 2], ["FFSP", 1, 0, [10, 9], 1, 1], ["AN", 1, 1, 6], ["PR", 4, 0, "auto_unroll_max_step$512"]]]], "r": [[0.00821886, 0.00822046], 0, 3.84814, 1653070923], "v": "v0.6"}
{"i": [["[\"626fb653e298f4cd4434364b5f2ed39c\", [32, 512], [1024, 512], [1, 1024], [32, 1024]]", "cuda -keys=cuda,gpu -arch=sm_80 -max_num_threads=1024 -thread_warp_size=32", [-1, 16, 64, 49152, 2147483647, 1024, 8, 32], "", 0, []], [[], [["CI", 11], ["CI", 10], ["CI", 9], ["CI", 8], ["CI", 7], ["CI", 6], ["CI", 5], ["CI", 4], ["CHW", 2, "local"], ["SP", 2, 0, 32, [1, 1, 1, 32], 1], ["SP", 2, 5, 1024, [1, 4, 4, 1], 1], ["SP", 2, 10, 512, [2, 16], 1], ["RE", 2, [0, 5, 1, 6, 2, 7, 10, 11, 3, 8, 12, 4, 9]], ["FSP", 3, 0, 9, 3], ["FSP", 3, 4, 10, 3], ["RE", 3, [0, 4, 1, 5, 2, 6, 3, 7]], ["CA", 2, 3, 5], ["CHR", 1, "shared", [2]], ["CA", 2, 3, 6], ["CHR", 0, "shared", [3]], ["CA", 1, 4, 6], ["FU", 15, [0, 1]], ["SP", 15, 0, 32768, [32], 1], ["AN", 15, 0, 5], ["AN", 15, 1, 6], ["FU", 5, [0, 1]], ["AN", 5, 0, 5], ["FU", 5, [1, 2]], ["AN", 5, 1, 4], ["FU", 5, [2, 3]], ["AN", 5, 2, 6], ["FU", 3, [0, 1]], ["SP", 3, 0, 128, [1], 1], ["AN", 3, 1, 2], ["FFSP", 3, 0, [10, 9], 1, 1], ["AN", 3, 1, 6], ["FU", 1, [0, 1]], ["SP", 1, 0, 32, [1], 1], ["AN", 1, 1, 2], ["FFSP", 1, 0, [10, 9], 1, 1], ["AN", 1, 1, 6], ["PR", 4, 0, "auto_unroll_max_step$64"]]]], "r": [[0.000648163, 0.000648197], 0, 3.662, 1653070925], "v": "v0.6"}
{"i": [["[\"626fb653e298f4cd4434364b5f2ed39c\", [32, 512], [1024, 512], [1, 1024], [32, 1024]]", "cuda -keys=cuda,gpu -arch=sm_80 -max_num_threads=1024 -thread_warp_size=32", [-1, 16, 64, 49152, 2147483647, 1024, 8, 32], "", 0, []], [[], [["CI", 11], ["CI", 10], ["CI", 9], ["CI", 8], ["CI", 7], ["CI", 6], ["CI", 5], ["CI", 4], ["CHW", 2, "local"], ["SP", 2, 0, 32, [1, 8, 1, 1], 1], ["SP", 2, 5, 1024, [1, 16, 1, 2], 1], ["SP", 2, 10, 512, [1, 64], 1], ["RE", 2, [0, 5, 1, 6, 2, 7, 10, 11, 3, 8, 12, 4, 9]], ["FSP", 3, 0, 9, 3], ["FSP", 3, 4, 10, 3], ["RE", 3, [0, 4, 1, 5, 2, 6, 3, 7]], ["CA", 2, 3, 5], ["CHR", 1, "shared", [2]], ["CA", 2, 3, 6], ["CHR", 0, "shared", [3]], ["CA", 1, 4, 6], ["FU", 15, [0, 1]], ["SP", 15, 0, 32768, [32], 1], ["AN", 15, 0, 5], ["AN", 15, 1, 6], ["FU", 5, [0, 1]], ["AN", 5, 0, 5], ["FU", 5, [1, 2]], ["AN", 5, 1, 4], ["FU", 5, [2, 3]], ["AN", 5, 2, 6], ["FU", 3, [0, 1]], ["SP", 3, 0, 128, [1], 1], ["AN", 3, 1, 2], ["FFSP", 3, 0, [10, 9], 1, 1], ["AN", 3, 1, 6], ["FU", 1, [0, 1]], ["SP", 1, 0, 128, [1], 1], ["AN", 1, 1, 2], ["FFSP", 1, 0, [10, 9], 1, 1], ["AN", 1, 1, 6], ["PR", 4, 0, "auto_unroll_max_step$64"]]]], "r": [[0.000107363, 0.000107374], 0, 3.13653, 1653070927], "v": "v0.6"}
{"i": [["[\"626fb653e298f4cd4434364b5f2ed39c\", [32, 512], [1024, 512], [1, 1024], [32, 1024]]", "cuda -keys=cuda,gpu -arch=sm_80 -max_num_threads=1024 -thread_warp_size=32", [-1, 16, 64, 49152, 2147483647, 1024, 8, 32], "", 0, []], [[], [["CI", 11], ["CI", 10], ["CI", 9], ["CI", 8], ["CI", 7], ["CI", 6], ["CI", 5], ["CI", 4], ["CHW", 2, "local"], ["SP", 2, 0, 32, [1, 1, 1, 8], 1], ["SP", 2, 5, 1024, [1, 512, 2, 1], 1], ["SP", 2, 10, 512, [1, 8], 1], ["RE", 2, [0, 5, 1, 6, 2, 7, 10, 11, 3, 8, 12, 4, 9]], ["FSP", 3, 0, 9, 3], ["FSP", 3, 4, 10, 3], ["RE", 3, [0, 4, 1, 5, 2, 6, 3, 7]], ["CA", 2, 3, 5], ["CHR", 1, "shared", [2]], ["CA", 2, 3, 6], ["CHR", 0, "shared", [3]], ["CA", 1, 4, 6], ["FU", 15, [0, 1]], ["SP", 15, 0, 32768, [32], 1], ["AN", 15, 0, 5], ["AN", 15, 1, 6], ["FU", 5, [0, 1]], ["AN", 5, 0, 5], ["FU", 5, [1, 2]], ["AN", 5, 1, 4], ["FU", 5, [2, 3]], ["AN", 5, 2, 6], ["FU", 3, [0, 1]], ["SP", 3, 0, 16, [1], 1], ["AN", 3, 1, 2], ["FFSP", 3, 0, [10, 9], 1, 1], ["AN", 3, 1, 6], ["FU", 1, [0, 1]], ["SP", 1, 0, 64, [1], 1], ["AN", 1, 1, 2], ["FFSP", 1, 0, [10, 9], 1, 1], ["AN", 1, 1, 6], ["PR", 4, 0, "auto_unroll_max_step$512"]]]], "r": [[0.000286531, 0.000286521], 0, 3.15021, 1653070928], "v": "v0.6"}
{"i": [["[\"626fb653e298f4cd4434364b5f2ed39c\", [32, 512], [1024, 512], [1, 1024], [32, 1024]]", "cuda -keys=cuda,gpu -arch=sm_80 -max_num_threads=1024 -thread_warp_size=32", [-1, 16, 64, 49152, 2147483647, 1024, 8, 32], "", 0, []], [[], [["CI", 11], ["CI", 10], ["CI", 9], ["CI", 8], ["CI", 7], ["CI", 6], ["CI", 5], ["CI", 4], ["CHW", 2, "local"], ["SP", 2, 0, 32, [8, 2, 1, 1], 1], ["SP", 2, 5, 1024, [1, 64, 2, 4], 1], ["SP", 2, 10, 512, [1, 2], 1], ["RE", 2, [0, 5, 1, 6, 2, 7, 10, 11, 3, 8, 12, 4, 9]], ["FSP", 3, 0, 9, 3], ["FSP", 3, 4, 10, 3], ["RE", 3, [0, 4, 1, 5, 2, 6, 3, 7]], ["CA", 2, 3, 5], ["CHR", 1, "shared", [2]], ["CA", 2, 3, 6], ["CHR", 0, "shared", [3]], ["CA", 1, 4, 6], ["FU", 15, [0, 1]], ["SP", 15, 0, 32768, [32], 1], ["AN", 15, 0, 5], ["AN", 15, 1, 6], ["FU", 5, [0, 1]], ["AN", 5, 0, 5], ["FU", 5, [1, 2]], ["AN", 5, 1, 4], ["FU", 5, [2, 3]], ["AN", 5, 2, 6], ["FU", 3, [0, 1]], ["SP", 3, 0, 32, [32], 1], ["AN", 3, 1, 2], ["FFSP", 3, 0, [10, 9], 1, 1], ["AN", 3, 1, 6], ["FU", 1, [0, 1]], ["SP", 1, 0, 4, [4], 1], ["AN", 1, 1, 2], ["FFSP", 1, 0, [10, 9], 1, 1], ["AN", 1, 1, 6], ["PR", 4, 0, "auto_unroll_max_step$0"]]]], "r": [[0.000992376, 0.00099236], 0, 2.97744, 1653070930], "v": "v0.6"}
{"i": [["[\"626fb653e298f4cd4434364b5f2ed39c\", [32, 512], [1024, 512], [1, 1024], [32, 1024]]", "cuda -keys=cuda,gpu -arch=sm_80 -max_num_threads=1024 -thread_warp_size=32", [-1, 16, 64, 49152, 2147483647, 1024, 8, 32], "", 0, []], [[], [["CI", 11], ["CI", 10], ["CI", 9], ["CI", 8], ["CI", 7], ["CI", 6], ["CI", 5], ["CI", 4], ["CHW", 2, "local"], ["SP", 2, 0, 32, [1, 4, 1, 8], 1], ["SP", 2, 5, 1024, [1, 16, 2, 8], 1], ["SP", 2, 10, 512, [2, 16], 1], ["RE", 2, [0, 5, 1, 6, 2, 7, 10, 11, 3, 8, 12, 4, 9]], ["FSP", 3, 0, 9, 3], ["FSP", 3, 4, 10, 3], ["RE", 3, [0, 4, 1, 5, 2, 6, 3, 7]], ["CA", 2, 3, 5], ["CHR", 1, "shared", [2]], ["CA", 2, 3, 6], ["CHR", 0, "shared", [3]], ["CA", 1, 4, 6], ["FU", 15, [0, 1]], ["SP", 15, 0, 32768, [32], 1], ["AN", 15, 0, 5], ["AN", 15, 1, 6], ["FU", 5, [0, 1]], ["AN", 5, 0, 5], ["FU", 5, [1, 2]], ["AN", 5, 1, 4], ["FU", 5, [2, 3]], ["AN", 5, 2, 6], ["FU", 3, [0, 1]], ["SP", 3, 0, 512, [1], 1], ["AN", 3, 1, 2], ["FFSP", 3, 0, [10, 9], 1, 1], ["AN", 3, 1, 6], ["FU", 1, [0, 1]], ["SP", 1, 0, 256, [1], 1], ["AN", 1, 1, 2], ["FFSP", 1, 0, [10, 9], 1, 1], ["AN", 1, 1, 6], ["PR", 4, 0, "auto_unroll_max_step$64"]]]], "r": [[0.00052298, 0.00052299], 0, 4.13196, 1653070932], "v": "v0.6"}
{"i": [["[\"626fb653e298f4cd4434364b5f2ed39c\", [32, 512], [1024, 512], [1, 1024], [32, 1024]]", "cuda -keys=cuda,gpu -arch=sm_80 -max_num_threads=1024 -thread_warp_size=32", [-1, 16, 64, 49152, 2147483647, 1024, 8, 32], "", 0, []], [[], [["CI", 11], ["CI", 10], ["CI", 9], ["CI", 8], ["CI", 7], ["CI", 6], ["CI", 5], ["CI", 4], ["CHW", 2, "local"], ["SP", 2, 0, 32, [2, 2, 1, 8], 1], ["SP", 2, 5, 1024, [1, 2, 32, 4], 1], ["SP", 2, 10, 512, [2, 4], 1], ["RE", 2, [0, 5, 1, 6, 2, 7, 10, 11, 3, 8, 12, 4, 9]], ["FSP", 3, 0, 9, 3], ["FSP", 3, 4, 10, 3], ["RE", 3, [0, 4, 1, 5, 2, 6, 3, 7]], ["CA", 2, 3, 5], ["CHR", 1, "shared", [2]], ["CA", 2, 3, 6], ["CHR", 0, "shared", [3]], ["CA", 1, 4, 6], ["FU", 15, [0, 1]], ["SP", 15, 0, 32768, [32], 1], ["AN", 15, 0, 5], ["AN", 15, 1, 6], ["FU", 5, [0, 1]], ["AN", 5, 0, 5], ["FU", 5, [1, 2]], ["AN", 5, 1, 4], ["FU", 5, [2, 3]], ["AN", 5, 2, 6], ["FU", 3, [0, 1]], ["SP", 3, 0, 64, [1], 1], ["AN", 3, 1, 2], ["FFSP", 3, 0, [10, 9], 1, 1], ["AN", 3, 1, 6], ["FU", 1, [0, 1]], ["SP", 1, 0, 64, [1], 1], ["AN", 1, 1, 2], ["FFSP", 1, 0, [10, 9], 1, 1], ["AN", 1, 1, 6], ["PR", 4, 0, "auto_unroll_max_step$64"]]]], "r": [[0.0056787, 0.00567864], 0, 4.3153, 1653070933], "v": "v0.6"}
{"i": [["[\"626fb653e298f4cd4434364b5f2ed39c\", [32, 512], [1024, 512], [1, 1024], [32, 1024]]", "cuda -keys=cuda,gpu -arch=sm_80 -max_num_threads=1024 -thread_warp_size=32", [-1, 16, 64, 49152, 2147483647, 1024, 8, 32], "", 0, []], [[], [["CI", 11], ["CI", 10], ["CI", 9], ["CI", 8], ["CI", 7], ["CI", 6], ["CI", 5], ["CI", 4], ["CHW", 2, "local"], ["SP", 2, 0, 32, [2, 2, 2, 2], 1], ["SP", 2, 5, 1024, [2, 128, 1, 1], 1], ["SP", 2, 10, 512, [1, 16], 1], ["RE", 2, [0, 5, 1, 6, 2, 7, 10, 11, 3, 8, 12, 4, 9]], ["FSP", 3, 0, 9, 3], ["FSP", 3, 4, 10, 3], ["RE", 3, [0, 4, 1, 5, 2, 6, 3, 7]], ["CA", 2, 3, 5], ["CHR", 1, "shared", [2]], ["CA", 2, 3, 6], ["CHR", 0, "shared", [3]], ["CA", 1, 4, 6], ["FU", 15, [0, 1]], ["SP", 15, 0, 32768, [64], 1], ["AN", 15, 0, 5], ["AN", 15, 1, 6], ["FU", 5, [0, 1]], ["AN", 5, 0, 5], ["FU", 5, [1, 2]], ["AN", 5, 1, 4], ["FU", 5, [2, 3]], ["AN", 5, 2, 6], ["FU", 3, [0, 1]], ["SP", 3, 0, 16, [1], 1], ["AN", 3, 1, 2], ["FFSP", 3, 0, [10, 9], 1, 1], ["AN", 3, 1, 6], ["FU", 1, [0, 1]], ["SP", 1, 0, 64, [64], 1], ["AN", 1, 1, 2], ["FFSP", 1, 0, [10, 9], 1, 1], ["AN", 1, 1, 6], ["PR", 4, 0, "auto_unroll_max_step$512"]]]], "r": [[0.000176096, 0.000176102], 0, 3.77989, 1653070934], "v": "v0.6"}
{"i": [["[\"626fb653e298f4cd4434364b5f2ed39c\", [32, 512], [1024, 512], [1, 1024], [32, 1024]]", "cuda -keys=cuda,gpu -arch=sm_80 -max_num_threads=1024 -thread_warp_size=32", [-1, 16, 64, 49152, 2147483647, 1024, 8, 32], "", 0, []], [[], [["CI", 11], ["CI", 10], ["CI", 9], ["CI", 8], ["CI", 7], ["CI", 6], ["CI", 5], ["CI", 4], ["CHW", 2, "local"], ["SP", 2, 0, 32, [1, 32, 1, 1], 1], ["SP", 2, 5, 1024, [2, 4, 2, 2], 1], ["SP", 2, 10, 512, [1, 2], 1], ["RE", 2, [0, 5, 1, 6, 2, 7, 10, 11, 3, 8, 12, 4, 9]], ["FSP", 3, 0, 9, 3], ["FSP", 3, 4, 10, 3], ["RE", 3, [0, 4, 1, 5, 2, 6, 3, 7]], ["CA", 2, 3, 5], ["CHR", 1, "shared", [2]], ["CA", 2, 3, 6], ["CHR", 0, "shared", [3]], ["CA", 1, 4, 6], ["FU", 15, [0, 1]], ["SP", 15, 0, 32768, [32], 1], ["AN", 15, 0, 5], ["AN", 15, 1, 6], ["FU", 5, [0, 1]], ["AN", 5, 0, 5], ["FU", 5, [1, 2]], ["AN", 5, 1, 4], ["FU", 5, [2, 3]], ["AN", 5, 2, 6], ["FU", 3, [0, 1]], ["SP", 3, 0, 16, [1], 1], ["AN", 3, 1, 2], ["FFSP", 3, 0, [10, 9], 1, 1], ["AN", 3, 1, 6], ["FU", 1, [0, 1]], ["SP", 1, 0, 8, [1], 1], ["AN", 1, 1, 2], ["FFSP", 1, 0, [10, 9], 1, 1], ["AN", 1, 1, 6], ["PR", 4, 0, "auto_unroll_max_step$64"]]]], "r": [[0.000102073, 0.000102085], 0, 3.00046, 1653070936], "v": "v0.6"}
{"i": [["[\"626fb653e298f4cd4434364b5f2ed39c\", [32, 512], [1024, 512], [1, 1024], [32, 1024]]", "cuda -keys=cuda,gpu -arch=sm_80 -max_num_threads=1024 -thread_warp_size=32", [-1, 16, 64, 49152, 2147483647, 1024, 8, 32], "", 0, []], [[], [["CI", 11], ["CI", 10], ["CI", 9], ["CI", 8], ["CI", 7], ["CI", 6], ["CI", 5], ["CI", 4], ["CHW", 2, "local"], ["SP", 2, 0, 32, [1, 16, 1, 2], 1], ["SP", 2, 5, 1024, [8, 4, 16, 2], 1], ["SP", 2, 10, 512, [2, 1], 1], ["RE", 2, [0, 5, 1, 6, 2, 7, 10, 11, 3, 8, 12, 4, 9]], ["FSP", 3, 0, 9, 3], ["FSP", 3, 4, 10, 3], ["RE", 3, [0, 4, 1, 5, 2, 6, 3, 7]], ["CA", 2, 3, 5], ["CHR", 1, "shared", [2]], ["CA", 2, 3, 6], ["CHR", 0, "shared", [3]], ["CA", 1, 4, 6], ["FU", 15, [0, 1]], ["SP", 15, 0, 32768, [32], 1], ["AN", 15, 0, 5], ["AN", 15, 1, 6], ["FU", 5, [0, 1]], ["AN", 5, 0, 5], ["FU", 5, [1, 2]], ["AN", 5, 1, 4], ["FU", 5, [2, 3]], ["AN", 5, 2, 6], ["FU", 3, [0, 1]], ["SP", 3, 0, 64, [1], 1], ["AN", 3, 1, 2], ["FFSP", 3, 0, [10, 9], 1, 1], ["AN", 3, 1, 6], ["FU", 1, [0, 1]], ["SP", 1, 0, 4, [1], 1], ["AN", 1, 1, 2], ["FFSP", 1, 0, [10, 9], 1, 1], ["AN", 1, 1, 6], ["PR", 4, 0, "auto_unroll_max_step$64"]]]], "r": [[0.0067856, 0.00678591], 0, 3.65895, 1653070937], "v": "v0.6"}
{"i": [["[\"626fb653e298f4cd4434364b5f2ed39c\", [32, 512], [1024, 512], [1, 1024], [32, 1024]]", "cuda -keys=cuda,gpu -arch=sm_80 -max_num_threads=1024 -thread_warp_size=32", [-1, 16, 64, 49152, 2147483647, 1024, 8, 32], "", 0, []], [[], [["CI", 11], ["CI", 10], ["CI", 9], ["CI", 8], ["CI", 7], ["CI", 6], ["CI", 5], ["CI", 4], ["CHW", 2, "local"], ["SP", 2, 0, 32, [1, 16, 1, 1], 1], ["SP", 2, 5, 1024, [1, 4, 1, 64], 1], ["SP", 2, 10, 512, [1, 2], 1], ["RE", 2, [0, 5, 1, 6, 2, 7, 10, 11, 3, 8, 12, 4, 9]], ["FSP", 3, 0, 9, 3], ["FSP", 3, 4, 10, 3], ["RE", 3, [0, 4, 1, 5, 2, 6, 3, 7]], ["CA", 2, 3, 5], ["CHR", 1, "shared", [2]], ["CA", 2, 3, 6], ["CHR", 0, "shared", [3]], ["CA", 1, 4, 6], ["FU", 15, [0, 1]], ["SP", 15, 0, 32768, [8], 1], ["AN", 15, 0, 5], ["AN", 15, 1, 6], ["FU", 5, [0, 1]], ["AN", 5, 0, 5], ["FU", 5, [1, 2]], ["AN", 5, 1, 4], ["FU", 5, [2, 3]], ["AN", 5, 2, 6], ["FU", 3, [0, 1]], ["SP", 3, 0, 64, [1], 1], ["AN", 3, 1, 2], ["FFSP", 3, 0, [10, 9], 1, 1], ["AN", 3, 1, 6], ["FU", 1, [0, 1]], ["SP", 1, 0, 1, [1], 1], ["AN", 1, 1, 2], ["FFSP", 1, 0, [10, 9], 1, 1], ["AN", 1, 1, 6], ["PR", 4, 0, "auto_unroll_max_step$1024"]]]], "r": [[0.000540593, 0.000540632], 0, 3.06213, 1653070939], "v": "v0.6"}
{"i": [["[\"626fb653e298f4cd4434364b5f2ed39c\", [32, 512], [1024, 512], [1, 1024], [32, 1024]]", "cuda -keys=cuda,gpu -arch=sm_80 -max_num_threads=1024 -thread_warp_size=32", [-1, 16, 64, 49152, 2147483647, 1024, 8, 32], "", 0, []], [[], [["CI", 11], ["CI", 10], ["CI", 9], ["CI", 8], ["CI", 7], ["CI", 6], ["CI", 5], ["CI", 4], ["CHW", 2, "local"], ["SP", 2, 0, 32, [2, 1, 4, 4], 1], ["SP", 2, 5, 1024, [2, 32, 4, 2], 1], ["SP", 2, 10, 512, [1, 8], 1], ["RE", 2, [0, 5, 1, 6, 2, 7, 10, 11, 3, 8, 12, 4, 9]], ["FSP", 3, 0, 9, 3], ["FSP", 3, 4, 10, 3], ["RE", 3, [0, 4, 1, 5, 2, 6, 3, 7]], ["CA", 2, 3, 5], ["CHR", 1, "shared", [2]], ["CA", 2, 3, 6], ["CHR", 0, "shared", [3]], ["CA", 1, 4, 6], ["FU", 15, [0, 1]], ["SP", 15, 0, 32768, [32], 1], ["AN", 15, 0, 5], ["AN", 15, 1, 6], ["FU", 5, [0, 1]], ["AN", 5, 0, 5], ["FU", 5, [1, 2]], ["AN", 5, 1, 4], ["FU", 5, [2, 3]], ["AN", 5, 2, 6], ["FU", 3, [0, 1]], ["SP", 3, 0, 32, [1], 1], ["AN", 3, 1, 2], ["FFSP", 3, 0, [10, 9], 1, 1], ["AN", 3, 1, 6], ["FU", 1, [0, 1]], ["SP", 1, 0, 128, [1], 1], ["AN", 1, 1, 2], ["FFSP", 1, 0, [10, 9], 1, 1], ["AN", 1, 1, 6], ["PR", 4, 0, "auto_unroll_max_step$512"]]]], "r": [[0.00135052, 0.00135052], 0, 5.04119, 1653070940], "v": "v0.6"}
{"i": [["[\"626fb653e298f4cd4434364b5f2ed39c\", [32, 512], [1024, 512], [1, 1024], [32, 1024]]", "cuda -keys=cuda,gpu -arch=sm_80 -max_num_threads=1024 -thread_warp_size=32", [-1, 16, 64, 49152, 2147483647, 1024, 8, 32], "", 0, []], [[], [["CI", 11], ["CI", 10], ["CI", 9], ["CI", 8], ["CI", 7], ["CI", 6], ["CI", 5], ["CI", 4], ["CHW", 2, "local"], ["SP", 2, 0, 32, [1, 8, 2, 1], 1], ["SP", 2, 5, 1024, [2, 4, 2, 1], 1], ["SP", 2, 10, 512, [8, 16], 1], ["RE", 2, [0, 5, 1, 6, 2, 7, 10, 11, 3, 8, 12, 4, 9]], ["FSP", 3, 0, 9, 3], ["FSP", 3, 4, 10, 3], ["RE", 3, [0, 4, 1, 5, 2, 6, 3, 7]], ["CA", 2, 3, 5], ["CHR", 1, "shared", [2]], ["CA", 2, 3, 6], ["CHR", 0, "shared", [3]], ["CA", 1, 4, 6], ["FU", 15, [0, 1]], ["SP", 15, 0, 32768, [32], 1], ["AN", 15, 0, 5], ["AN", 15, 1, 6], ["FU", 5, [0, 1]], ["AN", 5, 0, 5], ["FU", 5, [1, 2]], ["AN", 5, 1, 4], ["FU", 5, [2, 3]], ["AN", 5, 2, 6], ["FU", 3, [0, 1]], ["SP", 3, 0, 256, [2], 1], ["AN", 3, 1, 2], ["FFSP", 3, 0, [10, 9], 1, 1], ["AN", 3, 1, 6], ["FU", 1, [0, 1]], ["SP", 1, 0, 256, [1], 1], ["AN", 1, 1, 2], ["FFSP", 1, 0, [10, 9], 1, 1], ["AN", 1, 1, 6], ["PR", 4, 0, "auto_unroll_max_step$16"]]]], "r": [[4.73001e-05, 4.73023e-05], 0, 3.16515, 1653070942], "v": "v0.6"}
{"i": [["[\"626fb653e298f4cd4434364b5f2ed39c\", [32, 512], [1024, 512], [1, 1024], [32, 1024]]", "cuda -keys=cuda,gpu -arch=sm_80 -max_num_threads=1024 -thread_warp_size=32", [-1, 16, 64, 49152, 2147483647, 1024, 8, 32], "", 0, []], [[], [["CI", 11], ["CI", 10], ["CI", 9], ["CI", 8], ["CI", 7], ["CI", 6], ["CI", 5], ["CI", 4], ["CHW", 2, "local"], ["SP", 2, 0, 32, [8, 1, 1, 1], 1], ["SP", 2, 5, 1024, [1, 64, 2, 4], 1], ["SP", 2, 10, 512, [2, 2], 1], ["RE", 2, [0, 5, 1, 6, 2, 7, 10, 11, 3, 8, 12, 4, 9]], ["FSP", 3, 0, 9, 3], ["FSP", 3, 4, 10, 3], ["RE", 3, [0, 4, 1, 5, 2, 6, 3, 7]], ["CA", 2, 3, 5], ["CHR", 1, "shared", [2]], ["CA", 2, 3, 6], ["CHR", 0, "shared", [3]], ["CA", 1, 4, 6], ["FU", 15, [0, 1]], ["SP", 15, 0, 32768, [16], 1], ["AN", 15, 0, 5], ["AN", 15, 1, 6], ["FU", 5, [0, 1]], ["AN", 5, 0, 5], ["FU", 5, [1, 2]], ["AN", 5, 1, 4], ["FU", 5, [2, 3]], ["AN", 5, 2, 6], ["FU", 3, [0, 1]], ["SP", 3, 0, 32, [1], 1], ["AN", 3, 1, 2], ["FFSP", 3, 0, [10, 9], 1, 1], ["AN", 3, 1, 6], ["FU", 1, [0, 1]], ["SP", 1, 0, 4, [1], 1], ["AN", 1, 1, 2], ["FFSP", 1, 0, [10, 9], 1, 1], ["AN", 1, 1, 6], ["PR", 4, 0, "auto_unroll_max_step$0"]]]], "r": [[0.000355709, 0.000355697], 0, 3.01126, 1653070944], "v": "v0.6"}
{"i": [["[\"626fb653e298f4cd4434364b5f2ed39c\", [32, 512], [1024, 512], [1, 1024], [32, 1024]]", "cuda -keys=cuda,gpu -arch=sm_80 -max_num_threads=1024 -thread_warp_size=32", [-1, 16, 64, 49152, 2147483647, 1024, 8, 32], "", 0, []], [[], [["CI", 11], ["CI", 10], ["CI", 9], ["CI", 8], ["CI", 7], ["CI", 6], ["CI", 5], ["CI", 4], ["CHW", 2, "local"], ["SP", 2, 0, 32, [1, 32, 1, 1], 1], ["SP", 2, 5, 1024, [1, 4, 4, 1], 1], ["SP", 2, 10, 512, [2, 16], 1], ["RE", 2, [0, 5, 1, 6, 2, 7, 10, 11, 3, 8, 12, 4, 9]], ["FSP", 3, 0, 9, 3], ["FSP", 3, 4, 10, 3], ["RE", 3, [0, 4, 1, 5, 2, 6, 3, 7]], ["CA", 2, 3, 5], ["CHR", 1, "shared", [2]], ["CA", 2, 3, 6], ["CHR", 0, "shared", [3]], ["CA", 1, 4, 6], ["FU", 15, [0, 1]], ["SP", 15, 0, 32768, [32], 1], ["AN", 15, 0, 5], ["AN", 15, 1, 6], ["FU", 5, [0, 1]], ["AN", 5, 0, 5], ["FU", 5, [1, 2]], ["AN", 5, 1, 4], ["FU", 5, [2, 3]], ["AN", 5, 2, 6], ["FU", 3, [0, 1]], ["SP", 3, 0, 128, [1], 1], ["AN", 3, 1, 2], ["FFSP", 3, 0, [10, 9], 1, 1], ["AN", 3, 1, 6], ["FU", 1, [0, 1]], ["SP", 1, 0, 32, [1], 1], ["AN", 1, 1, 2], ["FFSP", 1, 0, [10, 9], 1, 1], ["AN", 1, 1, 6], ["PR", 4, 0, "auto_unroll_max_step$1024"]]]], "r": [[6.88549e-05, 6.88542e-05], 0, 3.14112, 1653070945], "v": "v0.6"}
{"i": [["[\"626fb653e298f4cd4434364b5f2ed39c\", [32, 512], [1024, 512], [1, 1024], [32, 1024]]", "cuda -keys=cuda,gpu -arch=sm_80 -max_num_threads=1024 -thread_warp_size=32", [-1, 16, 64, 49152, 2147483647, 1024, 8, 32], "", 0, []], [[], [["CI", 11], ["CI", 10], ["CI", 9], ["CI", 8], ["CI", 7], ["CI", 6], ["CI", 5], ["CI", 4], ["CHW", 2, "local"], ["SP", 2, 0, 32, [1, 1, 1, 8], 1], ["SP", 2, 5, 1024, [1, 512, 2, 1], 1], ["SP", 2, 10, 512, [1, 8], 1], ["RE", 2, [0, 5, 1, 6, 2, 7, 10, 11, 3, 8, 12, 4, 9]], ["FSP", 3, 0, 9, 3], ["FSP", 3, 4, 10, 3], ["RE", 3, [0, 4, 1, 5, 2, 6, 3, 7]], ["CA", 2, 3, 5], ["CHR", 1, "shared", [2]], ["CA", 2, 3, 6], ["CHR", 0, "shared", [3]], ["CA", 1, 4, 6], ["FU", 15, [0, 1]], ["SP", 15, 0, 32768, [64], 1], ["AN", 15, 0, 5], ["AN", 15, 1, 6], ["FU", 5, [0, 1]], ["AN", 5, 0, 5], ["FU", 5, [1, 2]], ["AN", 5, 1, 4], ["FU", 5, [2, 3]], ["AN", 5, 2, 6], ["FU", 3, [0, 1]], ["SP", 3, 0, 16, [1], 1], ["AN", 3, 1, 2], ["FFSP", 3, 0, [10, 9], 1, 1], ["AN", 3, 1, 6], ["FU", 1, [0, 1]], ["SP", 1, 0, 64, [1], 1], ["AN", 1, 1, 2], ["FFSP", 1, 0, [10, 9], 1, 1], ["AN", 1, 1, 6], ["PR", 4, 0, "auto_unroll_max_step$512"]]]], "r": [[0.000285542, 0.000285575], 0, 2.84579, 1653070947], "v": "v0.6"}
{"i": [["[\"626fb653e298f4cd4434364b5f2ed39c\", [32, 512], [1024, 512], [1, 1024], [32, 1024]]", "cuda -keys=cuda,gpu -arch=sm_80 -max_num_threads=1024 -thread_warp_size=32", [-1, 16, 64, 49152, 2147483647, 1024, 8, 32], "", 0, []], [[], [["CI", 11], ["CI", 10], ["CI", 9], ["CI", 8], ["CI", 7], ["CI", 6], ["CI", 5], ["CI", 4], ["CHW", 2, "local"], ["SP", 2, 0, 32, [2, 4, 2, 1], 1], ["SP", 2, 5, 1024, [1, 8, 8, 1], 1], ["SP", 2, 10, 512, [1, 16], 1], ["RE", 2, [0, 5, 1, 6, 2, 7, 10, 11, 3, 8, 12, 4, 9]], ["FSP", 3, 0, 9, 3], ["FSP", 3, 4, 10, 3], ["RE", 3, [0, 4, 1, 5, 2, 6, 3, 7]], ["CA", 2, 3, 5], ["CHR", 1, "shared", [2]], ["CA", 2, 3, 6], ["CHR", 0, "shared", [3]], ["CA", 1, 4, 6], ["FU", 15, [0, 1]], ["SP", 15, 0, 32768, [2], 1], ["AN", 15, 0, 5], ["AN", 15, 1, 6], ["FU", 5, [0, 1]], ["AN", 5, 0, 5], ["FU", 5, [1, 2]], ["AN", 5, 1, 4], ["FU", 5, [2, 3]], ["AN", 5, 2, 6], ["FU", 3, [0, 1]], ["SP", 3, 0, 128, [2], 1], ["AN", 3, 1, 2], ["FFSP", 3, 0, [10, 9], 1, 1], ["AN", 3, 1, 6], ["FU", 1, [0, 1]], ["SP", 1, 0, 32, [1], 1], ["AN", 1, 1, 2], ["FFSP", 1, 0, [10, 9], 1, 1], ["AN", 1, 1, 6], ["PR", 4, 0, "auto_unroll_max_step$16"]]]], "r": [[0.000165452, 0.000165455], 0, 3.38453, 1653070948], "v": "v0.6"}
{"i": [["[\"626fb653e298f4cd4434364b5f2ed39c\", [32, 512], [1024, 512], [1, 1024], [32, 1024]]", "cuda -keys=cuda,gpu -arch=sm_80 -max_num_threads=1024 -thread_warp_size=32", [-1, 16, 64, 49152, 2147483647, 1024, 8, 32], "", 0, []], [[], [["CI", 11], ["CI", 10], ["CI", 9], ["CI", 8], ["CI", 7], ["CI", 6], ["CI", 5], ["CI", 4], ["CHW", 2, "local"], ["SP", 2, 0, 32, [1, 2, 2, 8], 1], ["SP", 2, 5, 1024, [2, 32, 2, 1], 1], ["SP", 2, 10, 512, [1, 1], 1], ["RE", 2, [0, 5, 1, 6, 2, 7, 10, 11, 3, 8, 12, 4, 9]], ["FSP", 3, 0, 9, 3], ["FSP", 3, 4, 10, 3], ["RE", 3, [0, 4, 1, 5, 2, 6, 3, 7]], ["CA", 2, 3, 5], ["CHR", 1, "shared", [2]], ["CA", 2, 3, 6], ["CHR", 0, "shared", [3]], ["CA", 1, 4, 6], ["FU", 15, [0, 1]], ["SP", 15, 0, 32768, [32], 1], ["AN", 15, 0, 5], ["AN", 15, 1, 6], ["FU", 5, [0, 1]], ["AN", 5, 0, 5], ["FU", 5, [1, 2]], ["AN", 5, 1, 4], ["FU", 5, [2, 3]], ["AN", 5, 2, 6], ["FU", 3, [0, 1]], ["SP", 3, 0, 2, [2], 1], ["AN", 3, 1, 2], ["FFSP", 3, 0, [10, 9], 1, 1], ["AN", 3, 1, 6], ["FU", 1, [0, 1]], ["SP", 1, 0, 16, [1], 1], ["AN", 1, 1, 2], ["FFSP", 1, 0, [10, 9], 1, 1], ["AN", 1, 1, 6], ["PR", 4, 0, "auto_unroll_max_step$1024"]]]], "r": [[0.000317272, 0.000317271], 0, 2.82431, 1653070950], "v": "v0.6"}
{"i": [["[\"626fb653e298f4cd4434364b5f2ed39c\", [32, 512], [1024, 512], [1, 1024], [32, 1024]]", "cuda -keys=cuda,gpu -arch=sm_80 -max_num_threads=1024 -thread_warp_size=32", [-1, 16, 64, 49152, 2147483647, 1024, 8, 32], "", 0, []], [[], [["CI", 11], ["CI", 10], ["CI", 9], ["CI", 8], ["CI", 7], ["CI", 6], ["CI", 5], ["CI", 4], ["CHW", 2, "local"], ["SP", 2, 0, 32, [1, 2, 2, 8], 1], ["SP", 2, 5, 1024, [2, 32, 2, 1], 1], ["SP", 2, 10, 512, [1, 64], 1], ["RE", 2, [0, 5, 1, 6, 2, 7, 10, 11, 3, 8, 12, 4, 9]], ["FSP", 3, 0, 9, 3], ["FSP", 3, 4, 10, 3], ["RE", 3, [0, 4, 1, 5, 2, 6, 3, 7]], ["CA", 2, 3, 5], ["CHR", 1, "shared", [2]], ["CA", 2, 3, 6], ["CHR", 0, "shared", [3]], ["CA", 1, 4, 6], ["FU", 15, [0, 1]], ["SP", 15, 0, 32768, [32], 1], ["AN", 15, 0, 5], ["AN", 15, 1, 6], ["FU", 5, [0, 1]], ["AN", 5, 0, 5], ["FU", 5, [1, 2]], ["AN", 5, 1, 4], ["FU", 5, [2, 3]], ["AN", 5, 2, 6], ["FU", 3, [0, 1]], ["SP", 3, 0, 2, [1], 1], ["AN", 3, 1, 2], ["FFSP", 3, 0, [10, 9], 1, 1], ["AN", 3, 1, 6], ["FU", 1, [0, 1]], ["SP", 1, 0, 16, [1], 1], ["AN", 1, 1, 2], ["FFSP", 1, 0, [10, 9], 1, 1], ["AN", 1, 1, 6], ["PR", 4, 0, "auto_unroll_max_step$1024"]]]], "r": [[0.000247473, 0.000247501], 0, 8.74108, 1653070952], "v": "v0.6"}
{"i": [["[\"626fb653e298f4cd4434364b5f2ed39c\", [32, 512], [1024, 512], [1, 1024], [32, 1024]]", "cuda -keys=cuda,gpu -arch=sm_80 -max_num_threads=1024 -thread_warp_size=32", [-1, 16, 64, 49152, 2147483647, 1024, 8, 32], "", 0, []], [[], [["CI", 11], ["CI", 10], ["CI", 9], ["CI", 8], ["CI", 7], ["CI", 6], ["CI", 5], ["CI", 4], ["CHW", 2, "local"], ["SP", 2, 0, 32, [1, 16, 1, 1], 1], ["SP", 2, 5, 1024, [2, 32, 2, 4], 1], ["SP", 2, 10, 512, [4, 1], 1], ["RE", 2, [0, 5, 1, 6, 2, 7, 10, 11, 3, 8, 12, 4, 9]], ["FSP", 3, 0, 9, 3], ["FSP", 3, 4, 10, 3], ["RE", 3, [0, 4, 1, 5, 2, 6, 3, 7]], ["CA", 2, 3, 5], ["CHR", 1, "shared", [2]], ["CA", 2, 3, 6], ["CHR", 0, "shared", [3]], ["CA", 1, 4, 6], ["FU", 15, [0, 1]], ["SP", 15, 0, 32768, [32], 1], ["AN", 15, 0, 5], ["AN", 15, 1, 6], ["FU", 5, [0, 1]], ["AN", 5, 0, 5], ["FU", 5, [1, 2]], ["AN", 5, 1, 4], ["FU", 5, [2, 3]], ["AN", 5, 2, 6], ["FU", 3, [0, 1]], ["SP", 3, 0, 32, [1], 1], ["AN", 3, 1, 2], ["FFSP", 3, 0, [10, 9], 1, 1], ["AN", 3, 1, 6], ["FU", 1, [0, 1]], ["SP", 1, 0, 4, [1], 1], ["AN", 1, 1, 2], ["FFSP", 1, 0, [10, 9], 1, 1], ["AN", 1, 1, 6], ["PR", 4, 0, "auto_unroll_max_step$16"]]]], "r": [[0.00155634, 0.00155634], 0, 2.02934, 1653070953], "v": "v0.6"}
{"i": [["[\"626fb653e298f4cd4434364b5f2ed39c\", [32, 512], [1024, 512], [1, 1024], [32, 1024]]", "cuda -keys=cuda,gpu -arch=sm_80 -max_num_threads=1024 -thread_warp_size=32", [-1, 16, 64, 49152, 2147483647, 1024, 8, 32], "", 0, []], [[], [["CI", 11], ["CI", 10], ["CI", 9], ["CI", 8], ["CI", 7], ["CI", 6], ["CI", 5], ["CI", 4], ["CHW", 2, "local"], ["SP", 2, 0, 32, [2, 2, 8, 1], 1], ["SP", 2, 5, 1024, [4, 32, 1, 2], 1], ["SP", 2, 10, 512, [1, 1], 1], ["RE", 2, [0, 5, 1, 6, 2, 7, 10, 11, 3, 8, 12, 4, 9]], ["FSP", 3, 0, 9, 3], ["FSP", 3, 4, 10, 3], ["RE", 3, [0, 4, 1, 5, 2, 6, 3, 7]], ["CA", 2, 3, 5], ["CHR", 1, "shared", [2]], ["CA", 2, 3, 6], ["CHR", 0, "shared", [3]], ["CA", 1, 4, 6], ["FU", 15, [0, 1]], ["SP", 15, 0, 32768, [16], 1], ["AN", 15, 0, 5], ["AN", 15, 1, 6], ["FU", 5, [0, 1]], ["AN", 5, 0, 5], ["FU", 5, [1, 2]], ["AN", 5, 1, 4], ["FU", 5, [2, 3]], ["AN", 5, 2, 6], ["FU", 3, [0, 1]], ["SP", 3, 0, 2, [1], 1], ["AN", 3, 1, 2], ["FFSP", 3, 0, [10, 9], 1, 1], ["AN", 3, 1, 6], ["FU", 1, [0, 1]], ["SP", 1, 0, 8, [1], 1], ["AN", 1, 1, 2], ["FFSP", 1, 0, [10, 9], 1, 1], ["AN", 1, 1, 6], ["PR", 4, 0, "auto_unroll_max_step$0"]]]], "r": [[0.000552948, 0.000552935], 0, 2.92029, 1653070954], "v": "v0.6"}
{"i": [["[\"626fb653e298f4cd4434364b5f2ed39c\", [32, 512], [1024, 512], [1, 1024], [32, 1024]]", "cuda -keys=cuda,gpu -arch=sm_80 -max_num_threads=1024 -thread_warp_size=32", [-1, 16, 64, 49152, 2147483647, 1024, 8, 32], "", 0, []], [[], [["CI", 11], ["CI", 10], ["CI", 9], ["CI", 8], ["CI", 7], ["CI", 6], ["CI", 5], ["CI", 4], ["CHW", 2, "local"], ["SP", 2, 0, 32, [1, 4, 4, 1], 1], ["SP", 2, 5, 1024, [2, 32, 1, 2], 1], ["SP", 2, 10, 512, [1, 64], 1], ["RE", 2, [0, 5, 1, 6, 2, 7, 10, 11, 3, 8, 12, 4, 9]], ["FSP", 3, 0, 9, 3], ["FSP", 3, 4, 10, 3], ["RE", 3, [0, 4, 1, 5, 2, 6, 3, 7]], ["CA", 2, 3, 5], ["CHR", 1, "shared", [2]], ["CA", 2, 3, 6], ["CHR", 0, "shared", [3]], ["CA", 1, 4, 6], ["FU", 15, [0, 1]], ["SP", 15, 0, 32768, [32], 1], ["AN", 15, 0, 5], ["AN", 15, 1, 6], ["FU", 5, [0, 1]], ["AN", 5, 0, 5], ["FU", 5, [1, 2]], ["AN", 5, 1, 4], ["FU", 5, [2, 3]], ["AN", 5, 2, 6], ["FU", 3, [0, 1]], ["SP", 3, 0, 64, [4], 1], ["AN", 3, 1, 2], ["FFSP", 3, 0, [10, 9], 1, 1], ["AN", 3, 1, 6], ["FU", 1, [0, 1]], ["SP", 1, 0, 64, [1], 1], ["AN", 1, 1, 2], ["FFSP", 1, 0, [10, 9], 1, 1], ["AN", 1, 1, 6], ["PR", 4, 0, "auto_unroll_max_step$512"]]]], "r": [[0.000122204, 0.000122199], 0, 3.77117, 1653070956], "v": "v0.6"}
{"i": [["[\"626fb653e298f4cd4434364b5f2ed39c\", [32, 512], [1024, 512], [1, 1024], [32, 1024]]", "cuda -keys=cuda,gpu -arch=sm_80 -max_num_threads=1024 -thread_warp_size=32", [-1, 16, 64, 49152, 2147483647, 1024, 8, 32], "", 0, []], [[], [["CI", 11], ["CI", 10], ["CI", 9], ["CI", 8], ["CI", 7], ["CI", 6], ["CI", 5], ["CI", 4], ["CHW", 2, "local"], ["SP", 2, 0, 32, [2, 1, 1, 1], 1], ["SP", 2, 5, 1024, [1, 32, 2, 4], 1], ["SP", 2, 10, 512, [1, 4], 1], ["RE", 2, [0, 5, 1, 6, 2, 7, 10, 11, 3, 8, 12, 4, 9]], ["FSP", 3, 0, 9, 3], ["FSP", 3, 4, 10, 3], ["RE", 3, [0, 4, 1, 5, 2, 6, 3, 7]], ["CA", 2, 3, 5], ["CHR", 1, "shared", [2]], ["CA", 2, 3, 6], ["CHR", 0, "shared", [3]], ["CA", 1, 4, 6], ["FU", 15, [0, 1]], ["SP", 15, 0, 32768, [32], 1], ["AN", 15, 0, 5], ["AN", 15, 1, 6], ["FU", 5, [0, 1]], ["AN", 5, 0, 5], ["FU", 5, [1, 2]], ["AN", 5, 1, 4], ["FU", 5, [2, 3]], ["AN", 5, 2, 6], ["FU", 3, [0, 1]], ["SP", 3, 0, 64, [64], 1], ["AN", 3, 1, 2], ["FFSP", 3, 0, [10, 9], 1, 1], ["AN", 3, 1, 6], ["FU", 1, [0, 1]], ["SP", 1, 0, 8, [1], 1], ["AN", 1, 1, 2], ["FFSP", 1, 0, [10, 9], 1, 1], ["AN", 1, 1, 6], ["PR", 4, 0, "auto_unroll_max_step$64"]]]], "r": [[0.00043253, 0.000432511], 0, 2.77774, 1653070958], "v": "v0.6"}
{"i": [["[\"626fb653e298f4cd4434364b5f2ed39c\", [32, 512], [1024, 512], [1, 1024], [32, 1024]]", "cuda -keys=cuda,gpu -arch=sm_80 -max_num_threads=1024 -thread_warp_size=32", [-1, 16, 64, 49152, 2147483647, 1024, 8, 32], "", 0, []], [[], [["CI", 11], ["CI", 10], ["CI", 9], ["CI", 8], ["CI", 7], ["CI", 6], ["CI", 5], ["CI", 4], ["CHW", 2, "local"], ["SP", 2, 0, 32, [2, 16, 1, 1], 1], ["SP", 2, 5, 1024, [1, 4, 2, 4], 1], ["SP", 2, 10, 512, [16, 1], 1], ["RE", 2, [0, 5, 1, 6, 2, 7, 10, 11, 3, 8, 12, 4, 9]], ["FSP", 3, 0, 9, 3], ["FSP", 3, 4, 10, 3], ["RE", 3, [0, 4, 1, 5, 2, 6, 3, 7]], ["CA", 2, 3, 5], ["CHR", 1, "shared", [2]], ["CA", 2, 3, 6], ["CHR", 0, "shared", [3]], ["CA", 1, 4, 6], ["FU", 15, [0, 1]], ["SP", 15, 0, 32768, [32], 1], ["AN", 15, 0, 5], ["AN", 15, 1, 6], ["FU", 5, [0, 1]], ["AN", 5, 0, 5], ["FU", 5, [1, 2]], ["AN", 5, 1, 4], ["FU", 5, [2, 3]], ["AN", 5, 2, 6], ["FU", 3, [0, 1]], ["SP", 3, 0, 64, [1], 1], ["AN", 3, 1, 2], ["FFSP", 3, 0, [10, 9], 1, 1], ["AN", 3, 1, 6], ["FU", 1, [0, 1]], ["SP", 1, 0, 16, [1], 1], ["AN", 1, 1, 2], ["FFSP", 1, 0, [10, 9], 1, 1], ["AN", 1, 1, 6], ["PR", 4, 0, "auto_unroll_max_step$0"]]]], "r": [[8.58586e-05, 8.58455e-05], 0, 2.74665, 1653070959], "v": "v0.6"}
{"i": [["[\"626fb653e298f4cd4434364b5f2ed39c\", [32, 512], [1024, 512], [1, 1024], [32, 1024]]", "cuda -keys=cuda,gpu -arch=sm_80 -max_num_threads=1024 -thread_warp_size=32", [-1, 16, 64, 49152, 2147483647, 1024, 8, 32], "", 0, []], [[], [["CI", 11], ["CI", 10], ["CI", 9], ["CI", 8], ["CI", 7], ["CI", 6], ["CI", 5], ["CI", 4], ["CHW", 2, "local"], ["SP", 2, 0, 32, [1, 1, 1, 4], 1], ["SP", 2, 5, 1024, [1, 32, 2, 4], 1], ["SP", 2, 10, 512, [2, 2], 1], ["RE", 2, [0, 5, 1, 6, 2, 7, 10, 11, 3, 8, 12, 4, 9]], ["FSP", 3, 0, 9, 3], ["FSP", 3, 4, 10, 3], ["RE", 3, [0, 4, 1, 5, 2, 6, 3, 7]], ["CA", 2, 3, 5], ["CHR", 1, "shared", [2]], ["CA", 2, 3, 6], ["CHR", 0, "shared", [3]], ["CA", 1, 4, 6], ["FU", 15, [0, 1]], ["SP", 15, 0, 32768, [4], 1], ["AN", 15, 0, 5], ["AN", 15, 1, 6], ["FU", 5, [0, 1]], ["AN", 5, 0, 5], ["FU", 5, [1, 2]], ["AN", 5, 1, 4], ["FU", 5, [2, 3]], ["AN", 5, 2, 6], ["FU", 3, [0, 1]], ["SP", 3, 0, 32, [1], 1], ["AN", 3, 1, 2], ["FFSP", 3, 0, [10, 9], 1, 1], ["AN", 3, 1, 6], ["FU", 1, [0, 1]], ["SP", 1, 0, 16, [16], 1], ["AN", 1, 1, 2], ["FFSP", 1, 0, [10, 9], 1, 1], ["AN", 1, 1, 6], ["PR", 4, 0, "auto_unroll_max_step$512"]]]], "r": [[0.000287393, 0.000287391], 0, 2.86009, 1653070961], "v": "v0.6"}
{"i": [["[\"626fb653e298f4cd4434364b5f2ed39c\", [32, 512], [1024, 512], [1, 1024], [32, 1024]]", "cuda -keys=cuda,gpu -arch=sm_80 -max_num_threads=1024 -thread_warp_size=32", [-1, 16, 64, 49152, 2147483647, 1024, 8, 32], "", 0, []], [[], [["CI", 11], ["CI", 10], ["CI", 9], ["CI", 8], ["CI", 7], ["CI", 6], ["CI", 5], ["CI", 4], ["CHW", 2, "local"], ["SP", 2, 0, 32, [4, 2, 4, 1], 1], ["SP", 2, 5, 1024, [1, 16, 16, 1], 1], ["SP", 2, 10, 512, [1, 16], 1], ["RE", 2, [0, 5, 1, 6, 2, 7, 10, 11, 3, 8, 12, 4, 9]], ["FSP", 3, 0, 9, 3], ["FSP", 3, 4, 10, 3], ["RE", 3, [0, 4, 1, 5, 2, 6, 3, 7]], ["CA", 2, 3, 5], ["CHR", 1, "shared", [2]], ["CA", 2, 3, 6], ["CHR", 0, "shared", [3]], ["CA", 1, 4, 6], ["FU", 15, [0, 1]], ["SP", 15, 0, 32768, [64], 1], ["AN", 15, 0, 5], ["AN", 15, 1, 6], ["FU", 5, [0, 1]], ["AN", 5, 0, 5], ["FU", 5, [1, 2]], ["AN", 5, 1, 4], ["FU", 5, [2, 3]], ["AN", 5, 2, 6], ["FU", 3, [0, 1]], ["SP", 3, 0, 256, [1], 1], ["AN", 3, 1, 2], ["FFSP", 3, 0, [10, 9], 1, 1], ["AN", 3, 1, 6], ["FU", 1, [0, 1]], ["SP", 1, 0, 64, [1], 1], ["AN", 1, 1, 2], ["FFSP", 1, 0, [10, 9], 1, 1], ["AN", 1, 1, 6], ["PR", 4, 0, "auto_unroll_max_step$16"]]]], "r": [[0.00112607, 0.00112604], 0, 3.5722, 1653070963], "v": "v0.6"}
{"i": [["[\"626fb653e298f4cd4434364b5f2ed39c\", [32, 512], [1024, 512], [1, 1024], [32, 1024]]", "cuda -keys=cuda,gpu -arch=sm_80 -max_num_threads=1024 -thread_warp_size=32", [-1, 16, 64, 49152, 2147483647, 1024, 8, 32], "", 0, []], [[], [["CI", 11], ["CI", 10], ["CI", 9], ["CI", 8], ["CI", 7], ["CI", 6], ["CI", 5], ["CI", 4], ["CHW", 2, "local"], ["SP", 2, 0, 32, [8, 2, 1, 1], 1], ["SP", 2, 5, 1024, [1, 64, 2, 4], 1], ["SP", 2, 10, 512, [1, 2], 1], ["RE", 2, [0, 5, 1, 6, 2, 7, 10, 11, 3, 8, 12, 4, 9]], ["FSP", 3, 0, 9, 3], ["FSP", 3, 4, 10, 3], ["RE", 3, [0, 4, 1, 5, 2, 6, 3, 7]], ["CA", 2, 3, 5], ["CHR", 1, "shared", [2]], ["CA", 2, 3, 6], ["CHR", 0, "shared", [3]], ["CA", 1, 4, 6], ["FU", 15, [0, 1]], ["SP", 15, 0, 32768, [16], 1], ["AN", 15, 0, 5], ["AN", 15, 1, 6], ["FU", 5, [0, 1]], ["AN", 5, 0, 5], ["FU", 5, [1, 2]], ["AN", 5, 1, 4], ["FU", 5, [2, 3]], ["AN", 5, 2, 6], ["FU", 3, [0, 1]], ["SP", 3, 0, 32, [1], 1], ["AN", 3, 1, 2], ["FFSP", 3, 0, [10, 9], 1, 1], ["AN", 3, 1, 6], ["FU", 1, [0, 1]], ["SP", 1, 0, 4, [1], 1], ["AN", 1, 1, 2], ["FFSP", 1, 0, [10, 9], 1, 1], ["AN", 1, 1, 6], ["PR", 4, 0, "auto_unroll_max_step$0"]]]], "r": [[0.000478273, 0.000478286], 0, 2.66785, 1653070964], "v": "v0.6"}
{"i": [["[\"626fb653e298f4cd4434364b5f2ed39c\", [32, 512], [1024, 512], [1, 1024], [32, 1024]]", "cuda -keys=cuda,gpu -arch=sm_80 -max_num_threads=1024 -thread_warp_size=32", [-1, 16, 64, 49152, 2147483647, 1024, 8, 32], "", 0, []], [[], [["CI", 11], ["CI", 10], ["CI", 9], ["CI", 8], ["CI", 7], ["CI", 6], ["CI", 5], ["CI", 4], ["CHW", 2, "local"], ["SP", 2, 0, 32, [1, 4, 4, 1], 1], ["SP", 2, 5, 1024, [1, 32, 1, 4], 1], ["SP", 2, 10, 512, [4, 4], 1], ["RE", 2, [0, 5, 1, 6, 2, 7, 10, 11, 3, 8, 12, 4, 9]], ["FSP", 3, 0, 9, 3], ["FSP", 3, 4, 10, 3], ["RE", 3, [0, 4, 1, 5, 2, 6, 3, 7]], ["CA", 2, 3, 5], ["CHR", 1, "shared", [2]], ["CA", 2, 3, 6], ["CHR", 0, "shared", [3]], ["CA", 1, 4, 6], ["FU", 15, [0, 1]], ["SP", 15, 0, 32768, [32], 1], ["AN", 15, 0, 5], ["AN", 15, 1, 6], ["FU", 5, [0, 1]], ["AN", 5, 0, 5], ["FU", 5, [1, 2]], ["AN", 5, 1, 4], ["FU", 5, [2, 3]], ["AN", 5, 2, 6], ["FU", 3, [0, 1]], ["SP", 3, 0, 64, [1], 1], ["AN", 3, 1, 2], ["FFSP", 3, 0, [10, 9], 1, 1], ["AN", 3, 1, 6], ["FU", 1, [0, 1]], ["SP", 1, 0, 64, [1], 1], ["AN", 1, 1, 2], ["FFSP", 1, 0, [10, 9], 1, 1], ["AN", 1, 1, 6], ["PR", 4, 0, "auto_unroll_max_step$1024"]]]], "r": [[0.00013718, 0.000137176], 0, 2.76965, 1653070966], "v": "v0.6"}
{"i": [["[\"626fb653e298f4cd4434364b5f2ed39c\", [32, 512], [1024, 512], [1, 1024], [32, 1024]]", "cuda -keys=cuda,gpu -arch=sm_80 -max_num_threads=1024 -thread_warp_size=32", [-1, 16, 64, 49152, 2147483647, 1024, 8, 32], "", 0, []], [[], [["CI", 11], ["CI", 10], ["CI", 9], ["CI", 8], ["CI", 7], ["CI", 6], ["CI", 5], ["CI", 4], ["CHW", 2, "local"], ["SP", 2, 0, 32, [1, 4, 1, 1], 1], ["SP", 2, 5, 1024, [4, 8, 2, 16], 1], ["SP", 2, 10, 512, [2, 1], 1], ["RE", 2, [0, 5, 1, 6, 2, 7, 10, 11, 3, 8, 12, 4, 9]], ["FSP", 3, 0, 9, 3], ["FSP", 3, 4, 10, 3], ["RE", 3, [0, 4, 1, 5, 2, 6, 3, 7]], ["CA", 2, 3, 5], ["CHR", 1, "shared", [2]], ["CA", 2, 3, 6], ["CHR", 0, "shared", [3]], ["CA", 1, 4, 6], ["FU", 15, [0, 1]], ["SP", 15, 0, 32768, [32], 1], ["AN", 15, 0, 5], ["AN", 15, 1, 6], ["FU", 5, [0, 1]], ["AN", 5, 0, 5], ["FU", 5, [1, 2]], ["AN", 5, 1, 4], ["FU", 5, [2, 3]], ["AN", 5, 2, 6], ["FU", 3, [0, 1]], ["SP", 3, 0, 128, [1], 1], ["AN", 3, 1, 2], ["FFSP", 3, 0, [10, 9], 1, 1], ["AN", 3, 1, 6], ["FU", 1, [0, 1]], ["SP", 1, 0, 4, [2], 1], ["AN", 1, 1, 2], ["FFSP", 1, 0, [10, 9], 1, 1], ["AN", 1, 1, 6], ["PR", 4, 0, "auto_unroll_max_step$1024"]]]], "r": [[0.00207752, 0.00207751], 0, 2.62992, 1653070967], "v": "v0.6"}
{"i": [["[\"626fb653e298f4cd4434364b5f2ed39c\", [32, 512], [1024, 512], [1, 1024], [32, 1024]]", "cuda -keys=cuda,gpu -arch=sm_80 -max_num_threads=1024 -thread_warp_size=32", [-1, 16, 64, 49152, 2147483647, 1024, 8, 32], "", 0, []], [[], [["CI", 11], ["CI", 10], ["CI", 9], ["CI", 8], ["CI", 7], ["CI", 6], ["CI", 5], ["CI", 4], ["CHW", 2, "local"], ["SP", 2, 0, 32, [1, 1, 2, 16], 1], ["SP", 2, 5, 1024, [2, 32, 2, 1], 1], ["SP", 2, 10, 512, [1, 1], 1], ["RE", 2, [0, 5, 1, 6, 2, 7, 10, 11, 3, 8, 12, 4, 9]], ["FSP", 3, 0, 9, 3], ["FSP", 3, 4, 10, 3], ["RE", 3, [0, 4, 1, 5, 2, 6, 3, 7]], ["CA", 2, 3, 5], ["CHR", 1, "shared", [2]], ["CA", 2, 3, 6], ["CHR", 0, "shared", [3]], ["CA", 1, 4, 6], ["FU", 15, [0, 1]], ["SP", 15, 0, 32768, [32], 1], ["AN", 15, 0, 5], ["AN", 15, 1, 6], ["FU", 5, [0, 1]], ["AN", 5, 0, 5], ["FU", 5, [1, 2]], ["AN", 5, 1, 4], ["FU", 5, [2, 3]], ["AN", 5, 2, 6], ["FU", 3, [0, 1]], ["SP", 3, 0, 2, [2], 1], ["AN", 3, 1, 2], ["FFSP", 3, 0, [10, 9], 1, 1], ["AN", 3, 1, 6], ["FU", 1, [0, 1]], ["SP", 1, 0, 16, [1], 1], ["AN", 1, 1, 2], ["FFSP", 1, 0, [10, 9], 1, 1], ["AN", 1, 1, 6], ["PR", 4, 0, "auto_unroll_max_step$1024"]]]], "r": [[0.00047293, 0.000472925], 0, 2.71034, 1653070969], "v": "v0.6"}
{"i": [["[\"626fb653e298f4cd4434364b5f2ed39c\", [32, 512], [1024, 512], [1, 1024], [32, 1024]]", "cuda -keys=cuda,gpu -arch=sm_80 -max_num_threads=1024 -thread_warp_size=32", [-1, 16, 64, 49152, 2147483647, 1024, 8, 32], "", 0, []], [[], [["CI", 11], ["CI", 10], ["CI", 9], ["CI", 8], ["CI", 7], ["CI", 6], ["CI", 5], ["CI", 4], ["CHW", 2, "local"], ["SP", 2, 0, 32, [2, 8, 1, 1], 1], ["SP", 2, 5, 1024, [4, 8, 1, 1], 1], ["SP", 2, 10, 512, [4, 4], 1], ["RE", 2, [0, 5, 1, 6, 2, 7, 10, 11, 3, 8, 12, 4, 9]], ["FSP", 3, 0, 9, 3], ["FSP", 3, 4, 10, 3], ["RE", 3, [0, 4, 1, 5, 2, 6, 3, 7]], ["CA", 2, 3, 5], ["CHR", 1, "shared", [2]], ["CA", 2, 3, 6], ["CHR", 0, "shared", [3]], ["CA", 1, 4, 6], ["FU", 15, [0, 1]], ["SP", 15, 0, 32768, [16], 1], ["AN", 15, 0, 5], ["AN", 15, 1, 6], ["FU", 5, [0, 1]], ["AN", 5, 0, 5], ["FU", 5, [1, 2]], ["AN", 5, 1, 4], ["FU", 5, [2, 3]], ["AN", 5, 2, 6], ["FU", 3, [0, 1]], ["SP", 3, 0, 16, [1], 1], ["AN", 3, 1, 2], ["FFSP", 3, 0, [10, 9], 1, 1], ["AN", 3, 1, 6], ["FU", 1, [0, 1]], ["SP", 1, 0, 16, [1], 1], ["AN", 1, 1, 2], ["FFSP", 1, 0, [10, 9], 1, 1], ["AN", 1, 1, 6], ["PR", 4, 0, "auto_unroll_max_step$16"]]]], "r": [[6.18188e-05, 6.18192e-05], 0, 2.39469, 1653070970], "v": "v0.6"}
{"i": [["[\"626fb653e298f4cd4434364b5f2ed39c\", [32, 512], [1024, 512], [1, 1024], [32, 1024]]", "cuda -keys=cuda,gpu -arch=sm_80 -max_num_threads=1024 -thread_warp_size=32", [-1, 16, 64, 49152, 2147483647, 1024, 8, 32], "", 0, []], [[], [["CI", 11], ["CI", 10], ["CI", 9], ["CI", 8], ["CI", 7], ["CI", 6], ["CI", 5], ["CI", 4], ["CHW", 2, "local"], ["SP", 2, 0, 32, [1, 8, 1, 2], 1], ["SP", 2, 5, 1024, [4, 128, 2, 1], 1], ["SP", 2, 10, 512, [1, 1], 1], ["RE", 2, [0, 5, 1, 6, 2, 7, 10, 11, 3, 8, 12, 4, 9]], ["FSP", 3, 0, 9, 3], ["FSP", 3, 4, 10, 3], ["RE", 3, [0, 4, 1, 5, 2, 6, 3, 7]], ["CA", 2, 3, 5], ["CHR", 1, "shared", [2]], ["CA", 2, 3, 6], ["CHR", 0, "shared", [3]], ["CA", 1, 4, 6], ["FU", 15, [0, 1]], ["SP", 15, 0, 32768, [32], 1], ["AN", 15, 0, 5], ["AN", 15, 1, 6], ["FU", 5, [0, 1]], ["AN", 5, 0, 5], ["FU", 5, [1, 2]], ["AN", 5, 1, 4], ["FU", 5, [2, 3]], ["AN", 5, 2, 6], ["FU", 3, [0, 1]], ["SP", 3, 0, 2, [2], 1], ["AN", 3, 1, 2], ["FFSP", 3, 0, [10, 9], 1, 1], ["AN", 3, 1, 6], ["FU", 1, [0, 1]], ["SP", 1, 0, 2, [2], 1], ["AN", 1, 1, 2], ["FFSP", 1, 0, [10, 9], 1, 1], ["AN", 1, 1, 6], ["PR", 4, 0, "auto_unroll_max_step$512"]]]], "r": [[0.00107922, 0.00107916], 0, 1.81462, 1653070971], "v": "v0.6"}
{"i": [["[\"626fb653e298f4cd4434364b5f2ed39c\", [32, 512], [1024, 512], [1, 1024], [32, 1024]]", "cuda -keys=cuda,gpu -arch=sm_80 -max_num_threads=1024 -thread_warp_size=32", [-1, 16, 64, 49152, 2147483647, 1024, 8, 32], "", 0, []], [[], [["CI", 11], ["CI", 10], ["CI", 9], ["CI", 8], ["CI", 7], ["CI", 6], ["CI", 5], ["CI", 4], ["CHW", 2, "local"], ["SP", 2, 0, 32, [1, 2, 1, 16], 1], ["SP", 2, 5, 1024, [1, 128, 1, 1], 1], ["SP", 2, 10, 512, [1, 64], 1], ["RE", 2, [0, 5, 1, 6, 2, 7, 10, 11, 3, 8, 12, 4, 9]], ["FSP", 3, 0, 9, 3], ["FSP", 3, 4, 10, 3], ["RE", 3, [0, 4, 1, 5, 2, 6, 3, 7]], ["CA", 2, 3, 5], ["CHR", 1, "shared", [2]], ["CA", 2, 3, 6], ["CHR", 0, "shared", [3]], ["CA", 1, 4, 6], ["FU", 15, [0, 1]], ["SP", 15, 0, 32768, [32], 1], ["AN", 15, 0, 5], ["AN", 15, 1, 6], ["FU", 5, [0, 1]], ["AN", 5, 0, 5], ["FU", 5, [1, 2]], ["AN", 5, 1, 4], ["FU", 5, [2, 3]], ["AN", 5, 2, 6], ["FU", 3, [0, 1]], ["SP", 3, 0, 64, [1], 1], ["AN", 3, 1, 2], ["FFSP", 3, 0, [10, 9], 1, 1], ["AN", 3, 1, 6], ["FU", 1, [0, 1]], ["SP", 1, 0, 256, [1], 1], ["AN", 1, 1, 2], ["FFSP", 1, 0, [10, 9], 1, 1], ["AN", 1, 1, 6], ["PR", 4, 0, "auto_unroll_max_step$0"]]]], "r": [[0.000114973, 0.000114979], 0, 2.54612, 1653070973], "v": "v0.6"}
{"i": [["[\"626fb653e298f4cd4434364b5f2ed39c\", [32, 512], [1024, 512], [1, 1024], [32, 1024]]", "cuda -keys=cuda,gpu -arch=sm_80 -max_num_threads=1024 -thread_warp_size=32", [-1, 16, 64, 49152, 2147483647, 1024, 8, 32], "", 0, []], [[], [["CI", 11], ["CI", 10], ["CI", 9], ["CI", 8], ["CI", 7], ["CI", 6], ["CI", 5], ["CI", 4], ["CHW", 2, "local"], ["SP", 2, 0, 32, [1, 1, 1, 8], 1], ["SP", 2, 5, 1024, [1, 32, 16, 1], 1], ["SP", 2, 10, 512, [2, 8], 1], ["RE", 2, [0, 5, 1, 6, 2, 7, 10, 11, 3, 8, 12, 4, 9]], ["FSP", 3, 0, 9, 3], ["FSP", 3, 4, 10, 3], ["RE", 3, [0, 4, 1, 5, 2, 6, 3, 7]], ["CA", 2, 3, 5], ["CHR", 1, "shared", [2]], ["CA", 2, 3, 6], ["CHR", 0, "shared", [3]], ["CA", 1, 4, 6], ["FU", 15, [0, 1]], ["SP", 15, 0, 32768, [16], 1], ["AN", 15, 0, 5], ["AN", 15, 1, 6], ["FU", 5, [0, 1]], ["AN", 5, 0, 5], ["FU", 5, [1, 2]], ["AN", 5, 1, 4], ["FU", 5, [2, 3]], ["AN", 5, 2, 6], ["FU", 3, [0, 1]], ["SP", 3, 0, 256, [1], 1], ["AN", 3, 1, 2], ["FFSP", 3, 0, [10, 9], 1, 1], ["AN", 3, 1, 6], ["FU", 1, [0, 1]], ["SP", 1, 0, 64, [4], 1], ["AN", 1, 1, 2], ["FFSP", 1, 0, [10, 9], 1, 1], ["AN", 1, 1, 6], ["PR", 4, 0, "auto_unroll_max_step$1024"]]]], "r": [[0.000374699, 0.000374699], 0, 6.13196, 1653070975], "v": "v0.6"}
{"i": [["[\"626fb653e298f4cd4434364b5f2ed39c\", [32, 512], [1024, 512], [1, 1024], [32, 1024]]", "cuda -keys=cuda,gpu -arch=sm_80 -max_num_threads=1024 -thread_warp_size=32", [-1, 16, 64, 49152, 2147483647, 1024, 8, 32], "", 0, []], [[], [["CI", 11], ["CI", 10], ["CI", 9], ["CI", 8], ["CI", 7], ["CI", 6], ["CI", 5], ["CI", 4], ["CHW", 2, "local"], ["SP", 2, 0, 32, [1, 1, 1, 1], 1], ["SP", 2, 5, 1024, [1, 64, 8, 2], 1], ["SP", 2, 10, 512, [8, 1], 1], ["RE", 2, [0, 5, 1, 6, 2, 7, 10, 11, 3, 8, 12, 4, 9]], ["FSP", 3, 0, 9, 3], ["FSP", 3, 4, 10, 3], ["RE", 3, [0, 4, 1, 5, 2, 6, 3, 7]], ["CA", 2, 3, 5], ["CHR", 1, "shared", [2]], ["CA", 2, 3, 6], ["CHR", 0, "shared", [3]], ["CA", 1, 4, 6], ["FU", 15, [0, 1]], ["SP", 15, 0, 32768, [32], 1], ["AN", 15, 0, 5], ["AN", 15, 1, 6], ["FU", 5, [0, 1]], ["AN", 5, 0, 5], ["FU", 5, [1, 2]], ["AN", 5, 1, 4], ["FU", 5, [2, 3]], ["AN", 5, 2, 6], ["FU", 3, [0, 1]], ["SP", 3, 0, 128, [1], 1], ["AN", 3, 1, 2], ["FFSP", 3, 0, [10, 9], 1, 1], ["AN", 3, 1, 6], ["FU", 1, [0, 1]], ["SP", 1, 0, 8, [1], 1], ["AN", 1, 1, 2], ["FFSP", 1, 0, [10, 9], 1, 1], ["AN", 1, 1, 6], ["PR", 4, 0, "auto_unroll_max_step$16"]]]], "r": [[0.000413417, 0.000413416], 0, 3.01091, 1653070976], "v": "v0.6"}
{"i": [["[\"626fb653e298f4cd4434364b5f2ed39c\", [32, 512], [1024, 512], [1, 1024], [32, 1024]]", "cuda -keys=cuda,gpu -arch=sm_80 -max_num_threads=1024 -thread_warp_size=32", [-1, 16, 64, 49152, 2147483647, 1024, 8, 32], "", 0, []], [[], [["CI", 11], ["CI", 10], ["CI", 9], ["CI", 8], ["CI", 7], ["CI", 6], ["CI", 5], ["CI", 4], ["CHW", 2, "local"], ["SP", 2, 0, 32, [1, 4, 4, 1], 1], ["SP", 2, 5, 1024, [4, 32, 4, 2], 1], ["SP", 2, 10, 512, [4, 2], 1], ["RE", 2, [0, 5, 1, 6, 2, 7, 10, 11, 3, 8, 12, 4, 9]], ["FSP", 3, 0, 9, 3], ["FSP", 3, 4, 10, 3], ["RE", 3, [0, 4, 1, 5, 2, 6, 3, 7]], ["CA", 2, 3, 5], ["CHR", 1, "shared", [2]], ["CA", 2, 3, 6], ["CHR", 0, "shared", [3]], ["CA", 1, 4, 6], ["FU", 15, [0, 1]], ["SP", 15, 0, 32768, [8], 1], ["AN", 15, 0, 5], ["AN", 15, 1, 6], ["FU", 5, [0, 1]], ["AN", 5, 0, 5], ["FU", 5, [1, 2]], ["AN", 5, 1, 4], ["FU", 5, [2, 3]], ["AN", 5, 2, 6], ["FU", 3, [0, 1]], ["SP", 3, 0, 64, [1], 1], ["AN", 3, 1, 2], ["FFSP", 3, 0, [10, 9], 1, 1], ["AN", 3, 1, 6], ["FU", 1, [0, 1]], ["SP", 1, 0, 32, [1], 1], ["AN", 1, 1, 2], ["FFSP", 1, 0, [10, 9], 1, 1], ["AN", 1, 1, 6], ["PR", 4, 0, "auto_unroll_max_step$1024"]]]], "r": [[0.000914972, 0.000914979], 0, 4.33877, 1653070977], "v": "v0.6"}
{"i": [["[\"626fb653e298f4cd4434364b5f2ed39c\", [32, 512], [1024, 512], [1, 1024], [32, 1024]]", "cuda -keys=cuda,gpu -arch=sm_80 -max_num_threads=1024 -thread_warp_size=32", [-1, 16, 64, 49152, 2147483647, 1024, 8, 32], "", 0, []], [[], [["CI", 11], ["CI", 10], ["CI", 9], ["CI", 8], ["CI", 7], ["CI", 6], ["CI", 5], ["CI", 4], ["CHW", 2, "local"], ["SP", 2, 0, 32, [4, 2, 4, 1], 1], ["SP", 2, 5, 1024, [1, 16, 16, 1], 1], ["SP", 2, 10, 512, [1, 16], 1], ["RE", 2, [0, 5, 1, 6, 2, 7, 10, 11, 3, 8, 12, 4, 9]], ["FSP", 3, 0, 9, 3], ["FSP", 3, 4, 10, 3], ["RE", 3, [0, 4, 1, 5, 2, 6, 3, 7]], ["CA", 2, 3, 5], ["CHR", 1, "shared", [2]], ["CA", 2, 3, 6], ["CHR", 0, "shared", [3]], ["CA", 1, 4, 6], ["FU", 15, [0, 1]], ["SP", 15, 0, 32768, [1], 1], ["AN", 15, 0, 5], ["AN", 15, 1, 6], ["FU", 5, [0, 1]], ["AN", 5, 0, 5], ["FU", 5, [1, 2]], ["AN", 5, 1, 4], ["FU", 5, [2, 3]], ["AN", 5, 2, 6], ["FU", 3, [0, 1]], ["SP", 3, 0, 256, [1], 1], ["AN", 3, 1, 2], ["FFSP", 3, 0, [10, 9], 1, 1], ["AN", 3, 1, 6], ["FU", 1, [0, 1]], ["SP", 1, 0, 64, [1], 1], ["AN", 1, 1, 2], ["FFSP", 1, 0, [10, 9], 1, 1], ["AN", 1, 1, 6], ["PR", 4, 0, "auto_unroll_max_step$1024"]]]], "r": [[0.0010345, 0.00103453], 0, 8.6041, 1653070979], "v": "v0.6"}
{"i": [["[\"626fb653e298f4cd4434364b5f2ed39c\", [32, 512], [1024, 512], [1, 1024], [32, 1024]]", "cuda -keys=cuda,gpu -arch=sm_80 -max_num_threads=1024 -thread_warp_size=32", [-1, 16, 64, 49152, 2147483647, 1024, 8, 32], "", 0, []], [[], [["CI", 11], ["CI", 10], ["CI", 9], ["CI", 8], ["CI", 7], ["CI", 6], ["CI", 5], ["CI", 4], ["CHW", 2, "local"], ["SP", 2, 0, 32, [1, 4, 2, 2], 1], ["SP", 2, 5, 1024, [2, 8, 2, 16], 1], ["SP", 2, 10, 512, [1, 8], 1], ["RE", 2, [0, 5, 1, 6, 2, 7, 10, 11, 3, 8, 12, 4, 9]], ["FSP", 3, 0, 9, 3], ["FSP", 3, 4, 10, 3], ["RE", 3, [0, 4, 1, 5, 2, 6, 3, 7]], ["CA", 2, 3, 5], ["CHR", 1, "shared", [2]], ["CA", 2, 3, 6], ["CHR", 0, "shared", [3]], ["CA", 1, 4, 6], ["FU", 15, [0, 1]], ["SP", 15, 0, 32768, [64], 1], ["AN", 15, 0, 5], ["AN", 15, 1, 6], ["FU", 5, [0, 1]], ["AN", 5, 0, 5], ["FU", 5, [1, 2]], ["AN", 5, 1, 4], ["FU", 5, [2, 3]], ["AN", 5, 2, 6], ["FU", 3, [0, 1]], ["SP", 3, 0, 256, [1], 1], ["AN", 3, 1, 2], ["FFSP", 3, 0, [10, 9], 1, 1], ["AN", 3, 1, 6], ["FU", 1, [0, 1]], ["SP", 1, 0, 32, [1], 1], ["AN", 1, 1, 2], ["FFSP", 1, 0, [10, 9], 1, 1], ["AN", 1, 1, 6], ["PR", 4, 0, "auto_unroll_max_step$64"]]]], "r": [[0.00403924, 0.00403938], 0, 2.77324, 1653070980], "v": "v0.6"}
{"i": [["[\"626fb653e298f4cd4434364b5f2ed39c\", [32, 512], [1024, 512], [1, 1024], [32, 1024]]", "cuda -keys=cuda,gpu -arch=sm_80 -max_num_threads=1024 -thread_warp_size=32", [-1, 16, 64, 49152, 2147483647, 1024, 8, 32], "", 0, []], [[], [["CI", 11], ["CI", 10], ["CI", 9], ["CI", 8], ["CI", 7], ["CI", 6], ["CI", 5], ["CI", 4], ["CHW", 2, "local"], ["SP", 2, 0, 32, [1, 2, 8, 2], 1], ["SP", 2, 5, 1024, [1, 128, 2, 4], 1], ["SP", 2, 10, 512, [8, 1], 1], ["RE", 2, [0, 5, 1, 6, 2, 7, 10, 11, 3, 8, 12, 4, 9]], ["FSP", 3, 0, 9, 3], ["FSP", 3, 4, 10, 3], ["RE", 3, [0, 4, 1, 5, 2, 6, 3, 7]], ["CA", 2, 3, 5], ["CHR", 1, "shared", [2]], ["CA", 2, 3, 6], ["CHR", 0, "shared", [3]], ["CA", 1, 4, 6], ["FU", 15, [0, 1]], ["SP", 15, 0, 32768, [32], 1], ["AN", 15, 0, 5], ["AN", 15, 1, 6], ["FU", 5, [0, 1]], ["AN", 5, 0, 5], ["FU", 5, [1, 2]], ["AN", 5, 1, 4], ["FU", 5, [2, 3]], ["AN", 5, 2, 6], ["FU", 3, [0, 1]], ["SP", 3, 0, 64, [1], 1], ["AN", 3, 1, 2], ["FFSP", 3, 0, [10, 9], 1, 1], ["AN", 3, 1, 6], ["FU", 1, [0, 1]], ["SP", 1, 0, 128, [1], 1], ["AN", 1, 1, 2], ["FFSP", 1, 0, [10, 9], 1, 1], ["AN", 1, 1, 6], ["PR", 4, 0, "auto_unroll_max_step$1024"]]]], "r": [[0.000845203, 0.000845234], 0, 3.42727, 1653070981], "v": "v0.6"}
{"i": [["[\"626fb653e298f4cd4434364b5f2ed39c\", [32, 512], [1024, 512], [1, 1024], [32, 1024]]", "cuda -keys=cuda,gpu -arch=sm_80 -max_num_threads=1024 -thread_warp_size=32", [-1, 16, 64, 49152, 2147483647, 1024, 8, 32], "", 0, []], [[], [["CI", 11], ["CI", 10], ["CI", 9], ["CI", 8], ["CI", 7], ["CI", 6], ["CI", 5], ["CI", 4], ["CHW", 2, "local"], ["SP", 2, 0, 32, [8, 2, 1, 1], 1], ["SP", 2, 5, 1024, [1, 64, 2, 4], 1], ["SP", 2, 10, 512, [1, 2], 1], ["RE", 2, [0, 5, 1, 6, 2, 7, 10, 11, 3, 8, 12, 4, 9]], ["FSP", 3, 0, 9, 3], ["FSP", 3, 4, 10, 3], ["RE", 3, [0, 4, 1, 5, 2, 6, 3, 7]], ["CA", 2, 3, 5], ["CHR", 1, "shared", [2]], ["CA", 2, 3, 6], ["CHR", 0, "shared", [3]], ["CA", 1, 4, 6], ["FU", 15, [0, 1]], ["SP", 15, 0, 32768, [32], 1], ["AN", 15, 0, 5], ["AN", 15, 1, 6], ["FU", 5, [0, 1]], ["AN", 5, 0, 5], ["FU", 5, [1, 2]], ["AN", 5, 1, 4], ["FU", 5, [2, 3]], ["AN", 5, 2, 6], ["FU", 3, [0, 1]], ["SP", 3, 0, 32, [1], 1], ["AN", 3, 1, 2], ["FFSP", 3, 0, [10, 9], 1, 1], ["AN", 3, 1, 6], ["FU", 1, [0, 1]], ["SP", 1, 0, 4, [4], 1], ["AN", 1, 1, 2], ["FFSP", 1, 0, [10, 9], 1, 1], ["AN", 1, 1, 6], ["PR", 4, 0, "auto_unroll_max_step$512"]]]], "r": [[0.000501294, 0.000501281], 0, 2.60335, 1653070982], "v": "v0.6"}
{"i": [["[\"626fb653e298f4cd4434364b5f2ed39c\", [32, 512], [1024, 512], [1, 1024], [32, 1024]]", "cuda -keys=cuda,gpu -arch=sm_80 -max_num_threads=1024 -thread_warp_size=32", [-1, 16, 64, 49152, 2147483647, 1024, 8, 32], "", 0, []], [[], [["CI", 11], ["CI", 10], ["CI", 9], ["CI", 8], ["CI", 7], ["CI", 6], ["CI", 5], ["CI", 4], ["CHW", 2, "local"], ["SP", 2, 0, 32, [1, 8, 1, 2], 1], ["SP", 2, 5, 1024, [1, 8, 1, 16], 1], ["SP", 2, 10, 512, [4, 4], 1], ["RE", 2, [0, 5, 1, 6, 2, 7, 10, 11, 3, 8, 12, 4, 9]], ["FSP", 3, 0, 9, 3], ["FSP", 3, 4, 10, 3], ["RE", 3, [0, 4, 1, 5, 2, 6, 3, 7]], ["CA", 2, 3, 5], ["CHR", 1, "shared", [2]], ["CA", 2, 3, 6], ["CHR", 0, "shared", [3]], ["CA", 1, 4, 6], ["FU", 15, [0, 1]], ["SP", 15, 0, 32768, [32], 1], ["AN", 15, 0, 5], ["AN", 15, 1, 6], ["FU", 5, [0, 1]], ["AN", 5, 0, 5], ["FU", 5, [1, 2]], ["AN", 5, 1, 4], ["FU", 5, [2, 3]], ["AN", 5, 2, 6], ["FU", 3, [0, 1]], ["SP", 3, 0, 256, [64], 1], ["AN", 3, 1, 2], ["FFSP", 3, 0, [10, 9], 1, 1], ["AN", 3, 1, 6], ["FU", 1, [0, 1]], ["SP", 1, 0, 32, [1], 1], ["AN", 1, 1, 2], ["FFSP", 1, 0, [10, 9], 1, 1], ["AN", 1, 1, 6], ["PR", 4, 0, "auto_unroll_max_step$64"]]]], "r": [[0.000407455, 0.000407501], 0, 2.49976, 1653070984], "v": "v0.6"}
{"i": [["[\"626fb653e298f4cd4434364b5f2ed39c\", [32, 512], [1024, 512], [1, 1024], [32, 1024]]", "cuda -keys=cuda,gpu -arch=sm_80 -max_num_threads=1024 -thread_warp_size=32", [-1, 16, 64, 49152, 2147483647, 1024, 8, 32], "", 0, []], [[], [["CI", 11], ["CI", 10], ["CI", 9], ["CI", 8], ["CI", 7], ["CI", 6], ["CI", 5], ["CI", 4], ["CHW", 2, "local"], ["SP", 2, 0, 32, [1, 16, 1, 1], 1], ["SP", 2, 5, 1024, [1, 4, 4, 1], 1], ["SP", 2, 10, 512, [2, 16], 1], ["RE", 2, [0, 5, 1, 6, 2, 7, 10, 11, 3, 8, 12, 4, 9]], ["FSP", 3, 0, 9, 3], ["FSP", 3, 4, 10, 3], ["RE", 3, [0, 4, 1, 5, 2, 6, 3, 7]], ["CA", 2, 3, 5], ["CHR", 1, "shared", [2]], ["CA", 2, 3, 6], ["CHR", 0, "shared", [3]], ["CA", 1, 4, 6], ["FU", 15, [0, 1]], ["SP", 15, 0, 32768, [32], 1], ["AN", 15, 0, 5], ["AN", 15, 1, 6], ["FU", 5, [0, 1]], ["AN", 5, 0, 5], ["FU", 5, [1, 2]], ["AN", 5, 1, 4], ["FU", 5, [2, 3]], ["AN", 5, 2, 6], ["FU", 3, [0, 1]], ["SP", 3, 0, 128, [1], 1], ["AN", 3, 1, 2], ["FFSP", 3, 0, [10, 9], 1, 1], ["AN", 3, 1, 6], ["FU", 1, [0, 1]], ["SP", 1, 0, 32, [4], 1], ["AN", 1, 1, 2], ["FFSP", 1, 0, [10, 9], 1, 1], ["AN", 1, 1, 6], ["PR", 4, 0, "auto_unroll_max_step$1024"]]]], "r": [[6.73349e-05, 6.73514e-05], 0, 2.56011, 1653070986], "v": "v0.6"}
{"i": [["[\"626fb653e298f4cd4434364b5f2ed39c\", [32, 512], [1024, 512], [1, 1024], [32, 1024]]", "cuda -keys=cuda,gpu -arch=sm_80 -max_num_threads=1024 -thread_warp_size=32", [-1, 16, 64, 49152, 2147483647, 1024, 8, 32], "", 0, []], [[], [["CI", 11], ["CI", 10], ["CI", 9], ["CI", 8], ["CI", 7], ["CI", 6], ["CI", 5], ["CI", 4], ["CHW", 2, "local"], ["SP", 2, 0, 32, [1, 4, 1, 1], 1], ["SP", 2, 5, 1024, [4, 8, 1, 1], 1], ["SP", 2, 10, 512, [4, 4], 1], ["RE", 2, [0, 5, 1, 6, 2, 7, 10, 11, 3, 8, 12, 4, 9]], ["FSP", 3, 0, 9, 3], ["FSP", 3, 4, 10, 3], ["RE", 3, [0, 4, 1, 5, 2, 6, 3, 7]], ["CA", 2, 3, 5], ["CHR", 1, "shared", [2]], ["CA", 2, 3, 6], ["CHR", 0, "shared", [3]], ["CA", 1, 4, 6], ["FU", 15, [0, 1]], ["SP", 15, 0, 32768, [2], 1], ["AN", 15, 0, 5], ["AN", 15, 1, 6], ["FU", 5, [0, 1]], ["AN", 5, 0, 5], ["FU", 5, [1, 2]], ["AN", 5, 1, 4], ["FU", 5, [2, 3]], ["AN", 5, 2, 6], ["FU", 3, [0, 1]], ["SP", 3, 0, 16, [1], 1], ["AN", 3, 1, 2], ["FFSP", 3, 0, [10, 9], 1, 1], ["AN", 3, 1, 6], ["FU", 1, [0, 1]], ["SP", 1, 0, 16, [1], 1], ["AN", 1, 1, 2], ["FFSP", 1, 0, [10, 9], 1, 1], ["AN", 1, 1, 6], ["PR", 4, 0, "auto_unroll_max_step$16"]]]], "r": [[9.18919e-05, 9.18969e-05], 0, 2.33954, 1653070987], "v": "v0.6"}
{"i": [["[\"626fb653e298f4cd4434364b5f2ed39c\", [32, 512], [1024, 512], [1, 1024], [32, 1024]]", "cuda -keys=cuda,gpu -arch=sm_80 -max_num_threads=1024 -thread_warp_size=32", [-1, 16, 64, 49152, 2147483647, 1024, 8, 32], "", 0, []], [[], [["CI", 11], ["CI", 10], ["CI", 9], ["CI", 8], ["CI", 7], ["CI", 6], ["CI", 5], ["CI", 4], ["CHW", 2, "local"], ["SP", 2, 0, 32, [2, 4, 2, 2], 1], ["SP", 2, 5, 1024, [2, 128, 1, 1], 1], ["SP", 2, 10, 512, [1, 16], 1], ["RE", 2, [0, 5, 1, 6, 2, 7, 10, 11, 3, 8, 12, 4, 9]], ["FSP", 3, 0, 9, 3], ["FSP", 3, 4, 10, 3], ["RE", 3, [0, 4, 1, 5, 2, 6, 3, 7]], ["CA", 2, 3, 5], ["CHR", 1, "shared", [2]], ["CA", 2, 3, 6], ["CHR", 0, "shared", [3]], ["CA", 1, 4, 6], ["FU", 15, [0, 1]], ["SP", 15, 0, 32768, [64], 1], ["AN", 15, 0, 5], ["AN", 15, 1, 6], ["FU", 5, [0, 1]], ["AN", 5, 0, 5], ["FU", 5, [1, 2]], ["AN", 5, 1, 4], ["FU", 5, [2, 3]], ["AN", 5, 2, 6], ["FU", 3, [0, 1]], ["SP", 3, 0, 16, [1], 1], ["AN", 3, 1, 2], ["FFSP", 3, 0, [10, 9], 1, 1], ["AN", 3, 1, 6], ["FU", 1, [0, 1]], ["SP", 1, 0, 64, [64], 1], ["AN", 1, 1, 2], ["FFSP", 1, 0, [10, 9], 1, 1], ["AN", 1, 1, 6], ["PR", 4, 0, "auto_unroll_max_step$512"]]]], "r": [[0.000226942, 0.000226983], 0, 3.04207, 1653070989], "v": "v0.6"}
{"i": [["[\"626fb653e298f4cd4434364b5f2ed39c\", [32, 512], [1024, 512], [1, 1024], [32, 1024]]", "cuda -keys=cuda,gpu -arch=sm_80 -max_num_threads=1024 -thread_warp_size=32", [-1, 16, 64, 49152, 2147483647, 1024, 8, 32], "", 0, []], [[], [["CI", 11], ["CI", 10], ["CI", 9], ["CI", 8], ["CI", 7], ["CI", 6], ["CI", 5], ["CI", 4], ["CHW", 2, "local"], ["SP", 2, 0, 32, [2, 1, 4, 4], 1], ["SP", 2, 5, 1024, [2, 32, 4, 1], 1], ["SP", 2, 10, 512, [8, 1], 1], ["RE", 2, [0, 5, 1, 6, 2, 7, 10, 11, 3, 8, 12, 4, 9]], ["FSP", 3, 0, 9, 3], ["FSP", 3, 4, 10, 3], ["RE", 3, [0, 4, 1, 5, 2, 6, 3, 7]], ["CA", 2, 3, 5], ["CHR", 1, "shared", [2]], ["CA", 2, 3, 6], ["CHR", 0, "shared", [3]], ["CA", 1, 4, 6], ["FU", 15, [0, 1]], ["SP", 15, 0, 32768, [16], 1], ["AN", 15, 0, 5], ["AN", 15, 1, 6], ["FU", 5, [0, 1]], ["AN", 5, 0, 5], ["FU", 5, [1, 2]], ["AN", 5, 1, 4], ["FU", 5, [2, 3]], ["AN", 5, 2, 6], ["FU", 3, [0, 1]], ["SP", 3, 0, 32, [1], 1], ["AN", 3, 1, 2], ["FFSP", 3, 0, [10, 9], 1, 1], ["AN", 3, 1, 6], ["FU", 1, [0, 1]], ["SP", 1, 0, 128, [1], 1], ["AN", 1, 1, 2], ["FFSP", 1, 0, [10, 9], 1, 1], ["AN", 1, 1, 6], ["PR", 4, 0, "auto_unroll_max_step$512"]]]], "r": [[0.000744801, 0.000744806], 0, 3.50045, 1653070991], "v": "v0.6"}
{"i": [["[\"626fb653e298f4cd4434364b5f2ed39c\", [32, 512], [1024, 512], [1, 1024], [32, 1024]]", "cuda -keys=cuda,gpu -arch=sm_80 -max_num_threads=1024 -thread_warp_size=32", [-1, 16, 64, 49152, 2147483647, 1024, 8, 32], "", 0, []], [[], [["CI", 11], ["CI", 10], ["CI", 9], ["CI", 8], ["CI", 7], ["CI", 6], ["CI", 5], ["CI", 4], ["CHW", 2, "local"], ["SP", 2, 0, 32, [2, 8, 2, 1], 1], ["SP", 2, 5, 1024, [2, 4, 8, 8], 1], ["SP", 2, 10, 512, [8, 2], 1], ["RE", 2, [0, 5, 1, 6, 2, 7, 10, 11, 3, 8, 12, 4, 9]], ["FSP", 3, 0, 9, 3], ["FSP", 3, 4, 10, 3], ["RE", 3, [0, 4, 1, 5, 2, 6, 3, 7]], ["CA", 2, 3, 5], ["CHR", 1, "shared", [2]], ["CA", 2, 3, 6], ["CHR", 0, "shared", [3]], ["CA", 1, 4, 6], ["FU", 15, [0, 1]], ["SP", 15, 0, 32768, [2], 1], ["AN", 15, 0, 5], ["AN", 15, 1, 6], ["FU", 5, [0, 1]], ["AN", 5, 0, 5], ["FU", 5, [1, 2]], ["AN", 5, 1, 4], ["FU", 5, [2, 3]], ["AN", 5, 2, 6], ["FU", 3, [0, 1]], ["SP", 3, 0, 1024, [1], 1], ["AN", 3, 1, 2], ["FFSP", 3, 0, [10, 9], 1, 1], ["AN", 3, 1, 6], ["FU", 1, [0, 1]], ["SP", 1, 0, 32, [1], 1], ["AN", 1, 1, 2], ["FFSP", 1, 0, [10, 9], 1, 1], ["AN", 1, 1, 6], ["PR", 4, 0, "auto_unroll_max_step$1024"]]]], "r": [[0.00458174, 0.00458268], 0, 6.73112, 1653070991], "v": "v0.6"}
