.cache/log/kernel_tune/Linear_4_2048_2048.json
{"i": [["[\"3458e75493bb4bb042e539b5ff4818fb\", [4, 2048], [2048, 2048], [1, 2048], [4, 2048]]", "cuda -keys=cuda,gpu -arch=sm_80 -max_num_threads=1024 -thread_warp_size=32", [-1, 16, 64, 49152, 2147483647, 1024, 8, 32], "", 0, []], [[], [["SP", 2, 0, 4, [1, 1, 1, 4], 1], ["SP", 2, 5, 2048, [4, 512, 1, 1], 1], ["SP", 2, 10, 2048, [1, 1], 1], ["RE", 2, [0, 5, 1, 6, 2, 7, 10, 11, 3, 8, 12, 4, 9]], ["FSP", 4, 0, 0, 3], ["FSP", 4, 4, 1, 3], ["RE", 4, [0, 4, 1, 5, 2, 6, 3, 7]], ["CA", 2, 4, 5], ["CHR", 1, "shared", [2]], ["CA", 2, 3, 6], ["CHR", 0, "shared", [3]], ["CA", 1, 4, 6], ["FU", 6, [0, 1]], ["AN", 6, 0, 5], ["FU", 6, [1, 2]], ["AN", 6, 1, 4], ["FU", 6, [2, 3]], ["AN", 6, 2, 6], ["FU", 3, [0, 1]], ["SP", 3, 0, 1, [1], 1], ["AN", 3, 1, 2], ["FFSP", 3, 0, [1, 0], 1, 1], ["AN", 3, 1, 6], ["FU", 1, [0, 1]], ["SP", 1, 0, 4, [4], 1], ["AN", 1, 1, 2], ["FFSP", 1, 0, [1, 0], 1, 1], ["AN", 1, 1, 6], ["PR", 4, 0, "auto_unroll_max_step$0"]]]], "r": [[0.00724139, 0.00724188], 0, 2.32464, 1653155729], "v": "v0.6"}
{"i": [["[\"3458e75493bb4bb042e539b5ff4818fb\", [4, 2048], [2048, 2048], [1, 2048], [4, 2048]]", "cuda -keys=cuda,gpu -arch=sm_80 -max_num_threads=1024 -thread_warp_size=32", [-1, 16, 64, 49152, 2147483647, 1024, 8, 32], "", 0, []], [[], [["SP", 2, 0, 4, [1, 1, 1, 2], 1], ["SP", 2, 5, 2048, [2, 32, 1, 1], 1], ["SP", 2, 10, 2048, [4, 2], 1], ["RE", 2, [0, 5, 1, 6, 2, 7, 10, 11, 3, 8, 12, 4, 9]], ["FSP", 4, 0, 0, 3], ["FSP", 4, 4, 1, 3], ["RE", 4, [0, 4, 1, 5, 2, 6, 3, 7]], ["CA", 2, 4, 5], ["CHR", 1, "shared", [2]], ["CA", 2, 3, 6], ["CHR", 0, "shared", [3]], ["CA", 1, 4, 6], ["FU", 6, [0, 1]], ["AN", 6, 0, 5], ["FU", 6, [1, 2]], ["AN", 6, 1, 4], ["FU", 6, [2, 3]], ["AN", 6, 2, 6], ["FU", 3, [0, 1]], ["SP", 3, 0, 8, [1], 1], ["AN", 3, 1, 2], ["FFSP", 3, 0, [1, 0], 1, 1], ["AN", 3, 1, 6], ["FU", 1, [0, 1]], ["SP", 1, 0, 16, [1], 1], ["AN", 1, 1, 2], ["FFSP", 1, 0, [1, 0], 1, 1], ["AN", 1, 1, 6], ["PR", 4, 0, "auto_unroll_max_step$64"]]]], "r": [[0.000202367, 0.000202371], 0, 2.65493, 1653155731], "v": "v0.6"}
{"i": [["[\"3458e75493bb4bb042e539b5ff4818fb\", [4, 2048], [2048, 2048], [1, 2048], [4, 2048]]", "cuda -keys=cuda,gpu -arch=sm_80 -max_num_threads=1024 -thread_warp_size=32", [-1, 16, 64, 49152, 2147483647, 1024, 8, 32], "", 0, []], [[], [["SP", 2, 0, 4, [1, 1, 1, 1], 1], ["SP", 2, 5, 2048, [1, 64, 32, 1], 1], ["SP", 2, 10, 2048, [2, 1], 1], ["RE", 2, [0, 5, 1, 6, 2, 7, 10, 11, 3, 8, 12, 4, 9]], ["FSP", 4, 0, 0, 3], ["FSP", 4, 4, 1, 3], ["RE", 4, [0, 4, 1, 5, 2, 6, 3, 7]], ["CA", 2, 4, 5], ["CHR", 1, "shared", [2]], ["CA", 2, 3, 6], ["CHR", 0, "shared", [3]], ["CA", 1, 4, 6], ["FU", 6, [0, 1]], ["AN", 6, 0, 5], ["FU", 6, [1, 2]], ["AN", 6, 1, 4], ["FU", 6, [2, 3]], ["AN", 6, 2, 6], ["FU", 3, [0, 1]], ["SP", 3, 0, 64, [1], 1], ["AN", 3, 1, 2], ["FFSP", 3, 0, [1, 0], 1, 1], ["AN", 3, 1, 6], ["FU", 1, [0, 1]], ["SP", 1, 0, 2, [1], 1], ["AN", 1, 1, 2], ["FFSP", 1, 0, [1, 0], 1, 1], ["AN", 1, 1, 6], ["PR", 4, 0, "auto_unroll_max_step$512"]]]], "r": [[0.00549299, 0.00548774], 0, 2.92301, 1653155732], "v": "v0.6"}
{"i": [["[\"3458e75493bb4bb042e539b5ff4818fb\", [4, 2048], [2048, 2048], [1, 2048], [4, 2048]]", "cuda -keys=cuda,gpu -arch=sm_80 -max_num_threads=1024 -thread_warp_size=32", [-1, 16, 64, 49152, 2147483647, 1024, 8, 32], "", 0, []], [[], [["SP", 2, 0, 4, [1, 1, 1, 4], 1], ["SP", 2, 5, 2048, [4, 32, 1, 1], 1], ["SP", 2, 10, 2048, [8, 2], 1], ["RE", 2, [0, 5, 1, 6, 2, 7, 10, 11, 3, 8, 12, 4, 9]], ["FSP", 4, 0, 0, 3], ["FSP", 4, 4, 1, 3], ["RE", 4, [0, 4, 1, 5, 2, 6, 3, 7]], ["CA", 2, 4, 5], ["CHR", 1, "shared", [2]], ["CA", 2, 3, 6], ["CHR", 0, "shared", [3]], ["CA", 1, 4, 6], ["FU", 6, [0, 1]], ["AN", 6, 0, 5], ["FU", 6, [1, 2]], ["AN", 6, 1, 4], ["FU", 6, [2, 3]], ["AN", 6, 2, 6], ["FU", 3, [0, 1]], ["SP", 3, 0, 8, [1], 1], ["AN", 3, 1, 2], ["FFSP", 3, 0, [1, 0], 1, 1], ["AN", 3, 1, 6], ["FU", 1, [0, 1]], ["SP", 1, 0, 16, [1], 1], ["AN", 1, 1, 2], ["FFSP", 1, 0, [1, 0], 1, 1], ["AN", 1, 1, 6], ["PR", 4, 0, "auto_unroll_max_step$0"]]]], "r": [[0.000278405, 0.000278407], 0, 2.90455, 1653155734], "v": "v0.6"}
{"i": [["[\"3458e75493bb4bb042e539b5ff4818fb\", [4, 2048], [2048, 2048], [1, 2048], [4, 2048]]", "cuda -keys=cuda,gpu -arch=sm_80 -max_num_threads=1024 -thread_warp_size=32", [-1, 16, 64, 49152, 2147483647, 1024, 8, 32], "", 0, []], [[], [["SP", 2, 0, 4, [2, 2, 1, 1], 1], ["SP", 2, 5, 2048, [2, 32, 1, 4], 1], ["SP", 2, 10, 2048, [1, 2], 1], ["RE", 2, [0, 5, 1, 6, 2, 7, 10, 11, 3, 8, 12, 4, 9]], ["FSP", 4, 0, 0, 3], ["FSP", 4, 4, 1, 3], ["RE", 4, [0, 4, 1, 5, 2, 6, 3, 7]], ["CA", 2, 4, 5], ["CHR", 1, "shared", [2]], ["CA", 2, 3, 6], ["CHR", 0, "shared", [3]], ["CA", 1, 4, 6], ["FU", 6, [0, 1]], ["AN", 6, 0, 5], ["FU", 6, [1, 2]], ["AN", 6, 1, 4], ["FU", 6, [2, 3]], ["AN", 6, 2, 6], ["FU", 3, [0, 1]], ["SP", 3, 0, 8, [1], 1], ["AN", 3, 1, 2], ["FFSP", 3, 0, [1, 0], 1, 1], ["AN", 3, 1, 6], ["FU", 1, [0, 1]], ["SP", 1, 0, 4, [1], 1], ["AN", 1, 1, 2], ["FFSP", 1, 0, [1, 0], 1, 1], ["AN", 1, 1, 6], ["PR", 4, 0, "auto_unroll_max_step$0"]]]], "r": [[0.000751195, 0.00075119], 0, 2.91893, 1653155736], "v": "v0.6"}
{"i": [["[\"3458e75493bb4bb042e539b5ff4818fb\", [4, 2048], [2048, 2048], [1, 2048], [4, 2048]]", "cuda -keys=cuda,gpu -arch=sm_80 -max_num_threads=1024 -thread_warp_size=32", [-1, 16, 64, 49152, 2147483647, 1024, 8, 32], "", 0, []], [[], [["SP", 2, 0, 4, [2, 1, 2, 1], 1], ["SP", 2, 5, 2048, [1, 128, 1, 1], 1], ["SP", 2, 10, 2048, [1, 2], 1], ["RE", 2, [0, 5, 1, 6, 2, 7, 10, 11, 3, 8, 12, 4, 9]], ["FSP", 4, 0, 0, 3], ["FSP", 4, 4, 1, 3], ["RE", 4, [0, 4, 1, 5, 2, 6, 3, 7]], ["CA", 2, 4, 5], ["CHR", 1, "shared", [2]], ["CA", 2, 3, 6], ["CHR", 0, "shared", [3]], ["CA", 1, 4, 6], ["FU", 6, [0, 1]], ["AN", 6, 0, 5], ["FU", 6, [1, 2]], ["AN", 6, 1, 4], ["FU", 6, [2, 3]], ["AN", 6, 2, 6], ["FU", 3, [0, 1]], ["SP", 3, 0, 16, [1], 1], ["AN", 3, 1, 2], ["FFSP", 3, 0, [1, 0], 1, 1], ["AN", 3, 1, 6], ["FU", 1, [0, 1]], ["SP", 1, 0, 32, [2], 1], ["AN", 1, 1, 2], ["FFSP", 1, 0, [1, 0], 1, 1], ["AN", 1, 1, 6], ["PR", 4, 0, "auto_unroll_max_step$0"]]]], "r": [[0.000375295, 0.000375431], 0, 2.79929, 1653155738], "v": "v0.6"}
{"i": [["[\"3458e75493bb4bb042e539b5ff4818fb\", [4, 2048], [2048, 2048], [1, 2048], [4, 2048]]", "cuda -keys=cuda,gpu -arch=sm_80 -max_num_threads=1024 -thread_warp_size=32", [-1, 16, 64, 49152, 2147483647, 1024, 8, 32], "", 0, []], [[], [["SP", 2, 0, 4, [2, 1, 1, 2], 1], ["SP", 2, 5, 2048, [1, 32, 32, 1], 1], ["SP", 2, 10, 2048, [2, 1], 1], ["RE", 2, [0, 5, 1, 6, 2, 7, 10, 11, 3, 8, 12, 4, 9]], ["FSP", 4, 0, 0, 3], ["FSP", 4, 4, 1, 3], ["RE", 4, [0, 4, 1, 5, 2, 6, 3, 7]], ["CA", 2, 4, 5], ["CHR", 1, "shared", [2]], ["CA", 2, 3, 6], ["CHR", 0, "shared", [3]], ["CA", 1, 4, 6], ["FU", 6, [0, 1]], ["AN", 6, 0, 5], ["FU", 6, [1, 2]], ["AN", 6, 1, 4], ["FU", 6, [2, 3]], ["AN", 6, 2, 6], ["FU", 3, [0, 1]], ["SP", 3, 0, 32, [1], 1], ["AN", 3, 1, 2], ["FFSP", 3, 0, [1, 0], 1, 1], ["AN", 3, 1, 6], ["FU", 1, [0, 1]], ["SP", 1, 0, 4, [1], 1], ["AN", 1, 1, 2], ["FFSP", 1, 0, [1, 0], 1, 1], ["AN", 1, 1, 6], ["PR", 4, 0, "auto_unroll_max_step$64"]]]], "r": [[0.00406701, 0.00406697], 0, 3.05203, 1653155739], "v": "v0.6"}
{"i": [["[\"3458e75493bb4bb042e539b5ff4818fb\", [4, 2048], [2048, 2048], [1, 2048], [4, 2048]]", "cuda -keys=cuda,gpu -arch=sm_80 -max_num_threads=1024 -thread_warp_size=32", [-1, 16, 64, 49152, 2147483647, 1024, 8, 32], "", 0, []], [[], [["SP", 2, 0, 4, [1, 4, 1, 1], 1], ["SP", 2, 5, 2048, [1, 32, 1, 8], 1], ["SP", 2, 10, 2048, [1, 4], 1], ["RE", 2, [0, 5, 1, 6, 2, 7, 10, 11, 3, 8, 12, 4, 9]], ["FSP", 4, 0, 0, 3], ["FSP", 4, 4, 1, 3], ["RE", 4, [0, 4, 1, 5, 2, 6, 3, 7]], ["CA", 2, 4, 5], ["CHR", 1, "shared", [2]], ["CA", 2, 3, 6], ["CHR", 0, "shared", [3]], ["CA", 1, 4, 6], ["FU", 6, [0, 1]], ["AN", 6, 0, 5], ["FU", 6, [1, 2]], ["AN", 6, 1, 4], ["FU", 6, [2, 3]], ["AN", 6, 2, 6], ["FU", 3, [0, 1]], ["SP", 3, 0, 32, [1], 1], ["AN", 3, 1, 2], ["FFSP", 3, 0, [1, 0], 1, 1], ["AN", 3, 1, 6], ["FU", 1, [0, 1]], ["SP", 1, 0, 4, [4], 1], ["AN", 1, 1, 2], ["FFSP", 1, 0, [1, 0], 1, 1], ["AN", 1, 1, 6], ["PR", 4, 0, "auto_unroll_max_step$0"]]]], "r": [[0.000999955, 0.000999921], 0, 2.62872, 1653155740], "v": "v0.6"}
{"i": [["[\"3458e75493bb4bb042e539b5ff4818fb\", [4, 2048], [2048, 2048], [1, 2048], [4, 2048]]", "cuda -keys=cuda,gpu -arch=sm_80 -max_num_threads=1024 -thread_warp_size=32", [-1, 16, 64, 49152, 2147483647, 1024, 8, 32], "", 0, []], [[], [["SP", 2, 0, 4, [1, 2, 1, 2], 1], ["SP", 2, 5, 2048, [2, 16, 1, 64], 1], ["SP", 2, 10, 2048, [1, 1], 1], ["RE", 2, [0, 5, 1, 6, 2, 7, 10, 11, 3, 8, 12, 4, 9]], ["FSP", 4, 0, 0, 3], ["FSP", 4, 4, 1, 3], ["RE", 4, [0, 4, 1, 5, 2, 6, 3, 7]], ["CA", 2, 4, 5], ["CHR", 1, "shared", [2]], ["CA", 2, 3, 6], ["CHR", 0, "shared", [3]], ["CA", 1, 4, 6], ["FU", 6, [0, 1]], ["AN", 6, 0, 5], ["FU", 6, [1, 2]], ["AN", 6, 1, 4], ["FU", 6, [2, 3]], ["AN", 6, 2, 6], ["FU", 3, [0, 1]], ["SP", 3, 0, 128, [1], 1], ["AN", 3, 1, 2], ["FFSP", 3, 0, [1, 0], 1, 1], ["AN", 3, 1, 6], ["FU", 1, [0, 1]], ["SP", 1, 0, 2, [2], 1], ["AN", 1, 1, 2], ["FFSP", 1, 0, [1, 0], 1, 1], ["AN", 1, 1, 6], ["PR", 4, 0, "auto_unroll_max_step$512"]]]], "r": [[0.0176327, 0.0176321], 0, 4.69305, 1653155742], "v": "v0.6"}
{"i": [["[\"3458e75493bb4bb042e539b5ff4818fb\", [4, 2048], [2048, 2048], [1, 2048], [4, 2048]]", "cuda -keys=cuda,gpu -arch=sm_80 -max_num_threads=1024 -thread_warp_size=32", [-1, 16, 64, 49152, 2147483647, 1024, 8, 32], "", 0, []], [[], [["SP", 2, 0, 4, [1, 1, 1, 2], 1], ["SP", 2, 5, 2048, [4, 32, 1, 1], 1], ["SP", 2, 10, 2048, [1, 2], 1], ["RE", 2, [0, 5, 1, 6, 2, 7, 10, 11, 3, 8, 12, 4, 9]], ["FSP", 4, 0, 0, 3], ["FSP", 4, 4, 1, 3], ["RE", 4, [0, 4, 1, 5, 2, 6, 3, 7]], ["CA", 2, 4, 5], ["CHR", 1, "shared", [2]], ["CA", 2, 3, 6], ["CHR", 0, "shared", [3]], ["CA", 1, 4, 6], ["FU", 6, [0, 1]], ["AN", 6, 0, 5], ["FU", 6, [1, 2]], ["AN", 6, 1, 4], ["FU", 6, [2, 3]], ["AN", 6, 2, 6], ["FU", 3, [0, 1]], ["SP", 3, 0, 8, [2], 1], ["AN", 3, 1, 2], ["FFSP", 3, 0, [1, 0], 1, 1], ["AN", 3, 1, 6], ["FU", 1, [0, 1]], ["SP", 1, 0, 16, [1], 1], ["AN", 1, 1, 2], ["FFSP", 1, 0, [1, 0], 1, 1], ["AN", 1, 1, 6], ["PR", 4, 0, "auto_unroll_max_step$64"]]]], "r": [[0.000503278, 0.000503235], 0, 3.33326, 1653155744], "v": "v0.6"}
{"i": [["[\"3458e75493bb4bb042e539b5ff4818fb\", [4, 2048], [2048, 2048], [1, 2048], [4, 2048]]", "cuda -keys=cuda,gpu -arch=sm_80 -max_num_threads=1024 -thread_warp_size=32", [-1, 16, 64, 49152, 2147483647, 1024, 8, 32], "", 0, []], [[], [["SP", 2, 0, 4, [4, 1, 1, 1], 1], ["SP", 2, 5, 2048, [2, 32, 2, 1], 1], ["SP", 2, 10, 2048, [8, 2], 1], ["RE", 2, [0, 5, 1, 6, 2, 7, 10, 11, 3, 8, 12, 4, 9]], ["FSP", 4, 0, 0, 3], ["FSP", 4, 4, 1, 3], ["RE", 4, [0, 4, 1, 5, 2, 6, 3, 7]], ["CA", 2, 4, 5], ["CHR", 1, "shared", [2]], ["CA", 2, 3, 6], ["CHR", 0, "shared", [3]], ["CA", 1, 4, 6], ["FU", 6, [0, 1]], ["AN", 6, 0, 5], ["FU", 6, [1, 2]], ["AN", 6, 1, 4], ["FU", 6, [2, 3]], ["AN", 6, 2, 6], ["FU", 3, [0, 1]], ["SP", 3, 0, 32, [1], 1], ["AN", 3, 1, 2], ["FFSP", 3, 0, [1, 0], 1, 1], ["AN", 3, 1, 6], ["FU", 1, [0, 1]], ["SP", 1, 0, 16, [1], 1], ["AN", 1, 1, 2], ["FFSP", 1, 0, [1, 0], 1, 1], ["AN", 1, 1, 6], ["PR", 4, 0, "auto_unroll_max_step$0"]]]], "r": [[0.000344899, 0.0003449], 0, 3.08724, 1653155746], "v": "v0.6"}
{"i": [["[\"3458e75493bb4bb042e539b5ff4818fb\", [4, 2048], [2048, 2048], [1, 2048], [4, 2048]]", "cuda -keys=cuda,gpu -arch=sm_80 -max_num_threads=1024 -thread_warp_size=32", [-1, 16, 64, 49152, 2147483647, 1024, 8, 32], "", 0, []], [[], [["SP", 2, 0, 4, [1, 2, 1, 2], 1], ["SP", 2, 5, 2048, [1, 32, 16, 1], 1], ["SP", 2, 10, 2048, [8, 2], 1], ["RE", 2, [0, 5, 1, 6, 2, 7, 10, 11, 3, 8, 12, 4, 9]], ["FSP", 4, 0, 0, 3], ["FSP", 4, 4, 1, 3], ["RE", 4, [0, 4, 1, 5, 2, 6, 3, 7]], ["CA", 2, 4, 5], ["CHR", 1, "shared", [2]], ["CA", 2, 3, 6], ["CHR", 0, "shared", [3]], ["CA", 1, 4, 6], ["FU", 6, [0, 1]], ["AN", 6, 0, 5], ["FU", 6, [1, 2]], ["AN", 6, 1, 4], ["FU", 6, [2, 3]], ["AN", 6, 2, 6], ["FU", 3, [0, 1]], ["SP", 3, 0, 128, [1], 1], ["AN", 3, 1, 2], ["FFSP", 3, 0, [1, 0], 1, 1], ["AN", 3, 1, 6], ["FU", 1, [0, 1]], ["SP", 1, 0, 16, [1], 1], ["AN", 1, 1, 2], ["FFSP", 1, 0, [1, 0], 1, 1], ["AN", 1, 1, 6], ["PR", 4, 0, "auto_unroll_max_step$0"]]]], "r": [[0.0017968, 0.00179708], 0, 2.4725, 1653155747], "v": "v0.6"}
{"i": [["[\"3458e75493bb4bb042e539b5ff4818fb\", [4, 2048], [2048, 2048], [1, 2048], [4, 2048]]", "cuda -keys=cuda,gpu -arch=sm_80 -max_num_threads=1024 -thread_warp_size=32", [-1, 16, 64, 49152, 2147483647, 1024, 8, 32], "", 0, []], [[], [["SP", 2, 0, 4, [1, 1, 2, 2], 1], ["SP", 2, 5, 2048, [4, 64, 1, 1], 1], ["SP", 2, 10, 2048, [2, 16], 1], ["RE", 2, [0, 5, 1, 6, 2, 7, 10, 11, 3, 8, 12, 4, 9]], ["FSP", 4, 0, 0, 3], ["FSP", 4, 4, 1, 3], ["RE", 4, [0, 4, 1, 5, 2, 6, 3, 7]], ["CA", 2, 4, 5], ["CHR", 1, "shared", [2]], ["CA", 2, 3, 6], ["CHR", 0, "shared", [3]], ["CA", 1, 4, 6], ["FU", 6, [0, 1]], ["AN", 6, 0, 5], ["FU", 6, [1, 2]], ["AN", 6, 1, 4], ["FU", 6, [2, 3]], ["AN", 6, 2, 6], ["FU", 3, [0, 1]], ["SP", 3, 0, 32, [1], 1], ["AN", 3, 1, 2], ["FFSP", 3, 0, [1, 0], 1, 1], ["AN", 3, 1, 6], ["FU", 1, [0, 1]], ["SP", 1, 0, 128, [1], 1], ["AN", 1, 1, 2], ["FFSP", 1, 0, [1, 0], 1, 1], ["AN", 1, 1, 6], ["PR", 4, 0, "auto_unroll_max_step$16"]]]], "r": [[0.000369361, 0.000369506], 0, 3.06792, 1653155749], "v": "v0.6"}
{"i": [["[\"3458e75493bb4bb042e539b5ff4818fb\", [4, 2048], [2048, 2048], [1, 2048], [4, 2048]]", "cuda -keys=cuda,gpu -arch=sm_80 -max_num_threads=1024 -thread_warp_size=32", [-1, 16, 64, 49152, 2147483647, 1024, 8, 32], "", 0, []], [[], [["SP", 2, 0, 4, [1, 2, 2, 1], 1], ["SP", 2, 5, 2048, [1, 64, 1, 2], 1], ["SP", 2, 10, 2048, [2, 4], 1], ["RE", 2, [0, 5, 1, 6, 2, 7, 10, 11, 3, 8, 12, 4, 9]], ["FSP", 4, 0, 0, 3], ["FSP", 4, 4, 1, 3], ["RE", 4, [0, 4, 1, 5, 2, 6, 3, 7]], ["CA", 2, 4, 5], ["CHR", 1, "shared", [2]], ["CA", 2, 3, 6], ["CHR", 0, "shared", [3]], ["CA", 1, 4, 6], ["FU", 6, [0, 1]], ["AN", 6, 0, 5], ["FU", 6, [1, 2]], ["AN", 6, 1, 4], ["FU", 6, [2, 3]], ["AN", 6, 2, 6], ["FU", 3, [0, 1]], ["SP", 3, 0, 16, [16], 1], ["AN", 3, 1, 2], ["FFSP", 3, 0, [1, 0], 1, 1], ["AN", 3, 1, 6], ["FU", 1, [0, 1]], ["SP", 1, 0, 16, [1], 1], ["AN", 1, 1, 2], ["FFSP", 1, 0, [1, 0], 1, 1], ["AN", 1, 1, 6], ["PR", 4, 0, "auto_unroll_max_step$64"]]]], "r": [[0.000599754, 0.00059974], 0, 3.04835, 1653155750], "v": "v0.6"}
{"i": [["[\"3458e75493bb4bb042e539b5ff4818fb\", [4, 2048], [2048, 2048], [1, 2048], [4, 2048]]", "cuda -keys=cuda,gpu -arch=sm_80 -max_num_threads=1024 -thread_warp_size=32", [-1, 16, 64, 49152, 2147483647, 1024, 8, 32], "", 0, []], [[], [["SP", 2, 0, 4, [2, 1, 1, 1], 1], ["SP", 2, 5, 2048, [1, 32, 1, 16], 1], ["SP", 2, 10, 2048, [1, 4], 1], ["RE", 2, [0, 5, 1, 6, 2, 7, 10, 11, 3, 8, 12, 4, 9]], ["FSP", 4, 0, 0, 3], ["FSP", 4, 4, 1, 3], ["RE", 4, [0, 4, 1, 5, 2, 6, 3, 7]], ["CA", 2, 4, 5], ["CHR", 1, "shared", [2]], ["CA", 2, 3, 6], ["CHR", 0, "shared", [3]], ["CA", 1, 4, 6], ["FU", 6, [0, 1]], ["AN", 6, 0, 5], ["FU", 6, [1, 2]], ["AN", 6, 1, 4], ["FU", 6, [2, 3]], ["AN", 6, 2, 6], ["FU", 3, [0, 1]], ["SP", 3, 0, 16, [2], 1], ["AN", 3, 1, 2], ["FFSP", 3, 0, [1, 0], 1, 1], ["AN", 3, 1, 6], ["FU", 1, [0, 1]], ["SP", 1, 0, 4, [1], 1], ["AN", 1, 1, 2], ["FFSP", 1, 0, [1, 0], 1, 1], ["AN", 1, 1, 6], ["PR", 4, 0, "auto_unroll_max_step$512"]]]], "r": [[0.00154207, 0.00154236], 0, 2.79052, 1653155751], "v": "v0.6"}
{"i": [["[\"3458e75493bb4bb042e539b5ff4818fb\", [4, 2048], [2048, 2048], [1, 2048], [4, 2048]]", "cuda -keys=cuda,gpu -arch=sm_80 -max_num_threads=1024 -thread_warp_size=32", [-1, 16, 64, 49152, 2147483647, 1024, 8, 32], "", 0, []], [[], [["SP", 2, 0, 4, [1, 1, 1, 4], 1], ["SP", 2, 5, 2048, [2, 128, 4, 1], 1], ["SP", 2, 10, 2048, [2, 1], 1], ["RE", 2, [0, 5, 1, 6, 2, 7, 10, 11, 3, 8, 12, 4, 9]], ["FSP", 4, 0, 0, 3], ["FSP", 4, 4, 1, 3], ["RE", 4, [0, 4, 1, 5, 2, 6, 3, 7]], ["CA", 2, 4, 5], ["CHR", 1, "shared", [2]], ["CA", 2, 3, 6], ["CHR", 0, "shared", [3]], ["CA", 1, 4, 6], ["FU", 6, [0, 1]], ["AN", 6, 0, 5], ["FU", 6, [1, 2]], ["AN", 6, 1, 4], ["FU", 6, [2, 3]], ["AN", 6, 2, 6], ["FU", 3, [0, 1]], ["SP", 3, 0, 8, [4], 1], ["AN", 3, 1, 2], ["FFSP", 3, 0, [1, 0], 1, 1], ["AN", 3, 1, 6], ["FU", 1, [0, 1]], ["SP", 1, 0, 8, [1], 1], ["AN", 1, 1, 2], ["FFSP", 1, 0, [1, 0], 1, 1], ["AN", 1, 1, 6], ["PR", 4, 0, "auto_unroll_max_step$512"]]]], "r": [[0.0036108, 0.00361084], 0, 2.44338, 1653155753], "v": "v0.6"}
{"i": [["[\"3458e75493bb4bb042e539b5ff4818fb\", [4, 2048], [2048, 2048], [1, 2048], [4, 2048]]", "cuda -keys=cuda,gpu -arch=sm_80 -max_num_threads=1024 -thread_warp_size=32", [-1, 16, 64, 49152, 2147483647, 1024, 8, 32], "", 0, []], [[], [["SP", 2, 0, 4, [2, 1, 1, 2], 1], ["SP", 2, 5, 2048, [1, 64, 1, 1], 1], ["SP", 2, 10, 2048, [8, 16], 1], ["RE", 2, [0, 5, 1, 6, 2, 7, 10, 11, 3, 8, 12, 4, 9]], ["FSP", 4, 0, 0, 3], ["FSP", 4, 4, 1, 3], ["RE", 4, [0, 4, 1, 5, 2, 6, 3, 7]], ["CA", 2, 4, 5], ["CHR", 1, "shared", [2]], ["CA", 2, 3, 6], ["CHR", 0, "shared", [3]], ["CA", 1, 4, 6], ["FU", 6, [0, 1]], ["AN", 6, 0, 5], ["FU", 6, [1, 2]], ["AN", 6, 1, 4], ["FU", 6, [2, 3]], ["AN", 6, 2, 6], ["FU", 3, [0, 1]], ["SP", 3, 0, 128, [1], 1], ["AN", 3, 1, 2], ["FFSP", 3, 0, [1, 0], 1, 1], ["AN", 3, 1, 6], ["FU", 1, [0, 1]], ["SP", 1, 0, 256, [1], 1], ["AN", 1, 1, 2], ["FFSP", 1, 0, [1, 0], 1, 1], ["AN", 1, 1, 6], ["PR", 4, 0, "auto_unroll_max_step$0"]]]], "r": [[9.78153e-05, 9.78108e-05], 0, 5.67341, 1653155754], "v": "v0.6"}
{"i": [["[\"3458e75493bb4bb042e539b5ff4818fb\", [4, 2048], [2048, 2048], [1, 2048], [4, 2048]]", "cuda -keys=cuda,gpu -arch=sm_80 -max_num_threads=1024 -thread_warp_size=32", [-1, 16, 64, 49152, 2147483647, 1024, 8, 32], "", 0, []], [[], [["SP", 2, 0, 4, [1, 1, 2, 1], 1], ["SP", 2, 5, 2048, [2, 64, 1, 2], 1], ["SP", 2, 10, 2048, [4, 2], 1], ["RE", 2, [0, 5, 1, 6, 2, 7, 10, 11, 3, 8, 12, 4, 9]], ["FSP", 4, 0, 0, 3], ["FSP", 4, 4, 1, 3], ["RE", 4, [0, 4, 1, 5, 2, 6, 3, 7]], ["CA", 2, 4, 5], ["CHR", 1, "shared", [2]], ["CA", 2, 3, 6], ["CHR", 0, "shared", [3]], ["CA", 1, 4, 6], ["FU", 6, [0, 1]], ["AN", 6, 0, 5], ["FU", 6, [1, 2]], ["AN", 6, 1, 4], ["FU", 6, [2, 3]], ["AN", 6, 2, 6], ["FU", 3, [0, 1]], ["SP", 3, 0, 16, [1], 1], ["AN", 3, 1, 2], ["FFSP", 3, 0, [1, 0], 1, 1], ["AN", 3, 1, 6], ["FU", 1, [0, 1]], ["SP", 1, 0, 32, [4], 1], ["AN", 1, 1, 2], ["FFSP", 1, 0, [1, 0], 1, 1], ["AN", 1, 1, 6], ["PR", 4, 0, "auto_unroll_max_step$1024"]]]], "r": [[0.000389436, 0.00038955], 0, 3.20824, 1653155756], "v": "v0.6"}
{"i": [["[\"3458e75493bb4bb042e539b5ff4818fb\", [4, 2048], [2048, 2048], [1, 2048], [4, 2048]]", "cuda -keys=cuda,gpu -arch=sm_80 -max_num_threads=1024 -thread_warp_size=32", [-1, 16, 64, 49152, 2147483647, 1024, 8, 32], "", 0, []], [[], [["SP", 2, 0, 4, [2, 1, 1, 2], 1], ["SP", 2, 5, 2048, [4, 512, 1, 1], 1], ["SP", 2, 10, 2048, [1, 1], 1], ["RE", 2, [0, 5, 1, 6, 2, 7, 10, 11, 3, 8, 12, 4, 9]], ["FSP", 4, 0, 0, 3], ["FSP", 4, 4, 1, 3], ["RE", 4, [0, 4, 1, 5, 2, 6, 3, 7]], ["CA", 2, 4, 5], ["CHR", 1, "shared", [2]], ["CA", 2, 3, 6], ["CHR", 0, "shared", [3]], ["CA", 1, 4, 6], ["FU", 6, [0, 1]], ["AN", 6, 0, 5], ["FU", 6, [1, 2]], ["AN", 6, 1, 4], ["FU", 6, [2, 3]], ["AN", 6, 2, 6], ["FU", 3, [0, 1]], ["SP", 3, 0, 1, [1], 1], ["AN", 3, 1, 2], ["FFSP", 3, 0, [1, 0], 1, 1], ["AN", 3, 1, 6], ["FU", 1, [0, 1]], ["SP", 1, 0, 4, [2], 1], ["AN", 1, 1, 2], ["FFSP", 1, 0, [1, 0], 1, 1], ["AN", 1, 1, 6], ["PR", 4, 0, "auto_unroll_max_step$0"]]]], "r": [[0.0071637, 0.0071653], 0, 2.30976, 1653155757], "v": "v0.6"}
{"i": [["[\"3458e75493bb4bb042e539b5ff4818fb\", [4, 2048], [2048, 2048], [1, 2048], [4, 2048]]", "cuda -keys=cuda,gpu -arch=sm_80 -max_num_threads=1024 -thread_warp_size=32", [-1, 16, 64, 49152, 2147483647, 1024, 8, 32], "", 0, []], [[], [["SP", 2, 0, 4, [1, 1, 4, 1], 1], ["SP", 2, 5, 2048, [4, 32, 1, 2], 1], ["SP", 2, 10, 2048, [4, 2], 1], ["RE", 2, [0, 5, 1, 6, 2, 7, 10, 11, 3, 8, 12, 4, 9]], ["FSP", 4, 0, 0, 3], ["FSP", 4, 4, 1, 3], ["RE", 4, [0, 4, 1, 5, 2, 6, 3, 7]], ["CA", 2, 4, 5], ["CHR", 1, "shared", [2]], ["CA", 2, 3, 6], ["CHR", 0, "shared", [3]], ["CA", 1, 4, 6], ["FU", 6, [0, 1]], ["AN", 6, 0, 5], ["FU", 6, [1, 2]], ["AN", 6, 1, 4], ["FU", 6, [2, 3]], ["AN", 6, 2, 6], ["FU", 3, [0, 1]], ["SP", 3, 0, 16, [1], 1], ["AN", 3, 1, 2], ["FFSP", 3, 0, [1, 0], 1, 1], ["AN", 3, 1, 6], ["FU", 1, [0, 1]], ["SP", 1, 0, 32, [1], 1], ["AN", 1, 1, 2], ["FFSP", 1, 0, [1, 0], 1, 1], ["AN", 1, 1, 6], ["PR", 4, 0, "auto_unroll_max_step$16"]]]], "r": [[0.000596021, 0.000596195], 0, 3.12213, 1653155759], "v": "v0.6"}
{"i": [["[\"3458e75493bb4bb042e539b5ff4818fb\", [4, 2048], [2048, 2048], [1, 2048], [4, 2048]]", "cuda -keys=cuda,gpu -arch=sm_80 -max_num_threads=1024 -thread_warp_size=32", [-1, 16, 64, 49152, 2147483647, 1024, 8, 32], "", 0, []], [[], [["SP", 2, 0, 4, [1, 1, 1, 4], 1], ["SP", 2, 5, 2048, [1, 16, 8, 2], 1], ["SP", 2, 10, 2048, [1, 2], 1], ["RE", 2, [0, 5, 1, 6, 2, 7, 10, 11, 3, 8, 12, 4, 9]], ["FSP", 4, 0, 0, 3], ["FSP", 4, 4, 1, 3], ["RE", 4, [0, 4, 1, 5, 2, 6, 3, 7]], ["CA", 2, 4, 5], ["CHR", 1, "shared", [2]], ["CA", 2, 3, 6], ["CHR", 0, "shared", [3]], ["CA", 1, 4, 6], ["FU", 6, [0, 1]], ["AN", 6, 0, 5], ["FU", 6, [1, 2]], ["AN", 6, 1, 4], ["FU", 6, [2, 3]], ["AN", 6, 2, 6], ["FU", 3, [0, 1]], ["SP", 3, 0, 256, [1], 1], ["AN", 3, 1, 2], ["FFSP", 3, 0, [1, 0], 1, 1], ["AN", 3, 1, 6], ["FU", 1, [0, 1]], ["SP", 1, 0, 16, [1], 1], ["AN", 1, 1, 2], ["FFSP", 1, 0, [1, 0], 1, 1], ["AN", 1, 1, 6], ["PR", 4, 0, "auto_unroll_max_step$512"]]]], "r": [[0.00157548, 0.00157554], 0, 2.43835, 1653155760], "v": "v0.6"}
{"i": [["[\"3458e75493bb4bb042e539b5ff4818fb\", [4, 2048], [2048, 2048], [1, 2048], [4, 2048]]", "cuda -keys=cuda,gpu -arch=sm_80 -max_num_threads=1024 -thread_warp_size=32", [-1, 16, 64, 49152, 2147483647, 1024, 8, 32], "", 0, []], [[], [["SP", 2, 0, 4, [1, 2, 1, 2], 1], ["SP", 2, 5, 2048, [2, 16, 1, 2], 1], ["SP", 2, 10, 2048, [1, 2], 1], ["RE", 2, [0, 5, 1, 6, 2, 7, 10, 11, 3, 8, 12, 4, 9]], ["FSP", 4, 0, 0, 3], ["FSP", 4, 4, 1, 3], ["RE", 4, [0, 4, 1, 5, 2, 6, 3, 7]], ["CA", 2, 4, 5], ["CHR", 1, "shared", [2]], ["CA", 2, 3, 6], ["CHR", 0, "shared", [3]], ["CA", 1, 4, 6], ["FU", 6, [0, 1]], ["AN", 6, 0, 5], ["FU", 6, [1, 2]], ["AN", 6, 1, 4], ["FU", 6, [2, 3]], ["AN", 6, 2, 6], ["FU", 3, [0, 1]], ["SP", 3, 0, 128, [1], 1], ["AN", 3, 1, 2], ["FFSP", 3, 0, [1, 0], 1, 1], ["AN", 3, 1, 6], ["FU", 1, [0, 1]], ["SP", 1, 0, 128, [1], 1], ["AN", 1, 1, 2], ["FFSP", 1, 0, [1, 0], 1, 1], ["AN", 1, 1, 6], ["PR", 4, 0, "auto_unroll_max_step$1024"]]]], "r": [[0.000367746, 0.000367698], 0, 2.75705, 1653155762], "v": "v0.6"}
{"i": [["[\"3458e75493bb4bb042e539b5ff4818fb\", [4, 2048], [2048, 2048], [1, 2048], [4, 2048]]", "cuda -keys=cuda,gpu -arch=sm_80 -max_num_threads=1024 -thread_warp_size=32", [-1, 16, 64, 49152, 2147483647, 1024, 8, 32], "", 0, []], [[], [["SP", 2, 0, 4, [1, 2, 1, 1], 1], ["SP", 2, 5, 2048, [4, 32, 1, 8], 1], ["SP", 2, 10, 2048, [4, 1], 1], ["RE", 2, [0, 5, 1, 6, 2, 7, 10, 11, 3, 8, 12, 4, 9]], ["FSP", 4, 0, 0, 3], ["FSP", 4, 4, 1, 3], ["RE", 4, [0, 4, 1, 5, 2, 6, 3, 7]], ["CA", 2, 4, 5], ["CHR", 1, "shared", [2]], ["CA", 2, 3, 6], ["CHR", 0, "shared", [3]], ["CA", 1, 4, 6], ["FU", 6, [0, 1]], ["AN", 6, 0, 5], ["FU", 6, [1, 2]], ["AN", 6, 1, 4], ["FU", 6, [2, 3]], ["AN", 6, 2, 6], ["FU", 3, [0, 1]], ["SP", 3, 0, 32, [1], 1], ["AN", 3, 1, 2], ["FFSP", 3, 0, [1, 0], 1, 1], ["AN", 3, 1, 6], ["FU", 1, [0, 1]], ["SP", 1, 0, 4, [4], 1], ["AN", 1, 1, 2], ["FFSP", 1, 0, [1, 0], 1, 1], ["AN", 1, 1, 6], ["PR", 4, 0, "auto_unroll_max_step$64"]]]], "r": [[0.00683311, 0.00683321], 0, 2.52556, 1653155763], "v": "v0.6"}
{"i": [["[\"3458e75493bb4bb042e539b5ff4818fb\", [4, 2048], [2048, 2048], [1, 2048], [4, 2048]]", "cuda -keys=cuda,gpu -arch=sm_80 -max_num_threads=1024 -thread_warp_size=32", [-1, 16, 64, 49152, 2147483647, 1024, 8, 32], "", 0, []], [[], [["SP", 2, 0, 4, [1, 4, 1, 1], 1], ["SP", 2, 5, 2048, [1, 16, 1, 8], 1], ["SP", 2, 10, 2048, [4, 2], 1], ["RE", 2, [0, 5, 1, 6, 2, 7, 10, 11, 3, 8, 12, 4, 9]], ["FSP", 4, 0, 0, 3], ["FSP", 4, 4, 1, 3], ["RE", 4, [0, 4, 1, 5, 2, 6, 3, 7]], ["CA", 2, 4, 5], ["CHR", 1, "shared", [2]], ["CA", 2, 3, 6], ["CHR", 0, "shared", [3]], ["CA", 1, 4, 6], ["FU", 6, [0, 1]], ["AN", 6, 0, 5], ["FU", 6, [1, 2]], ["AN", 6, 1, 4], ["FU", 6, [2, 3]], ["AN", 6, 2, 6], ["FU", 3, [0, 1]], ["SP", 3, 0, 128, [4], 1], ["AN", 3, 1, 2], ["FFSP", 3, 0, [1, 0], 1, 1], ["AN", 3, 1, 6], ["FU", 1, [0, 1]], ["SP", 1, 0, 8, [1], 1], ["AN", 1, 1, 2], ["FFSP", 1, 0, [1, 0], 1, 1], ["AN", 1, 1, 6], ["PR", 4, 0, "auto_unroll_max_step$0"]]]], "r": [[0.000522356, 0.000522404], 0, 2.96768, 1653155764], "v": "v0.6"}
{"i": [["[\"3458e75493bb4bb042e539b5ff4818fb\", [4, 2048], [2048, 2048], [1, 2048], [4, 2048]]", "cuda -keys=cuda,gpu -arch=sm_80 -max_num_threads=1024 -thread_warp_size=32", [-1, 16, 64, 49152, 2147483647, 1024, 8, 32], "", 0, []], [[], [["SP", 2, 0, 4, [1, 1, 2, 2], 1], ["SP", 2, 5, 2048, [4, 32, 4, 1], 1], ["SP", 2, 10, 2048, [1, 4], 1], ["RE", 2, [0, 5, 1, 6, 2, 7, 10, 11, 3, 8, 12, 4, 9]], ["FSP", 4, 0, 0, 3], ["FSP", 4, 4, 1, 3], ["RE", 4, [0, 4, 1, 5, 2, 6, 3, 7]], ["CA", 2, 4, 5], ["CHR", 1, "shared", [2]], ["CA", 2, 3, 6], ["CHR", 0, "shared", [3]], ["CA", 1, 4, 6], ["FU", 6, [0, 1]], ["AN", 6, 0, 5], ["FU", 6, [1, 2]], ["AN", 6, 1, 4], ["FU", 6, [2, 3]], ["AN", 6, 2, 6], ["FU", 3, [0, 1]], ["SP", 3, 0, 16, [1], 1], ["AN", 3, 1, 2], ["FFSP", 3, 0, [1, 0], 1, 1], ["AN", 3, 1, 6], ["FU", 1, [0, 1]], ["SP", 1, 0, 8, [4], 1], ["AN", 1, 1, 2], ["FFSP", 1, 0, [1, 0], 1, 1], ["AN", 1, 1, 6], ["PR", 4, 0, "auto_unroll_max_step$512"]]]], "r": [[0.00124606, 0.00124622], 0, 2.47569, 1653155766], "v": "v0.6"}
{"i": [["[\"3458e75493bb4bb042e539b5ff4818fb\", [4, 2048], [2048, 2048], [1, 2048], [4, 2048]]", "cuda -keys=cuda,gpu -arch=sm_80 -max_num_threads=1024 -thread_warp_size=32", [-1, 16, 64, 49152, 2147483647, 1024, 8, 32], "", 0, []], [[], [["SP", 2, 0, 4, [1, 4, 1, 1], 1], ["SP", 2, 5, 2048, [2, 64, 1, 8], 1], ["SP", 2, 10, 2048, [8, 1], 1], ["RE", 2, [0, 5, 1, 6, 2, 7, 10, 11, 3, 8, 12, 4, 9]], ["FSP", 4, 0, 0, 3], ["FSP", 4, 4, 1, 3], ["RE", 4, [0, 4, 1, 5, 2, 6, 3, 7]], ["CA", 2, 4, 5], ["CHR", 1, "shared", [2]], ["CA", 2, 3, 6], ["CHR", 0, "shared", [3]], ["CA", 1, 4, 6], ["FU", 6, [0, 1]], ["AN", 6, 0, 5], ["FU", 6, [1, 2]], ["AN", 6, 1, 4], ["FU", 6, [2, 3]], ["AN", 6, 2, 6], ["FU", 3, [0, 1]], ["SP", 3, 0, 32, [1], 1], ["AN", 3, 1, 2], ["FFSP", 3, 0, [1, 0], 1, 1], ["AN", 3, 1, 6], ["FU", 1, [0, 1]], ["SP", 1, 0, 32, [16], 1], ["AN", 1, 1, 2], ["FFSP", 1, 0, [1, 0], 1, 1], ["AN", 1, 1, 6], ["PR", 4, 0, "auto_unroll_max_step$16"]]]], "r": [[0.00620311, 0.00620342], 0, 2.0888, 1653155767], "v": "v0.6"}
{"i": [["[\"3458e75493bb4bb042e539b5ff4818fb\", [4, 2048], [2048, 2048], [1, 2048], [4, 2048]]", "cuda -keys=cuda,gpu -arch=sm_80 -max_num_threads=1024 -thread_warp_size=32", [-1, 16, 64, 49152, 2147483647, 1024, 8, 32], "", 0, []], [[], [["SP", 2, 0, 4, [1, 4, 1, 1], 1], ["SP", 2, 5, 2048, [8, 16, 2, 2], 1], ["SP", 2, 10, 2048, [16, 1], 1], ["RE", 2, [0, 5, 1, 6, 2, 7, 10, 11, 3, 8, 12, 4, 9]], ["FSP", 4, 0, 0, 3], ["FSP", 4, 4, 1, 3], ["RE", 4, [0, 4, 1, 5, 2, 6, 3, 7]], ["CA", 2, 4, 5], ["CHR", 1, "shared", [2]], ["CA", 2, 3, 6], ["CHR", 0, "shared", [3]], ["CA", 1, 4, 6], ["FU", 6, [0, 1]], ["AN", 6, 0, 5], ["FU", 6, [1, 2]], ["AN", 6, 1, 4], ["FU", 6, [2, 3]], ["AN", 6, 2, 6], ["FU", 3, [0, 1]], ["SP", 3, 0, 64, [1], 1], ["AN", 3, 1, 2], ["FFSP", 3, 0, [1, 0], 1, 1], ["AN", 3, 1, 6], ["FU", 1, [0, 1]], ["SP", 1, 0, 16, [4], 1], ["AN", 1, 1, 2], ["FFSP", 1, 0, [1, 0], 1, 1], ["AN", 1, 1, 6], ["PR", 4, 0, "auto_unroll_max_step$0"]]]], "r": [[0.00318958, 0.00318963], 0, 2.97597, 1653155768], "v": "v0.6"}
{"i": [["[\"3458e75493bb4bb042e539b5ff4818fb\", [4, 2048], [2048, 2048], [1, 2048], [4, 2048]]", "cuda -keys=cuda,gpu -arch=sm_80 -max_num_threads=1024 -thread_warp_size=32", [-1, 16, 64, 49152, 2147483647, 1024, 8, 32], "", 0, []], [[], [["SP", 2, 0, 4, [1, 1, 2, 1], 1], ["SP", 2, 5, 2048, [4, 32, 1, 1], 1], ["SP", 2, 10, 2048, [1, 4], 1], ["RE", 2, [0, 5, 1, 6, 2, 7, 10, 11, 3, 8, 12, 4, 9]], ["FSP", 4, 0, 0, 3], ["FSP", 4, 4, 1, 3], ["RE", 4, [0, 4, 1, 5, 2, 6, 3, 7]], ["CA", 2, 4, 5], ["CHR", 1, "shared", [2]], ["CA", 2, 3, 6], ["CHR", 0, "shared", [3]], ["CA", 1, 4, 6], ["FU", 6, [0, 1]], ["AN", 6, 0, 5], ["FU", 6, [1, 2]], ["AN", 6, 1, 4], ["FU", 6, [2, 3]], ["AN", 6, 2, 6], ["FU", 3, [0, 1]], ["SP", 3, 0, 4, [1], 1], ["AN", 3, 1, 2], ["FFSP", 3, 0, [1, 0], 1, 1], ["AN", 3, 1, 6], ["FU", 1, [0, 1]], ["SP", 1, 0, 8, [2], 1], ["AN", 1, 1, 2], ["FFSP", 1, 0, [1, 0], 1, 1], ["AN", 1, 1, 6], ["PR", 4, 0, "auto_unroll_max_step$512"]]]], "r": [[0.000364307, 0.000364427], 0, 2.7865, 1653155770], "v": "v0.6"}
{"i": [["[\"3458e75493bb4bb042e539b5ff4818fb\", [4, 2048], [2048, 2048], [1, 2048], [4, 2048]]", "cuda -keys=cuda,gpu -arch=sm_80 -max_num_threads=1024 -thread_warp_size=32", [-1, 16, 64, 49152, 2147483647, 1024, 8, 32], "", 0, []], [[], [["SP", 2, 0, 4, [1, 1, 1, 1], 1], ["SP", 2, 5, 2048, [1, 64, 1, 4], 1], ["SP", 2, 10, 2048, [1, 2], 1], ["RE", 2, [0, 5, 1, 6, 2, 7, 10, 11, 3, 8, 12, 4, 9]], ["FSP", 4, 0, 0, 3], ["FSP", 4, 4, 1, 3], ["RE", 4, [0, 4, 1, 5, 2, 6, 3, 7]], ["CA", 2, 4, 5], ["CHR", 1, "shared", [2]], ["CA", 2, 3, 6], ["CHR", 0, "shared", [3]], ["CA", 1, 4, 6], ["FU", 6, [0, 1]], ["AN", 6, 0, 5], ["FU", 6, [1, 2]], ["AN", 6, 1, 4], ["FU", 6, [2, 3]], ["AN", 6, 2, 6], ["FU", 3, [0, 1]], ["SP", 3, 0, 128, [1], 1], ["AN", 3, 1, 2], ["FFSP", 3, 0, [1, 0], 1, 1], ["AN", 3, 1, 6], ["FU", 1, [0, 1]], ["SP", 1, 0, 64, [1], 1], ["AN", 1, 1, 2], ["FFSP", 1, 0, [1, 0], 1, 1], ["AN", 1, 1, 6], ["PR", 4, 0, "auto_unroll_max_step$64"]]]], "r": [[0.000731567, 0.000731656], 0, 2.4493, 1653155772], "v": "v0.6"}
{"i": [["[\"3458e75493bb4bb042e539b5ff4818fb\", [4, 2048], [2048, 2048], [1, 2048], [4, 2048]]", "cuda -keys=cuda,gpu -arch=sm_80 -max_num_threads=1024 -thread_warp_size=32", [-1, 16, 64, 49152, 2147483647, 1024, 8, 32], "", 0, []], [[], [["SP", 2, 0, 4, [2, 2, 1, 1], 1], ["SP", 2, 5, 2048, [4, 32, 4, 1], 1], ["SP", 2, 10, 2048, [2, 8], 1], ["RE", 2, [0, 5, 1, 6, 2, 7, 10, 11, 3, 8, 12, 4, 9]], ["FSP", 4, 0, 0, 3], ["FSP", 4, 4, 1, 3], ["RE", 4, [0, 4, 1, 5, 2, 6, 3, 7]], ["CA", 2, 4, 5], ["CHR", 1, "shared", [2]], ["CA", 2, 3, 6], ["CHR", 0, "shared", [3]], ["CA", 1, 4, 6], ["FU", 6, [0, 1]], ["AN", 6, 0, 5], ["FU", 6, [1, 2]], ["AN", 6, 1, 4], ["FU", 6, [2, 3]], ["AN", 6, 2, 6], ["FU", 3, [0, 1]], ["SP", 3, 0, 64, [1], 1], ["AN", 3, 1, 2], ["FFSP", 3, 0, [1, 0], 1, 1], ["AN", 3, 1, 6], ["FU", 1, [0, 1]], ["SP", 1, 0, 16, [1], 1], ["AN", 1, 1, 2], ["FFSP", 1, 0, [1, 0], 1, 1], ["AN", 1, 1, 6], ["PR", 4, 0, "auto_unroll_max_step$512"]]]], "r": [[0.000996434, 0.000996573], 0, 3.71943, 1653155774], "v": "v0.6"}
{"i": [["[\"3458e75493bb4bb042e539b5ff4818fb\", [4, 2048], [2048, 2048], [1, 2048], [4, 2048]]", "cuda -keys=cuda,gpu -arch=sm_80 -max_num_threads=1024 -thread_warp_size=32", [-1, 16, 64, 49152, 2147483647, 1024, 8, 32], "", 0, []], [[], [["SP", 2, 0, 4, [1, 2, 2, 1], 1], ["SP", 2, 5, 2048, [8, 32, 1, 4], 1], ["SP", 2, 10, 2048, [1, 2], 1], ["RE", 2, [0, 5, 1, 6, 2, 7, 10, 11, 3, 8, 12, 4, 9]], ["FSP", 4, 0, 0, 3], ["FSP", 4, 4, 1, 3], ["RE", 4, [0, 4, 1, 5, 2, 6, 3, 7]], ["CA", 2, 4, 5], ["CHR", 1, "shared", [2]], ["CA", 2, 3, 6], ["CHR", 0, "shared", [3]], ["CA", 1, 4, 6], ["FU", 6, [0, 1]], ["AN", 6, 0, 5], ["FU", 6, [1, 2]], ["AN", 6, 1, 4], ["FU", 6, [2, 3]], ["AN", 6, 2, 6], ["FU", 3, [0, 1]], ["SP", 3, 0, 8, [1], 1], ["AN", 3, 1, 2], ["FFSP", 3, 0, [1, 0], 1, 1], ["AN", 3, 1, 6], ["FU", 1, [0, 1]], ["SP", 1, 0, 4, [1], 1], ["AN", 1, 1, 2], ["FFSP", 1, 0, [1, 0], 1, 1], ["AN", 1, 1, 6], ["PR", 4, 0, "auto_unroll_max_step$0"]]]], "r": [[0.00275858, 0.00275837], 0, 2.27041, 1653155775], "v": "v0.6"}
{"i": [["[\"3458e75493bb4bb042e539b5ff4818fb\", [4, 2048], [2048, 2048], [1, 2048], [4, 2048]]", "cuda -keys=cuda,gpu -arch=sm_80 -max_num_threads=1024 -thread_warp_size=32", [-1, 16, 64, 49152, 2147483647, 1024, 8, 32], "", 0, []], [[], [["SP", 2, 0, 4, [2, 1, 2, 1], 1], ["SP", 2, 5, 2048, [4, 512, 1, 1], 1], ["SP", 2, 10, 2048, [4, 1], 1], ["RE", 2, [0, 5, 1, 6, 2, 7, 10, 11, 3, 8, 12, 4, 9]], ["FSP", 4, 0, 0, 3], ["FSP", 4, 4, 1, 3], ["RE", 4, [0, 4, 1, 5, 2, 6, 3, 7]], ["CA", 2, 4, 5], ["CHR", 1, "shared", [2]], ["CA", 2, 3, 6], ["CHR", 0, "shared", [3]], ["CA", 1, 4, 6], ["FU", 6, [0, 1]], ["AN", 6, 0, 5], ["FU", 6, [1, 2]], ["AN", 6, 1, 4], ["FU", 6, [2, 3]], ["AN", 6, 2, 6], ["FU", 3, [0, 1]], ["SP", 3, 0, 4, [2], 1], ["AN", 3, 1, 2], ["FFSP", 3, 0, [1, 0], 1, 1], ["AN", 3, 1, 6], ["FU", 1, [0, 1]], ["SP", 1, 0, 16, [1], 1], ["AN", 1, 1, 2], ["FFSP", 1, 0, [1, 0], 1, 1], ["AN", 1, 1, 6], ["PR", 4, 0, "auto_unroll_max_step$0"]]]], "r": [[0.0021304, 0.00213008], 0, 1.98864, 1653155776], "v": "v0.6"}
{"i": [["[\"3458e75493bb4bb042e539b5ff4818fb\", [4, 2048], [2048, 2048], [1, 2048], [4, 2048]]", "cuda -keys=cuda,gpu -arch=sm_80 -max_num_threads=1024 -thread_warp_size=32", [-1, 16, 64, 49152, 2147483647, 1024, 8, 32], "", 0, []], [[], [["SP", 2, 0, 4, [1, 2, 1, 1], 1], ["SP", 2, 5, 2048, [1, 16, 1, 2], 1], ["SP", 2, 10, 2048, [16, 8], 1], ["RE", 2, [0, 5, 1, 6, 2, 7, 10, 11, 3, 8, 12, 4, 9]], ["FSP", 4, 0, 0, 3], ["FSP", 4, 4, 1, 3], ["RE", 4, [0, 4, 1, 5, 2, 6, 3, 7]], ["CA", 2, 4, 5], ["CHR", 1, "shared", [2]], ["CA", 2, 3, 6], ["CHR", 0, "shared", [3]], ["CA", 1, 4, 6], ["FU", 6, [0, 1]], ["AN", 6, 0, 5], ["FU", 6, [1, 2]], ["AN", 6, 1, 4], ["FU", 6, [2, 3]], ["AN", 6, 2, 6], ["FU", 3, [0, 1]], ["SP", 3, 0, 256, [1], 1], ["AN", 3, 1, 2], ["FFSP", 3, 0, [1, 0], 1, 1], ["AN", 3, 1, 6], ["FU", 1, [0, 1]], ["SP", 1, 0, 128, [1], 1], ["AN", 1, 1, 2], ["FFSP", 1, 0, [1, 0], 1, 1], ["AN", 1, 1, 6], ["PR", 4, 0, "auto_unroll_max_step$0"]]]], "r": [[0.000149364, 0.000149399], 0, 2.41236, 1653155777], "v": "v0.6"}
{"i": [["[\"3458e75493bb4bb042e539b5ff4818fb\", [4, 2048], [2048, 2048], [1, 2048], [4, 2048]]", "cuda -keys=cuda,gpu -arch=sm_80 -max_num_threads=1024 -thread_warp_size=32", [-1, 16, 64, 49152, 2147483647, 1024, 8, 32], "", 0, []], [[], [["SP", 2, 0, 4, [1, 1, 2, 2], 1], ["SP", 2, 5, 2048, [4, 512, 1, 1], 1], ["SP", 2, 10, 2048, [1, 1], 1], ["RE", 2, [0, 5, 1, 6, 2, 7, 10, 11, 3, 8, 12, 4, 9]], ["FSP", 4, 0, 0, 3], ["FSP", 4, 4, 1, 3], ["RE", 4, [0, 4, 1, 5, 2, 6, 3, 7]], ["CA", 2, 4, 5], ["CHR", 1, "shared", [2]], ["CA", 2, 3, 6], ["CHR", 0, "shared", [3]], ["CA", 1, 4, 6], ["FU", 6, [0, 1]], ["AN", 6, 0, 5], ["FU", 6, [1, 2]], ["AN", 6, 1, 4], ["FU", 6, [2, 3]], ["AN", 6, 2, 6], ["FU", 3, [0, 1]], ["SP", 3, 0, 4, [4], 1], ["AN", 3, 1, 2], ["FFSP", 3, 0, [1, 0], 1, 1], ["AN", 3, 1, 6], ["FU", 1, [0, 1]], ["SP", 1, 0, 16, [2], 1], ["AN", 1, 1, 2], ["FFSP", 1, 0, [1, 0], 1, 1], ["AN", 1, 1, 6], ["PR", 4, 0, "auto_unroll_max_step$16"]]]], "r": [[0.00661142, 0.00661256], 0, 1.76866, 1653155779], "v": "v0.6"}
{"i": [["[\"3458e75493bb4bb042e539b5ff4818fb\", [4, 2048], [2048, 2048], [1, 2048], [4, 2048]]", "cuda -keys=cuda,gpu -arch=sm_80 -max_num_threads=1024 -thread_warp_size=32", [-1, 16, 64, 49152, 2147483647, 1024, 8, 32], "", 0, []], [[], [["SP", 2, 0, 4, [1, 1, 2, 1], 1], ["SP", 2, 5, 2048, [2, 128, 1, 2], 1], ["SP", 2, 10, 2048, [4, 2], 1], ["RE", 2, [0, 5, 1, 6, 2, 7, 10, 11, 3, 8, 12, 4, 9]], ["FSP", 4, 0, 0, 3], ["FSP", 4, 4, 1, 3], ["RE", 4, [0, 4, 1, 5, 2, 6, 3, 7]], ["CA", 2, 4, 5], ["CHR", 1, "shared", [2]], ["CA", 2, 3, 6], ["CHR", 0, "shared", [3]], ["CA", 1, 4, 6], ["FU", 6, [0, 1]], ["AN", 6, 0, 5], ["FU", 6, [1, 2]], ["AN", 6, 1, 4], ["FU", 6, [2, 3]], ["AN", 6, 2, 6], ["FU", 3, [0, 1]], ["SP", 3, 0, 16, [4], 1], ["AN", 3, 1, 2], ["FFSP", 3, 0, [1, 0], 1, 1], ["AN", 3, 1, 6], ["FU", 1, [0, 1]], ["SP", 1, 0, 16, [1], 1], ["AN", 1, 1, 2], ["FFSP", 1, 0, [1, 0], 1, 1], ["AN", 1, 1, 6], ["PR", 4, 0, "auto_unroll_max_step$1024"]]]], "r": [[0.000549922, 0.000549968], 0, 2.58921, 1653155780], "v": "v0.6"}
{"i": [["[\"3458e75493bb4bb042e539b5ff4818fb\", [4, 2048], [2048, 2048], [1, 2048], [4, 2048]]", "cuda -keys=cuda,gpu -arch=sm_80 -max_num_threads=1024 -thread_warp_size=32", [-1, 16, 64, 49152, 2147483647, 1024, 8, 32], "", 0, []], [[], [["SP", 2, 0, 4, [4, 1, 1, 1], 1], ["SP", 2, 5, 2048, [2, 64, 1, 1], 1], ["SP", 2, 10, 2048, [1, 2], 1], ["RE", 2, [0, 5, 1, 6, 2, 7, 10, 11, 3, 8, 12, 4, 9]], ["FSP", 4, 0, 0, 3], ["FSP", 4, 4, 1, 3], ["RE", 4, [0, 4, 1, 5, 2, 6, 3, 7]], ["CA", 2, 4, 5], ["CHR", 1, "shared", [2]], ["CA", 2, 3, 6], ["CHR", 0, "shared", [3]], ["CA", 1, 4, 6], ["FU", 6, [0, 1]], ["AN", 6, 0, 5], ["FU", 6, [1, 2]], ["AN", 6, 1, 4], ["FU", 6, [2, 3]], ["AN", 6, 2, 6], ["FU", 3, [0, 1]], ["SP", 3, 0, 4, [4], 1], ["AN", 3, 1, 2], ["FFSP", 3, 0, [1, 0], 1, 1], ["AN", 3, 1, 6], ["FU", 1, [0, 1]], ["SP", 1, 0, 4, [1], 1], ["AN", 1, 1, 2], ["FFSP", 1, 0, [1, 0], 1, 1], ["AN", 1, 1, 6], ["PR", 4, 0, "auto_unroll_max_step$512"]]]], "r": [[0.000628251, 0.000628247], 0, 2.48526, 1653155782], "v": "v0.6"}
{"i": [["[\"3458e75493bb4bb042e539b5ff4818fb\", [4, 2048], [2048, 2048], [1, 2048], [4, 2048]]", "cuda -keys=cuda,gpu -arch=sm_80 -max_num_threads=1024 -thread_warp_size=32", [-1, 16, 64, 49152, 2147483647, 1024, 8, 32], "", 0, []], [[], [["SP", 2, 0, 4, [2, 1, 1, 1], 1], ["SP", 2, 5, 2048, [1, 64, 1, 16], 1], ["SP", 2, 10, 2048, [1, 1], 1], ["RE", 2, [0, 5, 1, 6, 2, 7, 10, 11, 3, 8, 12, 4, 9]], ["FSP", 4, 0, 0, 3], ["FSP", 4, 4, 1, 3], ["RE", 4, [0, 4, 1, 5, 2, 6, 3, 7]], ["CA", 2, 4, 5], ["CHR", 1, "shared", [2]], ["CA", 2, 3, 6], ["CHR", 0, "shared", [3]], ["CA", 1, 4, 6], ["FU", 6, [0, 1]], ["AN", 6, 0, 5], ["FU", 6, [1, 2]], ["AN", 6, 1, 4], ["FU", 6, [2, 3]], ["AN", 6, 2, 6], ["FU", 3, [0, 1]], ["SP", 3, 0, 32, [1], 1], ["AN", 3, 1, 2], ["FFSP", 3, 0, [1, 0], 1, 1], ["AN", 3, 1, 6], ["FU", 1, [0, 1]], ["SP", 1, 0, 2, [1], 1], ["AN", 1, 1, 2], ["FFSP", 1, 0, [1, 0], 1, 1], ["AN", 1, 1, 6], ["PR", 4, 0, "auto_unroll_max_step$16"]]]], "r": [[0.00434499, 0.00434498], 0, 2.43495, 1653155784], "v": "v0.6"}
{"i": [["[\"3458e75493bb4bb042e539b5ff4818fb\", [4, 2048], [2048, 2048], [1, 2048], [4, 2048]]", "cuda -keys=cuda,gpu -arch=sm_80 -max_num_threads=1024 -thread_warp_size=32", [-1, 16, 64, 49152, 2147483647, 1024, 8, 32], "", 0, []], [[], [["SP", 2, 0, 4, [2, 1, 1, 1], 1], ["SP", 2, 5, 2048, [1, 128, 1, 1], 1], ["SP", 2, 10, 2048, [1, 64], 1], ["RE", 2, [0, 5, 1, 6, 2, 7, 10, 11, 3, 8, 12, 4, 9]], ["FSP", 4, 0, 0, 3], ["FSP", 4, 4, 1, 3], ["RE", 4, [0, 4, 1, 5, 2, 6, 3, 7]], ["CA", 2, 4, 5], ["CHR", 1, "shared", [2]], ["CA", 2, 3, 6], ["CHR", 0, "shared", [3]], ["CA", 1, 4, 6], ["FU", 6, [0, 1]], ["AN", 6, 0, 5], ["FU", 6, [1, 2]], ["AN", 6, 1, 4], ["FU", 6, [2, 3]], ["AN", 6, 2, 6], ["FU", 3, [0, 1]], ["SP", 3, 0, 256, [1], 1], ["AN", 3, 1, 2], ["FFSP", 3, 0, [1, 0], 1, 1], ["AN", 3, 1, 6], ["FU", 1, [0, 1]], ["SP", 1, 0, 64, [1], 1], ["AN", 1, 1, 2], ["FFSP", 1, 0, [1, 0], 1, 1], ["AN", 1, 1, 6], ["PR", 4, 0, "auto_unroll_max_step$512"]]]], "r": [[0.000148646, 0.000148651], 0, 2.78909, 1653155786], "v": "v0.6"}
{"i": [["[\"3458e75493bb4bb042e539b5ff4818fb\", [4, 2048], [2048, 2048], [1, 2048], [4, 2048]]", "cuda -keys=cuda,gpu -arch=sm_80 -max_num_threads=1024 -thread_warp_size=32", [-1, 16, 64, 49152, 2147483647, 1024, 8, 32], "", 0, []], [[], [["SP", 2, 0, 4, [2, 1, 1, 2], 1], ["SP", 2, 5, 2048, [1, 128, 4, 2], 1], ["SP", 2, 10, 2048, [1, 1], 1], ["RE", 2, [0, 5, 1, 6, 2, 7, 10, 11, 3, 8, 12, 4, 9]], ["FSP", 4, 0, 0, 3], ["FSP", 4, 4, 1, 3], ["RE", 4, [0, 4, 1, 5, 2, 6, 3, 7]], ["CA", 2, 4, 5], ["CHR", 1, "shared", [2]], ["CA", 2, 3, 6], ["CHR", 0, "shared", [3]], ["CA", 1, 4, 6], ["FU", 6, [0, 1]], ["AN", 6, 0, 5], ["FU", 6, [1, 2]], ["AN", 6, 1, 4], ["FU", 6, [2, 3]], ["AN", 6, 2, 6], ["FU", 3, [0, 1]], ["SP", 3, 0, 16, [4], 1], ["AN", 3, 1, 2], ["FFSP", 3, 0, [1, 0], 1, 1], ["AN", 3, 1, 6], ["FU", 1, [0, 1]], ["SP", 1, 0, 4, [1], 1], ["AN", 1, 1, 2], ["FFSP", 1, 0, [1, 0], 1, 1], ["AN", 1, 1, 6], ["PR", 4, 0, "auto_unroll_max_step$1024"]]]], "r": [[0.00392906, 0.0039291], 0, 1.69301, 1653155787], "v": "v0.6"}
{"i": [["[\"3458e75493bb4bb042e539b5ff4818fb\", [4, 2048], [2048, 2048], [1, 2048], [4, 2048]]", "cuda -keys=cuda,gpu -arch=sm_80 -max_num_threads=1024 -thread_warp_size=32", [-1, 16, 64, 49152, 2147483647, 1024, 8, 32], "", 0, []], [[], [["SP", 2, 0, 4, [4, 1, 1, 1], 1], ["SP", 2, 5, 2048, [1, 32, 4, 2], 1], ["SP", 2, 10, 2048, [4, 2], 1], ["RE", 2, [0, 5, 1, 6, 2, 7, 10, 11, 3, 8, 12, 4, 9]], ["FSP", 4, 0, 0, 3], ["FSP", 4, 4, 1, 3], ["RE", 4, [0, 4, 1, 5, 2, 6, 3, 7]], ["CA", 2, 4, 5], ["CHR", 1, "shared", [2]], ["CA", 2, 3, 6], ["CHR", 0, "shared", [3]], ["CA", 1, 4, 6], ["FU", 6, [0, 1]], ["AN", 6, 0, 5], ["FU", 6, [1, 2]], ["AN", 6, 1, 4], ["FU", 6, [2, 3]], ["AN", 6, 2, 6], ["FU", 3, [0, 1]], ["SP", 3, 0, 64, [4], 1], ["AN", 3, 1, 2], ["FFSP", 3, 0, [1, 0], 1, 1], ["AN", 3, 1, 6], ["FU", 1, [0, 1]], ["SP", 1, 0, 8, [1], 1], ["AN", 1, 1, 2], ["FFSP", 1, 0, [1, 0], 1, 1], ["AN", 1, 1, 6], ["PR", 4, 0, "auto_unroll_max_step$16"]]]], "r": [[0.000682842, 0.000682775], 0, 2.53485, 1653155788], "v": "v0.6"}
{"i": [["[\"3458e75493bb4bb042e539b5ff4818fb\", [4, 2048], [2048, 2048], [1, 2048], [4, 2048]]", "cuda -keys=cuda,gpu -arch=sm_80 -max_num_threads=1024 -thread_warp_size=32", [-1, 16, 64, 49152, 2147483647, 1024, 8, 32], "", 0, []], [[], [["SP", 2, 0, 4, [1, 1, 2, 2], 1], ["SP", 2, 5, 2048, [4, 32, 1, 1], 1], ["SP", 2, 10, 2048, [4, 2], 1], ["RE", 2, [0, 5, 1, 6, 2, 7, 10, 11, 3, 8, 12, 4, 9]], ["FSP", 4, 0, 0, 3], ["FSP", 4, 4, 1, 3], ["RE", 4, [0, 4, 1, 5, 2, 6, 3, 7]], ["CA", 2, 4, 5], ["CHR", 1, "shared", [2]], ["CA", 2, 3, 6], ["CHR", 0, "shared", [3]], ["CA", 1, 4, 6], ["FU", 6, [0, 1]], ["AN", 6, 0, 5], ["FU", 6, [1, 2]], ["AN", 6, 1, 4], ["FU", 6, [2, 3]], ["AN", 6, 2, 6], ["FU", 3, [0, 1]], ["SP", 3, 0, 8, [1], 1], ["AN", 3, 1, 2], ["FFSP", 3, 0, [1, 0], 1, 1], ["AN", 3, 1, 6], ["FU", 1, [0, 1]], ["SP", 1, 0, 16, [1], 1], ["AN", 1, 1, 2], ["FFSP", 1, 0, [1, 0], 1, 1], ["AN", 1, 1, 6], ["PR", 4, 0, "auto_unroll_max_step$64"]]]], "r": [[0.000348972, 0.000349005], 0, 3.28245, 1653155790], "v": "v0.6"}
{"i": [["[\"3458e75493bb4bb042e539b5ff4818fb\", [4, 2048], [2048, 2048], [1, 2048], [4, 2048]]", "cuda -keys=cuda,gpu -arch=sm_80 -max_num_threads=1024 -thread_warp_size=32", [-1, 16, 64, 49152, 2147483647, 1024, 8, 32], "", 0, []], [[], [["SP", 2, 0, 4, [1, 1, 4, 1], 1], ["SP", 2, 5, 2048, [8, 32, 1, 4], 1], ["SP", 2, 10, 2048, [1, 2], 1], ["RE", 2, [0, 5, 1, 6, 2, 7, 10, 11, 3, 8, 12, 4, 9]], ["FSP", 4, 0, 0, 3], ["FSP", 4, 4, 1, 3], ["RE", 4, [0, 4, 1, 5, 2, 6, 3, 7]], ["CA", 2, 4, 5], ["CHR", 1, "shared", [2]], ["CA", 2, 3, 6], ["CHR", 0, "shared", [3]], ["CA", 1, 4, 6], ["FU", 6, [0, 1]], ["AN", 6, 0, 5], ["FU", 6, [1, 2]], ["AN", 6, 1, 4], ["FU", 6, [2, 3]], ["AN", 6, 2, 6], ["FU", 3, [0, 1]], ["SP", 3, 0, 8, [1], 1], ["AN", 3, 1, 2], ["FFSP", 3, 0, [1, 0], 1, 1], ["AN", 3, 1, 6], ["FU", 1, [0, 1]], ["SP", 1, 0, 4, [1], 1], ["AN", 1, 1, 2], ["FFSP", 1, 0, [1, 0], 1, 1], ["AN", 1, 1, 6], ["PR", 4, 0, "auto_unroll_max_step$0"]]]], "r": [[0.00347275, 0.00347228], 0, 2.75097, 1653155791], "v": "v0.6"}
{"i": [["[\"3458e75493bb4bb042e539b5ff4818fb\", [4, 2048], [2048, 2048], [1, 2048], [4, 2048]]", "cuda -keys=cuda,gpu -arch=sm_80 -max_num_threads=1024 -thread_warp_size=32", [-1, 16, 64, 49152, 2147483647, 1024, 8, 32], "", 0, []], [[], [["SP", 2, 0, 4, [2, 2, 1, 1], 1], ["SP", 2, 5, 2048, [4, 16, 1, 2], 1], ["SP", 2, 10, 2048, [64, 1], 1], ["RE", 2, [0, 5, 1, 6, 2, 7, 10, 11, 3, 8, 12, 4, 9]], ["FSP", 4, 0, 0, 3], ["FSP", 4, 4, 1, 3], ["RE", 4, [0, 4, 1, 5, 2, 6, 3, 7]], ["CA", 2, 4, 5], ["CHR", 1, "shared", [2]], ["CA", 2, 3, 6], ["CHR", 0, "shared", [3]], ["CA", 1, 4, 6], ["FU", 6, [0, 1]], ["AN", 6, 0, 5], ["FU", 6, [1, 2]], ["AN", 6, 1, 4], ["FU", 6, [2, 3]], ["AN", 6, 2, 6], ["FU", 3, [0, 1]], ["SP", 3, 0, 256, [1], 1], ["AN", 3, 1, 2], ["FFSP", 3, 0, [1, 0], 1, 1], ["AN", 3, 1, 6], ["FU", 1, [0, 1]], ["SP", 1, 0, 64, [1], 1], ["AN", 1, 1, 2], ["FFSP", 1, 0, [1, 0], 1, 1], ["AN", 1, 1, 6], ["PR", 4, 0, "auto_unroll_max_step$64"]]]], "r": [[0.000958215, 0.000958253], 0, 2.77805, 1653155793], "v": "v0.6"}
{"i": [["[\"3458e75493bb4bb042e539b5ff4818fb\", [4, 2048], [2048, 2048], [1, 2048], [4, 2048]]", "cuda -keys=cuda,gpu -arch=sm_80 -max_num_threads=1024 -thread_warp_size=32", [-1, 16, 64, 49152, 2147483647, 1024, 8, 32], "", 0, []], [[], [["SP", 2, 0, 4, [1, 2, 1, 1], 1], ["SP", 2, 5, 2048, [1, 32, 1, 2], 1], ["SP", 2, 10, 2048, [4, 1], 1], ["RE", 2, [0, 5, 1, 6, 2, 7, 10, 11, 3, 8, 12, 4, 9]], ["FSP", 4, 0, 0, 3], ["FSP", 4, 4, 1, 3], ["RE", 4, [0, 4, 1, 5, 2, 6, 3, 7]], ["CA", 2, 4, 5], ["CHR", 1, "shared", [2]], ["CA", 2, 3, 6], ["CHR", 0, "shared", [3]], ["CA", 1, 4, 6], ["FU", 6, [0, 1]], ["AN", 6, 0, 5], ["FU", 6, [1, 2]], ["AN", 6, 1, 4], ["FU", 6, [2, 3]], ["AN", 6, 2, 6], ["FU", 3, [0, 1]], ["SP", 3, 0, 128, [1], 1], ["AN", 3, 1, 2], ["FFSP", 3, 0, [1, 0], 1, 1], ["AN", 3, 1, 6], ["FU", 1, [0, 1]], ["SP", 1, 0, 16, [16], 1], ["AN", 1, 1, 2], ["FFSP", 1, 0, [1, 0], 1, 1], ["AN", 1, 1, 6], ["PR", 4, 0, "auto_unroll_max_step$16"]]]], "r": [[0.000275879, 0.000275897], 0, 2.78739, 1653155795], "v": "v0.6"}
{"i": [["[\"3458e75493bb4bb042e539b5ff4818fb\", [4, 2048], [2048, 2048], [1, 2048], [4, 2048]]", "cuda -keys=cuda,gpu -arch=sm_80 -max_num_threads=1024 -thread_warp_size=32", [-1, 16, 64, 49152, 2147483647, 1024, 8, 32], "", 0, []], [[], [["SP", 2, 0, 4, [1, 1, 1, 4], 1], ["SP", 2, 5, 2048, [1, 64, 1, 8], 1], ["SP", 2, 10, 2048, [8, 1], 1], ["RE", 2, [0, 5, 1, 6, 2, 7, 10, 11, 3, 8, 12, 4, 9]], ["FSP", 4, 0, 0, 3], ["FSP", 4, 4, 1, 3], ["RE", 4, [0, 4, 1, 5, 2, 6, 3, 7]], ["CA", 2, 4, 5], ["CHR", 1, "shared", [2]], ["CA", 2, 3, 6], ["CHR", 0, "shared", [3]], ["CA", 1, 4, 6], ["FU", 6, [0, 1]], ["AN", 6, 0, 5], ["FU", 6, [1, 2]], ["AN", 6, 1, 4], ["FU", 6, [2, 3]], ["AN", 6, 2, 6], ["FU", 3, [0, 1]], ["SP", 3, 0, 32, [1], 1], ["AN", 3, 1, 2], ["FFSP", 3, 0, [1, 0], 1, 1], ["AN", 3, 1, 6], ["FU", 1, [0, 1]], ["SP", 1, 0, 32, [2], 1], ["AN", 1, 1, 2], ["FFSP", 1, 0, [1, 0], 1, 1], ["AN", 1, 1, 6], ["PR", 4, 0, "auto_unroll_max_step$16"]]]], "r": [[0.000799099, 0.000798862], 0, 3.1365, 1653155797], "v": "v0.6"}
{"i": [["[\"3458e75493bb4bb042e539b5ff4818fb\", [4, 2048], [2048, 2048], [1, 2048], [4, 2048]]", "cuda -keys=cuda,gpu -arch=sm_80 -max_num_threads=1024 -thread_warp_size=32", [-1, 16, 64, 49152, 2147483647, 1024, 8, 32], "", 0, []], [[], [["SP", 2, 0, 4, [1, 1, 2, 2], 1], ["SP", 2, 5, 2048, [4, 32, 1, 1], 1], ["SP", 2, 10, 2048, [4, 2], 1], ["RE", 2, [0, 5, 1, 6, 2, 7, 10, 11, 3, 8, 12, 4, 9]], ["FSP", 4, 0, 0, 3], ["FSP", 4, 4, 1, 3], ["RE", 4, [0, 4, 1, 5, 2, 6, 3, 7]], ["CA", 2, 4, 5], ["CHR", 1, "shared", [2]], ["CA", 2, 3, 6], ["CHR", 0, "shared", [3]], ["CA", 1, 4, 6], ["FU", 6, [0, 1]], ["AN", 6, 0, 5], ["FU", 6, [1, 2]], ["AN", 6, 1, 4], ["FU", 6, [2, 3]], ["AN", 6, 2, 6], ["FU", 3, [0, 1]], ["SP", 3, 0, 8, [1], 1], ["AN", 3, 1, 2], ["FFSP", 3, 0, [1, 0], 1, 1], ["AN", 3, 1, 6], ["FU", 1, [0, 1]], ["SP", 1, 0, 16, [16], 1], ["AN", 1, 1, 2], ["FFSP", 1, 0, [1, 0], 1, 1], ["AN", 1, 1, 6], ["PR", 4, 0, "auto_unroll_max_step$16"]]]], "r": [[0.000460102, 0.00046014], 0, 2.94289, 1653155799], "v": "v0.6"}
{"i": [["[\"3458e75493bb4bb042e539b5ff4818fb\", [4, 2048], [2048, 2048], [1, 2048], [4, 2048]]", "cuda -keys=cuda,gpu -arch=sm_80 -max_num_threads=1024 -thread_warp_size=32", [-1, 16, 64, 49152, 2147483647, 1024, 8, 32], "", 0, []], [[], [["SP", 2, 0, 4, [1, 1, 4, 1], 1], ["SP", 2, 5, 2048, [4, 32, 1, 2], 1], ["SP", 2, 10, 2048, [2, 4], 1], ["RE", 2, [0, 5, 1, 6, 2, 7, 10, 11, 3, 8, 12, 4, 9]], ["FSP", 4, 0, 0, 3], ["FSP", 4, 4, 1, 3], ["RE", 4, [0, 4, 1, 5, 2, 6, 3, 7]], ["CA", 2, 4, 5], ["CHR", 1, "shared", [2]], ["CA", 2, 3, 6], ["CHR", 0, "shared", [3]], ["CA", 1, 4, 6], ["FU", 6, [0, 1]], ["AN", 6, 0, 5], ["FU", 6, [1, 2]], ["AN", 6, 1, 4], ["FU", 6, [2, 3]], ["AN", 6, 2, 6], ["FU", 3, [0, 1]], ["SP", 3, 0, 16, [1], 1], ["AN", 3, 1, 2], ["FFSP", 3, 0, [1, 0], 1, 1], ["AN", 3, 1, 6], ["FU", 1, [0, 1]], ["SP", 1, 0, 32, [32], 1], ["AN", 1, 1, 2], ["FFSP", 1, 0, [1, 0], 1, 1], ["AN", 1, 1, 6], ["PR", 4, 0, "auto_unroll_max_step$16"]]]], "r": [[0.000707101, 0.000707278], 0, 2.96018, 1653155800], "v": "v0.6"}
{"i": [["[\"3458e75493bb4bb042e539b5ff4818fb\", [4, 2048], [2048, 2048], [1, 2048], [4, 2048]]", "cuda -keys=cuda,gpu -arch=sm_80 -max_num_threads=1024 -thread_warp_size=32", [-1, 16, 64, 49152, 2147483647, 1024, 8, 32], "", 0, []], [[], [["SP", 2, 0, 4, [1, 4, 1, 1], 1], ["SP", 2, 5, 2048, [2, 16, 4, 1], 1], ["SP", 2, 10, 2048, [8, 1], 1], ["RE", 2, [0, 5, 1, 6, 2, 7, 10, 11, 3, 8, 12, 4, 9]], ["FSP", 4, 0, 0, 3], ["FSP", 4, 4, 1, 3], ["RE", 4, [0, 4, 1, 5, 2, 6, 3, 7]], ["CA", 2, 4, 5], ["CHR", 1, "shared", [2]], ["CA", 2, 3, 6], ["CHR", 0, "shared", [3]], ["CA", 1, 4, 6], ["FU", 6, [0, 1]], ["AN", 6, 0, 5], ["FU", 6, [1, 2]], ["AN", 6, 1, 4], ["FU", 6, [2, 3]], ["AN", 6, 2, 6], ["FU", 3, [0, 1]], ["SP", 3, 0, 64, [4], 1], ["AN", 3, 1, 2], ["FFSP", 3, 0, [1, 0], 1, 1], ["AN", 3, 1, 6], ["FU", 1, [0, 1]], ["SP", 1, 0, 16, [1], 1], ["AN", 1, 1, 2], ["FFSP", 1, 0, [1, 0], 1, 1], ["AN", 1, 1, 6], ["PR", 4, 0, "auto_unroll_max_step$0"]]]], "r": [[0.000522549, 0.000521981], 0, 2.58915, 1653155802], "v": "v0.6"}
{"i": [["[\"3458e75493bb4bb042e539b5ff4818fb\", [4, 2048], [2048, 2048], [1, 2048], [4, 2048]]", "cuda -keys=cuda,gpu -arch=sm_80 -max_num_threads=1024 -thread_warp_size=32", [-1, 16, 64, 49152, 2147483647, 1024, 8, 32], "", 0, []], [[], [["SP", 2, 0, 4, [1, 1, 1, 2], 1], ["SP", 2, 5, 2048, [8, 32, 1, 4], 1], ["SP", 2, 10, 2048, [1, 2], 1], ["RE", 2, [0, 5, 1, 6, 2, 7, 10, 11, 3, 8, 12, 4, 9]], ["FSP", 4, 0, 0, 3], ["FSP", 4, 4, 1, 3], ["RE", 4, [0, 4, 1, 5, 2, 6, 3, 7]], ["CA", 2, 4, 5], ["CHR", 1, "shared", [2]], ["CA", 2, 3, 6], ["CHR", 0, "shared", [3]], ["CA", 1, 4, 6], ["FU", 6, [0, 1]], ["AN", 6, 0, 5], ["FU", 6, [1, 2]], ["AN", 6, 1, 4], ["FU", 6, [2, 3]], ["AN", 6, 2, 6], ["FU", 3, [0, 1]], ["SP", 3, 0, 8, [1], 1], ["AN", 3, 1, 2], ["FFSP", 3, 0, [1, 0], 1, 1], ["AN", 3, 1, 6], ["FU", 1, [0, 1]], ["SP", 1, 0, 4, [1], 1], ["AN", 1, 1, 2], ["FFSP", 1, 0, [1, 0], 1, 1], ["AN", 1, 1, 6], ["PR", 4, 0, "auto_unroll_max_step$0"]]]], "r": [[0.00347127, 0.00346872], 0, 1.99818, 1653155803], "v": "v0.6"}
{"i": [["[\"3458e75493bb4bb042e539b5ff4818fb\", [4, 2048], [2048, 2048], [1, 2048], [4, 2048]]", "cuda -keys=cuda,gpu -arch=sm_80 -max_num_threads=1024 -thread_warp_size=32", [-1, 16, 64, 49152, 2147483647, 1024, 8, 32], "", 0, []], [[], [["SP", 2, 0, 4, [1, 1, 2, 1], 1], ["SP", 2, 5, 2048, [1, 32, 1, 2], 1], ["SP", 2, 10, 2048, [2, 2], 1], ["RE", 2, [0, 5, 1, 6, 2, 7, 10, 11, 3, 8, 12, 4, 9]], ["FSP", 4, 0, 0, 3], ["FSP", 4, 4, 1, 3], ["RE", 4, [0, 4, 1, 5, 2, 6, 3, 7]], ["CA", 2, 4, 5], ["CHR", 1, "shared", [2]], ["CA", 2, 3, 6], ["CHR", 0, "shared", [3]], ["CA", 1, 4, 6], ["FU", 6, [0, 1]], ["AN", 6, 0, 5], ["FU", 6, [1, 2]], ["AN", 6, 1, 4], ["FU", 6, [2, 3]], ["AN", 6, 2, 6], ["FU", 3, [0, 1]], ["SP", 3, 0, 16, [4], 1], ["AN", 3, 1, 2], ["FFSP", 3, 0, [1, 0], 1, 1], ["AN", 3, 1, 6], ["FU", 1, [0, 1]], ["SP", 1, 0, 16, [1], 1], ["AN", 1, 1, 2], ["FFSP", 1, 0, [1, 0], 1, 1], ["AN", 1, 1, 6], ["PR", 4, 0, "auto_unroll_max_step$1024"]]]], "r": [[0.000193997, 0.000194009], 0, 2.25703, 1653155805], "v": "v0.6"}
{"i": [["[\"3458e75493bb4bb042e539b5ff4818fb\", [4, 2048], [2048, 2048], [1, 2048], [4, 2048]]", "cuda -keys=cuda,gpu -arch=sm_80 -max_num_threads=1024 -thread_warp_size=32", [-1, 16, 64, 49152, 2147483647, 1024, 8, 32], "", 0, []], [[], [["SP", 2, 0, 4, [2, 2, 1, 1], 1], ["SP", 2, 5, 2048, [2, 32, 1, 1], 1], ["SP", 2, 10, 2048, [8, 16], 1], ["RE", 2, [0, 5, 1, 6, 2, 7, 10, 11, 3, 8, 12, 4, 9]], ["FSP", 4, 0, 0, 3], ["FSP", 4, 4, 1, 3], ["RE", 4, [0, 4, 1, 5, 2, 6, 3, 7]], ["CA", 2, 4, 5], ["CHR", 1, "shared", [2]], ["CA", 2, 3, 6], ["CHR", 0, "shared", [3]], ["CA", 1, 4, 6], ["FU", 6, [0, 1]], ["AN", 6, 0, 5], ["FU", 6, [1, 2]], ["AN", 6, 1, 4], ["FU", 6, [2, 3]], ["AN", 6, 2, 6], ["FU", 3, [0, 1]], ["SP", 3, 0, 128, [1], 1], ["AN", 3, 1, 2], ["FFSP", 3, 0, [1, 0], 1, 1], ["AN", 3, 1, 6], ["FU", 1, [0, 1]], ["SP", 1, 0, 256, [1], 1], ["AN", 1, 1, 2], ["FFSP", 1, 0, [1, 0], 1, 1], ["AN", 1, 1, 6], ["PR", 4, 0, "auto_unroll_max_step$0"]]]], "r": [[0.000139301, 0.000139307], 0, 2.53201, 1653155807], "v": "v0.6"}
{"i": [["[\"3458e75493bb4bb042e539b5ff4818fb\", [4, 2048], [2048, 2048], [1, 2048], [4, 2048]]", "cuda -keys=cuda,gpu -arch=sm_80 -max_num_threads=1024 -thread_warp_size=32", [-1, 16, 64, 49152, 2147483647, 1024, 8, 32], "", 0, []], [[], [["SP", 2, 0, 4, [2, 2, 1, 1], 1], ["SP", 2, 5, 2048, [4, 32, 1, 8], 1], ["SP", 2, 10, 2048, [4, 1], 1], ["RE", 2, [0, 5, 1, 6, 2, 7, 10, 11, 3, 8, 12, 4, 9]], ["FSP", 4, 0, 0, 3], ["FSP", 4, 4, 1, 3], ["RE", 4, [0, 4, 1, 5, 2, 6, 3, 7]], ["CA", 2, 4, 5], ["CHR", 1, "shared", [2]], ["CA", 2, 3, 6], ["CHR", 0, "shared", [3]], ["CA", 1, 4, 6], ["FU", 6, [0, 1]], ["AN", 6, 0, 5], ["FU", 6, [1, 2]], ["AN", 6, 1, 4], ["FU", 6, [2, 3]], ["AN", 6, 2, 6], ["FU", 3, [0, 1]], ["SP", 3, 0, 32, [1], 1], ["AN", 3, 1, 2], ["FFSP", 3, 0, [1, 0], 1, 1], ["AN", 3, 1, 6], ["FU", 1, [0, 1]], ["SP", 1, 0, 4, [1], 1], ["AN", 1, 1, 2], ["FFSP", 1, 0, [1, 0], 1, 1], ["AN", 1, 1, 6], ["PR", 4, 0, "auto_unroll_max_step$64"]]]], "r": [[0.00702108, 0.00702054], 0, 1.94755, 1653155808], "v": "v0.6"}
{"i": [["[\"3458e75493bb4bb042e539b5ff4818fb\", [4, 2048], [2048, 2048], [1, 2048], [4, 2048]]", "cuda -keys=cuda,gpu -arch=sm_80 -max_num_threads=1024 -thread_warp_size=32", [-1, 16, 64, 49152, 2147483647, 1024, 8, 32], "", 0, []], [[], [["SP", 2, 0, 4, [2, 1, 1, 2], 1], ["SP", 2, 5, 2048, [1, 64, 1, 2], 1], ["SP", 2, 10, 2048, [1, 1], 1], ["RE", 2, [0, 5, 1, 6, 2, 7, 10, 11, 3, 8, 12, 4, 9]], ["FSP", 4, 0, 0, 3], ["FSP", 4, 4, 1, 3], ["RE", 4, [0, 4, 1, 5, 2, 6, 3, 7]], ["CA", 2, 4, 5], ["CHR", 1, "shared", [2]], ["CA", 2, 3, 6], ["CHR", 0, "shared", [3]], ["CA", 1, 4, 6], ["FU", 6, [0, 1]], ["AN", 6, 0, 5], ["FU", 6, [1, 2]], ["AN", 6, 1, 4], ["FU", 6, [2, 3]], ["AN", 6, 2, 6], ["FU", 3, [0, 1]], ["SP", 3, 0, 4, [2], 1], ["AN", 3, 1, 2], ["FFSP", 3, 0, [1, 0], 1, 1], ["AN", 3, 1, 6], ["FU", 1, [0, 1]], ["SP", 1, 0, 4, [1], 1], ["AN", 1, 1, 2], ["FFSP", 1, 0, [1, 0], 1, 1], ["AN", 1, 1, 6], ["PR", 4, 0, "auto_unroll_max_step$512"]]]], "r": [[0.000622348, 0.000622261], 0, 2.35954, 1653155810], "v": "v0.6"}
{"i": [["[\"3458e75493bb4bb042e539b5ff4818fb\", [4, 2048], [2048, 2048], [1, 2048], [4, 2048]]", "cuda -keys=cuda,gpu -arch=sm_80 -max_num_threads=1024 -thread_warp_size=32", [-1, 16, 64, 49152, 2147483647, 1024, 8, 32], "", 0, []], [[], [["SP", 2, 0, 4, [1, 1, 4, 1], 1], ["SP", 2, 5, 2048, [1, 256, 1, 2], 1], ["SP", 2, 10, 2048, [4, 2], 1], ["RE", 2, [0, 5, 1, 6, 2, 7, 10, 11, 3, 8, 12, 4, 9]], ["FSP", 4, 0, 0, 3], ["FSP", 4, 4, 1, 3], ["RE", 4, [0, 4, 1, 5, 2, 6, 3, 7]], ["CA", 2, 4, 5], ["CHR", 1, "shared", [2]], ["CA", 2, 3, 6], ["CHR", 0, "shared", [3]], ["CA", 1, 4, 6], ["FU", 6, [0, 1]], ["AN", 6, 0, 5], ["FU", 6, [1, 2]], ["AN", 6, 1, 4], ["FU", 6, [2, 3]], ["AN", 6, 2, 6], ["FU", 3, [0, 1]], ["SP", 3, 0, 16, [4], 1], ["AN", 3, 1, 2], ["FFSP", 3, 0, [1, 0], 1, 1], ["AN", 3, 1, 6], ["FU", 1, [0, 1]], ["SP", 1, 0, 16, [2], 1], ["AN", 1, 1, 2], ["FFSP", 1, 0, [1, 0], 1, 1], ["AN", 1, 1, 6], ["PR", 4, 0, "auto_unroll_max_step$1024"]]]], "r": [[0.000580828, 0.000581002], 0, 2.4398, 1653155812], "v": "v0.6"}
{"i": [["[\"3458e75493bb4bb042e539b5ff4818fb\", [4, 2048], [2048, 2048], [1, 2048], [4, 2048]]", "cuda -keys=cuda,gpu -arch=sm_80 -max_num_threads=1024 -thread_warp_size=32", [-1, 16, 64, 49152, 2147483647, 1024, 8, 32], "", 0, []], [[], [["SP", 2, 0, 4, [1, 1, 2, 2], 1], ["SP", 2, 5, 2048, [2, 64, 1, 8], 1], ["SP", 2, 10, 2048, [4, 1], 1], ["RE", 2, [0, 5, 1, 6, 2, 7, 10, 11, 3, 8, 12, 4, 9]], ["FSP", 4, 0, 0, 3], ["FSP", 4, 4, 1, 3], ["RE", 4, [0, 4, 1, 5, 2, 6, 3, 7]], ["CA", 2, 4, 5], ["CHR", 1, "shared", [2]], ["CA", 2, 3, 6], ["CHR", 0, "shared", [3]], ["CA", 1, 4, 6], ["FU", 6, [0, 1]], ["AN", 6, 0, 5], ["FU", 6, [1, 2]], ["AN", 6, 1, 4], ["FU", 6, [2, 3]], ["AN", 6, 2, 6], ["FU", 3, [0, 1]], ["SP", 3, 0, 32, [1], 1], ["AN", 3, 1, 2], ["FFSP", 3, 0, [1, 0], 1, 1], ["AN", 3, 1, 6], ["FU", 1, [0, 1]], ["SP", 1, 0, 16, [1], 1], ["AN", 1, 1, 2], ["FFSP", 1, 0, [1, 0], 1, 1], ["AN", 1, 1, 6], ["PR", 4, 0, "auto_unroll_max_step$512"]]]], "r": [[0.00192187, 0.00192182], 0, 2.79287, 1653155813], "v": "v0.6"}
{"i": [["[\"3458e75493bb4bb042e539b5ff4818fb\", [4, 2048], [2048, 2048], [1, 2048], [4, 2048]]", "cuda -keys=cuda,gpu -arch=sm_80 -max_num_threads=1024 -thread_warp_size=32", [-1, 16, 64, 49152, 2147483647, 1024, 8, 32], "", 0, []], [[], [["SP", 2, 0, 4, [1, 2, 1, 2], 1], ["SP", 2, 5, 2048, [1, 16, 2, 64], 1], ["SP", 2, 10, 2048, [1, 1], 1], ["RE", 2, [0, 5, 1, 6, 2, 7, 10, 11, 3, 8, 12, 4, 9]], ["FSP", 4, 0, 0, 3], ["FSP", 4, 4, 1, 3], ["RE", 4, [0, 4, 1, 5, 2, 6, 3, 7]], ["CA", 2, 4, 5], ["CHR", 1, "shared", [2]], ["CA", 2, 3, 6], ["CHR", 0, "shared", [3]], ["CA", 1, 4, 6], ["FU", 6, [0, 1]], ["AN", 6, 0, 5], ["FU", 6, [1, 2]], ["AN", 6, 1, 4], ["FU", 6, [2, 3]], ["AN", 6, 2, 6], ["FU", 3, [0, 1]], ["SP", 3, 0, 128, [1], 1], ["AN", 3, 1, 2], ["FFSP", 3, 0, [1, 0], 1, 1], ["AN", 3, 1, 6], ["FU", 1, [0, 1]], ["SP", 1, 0, 2, [1], 1], ["AN", 1, 1, 2], ["FFSP", 1, 0, [1, 0], 1, 1], ["AN", 1, 1, 6], ["PR", 4, 0, "auto_unroll_max_step$512"]]]], "r": [[0.0174723, 0.0174758], 0, 2.93297, 1653155815], "v": "v0.6"}
{"i": [["[\"3458e75493bb4bb042e539b5ff4818fb\", [4, 2048], [2048, 2048], [1, 2048], [4, 2048]]", "cuda -keys=cuda,gpu -arch=sm_80 -max_num_threads=1024 -thread_warp_size=32", [-1, 16, 64, 49152, 2147483647, 1024, 8, 32], "", 0, []], [[], [["SP", 2, 0, 4, [1, 1, 1, 4], 1], ["SP", 2, 5, 2048, [1, 8, 1, 32], 1], ["SP", 2, 10, 2048, [2, 4], 1], ["RE", 2, [0, 5, 1, 6, 2, 7, 10, 11, 3, 8, 12, 4, 9]], ["FSP", 4, 0, 0, 3], ["FSP", 4, 4, 1, 3], ["RE", 4, [0, 4, 1, 5, 2, 6, 3, 7]], ["CA", 2, 4, 5], ["CHR", 1, "shared", [2]], ["CA", 2, 3, 6], ["CHR", 0, "shared", [3]], ["CA", 1, 4, 6], ["FU", 6, [0, 1]], ["AN", 6, 0, 5], ["FU", 6, [1, 2]], ["AN", 6, 1, 4], ["FU", 6, [2, 3]], ["AN", 6, 2, 6], ["FU", 3, [0, 1]], ["SP", 3, 0, 16, [1], 1], ["AN", 3, 1, 2], ["FFSP", 3, 0, [1, 0], 1, 1], ["AN", 3, 1, 6], ["FU", 1, [0, 1]], ["SP", 1, 0, 32, [1], 1], ["AN", 1, 1, 2], ["FFSP", 1, 0, [1, 0], 1, 1], ["AN", 1, 1, 6], ["PR", 4, 0, "auto_unroll_max_step$16"]]]], "r": [[0.00232772, 0.00232796], 0, 1.95099, 1653155816], "v": "v0.6"}
{"i": [["[\"3458e75493bb4bb042e539b5ff4818fb\", [4, 2048], [2048, 2048], [1, 2048], [4, 2048]]", "cuda -keys=cuda,gpu -arch=sm_80 -max_num_threads=1024 -thread_warp_size=32", [-1, 16, 64, 49152, 2147483647, 1024, 8, 32], "", 0, []], [[], [["SP", 2, 0, 4, [2, 1, 1, 2], 1], ["SP", 2, 5, 2048, [4, 32, 1, 1], 1], ["SP", 2, 10, 2048, [4, 2], 1], ["RE", 2, [0, 5, 1, 6, 2, 7, 10, 11, 3, 8, 12, 4, 9]], ["FSP", 4, 0, 0, 3], ["FSP", 4, 4, 1, 3], ["RE", 4, [0, 4, 1, 5, 2, 6, 3, 7]], ["CA", 2, 4, 5], ["CHR", 1, "shared", [2]], ["CA", 2, 3, 6], ["CHR", 0, "shared", [3]], ["CA", 1, 4, 6], ["FU", 6, [0, 1]], ["AN", 6, 0, 5], ["FU", 6, [1, 2]], ["AN", 6, 1, 4], ["FU", 6, [2, 3]], ["AN", 6, 2, 6], ["FU", 3, [0, 1]], ["SP", 3, 0, 8, [2], 1], ["AN", 3, 1, 2], ["FFSP", 3, 0, [1, 0], 1, 1], ["AN", 3, 1, 6], ["FU", 1, [0, 1]], ["SP", 1, 0, 16, [2], 1], ["AN", 1, 1, 2], ["FFSP", 1, 0, [1, 0], 1, 1], ["AN", 1, 1, 6], ["PR", 4, 0, "auto_unroll_max_step$64"]]]], "r": [[0.000312317, 0.000312371], 0, 2.32884, 1653155817], "v": "v0.6"}
{"i": [["[\"3458e75493bb4bb042e539b5ff4818fb\", [4, 2048], [2048, 2048], [1, 2048], [4, 2048]]", "cuda -keys=cuda,gpu -arch=sm_80 -max_num_threads=1024 -thread_warp_size=32", [-1, 16, 64, 49152, 2147483647, 1024, 8, 32], "", 0, []], [[], [["SP", 2, 0, 4, [2, 1, 1, 2], 1], ["SP", 2, 5, 2048, [2, 64, 2, 1], 1], ["SP", 2, 10, 2048, [1, 32], 1], ["RE", 2, [0, 5, 1, 6, 2, 7, 10, 11, 3, 8, 12, 4, 9]], ["FSP", 4, 0, 0, 3], ["FSP", 4, 4, 1, 3], ["RE", 4, [0, 4, 1, 5, 2, 6, 3, 7]], ["CA", 2, 4, 5], ["CHR", 1, "shared", [2]], ["CA", 2, 3, 6], ["CHR", 0, "shared", [3]], ["CA", 1, 4, 6], ["FU", 6, [0, 1]], ["AN", 6, 0, 5], ["FU", 6, [1, 2]], ["AN", 6, 1, 4], ["FU", 6, [2, 3]], ["AN", 6, 2, 6], ["FU", 3, [0, 1]], ["SP", 3, 0, 16, [1], 1], ["AN", 3, 1, 2], ["FFSP", 3, 0, [1, 0], 1, 1], ["AN", 3, 1, 6], ["FU", 1, [0, 1]], ["SP", 1, 0, 16, [1], 1], ["AN", 1, 1, 2], ["FFSP", 1, 0, [1, 0], 1, 1], ["AN", 1, 1, 6], ["PR", 4, 0, "auto_unroll_max_step$1024"]]]], "r": [[0.000306778, 0.000306793], 0, 3.15778, 1653155819], "v": "v0.6"}
{"i": [["[\"3458e75493bb4bb042e539b5ff4818fb\", [4, 2048], [2048, 2048], [1, 2048], [4, 2048]]", "cuda -keys=cuda,gpu -arch=sm_80 -max_num_threads=1024 -thread_warp_size=32", [-1, 16, 64, 49152, 2147483647, 1024, 8, 32], "", 0, []], [[], [["SP", 2, 0, 4, [1, 2, 1, 1], 1], ["SP", 2, 5, 2048, [1, 32, 4, 1], 1], ["SP", 2, 10, 2048, [1, 1], 1], ["RE", 2, [0, 5, 1, 6, 2, 7, 10, 11, 3, 8, 12, 4, 9]], ["FSP", 4, 0, 0, 3], ["FSP", 4, 4, 1, 3], ["RE", 4, [0, 4, 1, 5, 2, 6, 3, 7]], ["CA", 2, 4, 5], ["CHR", 1, "shared", [2]], ["CA", 2, 3, 6], ["CHR", 0, "shared", [3]], ["CA", 1, 4, 6], ["FU", 6, [0, 1]], ["AN", 6, 0, 5], ["FU", 6, [1, 2]], ["AN", 6, 1, 4], ["FU", 6, [2, 3]], ["AN", 6, 2, 6], ["FU", 3, [0, 1]], ["SP", 3, 0, 8, [1], 1], ["AN", 3, 1, 2], ["FFSP", 3, 0, [1, 0], 1, 1], ["AN", 3, 1, 6], ["FU", 1, [0, 1]], ["SP", 1, 0, 2, [2], 1], ["AN", 1, 1, 2], ["FFSP", 1, 0, [1, 0], 1, 1], ["AN", 1, 1, 6], ["PR", 4, 0, "auto_unroll_max_step$1024"]]]], "r": [[0.000707653, 0.00070783], 0, 2.34873, 1653155821], "v": "v0.6"}
{"i": [["[\"3458e75493bb4bb042e539b5ff4818fb\", [4, 2048], [2048, 2048], [1, 2048], [4, 2048]]", "cuda -keys=cuda,gpu -arch=sm_80 -max_num_threads=1024 -thread_warp_size=32", [-1, 16, 64, 49152, 2147483647, 1024, 8, 32], "", 0, []], [[], [["SP", 2, 0, 4, [2, 1, 1, 2], 1], ["SP", 2, 5, 2048, [1, 128, 4, 2], 1], ["SP", 2, 10, 2048, [1, 1], 1], ["RE", 2, [0, 5, 1, 6, 2, 7, 10, 11, 3, 8, 12, 4, 9]], ["FSP", 4, 0, 0, 3], ["FSP", 4, 4, 1, 3], ["RE", 4, [0, 4, 1, 5, 2, 6, 3, 7]], ["CA", 2, 4, 5], ["CHR", 1, "shared", [2]], ["CA", 2, 3, 6], ["CHR", 0, "shared", [3]], ["CA", 1, 4, 6], ["FU", 6, [0, 1]], ["AN", 6, 0, 5], ["FU", 6, [1, 2]], ["AN", 6, 1, 4], ["FU", 6, [2, 3]], ["AN", 6, 2, 6], ["FU", 3, [0, 1]], ["SP", 3, 0, 16, [1], 1], ["AN", 3, 1, 2], ["FFSP", 3, 0, [1, 0], 1, 1], ["AN", 3, 1, 6], ["FU", 1, [0, 1]], ["SP", 1, 0, 4, [1], 1], ["AN", 1, 1, 2], ["FFSP", 1, 0, [1, 0], 1, 1], ["AN", 1, 1, 6], ["PR", 4, 0, "auto_unroll_max_step$1024"]]]], "r": [[0.00397266, 0.00397299], 0, 1.59213, 1653155822], "v": "v0.6"}
{"i": [["[\"3458e75493bb4bb042e539b5ff4818fb\", [4, 2048], [2048, 2048], [1, 2048], [4, 2048]]", "cuda -keys=cuda,gpu -arch=sm_80 -max_num_threads=1024 -thread_warp_size=32", [-1, 16, 64, 49152, 2147483647, 1024, 8, 32], "", 0, []], [[], [["SP", 2, 0, 4, [1, 1, 2, 1], 1], ["SP", 2, 5, 2048, [2, 32, 1, 4], 1], ["SP", 2, 10, 2048, [8, 2], 1], ["RE", 2, [0, 5, 1, 6, 2, 7, 10, 11, 3, 8, 12, 4, 9]], ["FSP", 4, 0, 0, 3], ["FSP", 4, 4, 1, 3], ["RE", 4, [0, 4, 1, 5, 2, 6, 3, 7]], ["CA", 2, 4, 5], ["CHR", 1, "shared", [2]], ["CA", 2, 3, 6], ["CHR", 0, "shared", [3]], ["CA", 1, 4, 6], ["FU", 6, [0, 1]], ["AN", 6, 0, 5], ["FU", 6, [1, 2]], ["AN", 6, 1, 4], ["FU", 6, [2, 3]], ["AN", 6, 2, 6], ["FU", 3, [0, 1]], ["SP", 3, 0, 64, [1], 1], ["AN", 3, 1, 2], ["FFSP", 3, 0, [1, 0], 1, 1], ["AN", 3, 1, 6], ["FU", 1, [0, 1]], ["SP", 1, 0, 32, [1], 1], ["AN", 1, 1, 2], ["FFSP", 1, 0, [1, 0], 1, 1], ["AN", 1, 1, 6], ["PR", 4, 0, "auto_unroll_max_step$512"]]]], "r": [[0.000588981, 0.00058876], 0, 2.86937, 1653155824], "v": "v0.6"}
