.cache/log/kernel_tune/Linear_GELU_1024_512_1024.json
{"i": [["[\"626fb653e298f4cd4434364b5f2ed39c\", [1024, 512], [1024, 512], [1, 1024], [1024, 1024]]", "cuda -keys=cuda,gpu -arch=sm_80 -max_num_threads=1024 -thread_warp_size=32", [-1, 16, 64, 49152, 2147483647, 1024, 8, 32], "", 0, []], [[], [["CI", 11], ["CI", 10], ["CI", 9], ["CI", 8], ["CI", 7], ["CI", 6], ["CI", 5], ["CI", 4], ["CHW", 2, "local"], ["SP", 2, 0, 1024, [1, 16, 1, 1], 1], ["SP", 2, 5, 1024, [8, 2, 16, 2], 1], ["SP", 2, 10, 512, [1, 8], 1], ["RE", 2, [0, 5, 1, 6, 2, 7, 10, 11, 3, 8, 12, 4, 9]], ["FSP", 3, 0, 9, 3], ["FSP", 3, 4, 10, 3], ["RE", 3, [0, 4, 1, 5, 2, 6, 3, 7]], ["CA", 2, 3, 5], ["CHR", 1, "shared", [2]], ["CA", 2, 3, 6], ["CHR", 0, "shared", [3]], ["CA", 1, 4, 6], ["FU", 15, [0, 1]], ["SP", 15, 0, 1048576, [1], 1], ["AN", 15, 0, 5], ["AN", 15, 1, 6], ["FU", 5, [0, 1]], ["AN", 5, 0, 5], ["FU", 5, [1, 2]], ["AN", 5, 1, 4], ["FU", 5, [2, 3]], ["AN", 5, 2, 6], ["FU", 3, [0, 1]], ["SP", 3, 0, 256, [1], 1], ["AN", 3, 1, 2], ["FFSP", 3, 0, [10, 9], 1, 1], ["AN", 3, 1, 6], ["FU", 1, [0, 1]], ["SP", 1, 0, 8, [4], 1], ["AN", 1, 1, 2], ["FFSP", 1, 0, [10, 9], 1, 1], ["AN", 1, 1, 6], ["PR", 4, 0, "auto_unroll_max_step$16"]]]], "r": [[0.00266305, 0.00266544], 0, 3.00866, 1653080694], "v": "v0.6"}
{"i": [["[\"626fb653e298f4cd4434364b5f2ed39c\", [1024, 512], [1024, 512], [1, 1024], [1024, 1024]]", "cuda -keys=cuda,gpu -arch=sm_80 -max_num_threads=1024 -thread_warp_size=32", [-1, 16, 64, 49152, 2147483647, 1024, 8, 32], "", 0, []], [[], [["CI", 11], ["CI", 10], ["CI", 9], ["CI", 8], ["CI", 7], ["CI", 6], ["CI", 5], ["CI", 4], ["CHW", 2, "local"], ["SP", 2, 0, 1024, [1, 8, 4, 16], 1], ["SP", 2, 5, 1024, [2, 8, 1, 8], 1], ["SP", 2, 10, 512, [2, 1], 1], ["RE", 2, [0, 5, 1, 6, 2, 7, 10, 11, 3, 8, 12, 4, 9]], ["FSP", 3, 0, 9, 3], ["FSP", 3, 4, 10, 3], ["RE", 3, [0, 4, 1, 5, 2, 6, 3, 7]], ["CA", 2, 3, 5], ["CHR", 1, "shared", [2]], ["CA", 2, 3, 6], ["CHR", 0, "shared", [3]], ["CA", 1, 4, 6], ["FU", 15, [0, 1]], ["SP", 15, 0, 1048576, [32], 1], ["AN", 15, 0, 5], ["AN", 15, 1, 6], ["FU", 5, [0, 1]], ["AN", 5, 0, 5], ["FU", 5, [1, 2]], ["AN", 5, 1, 4], ["FU", 5, [2, 3]], ["AN", 5, 2, 6], ["FU", 3, [0, 1]], ["SP", 3, 0, 16, [1], 1], ["AN", 3, 1, 2], ["FFSP", 3, 0, [10, 9], 1, 1], ["AN", 3, 1, 6], ["FU", 1, [0, 1]], ["SP", 1, 0, 128, [1], 1], ["AN", 1, 1, 2], ["FFSP", 1, 0, [10, 9], 1, 1], ["AN", 1, 1, 6], ["PR", 4, 0, "auto_unroll_max_step$16"]]]], "r": [[0.0167478, 0.0167411], 0, 4.43374, 1653080695], "v": "v0.6"}
{"i": [["[\"626fb653e298f4cd4434364b5f2ed39c\", [1024, 512], [1024, 512], [1, 1024], [1024, 1024]]", "cuda -keys=cuda,gpu -arch=sm_80 -max_num_threads=1024 -thread_warp_size=32", [-1, 16, 64, 49152, 2147483647, 1024, 8, 32], "", 0, []], [[], [["CI", 11], ["CI", 10], ["CI", 9], ["CI", 8], ["CI", 7], ["CI", 6], ["CI", 5], ["CI", 4], ["CHW", 2, "local"], ["SP", 2, 0, 1024, [1, 1, 4, 32], 1], ["SP", 2, 5, 1024, [1, 128, 1, 8], 1], ["SP", 2, 10, 512, [1, 8], 1], ["RE", 2, [0, 5, 1, 6, 2, 7, 10, 11, 3, 8, 12, 4, 9]], ["FSP", 3, 0, 9, 3], ["FSP", 3, 4, 10, 3], ["RE", 3, [0, 4, 1, 5, 2, 6, 3, 7]], ["CA", 2, 3, 5], ["CHR", 1, "shared", [2]], ["CA", 2, 3, 6], ["CHR", 0, "shared", [3]], ["CA", 1, 4, 6], ["FU", 15, [0, 1]], ["SP", 15, 0, 1048576, [64], 1], ["AN", 15, 0, 5], ["AN", 15, 1, 6], ["FU", 5, [0, 1]], ["AN", 5, 0, 5], ["FU", 5, [1, 2]], ["AN", 5, 1, 4], ["FU", 5, [2, 3]], ["AN", 5, 2, 6], ["FU", 3, [0, 1]], ["SP", 3, 0, 64, [1], 1], ["AN", 3, 1, 2], ["FFSP", 3, 0, [10, 9], 1, 1], ["AN", 3, 1, 6], ["FU", 1, [0, 1]], ["SP", 1, 0, 1024, [1], 1], ["AN", 1, 1, 2], ["FFSP", 1, 0, [10, 9], 1, 1], ["AN", 1, 1, 6], ["PR", 4, 0, "auto_unroll_max_step$512"]]]], "r": [[0.00543681, 0.00543316], 0, 8.0419, 1653080696], "v": "v0.6"}
{"i": [["[\"626fb653e298f4cd4434364b5f2ed39c\", [1024, 512], [1024, 512], [1, 1024], [1024, 1024]]", "cuda -keys=cuda,gpu -arch=sm_80 -max_num_threads=1024 -thread_warp_size=32", [-1, 16, 64, 49152, 2147483647, 1024, 8, 32], "", 0, []], [[], [["CI", 11], ["CI", 10], ["CI", 9], ["CI", 8], ["CI", 7], ["CI", 6], ["CI", 5], ["CI", 4], ["CHW", 2, "local"], ["SP", 2, 0, 1024, [4, 8, 8, 2], 1], ["SP", 2, 5, 1024, [2, 1, 4, 16], 1], ["SP", 2, 10, 512, [1, 16], 1], ["RE", 2, [0, 5, 1, 6, 2, 7, 10, 11, 3, 8, 12, 4, 9]], ["FSP", 3, 0, 9, 3], ["FSP", 3, 4, 10, 3], ["RE", 3, [0, 4, 1, 5, 2, 6, 3, 7]], ["CA", 2, 3, 5], ["CHR", 1, "shared", [2]], ["CA", 2, 3, 6], ["CHR", 0, "shared", [3]], ["CA", 1, 4, 6], ["FU", 15, [0, 1]], ["SP", 15, 0, 1048576, [32], 1], ["AN", 15, 0, 5], ["AN", 15, 1, 6], ["FU", 5, [0, 1]], ["AN", 5, 0, 5], ["FU", 5, [1, 2]], ["AN", 5, 1, 4], ["FU", 5, [2, 3]], ["AN", 5, 2, 6], ["FU", 3, [0, 1]], ["SP", 3, 0, 128, [1], 1], ["AN", 3, 1, 2], ["FFSP", 3, 0, [10, 9], 1, 1], ["AN", 3, 1, 6], ["FU", 1, [0, 1]], ["SP", 1, 0, 1024, [1], 1], ["AN", 1, 1, 2], ["FFSP", 1, 0, [10, 9], 1, 1], ["AN", 1, 1, 6], ["PR", 4, 0, "auto_unroll_max_step$0"]]]], "r": [[0.0362868, 0.0363259], 0, 5.82455, 1653080698], "v": "v0.6"}
{"i": [["[\"626fb653e298f4cd4434364b5f2ed39c\", [1024, 512], [1024, 512], [1, 1024], [1024, 1024]]", "cuda -keys=cuda,gpu -arch=sm_80 -max_num_threads=1024 -thread_warp_size=32", [-1, 16, 64, 49152, 2147483647, 1024, 8, 32], "", 0, []], [[], [["CI", 11], ["CI", 10], ["CI", 9], ["CI", 8], ["CI", 7], ["CI", 6], ["CI", 5], ["CI", 4], ["CHW", 2, "local"], ["SP", 2, 0, 1024, [1, 8, 1, 2], 1], ["SP", 2, 5, 1024, [2, 1, 16, 32], 1], ["SP", 2, 10, 512, [1, 8], 1], ["RE", 2, [0, 5, 1, 6, 2, 7, 10, 11, 3, 8, 12, 4, 9]], ["FSP", 3, 0, 9, 3], ["FSP", 3, 4, 10, 3], ["RE", 3, [0, 4, 1, 5, 2, 6, 3, 7]], ["CA", 2, 3, 5], ["CHR", 1, "shared", [2]], ["CA", 2, 3, 6], ["CHR", 0, "shared", [3]], ["CA", 1, 4, 6], ["FU", 15, [0, 1]], ["SP", 15, 0, 1048576, [32], 1], ["AN", 15, 0, 5], ["AN", 15, 1, 6], ["FU", 5, [0, 1]], ["AN", 5, 0, 5], ["FU", 5, [1, 2]], ["AN", 5, 1, 4], ["FU", 5, [2, 3]], ["AN", 5, 2, 6], ["FU", 3, [0, 1]], ["SP", 3, 0, 1024, [1], 1], ["AN", 3, 1, 2], ["FFSP", 3, 0, [10, 9], 1, 1], ["AN", 3, 1, 6], ["FU", 1, [0, 1]], ["SP", 1, 0, 32, [1], 1], ["AN", 1, 1, 2], ["FFSP", 1, 0, [10, 9], 1, 1], ["AN", 1, 1, 6], ["PR", 4, 0, "auto_unroll_max_step$64"]]]], "r": [[0.00535726, 0.00532365], 0, 4.11436, 1653080699], "v": "v0.6"}
{"i": [["[\"626fb653e298f4cd4434364b5f2ed39c\", [1024, 512], [1024, 512], [1, 1024], [1024, 1024]]", "cuda -keys=cuda,gpu -arch=sm_80 -max_num_threads=1024 -thread_warp_size=32", [-1, 16, 64, 49152, 2147483647, 1024, 8, 32], "", 0, []], [[], [["CI", 11], ["CI", 10], ["CI", 9], ["CI", 8], ["CI", 7], ["CI", 6], ["CI", 5], ["CI", 4], ["CHW", 2, "local"], ["SP", 2, 0, 1024, [2, 2, 2, 8], 1], ["SP", 2, 5, 1024, [2, 16, 1, 16], 1], ["SP", 2, 10, 512, [8, 1], 1], ["RE", 2, [0, 5, 1, 6, 2, 7, 10, 11, 3, 8, 12, 4, 9]], ["FSP", 3, 0, 9, 3], ["FSP", 3, 4, 10, 3], ["RE", 3, [0, 4, 1, 5, 2, 6, 3, 7]], ["CA", 2, 3, 5], ["CHR", 1, "shared", [2]], ["CA", 2, 3, 6], ["CHR", 0, "shared", [3]], ["CA", 1, 4, 6], ["FU", 15, [0, 1]], ["SP", 15, 0, 1048576, [32], 1], ["AN", 15, 0, 5], ["AN", 15, 1, 6], ["FU", 5, [0, 1]], ["AN", 5, 0, 5], ["FU", 5, [1, 2]], ["AN", 5, 1, 4], ["FU", 5, [2, 3]], ["AN", 5, 2, 6], ["FU", 3, [0, 1]], ["SP", 3, 0, 128, [1], 1], ["AN", 3, 1, 2], ["FFSP", 3, 0, [10, 9], 1, 1], ["AN", 3, 1, 6], ["FU", 1, [0, 1]], ["SP", 1, 0, 128, [1], 1], ["AN", 1, 1, 2], ["FFSP", 1, 0, [10, 9], 1, 1], ["AN", 1, 1, 6], ["PR", 4, 0, "auto_unroll_max_step$0"]]]], "r": [[0.00795652, 0.00795679], 0, 4.69765, 1653080700], "v": "v0.6"}
{"i": [["[\"626fb653e298f4cd4434364b5f2ed39c\", [1024, 512], [1024, 512], [1, 1024], [1024, 1024]]", "cuda -keys=cuda,gpu -arch=sm_80 -max_num_threads=1024 -thread_warp_size=32", [-1, 16, 64, 49152, 2147483647, 1024, 8, 32], "", 0, []], [[], [["CI", 11], ["CI", 10], ["CI", 9], ["CI", 8], ["CI", 7], ["CI", 6], ["CI", 5], ["CI", 4], ["CHW", 2, "local"], ["SP", 2, 0, 1024, [1, 8, 1, 64], 1], ["SP", 2, 5, 1024, [1, 4, 1, 2], 1], ["SP", 2, 10, 512, [2, 4], 1], ["RE", 2, [0, 5, 1, 6, 2, 7, 10, 11, 3, 8, 12, 4, 9]], ["FSP", 3, 0, 9, 3], ["FSP", 3, 4, 10, 3], ["RE", 3, [0, 4, 1, 5, 2, 6, 3, 7]], ["CA", 2, 3, 5], ["CHR", 1, "shared", [2]], ["CA", 2, 3, 6], ["CHR", 0, "shared", [3]], ["CA", 1, 4, 6], ["FU", 15, [0, 1]], ["SP", 15, 0, 1048576, [32], 1], ["AN", 15, 0, 5], ["AN", 15, 1, 6], ["FU", 5, [0, 1]], ["AN", 5, 0, 5], ["FU", 5, [1, 2]], ["AN", 5, 1, 4], ["FU", 5, [2, 3]], ["AN", 5, 2, 6], ["FU", 3, [0, 1]], ["SP", 3, 0, 32, [1], 1], ["AN", 3, 1, 2], ["FFSP", 3, 0, [10, 9], 1, 1], ["AN", 3, 1, 6], ["FU", 1, [0, 1]], ["SP", 1, 0, 64, [1], 1], ["AN", 1, 1, 2], ["FFSP", 1, 0, [10, 9], 1, 1], ["AN", 1, 1, 6], ["PR", 4, 0, "auto_unroll_max_step$1024"]]]], "r": [[0.000732369, 0.000732131], 0, 7.19135, 1653080701], "v": "v0.6"}
{"i": [["[\"626fb653e298f4cd4434364b5f2ed39c\", [1024, 512], [1024, 512], [1, 1024], [1024, 1024]]", "cuda -keys=cuda,gpu -arch=sm_80 -max_num_threads=1024 -thread_warp_size=32", [-1, 16, 64, 49152, 2147483647, 1024, 8, 32], "", 0, []], [[], [["CI", 11], ["CI", 10], ["CI", 9], ["CI", 8], ["CI", 7], ["CI", 6], ["CI", 5], ["CI", 4], ["CHW", 2, "local"], ["SP", 2, 0, 1024, [1, 8, 1, 4], 1], ["SP", 2, 5, 1024, [1, 4, 1, 2], 1], ["SP", 2, 10, 512, [2, 2], 1], ["RE", 2, [0, 5, 1, 6, 2, 7, 10, 11, 3, 8, 12, 4, 9]], ["FSP", 3, 0, 9, 3], ["FSP", 3, 4, 10, 3], ["RE", 3, [0, 4, 1, 5, 2, 6, 3, 7]], ["CA", 2, 3, 5], ["CHR", 1, "shared", [2]], ["CA", 2, 3, 6], ["CHR", 0, "shared", [3]], ["CA", 1, 4, 6], ["FU", 15, [0, 1]], ["SP", 15, 0, 1048576, [32], 1], ["AN", 15, 0, 5], ["AN", 15, 1, 6], ["FU", 5, [0, 1]], ["AN", 5, 0, 5], ["FU", 5, [1, 2]], ["AN", 5, 1, 4], ["FU", 5, [2, 3]], ["AN", 5, 2, 6], ["FU", 3, [0, 1]], ["SP", 3, 0, 32, [1], 1], ["AN", 3, 1, 2], ["FFSP", 3, 0, [10, 9], 1, 1], ["AN", 3, 1, 6], ["FU", 1, [0, 1]], ["SP", 1, 0, 64, [1], 1], ["AN", 1, 1, 2], ["FFSP", 1, 0, [10, 9], 1, 1], ["AN", 1, 1, 6], ["PR", 4, 0, "auto_unroll_max_step$512"]]]], "r": [[0.000610408, 0.000610449], 0, 2.9132, 1653080703], "v": "v0.6"}
{"i": [["[\"626fb653e298f4cd4434364b5f2ed39c\", [1024, 512], [1024, 512], [1, 1024], [1024, 1024]]", "cuda -keys=cuda,gpu -arch=sm_80 -max_num_threads=1024 -thread_warp_size=32", [-1, 16, 64, 49152, 2147483647, 1024, 8, 32], "", 0, []], [[], [["CI", 11], ["CI", 10], ["CI", 9], ["CI", 8], ["CI", 7], ["CI", 6], ["CI", 5], ["CI", 4], ["CHW", 2, "local"], ["SP", 2, 0, 1024, [1, 32, 16, 2], 1], ["SP", 2, 5, 1024, [2, 2, 16, 2], 1], ["SP", 2, 10, 512, [2, 1], 1], ["RE", 2, [0, 5, 1, 6, 2, 7, 10, 11, 3, 8, 12, 4, 9]], ["FSP", 3, 0, 9, 3], ["FSP", 3, 4, 10, 3], ["RE", 3, [0, 4, 1, 5, 2, 6, 3, 7]], ["CA", 2, 3, 5], ["CHR", 1, "shared", [2]], ["CA", 2, 3, 6], ["CHR", 0, "shared", [3]], ["CA", 1, 4, 6], ["FU", 15, [0, 1]], ["SP", 15, 0, 1048576, [32], 1], ["AN", 15, 0, 5], ["AN", 15, 1, 6], ["FU", 5, [0, 1]], ["AN", 5, 0, 5], ["FU", 5, [1, 2]], ["AN", 5, 1, 4], ["FU", 5, [2, 3]], ["AN", 5, 2, 6], ["FU", 3, [0, 1]], ["SP", 3, 0, 64, [16], 1], ["AN", 3, 1, 2], ["FFSP", 3, 0, [10, 9], 1, 1], ["AN", 3, 1, 6], ["FU", 1, [0, 1]], ["SP", 1, 0, 64, [1], 1], ["AN", 1, 1, 2], ["FFSP", 1, 0, [10, 9], 1, 1], ["AN", 1, 1, 6], ["PR", 4, 0, "auto_unroll_max_step$1024"]]]], "r": [[0.0264393, 0.0261213], 0, 5.49956, 1653080704], "v": "v0.6"}
{"i": [["[\"626fb653e298f4cd4434364b5f2ed39c\", [1024, 512], [1024, 512], [1, 1024], [1024, 1024]]", "cuda -keys=cuda,gpu -arch=sm_80 -max_num_threads=1024 -thread_warp_size=32", [-1, 16, 64, 49152, 2147483647, 1024, 8, 32], "", 0, []], [[], [["CI", 11], ["CI", 10], ["CI", 9], ["CI", 8], ["CI", 7], ["CI", 6], ["CI", 5], ["CI", 4], ["CHW", 2, "local"], ["SP", 2, 0, 1024, [4, 4, 8, 4], 1], ["SP", 2, 5, 1024, [2, 128, 1, 1], 1], ["SP", 2, 10, 512, [2, 2], 1], ["RE", 2, [0, 5, 1, 6, 2, 7, 10, 11, 3, 8, 12, 4, 9]], ["FSP", 3, 0, 9, 3], ["FSP", 3, 4, 10, 3], ["RE", 3, [0, 4, 1, 5, 2, 6, 3, 7]], ["CA", 2, 3, 5], ["CHR", 1, "shared", [2]], ["CA", 2, 3, 6], ["CHR", 0, "shared", [3]], ["CA", 1, 4, 6], ["FU", 15, [0, 1]], ["SP", 15, 0, 1048576, [32], 1], ["AN", 15, 0, 5], ["AN", 15, 1, 6], ["FU", 5, [0, 1]], ["AN", 5, 0, 5], ["FU", 5, [1, 2]], ["AN", 5, 1, 4], ["FU", 5, [2, 3]], ["AN", 5, 2, 6], ["FU", 3, [0, 1]], ["SP", 3, 0, 4, [1], 1], ["AN", 3, 1, 2], ["FFSP", 3, 0, [10, 9], 1, 1], ["AN", 3, 1, 6], ["FU", 1, [0, 1]], ["SP", 1, 0, 128, [1], 1], ["AN", 1, 1, 2], ["FFSP", 1, 0, [10, 9], 1, 1], ["AN", 1, 1, 6], ["PR", 4, 0, "auto_unroll_max_step$64"]]]], "r": [[0.00757141, 0.0075715], 0, 3.64253, 1653080706], "v": "v0.6"}
{"i": [["[\"626fb653e298f4cd4434364b5f2ed39c\", [1024, 512], [1024, 512], [1, 1024], [1024, 1024]]", "cuda -keys=cuda,gpu -arch=sm_80 -max_num_threads=1024 -thread_warp_size=32", [-1, 16, 64, 49152, 2147483647, 1024, 8, 32], "", 0, []], [[], [["CI", 11], ["CI", 10], ["CI", 9], ["CI", 8], ["CI", 7], ["CI", 6], ["CI", 5], ["CI", 4], ["CHW", 2, "local"], ["SP", 2, 0, 1024, [1, 32, 2, 1], 1], ["SP", 2, 5, 1024, [4, 1, 128, 1], 1], ["SP", 2, 10, 512, [1, 1], 1], ["RE", 2, [0, 5, 1, 6, 2, 7, 10, 11, 3, 8, 12, 4, 9]], ["FSP", 3, 0, 9, 3], ["FSP", 3, 4, 10, 3], ["RE", 3, [0, 4, 1, 5, 2, 6, 3, 7]], ["CA", 2, 3, 5], ["CHR", 1, "shared", [2]], ["CA", 2, 3, 6], ["CHR", 0, "shared", [3]], ["CA", 1, 4, 6], ["FU", 15, [0, 1]], ["SP", 15, 0, 1048576, [32], 1], ["AN", 15, 0, 5], ["AN", 15, 1, 6], ["FU", 5, [0, 1]], ["AN", 5, 0, 5], ["FU", 5, [1, 2]], ["AN", 5, 1, 4], ["FU", 5, [2, 3]], ["AN", 5, 2, 6], ["FU", 3, [0, 1]], ["SP", 3, 0, 128, [1], 1], ["AN", 3, 1, 2], ["FFSP", 3, 0, [10, 9], 1, 1], ["AN", 3, 1, 6], ["FU", 1, [0, 1]], ["SP", 1, 0, 2, [1], 1], ["AN", 1, 1, 2], ["FFSP", 1, 0, [10, 9], 1, 1], ["AN", 1, 1, 6], ["PR", 4, 0, "auto_unroll_max_step$64"]]]], "r": [[0.00751325, 0.00751425], 0, 4.14371, 1653080707], "v": "v0.6"}
{"i": [["[\"626fb653e298f4cd4434364b5f2ed39c\", [1024, 512], [1024, 512], [1, 1024], [1024, 1024]]", "cuda -keys=cuda,gpu -arch=sm_80 -max_num_threads=1024 -thread_warp_size=32", [-1, 16, 64, 49152, 2147483647, 1024, 8, 32], "", 0, []], [[], [["CI", 11], ["CI", 10], ["CI", 9], ["CI", 8], ["CI", 7], ["CI", 6], ["CI", 5], ["CI", 4], ["CHW", 2, "local"], ["SP", 2, 0, 1024, [2, 1, 1, 64], 1], ["SP", 2, 5, 1024, [1, 16, 1, 32], 1], ["SP", 2, 10, 512, [1, 1], 1], ["RE", 2, [0, 5, 1, 6, 2, 7, 10, 11, 3, 8, 12, 4, 9]], ["FSP", 3, 0, 9, 3], ["FSP", 3, 4, 10, 3], ["RE", 3, [0, 4, 1, 5, 2, 6, 3, 7]], ["CA", 2, 3, 5], ["CHR", 1, "shared", [2]], ["CA", 2, 3, 6], ["CHR", 0, "shared", [3]], ["CA", 1, 4, 6], ["FU", 15, [0, 1]], ["SP", 15, 0, 1048576, [1], 1], ["AN", 15, 0, 5], ["AN", 15, 1, 6], ["FU", 5, [0, 1]], ["AN", 5, 0, 5], ["FU", 5, [1, 2]], ["AN", 5, 1, 4], ["FU", 5, [2, 3]], ["AN", 5, 2, 6], ["FU", 3, [0, 1]], ["SP", 3, 0, 16, [4], 1], ["AN", 3, 1, 2], ["FFSP", 3, 0, [10, 9], 1, 1], ["AN", 3, 1, 6], ["FU", 1, [0, 1]], ["SP", 1, 0, 64, [1], 1], ["AN", 1, 1, 2], ["FFSP", 1, 0, [10, 9], 1, 1], ["AN", 1, 1, 6], ["PR", 4, 0, "auto_unroll_max_step$512"]]]], "r": [[0.0400779, 0.0400465], 0, 3.25014, 1653080708], "v": "v0.6"}
{"i": [["[\"626fb653e298f4cd4434364b5f2ed39c\", [1024, 512], [1024, 512], [1, 1024], [1024, 1024]]", "cuda -keys=cuda,gpu -arch=sm_80 -max_num_threads=1024 -thread_warp_size=32", [-1, 16, 64, 49152, 2147483647, 1024, 8, 32], "", 0, []], [[], [["CI", 11], ["CI", 10], ["CI", 9], ["CI", 8], ["CI", 7], ["CI", 6], ["CI", 5], ["CI", 4], ["CHW", 2, "local"], ["SP", 2, 0, 1024, [2, 32, 2, 4], 1], ["SP", 2, 5, 1024, [4, 2, 2, 4], 1], ["SP", 2, 10, 512, [2, 4], 1], ["RE", 2, [0, 5, 1, 6, 2, 7, 10, 11, 3, 8, 12, 4, 9]], ["FSP", 3, 0, 9, 3], ["FSP", 3, 4, 10, 3], ["RE", 3, [0, 4, 1, 5, 2, 6, 3, 7]], ["CA", 2, 3, 5], ["CHR", 1, "shared", [2]], ["CA", 2, 3, 6], ["CHR", 0, "shared", [3]], ["CA", 1, 4, 6], ["FU", 15, [0, 1]], ["SP", 15, 0, 1048576, [32], 1], ["AN", 15, 0, 5], ["AN", 15, 1, 6], ["FU", 5, [0, 1]], ["AN", 5, 0, 5], ["FU", 5, [1, 2]], ["AN", 5, 1, 4], ["FU", 5, [2, 3]], ["AN", 5, 2, 6], ["FU", 3, [0, 1]], ["SP", 3, 0, 64, [1], 1], ["AN", 3, 1, 2], ["FFSP", 3, 0, [10, 9], 1, 1], ["AN", 3, 1, 6], ["FU", 1, [0, 1]], ["SP", 1, 0, 64, [1], 1], ["AN", 1, 1, 2], ["FFSP", 1, 0, [10, 9], 1, 1], ["AN", 1, 1, 6], ["PR", 4, 0, "auto_unroll_max_step$512"]]]], "r": [[0.00153579, 0.0015358], 0, 9.04057, 1653080710], "v": "v0.6"}
{"i": [["[\"626fb653e298f4cd4434364b5f2ed39c\", [1024, 512], [1024, 512], [1, 1024], [1024, 1024]]", "cuda -keys=cuda,gpu -arch=sm_80 -max_num_threads=1024 -thread_warp_size=32", [-1, 16, 64, 49152, 2147483647, 1024, 8, 32], "", 0, []], [[], [["CI", 11], ["CI", 10], ["CI", 9], ["CI", 8], ["CI", 7], ["CI", 6], ["CI", 5], ["CI", 4], ["CHW", 2, "local"], ["SP", 2, 0, 1024, [2, 32, 1, 4], 1], ["SP", 2, 5, 1024, [1, 2, 4, 2], 1], ["SP", 2, 10, 512, [8, 4], 1], ["RE", 2, [0, 5, 1, 6, 2, 7, 10, 11, 3, 8, 12, 4, 9]], ["FSP", 3, 0, 9, 3], ["FSP", 3, 4, 10, 3], ["RE", 3, [0, 4, 1, 5, 2, 6, 3, 7]], ["CA", 2, 3, 5], ["CHR", 1, "shared", [2]], ["CA", 2, 3, 6], ["CHR", 0, "shared", [3]], ["CA", 1, 4, 6], ["FU", 15, [0, 1]], ["SP", 15, 0, 1048576, [64], 1], ["AN", 15, 0, 5], ["AN", 15, 1, 6], ["FU", 5, [0, 1]], ["AN", 5, 0, 5], ["FU", 5, [1, 2]], ["AN", 5, 1, 4], ["FU", 5, [2, 3]], ["AN", 5, 2, 6], ["FU", 3, [0, 1]], ["SP", 3, 0, 256, [1], 1], ["AN", 3, 1, 2], ["FFSP", 3, 0, [10, 9], 1, 1], ["AN", 3, 1, 6], ["FU", 1, [0, 1]], ["SP", 1, 0, 128, [1], 1], ["AN", 1, 1, 2], ["FFSP", 1, 0, [10, 9], 1, 1], ["AN", 1, 1, 6], ["PR", 4, 0, "auto_unroll_max_step$16"]]]], "r": [[0.000369964, 0.000369929], 0, 3.46949, 1653080711], "v": "v0.6"}
{"i": [["[\"626fb653e298f4cd4434364b5f2ed39c\", [1024, 512], [1024, 512], [1, 1024], [1024, 1024]]", "cuda -keys=cuda,gpu -arch=sm_80 -max_num_threads=1024 -thread_warp_size=32", [-1, 16, 64, 49152, 2147483647, 1024, 8, 32], "", 0, []], [[], [["CI", 11], ["CI", 10], ["CI", 9], ["CI", 8], ["CI", 7], ["CI", 6], ["CI", 5], ["CI", 4], ["CHW", 2, "local"], ["SP", 2, 0, 1024, [2, 128, 2, 1], 1], ["SP", 2, 5, 1024, [1, 1, 16, 8], 1], ["SP", 2, 10, 512, [1, 1], 1], ["RE", 2, [0, 5, 1, 6, 2, 7, 10, 11, 3, 8, 12, 4, 9]], ["FSP", 3, 0, 9, 3], ["FSP", 3, 4, 10, 3], ["RE", 3, [0, 4, 1, 5, 2, 6, 3, 7]], ["CA", 2, 3, 5], ["CHR", 1, "shared", [2]], ["CA", 2, 3, 6], ["CHR", 0, "shared", [3]], ["CA", 1, 4, 6], ["FU", 15, [0, 1]], ["SP", 15, 0, 1048576, [2], 1], ["AN", 15, 0, 5], ["AN", 15, 1, 6], ["FU", 5, [0, 1]], ["AN", 5, 0, 5], ["FU", 5, [1, 2]], ["AN", 5, 1, 4], ["FU", 5, [2, 3]], ["AN", 5, 2, 6], ["FU", 3, [0, 1]], ["SP", 3, 0, 128, [1], 1], ["AN", 3, 1, 2], ["FFSP", 3, 0, [10, 9], 1, 1], ["AN", 3, 1, 6], ["FU", 1, [0, 1]], ["SP", 1, 0, 2, [1], 1], ["AN", 1, 1, 2], ["FFSP", 1, 0, [10, 9], 1, 1], ["AN", 1, 1, 6], ["PR", 4, 0, "auto_unroll_max_step$0"]]]], "r": [[0.00916108, 0.00916201], 0, 4.6168, 1653080712], "v": "v0.6"}
{"i": [["[\"626fb653e298f4cd4434364b5f2ed39c\", [1024, 512], [1024, 512], [1, 1024], [1024, 1024]]", "cuda -keys=cuda,gpu -arch=sm_80 -max_num_threads=1024 -thread_warp_size=32", [-1, 16, 64, 49152, 2147483647, 1024, 8, 32], "", 0, []], [[], [["CI", 11], ["CI", 10], ["CI", 9], ["CI", 8], ["CI", 7], ["CI", 6], ["CI", 5], ["CI", 4], ["CHW", 2, "local"], ["SP", 2, 0, 1024, [4, 4, 8, 4], 1], ["SP", 2, 5, 1024, [1, 256, 1, 2], 1], ["SP", 2, 10, 512, [1, 1], 1], ["RE", 2, [0, 5, 1, 6, 2, 7, 10, 11, 3, 8, 12, 4, 9]], ["FSP", 3, 0, 9, 3], ["FSP", 3, 4, 10, 3], ["RE", 3, [0, 4, 1, 5, 2, 6, 3, 7]], ["CA", 2, 3, 5], ["CHR", 1, "shared", [2]], ["CA", 2, 3, 6], ["CHR", 0, "shared", [3]], ["CA", 1, 4, 6], ["FU", 15, [0, 1]], ["SP", 15, 0, 1048576, [32], 1], ["AN", 15, 0, 5], ["AN", 15, 1, 6], ["FU", 5, [0, 1]], ["AN", 5, 0, 5], ["FU", 5, [1, 2]], ["AN", 5, 1, 4], ["FU", 5, [2, 3]], ["AN", 5, 2, 6], ["FU", 3, [0, 1]], ["SP", 3, 0, 2, [2], 1], ["AN", 3, 1, 2], ["FFSP", 3, 0, [10, 9], 1, 1], ["AN", 3, 1, 6], ["FU", 1, [0, 1]], ["SP", 1, 0, 32, [1], 1], ["AN", 1, 1, 2], ["FFSP", 1, 0, [10, 9], 1, 1], ["AN", 1, 1, 6], ["PR", 4, 0, "auto_unroll_max_step$16"]]]], "r": [[0.027921, 0.027921], 0, 2.7543, 1653080714], "v": "v0.6"}
{"i": [["[\"626fb653e298f4cd4434364b5f2ed39c\", [1024, 512], [1024, 512], [1, 1024], [1024, 1024]]", "cuda -keys=cuda,gpu -arch=sm_80 -max_num_threads=1024 -thread_warp_size=32", [-1, 16, 64, 49152, 2147483647, 1024, 8, 32], "", 0, []], [[], [["CI", 11], ["CI", 10], ["CI", 9], ["CI", 8], ["CI", 7], ["CI", 6], ["CI", 5], ["CI", 4], ["CHW", 2, "local"], ["SP", 2, 0, 1024, [1, 32, 16, 2], 1], ["SP", 2, 5, 1024, [2, 2, 16, 2], 1], ["SP", 2, 10, 512, [2, 1], 1], ["RE", 2, [0, 5, 1, 6, 2, 7, 10, 11, 3, 8, 12, 4, 9]], ["FSP", 3, 0, 9, 3], ["FSP", 3, 4, 10, 3], ["RE", 3, [0, 4, 1, 5, 2, 6, 3, 7]], ["CA", 2, 3, 5], ["CHR", 1, "shared", [2]], ["CA", 2, 3, 6], ["CHR", 0, "shared", [3]], ["CA", 1, 4, 6], ["FU", 15, [0, 1]], ["SP", 15, 0, 1048576, [32], 1], ["AN", 15, 0, 5], ["AN", 15, 1, 6], ["FU", 5, [0, 1]], ["AN", 5, 0, 5], ["FU", 5, [1, 2]], ["AN", 5, 1, 4], ["FU", 5, [2, 3]], ["AN", 5, 2, 6], ["FU", 3, [0, 1]], ["SP", 3, 0, 64, [32], 1], ["AN", 3, 1, 2], ["FFSP", 3, 0, [10, 9], 1, 1], ["AN", 3, 1, 6], ["FU", 1, [0, 1]], ["SP", 1, 0, 64, [2], 1], ["AN", 1, 1, 2], ["FFSP", 1, 0, [10, 9], 1, 1], ["AN", 1, 1, 6], ["PR", 4, 0, "auto_unroll_max_step$1024"]]]], "r": [[0.0267824, 0.0266924], 0, 5.77181, 1653080715], "v": "v0.6"}
{"i": [["[\"626fb653e298f4cd4434364b5f2ed39c\", [1024, 512], [1024, 512], [1, 1024], [1024, 1024]]", "cuda -keys=cuda,gpu -arch=sm_80 -max_num_threads=1024 -thread_warp_size=32", [-1, 16, 64, 49152, 2147483647, 1024, 8, 32], "", 0, []], [[], [["CI", 11], ["CI", 10], ["CI", 9], ["CI", 8], ["CI", 7], ["CI", 6], ["CI", 5], ["CI", 4], ["CHW", 2, "local"], ["SP", 2, 0, 1024, [2, 2, 8, 2], 1], ["SP", 2, 5, 1024, [1, 128, 4, 1], 1], ["SP", 2, 10, 512, [4, 1], 1], ["RE", 2, [0, 5, 1, 6, 2, 7, 10, 11, 3, 8, 12, 4, 9]], ["FSP", 3, 0, 9, 3], ["FSP", 3, 4, 10, 3], ["RE", 3, [0, 4, 1, 5, 2, 6, 3, 7]], ["CA", 2, 3, 5], ["CHR", 1, "shared", [2]], ["CA", 2, 3, 6], ["CHR", 0, "shared", [3]], ["CA", 1, 4, 6], ["FU", 15, [0, 1]], ["SP", 15, 0, 1048576, [32], 1], ["AN", 15, 0, 5], ["AN", 15, 1, 6], ["FU", 5, [0, 1]], ["AN", 5, 0, 5], ["FU", 5, [1, 2]], ["AN", 5, 1, 4], ["FU", 5, [2, 3]], ["AN", 5, 2, 6], ["FU", 3, [0, 1]], ["SP", 3, 0, 16, [1], 1], ["AN", 3, 1, 2], ["FFSP", 3, 0, [10, 9], 1, 1], ["AN", 3, 1, 6], ["FU", 1, [0, 1]], ["SP", 1, 0, 64, [1], 1], ["AN", 1, 1, 2], ["FFSP", 1, 0, [10, 9], 1, 1], ["AN", 1, 1, 6], ["PR", 4, 0, "auto_unroll_max_step$16"]]]], "r": [[0.000684842, 0.000684926], 0, 3.47983, 1653080717], "v": "v0.6"}
{"i": [["[\"626fb653e298f4cd4434364b5f2ed39c\", [1024, 512], [1024, 512], [1, 1024], [1024, 1024]]", "cuda -keys=cuda,gpu -arch=sm_80 -max_num_threads=1024 -thread_warp_size=32", [-1, 16, 64, 49152, 2147483647, 1024, 8, 32], "", 0, []], [[], [["CI", 11], ["CI", 10], ["CI", 9], ["CI", 8], ["CI", 7], ["CI", 6], ["CI", 5], ["CI", 4], ["CHW", 2, "local"], ["SP", 2, 0, 1024, [1, 32, 1, 2], 1], ["SP", 2, 5, 1024, [2, 2, 8, 1], 1], ["SP", 2, 10, 512, [2, 2], 1], ["RE", 2, [0, 5, 1, 6, 2, 7, 10, 11, 3, 8, 12, 4, 9]], ["FSP", 3, 0, 9, 3], ["FSP", 3, 4, 10, 3], ["RE", 3, [0, 4, 1, 5, 2, 6, 3, 7]], ["CA", 2, 3, 5], ["CHR", 1, "shared", [2]], ["CA", 2, 3, 6], ["CHR", 0, "shared", [3]], ["CA", 1, 4, 6], ["FU", 15, [0, 1]], ["SP", 15, 0, 1048576, [8], 1], ["AN", 15, 0, 5], ["AN", 15, 1, 6], ["FU", 5, [0, 1]], ["AN", 5, 0, 5], ["FU", 5, [1, 2]], ["AN", 5, 1, 4], ["FU", 5, [2, 3]], ["AN", 5, 2, 6], ["FU", 3, [0, 1]], ["SP", 3, 0, 32, [1], 1], ["AN", 3, 1, 2], ["FFSP", 3, 0, [10, 9], 1, 1], ["AN", 3, 1, 6], ["FU", 1, [0, 1]], ["SP", 1, 0, 8, [1], 1], ["AN", 1, 1, 2], ["FFSP", 1, 0, [10, 9], 1, 1], ["AN", 1, 1, 6], ["PR", 4, 0, "auto_unroll_max_step$0"]]]], "r": [[0.000476198, 0.000476173], 0, 2.96905, 1653080718], "v": "v0.6"}
{"i": [["[\"626fb653e298f4cd4434364b5f2ed39c\", [1024, 512], [1024, 512], [1, 1024], [1024, 1024]]", "cuda -keys=cuda,gpu -arch=sm_80 -max_num_threads=1024 -thread_warp_size=32", [-1, 16, 64, 49152, 2147483647, 1024, 8, 32], "", 0, []], [[], [["CI", 11], ["CI", 10], ["CI", 9], ["CI", 8], ["CI", 7], ["CI", 6], ["CI", 5], ["CI", 4], ["CHW", 2, "local"], ["SP", 2, 0, 1024, [2, 8, 8, 1], 1], ["SP", 2, 5, 1024, [1, 16, 8, 4], 1], ["SP", 2, 10, 512, [4, 1], 1], ["RE", 2, [0, 5, 1, 6, 2, 7, 10, 11, 3, 8, 12, 4, 9]], ["FSP", 3, 0, 9, 3], ["FSP", 3, 4, 10, 3], ["RE", 3, [0, 4, 1, 5, 2, 6, 3, 7]], ["CA", 2, 3, 5], ["CHR", 1, "shared", [2]], ["CA", 2, 3, 6], ["CHR", 0, "shared", [3]], ["CA", 1, 4, 6], ["FU", 15, [0, 1]], ["SP", 15, 0, 1048576, [32], 1], ["AN", 15, 0, 5], ["AN", 15, 1, 6], ["FU", 5, [0, 1]], ["AN", 5, 0, 5], ["FU", 5, [1, 2]], ["AN", 5, 1, 4], ["FU", 5, [2, 3]], ["AN", 5, 2, 6], ["FU", 3, [0, 1]], ["SP", 3, 0, 128, [4], 1], ["AN", 3, 1, 2], ["FFSP", 3, 0, [10, 9], 1, 1], ["AN", 3, 1, 6], ["FU", 1, [0, 1]], ["SP", 1, 0, 32, [1], 1], ["AN", 1, 1, 2], ["FFSP", 1, 0, [10, 9], 1, 1], ["AN", 1, 1, 6], ["PR", 4, 0, "auto_unroll_max_step$64"]]]], "r": [[0.00991664, 0.0099187], 0, 4.05044, 1653080720], "v": "v0.6"}
{"i": [["[\"626fb653e298f4cd4434364b5f2ed39c\", [1024, 512], [1024, 512], [1, 1024], [1024, 1024]]", "cuda -keys=cuda,gpu -arch=sm_80 -max_num_threads=1024 -thread_warp_size=32", [-1, 16, 64, 49152, 2147483647, 1024, 8, 32], "", 0, []], [[], [["CI", 11], ["CI", 10], ["CI", 9], ["CI", 8], ["CI", 7], ["CI", 6], ["CI", 5], ["CI", 4], ["CHW", 2, "local"], ["SP", 2, 0, 1024, [1, 1, 512, 1], 1], ["SP", 2, 5, 1024, [1, 64, 8, 2], 1], ["SP", 2, 10, 512, [8, 1], 1], ["RE", 2, [0, 5, 1, 6, 2, 7, 10, 11, 3, 8, 12, 4, 9]], ["FSP", 3, 0, 9, 3], ["FSP", 3, 4, 10, 3], ["RE", 3, [0, 4, 1, 5, 2, 6, 3, 7]], ["CA", 2, 3, 5], ["CHR", 1, "shared", [2]], ["CA", 2, 3, 6], ["CHR", 0, "shared", [3]], ["CA", 1, 4, 6], ["FU", 15, [0, 1]], ["SP", 15, 0, 1048576, [32], 1], ["AN", 15, 0, 5], ["AN", 15, 1, 6], ["FU", 5, [0, 1]], ["AN", 5, 0, 5], ["FU", 5, [1, 2]], ["AN", 5, 1, 4], ["FU", 5, [2, 3]], ["AN", 5, 2, 6], ["FU", 3, [0, 1]], ["SP", 3, 0, 64, [1], 1], ["AN", 3, 1, 2], ["FFSP", 3, 0, [10, 9], 1, 1], ["AN", 3, 1, 6], ["FU", 1, [0, 1]], ["SP", 1, 0, 4096, [1], 1], ["AN", 1, 1, 2], ["FFSP", 1, 0, [10, 9], 1, 1], ["AN", 1, 1, 6], ["PR", 4, 0, "auto_unroll_max_step$0"]]]], "r": [[0.107546, 0.107613], 0, 2.96627, 1653080721], "v": "v0.6"}
{"i": [["[\"626fb653e298f4cd4434364b5f2ed39c\", [1024, 512], [1024, 512], [1, 1024], [1024, 1024]]", "cuda -keys=cuda,gpu -arch=sm_80 -max_num_threads=1024 -thread_warp_size=32", [-1, 16, 64, 49152, 2147483647, 1024, 8, 32], "", 0, []], [[], [["CI", 11], ["CI", 10], ["CI", 9], ["CI", 8], ["CI", 7], ["CI", 6], ["CI", 5], ["CI", 4], ["CHW", 2, "local"], ["SP", 2, 0, 1024, [1, 16, 2, 1], 1], ["SP", 2, 5, 1024, [2, 4, 16, 8], 1], ["SP", 2, 10, 512, [1, 8], 1], ["RE", 2, [0, 5, 1, 6, 2, 7, 10, 11, 3, 8, 12, 4, 9]], ["FSP", 3, 0, 9, 3], ["FSP", 3, 4, 10, 3], ["RE", 3, [0, 4, 1, 5, 2, 6, 3, 7]], ["CA", 2, 3, 5], ["CHR", 1, "shared", [2]], ["CA", 2, 3, 6], ["CHR", 0, "shared", [3]], ["CA", 1, 4, 6], ["FU", 15, [0, 1]], ["SP", 15, 0, 1048576, [32], 1], ["AN", 15, 0, 5], ["AN", 15, 1, 6], ["FU", 5, [0, 1]], ["AN", 5, 0, 5], ["FU", 5, [1, 2]], ["AN", 5, 1, 4], ["FU", 5, [2, 3]], ["AN", 5, 2, 6], ["FU", 3, [0, 1]], ["SP", 3, 0, 1024, [1], 1], ["AN", 3, 1, 2], ["FFSP", 3, 0, [10, 9], 1, 1], ["AN", 3, 1, 6], ["FU", 1, [0, 1]], ["SP", 1, 0, 32, [16], 1], ["AN", 1, 1, 2], ["FFSP", 1, 0, [10, 9], 1, 1], ["AN", 1, 1, 6], ["PR", 4, 0, "auto_unroll_max_step$16"]]]], "r": [[0.00431376, 0.00431364], 0, 3.81776, 1653080722], "v": "v0.6"}
{"i": [["[\"626fb653e298f4cd4434364b5f2ed39c\", [1024, 512], [1024, 512], [1, 1024], [1024, 1024]]", "cuda -keys=cuda,gpu -arch=sm_80 -max_num_threads=1024 -thread_warp_size=32", [-1, 16, 64, 49152, 2147483647, 1024, 8, 32], "", 0, []], [[], [["CI", 11], ["CI", 10], ["CI", 9], ["CI", 8], ["CI", 7], ["CI", 6], ["CI", 5], ["CI", 4], ["CHW", 2, "local"], ["SP", 2, 0, 1024, [1, 2, 8, 2], 1], ["SP", 2, 5, 1024, [1, 32, 2, 4], 1], ["SP", 2, 10, 512, [4, 4], 1], ["RE", 2, [0, 5, 1, 6, 2, 7, 10, 11, 3, 8, 12, 4, 9]], ["FSP", 3, 0, 9, 3], ["FSP", 3, 4, 10, 3], ["RE", 3, [0, 4, 1, 5, 2, 6, 3, 7]], ["CA", 2, 3, 5], ["CHR", 1, "shared", [2]], ["CA", 2, 3, 6], ["CHR", 0, "shared", [3]], ["CA", 1, 4, 6], ["FU", 15, [0, 1]], ["SP", 15, 0, 1048576, [4], 1], ["AN", 15, 0, 5], ["AN", 15, 1, 6], ["FU", 5, [0, 1]], ["AN", 5, 0, 5], ["FU", 5, [1, 2]], ["AN", 5, 1, 4], ["FU", 5, [2, 3]], ["AN", 5, 2, 6], ["FU", 3, [0, 1]], ["SP", 3, 0, 64, [1], 1], ["AN", 3, 1, 2], ["FFSP", 3, 0, [10, 9], 1, 1], ["AN", 3, 1, 6], ["FU", 1, [0, 1]], ["SP", 1, 0, 256, [1], 1], ["AN", 1, 1, 2], ["FFSP", 1, 0, [10, 9], 1, 1], ["AN", 1, 1, 6], ["PR", 4, 0, "auto_unroll_max_step$64"]]]], "r": [[0.000847882, 0.000847714], 0, 4.05448, 1653080724], "v": "v0.6"}
{"i": [["[\"626fb653e298f4cd4434364b5f2ed39c\", [1024, 512], [1024, 512], [1, 1024], [1024, 1024]]", "cuda -keys=cuda,gpu -arch=sm_80 -max_num_threads=1024 -thread_warp_size=32", [-1, 16, 64, 49152, 2147483647, 1024, 8, 32], "", 0, []], [[], [["CI", 11], ["CI", 10], ["CI", 9], ["CI", 8], ["CI", 7], ["CI", 6], ["CI", 5], ["CI", 4], ["CHW", 2, "local"], ["SP", 2, 0, 1024, [2, 4, 8, 4], 1], ["SP", 2, 5, 1024, [2, 128, 1, 1], 1], ["SP", 2, 10, 512, [2, 2], 1], ["RE", 2, [0, 5, 1, 6, 2, 7, 10, 11, 3, 8, 12, 4, 9]], ["FSP", 3, 0, 9, 3], ["FSP", 3, 4, 10, 3], ["RE", 3, [0, 4, 1, 5, 2, 6, 3, 7]], ["CA", 2, 3, 5], ["CHR", 1, "shared", [2]], ["CA", 2, 3, 6], ["CHR", 0, "shared", [3]], ["CA", 1, 4, 6], ["FU", 15, [0, 1]], ["SP", 15, 0, 1048576, [32], 1], ["AN", 15, 0, 5], ["AN", 15, 1, 6], ["FU", 5, [0, 1]], ["AN", 5, 0, 5], ["FU", 5, [1, 2]], ["AN", 5, 1, 4], ["FU", 5, [2, 3]], ["AN", 5, 2, 6], ["FU", 3, [0, 1]], ["SP", 3, 0, 4, [2], 1], ["AN", 3, 1, 2], ["FFSP", 3, 0, [10, 9], 1, 1], ["AN", 3, 1, 6], ["FU", 1, [0, 1]], ["SP", 1, 0, 128, [32], 1], ["AN", 1, 1, 2], ["FFSP", 1, 0, [10, 9], 1, 1], ["AN", 1, 1, 6], ["PR", 4, 0, "auto_unroll_max_step$0"]]]], "r": [[0.00148107, 0.001481], 0, 2.53664, 1653080725], "v": "v0.6"}
{"i": [["[\"626fb653e298f4cd4434364b5f2ed39c\", [1024, 512], [1024, 512], [1, 1024], [1024, 1024]]", "cuda -keys=cuda,gpu -arch=sm_80 -max_num_threads=1024 -thread_warp_size=32", [-1, 16, 64, 49152, 2147483647, 1024, 8, 32], "", 0, []], [[], [["CI", 11], ["CI", 10], ["CI", 9], ["CI", 8], ["CI", 7], ["CI", 6], ["CI", 5], ["CI", 4], ["CHW", 2, "local"], ["SP", 2, 0, 1024, [1, 32, 2, 1], 1], ["SP", 2, 5, 1024, [4, 1, 128, 1], 1], ["SP", 2, 10, 512, [1, 1], 1], ["RE", 2, [0, 5, 1, 6, 2, 7, 10, 11, 3, 8, 12, 4, 9]], ["FSP", 3, 0, 9, 3], ["FSP", 3, 4, 10, 3], ["RE", 3, [0, 4, 1, 5, 2, 6, 3, 7]], ["CA", 2, 3, 5], ["CHR", 1, "shared", [2]], ["CA", 2, 3, 6], ["CHR", 0, "shared", [3]], ["CA", 1, 4, 6], ["FU", 15, [0, 1]], ["SP", 15, 0, 1048576, [32], 1], ["AN", 15, 0, 5], ["AN", 15, 1, 6], ["FU", 5, [0, 1]], ["AN", 5, 0, 5], ["FU", 5, [1, 2]], ["AN", 5, 1, 4], ["FU", 5, [2, 3]], ["AN", 5, 2, 6], ["FU", 3, [0, 1]], ["SP", 3, 0, 128, [32], 1], ["AN", 3, 1, 2], ["FFSP", 3, 0, [10, 9], 1, 1], ["AN", 3, 1, 6], ["FU", 1, [0, 1]], ["SP", 1, 0, 2, [1], 1], ["AN", 1, 1, 2], ["FFSP", 1, 0, [10, 9], 1, 1], ["AN", 1, 1, 6], ["PR", 4, 0, "auto_unroll_max_step$64"]]]], "r": [[0.00767629, 0.00767091], 0, 3.83138, 1653080726], "v": "v0.6"}
{"i": [["[\"626fb653e298f4cd4434364b5f2ed39c\", [1024, 512], [1024, 512], [1, 1024], [1024, 1024]]", "cuda -keys=cuda,gpu -arch=sm_80 -max_num_threads=1024 -thread_warp_size=32", [-1, 16, 64, 49152, 2147483647, 1024, 8, 32], "", 0, []], [[], [["CI", 11], ["CI", 10], ["CI", 9], ["CI", 8], ["CI", 7], ["CI", 6], ["CI", 5], ["CI", 4], ["CHW", 2, "local"], ["SP", 2, 0, 1024, [1, 32, 2, 8], 1], ["SP", 2, 5, 1024, [1, 8, 64, 2], 1], ["SP", 2, 10, 512, [1, 4], 1], ["RE", 2, [0, 5, 1, 6, 2, 7, 10, 11, 3, 8, 12, 4, 9]], ["FSP", 3, 0, 9, 3], ["FSP", 3, 4, 10, 3], ["RE", 3, [0, 4, 1, 5, 2, 6, 3, 7]], ["CA", 2, 3, 5], ["CHR", 1, "shared", [2]], ["CA", 2, 3, 6], ["CHR", 0, "shared", [3]], ["CA", 1, 4, 6], ["FU", 15, [0, 1]], ["SP", 15, 0, 1048576, [32], 1], ["AN", 15, 0, 5], ["AN", 15, 1, 6], ["FU", 5, [0, 1]], ["AN", 5, 0, 5], ["FU", 5, [1, 2]], ["AN", 5, 1, 4], ["FU", 5, [2, 3]], ["AN", 5, 2, 6], ["FU", 3, [0, 1]], ["SP", 3, 0, 512, [64], 1], ["AN", 3, 1, 2], ["FFSP", 3, 0, [10, 9], 1, 1], ["AN", 3, 1, 6], ["FU", 1, [0, 1]], ["SP", 1, 0, 64, [1], 1], ["AN", 1, 1, 2], ["FFSP", 1, 0, [10, 9], 1, 1], ["AN", 1, 1, 6], ["PR", 4, 0, "auto_unroll_max_step$0"]]]], "r": [[0.0225781, 0.0225806], 0, 2.90329, 1653080727], "v": "v0.6"}
{"i": [["[\"626fb653e298f4cd4434364b5f2ed39c\", [1024, 512], [1024, 512], [1, 1024], [1024, 1024]]", "cuda -keys=cuda,gpu -arch=sm_80 -max_num_threads=1024 -thread_warp_size=32", [-1, 16, 64, 49152, 2147483647, 1024, 8, 32], "", 0, []], [[], [["CI", 11], ["CI", 10], ["CI", 9], ["CI", 8], ["CI", 7], ["CI", 6], ["CI", 5], ["CI", 4], ["CHW", 2, "local"], ["SP", 2, 0, 1024, [2, 2, 4, 4], 1], ["SP", 2, 5, 1024, [1, 16, 4, 4], 1], ["SP", 2, 10, 512, [4, 1], 1], ["RE", 2, [0, 5, 1, 6, 2, 7, 10, 11, 3, 8, 12, 4, 9]], ["FSP", 3, 0, 9, 3], ["FSP", 3, 4, 10, 3], ["RE", 3, [0, 4, 1, 5, 2, 6, 3, 7]], ["CA", 2, 3, 5], ["CHR", 1, "shared", [2]], ["CA", 2, 3, 6], ["CHR", 0, "shared", [3]], ["CA", 1, 4, 6], ["FU", 15, [0, 1]], ["SP", 15, 0, 1048576, [32], 1], ["AN", 15, 0, 5], ["AN", 15, 1, 6], ["FU", 5, [0, 1]], ["AN", 5, 0, 5], ["FU", 5, [1, 2]], ["AN", 5, 1, 4], ["FU", 5, [2, 3]], ["AN", 5, 2, 6], ["FU", 3, [0, 1]], ["SP", 3, 0, 128, [1], 1], ["AN", 3, 1, 2], ["FFSP", 3, 0, [10, 9], 1, 1], ["AN", 3, 1, 6], ["FU", 1, [0, 1]], ["SP", 1, 0, 128, [1], 1], ["AN", 1, 1, 2], ["FFSP", 1, 0, [10, 9], 1, 1], ["AN", 1, 1, 6], ["PR", 4, 0, "auto_unroll_max_step$1024"]]]], "r": [[0.00391454, 0.00391842], 0, 4.91196, 1653080728], "v": "v0.6"}
{"i": [["[\"626fb653e298f4cd4434364b5f2ed39c\", [1024, 512], [1024, 512], [1, 1024], [1024, 1024]]", "cuda -keys=cuda,gpu -arch=sm_80 -max_num_threads=1024 -thread_warp_size=32", [-1, 16, 64, 49152, 2147483647, 1024, 8, 32], "", 0, []], [[], [["CI", 11], ["CI", 10], ["CI", 9], ["CI", 8], ["CI", 7], ["CI", 6], ["CI", 5], ["CI", 4], ["CHW", 2, "local"], ["SP", 2, 0, 1024, [2, 8, 1, 8], 1], ["SP", 2, 5, 1024, [1, 4, 2, 1], 1], ["SP", 2, 10, 512, [16, 4], 1], ["RE", 2, [0, 5, 1, 6, 2, 7, 10, 11, 3, 8, 12, 4, 9]], ["FSP", 3, 0, 9, 3], ["FSP", 3, 4, 10, 3], ["RE", 3, [0, 4, 1, 5, 2, 6, 3, 7]], ["CA", 2, 3, 5], ["CHR", 1, "shared", [2]], ["CA", 2, 3, 6], ["CHR", 0, "shared", [3]], ["CA", 1, 4, 6], ["FU", 15, [0, 1]], ["SP", 15, 0, 1048576, [32], 1], ["AN", 15, 0, 5], ["AN", 15, 1, 6], ["FU", 5, [0, 1]], ["AN", 5, 0, 5], ["FU", 5, [1, 2]], ["AN", 5, 1, 4], ["FU", 5, [2, 3]], ["AN", 5, 2, 6], ["FU", 3, [0, 1]], ["SP", 3, 0, 128, [1], 1], ["AN", 3, 1, 2], ["FFSP", 3, 0, [10, 9], 1, 1], ["AN", 3, 1, 6], ["FU", 1, [0, 1]], ["SP", 1, 0, 512, [1], 1], ["AN", 1, 1, 2], ["FFSP", 1, 0, [10, 9], 1, 1], ["AN", 1, 1, 6], ["PR", 4, 0, "auto_unroll_max_step$16"]]]], "r": [[0.000530186, 0.000530197], 0, 2.94167, 1653080730], "v": "v0.6"}
{"i": [["[\"626fb653e298f4cd4434364b5f2ed39c\", [1024, 512], [1024, 512], [1, 1024], [1024, 1024]]", "cuda -keys=cuda,gpu -arch=sm_80 -max_num_threads=1024 -thread_warp_size=32", [-1, 16, 64, 49152, 2147483647, 1024, 8, 32], "", 0, []], [[], [["CI", 11], ["CI", 10], ["CI", 9], ["CI", 8], ["CI", 7], ["CI", 6], ["CI", 5], ["CI", 4], ["CHW", 2, "local"], ["SP", 2, 0, 1024, [1, 32, 8, 1], 1], ["SP", 2, 5, 1024, [1, 1, 256, 1], 1], ["SP", 2, 10, 512, [4, 1], 1], ["RE", 2, [0, 5, 1, 6, 2, 7, 10, 11, 3, 8, 12, 4, 9]], ["FSP", 3, 0, 9, 3], ["FSP", 3, 4, 10, 3], ["RE", 3, [0, 4, 1, 5, 2, 6, 3, 7]], ["CA", 2, 3, 5], ["CHR", 1, "shared", [2]], ["CA", 2, 3, 6], ["CHR", 0, "shared", [3]], ["CA", 1, 4, 6], ["FU", 15, [0, 1]], ["SP", 15, 0, 1048576, [32], 1], ["AN", 15, 0, 5], ["AN", 15, 1, 6], ["FU", 5, [0, 1]], ["AN", 5, 0, 5], ["FU", 5, [1, 2]], ["AN", 5, 1, 4], ["FU", 5, [2, 3]], ["AN", 5, 2, 6], ["FU", 3, [0, 1]], ["SP", 3, 0, 1024, [1], 1], ["AN", 3, 1, 2], ["FFSP", 3, 0, [10, 9], 1, 1], ["AN", 3, 1, 6], ["FU", 1, [0, 1]], ["SP", 1, 0, 32, [1], 1], ["AN", 1, 1, 2], ["FFSP", 1, 0, [10, 9], 1, 1], ["AN", 1, 1, 6], ["PR", 4, 0, "auto_unroll_max_step$16"]]]], "r": [[0.0452134, 0.0452328], 0, 5.01719, 1653080731], "v": "v0.6"}
{"i": [["[\"626fb653e298f4cd4434364b5f2ed39c\", [1024, 512], [1024, 512], [1, 1024], [1024, 1024]]", "cuda -keys=cuda,gpu -arch=sm_80 -max_num_threads=1024 -thread_warp_size=32", [-1, 16, 64, 49152, 2147483647, 1024, 8, 32], "", 0, []], [[], [["CI", 11], ["CI", 10], ["CI", 9], ["CI", 8], ["CI", 7], ["CI", 6], ["CI", 5], ["CI", 4], ["CHW", 2, "local"], ["SP", 2, 0, 1024, [4, 4, 8, 4], 1], ["SP", 2, 5, 1024, [1, 256, 1, 2], 1], ["SP", 2, 10, 512, [1, 1], 1], ["RE", 2, [0, 5, 1, 6, 2, 7, 10, 11, 3, 8, 12, 4, 9]], ["FSP", 3, 0, 9, 3], ["FSP", 3, 4, 10, 3], ["RE", 3, [0, 4, 1, 5, 2, 6, 3, 7]], ["CA", 2, 3, 5], ["CHR", 1, "shared", [2]], ["CA", 2, 3, 6], ["CHR", 0, "shared", [3]], ["CA", 1, 4, 6], ["FU", 15, [0, 1]], ["SP", 15, 0, 1048576, [32], 1], ["AN", 15, 0, 5], ["AN", 15, 1, 6], ["FU", 5, [0, 1]], ["AN", 5, 0, 5], ["FU", 5, [1, 2]], ["AN", 5, 1, 4], ["FU", 5, [2, 3]], ["AN", 5, 2, 6], ["FU", 3, [0, 1]], ["SP", 3, 0, 2, [2], 1], ["AN", 3, 1, 2], ["FFSP", 3, 0, [10, 9], 1, 1], ["AN", 3, 1, 6], ["FU", 1, [0, 1]], ["SP", 1, 0, 32, [1], 1], ["AN", 1, 1, 2], ["FFSP", 1, 0, [10, 9], 1, 1], ["AN", 1, 1, 6], ["PR", 4, 0, "auto_unroll_max_step$1024"]]]], "r": [[0.0275473, 0.0275466], 0, 2.96916, 1653080732], "v": "v0.6"}
{"i": [["[\"626fb653e298f4cd4434364b5f2ed39c\", [1024, 512], [1024, 512], [1, 1024], [1024, 1024]]", "cuda -keys=cuda,gpu -arch=sm_80 -max_num_threads=1024 -thread_warp_size=32", [-1, 16, 64, 49152, 2147483647, 1024, 8, 32], "", 0, []], [[], [["CI", 11], ["CI", 10], ["CI", 9], ["CI", 8], ["CI", 7], ["CI", 6], ["CI", 5], ["CI", 4], ["CHW", 2, "local"], ["SP", 2, 0, 1024, [1, 128, 1, 1], 1], ["SP", 2, 5, 1024, [2, 1, 128, 1], 1], ["SP", 2, 10, 512, [2, 1], 1], ["RE", 2, [0, 5, 1, 6, 2, 7, 10, 11, 3, 8, 12, 4, 9]], ["FSP", 3, 0, 9, 3], ["FSP", 3, 4, 10, 3], ["RE", 3, [0, 4, 1, 5, 2, 6, 3, 7]], ["CA", 2, 3, 5], ["CHR", 1, "shared", [2]], ["CA", 2, 3, 6], ["CHR", 0, "shared", [3]], ["CA", 1, 4, 6], ["FU", 15, [0, 1]], ["SP", 15, 0, 1048576, [64], 1], ["AN", 15, 0, 5], ["AN", 15, 1, 6], ["FU", 5, [0, 1]], ["AN", 5, 0, 5], ["FU", 5, [1, 2]], ["AN", 5, 1, 4], ["FU", 5, [2, 3]], ["AN", 5, 2, 6], ["FU", 3, [0, 1]], ["SP", 3, 0, 256, [1], 1], ["AN", 3, 1, 2], ["FFSP", 3, 0, [10, 9], 1, 1], ["AN", 3, 1, 6], ["FU", 1, [0, 1]], ["SP", 1, 0, 4, [1], 1], ["AN", 1, 1, 2], ["FFSP", 1, 0, [10, 9], 1, 1], ["AN", 1, 1, 6], ["PR", 4, 0, "auto_unroll_max_step$0"]]]], "r": [[0.00123023, 0.00123025], 0, 2.77379, 1653080733], "v": "v0.6"}
{"i": [["[\"626fb653e298f4cd4434364b5f2ed39c\", [1024, 512], [1024, 512], [1, 1024], [1024, 1024]]", "cuda -keys=cuda,gpu -arch=sm_80 -max_num_threads=1024 -thread_warp_size=32", [-1, 16, 64, 49152, 2147483647, 1024, 8, 32], "", 0, []], [[], [["CI", 11], ["CI", 10], ["CI", 9], ["CI", 8], ["CI", 7], ["CI", 6], ["CI", 5], ["CI", 4], ["CHW", 2, "local"], ["SP", 2, 0, 1024, [2, 4, 1, 1], 1], ["SP", 2, 5, 1024, [1, 32, 1, 2], 1], ["SP", 2, 10, 512, [4, 16], 1], ["RE", 2, [0, 5, 1, 6, 2, 7, 10, 11, 3, 8, 12, 4, 9]], ["FSP", 3, 0, 9, 3], ["FSP", 3, 4, 10, 3], ["RE", 3, [0, 4, 1, 5, 2, 6, 3, 7]], ["CA", 2, 3, 5], ["CHR", 1, "shared", [2]], ["CA", 2, 3, 6], ["CHR", 0, "shared", [3]], ["CA", 1, 4, 6], ["FU", 15, [0, 1]], ["SP", 15, 0, 1048576, [32], 1], ["AN", 15, 0, 5], ["AN", 15, 1, 6], ["FU", 5, [0, 1]], ["AN", 5, 0, 5], ["FU", 5, [1, 2]], ["AN", 5, 1, 4], ["FU", 5, [2, 3]], ["AN", 5, 2, 6], ["FU", 3, [0, 1]], ["SP", 3, 0, 128, [2], 1], ["AN", 3, 1, 2], ["FFSP", 3, 0, [10, 9], 1, 1], ["AN", 3, 1, 6], ["FU", 1, [0, 1]], ["SP", 1, 0, 128, [1], 1], ["AN", 1, 1, 2], ["FFSP", 1, 0, [10, 9], 1, 1], ["AN", 1, 1, 6], ["PR", 4, 0, "auto_unroll_max_step$1024"]]]], "r": [[0.000992368, 0.000992438], 0, 3.26498, 1653080735], "v": "v0.6"}
{"i": [["[\"626fb653e298f4cd4434364b5f2ed39c\", [1024, 512], [1024, 512], [1, 1024], [1024, 1024]]", "cuda -keys=cuda,gpu -arch=sm_80 -max_num_threads=1024 -thread_warp_size=32", [-1, 16, 64, 49152, 2147483647, 1024, 8, 32], "", 0, []], [[], [["CI", 11], ["CI", 10], ["CI", 9], ["CI", 8], ["CI", 7], ["CI", 6], ["CI", 5], ["CI", 4], ["CHW", 2, "local"], ["SP", 2, 0, 1024, [1, 8, 4, 16], 1], ["SP", 2, 5, 1024, [2, 8, 1, 8], 1], ["SP", 2, 10, 512, [1, 1], 1], ["RE", 2, [0, 5, 1, 6, 2, 7, 10, 11, 3, 8, 12, 4, 9]], ["FSP", 3, 0, 9, 3], ["FSP", 3, 4, 10, 3], ["RE", 3, [0, 4, 1, 5, 2, 6, 3, 7]], ["CA", 2, 3, 5], ["CHR", 1, "shared", [2]], ["CA", 2, 3, 6], ["CHR", 0, "shared", [3]], ["CA", 1, 4, 6], ["FU", 15, [0, 1]], ["SP", 15, 0, 1048576, [32], 1], ["AN", 15, 0, 5], ["AN", 15, 1, 6], ["FU", 5, [0, 1]], ["AN", 5, 0, 5], ["FU", 5, [1, 2]], ["AN", 5, 1, 4], ["FU", 5, [2, 3]], ["AN", 5, 2, 6], ["FU", 3, [0, 1]], ["SP", 3, 0, 16, [1], 1], ["AN", 3, 1, 2], ["FFSP", 3, 0, [10, 9], 1, 1], ["AN", 3, 1, 6], ["FU", 1, [0, 1]], ["SP", 1, 0, 128, [4], 1], ["AN", 1, 1, 2], ["FFSP", 1, 0, [10, 9], 1, 1], ["AN", 1, 1, 6], ["PR", 4, 0, "auto_unroll_max_step$16"]]]], "r": [[0.0135729, 0.0135321], 0, 3.2094, 1653080736], "v": "v0.6"}
{"i": [["[\"626fb653e298f4cd4434364b5f2ed39c\", [1024, 512], [1024, 512], [1, 1024], [1024, 1024]]", "cuda -keys=cuda,gpu -arch=sm_80 -max_num_threads=1024 -thread_warp_size=32", [-1, 16, 64, 49152, 2147483647, 1024, 8, 32], "", 0, []], [[], [["CI", 11], ["CI", 10], ["CI", 9], ["CI", 8], ["CI", 7], ["CI", 6], ["CI", 5], ["CI", 4], ["CHW", 2, "local"], ["SP", 2, 0, 1024, [1, 32, 8, 1], 1], ["SP", 2, 5, 1024, [1, 1, 64, 8], 1], ["SP", 2, 10, 512, [4, 1], 1], ["RE", 2, [0, 5, 1, 6, 2, 7, 10, 11, 3, 8, 12, 4, 9]], ["FSP", 3, 0, 9, 3], ["FSP", 3, 4, 10, 3], ["RE", 3, [0, 4, 1, 5, 2, 6, 3, 7]], ["CA", 2, 3, 5], ["CHR", 1, "shared", [2]], ["CA", 2, 3, 6], ["CHR", 0, "shared", [3]], ["CA", 1, 4, 6], ["FU", 15, [0, 1]], ["SP", 15, 0, 1048576, [32], 1], ["AN", 15, 0, 5], ["AN", 15, 1, 6], ["FU", 5, [0, 1]], ["AN", 5, 0, 5], ["FU", 5, [1, 2]], ["AN", 5, 1, 4], ["FU", 5, [2, 3]], ["AN", 5, 2, 6], ["FU", 3, [0, 1]], ["SP", 3, 0, 1024, [1], 1], ["AN", 3, 1, 2], ["FFSP", 3, 0, [10, 9], 1, 1], ["AN", 3, 1, 6], ["FU", 1, [0, 1]], ["SP", 1, 0, 32, [1], 1], ["AN", 1, 1, 2], ["FFSP", 1, 0, [10, 9], 1, 1], ["AN", 1, 1, 6], ["PR", 4, 0, "auto_unroll_max_step$16"]]]], "r": [[0.0554285, 0.0554781], 0, 3.87726, 1653080738], "v": "v0.6"}
{"i": [["[\"626fb653e298f4cd4434364b5f2ed39c\", [1024, 512], [1024, 512], [1, 1024], [1024, 1024]]", "cuda -keys=cuda,gpu -arch=sm_80 -max_num_threads=1024 -thread_warp_size=32", [-1, 16, 64, 49152, 2147483647, 1024, 8, 32], "", 0, []], [[], [["CI", 11], ["CI", 10], ["CI", 9], ["CI", 8], ["CI", 7], ["CI", 6], ["CI", 5], ["CI", 4], ["CHW", 2, "local"], ["SP", 2, 0, 1024, [1, 128, 1, 2], 1], ["SP", 2, 5, 1024, [1, 8, 1, 4], 1], ["SP", 2, 10, 512, [8, 2], 1], ["RE", 2, [0, 5, 1, 6, 2, 7, 10, 11, 3, 8, 12, 4, 9]], ["FSP", 3, 0, 9, 3], ["FSP", 3, 4, 10, 3], ["RE", 3, [0, 4, 1, 5, 2, 6, 3, 7]], ["CA", 2, 3, 5], ["CHR", 1, "shared", [2]], ["CA", 2, 3, 6], ["CHR", 0, "shared", [3]], ["CA", 1, 4, 6], ["FU", 15, [0, 1]], ["SP", 15, 0, 1048576, [32], 1], ["AN", 15, 0, 5], ["AN", 15, 1, 6], ["FU", 5, [0, 1]], ["AN", 5, 0, 5], ["FU", 5, [1, 2]], ["AN", 5, 1, 4], ["FU", 5, [2, 3]], ["AN", 5, 2, 6], ["FU", 3, [0, 1]], ["SP", 3, 0, 512, [1], 1], ["AN", 3, 1, 2], ["FFSP", 3, 0, [10, 9], 1, 1], ["AN", 3, 1, 6], ["FU", 1, [0, 1]], ["SP", 1, 0, 32, [1], 1], ["AN", 1, 1, 2], ["FFSP", 1, 0, [10, 9], 1, 1], ["AN", 1, 1, 6], ["PR", 4, 0, "auto_unroll_max_step$0"]]]], "r": [[0.00159863, 0.00159856], 0, 1.99134, 1653080739], "v": "v0.6"}
{"i": [["[\"626fb653e298f4cd4434364b5f2ed39c\", [1024, 512], [1024, 512], [1, 1024], [1024, 1024]]", "cuda -keys=cuda,gpu -arch=sm_80 -max_num_threads=1024 -thread_warp_size=32", [-1, 16, 64, 49152, 2147483647, 1024, 8, 32], "", 0, []], [[], [["CI", 11], ["CI", 10], ["CI", 9], ["CI", 8], ["CI", 7], ["CI", 6], ["CI", 5], ["CI", 4], ["CHW", 2, "local"], ["SP", 2, 0, 1024, [2, 1, 16, 2], 1], ["SP", 2, 5, 1024, [1, 128, 4, 1], 1], ["SP", 2, 10, 512, [4, 1], 1], ["RE", 2, [0, 5, 1, 6, 2, 7, 10, 11, 3, 8, 12, 4, 9]], ["FSP", 3, 0, 9, 3], ["FSP", 3, 4, 10, 3], ["RE", 3, [0, 4, 1, 5, 2, 6, 3, 7]], ["CA", 2, 3, 5], ["CHR", 1, "shared", [2]], ["CA", 2, 3, 6], ["CHR", 0, "shared", [3]], ["CA", 1, 4, 6], ["FU", 15, [0, 1]], ["SP", 15, 0, 1048576, [32], 1], ["AN", 15, 0, 5], ["AN", 15, 1, 6], ["FU", 5, [0, 1]], ["AN", 5, 0, 5], ["FU", 5, [1, 2]], ["AN", 5, 1, 4], ["FU", 5, [2, 3]], ["AN", 5, 2, 6], ["FU", 3, [0, 1]], ["SP", 3, 0, 16, [1], 1], ["AN", 3, 1, 2], ["FFSP", 3, 0, [10, 9], 1, 1], ["AN", 3, 1, 6], ["FU", 1, [0, 1]], ["SP", 1, 0, 64, [1], 1], ["AN", 1, 1, 2], ["FFSP", 1, 0, [10, 9], 1, 1], ["AN", 1, 1, 6], ["PR", 4, 0, "auto_unroll_max_step$1024"]]]], "r": [[0.000960406, 0.000960398], 0, 4.49534, 1653080741], "v": "v0.6"}
{"i": [["[\"626fb653e298f4cd4434364b5f2ed39c\", [1024, 512], [1024, 512], [1, 1024], [1024, 1024]]", "cuda -keys=cuda,gpu -arch=sm_80 -max_num_threads=1024 -thread_warp_size=32", [-1, 16, 64, 49152, 2147483647, 1024, 8, 32], "", 0, []], [[], [["CI", 11], ["CI", 10], ["CI", 9], ["CI", 8], ["CI", 7], ["CI", 6], ["CI", 5], ["CI", 4], ["CHW", 2, "local"], ["SP", 2, 0, 1024, [4, 2, 1, 64], 1], ["SP", 2, 5, 1024, [1, 32, 1, 16], 1], ["SP", 2, 10, 512, [8, 1], 1], ["RE", 2, [0, 5, 1, 6, 2, 7, 10, 11, 3, 8, 12, 4, 9]], ["FSP", 3, 0, 9, 3], ["FSP", 3, 4, 10, 3], ["RE", 3, [0, 4, 1, 5, 2, 6, 3, 7]], ["CA", 2, 3, 5], ["CHR", 1, "shared", [2]], ["CA", 2, 3, 6], ["CHR", 0, "shared", [3]], ["CA", 1, 4, 6], ["FU", 15, [0, 1]], ["SP", 15, 0, 1048576, [32], 1], ["AN", 15, 0, 5], ["AN", 15, 1, 6], ["FU", 5, [0, 1]], ["AN", 5, 0, 5], ["FU", 5, [1, 2]], ["AN", 5, 1, 4], ["FU", 5, [2, 3]], ["AN", 5, 2, 6], ["FU", 3, [0, 1]], ["SP", 3, 0, 32, [1], 1], ["AN", 3, 1, 2], ["FFSP", 3, 0, [10, 9], 1, 1], ["AN", 3, 1, 6], ["FU", 1, [0, 1]], ["SP", 1, 0, 512, [1], 1], ["AN", 1, 1, 2], ["FFSP", 1, 0, [10, 9], 1, 1], ["AN", 1, 1, 6], ["PR", 4, 0, "auto_unroll_max_step$64"]]]], "r": [[0.0300606, 0.0300744], 0, 3.0134, 1653080742], "v": "v0.6"}
{"i": [["[\"626fb653e298f4cd4434364b5f2ed39c\", [1024, 512], [1024, 512], [1, 1024], [1024, 1024]]", "cuda -keys=cuda,gpu -arch=sm_80 -max_num_threads=1024 -thread_warp_size=32", [-1, 16, 64, 49152, 2147483647, 1024, 8, 32], "", 0, []], [[], [["CI", 11], ["CI", 10], ["CI", 9], ["CI", 8], ["CI", 7], ["CI", 6], ["CI", 5], ["CI", 4], ["CHW", 2, "local"], ["SP", 2, 0, 1024, [8, 8, 2, 4], 1], ["SP", 2, 5, 1024, [1, 8, 1, 1], 1], ["SP", 2, 10, 512, [1, 4], 1], ["RE", 2, [0, 5, 1, 6, 2, 7, 10, 11, 3, 8, 12, 4, 9]], ["FSP", 3, 0, 9, 3], ["FSP", 3, 4, 10, 3], ["RE", 3, [0, 4, 1, 5, 2, 6, 3, 7]], ["CA", 2, 3, 5], ["CHR", 1, "shared", [2]], ["CA", 2, 3, 6], ["CHR", 0, "shared", [3]], ["CA", 1, 4, 6], ["FU", 15, [0, 1]], ["SP", 15, 0, 1048576, [32], 1], ["AN", 15, 0, 5], ["AN", 15, 1, 6], ["FU", 5, [0, 1]], ["AN", 5, 0, 5], ["FU", 5, [1, 2]], ["AN", 5, 1, 4], ["FU", 5, [2, 3]], ["AN", 5, 2, 6], ["FU", 3, [0, 1]], ["SP", 3, 0, 2, [2], 1], ["AN", 3, 1, 2], ["FFSP", 3, 0, [10, 9], 1, 1], ["AN", 3, 1, 6], ["FU", 1, [0, 1]], ["SP", 1, 0, 16, [4], 1], ["AN", 1, 1, 2], ["FFSP", 1, 0, [10, 9], 1, 1], ["AN", 1, 1, 6], ["PR", 4, 0, "auto_unroll_max_step$64"]]]], "r": [[0.00144503, 0.0014451], 0, 1.98765, 1653080743], "v": "v0.6"}
{"i": [["[\"626fb653e298f4cd4434364b5f2ed39c\", [1024, 512], [1024, 512], [1, 1024], [1024, 1024]]", "cuda -keys=cuda,gpu -arch=sm_80 -max_num_threads=1024 -thread_warp_size=32", [-1, 16, 64, 49152, 2147483647, 1024, 8, 32], "", 0, []], [[], [["CI", 11], ["CI", 10], ["CI", 9], ["CI", 8], ["CI", 7], ["CI", 6], ["CI", 5], ["CI", 4], ["CHW", 2, "local"], ["SP", 2, 0, 1024, [1, 4, 4, 2], 1], ["SP", 2, 5, 1024, [1, 16, 4, 2], 1], ["SP", 2, 10, 512, [16, 4], 1], ["RE", 2, [0, 5, 1, 6, 2, 7, 10, 11, 3, 8, 12, 4, 9]], ["FSP", 3, 0, 9, 3], ["FSP", 3, 4, 10, 3], ["RE", 3, [0, 4, 1, 5, 2, 6, 3, 7]], ["CA", 2, 3, 5], ["CHR", 1, "shared", [2]], ["CA", 2, 3, 6], ["CHR", 0, "shared", [3]], ["CA", 1, 4, 6], ["FU", 15, [0, 1]], ["SP", 15, 0, 1048576, [32], 1], ["AN", 15, 0, 5], ["AN", 15, 1, 6], ["FU", 5, [0, 1]], ["AN", 5, 0, 5], ["FU", 5, [1, 2]], ["AN", 5, 1, 4], ["FU", 5, [2, 3]], ["AN", 5, 2, 6], ["FU", 3, [0, 1]], ["SP", 3, 0, 512, [1], 1], ["AN", 3, 1, 2], ["FFSP", 3, 0, [10, 9], 1, 1], ["AN", 3, 1, 6], ["FU", 1, [0, 1]], ["SP", 1, 0, 512, [1], 1], ["AN", 1, 1, 2], ["FFSP", 1, 0, [10, 9], 1, 1], ["AN", 1, 1, 6], ["PR", 4, 0, "auto_unroll_max_step$64"]]]], "r": [[0.000375891, 0.000375922], 0, 3.50127, 1653080744], "v": "v0.6"}
{"i": [["[\"626fb653e298f4cd4434364b5f2ed39c\", [1024, 512], [1024, 512], [1, 1024], [1024, 1024]]", "cuda -keys=cuda,gpu -arch=sm_80 -max_num_threads=1024 -thread_warp_size=32", [-1, 16, 64, 49152, 2147483647, 1024, 8, 32], "", 0, []], [[], [["CI", 11], ["CI", 10], ["CI", 9], ["CI", 8], ["CI", 7], ["CI", 6], ["CI", 5], ["CI", 4], ["CHW", 2, "local"], ["SP", 2, 0, 1024, [2, 1, 1, 32], 1], ["SP", 2, 5, 1024, [1, 4, 2, 64], 1], ["SP", 2, 10, 512, [2, 2], 1], ["RE", 2, [0, 5, 1, 6, 2, 7, 10, 11, 3, 8, 12, 4, 9]], ["FSP", 3, 0, 9, 3], ["FSP", 3, 4, 10, 3], ["RE", 3, [0, 4, 1, 5, 2, 6, 3, 7]], ["CA", 2, 3, 5], ["CHR", 1, "shared", [2]], ["CA", 2, 3, 6], ["CHR", 0, "shared", [3]], ["CA", 1, 4, 6], ["FU", 15, [0, 1]], ["SP", 15, 0, 1048576, [32], 1], ["AN", 15, 0, 5], ["AN", 15, 1, 6], ["FU", 5, [0, 1]], ["AN", 5, 0, 5], ["FU", 5, [1, 2]], ["AN", 5, 1, 4], ["FU", 5, [2, 3]], ["AN", 5, 2, 6], ["FU", 3, [0, 1]], ["SP", 3, 0, 16, [1], 1], ["AN", 3, 1, 2], ["FFSP", 3, 0, [10, 9], 1, 1], ["AN", 3, 1, 6], ["FU", 1, [0, 1]], ["SP", 1, 0, 128, [1], 1], ["AN", 1, 1, 2], ["FFSP", 1, 0, [10, 9], 1, 1], ["AN", 1, 1, 6], ["PR", 4, 0, "auto_unroll_max_step$512"]]]], "r": [[0.138559, 0.132271], 0, 7.63926, 1653080746], "v": "v0.6"}
{"i": [["[\"626fb653e298f4cd4434364b5f2ed39c\", [1024, 512], [1024, 512], [1, 1024], [1024, 1024]]", "cuda -keys=cuda,gpu -arch=sm_80 -max_num_threads=1024 -thread_warp_size=32", [-1, 16, 64, 49152, 2147483647, 1024, 8, 32], "", 0, []], [[], [["CI", 11], ["CI", 10], ["CI", 9], ["CI", 8], ["CI", 7], ["CI", 6], ["CI", 5], ["CI", 4], ["CHW", 2, "local"], ["SP", 2, 0, 1024, [1, 2, 1, 8], 1], ["SP", 2, 5, 1024, [8, 2, 16, 2], 1], ["SP", 2, 10, 512, [1, 8], 1], ["RE", 2, [0, 5, 1, 6, 2, 7, 10, 11, 3, 8, 12, 4, 9]], ["FSP", 3, 0, 9, 3], ["FSP", 3, 4, 10, 3], ["RE", 3, [0, 4, 1, 5, 2, 6, 3, 7]], ["CA", 2, 3, 5], ["CHR", 1, "shared", [2]], ["CA", 2, 3, 6], ["CHR", 0, "shared", [3]], ["CA", 1, 4, 6], ["FU", 15, [0, 1]], ["SP", 15, 0, 1048576, [32], 1], ["AN", 15, 0, 5], ["AN", 15, 1, 6], ["FU", 5, [0, 1]], ["AN", 5, 0, 5], ["FU", 5, [1, 2]], ["AN", 5, 1, 4], ["FU", 5, [2, 3]], ["AN", 5, 2, 6], ["FU", 3, [0, 1]], ["SP", 3, 0, 256, [1], 1], ["AN", 3, 1, 2], ["FFSP", 3, 0, [10, 9], 1, 1], ["AN", 3, 1, 6], ["FU", 1, [0, 1]], ["SP", 1, 0, 8, [1], 1], ["AN", 1, 1, 2], ["FFSP", 1, 0, [10, 9], 1, 1], ["AN", 1, 1, 6], ["PR", 4, 0, "auto_unroll_max_step$16"]]]], "r": [[0.00698495, 0.00699615], 0, 3.65591, 1653080747], "v": "v0.6"}
{"i": [["[\"626fb653e298f4cd4434364b5f2ed39c\", [1024, 512], [1024, 512], [1, 1024], [1024, 1024]]", "cuda -keys=cuda,gpu -arch=sm_80 -max_num_threads=1024 -thread_warp_size=32", [-1, 16, 64, 49152, 2147483647, 1024, 8, 32], "", 0, []], [[], [["CI", 11], ["CI", 10], ["CI", 9], ["CI", 8], ["CI", 7], ["CI", 6], ["CI", 5], ["CI", 4], ["CHW", 2, "local"], ["SP", 2, 0, 1024, [2, 32, 1, 4], 1], ["SP", 2, 5, 1024, [1, 2, 8, 1], 1], ["SP", 2, 10, 512, [8, 4], 1], ["RE", 2, [0, 5, 1, 6, 2, 7, 10, 11, 3, 8, 12, 4, 9]], ["FSP", 3, 0, 9, 3], ["FSP", 3, 4, 10, 3], ["RE", 3, [0, 4, 1, 5, 2, 6, 3, 7]], ["CA", 2, 3, 5], ["CHR", 1, "shared", [2]], ["CA", 2, 3, 6], ["CHR", 0, "shared", [3]], ["CA", 1, 4, 6], ["FU", 15, [0, 1]], ["SP", 15, 0, 1048576, [64], 1], ["AN", 15, 0, 5], ["AN", 15, 1, 6], ["FU", 5, [0, 1]], ["AN", 5, 0, 5], ["FU", 5, [1, 2]], ["AN", 5, 1, 4], ["FU", 5, [2, 3]], ["AN", 5, 2, 6], ["FU", 3, [0, 1]], ["SP", 3, 0, 256, [1], 1], ["AN", 3, 1, 2], ["FFSP", 3, 0, [10, 9], 1, 1], ["AN", 3, 1, 6], ["FU", 1, [0, 1]], ["SP", 1, 0, 128, [1], 1], ["AN", 1, 1, 2], ["FFSP", 1, 0, [10, 9], 1, 1], ["AN", 1, 1, 6], ["PR", 4, 0, "auto_unroll_max_step$16"]]]], "r": [[0.000369655, 0.000369563], 0, 2.66506, 1653080749], "v": "v0.6"}
{"i": [["[\"626fb653e298f4cd4434364b5f2ed39c\", [1024, 512], [1024, 512], [1, 1024], [1024, 1024]]", "cuda -keys=cuda,gpu -arch=sm_80 -max_num_threads=1024 -thread_warp_size=32", [-1, 16, 64, 49152, 2147483647, 1024, 8, 32], "", 0, []], [[], [["CI", 11], ["CI", 10], ["CI", 9], ["CI", 8], ["CI", 7], ["CI", 6], ["CI", 5], ["CI", 4], ["CHW", 2, "local"], ["SP", 2, 0, 1024, [1, 16, 1, 1], 1], ["SP", 2, 5, 1024, [1, 1, 1, 4], 1], ["SP", 2, 10, 512, [16, 1], 1], ["RE", 2, [0, 5, 1, 6, 2, 7, 10, 11, 3, 8, 12, 4, 9]], ["FSP", 3, 0, 9, 3], ["FSP", 3, 4, 10, 3], ["RE", 3, [0, 4, 1, 5, 2, 6, 3, 7]], ["CA", 2, 3, 5], ["CHR", 1, "shared", [2]], ["CA", 2, 3, 6], ["CHR", 0, "shared", [3]], ["CA", 1, 4, 6], ["FU", 15, [0, 1]], ["SP", 15, 0, 1048576, [32], 1], ["AN", 15, 0, 5], ["AN", 15, 1, 6], ["FU", 5, [0, 1]], ["AN", 5, 0, 5], ["FU", 5, [1, 2]], ["AN", 5, 1, 4], ["FU", 5, [2, 3]], ["AN", 5, 2, 6], ["FU", 3, [0, 1]], ["SP", 3, 0, 64, [1], 1], ["AN", 3, 1, 2], ["FFSP", 3, 0, [10, 9], 1, 1], ["AN", 3, 1, 6], ["FU", 1, [0, 1]], ["SP", 1, 0, 16, [1], 1], ["AN", 1, 1, 2], ["FFSP", 1, 0, [10, 9], 1, 1], ["AN", 1, 1, 6], ["PR", 4, 0, "auto_unroll_max_step$512"]]]], "r": [[0.000722955, 0.000722967], 0, 2.42295, 1653080750], "v": "v0.6"}
{"i": [["[\"626fb653e298f4cd4434364b5f2ed39c\", [1024, 512], [1024, 512], [1, 1024], [1024, 1024]]", "cuda -keys=cuda,gpu -arch=sm_80 -max_num_threads=1024 -thread_warp_size=32", [-1, 16, 64, 49152, 2147483647, 1024, 8, 32], "", 0, []], [[], [["CI", 11], ["CI", 10], ["CI", 9], ["CI", 8], ["CI", 7], ["CI", 6], ["CI", 5], ["CI", 4], ["CHW", 2, "local"], ["SP", 2, 0, 1024, [1, 32, 1, 8], 1], ["SP", 2, 5, 1024, [8, 16, 1, 1], 1], ["SP", 2, 10, 512, [1, 8], 1], ["RE", 2, [0, 5, 1, 6, 2, 7, 10, 11, 3, 8, 12, 4, 9]], ["FSP", 3, 0, 9, 3], ["FSP", 3, 4, 10, 3], ["RE", 3, [0, 4, 1, 5, 2, 6, 3, 7]], ["CA", 2, 3, 5], ["CHR", 1, "shared", [2]], ["CA", 2, 3, 6], ["CHR", 0, "shared", [3]], ["CA", 1, 4, 6], ["FU", 15, [0, 1]], ["SP", 15, 0, 1048576, [32], 1], ["AN", 15, 0, 5], ["AN", 15, 1, 6], ["FU", 5, [0, 1]], ["AN", 5, 0, 5], ["FU", 5, [1, 2]], ["AN", 5, 1, 4], ["FU", 5, [2, 3]], ["AN", 5, 2, 6], ["FU", 3, [0, 1]], ["SP", 3, 0, 16, [1], 1], ["AN", 3, 1, 2], ["FFSP", 3, 0, [10, 9], 1, 1], ["AN", 3, 1, 6], ["FU", 1, [0, 1]], ["SP", 1, 0, 64, [1], 1], ["AN", 1, 1, 2], ["FFSP", 1, 0, [10, 9], 1, 1], ["AN", 1, 1, 6], ["PR", 4, 0, "auto_unroll_max_step$16"]]]], "r": [[0.00059596, 0.000595956], 0, 2.54661, 1653080752], "v": "v0.6"}
{"i": [["[\"626fb653e298f4cd4434364b5f2ed39c\", [1024, 512], [1024, 512], [1, 1024], [1024, 1024]]", "cuda -keys=cuda,gpu -arch=sm_80 -max_num_threads=1024 -thread_warp_size=32", [-1, 16, 64, 49152, 2147483647, 1024, 8, 32], "", 0, []], [[], [["CI", 11], ["CI", 10], ["CI", 9], ["CI", 8], ["CI", 7], ["CI", 6], ["CI", 5], ["CI", 4], ["CHW", 2, "local"], ["SP", 2, 0, 1024, [1, 2, 8, 2], 1], ["SP", 2, 5, 1024, [2, 32, 2, 2], 1], ["SP", 2, 10, 512, [4, 4], 1], ["RE", 2, [0, 5, 1, 6, 2, 7, 10, 11, 3, 8, 12, 4, 9]], ["FSP", 3, 0, 9, 3], ["FSP", 3, 4, 10, 3], ["RE", 3, [0, 4, 1, 5, 2, 6, 3, 7]], ["CA", 2, 3, 5], ["CHR", 1, "shared", [2]], ["CA", 2, 3, 6], ["CHR", 0, "shared", [3]], ["CA", 1, 4, 6], ["FU", 15, [0, 1]], ["SP", 15, 0, 1048576, [2], 1], ["AN", 15, 0, 5], ["AN", 15, 1, 6], ["FU", 5, [0, 1]], ["AN", 5, 0, 5], ["FU", 5, [1, 2]], ["AN", 5, 1, 4], ["FU", 5, [2, 3]], ["AN", 5, 2, 6], ["FU", 3, [0, 1]], ["SP", 3, 0, 64, [1], 1], ["AN", 3, 1, 2], ["FFSP", 3, 0, [10, 9], 1, 1], ["AN", 3, 1, 6], ["FU", 1, [0, 1]], ["SP", 1, 0, 256, [1], 1], ["AN", 1, 1, 2], ["FFSP", 1, 0, [10, 9], 1, 1], ["AN", 1, 1, 6], ["PR", 4, 0, "auto_unroll_max_step$512"]]]], "r": [[0.00118508, 0.00118494], 0, 4.14201, 1653080754], "v": "v0.6"}
{"i": [["[\"626fb653e298f4cd4434364b5f2ed39c\", [1024, 512], [1024, 512], [1, 1024], [1024, 1024]]", "cuda -keys=cuda,gpu -arch=sm_80 -max_num_threads=1024 -thread_warp_size=32", [-1, 16, 64, 49152, 2147483647, 1024, 8, 32], "", 0, []], [[], [["CI", 11], ["CI", 10], ["CI", 9], ["CI", 8], ["CI", 7], ["CI", 6], ["CI", 5], ["CI", 4], ["CHW", 2, "local"], ["SP", 2, 0, 1024, [8, 2, 2, 4], 1], ["SP", 2, 5, 1024, [1, 8, 1, 1], 1], ["SP", 2, 10, 512, [1, 2], 1], ["RE", 2, [0, 5, 1, 6, 2, 7, 10, 11, 3, 8, 12, 4, 9]], ["FSP", 3, 0, 9, 3], ["FSP", 3, 4, 10, 3], ["RE", 3, [0, 4, 1, 5, 2, 6, 3, 7]], ["CA", 2, 3, 5], ["CHR", 1, "shared", [2]], ["CA", 2, 3, 6], ["CHR", 0, "shared", [3]], ["CA", 1, 4, 6], ["FU", 15, [0, 1]], ["SP", 15, 0, 1048576, [32], 1], ["AN", 15, 0, 5], ["AN", 15, 1, 6], ["FU", 5, [0, 1]], ["AN", 5, 0, 5], ["FU", 5, [1, 2]], ["AN", 5, 1, 4], ["FU", 5, [2, 3]], ["AN", 5, 2, 6], ["FU", 3, [0, 1]], ["SP", 3, 0, 2, [1], 1], ["AN", 3, 1, 2], ["FFSP", 3, 0, [10, 9], 1, 1], ["AN", 3, 1, 6], ["FU", 1, [0, 1]], ["SP", 1, 0, 16, [1], 1], ["AN", 1, 1, 2], ["FFSP", 1, 0, [10, 9], 1, 1], ["AN", 1, 1, 6], ["PR", 4, 0, "auto_unroll_max_step$64"]]]], "r": [[0.000829195, 0.000829314], 0, 2.93045, 1653080756], "v": "v0.6"}
{"i": [["[\"626fb653e298f4cd4434364b5f2ed39c\", [1024, 512], [1024, 512], [1, 1024], [1024, 1024]]", "cuda -keys=cuda,gpu -arch=sm_80 -max_num_threads=1024 -thread_warp_size=32", [-1, 16, 64, 49152, 2147483647, 1024, 8, 32], "", 0, []], [[], [["CI", 11], ["CI", 10], ["CI", 9], ["CI", 8], ["CI", 7], ["CI", 6], ["CI", 5], ["CI", 4], ["CHW", 2, "local"], ["SP", 2, 0, 1024, [1, 8, 4, 16], 1], ["SP", 2, 5, 1024, [1, 4, 8, 2], 1], ["SP", 2, 10, 512, [4, 4], 1], ["RE", 2, [0, 5, 1, 6, 2, 7, 10, 11, 3, 8, 12, 4, 9]], ["FSP", 3, 0, 9, 3], ["FSP", 3, 4, 10, 3], ["RE", 3, [0, 4, 1, 5, 2, 6, 3, 7]], ["CA", 2, 3, 5], ["CHR", 1, "shared", [2]], ["CA", 2, 3, 6], ["CHR", 0, "shared", [3]], ["CA", 1, 4, 6], ["FU", 15, [0, 1]], ["SP", 15, 0, 1048576, [32], 1], ["AN", 15, 0, 5], ["AN", 15, 1, 6], ["FU", 5, [0, 1]], ["AN", 5, 0, 5], ["FU", 5, [1, 2]], ["AN", 5, 1, 4], ["FU", 5, [2, 3]], ["AN", 5, 2, 6], ["FU", 3, [0, 1]], ["SP", 3, 0, 256, [64], 1], ["AN", 3, 1, 2], ["FFSP", 3, 0, [10, 9], 1, 1], ["AN", 3, 1, 6], ["FU", 1, [0, 1]], ["SP", 1, 0, 256, [1], 1], ["AN", 1, 1, 2], ["FFSP", 1, 0, [10, 9], 1, 1], ["AN", 1, 1, 6], ["PR", 4, 0, "auto_unroll_max_step$1024"]]]], "r": [[0.00252199, 0.00252164], 0, 15.9251, 1653080757], "v": "v0.6"}
{"i": [["[\"626fb653e298f4cd4434364b5f2ed39c\", [1024, 512], [1024, 512], [1, 1024], [1024, 1024]]", "cuda -keys=cuda,gpu -arch=sm_80 -max_num_threads=1024 -thread_warp_size=32", [-1, 16, 64, 49152, 2147483647, 1024, 8, 32], "", 0, []], [[], [["CI", 11], ["CI", 10], ["CI", 9], ["CI", 8], ["CI", 7], ["CI", 6], ["CI", 5], ["CI", 4], ["CHW", 2, "local"], ["SP", 2, 0, 1024, [1, 8, 1, 4], 1], ["SP", 2, 5, 1024, [2, 2, 1, 2], 1], ["SP", 2, 10, 512, [4, 4], 1], ["RE", 2, [0, 5, 1, 6, 2, 7, 10, 11, 3, 8, 12, 4, 9]], ["FSP", 3, 0, 9, 3], ["FSP", 3, 4, 10, 3], ["RE", 3, [0, 4, 1, 5, 2, 6, 3, 7]], ["CA", 2, 3, 5], ["CHR", 1, "shared", [2]], ["CA", 2, 3, 6], ["CHR", 0, "shared", [3]], ["CA", 1, 4, 6], ["FU", 15, [0, 1]], ["SP", 15, 0, 1048576, [32], 1], ["AN", 15, 0, 5], ["AN", 15, 1, 6], ["FU", 5, [0, 1]], ["AN", 5, 0, 5], ["FU", 5, [1, 2]], ["AN", 5, 1, 4], ["FU", 5, [2, 3]], ["AN", 5, 2, 6], ["FU", 3, [0, 1]], ["SP", 3, 0, 32, [1], 1], ["AN", 3, 1, 2], ["FFSP", 3, 0, [10, 9], 1, 1], ["AN", 3, 1, 6], ["FU", 1, [0, 1]], ["SP", 1, 0, 64, [1], 1], ["AN", 1, 1, 2], ["FFSP", 1, 0, [10, 9], 1, 1], ["AN", 1, 1, 6], ["PR", 4, 0, "auto_unroll_max_step$512"]]]], "r": [[0.000490563, 0.000490626], 0, 2.81588, 1653080758], "v": "v0.6"}
{"i": [["[\"626fb653e298f4cd4434364b5f2ed39c\", [1024, 512], [1024, 512], [1, 1024], [1024, 1024]]", "cuda -keys=cuda,gpu -arch=sm_80 -max_num_threads=1024 -thread_warp_size=32", [-1, 16, 64, 49152, 2147483647, 1024, 8, 32], "", 0, []], [[], [["CI", 11], ["CI", 10], ["CI", 9], ["CI", 8], ["CI", 7], ["CI", 6], ["CI", 5], ["CI", 4], ["CHW", 2, "local"], ["SP", 2, 0, 1024, [4, 16, 1, 8], 1], ["SP", 2, 5, 1024, [2, 2, 16, 1], 1], ["SP", 2, 10, 512, [1, 8], 1], ["RE", 2, [0, 5, 1, 6, 2, 7, 10, 11, 3, 8, 12, 4, 9]], ["FSP", 3, 0, 9, 3], ["FSP", 3, 4, 10, 3], ["RE", 3, [0, 4, 1, 5, 2, 6, 3, 7]], ["CA", 2, 3, 5], ["CHR", 1, "shared", [2]], ["CA", 2, 3, 6], ["CHR", 0, "shared", [3]], ["CA", 1, 4, 6], ["FU", 15, [0, 1]], ["SP", 15, 0, 1048576, [32], 1], ["AN", 15, 0, 5], ["AN", 15, 1, 6], ["FU", 5, [0, 1]], ["AN", 5, 0, 5], ["FU", 5, [1, 2]], ["AN", 5, 1, 4], ["FU", 5, [2, 3]], ["AN", 5, 2, 6], ["FU", 3, [0, 1]], ["SP", 3, 0, 32, [1], 1], ["AN", 3, 1, 2], ["FFSP", 3, 0, [10, 9], 1, 1], ["AN", 3, 1, 6], ["FU", 1, [0, 1]], ["SP", 1, 0, 16, [1], 1], ["AN", 1, 1, 2], ["FFSP", 1, 0, [10, 9], 1, 1], ["AN", 1, 1, 6], ["PR", 4, 0, "auto_unroll_max_step$0"]]]], "r": [[0.00374434, 0.00374521], 0, 2.62247, 1653080759], "v": "v0.6"}
{"i": [["[\"626fb653e298f4cd4434364b5f2ed39c\", [1024, 512], [1024, 512], [1, 1024], [1024, 1024]]", "cuda -keys=cuda,gpu -arch=sm_80 -max_num_threads=1024 -thread_warp_size=32", [-1, 16, 64, 49152, 2147483647, 1024, 8, 32], "", 0, []], [[], [["CI", 11], ["CI", 10], ["CI", 9], ["CI", 8], ["CI", 7], ["CI", 6], ["CI", 5], ["CI", 4], ["CHW", 2, "local"], ["SP", 2, 0, 1024, [1, 32, 1, 8], 1], ["SP", 2, 5, 1024, [8, 8, 2, 1], 1], ["SP", 2, 10, 512, [1, 8], 1], ["RE", 2, [0, 5, 1, 6, 2, 7, 10, 11, 3, 8, 12, 4, 9]], ["FSP", 3, 0, 9, 3], ["FSP", 3, 4, 10, 3], ["RE", 3, [0, 4, 1, 5, 2, 6, 3, 7]], ["CA", 2, 3, 5], ["CHR", 1, "shared", [2]], ["CA", 2, 3, 6], ["CHR", 0, "shared", [3]], ["CA", 1, 4, 6], ["FU", 15, [0, 1]], ["SP", 15, 0, 1048576, [64], 1], ["AN", 15, 0, 5], ["AN", 15, 1, 6], ["FU", 5, [0, 1]], ["AN", 5, 0, 5], ["FU", 5, [1, 2]], ["AN", 5, 1, 4], ["FU", 5, [2, 3]], ["AN", 5, 2, 6], ["FU", 3, [0, 1]], ["SP", 3, 0, 16, [1], 1], ["AN", 3, 1, 2], ["FFSP", 3, 0, [10, 9], 1, 1], ["AN", 3, 1, 6], ["FU", 1, [0, 1]], ["SP", 1, 0, 64, [1], 1], ["AN", 1, 1, 2], ["FFSP", 1, 0, [10, 9], 1, 1], ["AN", 1, 1, 6], ["PR", 4, 0, "auto_unroll_max_step$16"]]]], "r": [[0.000818209, 0.000818289], 0, 2.65587, 1653080761], "v": "v0.6"}
{"i": [["[\"626fb653e298f4cd4434364b5f2ed39c\", [1024, 512], [1024, 512], [1, 1024], [1024, 1024]]", "cuda -keys=cuda,gpu -arch=sm_80 -max_num_threads=1024 -thread_warp_size=32", [-1, 16, 64, 49152, 2147483647, 1024, 8, 32], "", 0, []], [[], [["CI", 11], ["CI", 10], ["CI", 9], ["CI", 8], ["CI", 7], ["CI", 6], ["CI", 5], ["CI", 4], ["CHW", 2, "local"], ["SP", 2, 0, 1024, [2, 64, 1, 1], 1], ["SP", 2, 5, 1024, [1, 4, 32, 4], 1], ["SP", 2, 10, 512, [1, 8], 1], ["RE", 2, [0, 5, 1, 6, 2, 7, 10, 11, 3, 8, 12, 4, 9]], ["FSP", 3, 0, 9, 3], ["FSP", 3, 4, 10, 3], ["RE", 3, [0, 4, 1, 5, 2, 6, 3, 7]], ["CA", 2, 3, 5], ["CHR", 1, "shared", [2]], ["CA", 2, 3, 6], ["CHR", 0, "shared", [3]], ["CA", 1, 4, 6], ["FU", 15, [0, 1]], ["SP", 15, 0, 1048576, [32], 1], ["AN", 15, 0, 5], ["AN", 15, 1, 6], ["FU", 5, [0, 1]], ["AN", 5, 0, 5], ["FU", 5, [1, 2]], ["AN", 5, 1, 4], ["FU", 5, [2, 3]], ["AN", 5, 2, 6], ["FU", 3, [0, 1]], ["SP", 3, 0, 1024, [1], 1], ["AN", 3, 1, 2], ["FFSP", 3, 0, [10, 9], 1, 1], ["AN", 3, 1, 6], ["FU", 1, [0, 1]], ["SP", 1, 0, 8, [1], 1], ["AN", 1, 1, 2], ["FFSP", 1, 0, [10, 9], 1, 1], ["AN", 1, 1, 6], ["PR", 4, 0, "auto_unroll_max_step$1024"]]]], "r": [[0.00352358, 0.00352371], 0, 2.84555, 1653080762], "v": "v0.6"}
