.cache/log/kernel_tune/NVIDIA_A100_80GB_PCIe/AdaptiveAvgPool2d_forward_input_0_28_64_32_32_output_0_28_64_1_1_output_size_1.json
{"i": [["[\"a95c963db640520084f903f0a5df1d3a\", [28, 64, 32, 32], [28, 64, 1, 1]]", "cuda -keys=cuda,gpu -arch=sm_80 -max_num_threads=1024 -thread_warp_size=32", [-1, 16, 64, 49152, 2147483647, 1024, 8, 32], "", 0, []], [[], [["FU", 2, [0, 1, 2, 3]], ["SP", 2, 0, 1792, [2], 1], ["AN", 2, 0, 5], ["AN", 2, 1, 6], ["FU", 1, [0, 1, 2, 3]], ["SP", 1, 0, 1792, [1], 1], ["AN", 1, 0, 5], ["AN", 1, 1, 6], ["PR", 1, 0, "auto_unroll_max_step$16"]]]], "r": [[2.70522e-05, 2.70582e-05, 2.7057e-05, 2.70652e-05], 0, 3.12365, 1664816765], "v": "v0.6"}
{"i": [["[\"a95c963db640520084f903f0a5df1d3a\", [28, 64, 32, 32], [28, 64, 1, 1]]", "cuda -keys=cuda,gpu -arch=sm_80 -max_num_threads=1024 -thread_warp_size=32", [-1, 16, 64, 49152, 2147483647, 1024, 8, 32], "", 0, []], [[], [["FU", 2, [0, 1, 2, 3]], ["SP", 2, 0, 1792, [4], 1], ["AN", 2, 0, 5], ["AN", 2, 1, 6], ["FU", 1, [0, 1, 2, 3]], ["SP", 1, 0, 1792, [4], 1], ["AN", 1, 0, 5], ["AN", 1, 1, 6], ["PR", 1, 0, "auto_unroll_max_step$512"]]]], "r": [[3.25697e-05, 3.25762e-05, 3.25652e-05, 3.25579e-05], 0, 3.34634, 1664816768], "v": "v0.6"}
{"i": [["[\"a95c963db640520084f903f0a5df1d3a\", [28, 64, 32, 32], [28, 64, 1, 1]]", "cuda -keys=cuda,gpu -arch=sm_80 -max_num_threads=1024 -thread_warp_size=32", [-1, 16, 64, 49152, 2147483647, 1024, 8, 32], "", 0, []], [[], [["FU", 2, [0, 1, 2, 3]], ["SP", 2, 0, 1792, [1], 1], ["AN", 2, 0, 5], ["AN", 2, 1, 6], ["FU", 1, [0, 1, 2, 3]], ["SP", 1, 0, 1792, [64], 1], ["AN", 1, 0, 5], ["AN", 1, 1, 6], ["PR", 1, 0, "auto_unroll_max_step$1024"]]]], "r": [[5.52102e-05, 5.52099e-05, 5.52069e-05, 5.521e-05], 0, 3.27821, 1664816770], "v": "v0.6"}
{"i": [["[\"a95c963db640520084f903f0a5df1d3a\", [28, 64, 32, 32], [28, 64, 1, 1]]", "cuda -keys=cuda,gpu -arch=sm_80 -max_num_threads=1024 -thread_warp_size=32", [-1, 16, 64, 49152, 2147483647, 1024, 8, 32], "", 0, []], [[], [["FU", 2, [0, 1, 2, 3]], ["SP", 2, 0, 1792, [2], 1], ["AN", 2, 0, 5], ["AN", 2, 1, 6], ["FU", 1, [0, 1, 2, 3]], ["SP", 1, 0, 1792, [8], 1], ["AN", 1, 0, 5], ["AN", 1, 1, 6], ["PR", 1, 0, "auto_unroll_max_step$16"]]]], "r": [[2.6085e-05, 2.60833e-05, 2.60857e-05, 2.60824e-05], 0, 3.01504, 1664816773], "v": "v0.6"}
{"i": [["[\"a95c963db640520084f903f0a5df1d3a\", [28, 64, 32, 32], [28, 64, 1, 1]]", "cuda -keys=cuda,gpu -arch=sm_80 -max_num_threads=1024 -thread_warp_size=32", [-1, 16, 64, 49152, 2147483647, 1024, 8, 32], "", 0, []], [[], [["FU", 2, [0, 1, 2, 3]], ["SP", 2, 0, 1792, [2], 1], ["AN", 2, 0, 5], ["AN", 2, 1, 6], ["FU", 1, [0, 1, 2, 3]], ["SP", 1, 0, 1792, [8], 1], ["AN", 1, 0, 5], ["AN", 1, 1, 6], ["PR", 1, 0, "auto_unroll_max_step$0"]]]], "r": [[2.59204e-05, 2.59261e-05, 2.59291e-05, 2.59256e-05], 0, 3.15431, 1664816775], "v": "v0.6"}
{"i": [["[\"a95c963db640520084f903f0a5df1d3a\", [28, 64, 32, 32], [28, 64, 1, 1]]", "cuda -keys=cuda,gpu -arch=sm_80 -max_num_threads=1024 -thread_warp_size=32", [-1, 16, 64, 49152, 2147483647, 1024, 8, 32], "", 0, []], [[], [["FU", 2, [0, 1, 2, 3]], ["SP", 2, 0, 1792, [4], 1], ["AN", 2, 0, 5], ["AN", 2, 1, 6], ["FU", 1, [0, 1, 2, 3]], ["SP", 1, 0, 1792, [16], 1], ["AN", 1, 0, 5], ["AN", 1, 1, 6], ["PR", 1, 0, "auto_unroll_max_step$512"]]]], "r": [[3.10592e-05, 3.10586e-05, 3.10603e-05, 3.10601e-05], 0, 3.13099, 1664816778], "v": "v0.6"}
{"i": [["[\"a95c963db640520084f903f0a5df1d3a\", [28, 64, 32, 32], [28, 64, 1, 1]]", "cuda -keys=cuda,gpu -arch=sm_80 -max_num_threads=1024 -thread_warp_size=32", [-1, 16, 64, 49152, 2147483647, 1024, 8, 32], "", 0, []], [[], [["FU", 2, [0, 1, 2, 3]], ["SP", 2, 0, 1792, [4], 1], ["AN", 2, 0, 5], ["AN", 2, 1, 6], ["FU", 1, [0, 1, 2, 3]], ["SP", 1, 0, 1792, [4], 1], ["AN", 1, 0, 5], ["AN", 1, 1, 6], ["PR", 1, 0, "auto_unroll_max_step$64"]]]], "r": [[3.29035e-05, 3.29049e-05, 3.29386e-05, 3.29181e-05], 0, 3.24002, 1664816781], "v": "v0.6"}
{"i": [["[\"a95c963db640520084f903f0a5df1d3a\", [28, 64, 32, 32], [28, 64, 1, 1]]", "cuda -keys=cuda,gpu -arch=sm_80 -max_num_threads=1024 -thread_warp_size=32", [-1, 16, 64, 49152, 2147483647, 1024, 8, 32], "", 0, []], [[], [["FU", 2, [0, 1, 2, 3]], ["SP", 2, 0, 1792, [1], 1], ["AN", 2, 0, 5], ["AN", 2, 1, 6], ["FU", 1, [0, 1, 2, 3]], ["SP", 1, 0, 1792, [8], 1], ["AN", 1, 0, 5], ["AN", 1, 1, 6], ["PR", 1, 0, "auto_unroll_max_step$1024"]]]], "r": [[2.69456e-05, 2.6945e-05, 2.69459e-05, 2.69424e-05], 0, 3.08949, 1664816783], "v": "v0.6"}
{"i": [["[\"a95c963db640520084f903f0a5df1d3a\", [28, 64, 32, 32], [28, 64, 1, 1]]", "cuda -keys=cuda,gpu -arch=sm_80 -max_num_threads=1024 -thread_warp_size=32", [-1, 16, 64, 49152, 2147483647, 1024, 8, 32], "", 0, []], [[], [["FU", 2, [0, 1, 2, 3]], ["SP", 2, 0, 1792, [32], 1], ["AN", 2, 0, 5], ["AN", 2, 1, 6], ["FU", 1, [0, 1, 2, 3]], ["SP", 1, 0, 1792, [32], 1], ["AN", 1, 0, 5], ["AN", 1, 1, 6], ["PR", 1, 0, "auto_unroll_max_step$1024"]]]], "r": [[3.76433e-05, 3.76434e-05, 3.76439e-05, 3.76439e-05], 0, 3.07011, 1664816786], "v": "v0.6"}
{"i": [["[\"a95c963db640520084f903f0a5df1d3a\", [28, 64, 32, 32], [28, 64, 1, 1]]", "cuda -keys=cuda,gpu -arch=sm_80 -max_num_threads=1024 -thread_warp_size=32", [-1, 16, 64, 49152, 2147483647, 1024, 8, 32], "", 0, []], [[], [["FU", 2, [0, 1, 2, 3]], ["SP", 2, 0, 1792, [2], 1], ["AN", 2, 0, 5], ["AN", 2, 1, 6], ["FU", 1, [0, 1, 2, 3]], ["SP", 1, 0, 1792, [16], 1], ["AN", 1, 0, 5], ["AN", 1, 1, 6], ["PR", 1, 0, "auto_unroll_max_step$0"]]]], "r": [[3.09986e-05, 3.09951e-05, 3.09926e-05, 3.09941e-05], 0, 3.00584, 1664816788], "v": "v0.6"}
{"i": [["[\"a95c963db640520084f903f0a5df1d3a\", [28, 64, 32, 32], [28, 64, 1, 1]]", "cuda -keys=cuda,gpu -arch=sm_80 -max_num_threads=1024 -thread_warp_size=32", [-1, 16, 64, 49152, 2147483647, 1024, 8, 32], "", 0, []], [[], [["FU", 2, [0, 1, 2, 3]], ["SP", 2, 0, 1792, [8], 1], ["AN", 2, 0, 5], ["AN", 2, 1, 6], ["FU", 1, [0, 1, 2, 3]], ["SP", 1, 0, 1792, [2], 1], ["AN", 1, 0, 5], ["AN", 1, 1, 6], ["PR", 1, 0, "auto_unroll_max_step$16"]]]], "r": [[2.24836e-05, 2.24819e-05, 2.24844e-05, 2.24786e-05], 0, 3.02792, 1664816791], "v": "v0.6"}
{"i": [["[\"a95c963db640520084f903f0a5df1d3a\", [28, 64, 32, 32], [28, 64, 1, 1]]", "cuda -keys=cuda,gpu -arch=sm_80 -max_num_threads=1024 -thread_warp_size=32", [-1, 16, 64, 49152, 2147483647, 1024, 8, 32], "", 0, []], [[], [["FU", 2, [0, 1, 2, 3]], ["SP", 2, 0, 1792, [32], 1], ["AN", 2, 0, 5], ["AN", 2, 1, 6], ["FU", 1, [0, 1, 2, 3]], ["SP", 1, 0, 1792, [8], 1], ["AN", 1, 0, 5], ["AN", 1, 1, 6], ["PR", 1, 0, "auto_unroll_max_step$512"]]]], "r": [[2.55007e-05, 2.54922e-05, 2.54945e-05, 2.54954e-05], 0, 2.98258, 1664816793], "v": "v0.6"}
{"i": [["[\"a95c963db640520084f903f0a5df1d3a\", [28, 64, 32, 32], [28, 64, 1, 1]]", "cuda -keys=cuda,gpu -arch=sm_80 -max_num_threads=1024 -thread_warp_size=32", [-1, 16, 64, 49152, 2147483647, 1024, 8, 32], "", 0, []], [[], [["FU", 2, [0, 1, 2, 3]], ["SP", 2, 0, 1792, [2], 1], ["AN", 2, 0, 5], ["AN", 2, 1, 6], ["FU", 1, [0, 1, 2, 3]], ["SP", 1, 0, 1792, [32], 1], ["AN", 1, 0, 5], ["AN", 1, 1, 6], ["PR", 1, 0, "auto_unroll_max_step$1024"]]]], "r": [[3.8477e-05, 3.84793e-05, 3.84731e-05, 3.84661e-05], 0, 3.25877, 1664816796], "v": "v0.6"}
{"i": [["[\"a95c963db640520084f903f0a5df1d3a\", [28, 64, 32, 32], [28, 64, 1, 1]]", "cuda -keys=cuda,gpu -arch=sm_80 -max_num_threads=1024 -thread_warp_size=32", [-1, 16, 64, 49152, 2147483647, 1024, 8, 32], "", 0, []], [[], [["FU", 2, [0, 1, 2, 3]], ["SP", 2, 0, 1792, [16], 1], ["AN", 2, 0, 5], ["AN", 2, 1, 6], ["FU", 1, [0, 1, 2, 3]], ["SP", 1, 0, 1792, [4], 1], ["AN", 1, 0, 5], ["AN", 1, 1, 6], ["PR", 1, 0, "auto_unroll_max_step$16"]]]], "r": [[3.26565e-05, 3.2654e-05, 3.26439e-05, 3.26438e-05], 0, 3.04987, 1664816799], "v": "v0.6"}
{"i": [["[\"a95c963db640520084f903f0a5df1d3a\", [28, 64, 32, 32], [28, 64, 1, 1]]", "cuda -keys=cuda,gpu -arch=sm_80 -max_num_threads=1024 -thread_warp_size=32", [-1, 16, 64, 49152, 2147483647, 1024, 8, 32], "", 0, []], [[], [["FU", 2, [0, 1, 2, 3]], ["SP", 2, 0, 1792, [1], 1], ["AN", 2, 0, 5], ["AN", 2, 1, 6], ["FU", 1, [0, 1, 2, 3]], ["SP", 1, 0, 1792, [8], 1], ["AN", 1, 0, 5], ["AN", 1, 1, 6], ["PR", 1, 0, "auto_unroll_max_step$16"]]]], "r": [[2.6635e-05, 2.66338e-05, 2.66302e-05, 2.66401e-05], 0, 2.99, 1664816801], "v": "v0.6"}
{"i": [["[\"a95c963db640520084f903f0a5df1d3a\", [28, 64, 32, 32], [28, 64, 1, 1]]", "cuda -keys=cuda,gpu -arch=sm_80 -max_num_threads=1024 -thread_warp_size=32", [-1, 16, 64, 49152, 2147483647, 1024, 8, 32], "", 0, []], [[], [["FU", 2, [0, 1, 2, 3]], ["SP", 2, 0, 1792, [64], 1], ["AN", 2, 0, 5], ["AN", 2, 1, 6], ["FU", 1, [0, 1, 2, 3]], ["SP", 1, 0, 1792, [8], 1], ["AN", 1, 0, 5], ["AN", 1, 1, 6], ["PR", 1, 0, "auto_unroll_max_step$0"]]]], "r": [[2.5472e-05, 2.54756e-05, 2.54809e-05, 2.54948e-05], 0, 2.92442, 1664816804], "v": "v0.6"}
{"i": [["[\"a95c963db640520084f903f0a5df1d3a\", [28, 64, 32, 32], [28, 64, 1, 1]]", "cuda -keys=cuda,gpu -arch=sm_80 -max_num_threads=1024 -thread_warp_size=32", [-1, 16, 64, 49152, 2147483647, 1024, 8, 32], "", 0, []], [[], [["FU", 2, [0, 1, 2, 3]], ["SP", 2, 0, 1792, [2], 1], ["AN", 2, 0, 5], ["AN", 2, 1, 6], ["FU", 1, [0, 1, 2, 3]], ["SP", 1, 0, 1792, [32], 1], ["AN", 1, 0, 5], ["AN", 1, 1, 6], ["PR", 1, 0, "auto_unroll_max_step$512"]]]], "r": [[3.85542e-05, 3.85504e-05, 3.85568e-05, 3.85493e-05], 0, 3.08481, 1664816806], "v": "v0.6"}
{"i": [["[\"a95c963db640520084f903f0a5df1d3a\", [28, 64, 32, 32], [28, 64, 1, 1]]", "cuda -keys=cuda,gpu -arch=sm_80 -max_num_threads=1024 -thread_warp_size=32", [-1, 16, 64, 49152, 2147483647, 1024, 8, 32], "", 0, []], [[], [["FU", 2, [0, 1, 2, 3]], ["SP", 2, 0, 1792, [32], 1], ["AN", 2, 0, 5], ["AN", 2, 1, 6], ["FU", 1, [0, 1, 2, 3]], ["SP", 1, 0, 1792, [16], 1], ["AN", 1, 0, 5], ["AN", 1, 1, 6], ["PR", 1, 0, "auto_unroll_max_step$64"]]]], "r": [[3.04574e-05, 3.04545e-05, 3.04506e-05, 3.04541e-05], 0, 2.91085, 1664816809], "v": "v0.6"}
{"i": [["[\"a95c963db640520084f903f0a5df1d3a\", [28, 64, 32, 32], [28, 64, 1, 1]]", "cuda -keys=cuda,gpu -arch=sm_80 -max_num_threads=1024 -thread_warp_size=32", [-1, 16, 64, 49152, 2147483647, 1024, 8, 32], "", 0, []], [[], [["FU", 2, [0, 1, 2, 3]], ["SP", 2, 0, 1792, [56], 1], ["AN", 2, 0, 5], ["AN", 2, 1, 6], ["FU", 1, [0, 1, 2, 3]], ["SP", 1, 0, 1792, [32], 1], ["AN", 1, 0, 5], ["AN", 1, 1, 6], ["PR", 1, 0, "auto_unroll_max_step$16"]]]], "r": [[3.77097e-05, 3.77103e-05, 3.771e-05, 3.77099e-05], 0, 2.87075, 1664816811], "v": "v0.6"}
{"i": [["[\"a95c963db640520084f903f0a5df1d3a\", [28, 64, 32, 32], [28, 64, 1, 1]]", "cuda -keys=cuda,gpu -arch=sm_80 -max_num_threads=1024 -thread_warp_size=32", [-1, 16, 64, 49152, 2147483647, 1024, 8, 32], "", 0, []], [[], [["FU", 2, [0, 1, 2, 3]], ["SP", 2, 0, 1792, [8], 1], ["AN", 2, 0, 5], ["AN", 2, 1, 6], ["FU", 1, [0, 1, 2, 3]], ["SP", 1, 0, 1792, [64], 1], ["AN", 1, 0, 5], ["AN", 1, 1, 6], ["PR", 1, 0, "auto_unroll_max_step$512"]]]], "r": [[5.4029e-05, 5.40311e-05, 5.40288e-05, 5.40264e-05], 0, 2.89402, 1664816814], "v": "v0.6"}
{"i": [["[\"a95c963db640520084f903f0a5df1d3a\", [28, 64, 32, 32], [28, 64, 1, 1]]", "cuda -keys=cuda,gpu -arch=sm_80 -max_num_threads=1024 -thread_warp_size=32", [-1, 16, 64, 49152, 2147483647, 1024, 8, 32], "", 0, []], [[], [["FU", 2, [0, 1, 2, 3]], ["SP", 2, 0, 1792, [2], 1], ["AN", 2, 0, 5], ["AN", 2, 1, 6], ["FU", 1, [0, 1, 2, 3]], ["SP", 1, 0, 1792, [4], 1], ["AN", 1, 0, 5], ["AN", 1, 1, 6], ["PR", 1, 0, "auto_unroll_max_step$0"]]]], "r": [[3.32762e-05, 3.329e-05, 3.32927e-05, 3.326e-05], 0, 2.88917, 1664816817], "v": "v0.6"}
{"i": [["[\"a95c963db640520084f903f0a5df1d3a\", [28, 64, 32, 32], [28, 64, 1, 1]]", "cuda -keys=cuda,gpu -arch=sm_80 -max_num_threads=1024 -thread_warp_size=32", [-1, 16, 64, 49152, 2147483647, 1024, 8, 32], "", 0, []], [[], [["FU", 2, [0, 1, 2, 3]], ["SP", 2, 0, 1792, [1], 1], ["AN", 2, 0, 5], ["AN", 2, 1, 6], ["FU", 1, [0, 1, 2, 3]], ["SP", 1, 0, 1792, [4], 1], ["AN", 1, 0, 5], ["AN", 1, 1, 6], ["PR", 1, 0, "auto_unroll_max_step$512"]]]], "r": [[3.38023e-05, 3.38105e-05, 3.37979e-05, 3.3766e-05], 0, 2.84646, 1664816819], "v": "v0.6"}
{"i": [["[\"a95c963db640520084f903f0a5df1d3a\", [28, 64, 32, 32], [28, 64, 1, 1]]", "cuda -keys=cuda,gpu -arch=sm_80 -max_num_threads=1024 -thread_warp_size=32", [-1, 16, 64, 49152, 2147483647, 1024, 8, 32], "", 0, []], [[], [["FU", 2, [0, 1, 2, 3]], ["SP", 2, 0, 1792, [8], 1], ["AN", 2, 0, 5], ["AN", 2, 1, 6], ["FU", 1, [0, 1, 2, 3]], ["SP", 1, 0, 1792, [32], 1], ["AN", 1, 0, 5], ["AN", 1, 1, 6], ["PR", 1, 0, "auto_unroll_max_step$512"]]]], "r": [[3.78398e-05, 3.78453e-05, 3.78349e-05, 3.78342e-05], 0, 2.87359, 1664816822], "v": "v0.6"}
{"i": [["[\"a95c963db640520084f903f0a5df1d3a\", [28, 64, 32, 32], [28, 64, 1, 1]]", "cuda -keys=cuda,gpu -arch=sm_80 -max_num_threads=1024 -thread_warp_size=32", [-1, 16, 64, 49152, 2147483647, 1024, 8, 32], "", 0, []], [[], [["FU", 2, [0, 1, 2, 3]], ["SP", 2, 0, 1792, [64], 1], ["AN", 2, 0, 5], ["AN", 2, 1, 6], ["FU", 1, [0, 1, 2, 3]], ["SP", 1, 0, 1792, [64], 1], ["AN", 1, 0, 5], ["AN", 1, 1, 6], ["PR", 1, 0, "auto_unroll_max_step$16"]]]], "r": [[5.38565e-05, 5.38568e-05, 5.38569e-05, 5.38564e-05], 0, 2.93241, 1664816824], "v": "v0.6"}
{"i": [["[\"a95c963db640520084f903f0a5df1d3a\", [28, 64, 32, 32], [28, 64, 1, 1]]", "cuda -keys=cuda,gpu -arch=sm_80 -max_num_threads=1024 -thread_warp_size=32", [-1, 16, 64, 49152, 2147483647, 1024, 8, 32], "", 0, []], [[], [["FU", 2, [0, 1, 2, 3]], ["SP", 2, 0, 1792, [64], 1], ["AN", 2, 0, 5], ["AN", 2, 1, 6], ["FU", 1, [0, 1, 2, 3]], ["SP", 1, 0, 1792, [28], 1], ["AN", 1, 0, 5], ["AN", 1, 1, 6], ["PR", 1, 0, "auto_unroll_max_step$64"]]]], "r": [[3.68313e-05, 3.68284e-05, 3.68302e-05, 3.68303e-05], 0, 3.06879, 1664816827], "v": "v0.6"}
{"i": [["[\"a95c963db640520084f903f0a5df1d3a\", [28, 64, 32, 32], [28, 64, 1, 1]]", "cuda -keys=cuda,gpu -arch=sm_80 -max_num_threads=1024 -thread_warp_size=32", [-1, 16, 64, 49152, 2147483647, 1024, 8, 32], "", 0, []], [[], [["FU", 2, [0, 1, 2, 3]], ["SP", 2, 0, 1792, [16], 1], ["AN", 2, 0, 5], ["AN", 2, 1, 6], ["FU", 1, [0, 1, 2, 3]], ["SP", 1, 0, 1792, [28], 1], ["AN", 1, 0, 5], ["AN", 1, 1, 6], ["PR", 1, 0, "auto_unroll_max_step$16"]]]], "r": [[3.72239e-05, 3.72182e-05, 3.72219e-05, 3.7242e-05], 0, 3.16902, 1664816830], "v": "v0.6"}
{"i": [["[\"a95c963db640520084f903f0a5df1d3a\", [28, 64, 32, 32], [28, 64, 1, 1]]", "cuda -keys=cuda,gpu -arch=sm_80 -max_num_threads=1024 -thread_warp_size=32", [-1, 16, 64, 49152, 2147483647, 1024, 8, 32], "", 0, []], [[], [["FU", 2, [0, 1, 2, 3]], ["SP", 2, 0, 1792, [32], 1], ["AN", 2, 0, 5], ["AN", 2, 1, 6], ["FU", 1, [0, 1, 2, 3]], ["SP", 1, 0, 1792, [16], 1], ["AN", 1, 0, 5], ["AN", 1, 1, 6], ["PR", 1, 0, "auto_unroll_max_step$512"]]]], "r": [[3.06581e-05, 3.06587e-05, 3.06572e-05, 3.06583e-05], 0, 3.06923, 1664816832], "v": "v0.6"}
{"i": [["[\"a95c963db640520084f903f0a5df1d3a\", [28, 64, 32, 32], [28, 64, 1, 1]]", "cuda -keys=cuda,gpu -arch=sm_80 -max_num_threads=1024 -thread_warp_size=32", [-1, 16, 64, 49152, 2147483647, 1024, 8, 32], "", 0, []], [[], [["FU", 2, [0, 1, 2, 3]], ["SP", 2, 0, 1792, [16], 1], ["AN", 2, 0, 5], ["AN", 2, 1, 6], ["FU", 1, [0, 1, 2, 3]], ["SP", 1, 0, 1792, [32], 1], ["AN", 1, 0, 5], ["AN", 1, 1, 6], ["PR", 1, 0, "auto_unroll_max_step$64"]]]], "r": [[3.78158e-05, 3.77977e-05, 3.78198e-05, 3.78215e-05], 0, 3.02333, 1664816835], "v": "v0.6"}
{"i": [["[\"a95c963db640520084f903f0a5df1d3a\", [28, 64, 32, 32], [28, 64, 1, 1]]", "cuda -keys=cuda,gpu -arch=sm_80 -max_num_threads=1024 -thread_warp_size=32", [-1, 16, 64, 49152, 2147483647, 1024, 8, 32], "", 0, []], [[], [["FU", 2, [0, 1, 2, 3]], ["SP", 2, 0, 1792, [64], 1], ["AN", 2, 0, 5], ["AN", 2, 1, 6], ["FU", 1, [0, 1, 2, 3]], ["SP", 1, 0, 1792, [4], 1], ["AN", 1, 0, 5], ["AN", 1, 1, 6], ["PR", 1, 0, "auto_unroll_max_step$0"]]]], "r": [[3.26513e-05, 3.26169e-05, 3.26481e-05, 3.2648e-05], 0, 3.09538, 1664816837], "v": "v0.6"}
{"i": [["[\"a95c963db640520084f903f0a5df1d3a\", [28, 64, 32, 32], [28, 64, 1, 1]]", "cuda -keys=cuda,gpu -arch=sm_80 -max_num_threads=1024 -thread_warp_size=32", [-1, 16, 64, 49152, 2147483647, 1024, 8, 32], "", 0, []], [[], [["FU", 2, [0, 1, 2, 3]], ["SP", 2, 0, 1792, [32], 1], ["AN", 2, 0, 5], ["AN", 2, 1, 6], ["FU", 1, [0, 1, 2, 3]], ["SP", 1, 0, 1792, [32], 1], ["AN", 1, 0, 5], ["AN", 1, 1, 6], ["PR", 1, 0, "auto_unroll_max_step$0"]]]], "r": [[3.76896e-05, 3.76919e-05, 3.76934e-05, 3.76942e-05], 0, 3.0858, 1664816840], "v": "v0.6"}
{"i": [["[\"a95c963db640520084f903f0a5df1d3a\", [28, 64, 32, 32], [28, 64, 1, 1]]", "cuda -keys=cuda,gpu -arch=sm_80 -max_num_threads=1024 -thread_warp_size=32", [-1, 16, 64, 49152, 2147483647, 1024, 8, 32], "", 0, []], [[], [["FU", 2, [0, 1, 2, 3]], ["SP", 2, 0, 1792, [8], 1], ["AN", 2, 0, 5], ["AN", 2, 1, 6], ["FU", 1, [0, 1, 2, 3]], ["SP", 1, 0, 1792, [32], 1], ["AN", 1, 0, 5], ["AN", 1, 1, 6], ["PR", 1, 0, "auto_unroll_max_step$16"]]]], "r": [[3.76977e-05, 3.76973e-05, 3.7696e-05, 3.76963e-05], 0, 3.1638, 1664816842], "v": "v0.6"}
{"i": [["[\"a95c963db640520084f903f0a5df1d3a\", [28, 64, 32, 32], [28, 64, 1, 1]]", "cuda -keys=cuda,gpu -arch=sm_80 -max_num_threads=1024 -thread_warp_size=32", [-1, 16, 64, 49152, 2147483647, 1024, 8, 32], "", 0, []], [[], [["FU", 2, [0, 1, 2, 3]], ["SP", 2, 0, 1792, [1], 1], ["AN", 2, 0, 5], ["AN", 2, 1, 6], ["FU", 1, [0, 1, 2, 3]], ["SP", 1, 0, 1792, [32], 1], ["AN", 1, 0, 5], ["AN", 1, 1, 6], ["PR", 1, 0, "auto_unroll_max_step$16"]]]], "r": [[3.93139e-05, 3.93092e-05, 3.93132e-05, 3.93055e-05], 0, 3.10835, 1664816845], "v": "v0.6"}
{"i": [["[\"a95c963db640520084f903f0a5df1d3a\", [28, 64, 32, 32], [28, 64, 1, 1]]", "cuda -keys=cuda,gpu -arch=sm_80 -max_num_threads=1024 -thread_warp_size=32", [-1, 16, 64, 49152, 2147483647, 1024, 8, 32], "", 0, []], [[], [["FU", 2, [0, 1, 2, 3]], ["SP", 2, 0, 1792, [32], 1], ["AN", 2, 0, 5], ["AN", 2, 1, 6], ["FU", 1, [0, 1, 2, 3]], ["SP", 1, 0, 1792, [56], 1], ["AN", 1, 0, 5], ["AN", 1, 1, 6], ["PR", 1, 0, "auto_unroll_max_step$0"]]]], "r": [[5.01225e-05, 5.01211e-05, 5.01247e-05, 5.01398e-05], 0, 3.113, 1664816848], "v": "v0.6"}
{"i": [["[\"a95c963db640520084f903f0a5df1d3a\", [28, 64, 32, 32], [28, 64, 1, 1]]", "cuda -keys=cuda,gpu -arch=sm_80 -max_num_threads=1024 -thread_warp_size=32", [-1, 16, 64, 49152, 2147483647, 1024, 8, 32], "", 0, []], [[], [["FU", 2, [0, 1, 2, 3]], ["SP", 2, 0, 1792, [16], 1], ["AN", 2, 0, 5], ["AN", 2, 1, 6], ["FU", 1, [0, 1, 2, 3]], ["SP", 1, 0, 1792, [64], 1], ["AN", 1, 0, 5], ["AN", 1, 1, 6], ["PR", 1, 0, "auto_unroll_max_step$0"]]]], "r": [[5.42584e-05, 5.4256e-05, 5.42602e-05, 5.4265e-05], 0, 3.05989, 1664816850], "v": "v0.6"}
{"i": [["[\"a95c963db640520084f903f0a5df1d3a\", [28, 64, 32, 32], [28, 64, 1, 1]]", "cuda -keys=cuda,gpu -arch=sm_80 -max_num_threads=1024 -thread_warp_size=32", [-1, 16, 64, 49152, 2147483647, 1024, 8, 32], "", 0, []], [[], [["FU", 2, [0, 1, 2, 3]], ["SP", 2, 0, 1792, [1], 1], ["AN", 2, 0, 5], ["AN", 2, 1, 6], ["FU", 1, [0, 1, 2, 3]], ["SP", 1, 0, 1792, [1], 1], ["AN", 1, 0, 5], ["AN", 1, 1, 6], ["PR", 1, 0, "auto_unroll_max_step$512"]]]], "r": [[2.75928e-05, 2.75929e-05, 2.75913e-05, 2.75925e-05], 0, 2.7166, 1664816853], "v": "v0.6"}
{"i": [["[\"a95c963db640520084f903f0a5df1d3a\", [28, 64, 32, 32], [28, 64, 1, 1]]", "cuda -keys=cuda,gpu -arch=sm_80 -max_num_threads=1024 -thread_warp_size=32", [-1, 16, 64, 49152, 2147483647, 1024, 8, 32], "", 0, []], [[], [["FU", 2, [0, 1, 2, 3]], ["SP", 2, 0, 1792, [4], 1], ["AN", 2, 0, 5], ["AN", 2, 1, 6], ["FU", 1, [0, 1, 2, 3]], ["SP", 1, 0, 1792, [2], 1], ["AN", 1, 0, 5], ["AN", 1, 1, 6], ["PR", 1, 0, "auto_unroll_max_step$64"]]]], "r": [[2.27198e-05, 2.27153e-05, 2.271e-05, 2.27248e-05], 0, 2.86339, 1664816855], "v": "v0.6"}
{"i": [["[\"a95c963db640520084f903f0a5df1d3a\", [28, 64, 32, 32], [28, 64, 1, 1]]", "cuda -keys=cuda,gpu -arch=sm_80 -max_num_threads=1024 -thread_warp_size=32", [-1, 16, 64, 49152, 2147483647, 1024, 8, 32], "", 0, []], [[], [["FU", 2, [0, 1, 2, 3]], ["SP", 2, 0, 1792, [4], 1], ["AN", 2, 0, 5], ["AN", 2, 1, 6], ["FU", 1, [0, 1, 2, 3]], ["SP", 1, 0, 1792, [1], 1], ["AN", 1, 0, 5], ["AN", 1, 1, 6], ["PR", 1, 0, "auto_unroll_max_step$16"]]]], "r": [[2.67853e-05, 2.67847e-05, 2.67835e-05, 2.67758e-05], 0, 2.83463, 1664816858], "v": "v0.6"}
{"i": [["[\"a95c963db640520084f903f0a5df1d3a\", [28, 64, 32, 32], [28, 64, 1, 1]]", "cuda -keys=cuda,gpu -arch=sm_80 -max_num_threads=1024 -thread_warp_size=32", [-1, 16, 64, 49152, 2147483647, 1024, 8, 32], "", 0, []], [[], [["FU", 2, [0, 1, 2, 3]], ["SP", 2, 0, 1792, [64], 1], ["AN", 2, 0, 5], ["AN", 2, 1, 6], ["FU", 1, [0, 1, 2, 3]], ["SP", 1, 0, 1792, [14], 1], ["AN", 1, 0, 5], ["AN", 1, 1, 6], ["PR", 1, 0, "auto_unroll_max_step$16"]]]], "r": [[2.94492e-05, 2.9477e-05, 2.94554e-05, 2.9451e-05], 0, 2.93076, 1664816860], "v": "v0.6"}
{"i": [["[\"a95c963db640520084f903f0a5df1d3a\", [28, 64, 32, 32], [28, 64, 1, 1]]", "cuda -keys=cuda,gpu -arch=sm_80 -max_num_threads=1024 -thread_warp_size=32", [-1, 16, 64, 49152, 2147483647, 1024, 8, 32], "", 0, []], [[], [["FU", 2, [0, 1, 2, 3]], ["SP", 2, 0, 1792, [1], 1], ["AN", 2, 0, 5], ["AN", 2, 1, 6], ["FU", 1, [0, 1, 2, 3]], ["SP", 1, 0, 1792, [16], 1], ["AN", 1, 0, 5], ["AN", 1, 1, 6], ["PR", 1, 0, "auto_unroll_max_step$16"]]]], "r": [[3.15909e-05, 3.15688e-05, 3.15658e-05, 3.15702e-05], 0, 2.95303, 1664816863], "v": "v0.6"}
{"i": [["[\"a95c963db640520084f903f0a5df1d3a\", [28, 64, 32, 32], [28, 64, 1, 1]]", "cuda -keys=cuda,gpu -arch=sm_80 -max_num_threads=1024 -thread_warp_size=32", [-1, 16, 64, 49152, 2147483647, 1024, 8, 32], "", 0, []], [[], [["FU", 2, [0, 1, 2, 3]], ["SP", 2, 0, 1792, [16], 1], ["AN", 2, 0, 5], ["AN", 2, 1, 6], ["FU", 1, [0, 1, 2, 3]], ["SP", 1, 0, 1792, [32], 1], ["AN", 1, 0, 5], ["AN", 1, 1, 6], ["PR", 1, 0, "auto_unroll_max_step$1024"]]]], "r": [[3.77686e-05, 3.77711e-05, 3.77692e-05, 3.77703e-05], 0, 2.93916, 1664816865], "v": "v0.6"}
{"i": [["[\"a95c963db640520084f903f0a5df1d3a\", [28, 64, 32, 32], [28, 64, 1, 1]]", "cuda -keys=cuda,gpu -arch=sm_80 -max_num_threads=1024 -thread_warp_size=32", [-1, 16, 64, 49152, 2147483647, 1024, 8, 32], "", 0, []], [[], [["FU", 2, [0, 1, 2, 3]], ["SP", 2, 0, 1792, [1], 1], ["AN", 2, 0, 5], ["AN", 2, 1, 6], ["FU", 1, [0, 1, 2, 3]], ["SP", 1, 0, 1792, [4], 1], ["AN", 1, 0, 5], ["AN", 1, 1, 6], ["PR", 1, 0, "auto_unroll_max_step$64"]]]], "r": [[3.37231e-05, 3.3721e-05, 3.37244e-05, 3.37228e-05], 0, 4.04157, 1664816869], "v": "v0.6"}
{"i": [["[\"a95c963db640520084f903f0a5df1d3a\", [28, 64, 32, 32], [28, 64, 1, 1]]", "cuda -keys=cuda,gpu -arch=sm_80 -max_num_threads=1024 -thread_warp_size=32", [-1, 16, 64, 49152, 2147483647, 1024, 8, 32], "", 0, []], [[], [["FU", 2, [0, 1, 2, 3]], ["SP", 2, 0, 1792, [64], 1], ["AN", 2, 0, 5], ["AN", 2, 1, 6], ["FU", 1, [0, 1, 2, 3]], ["SP", 1, 0, 1792, [8], 1], ["AN", 1, 0, 5], ["AN", 1, 1, 6], ["PR", 1, 0, "auto_unroll_max_step$16"]]]], "r": [[2.52845e-05, 2.52857e-05, 2.52925e-05, 2.53031e-05], 0, 2.90189, 1664816872], "v": "v0.6"}
{"i": [["[\"a95c963db640520084f903f0a5df1d3a\", [28, 64, 32, 32], [28, 64, 1, 1]]", "cuda -keys=cuda,gpu -arch=sm_80 -max_num_threads=1024 -thread_warp_size=32", [-1, 16, 64, 49152, 2147483647, 1024, 8, 32], "", 0, []], [[], [["FU", 2, [0, 1, 2, 3]], ["SP", 2, 0, 1792, [2], 1], ["AN", 2, 0, 5], ["AN", 2, 1, 6], ["FU", 1, [0, 1, 2, 3]], ["SP", 1, 0, 1792, [32], 1], ["AN", 1, 0, 5], ["AN", 1, 1, 6], ["PR", 1, 0, "auto_unroll_max_step$0"]]]], "r": [[3.85367e-05, 3.85453e-05, 3.85271e-05, 3.84566e-05], 0, 2.87415, 1664816874], "v": "v0.6"}
{"i": [["[\"a95c963db640520084f903f0a5df1d3a\", [28, 64, 32, 32], [28, 64, 1, 1]]", "cuda -keys=cuda,gpu -arch=sm_80 -max_num_threads=1024 -thread_warp_size=32", [-1, 16, 64, 49152, 2147483647, 1024, 8, 32], "", 0, []], [[], [["FU", 2, [0, 1, 2, 3]], ["SP", 2, 0, 1792, [64], 1], ["AN", 2, 0, 5], ["AN", 2, 1, 6], ["FU", 1, [0, 1, 2, 3]], ["SP", 1, 0, 1792, [8], 1], ["AN", 1, 0, 5], ["AN", 1, 1, 6], ["PR", 1, 0, "auto_unroll_max_step$1024"]]]], "r": [[2.54809e-05, 2.54806e-05, 2.54825e-05, 2.54817e-05], 0, 2.83407, 1664816877], "v": "v0.6"}
{"i": [["[\"a95c963db640520084f903f0a5df1d3a\", [28, 64, 32, 32], [28, 64, 1, 1]]", "cuda -keys=cuda,gpu -arch=sm_80 -max_num_threads=1024 -thread_warp_size=32", [-1, 16, 64, 49152, 2147483647, 1024, 8, 32], "", 0, []], [[], [["FU", 2, [0, 1, 2, 3]], ["SP", 2, 0, 1792, [1], 1], ["AN", 2, 0, 5], ["AN", 2, 1, 6], ["FU", 1, [0, 1, 2, 3]], ["SP", 1, 0, 1792, [16], 1], ["AN", 1, 0, 5], ["AN", 1, 1, 6], ["PR", 1, 0, "auto_unroll_max_step$1024"]]]], "r": [[3.17675e-05, 3.17675e-05, 3.1773e-05, 3.17922e-05], 0, 2.88523, 1664816879], "v": "v0.6"}
{"i": [["[\"a95c963db640520084f903f0a5df1d3a\", [28, 64, 32, 32], [28, 64, 1, 1]]", "cuda -keys=cuda,gpu -arch=sm_80 -max_num_threads=1024 -thread_warp_size=32", [-1, 16, 64, 49152, 2147483647, 1024, 8, 32], "", 0, []], [[], [["FU", 2, [0, 1, 2, 3]], ["SP", 2, 0, 1792, [64], 1], ["AN", 2, 0, 5], ["AN", 2, 1, 6], ["FU", 1, [0, 1, 2, 3]], ["SP", 1, 0, 1792, [4], 1], ["AN", 1, 0, 5], ["AN", 1, 1, 6], ["PR", 1, 0, "auto_unroll_max_step$64"]]]], "r": [[3.23404e-05, 3.2341e-05, 3.23411e-05, 3.23412e-05], 0, 2.84526, 1664816882], "v": "v0.6"}
{"i": [["[\"a95c963db640520084f903f0a5df1d3a\", [28, 64, 32, 32], [28, 64, 1, 1]]", "cuda -keys=cuda,gpu -arch=sm_80 -max_num_threads=1024 -thread_warp_size=32", [-1, 16, 64, 49152, 2147483647, 1024, 8, 32], "", 0, []], [[], [["FU", 2, [0, 1, 2, 3]], ["SP", 2, 0, 1792, [32], 1], ["AN", 2, 0, 5], ["AN", 2, 1, 6], ["FU", 1, [0, 1, 2, 3]], ["SP", 1, 0, 1792, [1], 1], ["AN", 1, 0, 5], ["AN", 1, 1, 6], ["PR", 1, 0, "auto_unroll_max_step$1024"]]]], "r": [[2.64945e-05, 2.64953e-05, 2.6495e-05, 2.64969e-05], 0, 2.80221, 1664816884], "v": "v0.6"}
{"i": [["[\"a95c963db640520084f903f0a5df1d3a\", [28, 64, 32, 32], [28, 64, 1, 1]]", "cuda -keys=cuda,gpu -arch=sm_80 -max_num_threads=1024 -thread_warp_size=32", [-1, 16, 64, 49152, 2147483647, 1024, 8, 32], "", 0, []], [[], [["FU", 2, [0, 1, 2, 3]], ["SP", 2, 0, 1792, [64], 1], ["AN", 2, 0, 5], ["AN", 2, 1, 6], ["FU", 1, [0, 1, 2, 3]], ["SP", 1, 0, 1792, [32], 1], ["AN", 1, 0, 5], ["AN", 1, 1, 6], ["PR", 1, 0, "auto_unroll_max_step$16"]]]], "r": [[3.79708e-05, 3.80013e-05, 3.79864e-05, 3.79925e-05], 0, 2.90531, 1664816887], "v": "v0.6"}
{"i": [["[\"a95c963db640520084f903f0a5df1d3a\", [28, 64, 32, 32], [28, 64, 1, 1]]", "cuda -keys=cuda,gpu -arch=sm_80 -max_num_threads=1024 -thread_warp_size=32", [-1, 16, 64, 49152, 2147483647, 1024, 8, 32], "", 0, []], [[], [["FU", 2, [0, 1, 2, 3]], ["SP", 2, 0, 1792, [4], 1], ["AN", 2, 0, 5], ["AN", 2, 1, 6], ["FU", 1, [0, 1, 2, 3]], ["SP", 1, 0, 1792, [4], 1], ["AN", 1, 0, 5], ["AN", 1, 1, 6], ["PR", 1, 0, "auto_unroll_max_step$1024"]]]], "r": [[3.29385e-05, 3.29423e-05, 3.29266e-05, 3.29395e-05], 0, 2.91674, 1664816892], "v": "v0.6"}
{"i": [["[\"a95c963db640520084f903f0a5df1d3a\", [28, 64, 32, 32], [28, 64, 1, 1]]", "cuda -keys=cuda,gpu -arch=sm_80 -max_num_threads=1024 -thread_warp_size=32", [-1, 16, 64, 49152, 2147483647, 1024, 8, 32], "", 0, []], [[], [["FU", 2, [0, 1, 2, 3]], ["SP", 2, 0, 1792, [56], 1], ["AN", 2, 0, 5], ["AN", 2, 1, 6], ["FU", 1, [0, 1, 2, 3]], ["SP", 1, 0, 1792, [8], 1], ["AN", 1, 0, 5], ["AN", 1, 1, 6], ["PR", 1, 0, "auto_unroll_max_step$512"]]]], "r": [[2.53039e-05, 2.53008e-05, 2.52988e-05, 2.53127e-05], 0, 3.11059, 1664816895], "v": "v0.6"}
{"i": [["[\"a95c963db640520084f903f0a5df1d3a\", [28, 64, 32, 32], [28, 64, 1, 1]]", "cuda -keys=cuda,gpu -arch=sm_80 -max_num_threads=1024 -thread_warp_size=32", [-1, 16, 64, 49152, 2147483647, 1024, 8, 32], "", 0, []], [[], [["FU", 2, [0, 1, 2, 3]], ["SP", 2, 0, 1792, [4], 1], ["AN", 2, 0, 5], ["AN", 2, 1, 6], ["FU", 1, [0, 1, 2, 3]], ["SP", 1, 0, 1792, [8], 1], ["AN", 1, 0, 5], ["AN", 1, 1, 6], ["PR", 1, 0, "auto_unroll_max_step$512"]]]], "r": [[2.53355e-05, 2.53346e-05, 2.53382e-05, 2.53437e-05], 0, 3.01778, 1664816897], "v": "v0.6"}
{"i": [["[\"a95c963db640520084f903f0a5df1d3a\", [28, 64, 32, 32], [28, 64, 1, 1]]", "cuda -keys=cuda,gpu -arch=sm_80 -max_num_threads=1024 -thread_warp_size=32", [-1, 16, 64, 49152, 2147483647, 1024, 8, 32], "", 0, []], [[], [["FU", 2, [0, 1, 2, 3]], ["SP", 2, 0, 1792, [56], 1], ["AN", 2, 0, 5], ["AN", 2, 1, 6], ["FU", 1, [0, 1, 2, 3]], ["SP", 1, 0, 1792, [8], 1], ["AN", 1, 0, 5], ["AN", 1, 1, 6], ["PR", 1, 0, "auto_unroll_max_step$0"]]]], "r": [[2.57278e-05, 2.57235e-05, 2.57248e-05, 2.57241e-05], 0, 3.01911, 1664816900], "v": "v0.6"}
{"i": [["[\"a95c963db640520084f903f0a5df1d3a\", [28, 64, 32, 32], [28, 64, 1, 1]]", "cuda -keys=cuda,gpu -arch=sm_80 -max_num_threads=1024 -thread_warp_size=32", [-1, 16, 64, 49152, 2147483647, 1024, 8, 32], "", 0, []], [[], [["FU", 2, [0, 1, 2, 3]], ["SP", 2, 0, 1792, [32], 1], ["AN", 2, 0, 5], ["AN", 2, 1, 6], ["FU", 1, [0, 1, 2, 3]], ["SP", 1, 0, 1792, [4], 1], ["AN", 1, 0, 5], ["AN", 1, 1, 6], ["PR", 1, 0, "auto_unroll_max_step$1024"]]]], "r": [[3.24964e-05, 3.24998e-05, 3.24917e-05, 3.24742e-05], 0, 3.03979, 1664816903], "v": "v0.6"}
{"i": [["[\"a95c963db640520084f903f0a5df1d3a\", [28, 64, 32, 32], [28, 64, 1, 1]]", "cuda -keys=cuda,gpu -arch=sm_80 -max_num_threads=1024 -thread_warp_size=32", [-1, 16, 64, 49152, 2147483647, 1024, 8, 32], "", 0, []], [[], [["FU", 2, [0, 1, 2, 3]], ["SP", 2, 0, 1792, [32], 1], ["AN", 2, 0, 5], ["AN", 2, 1, 6], ["FU", 1, [0, 1, 2, 3]], ["SP", 1, 0, 1792, [32], 1], ["AN", 1, 0, 5], ["AN", 1, 1, 6], ["PR", 1, 0, "auto_unroll_max_step$512"]]]], "r": [[3.76726e-05, 3.76764e-05, 3.76212e-05, 3.76184e-05], 0, 3.06659, 1664816905], "v": "v0.6"}
{"i": [["[\"a95c963db640520084f903f0a5df1d3a\", [28, 64, 32, 32], [28, 64, 1, 1]]", "cuda -keys=cuda,gpu -arch=sm_80 -max_num_threads=1024 -thread_warp_size=32", [-1, 16, 64, 49152, 2147483647, 1024, 8, 32], "", 0, []], [[], [["FU", 2, [0, 1, 2, 3]], ["SP", 2, 0, 1792, [64], 1], ["AN", 2, 0, 5], ["AN", 2, 1, 6], ["FU", 1, [0, 1, 2, 3]], ["SP", 1, 0, 1792, [8], 1], ["AN", 1, 0, 5], ["AN", 1, 1, 6], ["PR", 1, 0, "auto_unroll_max_step$512"]]]], "r": [[2.54976e-05, 2.54897e-05, 2.54926e-05, 2.54899e-05], 0, 2.99099, 1664816908], "v": "v0.6"}
{"i": [["[\"a95c963db640520084f903f0a5df1d3a\", [28, 64, 32, 32], [28, 64, 1, 1]]", "cuda -keys=cuda,gpu -arch=sm_80 -max_num_threads=1024 -thread_warp_size=32", [-1, 16, 64, 49152, 2147483647, 1024, 8, 32], "", 0, []], [[], [["FU", 2, [0, 1, 2, 3]], ["SP", 2, 0, 1792, [64], 1], ["AN", 2, 0, 5], ["AN", 2, 1, 6], ["FU", 1, [0, 1, 2, 3]], ["SP", 1, 0, 1792, [64], 1], ["AN", 1, 0, 5], ["AN", 1, 1, 6], ["PR", 1, 0, "auto_unroll_max_step$0"]]]], "r": [[5.40126e-05, 5.40247e-05, 5.40417e-05, 5.40201e-05], 0, 2.94917, 1664816910], "v": "v0.6"}
{"i": [["[\"a95c963db640520084f903f0a5df1d3a\", [28, 64, 32, 32], [28, 64, 1, 1]]", "cuda -keys=cuda,gpu -arch=sm_80 -max_num_threads=1024 -thread_warp_size=32", [-1, 16, 64, 49152, 2147483647, 1024, 8, 32], "", 0, []], [[], [["FU", 2, [0, 1, 2, 3]], ["SP", 2, 0, 1792, [1], 1], ["AN", 2, 0, 5], ["AN", 2, 1, 6], ["FU", 1, [0, 1, 2, 3]], ["SP", 1, 0, 1792, [2], 1], ["AN", 1, 0, 5], ["AN", 1, 1, 6], ["PR", 1, 0, "auto_unroll_max_step$512"]]]], "r": [[2.36691e-05, 2.36549e-05, 2.36364e-05, 2.3625e-05], 0, 2.84002, 1664816913], "v": "v0.6"}
{"i": [["[\"a95c963db640520084f903f0a5df1d3a\", [28, 64, 32, 32], [28, 64, 1, 1]]", "cuda -keys=cuda,gpu -arch=sm_80 -max_num_threads=1024 -thread_warp_size=32", [-1, 16, 64, 49152, 2147483647, 1024, 8, 32], "", 0, []], [[], [["FU", 2, [0, 1, 2, 3]], ["SP", 2, 0, 1792, [8], 1], ["AN", 2, 0, 5], ["AN", 2, 1, 6], ["FU", 1, [0, 1, 2, 3]], ["SP", 1, 0, 1792, [8], 1], ["AN", 1, 0, 5], ["AN", 1, 1, 6], ["PR", 1, 0, "auto_unroll_max_step$1024"]]]], "r": [[2.53628e-05, 2.53642e-05, 2.53622e-05, 2.53648e-05], 0, 2.82857, 1664816915], "v": "v0.6"}
{"i": [["[\"a95c963db640520084f903f0a5df1d3a\", [28, 64, 32, 32], [28, 64, 1, 1]]", "cuda -keys=cuda,gpu -arch=sm_80 -max_num_threads=1024 -thread_warp_size=32", [-1, 16, 64, 49152, 2147483647, 1024, 8, 32], "", 0, []], [[], [["FU", 2, [0, 1, 2, 3]], ["SP", 2, 0, 1792, [8], 1], ["AN", 2, 0, 5], ["AN", 2, 1, 6], ["FU", 1, [0, 1, 2, 3]], ["SP", 1, 0, 1792, [16], 1], ["AN", 1, 0, 5], ["AN", 1, 1, 6], ["PR", 1, 0, "auto_unroll_max_step$0"]]]], "r": [[3.09043e-05, 3.0907e-05, 3.09763e-05, 3.09783e-05], 0, 2.88651, 1664816918], "v": "v0.6"}
{"i": [["[\"a95c963db640520084f903f0a5df1d3a\", [28, 64, 32, 32], [28, 64, 1, 1]]", "cuda -keys=cuda,gpu -arch=sm_80 -max_num_threads=1024 -thread_warp_size=32", [-1, 16, 64, 49152, 2147483647, 1024, 8, 32], "", 0, []], [[], [["FU", 2, [0, 1, 2, 3]], ["SP", 2, 0, 1792, [16], 1], ["AN", 2, 0, 5], ["AN", 2, 1, 6], ["FU", 1, [0, 1, 2, 3]], ["SP", 1, 0, 1792, [64], 1], ["AN", 1, 0, 5], ["AN", 1, 1, 6], ["PR", 1, 0, "auto_unroll_max_step$1024"]]]], "r": [[5.42558e-05, 5.42568e-05, 5.42581e-05, 5.42568e-05], 0, 2.93966, 1664816921], "v": "v0.6"}
{"i": [["[\"a95c963db640520084f903f0a5df1d3a\", [28, 64, 32, 32], [28, 64, 1, 1]]", "cuda -keys=cuda,gpu -arch=sm_80 -max_num_threads=1024 -thread_warp_size=32", [-1, 16, 64, 49152, 2147483647, 1024, 8, 32], "", 0, []], [[], [["FU", 2, [0, 1, 2, 3]], ["SP", 2, 0, 1792, [32], 1], ["AN", 2, 0, 5], ["AN", 2, 1, 6], ["FU", 1, [0, 1, 2, 3]], ["SP", 1, 0, 1792, [2], 1], ["AN", 1, 0, 5], ["AN", 1, 1, 6], ["PR", 1, 0, "auto_unroll_max_step$1024"]]]], "r": [[2.22478e-05, 2.22432e-05, 2.22478e-05, 2.22397e-05], 0, 2.79862, 1664816923], "v": "v0.6"}
{"i": [["[\"a95c963db640520084f903f0a5df1d3a\", [28, 64, 32, 32], [28, 64, 1, 1]]", "cuda -keys=cuda,gpu -arch=sm_80 -max_num_threads=1024 -thread_warp_size=32", [-1, 16, 64, 49152, 2147483647, 1024, 8, 32], "", 0, []], [[], [["FU", 2, [0, 1, 2, 3]], ["SP", 2, 0, 1792, [32], 1], ["AN", 2, 0, 5], ["AN", 2, 1, 6], ["FU", 1, [0, 1, 2, 3]], ["SP", 1, 0, 1792, [32], 1], ["AN", 1, 0, 5], ["AN", 1, 1, 6], ["PR", 1, 0, "auto_unroll_max_step$64"]]]], "r": [[3.76935e-05, 3.76709e-05, 3.76561e-05, 3.76415e-05], 0, 2.88989, 1664816926], "v": "v0.6"}
{"i": [["[\"a95c963db640520084f903f0a5df1d3a\", [28, 64, 32, 32], [28, 64, 1, 1]]", "cuda -keys=cuda,gpu -arch=sm_80 -max_num_threads=1024 -thread_warp_size=32", [-1, 16, 64, 49152, 2147483647, 1024, 8, 32], "", 0, []], [[], [["FU", 2, [0, 1, 2, 3]], ["SP", 2, 0, 1792, [32], 1], ["AN", 2, 0, 5], ["AN", 2, 1, 6], ["FU", 1, [0, 1, 2, 3]], ["SP", 1, 0, 1792, [32], 1], ["AN", 1, 0, 5], ["AN", 1, 1, 6], ["PR", 1, 0, "auto_unroll_max_step$16"]]]], "r": [[3.75526e-05, 3.75837e-05, 3.76152e-05, 3.77329e-05], 0, 2.77117, 1664816928], "v": "v0.6"}
{"i": [["[\"a95c963db640520084f903f0a5df1d3a\", [28, 64, 32, 32], [28, 64, 1, 1]]", "cuda -keys=cuda,gpu -arch=sm_80 -max_num_threads=1024 -thread_warp_size=32", [-1, 16, 64, 49152, 2147483647, 1024, 8, 32], "", 0, []], [[], [["FU", 2, [0, 1, 2, 3]], ["SP", 2, 0, 1792, [8], 1], ["AN", 2, 0, 5], ["AN", 2, 1, 6], ["FU", 1, [0, 1, 2, 3]], ["SP", 1, 0, 1792, [64], 1], ["AN", 1, 0, 5], ["AN", 1, 1, 6], ["PR", 1, 0, "auto_unroll_max_step$16"]]]], "r": [[5.43588e-05, 5.43474e-05, 5.43444e-05, 5.43416e-05], 0, 2.88342, 1664816931], "v": "v0.6"}
{"i": [["[\"a95c963db640520084f903f0a5df1d3a\", [28, 64, 32, 32], [28, 64, 1, 1]]", "cuda -keys=cuda,gpu -arch=sm_80 -max_num_threads=1024 -thread_warp_size=32", [-1, 16, 64, 49152, 2147483647, 1024, 8, 32], "", 0, []], [[], [["FU", 2, [0, 1, 2, 3]], ["SP", 2, 0, 1792, [16], 1], ["AN", 2, 0, 5], ["AN", 2, 1, 6], ["FU", 1, [0, 1, 2, 3]], ["SP", 1, 0, 1792, [8], 1], ["AN", 1, 0, 5], ["AN", 1, 1, 6], ["PR", 1, 0, "auto_unroll_max_step$16"]]]], "r": [[2.55715e-05, 2.55641e-05, 2.55517e-05, 2.5568e-05], 0, 3.28689, 1664816939], "v": "v0.6"}
{"i": [["[\"a95c963db640520084f903f0a5df1d3a\", [28, 64, 32, 32], [28, 64, 1, 1]]", "cuda -keys=cuda,gpu -arch=sm_80 -max_num_threads=1024 -thread_warp_size=32", [-1, 16, 64, 49152, 2147483647, 1024, 8, 32], "", 0, []], [[], [["FU", 2, [0, 1, 2, 3]], ["SP", 2, 0, 1792, [4], 1], ["AN", 2, 0, 5], ["AN", 2, 1, 6], ["FU", 1, [0, 1, 2, 3]], ["SP", 1, 0, 1792, [64], 1], ["AN", 1, 0, 5], ["AN", 1, 1, 6], ["PR", 1, 0, "auto_unroll_max_step$512"]]]], "r": [[5.44556e-05, 5.44552e-05, 5.44558e-05, 5.4478e-05], 0, 3.53683, 1664816941], "v": "v0.6"}
{"i": [["[\"a95c963db640520084f903f0a5df1d3a\", [28, 64, 32, 32], [28, 64, 1, 1]]", "cuda -keys=cuda,gpu -arch=sm_80 -max_num_threads=1024 -thread_warp_size=32", [-1, 16, 64, 49152, 2147483647, 1024, 8, 32], "", 0, []], [[], [["FU", 2, [0, 1, 2, 3]], ["SP", 2, 0, 1792, [8], 1], ["AN", 2, 0, 5], ["AN", 2, 1, 6], ["FU", 1, [0, 1, 2, 3]], ["SP", 1, 0, 1792, [28], 1], ["AN", 1, 0, 5], ["AN", 1, 1, 6], ["PR", 1, 0, "auto_unroll_max_step$64"]]]], "r": [[3.68125e-05, 3.68859e-05, 3.68204e-05, 3.68159e-05], 0, 3.32816, 1664816944], "v": "v0.6"}
{"i": [["[\"a95c963db640520084f903f0a5df1d3a\", [28, 64, 32, 32], [28, 64, 1, 1]]", "cuda -keys=cuda,gpu -arch=sm_80 -max_num_threads=1024 -thread_warp_size=32", [-1, 16, 64, 49152, 2147483647, 1024, 8, 32], "", 0, []], [[], [["FU", 2, [0, 1, 2, 3]], ["SP", 2, 0, 1792, [56], 1], ["AN", 2, 0, 5], ["AN", 2, 1, 6], ["FU", 1, [0, 1, 2, 3]], ["SP", 1, 0, 1792, [28], 1], ["AN", 1, 0, 5], ["AN", 1, 1, 6], ["PR", 1, 0, "auto_unroll_max_step$0"]]]], "r": [[3.67361e-05, 3.67389e-05, 3.67391e-05, 3.67399e-05], 0, 3.48897, 1664816947], "v": "v0.6"}
{"i": [["[\"a95c963db640520084f903f0a5df1d3a\", [28, 64, 32, 32], [28, 64, 1, 1]]", "cuda -keys=cuda,gpu -arch=sm_80 -max_num_threads=1024 -thread_warp_size=32", [-1, 16, 64, 49152, 2147483647, 1024, 8, 32], "", 0, []], [[], [["FU", 2, [0, 1, 2, 3]], ["SP", 2, 0, 1792, [56], 1], ["AN", 2, 0, 5], ["AN", 2, 1, 6], ["FU", 1, [0, 1, 2, 3]], ["SP", 1, 0, 1792, [7], 1], ["AN", 1, 0, 5], ["AN", 1, 1, 6], ["PR", 1, 0, "auto_unroll_max_step$16"]]]], "r": [[2.32577e-05, 2.32579e-05, 2.32578e-05, 2.32583e-05], 0, 3.53068, 1664816949], "v": "v0.6"}
{"i": [["[\"a95c963db640520084f903f0a5df1d3a\", [28, 64, 32, 32], [28, 64, 1, 1]]", "cuda -keys=cuda,gpu -arch=sm_80 -max_num_threads=1024 -thread_warp_size=32", [-1, 16, 64, 49152, 2147483647, 1024, 8, 32], "", 0, []], [[], [["FU", 2, [0, 1, 2, 3]], ["SP", 2, 0, 1792, [64], 1], ["AN", 2, 0, 5], ["AN", 2, 1, 6], ["FU", 1, [0, 1, 2, 3]], ["SP", 1, 0, 1792, [2], 1], ["AN", 1, 0, 5], ["AN", 1, 1, 6], ["PR", 1, 0, "auto_unroll_max_step$64"]]]], "r": [[2.24166e-05, 2.24109e-05, 2.24171e-05, 2.24177e-05], 0, 3.41912, 1664816952], "v": "v0.6"}
{"i": [["[\"a95c963db640520084f903f0a5df1d3a\", [28, 64, 32, 32], [28, 64, 1, 1]]", "cuda -keys=cuda,gpu -arch=sm_80 -max_num_threads=1024 -thread_warp_size=32", [-1, 16, 64, 49152, 2147483647, 1024, 8, 32], "", 0, []], [[], [["FU", 2, [0, 1, 2, 3]], ["SP", 2, 0, 1792, [2], 1], ["AN", 2, 0, 5], ["AN", 2, 1, 6], ["FU", 1, [0, 1, 2, 3]], ["SP", 1, 0, 1792, [28], 1], ["AN", 1, 0, 5], ["AN", 1, 1, 6], ["PR", 1, 0, "auto_unroll_max_step$0"]]]], "r": [[3.76377e-05, 3.76378e-05, 3.76333e-05, 3.76338e-05], 0, 3.31581, 1664816954], "v": "v0.6"}
{"i": [["[\"a95c963db640520084f903f0a5df1d3a\", [28, 64, 32, 32], [28, 64, 1, 1]]", "cuda -keys=cuda,gpu -arch=sm_80 -max_num_threads=1024 -thread_warp_size=32", [-1, 16, 64, 49152, 2147483647, 1024, 8, 32], "", 0, []], [[], [["FU", 2, [0, 1, 2, 3]], ["SP", 2, 0, 1792, [1], 1], ["AN", 2, 0, 5], ["AN", 2, 1, 6], ["FU", 1, [0, 1, 2, 3]], ["SP", 1, 0, 1792, [1], 1], ["AN", 1, 0, 5], ["AN", 1, 1, 6], ["PR", 1, 0, "auto_unroll_max_step$16"]]]], "r": [[2.76699e-05, 2.76673e-05, 2.76776e-05, 2.7673e-05], 0, 3.09113, 1664816957], "v": "v0.6"}
{"i": [["[\"a95c963db640520084f903f0a5df1d3a\", [28, 64, 32, 32], [28, 64, 1, 1]]", "cuda -keys=cuda,gpu -arch=sm_80 -max_num_threads=1024 -thread_warp_size=32", [-1, 16, 64, 49152, 2147483647, 1024, 8, 32], "", 0, []], [[], [["FU", 2, [0, 1, 2, 3]], ["SP", 2, 0, 1792, [64], 1], ["AN", 2, 0, 5], ["AN", 2, 1, 6], ["FU", 1, [0, 1, 2, 3]], ["SP", 1, 0, 1792, [1], 1], ["AN", 1, 0, 5], ["AN", 1, 1, 6], ["PR", 1, 0, "auto_unroll_max_step$16"]]]], "r": [[2.6527e-05, 2.65257e-05, 2.65206e-05, 2.65098e-05], 0, 2.98513, 1664816959], "v": "v0.6"}
{"i": [["[\"a95c963db640520084f903f0a5df1d3a\", [28, 64, 32, 32], [28, 64, 1, 1]]", "cuda -keys=cuda,gpu -arch=sm_80 -max_num_threads=1024 -thread_warp_size=32", [-1, 16, 64, 49152, 2147483647, 1024, 8, 32], "", 0, []], [[], [["FU", 2, [0, 1, 2, 3]], ["SP", 2, 0, 1792, [16], 1], ["AN", 2, 0, 5], ["AN", 2, 1, 6], ["FU", 1, [0, 1, 2, 3]], ["SP", 1, 0, 1792, [2], 1], ["AN", 1, 0, 5], ["AN", 1, 1, 6], ["PR", 1, 0, "auto_unroll_max_step$16"]]]], "r": [[2.20866e-05, 2.20848e-05, 2.20826e-05, 2.20821e-05], 0, 3.14734, 1664816962], "v": "v0.6"}
{"i": [["[\"a95c963db640520084f903f0a5df1d3a\", [28, 64, 32, 32], [28, 64, 1, 1]]", "cuda -keys=cuda,gpu -arch=sm_80 -max_num_threads=1024 -thread_warp_size=32", [-1, 16, 64, 49152, 2147483647, 1024, 8, 32], "", 0, []], [[], [["FU", 2, [0, 1, 2, 3]], ["SP", 2, 0, 1792, [32], 1], ["AN", 2, 0, 5], ["AN", 2, 1, 6], ["FU", 1, [0, 1, 2, 3]], ["SP", 1, 0, 1792, [16], 1], ["AN", 1, 0, 5], ["AN", 1, 1, 6], ["PR", 1, 0, "auto_unroll_max_step$0"]]]], "r": [[3.02684e-05, 3.02697e-05, 3.02679e-05, 3.02983e-05], 0, 3.19507, 1664816964], "v": "v0.6"}
{"i": [["[\"a95c963db640520084f903f0a5df1d3a\", [28, 64, 32, 32], [28, 64, 1, 1]]", "cuda -keys=cuda,gpu -arch=sm_80 -max_num_threads=1024 -thread_warp_size=32", [-1, 16, 64, 49152, 2147483647, 1024, 8, 32], "", 0, []], [[], [["FU", 2, [0, 1, 2, 3]], ["SP", 2, 0, 1792, [56], 1], ["AN", 2, 0, 5], ["AN", 2, 1, 6], ["FU", 1, [0, 1, 2, 3]], ["SP", 1, 0, 1792, [2], 1], ["AN", 1, 0, 5], ["AN", 1, 1, 6], ["PR", 1, 0, "auto_unroll_max_step$16"]]]], "r": [[2.22273e-05, 2.22203e-05, 2.22185e-05, 2.22181e-05], 0, 3.09424, 1664816967], "v": "v0.6"}
{"i": [["[\"a95c963db640520084f903f0a5df1d3a\", [28, 64, 32, 32], [28, 64, 1, 1]]", "cuda -keys=cuda,gpu -arch=sm_80 -max_num_threads=1024 -thread_warp_size=32", [-1, 16, 64, 49152, 2147483647, 1024, 8, 32], "", 0, []], [[], [["FU", 2, [0, 1, 2, 3]], ["SP", 2, 0, 1792, [32], 1], ["AN", 2, 0, 5], ["AN", 2, 1, 6], ["FU", 1, [0, 1, 2, 3]], ["SP", 1, 0, 1792, [64], 1], ["AN", 1, 0, 5], ["AN", 1, 1, 6], ["PR", 1, 0, "auto_unroll_max_step$64"]]]], "r": [[5.42317e-05, 5.42427e-05, 5.42398e-05, 5.42433e-05], 0, 3.19111, 1664816969], "v": "v0.6"}
{"i": [["[\"a95c963db640520084f903f0a5df1d3a\", [28, 64, 32, 32], [28, 64, 1, 1]]", "cuda -keys=cuda,gpu -arch=sm_80 -max_num_threads=1024 -thread_warp_size=32", [-1, 16, 64, 49152, 2147483647, 1024, 8, 32], "", 0, []], [[], [["FU", 2, [0, 1, 2, 3]], ["SP", 2, 0, 1792, [32], 1], ["AN", 2, 0, 5], ["AN", 2, 1, 6], ["FU", 1, [0, 1, 2, 3]], ["SP", 1, 0, 1792, [2], 1], ["AN", 1, 0, 5], ["AN", 1, 1, 6], ["PR", 1, 0, "auto_unroll_max_step$0"]]]], "r": [[2.23921e-05, 2.23972e-05, 2.2393e-05, 2.2398e-05], 0, 3.08911, 1664816972], "v": "v0.6"}
{"i": [["[\"a95c963db640520084f903f0a5df1d3a\", [28, 64, 32, 32], [28, 64, 1, 1]]", "cuda -keys=cuda,gpu -arch=sm_80 -max_num_threads=1024 -thread_warp_size=32", [-1, 16, 64, 49152, 2147483647, 1024, 8, 32], "", 0, []], [[], [["FU", 2, [0, 1, 2, 3]], ["SP", 2, 0, 1792, [28], 1], ["AN", 2, 0, 5], ["AN", 2, 1, 6], ["FU", 1, [0, 1, 2, 3]], ["SP", 1, 0, 1792, [2], 1], ["AN", 1, 0, 5], ["AN", 1, 1, 6], ["PR", 1, 0, "auto_unroll_max_step$0"]]]], "r": [[2.21491e-05, 2.21466e-05, 2.21474e-05, 2.21449e-05], 0, 2.95764, 1664816974], "v": "v0.6"}
{"i": [["[\"a95c963db640520084f903f0a5df1d3a\", [28, 64, 32, 32], [28, 64, 1, 1]]", "cuda -keys=cuda,gpu -arch=sm_80 -max_num_threads=1024 -thread_warp_size=32", [-1, 16, 64, 49152, 2147483647, 1024, 8, 32], "", 0, []], [[], [["FU", 2, [0, 1, 2, 3]], ["SP", 2, 0, 1792, [7], 1], ["AN", 2, 0, 5], ["AN", 2, 1, 6], ["FU", 1, [0, 1, 2, 3]], ["SP", 1, 0, 1792, [64], 1], ["AN", 1, 0, 5], ["AN", 1, 1, 6], ["PR", 1, 0, "auto_unroll_max_step$16"]]]], "r": [[5.434e-05, 5.43425e-05, 5.43331e-05, 5.43376e-05], 0, 3.19122, 1664816977], "v": "v0.6"}
{"i": [["[\"a95c963db640520084f903f0a5df1d3a\", [28, 64, 32, 32], [28, 64, 1, 1]]", "cuda -keys=cuda,gpu -arch=sm_80 -max_num_threads=1024 -thread_warp_size=32", [-1, 16, 64, 49152, 2147483647, 1024, 8, 32], "", 0, []], [[], [["FU", 2, [0, 1, 2, 3]], ["SP", 2, 0, 1792, [7], 1], ["AN", 2, 0, 5], ["AN", 2, 1, 6], ["FU", 1, [0, 1, 2, 3]], ["SP", 1, 0, 1792, [1], 1], ["AN", 1, 0, 5], ["AN", 1, 1, 6], ["PR", 1, 0, "auto_unroll_max_step$1024"]]]], "r": [[2.6633e-05, 2.6639e-05, 2.66332e-05, 2.66332e-05], 0, 2.78874, 1664816980], "v": "v0.6"}
{"i": [["[\"a95c963db640520084f903f0a5df1d3a\", [28, 64, 32, 32], [28, 64, 1, 1]]", "cuda -keys=cuda,gpu -arch=sm_80 -max_num_threads=1024 -thread_warp_size=32", [-1, 16, 64, 49152, 2147483647, 1024, 8, 32], "", 0, []], [[], [["FU", 2, [0, 1, 2, 3]], ["SP", 2, 0, 1792, [2], 1], ["AN", 2, 0, 5], ["AN", 2, 1, 6], ["FU", 1, [0, 1, 2, 3]], ["SP", 1, 0, 1792, [2], 1], ["AN", 1, 0, 5], ["AN", 1, 1, 6], ["PR", 1, 0, "auto_unroll_max_step$0"]]]], "r": [[2.28147e-05, 2.28257e-05, 2.28259e-05, 2.28181e-05], 0, 2.84085, 1664816982], "v": "v0.6"}
{"i": [["[\"a95c963db640520084f903f0a5df1d3a\", [28, 64, 32, 32], [28, 64, 1, 1]]", "cuda -keys=cuda,gpu -arch=sm_80 -max_num_threads=1024 -thread_warp_size=32", [-1, 16, 64, 49152, 2147483647, 1024, 8, 32], "", 0, []], [[], [["FU", 2, [0, 1, 2, 3]], ["SP", 2, 0, 1792, [64], 1], ["AN", 2, 0, 5], ["AN", 2, 1, 6], ["FU", 1, [0, 1, 2, 3]], ["SP", 1, 0, 1792, [2], 1], ["AN", 1, 0, 5], ["AN", 1, 1, 6], ["PR", 1, 0, "auto_unroll_max_step$1024"]]]], "r": [[2.24177e-05, 2.2417e-05, 2.2414e-05, 2.24161e-05], 0, 2.80794, 1664816985], "v": "v0.6"}
{"i": [["[\"a95c963db640520084f903f0a5df1d3a\", [28, 64, 32, 32], [28, 64, 1, 1]]", "cuda -keys=cuda,gpu -arch=sm_80 -max_num_threads=1024 -thread_warp_size=32", [-1, 16, 64, 49152, 2147483647, 1024, 8, 32], "", 0, []], [[], [["FU", 2, [0, 1, 2, 3]], ["SP", 2, 0, 1792, [56], 1], ["AN", 2, 0, 5], ["AN", 2, 1, 6], ["FU", 1, [0, 1, 2, 3]], ["SP", 1, 0, 1792, [4], 1], ["AN", 1, 0, 5], ["AN", 1, 1, 6], ["PR", 1, 0, "auto_unroll_max_step$512"]]]], "r": [[3.24247e-05, 3.2441e-05, 3.24361e-05, 3.24291e-05], 0, 2.88129, 1664816987], "v": "v0.6"}
{"i": [["[\"a95c963db640520084f903f0a5df1d3a\", [28, 64, 32, 32], [28, 64, 1, 1]]", "cuda -keys=cuda,gpu -arch=sm_80 -max_num_threads=1024 -thread_warp_size=32", [-1, 16, 64, 49152, 2147483647, 1024, 8, 32], "", 0, []], [[], [["FU", 2, [0, 1, 2, 3]], ["SP", 2, 0, 1792, [64], 1], ["AN", 2, 0, 5], ["AN", 2, 1, 6], ["FU", 1, [0, 1, 2, 3]], ["SP", 1, 0, 1792, [1], 1], ["AN", 1, 0, 5], ["AN", 1, 1, 6], ["PR", 1, 0, "auto_unroll_max_step$1024"]]]], "r": [[2.63528e-05, 2.63516e-05, 2.63557e-05, 2.63544e-05], 0, 2.57242, 1664816990], "v": "v0.6"}
{"i": [["[\"a95c963db640520084f903f0a5df1d3a\", [28, 64, 32, 32], [28, 64, 1, 1]]", "cuda -keys=cuda,gpu -arch=sm_80 -max_num_threads=1024 -thread_warp_size=32", [-1, 16, 64, 49152, 2147483647, 1024, 8, 32], "", 0, []], [[], [["FU", 2, [0, 1, 2, 3]], ["SP", 2, 0, 1792, [16], 1], ["AN", 2, 0, 5], ["AN", 2, 1, 6], ["FU", 1, [0, 1, 2, 3]], ["SP", 1, 0, 1792, [16], 1], ["AN", 1, 0, 5], ["AN", 1, 1, 6], ["PR", 1, 0, "auto_unroll_max_step$1024"]]]], "r": [[3.04317e-05, 3.04391e-05, 3.03708e-05, 3.03705e-05], 0, 2.84749, 1664816992], "v": "v0.6"}
{"i": [["[\"a95c963db640520084f903f0a5df1d3a\", [28, 64, 32, 32], [28, 64, 1, 1]]", "cuda -keys=cuda,gpu -arch=sm_80 -max_num_threads=1024 -thread_warp_size=32", [-1, 16, 64, 49152, 2147483647, 1024, 8, 32], "", 0, []], [[], [["FU", 2, [0, 1, 2, 3]], ["SP", 2, 0, 1792, [56], 1], ["AN", 2, 0, 5], ["AN", 2, 1, 6], ["FU", 1, [0, 1, 2, 3]], ["SP", 1, 0, 1792, [16], 1], ["AN", 1, 0, 5], ["AN", 1, 1, 6], ["PR", 1, 0, "auto_unroll_max_step$1024"]]]], "r": [[3.03312e-05, 3.02949e-05, 3.03074e-05, 3.0306e-05], 0, 2.85212, 1664816995], "v": "v0.6"}
{"i": [["[\"a95c963db640520084f903f0a5df1d3a\", [28, 64, 32, 32], [28, 64, 1, 1]]", "cuda -keys=cuda,gpu -arch=sm_80 -max_num_threads=1024 -thread_warp_size=32", [-1, 16, 64, 49152, 2147483647, 1024, 8, 32], "", 0, []], [[], [["FU", 2, [0, 1, 2, 3]], ["SP", 2, 0, 1792, [1], 1], ["AN", 2, 0, 5], ["AN", 2, 1, 6], ["FU", 1, [0, 1, 2, 3]], ["SP", 1, 0, 1792, [8], 1], ["AN", 1, 0, 5], ["AN", 1, 1, 6], ["PR", 1, 0, "auto_unroll_max_step$512"]]]], "r": [[2.67417e-05, 2.67405e-05, 2.67402e-05, 2.6741e-05], 0, 2.80882, 1664816997], "v": "v0.6"}
{"i": [["[\"a95c963db640520084f903f0a5df1d3a\", [28, 64, 32, 32], [28, 64, 1, 1]]", "cuda -keys=cuda,gpu -arch=sm_80 -max_num_threads=1024 -thread_warp_size=32", [-1, 16, 64, 49152, 2147483647, 1024, 8, 32], "", 0, []], [[], [["FU", 2, [0, 1, 2, 3]], ["SP", 2, 0, 1792, [32], 1], ["AN", 2, 0, 5], ["AN", 2, 1, 6], ["FU", 1, [0, 1, 2, 3]], ["SP", 1, 0, 1792, [7], 1], ["AN", 1, 0, 5], ["AN", 1, 1, 6], ["PR", 1, 0, "auto_unroll_max_step$16"]]]], "r": [[2.35425e-05, 2.35444e-05, 2.35549e-05, 2.35698e-05], 0, 3.10693, 1664817000], "v": "v0.6"}
{"i": [["[\"a95c963db640520084f903f0a5df1d3a\", [28, 64, 32, 32], [28, 64, 1, 1]]", "cuda -keys=cuda,gpu -arch=sm_80 -max_num_threads=1024 -thread_warp_size=32", [-1, 16, 64, 49152, 2147483647, 1024, 8, 32], "", 0, []], [[], [["FU", 2, [0, 1, 2, 3]], ["SP", 2, 0, 1792, [2], 1], ["AN", 2, 0, 5], ["AN", 2, 1, 6], ["FU", 1, [0, 1, 2, 3]], ["SP", 1, 0, 1792, [4], 1], ["AN", 1, 0, 5], ["AN", 1, 1, 6], ["PR", 1, 0, "auto_unroll_max_step$1024"]]]], "r": [[3.30135e-05, 3.30123e-05, 3.30041e-05, 3.30032e-05], 0, 3.0872, 1664817002], "v": "v0.6"}
{"i": [["[\"a95c963db640520084f903f0a5df1d3a\", [28, 64, 32, 32], [28, 64, 1, 1]]", "cuda -keys=cuda,gpu -arch=sm_80 -max_num_threads=1024 -thread_warp_size=32", [-1, 16, 64, 49152, 2147483647, 1024, 8, 32], "", 0, []], [[], [["FU", 2, [0, 1, 2, 3]], ["SP", 2, 0, 1792, [7], 1], ["AN", 2, 0, 5], ["AN", 2, 1, 6], ["FU", 1, [0, 1, 2, 3]], ["SP", 1, 0, 1792, [32], 1], ["AN", 1, 0, 5], ["AN", 1, 1, 6], ["PR", 1, 0, "auto_unroll_max_step$16"]]]], "r": [[3.78617e-05, 3.78668e-05, 3.78622e-05, 3.78561e-05], 0, 3.05033, 1664817005], "v": "v0.6"}
{"i": [["[\"a95c963db640520084f903f0a5df1d3a\", [28, 64, 32, 32], [28, 64, 1, 1]]", "cuda -keys=cuda,gpu -arch=sm_80 -max_num_threads=1024 -thread_warp_size=32", [-1, 16, 64, 49152, 2147483647, 1024, 8, 32], "", 0, []], [[], [["FU", 2, [0, 1, 2, 3]], ["SP", 2, 0, 1792, [2], 1], ["AN", 2, 0, 5], ["AN", 2, 1, 6], ["FU", 1, [0, 1, 2, 3]], ["SP", 1, 0, 1792, [7], 1], ["AN", 1, 0, 5], ["AN", 1, 1, 6], ["PR", 1, 0, "auto_unroll_max_step$16"]]]], "r": [[2.39875e-05, 2.39953e-05, 2.39896e-05, 2.39957e-05], 0, 2.98303, 1664817007], "v": "v0.6"}
{"i": [["[\"a95c963db640520084f903f0a5df1d3a\", [28, 64, 32, 32], [28, 64, 1, 1]]", "cuda -keys=cuda,gpu -arch=sm_80 -max_num_threads=1024 -thread_warp_size=32", [-1, 16, 64, 49152, 2147483647, 1024, 8, 32], "", 0, []], [[], [["FU", 2, [0, 1, 2, 3]], ["SP", 2, 0, 1792, [4], 1], ["AN", 2, 0, 5], ["AN", 2, 1, 6], ["FU", 1, [0, 1, 2, 3]], ["SP", 1, 0, 1792, [14], 1], ["AN", 1, 0, 5], ["AN", 1, 1, 6], ["PR", 1, 0, "auto_unroll_max_step$16"]]]], "r": [[2.9604e-05, 2.96478e-05, 2.96243e-05, 2.96226e-05], 0, 3.01979, 1664817010], "v": "v0.6"}
{"i": [["[\"a95c963db640520084f903f0a5df1d3a\", [28, 64, 32, 32], [28, 64, 1, 1]]", "cuda -keys=cuda,gpu -arch=sm_80 -max_num_threads=1024 -thread_warp_size=32", [-1, 16, 64, 49152, 2147483647, 1024, 8, 32], "", 0, []], [[], [["FU", 2, [0, 1, 2, 3]], ["SP", 2, 0, 1792, [4], 1], ["AN", 2, 0, 5], ["AN", 2, 1, 6], ["FU", 1, [0, 1, 2, 3]], ["SP", 1, 0, 1792, [8], 1], ["AN", 1, 0, 5], ["AN", 1, 1, 6], ["PR", 1, 0, "auto_unroll_max_step$1024"]]]], "r": [[2.57767e-05, 2.57798e-05, 2.57808e-05, 2.57773e-05], 0, 2.95083, 1664817013], "v": "v0.6"}
{"i": [["[\"a95c963db640520084f903f0a5df1d3a\", [28, 64, 32, 32], [28, 64, 1, 1]]", "cuda -keys=cuda,gpu -arch=sm_80 -max_num_threads=1024 -thread_warp_size=32", [-1, 16, 64, 49152, 2147483647, 1024, 8, 32], "", 0, []], [[], [["FU", 2, [0, 1, 2, 3]], ["SP", 2, 0, 1792, [14], 1], ["AN", 2, 0, 5], ["AN", 2, 1, 6], ["FU", 1, [0, 1, 2, 3]], ["SP", 1, 0, 1792, [64], 1], ["AN", 1, 0, 5], ["AN", 1, 1, 6], ["PR", 1, 0, "auto_unroll_max_step$16"]]]], "r": [[5.41488e-05, 5.41366e-05, 5.41346e-05, 5.41686e-05], 0, 2.97957, 1664817015], "v": "v0.6"}
{"i": [["[\"a95c963db640520084f903f0a5df1d3a\", [28, 64, 32, 32], [28, 64, 1, 1]]", "cuda -keys=cuda,gpu -arch=sm_80 -max_num_threads=1024 -thread_warp_size=32", [-1, 16, 64, 49152, 2147483647, 1024, 8, 32], "", 0, []], [[], [["FU", 2, [0, 1, 2, 3]], ["SP", 2, 0, 1792, [32], 1], ["AN", 2, 0, 5], ["AN", 2, 1, 6], ["FU", 1, [0, 1, 2, 3]], ["SP", 1, 0, 1792, [4], 1], ["AN", 1, 0, 5], ["AN", 1, 1, 6], ["PR", 1, 0, "auto_unroll_max_step$0"]]]], "r": [[3.23732e-05, 3.23665e-05, 3.23571e-05, 3.23583e-05], 0, 2.97443, 1664817018], "v": "v0.6"}
{"i": [["[\"a95c963db640520084f903f0a5df1d3a\", [28, 64, 32, 32], [28, 64, 1, 1]]", "cuda -keys=cuda,gpu -arch=sm_80 -max_num_threads=1024 -thread_warp_size=32", [-1, 16, 64, 49152, 2147483647, 1024, 8, 32], "", 0, []], [[], [["FU", 2, [0, 1, 2, 3]], ["SP", 2, 0, 1792, [2], 1], ["AN", 2, 0, 5], ["AN", 2, 1, 6], ["FU", 1, [0, 1, 2, 3]], ["SP", 1, 0, 1792, [64], 1], ["AN", 1, 0, 5], ["AN", 1, 1, 6], ["PR", 1, 0, "auto_unroll_max_step$512"]]]], "r": [[5.468e-05, 5.46943e-05, 5.46862e-05, 5.46818e-05], 0, 3.01998, 1664817020], "v": "v0.6"}
{"i": [["[\"a95c963db640520084f903f0a5df1d3a\", [28, 64, 32, 32], [28, 64, 1, 1]]", "cuda -keys=cuda,gpu -arch=sm_80 -max_num_threads=1024 -thread_warp_size=32", [-1, 16, 64, 49152, 2147483647, 1024, 8, 32], "", 0, []], [[], [["FU", 2, [0, 1, 2, 3]], ["SP", 2, 0, 1792, [32], 1], ["AN", 2, 0, 5], ["AN", 2, 1, 6], ["FU", 1, [0, 1, 2, 3]], ["SP", 1, 0, 1792, [56], 1], ["AN", 1, 0, 5], ["AN", 1, 1, 6], ["PR", 1, 0, "auto_unroll_max_step$512"]]]], "r": [[5.03316e-05, 5.03311e-05, 5.03323e-05, 5.03315e-05], 0, 3.0051, 1664817023], "v": "v0.6"}
{"i": [["[\"a95c963db640520084f903f0a5df1d3a\", [28, 64, 32, 32], [28, 64, 1, 1]]", "cuda -keys=cuda,gpu -arch=sm_80 -max_num_threads=1024 -thread_warp_size=32", [-1, 16, 64, 49152, 2147483647, 1024, 8, 32], "", 0, []], [[], [["FU", 2, [0, 1, 2, 3]], ["SP", 2, 0, 1792, [56], 1], ["AN", 2, 0, 5], ["AN", 2, 1, 6], ["FU", 1, [0, 1, 2, 3]], ["SP", 1, 0, 1792, [1], 1], ["AN", 1, 0, 5], ["AN", 1, 1, 6], ["PR", 1, 0, "auto_unroll_max_step$16"]]]], "r": [[2.64005e-05, 2.64009e-05, 2.6403e-05, 2.63999e-05], 0, 2.80076, 1664817025], "v": "v0.6"}
{"i": [["[\"a95c963db640520084f903f0a5df1d3a\", [28, 64, 32, 32], [28, 64, 1, 1]]", "cuda -keys=cuda,gpu -arch=sm_80 -max_num_threads=1024 -thread_warp_size=32", [-1, 16, 64, 49152, 2147483647, 1024, 8, 32], "", 0, []], [[], [["FU", 2, [0, 1, 2, 3]], ["SP", 2, 0, 1792, [2], 1], ["AN", 2, 0, 5], ["AN", 2, 1, 6], ["FU", 1, [0, 1, 2, 3]], ["SP", 1, 0, 1792, [4], 1], ["AN", 1, 0, 5], ["AN", 1, 1, 6], ["PR", 1, 0, "auto_unroll_max_step$64"]]]], "r": [[3.31964e-05, 3.31929e-05, 3.32017e-05, 3.31949e-05], 0, 2.90973, 1664817028], "v": "v0.6"}
{"i": [["[\"a95c963db640520084f903f0a5df1d3a\", [28, 64, 32, 32], [28, 64, 1, 1]]", "cuda -keys=cuda,gpu -arch=sm_80 -max_num_threads=1024 -thread_warp_size=32", [-1, 16, 64, 49152, 2147483647, 1024, 8, 32], "", 0, []], [[], [["FU", 2, [0, 1, 2, 3]], ["SP", 2, 0, 1792, [4], 1], ["AN", 2, 0, 5], ["AN", 2, 1, 6], ["FU", 1, [0, 1, 2, 3]], ["SP", 1, 0, 1792, [1], 1], ["AN", 1, 0, 5], ["AN", 1, 1, 6], ["PR", 1, 0, "auto_unroll_max_step$64"]]]], "r": [[2.65193e-05, 2.65194e-05, 2.65221e-05, 2.65187e-05], 0, 2.71826, 1664817030], "v": "v0.6"}
{"i": [["[\"a95c963db640520084f903f0a5df1d3a\", [28, 64, 32, 32], [28, 64, 1, 1]]", "cuda -keys=cuda,gpu -arch=sm_80 -max_num_threads=1024 -thread_warp_size=32", [-1, 16, 64, 49152, 2147483647, 1024, 8, 32], "", 0, []], [[], [["FU", 2, [0, 1, 2, 3]], ["SP", 2, 0, 1792, [2], 1], ["AN", 2, 0, 5], ["AN", 2, 1, 6], ["FU", 1, [0, 1, 2, 3]], ["SP", 1, 0, 1792, [1], 1], ["AN", 1, 0, 5], ["AN", 1, 1, 6], ["PR", 1, 0, "auto_unroll_max_step$512"]]]], "r": [[2.7056e-05, 2.70468e-05, 2.70426e-05, 2.70454e-05], 0, 2.70342, 1664817033], "v": "v0.6"}
{"i": [["[\"a95c963db640520084f903f0a5df1d3a\", [28, 64, 32, 32], [28, 64, 1, 1]]", "cuda -keys=cuda,gpu -arch=sm_80 -max_num_threads=1024 -thread_warp_size=32", [-1, 16, 64, 49152, 2147483647, 1024, 8, 32], "", 0, []], [[], [["FU", 2, [0, 1, 2, 3]], ["SP", 2, 0, 1792, [16], 1], ["AN", 2, 0, 5], ["AN", 2, 1, 6], ["FU", 1, [0, 1, 2, 3]], ["SP", 1, 0, 1792, [2], 1], ["AN", 1, 0, 5], ["AN", 1, 1, 6], ["PR", 1, 0, "auto_unroll_max_step$1024"]]]], "r": [[2.22979e-05, 2.22969e-05, 2.22996e-05, 2.22965e-05], 0, 2.78691, 1664817035], "v": "v0.6"}
{"i": [["[\"a95c963db640520084f903f0a5df1d3a\", [28, 64, 32, 32], [28, 64, 1, 1]]", "cuda -keys=cuda,gpu -arch=sm_80 -max_num_threads=1024 -thread_warp_size=32", [-1, 16, 64, 49152, 2147483647, 1024, 8, 32], "", 0, []], [[], [["FU", 2, [0, 1, 2, 3]], ["SP", 2, 0, 1792, [28], 1], ["AN", 2, 0, 5], ["AN", 2, 1, 6], ["FU", 1, [0, 1, 2, 3]], ["SP", 1, 0, 1792, [64], 1], ["AN", 1, 0, 5], ["AN", 1, 1, 6], ["PR", 1, 0, "auto_unroll_max_step$512"]]]], "r": [[5.41198e-05, 5.41199e-05, 5.41177e-05, 5.41177e-05], 0, 2.90314, 1664817038], "v": "v0.6"}
{"i": [["[\"a95c963db640520084f903f0a5df1d3a\", [28, 64, 32, 32], [28, 64, 1, 1]]", "cuda -keys=cuda,gpu -arch=sm_80 -max_num_threads=1024 -thread_warp_size=32", [-1, 16, 64, 49152, 2147483647, 1024, 8, 32], "", 0, []], [[], [["FU", 2, [0, 1, 2, 3]], ["SP", 2, 0, 1792, [64], 1], ["AN", 2, 0, 5], ["AN", 2, 1, 6], ["FU", 1, [0, 1, 2, 3]], ["SP", 1, 0, 1792, [1], 1], ["AN", 1, 0, 5], ["AN", 1, 1, 6], ["PR", 1, 0, "auto_unroll_max_step$64"]]]], "r": [[2.66337e-05, 2.66319e-05, 2.66352e-05, 2.66359e-05], 0, 2.7129, 1664817040], "v": "v0.6"}
{"i": [["[\"a95c963db640520084f903f0a5df1d3a\", [28, 64, 32, 32], [28, 64, 1, 1]]", "cuda -keys=cuda,gpu -arch=sm_80 -max_num_threads=1024 -thread_warp_size=32", [-1, 16, 64, 49152, 2147483647, 1024, 8, 32], "", 0, []], [[], [["FU", 2, [0, 1, 2, 3]], ["SP", 2, 0, 1792, [64], 1], ["AN", 2, 0, 5], ["AN", 2, 1, 6], ["FU", 1, [0, 1, 2, 3]], ["SP", 1, 0, 1792, [56], 1], ["AN", 1, 0, 5], ["AN", 1, 1, 6], ["PR", 1, 0, "auto_unroll_max_step$16"]]]], "r": [[4.98883e-05, 4.98857e-05, 4.98874e-05, 4.98845e-05], 0, 2.89061, 1664817043], "v": "v0.6"}
{"i": [["[\"a95c963db640520084f903f0a5df1d3a\", [28, 64, 32, 32], [28, 64, 1, 1]]", "cuda -keys=cuda,gpu -arch=sm_80 -max_num_threads=1024 -thread_warp_size=32", [-1, 16, 64, 49152, 2147483647, 1024, 8, 32], "", 0, []], [[], [["FU", 2, [0, 1, 2, 3]], ["SP", 2, 0, 1792, [64], 1], ["AN", 2, 0, 5], ["AN", 2, 1, 6], ["FU", 1, [0, 1, 2, 3]], ["SP", 1, 0, 1792, [16], 1], ["AN", 1, 0, 5], ["AN", 1, 1, 6], ["PR", 1, 0, "auto_unroll_max_step$512"]]]], "r": [[3.06176e-05, 3.05867e-05, 3.0558e-05, 3.05588e-05], 0, 3.16377, 1664817046], "v": "v0.6"}
{"i": [["[\"a95c963db640520084f903f0a5df1d3a\", [28, 64, 32, 32], [28, 64, 1, 1]]", "cuda -keys=cuda,gpu -arch=sm_80 -max_num_threads=1024 -thread_warp_size=32", [-1, 16, 64, 49152, 2147483647, 1024, 8, 32], "", 0, []], [[], [["FU", 2, [0, 1, 2, 3]], ["SP", 2, 0, 1792, [2], 1], ["AN", 2, 0, 5], ["AN", 2, 1, 6], ["FU", 1, [0, 1, 2, 3]], ["SP", 1, 0, 1792, [2], 1], ["AN", 1, 0, 5], ["AN", 1, 1, 6], ["PR", 1, 0, "auto_unroll_max_step$16"]]]], "r": [[2.28293e-05, 2.28423e-05, 2.28414e-05, 2.2841e-05], 0, 2.82616, 1664817048], "v": "v0.6"}
{"i": [["[\"a95c963db640520084f903f0a5df1d3a\", [28, 64, 32, 32], [28, 64, 1, 1]]", "cuda -keys=cuda,gpu -arch=sm_80 -max_num_threads=1024 -thread_warp_size=32", [-1, 16, 64, 49152, 2147483647, 1024, 8, 32], "", 0, []], [[], [["FU", 2, [0, 1, 2, 3]], ["SP", 2, 0, 1792, [1], 1], ["AN", 2, 0, 5], ["AN", 2, 1, 6], ["FU", 1, [0, 1, 2, 3]], ["SP", 1, 0, 1792, [8], 1], ["AN", 1, 0, 5], ["AN", 1, 1, 6], ["PR", 1, 0, "auto_unroll_max_step$0"]]]], "r": [[2.65361e-05, 2.65337e-05, 2.65332e-05, 2.65345e-05], 0, 2.81062, 1664817051], "v": "v0.6"}
{"i": [["[\"a95c963db640520084f903f0a5df1d3a\", [28, 64, 32, 32], [28, 64, 1, 1]]", "cuda -keys=cuda,gpu -arch=sm_80 -max_num_threads=1024 -thread_warp_size=32", [-1, 16, 64, 49152, 2147483647, 1024, 8, 32], "", 0, []], [[], [["FU", 2, [0, 1, 2, 3]], ["SP", 2, 0, 1792, [4], 1], ["AN", 2, 0, 5], ["AN", 2, 1, 6], ["FU", 1, [0, 1, 2, 3]], ["SP", 1, 0, 1792, [64], 1], ["AN", 1, 0, 5], ["AN", 1, 1, 6], ["PR", 1, 0, "auto_unroll_max_step$0"]]]], "r": [[5.46015e-05, 5.45821e-05, 5.45972e-05, 5.46082e-05], 0, 2.8905, 1664817054], "v": "v0.6"}
{"i": [["[\"a95c963db640520084f903f0a5df1d3a\", [28, 64, 32, 32], [28, 64, 1, 1]]", "cuda -keys=cuda,gpu -arch=sm_80 -max_num_threads=1024 -thread_warp_size=32", [-1, 16, 64, 49152, 2147483647, 1024, 8, 32], "", 0, []], [[], [["FU", 2, [0, 1, 2, 3]], ["SP", 2, 0, 1792, [64], 1], ["AN", 2, 0, 5], ["AN", 2, 1, 6], ["FU", 1, [0, 1, 2, 3]], ["SP", 1, 0, 1792, [14], 1], ["AN", 1, 0, 5], ["AN", 1, 1, 6], ["PR", 1, 0, "auto_unroll_max_step$1024"]]]], "r": [[2.93034e-05, 2.92784e-05, 2.92367e-05, 2.92628e-05], 0, 2.86735, 1664817056], "v": "v0.6"}
{"i": [["[\"a95c963db640520084f903f0a5df1d3a\", [28, 64, 32, 32], [28, 64, 1, 1]]", "cuda -keys=cuda,gpu -arch=sm_80 -max_num_threads=1024 -thread_warp_size=32", [-1, 16, 64, 49152, 2147483647, 1024, 8, 32], "", 0, []], [[], [["FU", 2, [0, 1, 2, 3]], ["SP", 2, 0, 1792, [2], 1], ["AN", 2, 0, 5], ["AN", 2, 1, 6], ["FU", 1, [0, 1, 2, 3]], ["SP", 1, 0, 1792, [1], 1], ["AN", 1, 0, 5], ["AN", 1, 1, 6], ["PR", 1, 0, "auto_unroll_max_step$64"]]]], "r": [[2.69383e-05, 2.69452e-05, 2.69403e-05, 2.69379e-05], 0, 2.66512, 1664817059], "v": "v0.6"}
{"i": [["[\"a95c963db640520084f903f0a5df1d3a\", [28, 64, 32, 32], [28, 64, 1, 1]]", "cuda -keys=cuda,gpu -arch=sm_80 -max_num_threads=1024 -thread_warp_size=32", [-1, 16, 64, 49152, 2147483647, 1024, 8, 32], "", 0, []], [[], [["FU", 2, [0, 1, 2, 3]], ["SP", 2, 0, 1792, [7], 1], ["AN", 2, 0, 5], ["AN", 2, 1, 6], ["FU", 1, [0, 1, 2, 3]], ["SP", 1, 0, 1792, [16], 1], ["AN", 1, 0, 5], ["AN", 1, 1, 6], ["PR", 1, 0, "auto_unroll_max_step$1024"]]]], "r": [[3.08362e-05, 3.07919e-05, 3.07885e-05, 3.08323e-05], 0, 2.97238, 1664817064], "v": "v0.6"}
{"i": [["[\"a95c963db640520084f903f0a5df1d3a\", [28, 64, 32, 32], [28, 64, 1, 1]]", "cuda -keys=cuda,gpu -arch=sm_80 -max_num_threads=1024 -thread_warp_size=32", [-1, 16, 64, 49152, 2147483647, 1024, 8, 32], "", 0, []], [[], [["FU", 2, [0, 1, 2, 3]], ["SP", 2, 0, 1792, [8], 1], ["AN", 2, 0, 5], ["AN", 2, 1, 6], ["FU", 1, [0, 1, 2, 3]], ["SP", 1, 0, 1792, [1], 1], ["AN", 1, 0, 5], ["AN", 1, 1, 6], ["PR", 1, 0, "auto_unroll_max_step$16"]]]], "r": [[2.63348e-05, 2.63325e-05, 2.63349e-05, 2.63307e-05], 0, 2.81264, 1664817066], "v": "v0.6"}
{"i": [["[\"a95c963db640520084f903f0a5df1d3a\", [28, 64, 32, 32], [28, 64, 1, 1]]", "cuda -keys=cuda,gpu -arch=sm_80 -max_num_threads=1024 -thread_warp_size=32", [-1, 16, 64, 49152, 2147483647, 1024, 8, 32], "", 0, []], [[], [["FU", 2, [0, 1, 2, 3]], ["SP", 2, 0, 1792, [1], 1], ["AN", 2, 0, 5], ["AN", 2, 1, 6], ["FU", 1, [0, 1, 2, 3]], ["SP", 1, 0, 1792, [8], 1], ["AN", 1, 0, 5], ["AN", 1, 1, 6], ["PR", 1, 0, "auto_unroll_max_step$64"]]]], "r": [[2.66627e-05, 2.66636e-05, 2.66616e-05, 2.66602e-05], 0, 2.95908, 1664817069], "v": "v0.6"}
{"i": [["[\"a95c963db640520084f903f0a5df1d3a\", [28, 64, 32, 32], [28, 64, 1, 1]]", "cuda -keys=cuda,gpu -arch=sm_80 -max_num_threads=1024 -thread_warp_size=32", [-1, 16, 64, 49152, 2147483647, 1024, 8, 32], "", 0, []], [[], [["FU", 2, [0, 1, 2, 3]], ["SP", 2, 0, 1792, [16], 1], ["AN", 2, 0, 5], ["AN", 2, 1, 6], ["FU", 1, [0, 1, 2, 3]], ["SP", 1, 0, 1792, [1], 1], ["AN", 1, 0, 5], ["AN", 1, 1, 6], ["PR", 1, 0, "auto_unroll_max_step$64"]]]], "r": [[2.66532e-05, 2.66505e-05, 2.66499e-05, 2.66744e-05], 0, 2.965, 1664817071], "v": "v0.6"}
{"i": [["[\"a95c963db640520084f903f0a5df1d3a\", [28, 64, 32, 32], [28, 64, 1, 1]]", "cuda -keys=cuda,gpu -arch=sm_80 -max_num_threads=1024 -thread_warp_size=32", [-1, 16, 64, 49152, 2147483647, 1024, 8, 32], "", 0, []], [[], [["FU", 2, [0, 1, 2, 3]], ["SP", 2, 0, 1792, [64], 1], ["AN", 2, 0, 5], ["AN", 2, 1, 6], ["FU", 1, [0, 1, 2, 3]], ["SP", 1, 0, 1792, [28], 1], ["AN", 1, 0, 5], ["AN", 1, 1, 6], ["PR", 1, 0, "auto_unroll_max_step$16"]]]], "r": [[3.73889e-05, 3.7299e-05, 3.73737e-05, 3.733e-05], 0, 2.9796, 1664817074], "v": "v0.6"}
