.cache/log/kernel_tune/NVIDIA_A100_80GB_PCIe/AvgPool2d_forward_input_0_1_384_2_2_output_0_1_384_1_1_kernel_size_2.json
{"i": [["[\"0a4dc90579b37e287edc09d585f36844\", [1, 384, 2, 2], [1, 384, 1, 1]]", "cuda -keys=cuda,gpu -arch=sm_80 -max_num_threads=1024 -thread_warp_size=32", [-1, 16, 64, 49152, 2147483647, 1024, 8, 32], "", 0, []], [[], [["FU", 2, [0, 1, 2, 3]], ["SP", 2, 0, 384, [32], 1], ["AN", 2, 0, 5], ["AN", 2, 1, 6], ["FU", 1, [0, 1, 2, 3]], ["SP", 1, 0, 384, [2], 1], ["AN", 1, 0, 5], ["AN", 1, 1, 6], ["PR", 1, 0, "auto_unroll_max_step$512"]]]], "r": [[5.55638e-06, 5.55798e-06, 5.56037e-06, 5.55974e-06], 0, 2.30888, 1668250397], "v": "v0.6"}
{"i": [["[\"0a4dc90579b37e287edc09d585f36844\", [1, 384, 2, 2], [1, 384, 1, 1]]", "cuda -keys=cuda,gpu -arch=sm_80 -max_num_threads=1024 -thread_warp_size=32", [-1, 16, 64, 49152, 2147483647, 1024, 8, 32], "", 0, []], [[], [["FU", 2, [0, 1, 2, 3]], ["SP", 2, 0, 384, [16], 1], ["AN", 2, 0, 5], ["AN", 2, 1, 6], ["FU", 1, [0, 1, 2, 3]], ["SP", 1, 0, 384, [64], 1], ["AN", 1, 0, 5], ["AN", 1, 1, 6], ["PR", 1, 0, "auto_unroll_max_step$512"]]]], "r": [[5.57328e-06, 5.57325e-06, 5.57329e-06, 5.57315e-06], 0, 2.4432, 1668250399], "v": "v0.6"}
{"i": [["[\"0a4dc90579b37e287edc09d585f36844\", [1, 384, 2, 2], [1, 384, 1, 1]]", "cuda -keys=cuda,gpu -arch=sm_80 -max_num_threads=1024 -thread_warp_size=32", [-1, 16, 64, 49152, 2147483647, 1024, 8, 32], "", 0, []], [[], [["FU", 2, [0, 1, 2, 3]], ["SP", 2, 0, 384, [2], 1], ["AN", 2, 0, 5], ["AN", 2, 1, 6], ["FU", 1, [0, 1, 2, 3]], ["SP", 1, 0, 384, [64], 1], ["AN", 1, 0, 5], ["AN", 1, 1, 6], ["PR", 1, 0, "auto_unroll_max_step$64"]]]], "r": [[5.6757e-06, 5.67111e-06, 5.67012e-06, 5.65865e-06], 0, 2.44722, 1668250401], "v": "v0.6"}
{"i": [["[\"0a4dc90579b37e287edc09d585f36844\", [1, 384, 2, 2], [1, 384, 1, 1]]", "cuda -keys=cuda,gpu -arch=sm_80 -max_num_threads=1024 -thread_warp_size=32", [-1, 16, 64, 49152, 2147483647, 1024, 8, 32], "", 0, []], [[], [["FU", 2, [0, 1, 2, 3]], ["SP", 2, 0, 384, [64], 1], ["AN", 2, 0, 5], ["AN", 2, 1, 6], ["FU", 1, [0, 1, 2, 3]], ["SP", 1, 0, 384, [16], 1], ["AN", 1, 0, 5], ["AN", 1, 1, 6], ["PR", 1, 0, "auto_unroll_max_step$1024"]]]], "r": [[5.19345e-06, 5.19802e-06, 5.21081e-06, 5.21191e-06], 0, 2.40945, 1668250403], "v": "v0.6"}
{"i": [["[\"0a4dc90579b37e287edc09d585f36844\", [1, 384, 2, 2], [1, 384, 1, 1]]", "cuda -keys=cuda,gpu -arch=sm_80 -max_num_threads=1024 -thread_warp_size=32", [-1, 16, 64, 49152, 2147483647, 1024, 8, 32], "", 0, []], [[], [["FU", 2, [0, 1, 2, 3]], ["SP", 2, 0, 384, [1], 1], ["AN", 2, 0, 5], ["AN", 2, 1, 6], ["FU", 1, [0, 1, 2, 3]], ["SP", 1, 0, 384, [8], 1], ["AN", 1, 0, 5], ["AN", 1, 1, 6], ["PR", 1, 0, "auto_unroll_max_step$1024"]]]], "r": [[5.65899e-06, 5.65765e-06, 5.6591e-06, 5.65939e-06], 0, 2.46743, 1668250406], "v": "v0.6"}
{"i": [["[\"0a4dc90579b37e287edc09d585f36844\", [1, 384, 2, 2], [1, 384, 1, 1]]", "cuda -keys=cuda,gpu -arch=sm_80 -max_num_threads=1024 -thread_warp_size=32", [-1, 16, 64, 49152, 2147483647, 1024, 8, 32], "", 0, []], [[], [["FU", 2, [0, 1, 2, 3]], ["SP", 2, 0, 384, [8], 1], ["AN", 2, 0, 5], ["AN", 2, 1, 6], ["FU", 1, [0, 1, 2, 3]], ["SP", 1, 0, 384, [2], 1], ["AN", 1, 0, 5], ["AN", 1, 1, 6], ["PR", 1, 0, "auto_unroll_max_step$1024"]]]], "r": [[5.51252e-06, 5.51064e-06, 5.51086e-06, 5.51056e-06], 0, 2.46691, 1668250408], "v": "v0.6"}
{"i": [["[\"0a4dc90579b37e287edc09d585f36844\", [1, 384, 2, 2], [1, 384, 1, 1]]", "cuda -keys=cuda,gpu -arch=sm_80 -max_num_threads=1024 -thread_warp_size=32", [-1, 16, 64, 49152, 2147483647, 1024, 8, 32], "", 0, []], [[], [["FU", 2, [0, 1, 2, 3]], ["SP", 2, 0, 384, [1], 1], ["AN", 2, 0, 5], ["AN", 2, 1, 6], ["FU", 1, [0, 1, 2, 3]], ["SP", 1, 0, 384, [8], 1], ["AN", 1, 0, 5], ["AN", 1, 1, 6], ["PR", 1, 0, "auto_unroll_max_step$0"]]]], "r": [[5.53704e-06, 5.53714e-06, 5.53713e-06, 5.53712e-06], 0, 2.67605, 1668250410], "v": "v0.6"}
{"i": [["[\"0a4dc90579b37e287edc09d585f36844\", [1, 384, 2, 2], [1, 384, 1, 1]]", "cuda -keys=cuda,gpu -arch=sm_80 -max_num_threads=1024 -thread_warp_size=32", [-1, 16, 64, 49152, 2147483647, 1024, 8, 32], "", 0, []], [[], [["FU", 2, [0, 1, 2, 3]], ["SP", 2, 0, 384, [8], 1], ["AN", 2, 0, 5], ["AN", 2, 1, 6], ["FU", 1, [0, 1, 2, 3]], ["SP", 1, 0, 384, [3], 1], ["AN", 1, 0, 5], ["AN", 1, 1, 6], ["PR", 1, 0, "auto_unroll_max_step$64"]]]], "r": [[5.28458e-06, 5.29218e-06, 5.29365e-06, 5.29323e-06], 0, 2.40483, 1668250412], "v": "v0.6"}
{"i": [["[\"0a4dc90579b37e287edc09d585f36844\", [1, 384, 2, 2], [1, 384, 1, 1]]", "cuda -keys=cuda,gpu -arch=sm_80 -max_num_threads=1024 -thread_warp_size=32", [-1, 16, 64, 49152, 2147483647, 1024, 8, 32], "", 0, []], [[], [["FU", 2, [0, 1, 2, 3]], ["SP", 2, 0, 384, [4], 1], ["AN", 2, 0, 5], ["AN", 2, 1, 6], ["FU", 1, [0, 1, 2, 3]], ["SP", 1, 0, 384, [4], 1], ["AN", 1, 0, 5], ["AN", 1, 1, 6], ["PR", 1, 0, "auto_unroll_max_step$64"]]]], "r": [[5.531e-06, 5.53099e-06, 5.53092e-06, 5.53109e-06], 0, 2.51265, 1668250414], "v": "v0.6"}
{"i": [["[\"0a4dc90579b37e287edc09d585f36844\", [1, 384, 2, 2], [1, 384, 1, 1]]", "cuda -keys=cuda,gpu -arch=sm_80 -max_num_threads=1024 -thread_warp_size=32", [-1, 16, 64, 49152, 2147483647, 1024, 8, 32], "", 0, []], [[], [["FU", 2, [0, 1, 2, 3]], ["SP", 2, 0, 384, [2], 1], ["AN", 2, 0, 5], ["AN", 2, 1, 6], ["FU", 1, [0, 1, 2, 3]], ["SP", 1, 0, 384, [32], 1], ["AN", 1, 0, 5], ["AN", 1, 1, 6], ["PR", 1, 0, "auto_unroll_max_step$64"]]]], "r": [[5.58977e-06, 5.58856e-06, 5.58919e-06, 5.58148e-06], 0, 2.47358, 1668250417], "v": "v0.6"}
{"i": [["[\"0a4dc90579b37e287edc09d585f36844\", [1, 384, 2, 2], [1, 384, 1, 1]]", "cuda -keys=cuda,gpu -arch=sm_80 -max_num_threads=1024 -thread_warp_size=32", [-1, 16, 64, 49152, 2147483647, 1024, 8, 32], "", 0, []], [[], [["FU", 2, [0, 1, 2, 3]], ["SP", 2, 0, 384, [64], 1], ["AN", 2, 0, 5], ["AN", 2, 1, 6], ["FU", 1, [0, 1, 2, 3]], ["SP", 1, 0, 384, [4], 1], ["AN", 1, 0, 5], ["AN", 1, 1, 6], ["PR", 1, 0, "auto_unroll_max_step$512"]]]], "r": [[5.32265e-06, 5.32259e-06, 5.32234e-06, 5.32267e-06], 0, 2.43173, 1668250419], "v": "v0.6"}
{"i": [["[\"0a4dc90579b37e287edc09d585f36844\", [1, 384, 2, 2], [1, 384, 1, 1]]", "cuda -keys=cuda,gpu -arch=sm_80 -max_num_threads=1024 -thread_warp_size=32", [-1, 16, 64, 49152, 2147483647, 1024, 8, 32], "", 0, []], [[], [["FU", 2, [0, 1, 2, 3]], ["SP", 2, 0, 384, [32], 1], ["AN", 2, 0, 5], ["AN", 2, 1, 6], ["FU", 1, [0, 1, 2, 3]], ["SP", 1, 0, 384, [1], 1], ["AN", 1, 0, 5], ["AN", 1, 1, 6], ["PR", 1, 0, "auto_unroll_max_step$1024"]]]], "r": [[5.77996e-06, 5.77985e-06, 5.77981e-06, 5.78009e-06], 0, 2.60313, 1668250421], "v": "v0.6"}
{"i": [["[\"0a4dc90579b37e287edc09d585f36844\", [1, 384, 2, 2], [1, 384, 1, 1]]", "cuda -keys=cuda,gpu -arch=sm_80 -max_num_threads=1024 -thread_warp_size=32", [-1, 16, 64, 49152, 2147483647, 1024, 8, 32], "", 0, []], [[], [["FU", 2, [0, 1, 2, 3]], ["SP", 2, 0, 384, [1], 1], ["AN", 2, 0, 5], ["AN", 2, 1, 6], ["FU", 1, [0, 1, 2, 3]], ["SP", 1, 0, 384, [24], 1], ["AN", 1, 0, 5], ["AN", 1, 1, 6], ["PR", 1, 0, "auto_unroll_max_step$64"]]]], "r": [[5.63621e-06, 5.63631e-06, 5.63605e-06, 5.63562e-06], 0, 2.57999, 1668250423], "v": "v0.6"}
{"i": [["[\"0a4dc90579b37e287edc09d585f36844\", [1, 384, 2, 2], [1, 384, 1, 1]]", "cuda -keys=cuda,gpu -arch=sm_80 -max_num_threads=1024 -thread_warp_size=32", [-1, 16, 64, 49152, 2147483647, 1024, 8, 32], "", 0, []], [[], [["FU", 2, [0, 1, 2, 3]], ["SP", 2, 0, 384, [24], 1], ["AN", 2, 0, 5], ["AN", 2, 1, 6], ["FU", 1, [0, 1, 2, 3]], ["SP", 1, 0, 384, [2], 1], ["AN", 1, 0, 5], ["AN", 1, 1, 6], ["PR", 1, 0, "auto_unroll_max_step$1024"]]]], "r": [[5.37101e-06, 5.37098e-06, 5.37088e-06, 5.37073e-06], 0, 2.49777, 1668250425], "v": "v0.6"}
{"i": [["[\"0a4dc90579b37e287edc09d585f36844\", [1, 384, 2, 2], [1, 384, 1, 1]]", "cuda -keys=cuda,gpu -arch=sm_80 -max_num_threads=1024 -thread_warp_size=32", [-1, 16, 64, 49152, 2147483647, 1024, 8, 32], "", 0, []], [[], [["FU", 2, [0, 1, 2, 3]], ["SP", 2, 0, 384, [8], 1], ["AN", 2, 0, 5], ["AN", 2, 1, 6], ["FU", 1, [0, 1, 2, 3]], ["SP", 1, 0, 384, [4], 1], ["AN", 1, 0, 5], ["AN", 1, 1, 6], ["PR", 1, 0, "auto_unroll_max_step$64"]]]], "r": [[5.55696e-06, 5.55696e-06, 5.55703e-06, 5.557e-06], 0, 2.46265, 1668250427], "v": "v0.6"}
{"i": [["[\"0a4dc90579b37e287edc09d585f36844\", [1, 384, 2, 2], [1, 384, 1, 1]]", "cuda -keys=cuda,gpu -arch=sm_80 -max_num_threads=1024 -thread_warp_size=32", [-1, 16, 64, 49152, 2147483647, 1024, 8, 32], "", 0, []], [[], [["FU", 2, [0, 1, 2, 3]], ["SP", 2, 0, 384, [64], 1], ["AN", 2, 0, 5], ["AN", 2, 1, 6], ["FU", 1, [0, 1, 2, 3]], ["SP", 1, 0, 384, [32], 1], ["AN", 1, 0, 5], ["AN", 1, 1, 6], ["PR", 1, 0, "auto_unroll_max_step$0"]]]], "r": [[5.39489e-06, 5.3951e-06, 5.39465e-06, 5.39475e-06], 0, 2.45389, 1668250430], "v": "v0.6"}
{"i": [["[\"0a4dc90579b37e287edc09d585f36844\", [1, 384, 2, 2], [1, 384, 1, 1]]", "cuda -keys=cuda,gpu -arch=sm_80 -max_num_threads=1024 -thread_warp_size=32", [-1, 16, 64, 49152, 2147483647, 1024, 8, 32], "", 0, []], [[], [["FU", 2, [0, 1, 2, 3]], ["SP", 2, 0, 384, [32], 1], ["AN", 2, 0, 5], ["AN", 2, 1, 6], ["FU", 1, [0, 1, 2, 3]], ["SP", 1, 0, 384, [64], 1], ["AN", 1, 0, 5], ["AN", 1, 1, 6], ["PR", 1, 0, "auto_unroll_max_step$512"]]]], "r": [[5.36773e-06, 5.36378e-06, 5.36341e-06, 5.3632e-06], 0, 2.46894, 1668250432], "v": "v0.6"}
{"i": [["[\"0a4dc90579b37e287edc09d585f36844\", [1, 384, 2, 2], [1, 384, 1, 1]]", "cuda -keys=cuda,gpu -arch=sm_80 -max_num_threads=1024 -thread_warp_size=32", [-1, 16, 64, 49152, 2147483647, 1024, 8, 32], "", 0, []], [[], [["FU", 2, [0, 1, 2, 3]], ["SP", 2, 0, 384, [32], 1], ["AN", 2, 0, 5], ["AN", 2, 1, 6], ["FU", 1, [0, 1, 2, 3]], ["SP", 1, 0, 384, [32], 1], ["AN", 1, 0, 5], ["AN", 1, 1, 6], ["PR", 1, 0, "auto_unroll_max_step$512"]]]], "r": [[5.12095e-06, 5.09542e-06, 5.0721e-06, 5.06866e-06], 0, 2.40831, 1668250434], "v": "v0.6"}
{"i": [["[\"0a4dc90579b37e287edc09d585f36844\", [1, 384, 2, 2], [1, 384, 1, 1]]", "cuda -keys=cuda,gpu -arch=sm_80 -max_num_threads=1024 -thread_warp_size=32", [-1, 16, 64, 49152, 2147483647, 1024, 8, 32], "", 0, []], [[], [["FU", 2, [0, 1, 2, 3]], ["SP", 2, 0, 384, [24], 1], ["AN", 2, 0, 5], ["AN", 2, 1, 6], ["FU", 1, [0, 1, 2, 3]], ["SP", 1, 0, 384, [32], 1], ["AN", 1, 0, 5], ["AN", 1, 1, 6], ["PR", 1, 0, "auto_unroll_max_step$1024"]]]], "r": [[5.17074e-06, 5.17071e-06, 5.16833e-06, 5.16913e-06], 0, 2.45703, 1668250436], "v": "v0.6"}
{"i": [["[\"0a4dc90579b37e287edc09d585f36844\", [1, 384, 2, 2], [1, 384, 1, 1]]", "cuda -keys=cuda,gpu -arch=sm_80 -max_num_threads=1024 -thread_warp_size=32", [-1, 16, 64, 49152, 2147483647, 1024, 8, 32], "", 0, []], [[], [["FU", 2, [0, 1, 2, 3]], ["SP", 2, 0, 384, [2], 1], ["AN", 2, 0, 5], ["AN", 2, 1, 6], ["FU", 1, [0, 1, 2, 3]], ["SP", 1, 0, 384, [1], 1], ["AN", 1, 0, 5], ["AN", 1, 1, 6], ["PR", 1, 0, "auto_unroll_max_step$0"]]]], "r": [[5.68898e-06, 5.68501e-06, 5.68768e-06, 5.69376e-06], 0, 2.47273, 1668250438], "v": "v0.6"}
{"i": [["[\"0a4dc90579b37e287edc09d585f36844\", [1, 384, 2, 2], [1, 384, 1, 1]]", "cuda -keys=cuda,gpu -arch=sm_80 -max_num_threads=1024 -thread_warp_size=32", [-1, 16, 64, 49152, 2147483647, 1024, 8, 32], "", 0, []], [[], [["FU", 2, [0, 1, 2, 3]], ["SP", 2, 0, 384, [16], 1], ["AN", 2, 0, 5], ["AN", 2, 1, 6], ["FU", 1, [0, 1, 2, 3]], ["SP", 1, 0, 384, [8], 1], ["AN", 1, 0, 5], ["AN", 1, 1, 6], ["PR", 1, 0, "auto_unroll_max_step$1024"]]]], "r": [[5.57522e-06, 5.57514e-06, 5.57493e-06, 5.57509e-06], 0, 2.38699, 1668250440], "v": "v0.6"}
{"i": [["[\"0a4dc90579b37e287edc09d585f36844\", [1, 384, 2, 2], [1, 384, 1, 1]]", "cuda -keys=cuda,gpu -arch=sm_80 -max_num_threads=1024 -thread_warp_size=32", [-1, 16, 64, 49152, 2147483647, 1024, 8, 32], "", 0, []], [[], [["FU", 2, [0, 1, 2, 3]], ["SP", 2, 0, 384, [1], 1], ["AN", 2, 0, 5], ["AN", 2, 1, 6], ["FU", 1, [0, 1, 2, 3]], ["SP", 1, 0, 384, [1], 1], ["AN", 1, 0, 5], ["AN", 1, 1, 6], ["PR", 1, 0, "auto_unroll_max_step$64"]]]], "r": [[5.80534e-06, 5.80543e-06, 5.80537e-06, 5.80532e-06], 0, 2.42956, 1668250443], "v": "v0.6"}
{"i": [["[\"0a4dc90579b37e287edc09d585f36844\", [1, 384, 2, 2], [1, 384, 1, 1]]", "cuda -keys=cuda,gpu -arch=sm_80 -max_num_threads=1024 -thread_warp_size=32", [-1, 16, 64, 49152, 2147483647, 1024, 8, 32], "", 0, []], [[], [["FU", 2, [0, 1, 2, 3]], ["SP", 2, 0, 384, [4], 1], ["AN", 2, 0, 5], ["AN", 2, 1, 6], ["FU", 1, [0, 1, 2, 3]], ["SP", 1, 0, 384, [2], 1], ["AN", 1, 0, 5], ["AN", 1, 1, 6], ["PR", 1, 0, "auto_unroll_max_step$1024"]]]], "r": [[5.89588e-06, 5.89588e-06, 5.89598e-06, 5.89612e-06], 0, 2.48928, 1668250445], "v": "v0.6"}
{"i": [["[\"0a4dc90579b37e287edc09d585f36844\", [1, 384, 2, 2], [1, 384, 1, 1]]", "cuda -keys=cuda,gpu -arch=sm_80 -max_num_threads=1024 -thread_warp_size=32", [-1, 16, 64, 49152, 2147483647, 1024, 8, 32], "", 0, []], [[], [["FU", 2, [0, 1, 2, 3]], ["SP", 2, 0, 384, [16], 1], ["AN", 2, 0, 5], ["AN", 2, 1, 6], ["FU", 1, [0, 1, 2, 3]], ["SP", 1, 0, 384, [64], 1], ["AN", 1, 0, 5], ["AN", 1, 1, 6], ["PR", 1, 0, "auto_unroll_max_step$1024"]]]], "r": [[5.40405e-06, 5.40509e-06, 5.40694e-06, 5.40573e-06], 0, 2.4716, 1668250447], "v": "v0.6"}
{"i": [["[\"0a4dc90579b37e287edc09d585f36844\", [1, 384, 2, 2], [1, 384, 1, 1]]", "cuda -keys=cuda,gpu -arch=sm_80 -max_num_threads=1024 -thread_warp_size=32", [-1, 16, 64, 49152, 2147483647, 1024, 8, 32], "", 0, []], [[], [["FU", 2, [0, 1, 2, 3]], ["SP", 2, 0, 384, [8], 1], ["AN", 2, 0, 5], ["AN", 2, 1, 6], ["FU", 1, [0, 1, 2, 3]], ["SP", 1, 0, 384, [2], 1], ["AN", 1, 0, 5], ["AN", 1, 1, 6], ["PR", 1, 0, "auto_unroll_max_step$16"]]]], "r": [[5.55642e-06, 5.55851e-06, 5.55662e-06, 5.55398e-06], 0, 2.44655, 1668250449], "v": "v0.6"}
{"i": [["[\"0a4dc90579b37e287edc09d585f36844\", [1, 384, 2, 2], [1, 384, 1, 1]]", "cuda -keys=cuda,gpu -arch=sm_80 -max_num_threads=1024 -thread_warp_size=32", [-1, 16, 64, 49152, 2147483647, 1024, 8, 32], "", 0, []], [[], [["FU", 2, [0, 1, 2, 3]], ["SP", 2, 0, 384, [2], 1], ["AN", 2, 0, 5], ["AN", 2, 1, 6], ["FU", 1, [0, 1, 2, 3]], ["SP", 1, 0, 384, [8], 1], ["AN", 1, 0, 5], ["AN", 1, 1, 6], ["PR", 1, 0, "auto_unroll_max_step$0"]]]], "r": [[5.72227e-06, 5.72162e-06, 5.72226e-06, 5.72354e-06], 0, 2.72116, 1668250451], "v": "v0.6"}
{"i": [["[\"0a4dc90579b37e287edc09d585f36844\", [1, 384, 2, 2], [1, 384, 1, 1]]", "cuda -keys=cuda,gpu -arch=sm_80 -max_num_threads=1024 -thread_warp_size=32", [-1, 16, 64, 49152, 2147483647, 1024, 8, 32], "", 0, []], [[], [["FU", 2, [0, 1, 2, 3]], ["SP", 2, 0, 384, [48], 1], ["AN", 2, 0, 5], ["AN", 2, 1, 6], ["FU", 1, [0, 1, 2, 3]], ["SP", 1, 0, 384, [64], 1], ["AN", 1, 0, 5], ["AN", 1, 1, 6], ["PR", 1, 0, "auto_unroll_max_step$512"]]]], "r": [[5.40786e-06, 5.40778e-06, 5.40785e-06, 5.40754e-06], 0, 2.6444, 1668250454], "v": "v0.6"}
{"i": [["[\"0a4dc90579b37e287edc09d585f36844\", [1, 384, 2, 2], [1, 384, 1, 1]]", "cuda -keys=cuda,gpu -arch=sm_80 -max_num_threads=1024 -thread_warp_size=32", [-1, 16, 64, 49152, 2147483647, 1024, 8, 32], "", 0, []], [[], [["FU", 2, [0, 1, 2, 3]], ["SP", 2, 0, 384, [12], 1], ["AN", 2, 0, 5], ["AN", 2, 1, 6], ["FU", 1, [0, 1, 2, 3]], ["SP", 1, 0, 384, [64], 1], ["AN", 1, 0, 5], ["AN", 1, 1, 6], ["PR", 1, 0, "auto_unroll_max_step$64"]]]], "r": [[5.40329e-06, 5.40312e-06, 5.40336e-06, 5.40344e-06], 0, 2.51639, 1668250456], "v": "v0.6"}
{"i": [["[\"0a4dc90579b37e287edc09d585f36844\", [1, 384, 2, 2], [1, 384, 1, 1]]", "cuda -keys=cuda,gpu -arch=sm_80 -max_num_threads=1024 -thread_warp_size=32", [-1, 16, 64, 49152, 2147483647, 1024, 8, 32], "", 0, []], [[], [["FU", 2, [0, 1, 2, 3]], ["SP", 2, 0, 384, [32], 1], ["AN", 2, 0, 5], ["AN", 2, 1, 6], ["FU", 1, [0, 1, 2, 3]], ["SP", 1, 0, 384, [12], 1], ["AN", 1, 0, 5], ["AN", 1, 1, 6], ["PR", 1, 0, "auto_unroll_max_step$512"]]]], "r": [[5.49526e-06, 5.49509e-06, 5.49504e-06, 5.49516e-06], 0, 2.59073, 1668250458], "v": "v0.6"}
{"i": [["[\"0a4dc90579b37e287edc09d585f36844\", [1, 384, 2, 2], [1, 384, 1, 1]]", "cuda -keys=cuda,gpu -arch=sm_80 -max_num_threads=1024 -thread_warp_size=32", [-1, 16, 64, 49152, 2147483647, 1024, 8, 32], "", 0, []], [[], [["FU", 2, [0, 1, 2, 3]], ["SP", 2, 0, 384, [4], 1], ["AN", 2, 0, 5], ["AN", 2, 1, 6], ["FU", 1, [0, 1, 2, 3]], ["SP", 1, 0, 384, [8], 1], ["AN", 1, 0, 5], ["AN", 1, 1, 6], ["PR", 1, 0, "auto_unroll_max_step$1024"]]]], "r": [[5.37207e-06, 5.37186e-06, 5.37203e-06, 5.37521e-06], 0, 2.65143, 1668250460], "v": "v0.6"}
{"i": [["[\"0a4dc90579b37e287edc09d585f36844\", [1, 384, 2, 2], [1, 384, 1, 1]]", "cuda -keys=cuda,gpu -arch=sm_80 -max_num_threads=1024 -thread_warp_size=32", [-1, 16, 64, 49152, 2147483647, 1024, 8, 32], "", 0, []], [[], [["FU", 2, [0, 1, 2, 3]], ["SP", 2, 0, 384, [64], 1], ["AN", 2, 0, 5], ["AN", 2, 1, 6], ["FU", 1, [0, 1, 2, 3]], ["SP", 1, 0, 384, [2], 1], ["AN", 1, 0, 5], ["AN", 1, 1, 6], ["PR", 1, 0, "auto_unroll_max_step$0"]]]], "r": [[5.42421e-06, 5.42412e-06, 5.42404e-06, 5.42413e-06], 0, 2.40366, 1668250462], "v": "v0.6"}
{"i": [["[\"0a4dc90579b37e287edc09d585f36844\", [1, 384, 2, 2], [1, 384, 1, 1]]", "cuda -keys=cuda,gpu -arch=sm_80 -max_num_threads=1024 -thread_warp_size=32", [-1, 16, 64, 49152, 2147483647, 1024, 8, 32], "", 0, []], [[], [["FU", 2, [0, 1, 2, 3]], ["SP", 2, 0, 384, [16], 1], ["AN", 2, 0, 5], ["AN", 2, 1, 6], ["FU", 1, [0, 1, 2, 3]], ["SP", 1, 0, 384, [2], 1], ["AN", 1, 0, 5], ["AN", 1, 1, 6], ["PR", 1, 0, "auto_unroll_max_step$0"]]]], "r": [[5.62982e-06, 5.62868e-06, 5.62993e-06, 5.63122e-06], 0, 2.44707, 1668250464], "v": "v0.6"}
{"i": [["[\"0a4dc90579b37e287edc09d585f36844\", [1, 384, 2, 2], [1, 384, 1, 1]]", "cuda -keys=cuda,gpu -arch=sm_80 -max_num_threads=1024 -thread_warp_size=32", [-1, 16, 64, 49152, 2147483647, 1024, 8, 32], "", 0, []], [[], [["FU", 2, [0, 1, 2, 3]], ["SP", 2, 0, 384, [32], 1], ["AN", 2, 0, 5], ["AN", 2, 1, 6], ["FU", 1, [0, 1, 2, 3]], ["SP", 1, 0, 384, [8], 1], ["AN", 1, 0, 5], ["AN", 1, 1, 6], ["PR", 1, 0, "auto_unroll_max_step$512"]]]], "r": [[5.4659e-06, 5.46616e-06, 5.46626e-06, 5.4661e-06], 0, 2.51963, 1668250467], "v": "v0.6"}
{"i": [["[\"0a4dc90579b37e287edc09d585f36844\", [1, 384, 2, 2], [1, 384, 1, 1]]", "cuda -keys=cuda,gpu -arch=sm_80 -max_num_threads=1024 -thread_warp_size=32", [-1, 16, 64, 49152, 2147483647, 1024, 8, 32], "", 0, []], [[], [["FU", 2, [0, 1, 2, 3]], ["SP", 2, 0, 384, [24], 1], ["AN", 2, 0, 5], ["AN", 2, 1, 6], ["FU", 1, [0, 1, 2, 3]], ["SP", 1, 0, 384, [64], 1], ["AN", 1, 0, 5], ["AN", 1, 1, 6], ["PR", 1, 0, "auto_unroll_max_step$512"]]]], "r": [[5.40081e-06, 5.40074e-06, 5.40086e-06, 5.40087e-06], 0, 2.44637, 1668250469], "v": "v0.6"}
{"i": [["[\"0a4dc90579b37e287edc09d585f36844\", [1, 384, 2, 2], [1, 384, 1, 1]]", "cuda -keys=cuda,gpu -arch=sm_80 -max_num_threads=1024 -thread_warp_size=32", [-1, 16, 64, 49152, 2147483647, 1024, 8, 32], "", 0, []], [[], [["FU", 2, [0, 1, 2, 3]], ["SP", 2, 0, 384, [4], 1], ["AN", 2, 0, 5], ["AN", 2, 1, 6], ["FU", 1, [0, 1, 2, 3]], ["SP", 1, 0, 384, [16], 1], ["AN", 1, 0, 5], ["AN", 1, 1, 6], ["PR", 1, 0, "auto_unroll_max_step$1024"]]]], "r": [[5.325e-06, 5.3255e-06, 5.32559e-06, 5.32753e-06], 0, 2.42569, 1668250471], "v": "v0.6"}
{"i": [["[\"0a4dc90579b37e287edc09d585f36844\", [1, 384, 2, 2], [1, 384, 1, 1]]", "cuda -keys=cuda,gpu -arch=sm_80 -max_num_threads=1024 -thread_warp_size=32", [-1, 16, 64, 49152, 2147483647, 1024, 8, 32], "", 0, []], [[], [["FU", 2, [0, 1, 2, 3]], ["SP", 2, 0, 384, [1], 1], ["AN", 2, 0, 5], ["AN", 2, 1, 6], ["FU", 1, [0, 1, 2, 3]], ["SP", 1, 0, 384, [8], 1], ["AN", 1, 0, 5], ["AN", 1, 1, 6], ["PR", 1, 0, "auto_unroll_max_step$64"]]]], "r": [[5.48651e-06, 5.48774e-06, 5.48348e-06, 5.48005e-06], 0, 2.43984, 1668250473], "v": "v0.6"}
{"i": [["[\"0a4dc90579b37e287edc09d585f36844\", [1, 384, 2, 2], [1, 384, 1, 1]]", "cuda -keys=cuda,gpu -arch=sm_80 -max_num_threads=1024 -thread_warp_size=32", [-1, 16, 64, 49152, 2147483647, 1024, 8, 32], "", 0, []], [[], [["FU", 2, [0, 1, 2, 3]], ["SP", 2, 0, 384, [2], 1], ["AN", 2, 0, 5], ["AN", 2, 1, 6], ["FU", 1, [0, 1, 2, 3]], ["SP", 1, 0, 384, [8], 1], ["AN", 1, 0, 5], ["AN", 1, 1, 6], ["PR", 1, 0, "auto_unroll_max_step$1024"]]]], "r": [[5.72305e-06, 5.72307e-06, 5.7229e-06, 5.72298e-06], 0, 2.50967, 1668250475], "v": "v0.6"}
{"i": [["[\"0a4dc90579b37e287edc09d585f36844\", [1, 384, 2, 2], [1, 384, 1, 1]]", "cuda -keys=cuda,gpu -arch=sm_80 -max_num_threads=1024 -thread_warp_size=32", [-1, 16, 64, 49152, 2147483647, 1024, 8, 32], "", 0, []], [[], [["FU", 2, [0, 1, 2, 3]], ["SP", 2, 0, 384, [16], 1], ["AN", 2, 0, 5], ["AN", 2, 1, 6], ["FU", 1, [0, 1, 2, 3]], ["SP", 1, 0, 384, [24], 1], ["AN", 1, 0, 5], ["AN", 1, 1, 6], ["PR", 1, 0, "auto_unroll_max_step$1024"]]]], "r": [[5.46051e-06, 5.46052e-06, 5.46028e-06, 5.46025e-06], 0, 2.44037, 1668250477], "v": "v0.6"}
{"i": [["[\"0a4dc90579b37e287edc09d585f36844\", [1, 384, 2, 2], [1, 384, 1, 1]]", "cuda -keys=cuda,gpu -arch=sm_80 -max_num_threads=1024 -thread_warp_size=32", [-1, 16, 64, 49152, 2147483647, 1024, 8, 32], "", 0, []], [[], [["FU", 2, [0, 1, 2, 3]], ["SP", 2, 0, 384, [32], 1], ["AN", 2, 0, 5], ["AN", 2, 1, 6], ["FU", 1, [0, 1, 2, 3]], ["SP", 1, 0, 384, [3], 1], ["AN", 1, 0, 5], ["AN", 1, 1, 6], ["PR", 1, 0, "auto_unroll_max_step$16"]]]], "r": [[5.57614e-06, 5.57316e-06, 5.57412e-06, 5.57694e-06], 0, 2.47457, 1668250480], "v": "v0.6"}
{"i": [["[\"0a4dc90579b37e287edc09d585f36844\", [1, 384, 2, 2], [1, 384, 1, 1]]", "cuda -keys=cuda,gpu -arch=sm_80 -max_num_threads=1024 -thread_warp_size=32", [-1, 16, 64, 49152, 2147483647, 1024, 8, 32], "", 0, []], [[], [["FU", 2, [0, 1, 2, 3]], ["SP", 2, 0, 384, [4], 1], ["AN", 2, 0, 5], ["AN", 2, 1, 6], ["FU", 1, [0, 1, 2, 3]], ["SP", 1, 0, 384, [48], 1], ["AN", 1, 0, 5], ["AN", 1, 1, 6], ["PR", 1, 0, "auto_unroll_max_step$512"]]]], "r": [[5.18588e-06, 5.18581e-06, 5.18598e-06, 5.18585e-06], 0, 2.47635, 1668250482], "v": "v0.6"}
{"i": [["[\"0a4dc90579b37e287edc09d585f36844\", [1, 384, 2, 2], [1, 384, 1, 1]]", "cuda -keys=cuda,gpu -arch=sm_80 -max_num_threads=1024 -thread_warp_size=32", [-1, 16, 64, 49152, 2147483647, 1024, 8, 32], "", 0, []], [[], [["FU", 2, [0, 1, 2, 3]], ["SP", 2, 0, 384, [4], 1], ["AN", 2, 0, 5], ["AN", 2, 1, 6], ["FU", 1, [0, 1, 2, 3]], ["SP", 1, 0, 384, [64], 1], ["AN", 1, 0, 5], ["AN", 1, 1, 6], ["PR", 1, 0, "auto_unroll_max_step$512"]]]], "r": [[5.21635e-06, 5.21864e-06, 5.21811e-06, 5.22248e-06], 0, 2.34721, 1668250484], "v": "v0.6"}
{"i": [["[\"0a4dc90579b37e287edc09d585f36844\", [1, 384, 2, 2], [1, 384, 1, 1]]", "cuda -keys=cuda,gpu -arch=sm_80 -max_num_threads=1024 -thread_warp_size=32", [-1, 16, 64, 49152, 2147483647, 1024, 8, 32], "", 0, []], [[], [["FU", 2, [0, 1, 2, 3]], ["SP", 2, 0, 384, [1], 1], ["AN", 2, 0, 5], ["AN", 2, 1, 6], ["FU", 1, [0, 1, 2, 3]], ["SP", 1, 0, 384, [2], 1], ["AN", 1, 0, 5], ["AN", 1, 1, 6], ["PR", 1, 0, "auto_unroll_max_step$0"]]]], "r": [[6.09789e-06, 6.09774e-06, 6.09842e-06, 6.09924e-06], 0, 2.56453, 1668250486], "v": "v0.6"}
{"i": [["[\"0a4dc90579b37e287edc09d585f36844\", [1, 384, 2, 2], [1, 384, 1, 1]]", "cuda -keys=cuda,gpu -arch=sm_80 -max_num_threads=1024 -thread_warp_size=32", [-1, 16, 64, 49152, 2147483647, 1024, 8, 32], "", 0, []], [[], [["FU", 2, [0, 1, 2, 3]], ["SP", 2, 0, 384, [64], 1], ["AN", 2, 0, 5], ["AN", 2, 1, 6], ["FU", 1, [0, 1, 2, 3]], ["SP", 1, 0, 384, [2], 1], ["AN", 1, 0, 5], ["AN", 1, 1, 6], ["PR", 1, 0, "auto_unroll_max_step$64"]]]], "r": [[5.37088e-06, 5.3709e-06, 5.37091e-06, 5.37079e-06], 0, 2.43661, 1668250488], "v": "v0.6"}
{"i": [["[\"0a4dc90579b37e287edc09d585f36844\", [1, 384, 2, 2], [1, 384, 1, 1]]", "cuda -keys=cuda,gpu -arch=sm_80 -max_num_threads=1024 -thread_warp_size=32", [-1, 16, 64, 49152, 2147483647, 1024, 8, 32], "", 0, []], [[], [["FU", 2, [0, 1, 2, 3]], ["SP", 2, 0, 384, [2], 1], ["AN", 2, 0, 5], ["AN", 2, 1, 6], ["FU", 1, [0, 1, 2, 3]], ["SP", 1, 0, 384, [4], 1], ["AN", 1, 0, 5], ["AN", 1, 1, 6], ["PR", 1, 0, "auto_unroll_max_step$0"]]]], "r": [[5.63846e-06, 5.63822e-06, 5.63855e-06, 5.63799e-06], 0, 2.47034, 1668250491], "v": "v0.6"}
{"i": [["[\"0a4dc90579b37e287edc09d585f36844\", [1, 384, 2, 2], [1, 384, 1, 1]]", "cuda -keys=cuda,gpu -arch=sm_80 -max_num_threads=1024 -thread_warp_size=32", [-1, 16, 64, 49152, 2147483647, 1024, 8, 32], "", 0, []], [[], [["FU", 2, [0, 1, 2, 3]], ["SP", 2, 0, 384, [4], 1], ["AN", 2, 0, 5], ["AN", 2, 1, 6], ["FU", 1, [0, 1, 2, 3]], ["SP", 1, 0, 384, [1], 1], ["AN", 1, 0, 5], ["AN", 1, 1, 6], ["PR", 1, 0, "auto_unroll_max_step$1024"]]]], "r": [[5.51302e-06, 5.51295e-06, 5.51292e-06, 5.51297e-06], 0, 2.4389, 1668250493], "v": "v0.6"}
{"i": [["[\"0a4dc90579b37e287edc09d585f36844\", [1, 384, 2, 2], [1, 384, 1, 1]]", "cuda -keys=cuda,gpu -arch=sm_80 -max_num_threads=1024 -thread_warp_size=32", [-1, 16, 64, 49152, 2147483647, 1024, 8, 32], "", 0, []], [[], [["FU", 2, [0, 1, 2, 3]], ["SP", 2, 0, 384, [16], 1], ["AN", 2, 0, 5], ["AN", 2, 1, 6], ["FU", 1, [0, 1, 2, 3]], ["SP", 1, 0, 384, [12], 1], ["AN", 1, 0, 5], ["AN", 1, 1, 6], ["PR", 1, 0, "auto_unroll_max_step$1024"]]]], "r": [[5.49378e-06, 5.49351e-06, 5.49347e-06, 5.4948e-06], 0, 2.41873, 1668250495], "v": "v0.6"}
{"i": [["[\"0a4dc90579b37e287edc09d585f36844\", [1, 384, 2, 2], [1, 384, 1, 1]]", "cuda -keys=cuda,gpu -arch=sm_80 -max_num_threads=1024 -thread_warp_size=32", [-1, 16, 64, 49152, 2147483647, 1024, 8, 32], "", 0, []], [[], [["FU", 2, [0, 1, 2, 3]], ["SP", 2, 0, 384, [4], 1], ["AN", 2, 0, 5], ["AN", 2, 1, 6], ["FU", 1, [0, 1, 2, 3]], ["SP", 1, 0, 384, [64], 1], ["AN", 1, 0, 5], ["AN", 1, 1, 6], ["PR", 1, 0, "auto_unroll_max_step$0"]]]], "r": [[5.23476e-06, 5.2347e-06, 5.23492e-06, 5.2348e-06], 0, 2.42694, 1668250497], "v": "v0.6"}
{"i": [["[\"0a4dc90579b37e287edc09d585f36844\", [1, 384, 2, 2], [1, 384, 1, 1]]", "cuda -keys=cuda,gpu -arch=sm_80 -max_num_threads=1024 -thread_warp_size=32", [-1, 16, 64, 49152, 2147483647, 1024, 8, 32], "", 0, []], [[], [["FU", 2, [0, 1, 2, 3]], ["SP", 2, 0, 384, [32], 1], ["AN", 2, 0, 5], ["AN", 2, 1, 6], ["FU", 1, [0, 1, 2, 3]], ["SP", 1, 0, 384, [1], 1], ["AN", 1, 0, 5], ["AN", 1, 1, 6], ["PR", 1, 0, "auto_unroll_max_step$512"]]]], "r": [[5.53018e-06, 5.53119e-06, 5.52975e-06, 5.5301e-06], 0, 2.45391, 1668250499], "v": "v0.6"}
{"i": [["[\"0a4dc90579b37e287edc09d585f36844\", [1, 384, 2, 2], [1, 384, 1, 1]]", "cuda -keys=cuda,gpu -arch=sm_80 -max_num_threads=1024 -thread_warp_size=32", [-1, 16, 64, 49152, 2147483647, 1024, 8, 32], "", 0, []], [[], [["FU", 2, [0, 1, 2, 3]], ["SP", 2, 0, 384, [16], 1], ["AN", 2, 0, 5], ["AN", 2, 1, 6], ["FU", 1, [0, 1, 2, 3]], ["SP", 1, 0, 384, [8], 1], ["AN", 1, 0, 5], ["AN", 1, 1, 6], ["PR", 1, 0, "auto_unroll_max_step$64"]]]], "r": [[5.2821e-06, 5.26878e-06, 5.26379e-06, 5.26466e-06], 0, 2.32589, 1668250504], "v": "v0.6"}
{"i": [["[\"0a4dc90579b37e287edc09d585f36844\", [1, 384, 2, 2], [1, 384, 1, 1]]", "cuda -keys=cuda,gpu -arch=sm_80 -max_num_threads=1024 -thread_warp_size=32", [-1, 16, 64, 49152, 2147483647, 1024, 8, 32], "", 0, []], [[], [["FU", 2, [0, 1, 2, 3]], ["SP", 2, 0, 384, [32], 1], ["AN", 2, 0, 5], ["AN", 2, 1, 6], ["FU", 1, [0, 1, 2, 3]], ["SP", 1, 0, 384, [32], 1], ["AN", 1, 0, 5], ["AN", 1, 1, 6], ["PR", 1, 0, "auto_unroll_max_step$16"]]]], "r": [[4.9465e-06, 4.94658e-06, 4.94666e-06, 4.94666e-06], 0, 2.34116, 1668250506], "v": "v0.6"}
{"i": [["[\"0a4dc90579b37e287edc09d585f36844\", [1, 384, 2, 2], [1, 384, 1, 1]]", "cuda -keys=cuda,gpu -arch=sm_80 -max_num_threads=1024 -thread_warp_size=32", [-1, 16, 64, 49152, 2147483647, 1024, 8, 32], "", 0, []], [[], [["FU", 2, [0, 1, 2, 3]], ["SP", 2, 0, 384, [2], 1], ["AN", 2, 0, 5], ["AN", 2, 1, 6], ["FU", 1, [0, 1, 2, 3]], ["SP", 1, 0, 384, [2], 1], ["AN", 1, 0, 5], ["AN", 1, 1, 6], ["PR", 1, 0, "auto_unroll_max_step$1024"]]]], "r": [[5.38715e-06, 5.38706e-06, 5.38727e-06, 5.3871e-06], 0, 2.3847, 1668250508], "v": "v0.6"}
{"i": [["[\"0a4dc90579b37e287edc09d585f36844\", [1, 384, 2, 2], [1, 384, 1, 1]]", "cuda -keys=cuda,gpu -arch=sm_80 -max_num_threads=1024 -thread_warp_size=32", [-1, 16, 64, 49152, 2147483647, 1024, 8, 32], "", 0, []], [[], [["FU", 2, [0, 1, 2, 3]], ["SP", 2, 0, 384, [16], 1], ["AN", 2, 0, 5], ["AN", 2, 1, 6], ["FU", 1, [0, 1, 2, 3]], ["SP", 1, 0, 384, [32], 1], ["AN", 1, 0, 5], ["AN", 1, 1, 6], ["PR", 1, 0, "auto_unroll_max_step$16"]]]], "r": [[5.15216e-06, 5.15204e-06, 5.15212e-06, 5.15193e-06], 0, 2.38738, 1668250510], "v": "v0.6"}
{"i": [["[\"0a4dc90579b37e287edc09d585f36844\", [1, 384, 2, 2], [1, 384, 1, 1]]", "cuda -keys=cuda,gpu -arch=sm_80 -max_num_threads=1024 -thread_warp_size=32", [-1, 16, 64, 49152, 2147483647, 1024, 8, 32], "", 0, []], [[], [["FU", 2, [0, 1, 2, 3]], ["SP", 2, 0, 384, [8], 1], ["AN", 2, 0, 5], ["AN", 2, 1, 6], ["FU", 1, [0, 1, 2, 3]], ["SP", 1, 0, 384, [64], 1], ["AN", 1, 0, 5], ["AN", 1, 1, 6], ["PR", 1, 0, "auto_unroll_max_step$0"]]]], "r": [[5.49625e-06, 5.49607e-06, 5.49612e-06, 5.49598e-06], 0, 2.43329, 1668250512], "v": "v0.6"}
{"i": [["[\"0a4dc90579b37e287edc09d585f36844\", [1, 384, 2, 2], [1, 384, 1, 1]]", "cuda -keys=cuda,gpu -arch=sm_80 -max_num_threads=1024 -thread_warp_size=32", [-1, 16, 64, 49152, 2147483647, 1024, 8, 32], "", 0, []], [[], [["FU", 2, [0, 1, 2, 3]], ["SP", 2, 0, 384, [64], 1], ["AN", 2, 0, 5], ["AN", 2, 1, 6], ["FU", 1, [0, 1, 2, 3]], ["SP", 1, 0, 384, [1], 1], ["AN", 1, 0, 5], ["AN", 1, 1, 6], ["PR", 1, 0, "auto_unroll_max_step$0"]]]], "r": [[5.54492e-06, 5.54484e-06, 5.54478e-06, 5.5447e-06], 0, 2.42638, 1668250514], "v": "v0.6"}
{"i": [["[\"0a4dc90579b37e287edc09d585f36844\", [1, 384, 2, 2], [1, 384, 1, 1]]", "cuda -keys=cuda,gpu -arch=sm_80 -max_num_threads=1024 -thread_warp_size=32", [-1, 16, 64, 49152, 2147483647, 1024, 8, 32], "", 0, []], [[], [["FU", 2, [0, 1, 2, 3]], ["SP", 2, 0, 384, [64], 1], ["AN", 2, 0, 5], ["AN", 2, 1, 6], ["FU", 1, [0, 1, 2, 3]], ["SP", 1, 0, 384, [1], 1], ["AN", 1, 0, 5], ["AN", 1, 1, 6], ["PR", 1, 0, "auto_unroll_max_step$512"]]]], "r": [[5.53401e-06, 5.53416e-06, 5.53405e-06, 5.5339e-06], 0, 2.38356, 1668250516], "v": "v0.6"}
{"i": [["[\"0a4dc90579b37e287edc09d585f36844\", [1, 384, 2, 2], [1, 384, 1, 1]]", "cuda -keys=cuda,gpu -arch=sm_80 -max_num_threads=1024 -thread_warp_size=32", [-1, 16, 64, 49152, 2147483647, 1024, 8, 32], "", 0, []], [[], [["FU", 2, [0, 1, 2, 3]], ["SP", 2, 0, 384, [64], 1], ["AN", 2, 0, 5], ["AN", 2, 1, 6], ["FU", 1, [0, 1, 2, 3]], ["SP", 1, 0, 384, [32], 1], ["AN", 1, 0, 5], ["AN", 1, 1, 6], ["PR", 1, 0, "auto_unroll_max_step$512"]]]], "r": [[5.15623e-06, 5.15656e-06, 5.15466e-06, 5.14874e-06], 0, 2.40363, 1668250519], "v": "v0.6"}
{"i": [["[\"0a4dc90579b37e287edc09d585f36844\", [1, 384, 2, 2], [1, 384, 1, 1]]", "cuda -keys=cuda,gpu -arch=sm_80 -max_num_threads=1024 -thread_warp_size=32", [-1, 16, 64, 49152, 2147483647, 1024, 8, 32], "", 0, []], [[], [["FU", 2, [0, 1, 2, 3]], ["SP", 2, 0, 384, [8], 1], ["AN", 2, 0, 5], ["AN", 2, 1, 6], ["FU", 1, [0, 1, 2, 3]], ["SP", 1, 0, 384, [32], 1], ["AN", 1, 0, 5], ["AN", 1, 1, 6], ["PR", 1, 0, "auto_unroll_max_step$512"]]]], "r": [[5.43117e-06, 5.43112e-06, 5.4314e-06, 5.4313e-06], 0, 2.47591, 1668250521], "v": "v0.6"}
{"i": [["[\"0a4dc90579b37e287edc09d585f36844\", [1, 384, 2, 2], [1, 384, 1, 1]]", "cuda -keys=cuda,gpu -arch=sm_80 -max_num_threads=1024 -thread_warp_size=32", [-1, 16, 64, 49152, 2147483647, 1024, 8, 32], "", 0, []], [[], [["FU", 2, [0, 1, 2, 3]], ["SP", 2, 0, 384, [64], 1], ["AN", 2, 0, 5], ["AN", 2, 1, 6], ["FU", 1, [0, 1, 2, 3]], ["SP", 1, 0, 384, [64], 1], ["AN", 1, 0, 5], ["AN", 1, 1, 6], ["PR", 1, 0, "auto_unroll_max_step$512"]]]], "r": [[5.01336e-06, 5.01327e-06, 5.01323e-06, 5.01346e-06], 0, 2.31728, 1668250523], "v": "v0.6"}
{"i": [["[\"0a4dc90579b37e287edc09d585f36844\", [1, 384, 2, 2], [1, 384, 1, 1]]", "cuda -keys=cuda,gpu -arch=sm_80 -max_num_threads=1024 -thread_warp_size=32", [-1, 16, 64, 49152, 2147483647, 1024, 8, 32], "", 0, []], [[], [["FU", 2, [0, 1, 2, 3]], ["SP", 2, 0, 384, [32], 1], ["AN", 2, 0, 5], ["AN", 2, 1, 6], ["FU", 1, [0, 1, 2, 3]], ["SP", 1, 0, 384, [48], 1], ["AN", 1, 0, 5], ["AN", 1, 1, 6], ["PR", 1, 0, "auto_unroll_max_step$16"]]]], "r": [[5.3065e-06, 5.30682e-06, 5.30645e-06, 5.30673e-06], 0, 2.42981, 1668250525], "v": "v0.6"}
{"i": [["[\"0a4dc90579b37e287edc09d585f36844\", [1, 384, 2, 2], [1, 384, 1, 1]]", "cuda -keys=cuda,gpu -arch=sm_80 -max_num_threads=1024 -thread_warp_size=32", [-1, 16, 64, 49152, 2147483647, 1024, 8, 32], "", 0, []], [[], [["FU", 2, [0, 1, 2, 3]], ["SP", 2, 0, 384, [32], 1], ["AN", 2, 0, 5], ["AN", 2, 1, 6], ["FU", 1, [0, 1, 2, 3]], ["SP", 1, 0, 384, [1], 1], ["AN", 1, 0, 5], ["AN", 1, 1, 6], ["PR", 1, 0, "auto_unroll_max_step$64"]]]], "r": [[5.56864e-06, 5.56854e-06, 5.56872e-06, 5.5685e-06], 0, 2.4392, 1668250527], "v": "v0.6"}
{"i": [["[\"0a4dc90579b37e287edc09d585f36844\", [1, 384, 2, 2], [1, 384, 1, 1]]", "cuda -keys=cuda,gpu -arch=sm_80 -max_num_threads=1024 -thread_warp_size=32", [-1, 16, 64, 49152, 2147483647, 1024, 8, 32], "", 0, []], [[], [["FU", 2, [0, 1, 2, 3]], ["SP", 2, 0, 384, [4], 1], ["AN", 2, 0, 5], ["AN", 2, 1, 6], ["FU", 1, [0, 1, 2, 3]], ["SP", 1, 0, 384, [32], 1], ["AN", 1, 0, 5], ["AN", 1, 1, 6], ["PR", 1, 0, "auto_unroll_max_step$0"]]]], "r": [[5.20174e-06, 5.20174e-06, 5.20176e-06, 5.20156e-06], 0, 2.33101, 1668250529], "v": "v0.6"}
{"i": [["[\"0a4dc90579b37e287edc09d585f36844\", [1, 384, 2, 2], [1, 384, 1, 1]]", "cuda -keys=cuda,gpu -arch=sm_80 -max_num_threads=1024 -thread_warp_size=32", [-1, 16, 64, 49152, 2147483647, 1024, 8, 32], "", 0, []], [[], [["FU", 2, [0, 1, 2, 3]], ["SP", 2, 0, 384, [32], 1], ["AN", 2, 0, 5], ["AN", 2, 1, 6], ["FU", 1, [0, 1, 2, 3]], ["SP", 1, 0, 384, [32], 1], ["AN", 1, 0, 5], ["AN", 1, 1, 6], ["PR", 1, 0, "auto_unroll_max_step$0"]]]], "r": [[4.91967e-06, 4.91973e-06, 4.91987e-06, 4.91973e-06], 0, 2.33895, 1668250531], "v": "v0.6"}
{"i": [["[\"0a4dc90579b37e287edc09d585f36844\", [1, 384, 2, 2], [1, 384, 1, 1]]", "cuda -keys=cuda,gpu -arch=sm_80 -max_num_threads=1024 -thread_warp_size=32", [-1, 16, 64, 49152, 2147483647, 1024, 8, 32], "", 0, []], [[], [["FU", 2, [0, 1, 2, 3]], ["SP", 2, 0, 384, [32], 1], ["AN", 2, 0, 5], ["AN", 2, 1, 6], ["FU", 1, [0, 1, 2, 3]], ["SP", 1, 0, 384, [32], 1], ["AN", 1, 0, 5], ["AN", 1, 1, 6], ["PR", 1, 0, "auto_unroll_max_step$64"]]]], "r": [[5.18007e-06, 5.1801e-06, 5.18008e-06, 5.18022e-06], 0, 2.38263, 1668250533], "v": "v0.6"}
{"i": [["[\"0a4dc90579b37e287edc09d585f36844\", [1, 384, 2, 2], [1, 384, 1, 1]]", "cuda -keys=cuda,gpu -arch=sm_80 -max_num_threads=1024 -thread_warp_size=32", [-1, 16, 64, 49152, 2147483647, 1024, 8, 32], "", 0, []], [[], [["FU", 2, [0, 1, 2, 3]], ["SP", 2, 0, 384, [16], 1], ["AN", 2, 0, 5], ["AN", 2, 1, 6], ["FU", 1, [0, 1, 2, 3]], ["SP", 1, 0, 384, [16], 1], ["AN", 1, 0, 5], ["AN", 1, 1, 6], ["PR", 1, 0, "auto_unroll_max_step$0"]]]], "r": [[4.9569e-06, 4.95731e-06, 4.95727e-06, 4.95757e-06], 0, 2.38357, 1668250536], "v": "v0.6"}
{"i": [["[\"0a4dc90579b37e287edc09d585f36844\", [1, 384, 2, 2], [1, 384, 1, 1]]", "cuda -keys=cuda,gpu -arch=sm_80 -max_num_threads=1024 -thread_warp_size=32", [-1, 16, 64, 49152, 2147483647, 1024, 8, 32], "", 0, []], [[], [["FU", 2, [0, 1, 2, 3]], ["SP", 2, 0, 384, [16], 1], ["AN", 2, 0, 5], ["AN", 2, 1, 6], ["FU", 1, [0, 1, 2, 3]], ["SP", 1, 0, 384, [16], 1], ["AN", 1, 0, 5], ["AN", 1, 1, 6], ["PR", 1, 0, "auto_unroll_max_step$512"]]]], "r": [[5.17811e-06, 5.17812e-06, 5.17803e-06, 5.17805e-06], 0, 2.28381, 1668250543], "v": "v0.6"}
{"i": [["[\"0a4dc90579b37e287edc09d585f36844\", [1, 384, 2, 2], [1, 384, 1, 1]]", "cuda -keys=cuda,gpu -arch=sm_80 -max_num_threads=1024 -thread_warp_size=32", [-1, 16, 64, 49152, 2147483647, 1024, 8, 32], "", 0, []], [[], [["FU", 2, [0, 1, 2, 3]], ["SP", 2, 0, 384, [16], 1], ["AN", 2, 0, 5], ["AN", 2, 1, 6], ["FU", 1, [0, 1, 2, 3]], ["SP", 1, 0, 384, [2], 1], ["AN", 1, 0, 5], ["AN", 1, 1, 6], ["PR", 1, 0, "auto_unroll_max_step$16"]]]], "r": [[5.42309e-06, 5.42299e-06, 5.42301e-06, 5.42281e-06], 0, 2.38499, 1668250545], "v": "v0.6"}
{"i": [["[\"0a4dc90579b37e287edc09d585f36844\", [1, 384, 2, 2], [1, 384, 1, 1]]", "cuda -keys=cuda,gpu -arch=sm_80 -max_num_threads=1024 -thread_warp_size=32", [-1, 16, 64, 49152, 2147483647, 1024, 8, 32], "", 0, []], [[], [["FU", 2, [0, 1, 2, 3]], ["SP", 2, 0, 384, [32], 1], ["AN", 2, 0, 5], ["AN", 2, 1, 6], ["FU", 1, [0, 1, 2, 3]], ["SP", 1, 0, 384, [16], 1], ["AN", 1, 0, 5], ["AN", 1, 1, 6], ["PR", 1, 0, "auto_unroll_max_step$1024"]]]], "r": [[5.17487e-06, 5.1751e-06, 5.17356e-06, 5.17479e-06], 0, 2.39276, 1668250547], "v": "v0.6"}
{"i": [["[\"0a4dc90579b37e287edc09d585f36844\", [1, 384, 2, 2], [1, 384, 1, 1]]", "cuda -keys=cuda,gpu -arch=sm_80 -max_num_threads=1024 -thread_warp_size=32", [-1, 16, 64, 49152, 2147483647, 1024, 8, 32], "", 0, []], [[], [["FU", 2, [0, 1, 2, 3]], ["SP", 2, 0, 384, [16], 1], ["AN", 2, 0, 5], ["AN", 2, 1, 6], ["FU", 1, [0, 1, 2, 3]], ["SP", 1, 0, 384, [3], 1], ["AN", 1, 0, 5], ["AN", 1, 1, 6], ["PR", 1, 0, "auto_unroll_max_step$512"]]]], "r": [[5.39107e-06, 5.38428e-06, 5.38392e-06, 5.38259e-06], 0, 2.34047, 1668250549], "v": "v0.6"}
{"i": [["[\"0a4dc90579b37e287edc09d585f36844\", [1, 384, 2, 2], [1, 384, 1, 1]]", "cuda -keys=cuda,gpu -arch=sm_80 -max_num_threads=1024 -thread_warp_size=32", [-1, 16, 64, 49152, 2147483647, 1024, 8, 32], "", 0, []], [[], [["FU", 2, [0, 1, 2, 3]], ["SP", 2, 0, 384, [1], 1], ["AN", 2, 0, 5], ["AN", 2, 1, 6], ["FU", 1, [0, 1, 2, 3]], ["SP", 1, 0, 384, [2], 1], ["AN", 1, 0, 5], ["AN", 1, 1, 6], ["PR", 1, 0, "auto_unroll_max_step$1024"]]]], "r": [[5.69821e-06, 5.6977e-06, 5.69745e-06, 5.69835e-06], 0, 2.44917, 1668250551], "v": "v0.6"}
{"i": [["[\"0a4dc90579b37e287edc09d585f36844\", [1, 384, 2, 2], [1, 384, 1, 1]]", "cuda -keys=cuda,gpu -arch=sm_80 -max_num_threads=1024 -thread_warp_size=32", [-1, 16, 64, 49152, 2147483647, 1024, 8, 32], "", 0, []], [[], [["FU", 2, [0, 1, 2, 3]], ["SP", 2, 0, 384, [32], 1], ["AN", 2, 0, 5], ["AN", 2, 1, 6], ["FU", 1, [0, 1, 2, 3]], ["SP", 1, 0, 384, [64], 1], ["AN", 1, 0, 5], ["AN", 1, 1, 6], ["PR", 1, 0, "auto_unroll_max_step$1024"]]]], "r": [[5.5163e-06, 5.51785e-06, 5.5165e-06, 5.51414e-06], 0, 2.43057, 1668250553], "v": "v0.6"}
{"i": [["[\"0a4dc90579b37e287edc09d585f36844\", [1, 384, 2, 2], [1, 384, 1, 1]]", "cuda -keys=cuda,gpu -arch=sm_80 -max_num_threads=1024 -thread_warp_size=32", [-1, 16, 64, 49152, 2147483647, 1024, 8, 32], "", 0, []], [[], [["FU", 2, [0, 1, 2, 3]], ["SP", 2, 0, 384, [16], 1], ["AN", 2, 0, 5], ["AN", 2, 1, 6], ["FU", 1, [0, 1, 2, 3]], ["SP", 1, 0, 384, [2], 1], ["AN", 1, 0, 5], ["AN", 1, 1, 6], ["PR", 1, 0, "auto_unroll_max_step$512"]]]], "r": [[5.31666e-06, 5.31699e-06, 5.31695e-06, 5.31677e-06], 0, 2.39366, 1668250555], "v": "v0.6"}
{"i": [["[\"0a4dc90579b37e287edc09d585f36844\", [1, 384, 2, 2], [1, 384, 1, 1]]", "cuda -keys=cuda,gpu -arch=sm_80 -max_num_threads=1024 -thread_warp_size=32", [-1, 16, 64, 49152, 2147483647, 1024, 8, 32], "", 0, []], [[], [["FU", 2, [0, 1, 2, 3]], ["SP", 2, 0, 384, [64], 1], ["AN", 2, 0, 5], ["AN", 2, 1, 6], ["FU", 1, [0, 1, 2, 3]], ["SP", 1, 0, 384, [1], 1], ["AN", 1, 0, 5], ["AN", 1, 1, 6], ["PR", 1, 0, "auto_unroll_max_step$1024"]]]], "r": [[5.78401e-06, 5.78419e-06, 5.78401e-06, 5.7837e-06], 0, 2.48893, 1668250557], "v": "v0.6"}
{"i": [["[\"0a4dc90579b37e287edc09d585f36844\", [1, 384, 2, 2], [1, 384, 1, 1]]", "cuda -keys=cuda,gpu -arch=sm_80 -max_num_threads=1024 -thread_warp_size=32", [-1, 16, 64, 49152, 2147483647, 1024, 8, 32], "", 0, []], [[], [["FU", 2, [0, 1, 2, 3]], ["SP", 2, 0, 384, [48], 1], ["AN", 2, 0, 5], ["AN", 2, 1, 6], ["FU", 1, [0, 1, 2, 3]], ["SP", 1, 0, 384, [1], 1], ["AN", 1, 0, 5], ["AN", 1, 1, 6], ["PR", 1, 0, "auto_unroll_max_step$64"]]]], "r": [[5.95963e-06, 5.95957e-06, 5.95976e-06, 5.95993e-06], 0, 2.48504, 1668250560], "v": "v0.6"}
{"i": [["[\"0a4dc90579b37e287edc09d585f36844\", [1, 384, 2, 2], [1, 384, 1, 1]]", "cuda -keys=cuda,gpu -arch=sm_80 -max_num_threads=1024 -thread_warp_size=32", [-1, 16, 64, 49152, 2147483647, 1024, 8, 32], "", 0, []], [[], [["FU", 2, [0, 1, 2, 3]], ["SP", 2, 0, 384, [32], 1], ["AN", 2, 0, 5], ["AN", 2, 1, 6], ["FU", 1, [0, 1, 2, 3]], ["SP", 1, 0, 384, [1], 1], ["AN", 1, 0, 5], ["AN", 1, 1, 6], ["PR", 1, 0, "auto_unroll_max_step$0"]]]], "r": [[5.82498e-06, 5.83888e-06, 5.84072e-06, 5.84775e-06], 0, 2.41733, 1668250562], "v": "v0.6"}
{"i": [["[\"0a4dc90579b37e287edc09d585f36844\", [1, 384, 2, 2], [1, 384, 1, 1]]", "cuda -keys=cuda,gpu -arch=sm_80 -max_num_threads=1024 -thread_warp_size=32", [-1, 16, 64, 49152, 2147483647, 1024, 8, 32], "", 0, []], [[], [["FU", 2, [0, 1, 2, 3]], ["SP", 2, 0, 384, [24], 1], ["AN", 2, 0, 5], ["AN", 2, 1, 6], ["FU", 1, [0, 1, 2, 3]], ["SP", 1, 0, 384, [2], 1], ["AN", 1, 0, 5], ["AN", 1, 1, 6], ["PR", 1, 0, "auto_unroll_max_step$512"]]]], "r": [[5.33251e-06, 5.33244e-06, 5.33238e-06, 5.33226e-06], 0, 2.45262, 1668250564], "v": "v0.6"}
{"i": [["[\"0a4dc90579b37e287edc09d585f36844\", [1, 384, 2, 2], [1, 384, 1, 1]]", "cuda -keys=cuda,gpu -arch=sm_80 -max_num_threads=1024 -thread_warp_size=32", [-1, 16, 64, 49152, 2147483647, 1024, 8, 32], "", 0, []], [[], [["FU", 2, [0, 1, 2, 3]], ["SP", 2, 0, 384, [8], 1], ["AN", 2, 0, 5], ["AN", 2, 1, 6], ["FU", 1, [0, 1, 2, 3]], ["SP", 1, 0, 384, [64], 1], ["AN", 1, 0, 5], ["AN", 1, 1, 6], ["PR", 1, 0, "auto_unroll_max_step$64"]]]], "r": [[5.40918e-06, 5.40908e-06, 5.40905e-06, 5.40888e-06], 0, 2.46344, 1668250566], "v": "v0.6"}
{"i": [["[\"0a4dc90579b37e287edc09d585f36844\", [1, 384, 2, 2], [1, 384, 1, 1]]", "cuda -keys=cuda,gpu -arch=sm_80 -max_num_threads=1024 -thread_warp_size=32", [-1, 16, 64, 49152, 2147483647, 1024, 8, 32], "", 0, []], [[], [["FU", 2, [0, 1, 2, 3]], ["SP", 2, 0, 384, [4], 1], ["AN", 2, 0, 5], ["AN", 2, 1, 6], ["FU", 1, [0, 1, 2, 3]], ["SP", 1, 0, 384, [2], 1], ["AN", 1, 0, 5], ["AN", 1, 1, 6], ["PR", 1, 0, "auto_unroll_max_step$0"]]]], "r": [[5.97419e-06, 5.97394e-06, 5.97524e-06, 5.97563e-06], 0, 2.54467, 1668250568], "v": "v0.6"}
{"i": [["[\"0a4dc90579b37e287edc09d585f36844\", [1, 384, 2, 2], [1, 384, 1, 1]]", "cuda -keys=cuda,gpu -arch=sm_80 -max_num_threads=1024 -thread_warp_size=32", [-1, 16, 64, 49152, 2147483647, 1024, 8, 32], "", 0, []], [[], [["FU", 2, [0, 1, 2, 3]], ["SP", 2, 0, 384, [32], 1], ["AN", 2, 0, 5], ["AN", 2, 1, 6], ["FU", 1, [0, 1, 2, 3]], ["SP", 1, 0, 384, [8], 1], ["AN", 1, 0, 5], ["AN", 1, 1, 6], ["PR", 1, 0, "auto_unroll_max_step$0"]]]], "r": [[5.48099e-06, 5.48104e-06, 5.48076e-06, 5.48106e-06], 0, 2.42931, 1668250570], "v": "v0.6"}
{"i": [["[\"0a4dc90579b37e287edc09d585f36844\", [1, 384, 2, 2], [1, 384, 1, 1]]", "cuda -keys=cuda,gpu -arch=sm_80 -max_num_threads=1024 -thread_warp_size=32", [-1, 16, 64, 49152, 2147483647, 1024, 8, 32], "", 0, []], [[], [["FU", 2, [0, 1, 2, 3]], ["SP", 2, 0, 384, [16], 1], ["AN", 2, 0, 5], ["AN", 2, 1, 6], ["FU", 1, [0, 1, 2, 3]], ["SP", 1, 0, 384, [64], 1], ["AN", 1, 0, 5], ["AN", 1, 1, 6], ["PR", 1, 0, "auto_unroll_max_step$16"]]]], "r": [[5.40442e-06, 5.40446e-06, 5.4042e-06, 5.40435e-06], 0, 2.45694, 1668250573], "v": "v0.6"}
{"i": [["[\"0a4dc90579b37e287edc09d585f36844\", [1, 384, 2, 2], [1, 384, 1, 1]]", "cuda -keys=cuda,gpu -arch=sm_80 -max_num_threads=1024 -thread_warp_size=32", [-1, 16, 64, 49152, 2147483647, 1024, 8, 32], "", 0, []], [[], [["FU", 2, [0, 1, 2, 3]], ["SP", 2, 0, 384, [48], 1], ["AN", 2, 0, 5], ["AN", 2, 1, 6], ["FU", 1, [0, 1, 2, 3]], ["SP", 1, 0, 384, [6], 1], ["AN", 1, 0, 5], ["AN", 1, 1, 6], ["PR", 1, 0, "auto_unroll_max_step$512"]]]], "r": [[5.51498e-06, 5.51481e-06, 5.51502e-06, 5.51502e-06], 0, 2.50269, 1668250575], "v": "v0.6"}
{"i": [["[\"0a4dc90579b37e287edc09d585f36844\", [1, 384, 2, 2], [1, 384, 1, 1]]", "cuda -keys=cuda,gpu -arch=sm_80 -max_num_threads=1024 -thread_warp_size=32", [-1, 16, 64, 49152, 2147483647, 1024, 8, 32], "", 0, []], [[], [["FU", 2, [0, 1, 2, 3]], ["SP", 2, 0, 384, [16], 1], ["AN", 2, 0, 5], ["AN", 2, 1, 6], ["FU", 1, [0, 1, 2, 3]], ["SP", 1, 0, 384, [8], 1], ["AN", 1, 0, 5], ["AN", 1, 1, 6], ["PR", 1, 0, "auto_unroll_max_step$0"]]]], "r": [[5.20174e-06, 5.20175e-06, 5.20179e-06, 5.20182e-06], 0, 2.42973, 1668250577], "v": "v0.6"}
{"i": [["[\"0a4dc90579b37e287edc09d585f36844\", [1, 384, 2, 2], [1, 384, 1, 1]]", "cuda -keys=cuda,gpu -arch=sm_80 -max_num_threads=1024 -thread_warp_size=32", [-1, 16, 64, 49152, 2147483647, 1024, 8, 32], "", 0, []], [[], [["FU", 2, [0, 1, 2, 3]], ["SP", 2, 0, 384, [12], 1], ["AN", 2, 0, 5], ["AN", 2, 1, 6], ["FU", 1, [0, 1, 2, 3]], ["SP", 1, 0, 384, [8], 1], ["AN", 1, 0, 5], ["AN", 1, 1, 6], ["PR", 1, 0, "auto_unroll_max_step$1024"]]]], "r": [[5.1881e-06, 5.18799e-06, 5.1881e-06, 5.18818e-06], 0, 2.44593, 1668250579], "v": "v0.6"}
{"i": [["[\"0a4dc90579b37e287edc09d585f36844\", [1, 384, 2, 2], [1, 384, 1, 1]]", "cuda -keys=cuda,gpu -arch=sm_80 -max_num_threads=1024 -thread_warp_size=32", [-1, 16, 64, 49152, 2147483647, 1024, 8, 32], "", 0, []], [[], [["FU", 2, [0, 1, 2, 3]], ["SP", 2, 0, 384, [2], 1], ["AN", 2, 0, 5], ["AN", 2, 1, 6], ["FU", 1, [0, 1, 2, 3]], ["SP", 1, 0, 384, [32], 1], ["AN", 1, 0, 5], ["AN", 1, 1, 6], ["PR", 1, 0, "auto_unroll_max_step$16"]]]], "r": [[5.54482e-06, 5.53948e-06, 5.54714e-06, 5.54516e-06], 0, 2.45975, 1668250581], "v": "v0.6"}
{"i": [["[\"0a4dc90579b37e287edc09d585f36844\", [1, 384, 2, 2], [1, 384, 1, 1]]", "cuda -keys=cuda,gpu -arch=sm_80 -max_num_threads=1024 -thread_warp_size=32", [-1, 16, 64, 49152, 2147483647, 1024, 8, 32], "", 0, []], [[], [["FU", 2, [0, 1, 2, 3]], ["SP", 2, 0, 384, [8], 1], ["AN", 2, 0, 5], ["AN", 2, 1, 6], ["FU", 1, [0, 1, 2, 3]], ["SP", 1, 0, 384, [1], 1], ["AN", 1, 0, 5], ["AN", 1, 1, 6], ["PR", 1, 0, "auto_unroll_max_step$64"]]]], "r": [[5.79757e-06, 5.79773e-06, 5.79768e-06, 5.79755e-06], 0, 2.50351, 1668250583], "v": "v0.6"}
{"i": [["[\"0a4dc90579b37e287edc09d585f36844\", [1, 384, 2, 2], [1, 384, 1, 1]]", "cuda -keys=cuda,gpu -arch=sm_80 -max_num_threads=1024 -thread_warp_size=32", [-1, 16, 64, 49152, 2147483647, 1024, 8, 32], "", 0, []], [[], [["FU", 2, [0, 1, 2, 3]], ["SP", 2, 0, 384, [24], 1], ["AN", 2, 0, 5], ["AN", 2, 1, 6], ["FU", 1, [0, 1, 2, 3]], ["SP", 1, 0, 384, [12], 1], ["AN", 1, 0, 5], ["AN", 1, 1, 6], ["PR", 1, 0, "auto_unroll_max_step$64"]]]], "r": [[5.34747e-06, 5.34789e-06, 5.34895e-06, 5.34942e-06], 0, 2.40425, 1668250586], "v": "v0.6"}
{"i": [["[\"0a4dc90579b37e287edc09d585f36844\", [1, 384, 2, 2], [1, 384, 1, 1]]", "cuda -keys=cuda,gpu -arch=sm_80 -max_num_threads=1024 -thread_warp_size=32", [-1, 16, 64, 49152, 2147483647, 1024, 8, 32], "", 0, []], [[], [["FU", 2, [0, 1, 2, 3]], ["SP", 2, 0, 384, [1], 1], ["AN", 2, 0, 5], ["AN", 2, 1, 6], ["FU", 1, [0, 1, 2, 3]], ["SP", 1, 0, 384, [32], 1], ["AN", 1, 0, 5], ["AN", 1, 1, 6], ["PR", 1, 0, "auto_unroll_max_step$1024"]]]], "r": [[5.36994e-06, 5.37005e-06, 5.36979e-06, 5.37023e-06], 0, 2.40811, 1668250588], "v": "v0.6"}
{"i": [["[\"0a4dc90579b37e287edc09d585f36844\", [1, 384, 2, 2], [1, 384, 1, 1]]", "cuda -keys=cuda,gpu -arch=sm_80 -max_num_threads=1024 -thread_warp_size=32", [-1, 16, 64, 49152, 2147483647, 1024, 8, 32], "", 0, []], [[], [["FU", 2, [0, 1, 2, 3]], ["SP", 2, 0, 384, [64], 1], ["AN", 2, 0, 5], ["AN", 2, 1, 6], ["FU", 1, [0, 1, 2, 3]], ["SP", 1, 0, 384, [3], 1], ["AN", 1, 0, 5], ["AN", 1, 1, 6], ["PR", 1, 0, "auto_unroll_max_step$512"]]]], "r": [[5.49981e-06, 5.513e-06, 5.50765e-06, 5.5131e-06], 0, 2.43302, 1668250590], "v": "v0.6"}
{"i": [["[\"0a4dc90579b37e287edc09d585f36844\", [1, 384, 2, 2], [1, 384, 1, 1]]", "cuda -keys=cuda,gpu -arch=sm_80 -max_num_threads=1024 -thread_warp_size=32", [-1, 16, 64, 49152, 2147483647, 1024, 8, 32], "", 0, []], [[], [["FU", 2, [0, 1, 2, 3]], ["SP", 2, 0, 384, [12], 1], ["AN", 2, 0, 5], ["AN", 2, 1, 6], ["FU", 1, [0, 1, 2, 3]], ["SP", 1, 0, 384, [64], 1], ["AN", 1, 0, 5], ["AN", 1, 1, 6], ["PR", 1, 0, "auto_unroll_max_step$1024"]]]], "r": [[5.18385e-06, 5.18388e-06, 5.18394e-06, 5.18381e-06], 0, 2.4407, 1668250592], "v": "v0.6"}
{"i": [["[\"0a4dc90579b37e287edc09d585f36844\", [1, 384, 2, 2], [1, 384, 1, 1]]", "cuda -keys=cuda,gpu -arch=sm_80 -max_num_threads=1024 -thread_warp_size=32", [-1, 16, 64, 49152, 2147483647, 1024, 8, 32], "", 0, []], [[], [["FU", 2, [0, 1, 2, 3]], ["SP", 2, 0, 384, [8], 1], ["AN", 2, 0, 5], ["AN", 2, 1, 6], ["FU", 1, [0, 1, 2, 3]], ["SP", 1, 0, 384, [64], 1], ["AN", 1, 0, 5], ["AN", 1, 1, 6], ["PR", 1, 0, "auto_unroll_max_step$16"]]]], "r": [[5.39992e-06, 5.40001e-06, 5.39995e-06, 5.40017e-06], 0, 2.39708, 1668250594], "v": "v0.6"}
{"i": [["[\"0a4dc90579b37e287edc09d585f36844\", [1, 384, 2, 2], [1, 384, 1, 1]]", "cuda -keys=cuda,gpu -arch=sm_80 -max_num_threads=1024 -thread_warp_size=32", [-1, 16, 64, 49152, 2147483647, 1024, 8, 32], "", 0, []], [[], [["FU", 2, [0, 1, 2, 3]], ["SP", 2, 0, 384, [16], 1], ["AN", 2, 0, 5], ["AN", 2, 1, 6], ["FU", 1, [0, 1, 2, 3]], ["SP", 1, 0, 384, [32], 1], ["AN", 1, 0, 5], ["AN", 1, 1, 6], ["PR", 1, 0, "auto_unroll_max_step$0"]]]], "r": [[5.52798e-06, 5.52815e-06, 5.52794e-06, 5.52795e-06], 0, 2.49581, 1668250596], "v": "v0.6"}
{"i": [["[\"0a4dc90579b37e287edc09d585f36844\", [1, 384, 2, 2], [1, 384, 1, 1]]", "cuda -keys=cuda,gpu -arch=sm_80 -max_num_threads=1024 -thread_warp_size=32", [-1, 16, 64, 49152, 2147483647, 1024, 8, 32], "", 0, []], [[], [["FU", 2, [0, 1, 2, 3]], ["SP", 2, 0, 384, [8], 1], ["AN", 2, 0, 5], ["AN", 2, 1, 6], ["FU", 1, [0, 1, 2, 3]], ["SP", 1, 0, 384, [48], 1], ["AN", 1, 0, 5], ["AN", 1, 1, 6], ["PR", 1, 0, "auto_unroll_max_step$16"]]]], "r": [[5.27425e-06, 5.27078e-06, 5.26732e-06, 5.26755e-06], 0, 2.41195, 1668250598], "v": "v0.6"}
{"i": [["[\"0a4dc90579b37e287edc09d585f36844\", [1, 384, 2, 2], [1, 384, 1, 1]]", "cuda -keys=cuda,gpu -arch=sm_80 -max_num_threads=1024 -thread_warp_size=32", [-1, 16, 64, 49152, 2147483647, 1024, 8, 32], "", 0, []], [[], [["FU", 2, [0, 1, 2, 3]], ["SP", 2, 0, 384, [64], 1], ["AN", 2, 0, 5], ["AN", 2, 1, 6], ["FU", 1, [0, 1, 2, 3]], ["SP", 1, 0, 384, [64], 1], ["AN", 1, 0, 5], ["AN", 1, 1, 6], ["PR", 1, 0, "auto_unroll_max_step$64"]]]], "r": [[5.15043e-06, 5.15046e-06, 5.15049e-06, 5.15046e-06], 0, 2.46611, 1668250601], "v": "v0.6"}
{"i": [["[\"0a4dc90579b37e287edc09d585f36844\", [1, 384, 2, 2], [1, 384, 1, 1]]", "cuda -keys=cuda,gpu -arch=sm_80 -max_num_threads=1024 -thread_warp_size=32", [-1, 16, 64, 49152, 2147483647, 1024, 8, 32], "", 0, []], [[], [["FU", 2, [0, 1, 2, 3]], ["SP", 2, 0, 384, [24], 1], ["AN", 2, 0, 5], ["AN", 2, 1, 6], ["FU", 1, [0, 1, 2, 3]], ["SP", 1, 0, 384, [8], 1], ["AN", 1, 0, 5], ["AN", 1, 1, 6], ["PR", 1, 0, "auto_unroll_max_step$1024"]]]], "r": [[5.5109e-06, 5.51074e-06, 5.51093e-06, 5.51087e-06], 0, 2.52625, 1668250603], "v": "v0.6"}
{"i": [["[\"0a4dc90579b37e287edc09d585f36844\", [1, 384, 2, 2], [1, 384, 1, 1]]", "cuda -keys=cuda,gpu -arch=sm_80 -max_num_threads=1024 -thread_warp_size=32", [-1, 16, 64, 49152, 2147483647, 1024, 8, 32], "", 0, []], [[], [["FU", 2, [0, 1, 2, 3]], ["SP", 2, 0, 384, [16], 1], ["AN", 2, 0, 5], ["AN", 2, 1, 6], ["FU", 1, [0, 1, 2, 3]], ["SP", 1, 0, 384, [1], 1], ["AN", 1, 0, 5], ["AN", 1, 1, 6], ["PR", 1, 0, "auto_unroll_max_step$0"]]]], "r": [[5.58704e-06, 5.58705e-06, 5.58714e-06, 5.58701e-06], 0, 2.47523, 1668250605], "v": "v0.6"}
{"i": [["[\"0a4dc90579b37e287edc09d585f36844\", [1, 384, 2, 2], [1, 384, 1, 1]]", "cuda -keys=cuda,gpu -arch=sm_80 -max_num_threads=1024 -thread_warp_size=32", [-1, 16, 64, 49152, 2147483647, 1024, 8, 32], "", 0, []], [[], [["FU", 2, [0, 1, 2, 3]], ["SP", 2, 0, 384, [1], 1], ["AN", 2, 0, 5], ["AN", 2, 1, 6], ["FU", 1, [0, 1, 2, 3]], ["SP", 1, 0, 384, [64], 1], ["AN", 1, 0, 5], ["AN", 1, 1, 6], ["PR", 1, 0, "auto_unroll_max_step$64"]]]], "r": [[5.70376e-06, 5.70435e-06, 5.70523e-06, 5.70459e-06], 0, 2.48403, 1668250607], "v": "v0.6"}
{"i": [["[\"0a4dc90579b37e287edc09d585f36844\", [1, 384, 2, 2], [1, 384, 1, 1]]", "cuda -keys=cuda,gpu -arch=sm_80 -max_num_threads=1024 -thread_warp_size=32", [-1, 16, 64, 49152, 2147483647, 1024, 8, 32], "", 0, []], [[], [["FU", 2, [0, 1, 2, 3]], ["SP", 2, 0, 384, [48], 1], ["AN", 2, 0, 5], ["AN", 2, 1, 6], ["FU", 1, [0, 1, 2, 3]], ["SP", 1, 0, 384, [24], 1], ["AN", 1, 0, 5], ["AN", 1, 1, 6], ["PR", 1, 0, "auto_unroll_max_step$0"]]]], "r": [[5.34678e-06, 5.34727e-06, 5.34727e-06, 5.34672e-06], 0, 2.4343, 1668250609], "v": "v0.6"}
{"i": [["[\"0a4dc90579b37e287edc09d585f36844\", [1, 384, 2, 2], [1, 384, 1, 1]]", "cuda -keys=cuda,gpu -arch=sm_80 -max_num_threads=1024 -thread_warp_size=32", [-1, 16, 64, 49152, 2147483647, 1024, 8, 32], "", 0, []], [[], [["FU", 2, [0, 1, 2, 3]], ["SP", 2, 0, 384, [4], 1], ["AN", 2, 0, 5], ["AN", 2, 1, 6], ["FU", 1, [0, 1, 2, 3]], ["SP", 1, 0, 384, [8], 1], ["AN", 1, 0, 5], ["AN", 1, 1, 6], ["PR", 1, 0, "auto_unroll_max_step$512"]]]], "r": [[5.32762e-06, 5.32803e-06, 5.32504e-06, 5.32328e-06], 0, 2.44635, 1668250611], "v": "v0.6"}
{"i": [["[\"0a4dc90579b37e287edc09d585f36844\", [1, 384, 2, 2], [1, 384, 1, 1]]", "cuda -keys=cuda,gpu -arch=sm_80 -max_num_threads=1024 -thread_warp_size=32", [-1, 16, 64, 49152, 2147483647, 1024, 8, 32], "", 0, []], [[], [["FU", 2, [0, 1, 2, 3]], ["SP", 2, 0, 384, [4], 1], ["AN", 2, 0, 5], ["AN", 2, 1, 6], ["FU", 1, [0, 1, 2, 3]], ["SP", 1, 0, 384, [24], 1], ["AN", 1, 0, 5], ["AN", 1, 1, 6], ["PR", 1, 0, "auto_unroll_max_step$16"]]]], "r": [[5.544e-06, 5.54468e-06, 5.54376e-06, 5.56859e-06], 0, 2.4925, 1668250614], "v": "v0.6"}
{"i": [["[\"0a4dc90579b37e287edc09d585f36844\", [1, 384, 2, 2], [1, 384, 1, 1]]", "cuda -keys=cuda,gpu -arch=sm_80 -max_num_threads=1024 -thread_warp_size=32", [-1, 16, 64, 49152, 2147483647, 1024, 8, 32], "", 0, []], [[], [["FU", 2, [0, 1, 2, 3]], ["SP", 2, 0, 384, [6], 1], ["AN", 2, 0, 5], ["AN", 2, 1, 6], ["FU", 1, [0, 1, 2, 3]], ["SP", 1, 0, 384, [3], 1], ["AN", 1, 0, 5], ["AN", 1, 1, 6], ["PR", 1, 0, "auto_unroll_max_step$64"]]]], "r": [[5.71088e-06, 5.71108e-06, 5.71091e-06, 5.71034e-06], 0, 2.57116, 1668250616], "v": "v0.6"}
{"i": [["[\"0a4dc90579b37e287edc09d585f36844\", [1, 384, 2, 2], [1, 384, 1, 1]]", "cuda -keys=cuda,gpu -arch=sm_80 -max_num_threads=1024 -thread_warp_size=32", [-1, 16, 64, 49152, 2147483647, 1024, 8, 32], "", 0, []], [[], [["FU", 2, [0, 1, 2, 3]], ["SP", 2, 0, 384, [6], 1], ["AN", 2, 0, 5], ["AN", 2, 1, 6], ["FU", 1, [0, 1, 2, 3]], ["SP", 1, 0, 384, [64], 1], ["AN", 1, 0, 5], ["AN", 1, 1, 6], ["PR", 1, 0, "auto_unroll_max_step$512"]]]], "r": [[5.44349e-06, 5.44352e-06, 5.44296e-06, 5.44229e-06], 0, 2.44793, 1668250618], "v": "v0.6"}
{"i": [["[\"0a4dc90579b37e287edc09d585f36844\", [1, 384, 2, 2], [1, 384, 1, 1]]", "cuda -keys=cuda,gpu -arch=sm_80 -max_num_threads=1024 -thread_warp_size=32", [-1, 16, 64, 49152, 2147483647, 1024, 8, 32], "", 0, []], [[], [["FU", 2, [0, 1, 2, 3]], ["SP", 2, 0, 384, [2], 1], ["AN", 2, 0, 5], ["AN", 2, 1, 6], ["FU", 1, [0, 1, 2, 3]], ["SP", 1, 0, 384, [2], 1], ["AN", 1, 0, 5], ["AN", 1, 1, 6], ["PR", 1, 0, "auto_unroll_max_step$0"]]]], "r": [[5.72197e-06, 5.72259e-06, 5.72128e-06, 5.72549e-06], 0, 2.46876, 1668250620], "v": "v0.6"}
{"i": [["[\"0a4dc90579b37e287edc09d585f36844\", [1, 384, 2, 2], [1, 384, 1, 1]]", "cuda -keys=cuda,gpu -arch=sm_80 -max_num_threads=1024 -thread_warp_size=32", [-1, 16, 64, 49152, 2147483647, 1024, 8, 32], "", 0, []], [[], [["FU", 2, [0, 1, 2, 3]], ["SP", 2, 0, 384, [64], 1], ["AN", 2, 0, 5], ["AN", 2, 1, 6], ["FU", 1, [0, 1, 2, 3]], ["SP", 1, 0, 384, [12], 1], ["AN", 1, 0, 5], ["AN", 1, 1, 6], ["PR", 1, 0, "auto_unroll_max_step$64"]]]], "r": [[5.51174e-06, 5.51182e-06, 5.51196e-06, 5.51179e-06], 0, 2.48752, 1668250622], "v": "v0.6"}
{"i": [["[\"0a4dc90579b37e287edc09d585f36844\", [1, 384, 2, 2], [1, 384, 1, 1]]", "cuda -keys=cuda,gpu -arch=sm_80 -max_num_threads=1024 -thread_warp_size=32", [-1, 16, 64, 49152, 2147483647, 1024, 8, 32], "", 0, []], [[], [["FU", 2, [0, 1, 2, 3]], ["SP", 2, 0, 384, [32], 1], ["AN", 2, 0, 5], ["AN", 2, 1, 6], ["FU", 1, [0, 1, 2, 3]], ["SP", 1, 0, 384, [64], 1], ["AN", 1, 0, 5], ["AN", 1, 1, 6], ["PR", 1, 0, "auto_unroll_max_step$16"]]]], "r": [[5.46348e-06, 5.46355e-06, 5.46365e-06, 5.46362e-06], 0, 2.49809, 1668250625], "v": "v0.6"}
{"i": [["[\"0a4dc90579b37e287edc09d585f36844\", [1, 384, 2, 2], [1, 384, 1, 1]]", "cuda -keys=cuda,gpu -arch=sm_80 -max_num_threads=1024 -thread_warp_size=32", [-1, 16, 64, 49152, 2147483647, 1024, 8, 32], "", 0, []], [[], [["FU", 2, [0, 1, 2, 3]], ["SP", 2, 0, 384, [2], 1], ["AN", 2, 0, 5], ["AN", 2, 1, 6], ["FU", 1, [0, 1, 2, 3]], ["SP", 1, 0, 384, [2], 1], ["AN", 1, 0, 5], ["AN", 1, 1, 6], ["PR", 1, 0, "auto_unroll_max_step$512"]]]], "r": [[5.6101e-06, 5.60913e-06, 5.60858e-06, 5.60991e-06], 0, 2.42374, 1668250627], "v": "v0.6"}
{"i": [["[\"0a4dc90579b37e287edc09d585f36844\", [1, 384, 2, 2], [1, 384, 1, 1]]", "cuda -keys=cuda,gpu -arch=sm_80 -max_num_threads=1024 -thread_warp_size=32", [-1, 16, 64, 49152, 2147483647, 1024, 8, 32], "", 0, []], [[], [["FU", 2, [0, 1, 2, 3]], ["SP", 2, 0, 384, [6], 1], ["AN", 2, 0, 5], ["AN", 2, 1, 6], ["FU", 1, [0, 1, 2, 3]], ["SP", 1, 0, 384, [3], 1], ["AN", 1, 0, 5], ["AN", 1, 1, 6], ["PR", 1, 0, "auto_unroll_max_step$0"]]]], "r": [[5.78589e-06, 5.78572e-06, 5.78566e-06, 5.78572e-06], 0, 2.54193, 1668250629], "v": "v0.6"}
{"i": [["[\"0a4dc90579b37e287edc09d585f36844\", [1, 384, 2, 2], [1, 384, 1, 1]]", "cuda -keys=cuda,gpu -arch=sm_80 -max_num_threads=1024 -thread_warp_size=32", [-1, 16, 64, 49152, 2147483647, 1024, 8, 32], "", 0, []], [[], [["FU", 2, [0, 1, 2, 3]], ["SP", 2, 0, 384, [2], 1], ["AN", 2, 0, 5], ["AN", 2, 1, 6], ["FU", 1, [0, 1, 2, 3]], ["SP", 1, 0, 384, [24], 1], ["AN", 1, 0, 5], ["AN", 1, 1, 6], ["PR", 1, 0, "auto_unroll_max_step$64"]]]], "r": [[5.16637e-06, 5.16631e-06, 5.16647e-06, 5.16652e-06], 0, 2.39966, 1668250631], "v": "v0.6"}
{"i": [["[\"0a4dc90579b37e287edc09d585f36844\", [1, 384, 2, 2], [1, 384, 1, 1]]", "cuda -keys=cuda,gpu -arch=sm_80 -max_num_threads=1024 -thread_warp_size=32", [-1, 16, 64, 49152, 2147483647, 1024, 8, 32], "", 0, []], [[], [["FU", 2, [0, 1, 2, 3]], ["SP", 2, 0, 384, [2], 1], ["AN", 2, 0, 5], ["AN", 2, 1, 6], ["FU", 1, [0, 1, 2, 3]], ["SP", 1, 0, 384, [64], 1], ["AN", 1, 0, 5], ["AN", 1, 1, 6], ["PR", 1, 0, "auto_unroll_max_step$0"]]]], "r": [[5.16942e-06, 5.16956e-06, 5.1693e-06, 5.16932e-06], 0, 2.3945, 1668250633], "v": "v0.6"}
{"i": [["[\"0a4dc90579b37e287edc09d585f36844\", [1, 384, 2, 2], [1, 384, 1, 1]]", "cuda -keys=cuda,gpu -arch=sm_80 -max_num_threads=1024 -thread_warp_size=32", [-1, 16, 64, 49152, 2147483647, 1024, 8, 32], "", 0, []], [[], [["FU", 2, [0, 1, 2, 3]], ["SP", 2, 0, 384, [1], 1], ["AN", 2, 0, 5], ["AN", 2, 1, 6], ["FU", 1, [0, 1, 2, 3]], ["SP", 1, 0, 384, [2], 1], ["AN", 1, 0, 5], ["AN", 1, 1, 6], ["PR", 1, 0, "auto_unroll_max_step$16"]]]], "r": [[6.02292e-06, 6.02316e-06, 6.02347e-06, 6.02375e-06], 0, 2.52283, 1668250635], "v": "v0.6"}
{"i": [["[\"0a4dc90579b37e287edc09d585f36844\", [1, 384, 2, 2], [1, 384, 1, 1]]", "cuda -keys=cuda,gpu -arch=sm_80 -max_num_threads=1024 -thread_warp_size=32", [-1, 16, 64, 49152, 2147483647, 1024, 8, 32], "", 0, []], [[], [["FU", 2, [0, 1, 2, 3]], ["SP", 2, 0, 384, [4], 1], ["AN", 2, 0, 5], ["AN", 2, 1, 6], ["FU", 1, [0, 1, 2, 3]], ["SP", 1, 0, 384, [24], 1], ["AN", 1, 0, 5], ["AN", 1, 1, 6], ["PR", 1, 0, "auto_unroll_max_step$0"]]]], "r": [[5.56146e-06, 5.56305e-06, 5.56131e-06, 5.56376e-06], 0, 2.40751, 1668250638], "v": "v0.6"}
{"i": [["[\"0a4dc90579b37e287edc09d585f36844\", [1, 384, 2, 2], [1, 384, 1, 1]]", "cuda -keys=cuda,gpu -arch=sm_80 -max_num_threads=1024 -thread_warp_size=32", [-1, 16, 64, 49152, 2147483647, 1024, 8, 32], "", 0, []], [[], [["FU", 2, [0, 1, 2, 3]], ["SP", 2, 0, 384, [6], 1], ["AN", 2, 0, 5], ["AN", 2, 1, 6], ["FU", 1, [0, 1, 2, 3]], ["SP", 1, 0, 384, [32], 1], ["AN", 1, 0, 5], ["AN", 1, 1, 6], ["PR", 1, 0, "auto_unroll_max_step$64"]]]], "r": [[5.5269e-06, 5.52677e-06, 5.52671e-06, 5.52681e-06], 0, 2.45817, 1668250640], "v": "v0.6"}
{"i": [["[\"0a4dc90579b37e287edc09d585f36844\", [1, 384, 2, 2], [1, 384, 1, 1]]", "cuda -keys=cuda,gpu -arch=sm_80 -max_num_threads=1024 -thread_warp_size=32", [-1, 16, 64, 49152, 2147483647, 1024, 8, 32], "", 0, []], [[], [["FU", 2, [0, 1, 2, 3]], ["SP", 2, 0, 384, [64], 1], ["AN", 2, 0, 5], ["AN", 2, 1, 6], ["FU", 1, [0, 1, 2, 3]], ["SP", 1, 0, 384, [48], 1], ["AN", 1, 0, 5], ["AN", 1, 1, 6], ["PR", 1, 0, "auto_unroll_max_step$0"]]]], "r": [[5.46378e-06, 5.46448e-06, 5.46481e-06, 5.46488e-06], 0, 2.4741, 1668250642], "v": "v0.6"}
{"i": [["[\"0a4dc90579b37e287edc09d585f36844\", [1, 384, 2, 2], [1, 384, 1, 1]]", "cuda -keys=cuda,gpu -arch=sm_80 -max_num_threads=1024 -thread_warp_size=32", [-1, 16, 64, 49152, 2147483647, 1024, 8, 32], "", 0, []], [[], [["FU", 2, [0, 1, 2, 3]], ["SP", 2, 0, 384, [4], 1], ["AN", 2, 0, 5], ["AN", 2, 1, 6], ["FU", 1, [0, 1, 2, 3]], ["SP", 1, 0, 384, [2], 1], ["AN", 1, 0, 5], ["AN", 1, 1, 6], ["PR", 1, 0, "auto_unroll_max_step$512"]]]], "r": [[5.92917e-06, 5.92901e-06, 5.92903e-06, 5.92904e-06], 0, 2.52526, 1668250644], "v": "v0.6"}
{"i": [["[\"0a4dc90579b37e287edc09d585f36844\", [1, 384, 2, 2], [1, 384, 1, 1]]", "cuda -keys=cuda,gpu -arch=sm_80 -max_num_threads=1024 -thread_warp_size=32", [-1, 16, 64, 49152, 2147483647, 1024, 8, 32], "", 0, []], [[], [["FU", 2, [0, 1, 2, 3]], ["SP", 2, 0, 384, [48], 1], ["AN", 2, 0, 5], ["AN", 2, 1, 6], ["FU", 1, [0, 1, 2, 3]], ["SP", 1, 0, 384, [8], 1], ["AN", 1, 0, 5], ["AN", 1, 1, 6], ["PR", 1, 0, "auto_unroll_max_step$16"]]]], "r": [[5.40562e-06, 5.40567e-06, 5.40555e-06, 5.40804e-06], 0, 2.31995, 1668250649], "v": "v0.6"}
{"i": [["[\"0a4dc90579b37e287edc09d585f36844\", [1, 384, 2, 2], [1, 384, 1, 1]]", "cuda -keys=cuda,gpu -arch=sm_80 -max_num_threads=1024 -thread_warp_size=32", [-1, 16, 64, 49152, 2147483647, 1024, 8, 32], "", 0, []], [[], [["FU", 2, [0, 1, 2, 3]], ["SP", 2, 0, 384, [64], 1], ["AN", 2, 0, 5], ["AN", 2, 1, 6], ["FU", 1, [0, 1, 2, 3]], ["SP", 1, 0, 384, [8], 1], ["AN", 1, 0, 5], ["AN", 1, 1, 6], ["PR", 1, 0, "auto_unroll_max_step$0"]]]], "r": [[5.48273e-06, 5.48273e-06, 5.48286e-06, 5.48276e-06], 0, 2.47045, 1668250651], "v": "v0.6"}
{"i": [["[\"0a4dc90579b37e287edc09d585f36844\", [1, 384, 2, 2], [1, 384, 1, 1]]", "cuda -keys=cuda,gpu -arch=sm_80 -max_num_threads=1024 -thread_warp_size=32", [-1, 16, 64, 49152, 2147483647, 1024, 8, 32], "", 0, []], [[], [["FU", 2, [0, 1, 2, 3]], ["SP", 2, 0, 384, [24], 1], ["AN", 2, 0, 5], ["AN", 2, 1, 6], ["FU", 1, [0, 1, 2, 3]], ["SP", 1, 0, 384, [3], 1], ["AN", 1, 0, 5], ["AN", 1, 1, 6], ["PR", 1, 0, "auto_unroll_max_step$512"]]]], "r": [[5.83093e-06, 5.83071e-06, 5.83091e-06, 5.83076e-06], 0, 2.5261, 1668250653], "v": "v0.6"}
{"i": [["[\"0a4dc90579b37e287edc09d585f36844\", [1, 384, 2, 2], [1, 384, 1, 1]]", "cuda -keys=cuda,gpu -arch=sm_80 -max_num_threads=1024 -thread_warp_size=32", [-1, 16, 64, 49152, 2147483647, 1024, 8, 32], "", 0, []], [[], [["FU", 2, [0, 1, 2, 3]], ["SP", 2, 0, 384, [16], 1], ["AN", 2, 0, 5], ["AN", 2, 1, 6], ["FU", 1, [0, 1, 2, 3]], ["SP", 1, 0, 384, [24], 1], ["AN", 1, 0, 5], ["AN", 1, 1, 6], ["PR", 1, 0, "auto_unroll_max_step$64"]]]], "r": [[5.43123e-06, 5.4363e-06, 5.4349e-06, 5.43872e-06], 0, 2.43284, 1668250655], "v": "v0.6"}
{"i": [["[\"0a4dc90579b37e287edc09d585f36844\", [1, 384, 2, 2], [1, 384, 1, 1]]", "cuda -keys=cuda,gpu -arch=sm_80 -max_num_threads=1024 -thread_warp_size=32", [-1, 16, 64, 49152, 2147483647, 1024, 8, 32], "", 0, []], [[], [["FU", 2, [0, 1, 2, 3]], ["SP", 2, 0, 384, [64], 1], ["AN", 2, 0, 5], ["AN", 2, 1, 6], ["FU", 1, [0, 1, 2, 3]], ["SP", 1, 0, 384, [32], 1], ["AN", 1, 0, 5], ["AN", 1, 1, 6], ["PR", 1, 0, "auto_unroll_max_step$16"]]]], "r": [[5.54263e-06, 5.54222e-06, 5.54213e-06, 5.54234e-06], 0, 2.47239, 1668250658], "v": "v0.6"}
{"i": [["[\"0a4dc90579b37e287edc09d585f36844\", [1, 384, 2, 2], [1, 384, 1, 1]]", "cuda -keys=cuda,gpu -arch=sm_80 -max_num_threads=1024 -thread_warp_size=32", [-1, 16, 64, 49152, 2147483647, 1024, 8, 32], "", 0, []], [[], [["FU", 2, [0, 1, 2, 3]], ["SP", 2, 0, 384, [16], 1], ["AN", 2, 0, 5], ["AN", 2, 1, 6], ["FU", 1, [0, 1, 2, 3]], ["SP", 1, 0, 384, [8], 1], ["AN", 1, 0, 5], ["AN", 1, 1, 6], ["PR", 1, 0, "auto_unroll_max_step$512"]]]], "r": [[5.26045e-06, 5.26052e-06, 5.26226e-06, 5.26265e-06], 0, 2.41053, 1668250660], "v": "v0.6"}
