.cache/log/kernel_tune/NVIDIA_A100_80GB_PCIe/Conv2dBias_forward_input_0_7_8_32_32_output_0_7_8_32_32_in_channels_8_out_channels_8_kernel_size_3_3_stride_1_1_padding_1_1_dilation_1_1_groups_1.json
{"i": [["[\"9a995a41bc2ff7cdadb96550380f7c85\", [7, 8, 32, 32], [8, 8, 3, 3], [1, 8, 1, 1], [7, 8, 32, 32]]", "cuda -keys=cuda,gpu -arch=sm_80 -max_num_threads=1024 -thread_warp_size=32", [-1, 16, 64, 49152, 2147483647, 1024, 8, 32], "", 0, []], [[], [["SP", 3, 0, 7, [1, 1, 1, 7], 1], ["SP", 3, 5, 8, [8, 1, 1, 1], 1], ["SP", 3, 10, 32, [1, 4, 1, 8], 1], ["SP", 3, 15, 32, [1, 16, 1, 1], 1], ["SP", 3, 20, 8, [1, 2], 1], ["SP", 3, 23, 3, [1, 1], 1], ["SP", 3, 26, 3, [1, 1], 1], ["RE", 3, [0, 5, 10, 15, 1, 6, 11, 16, 2, 7, 12, 17, 20, 23, 26, 21, 24, 27, 3, 8, 13, 18, 22, 25, 28, 4, 9, 14, 19]], ["FSP", 5, 0, 0, 3], ["FSP", 5, 4, 1, 3], ["FSP", 5, 8, 2, 3], ["FSP", 5, 12, 3, 3], ["RE", 5, [0, 4, 8, 12, 1, 5, 9, 13, 2, 6, 10, 14, 3, 7, 11, 15]], ["CA", 3, 5, 11], ["CHR", 2, "shared", [3]], ["CA", 3, 4, 14], ["CHR", 1, "shared", [4]], ["CA", 2, 5, 14], ["CI", 1], ["FU", 7, [0, 1, 2, 3]], ["AN", 7, 0, 5], ["FU", 7, [1, 2, 3, 4]], ["AN", 7, 1, 4], ["FU", 7, [2, 3, 4, 5]], ["AN", 7, 2, 6], ["FU", 4, [0, 1, 2, 3]], ["SP", 4, 0, 6, [3], 1], ["AN", 4, 1, 2], ["FFSP", 4, 0, [3, 2, 1, 0], 1, 1], ["AN", 4, 1, 6], ["FU", 2, [0, 1, 2, 3]], ["SP", 2, 0, 140, [1], 1], ["AN", 2, 1, 2], ["FFSP", 2, 0, [3, 2, 1, 0], 1, 1], ["AN", 2, 1, 6], ["PR", 5, 0, "auto_unroll_max_step$16"]]]], "r": [[0.000421984, 0.000421988, 0.00042199, 0.000421984], 0, 3.509, 1668696045], "v": "v0.6"}
{"i": [["[\"9a995a41bc2ff7cdadb96550380f7c85\", [7, 8, 32, 32], [8, 8, 3, 3], [1, 8, 1, 1], [7, 8, 32, 32]]", "cuda -keys=cuda,gpu -arch=sm_80 -max_num_threads=1024 -thread_warp_size=32", [-1, 16, 64, 49152, 2147483647, 1024, 8, 32], "", 0, []], [[], [["SP", 3, 0, 7, [1, 7, 1, 1], 1], ["SP", 3, 5, 8, [1, 2, 4, 1], 1], ["SP", 3, 10, 32, [1, 16, 1, 1], 1], ["SP", 3, 15, 32, [1, 1, 1, 2], 1], ["SP", 3, 20, 8, [1, 2], 1], ["SP", 3, 23, 3, [3, 1], 1], ["SP", 3, 26, 3, [1, 3], 1], ["RE", 3, [0, 5, 10, 15, 1, 6, 11, 16, 2, 7, 12, 17, 20, 23, 26, 21, 24, 27, 3, 8, 13, 18, 22, 25, 28, 4, 9, 14, 19]], ["FSP", 5, 0, 0, 3], ["FSP", 5, 4, 1, 3], ["FSP", 5, 8, 2, 3], ["FSP", 5, 12, 3, 3], ["RE", 5, [0, 4, 8, 12, 1, 5, 9, 13, 2, 6, 10, 14, 3, 7, 11, 15]], ["CA", 3, 5, 11], ["CHR", 2, "shared", [3]], ["CA", 3, 4, 14], ["CHR", 1, "shared", [4]], ["CA", 2, 5, 14], ["CI", 1], ["FU", 7, [0, 1, 2, 3]], ["AN", 7, 0, 5], ["FU", 7, [1, 2, 3, 4]], ["AN", 7, 1, 4], ["FU", 7, [2, 3, 4, 5]], ["AN", 7, 2, 6], ["FU", 4, [0, 1, 2, 3]], ["SP", 4, 0, 72, [1], 1], ["AN", 4, 1, 2], ["FFSP", 4, 0, [3, 2, 1, 0], 1, 1], ["AN", 4, 1, 6], ["FU", 2, [0, 1, 2, 3]], ["SP", 2, 0, 18, [6], 1], ["AN", 2, 1, 2], ["FFSP", 2, 0, [3, 2, 1, 0], 1, 1], ["AN", 2, 1, 6], ["PR", 5, 0, "auto_unroll_max_step$512"]]]], "r": [[1.20719e-05, 1.20968e-05, 1.20779e-05, 1.20679e-05], 0, 3.52109, 1668696047], "v": "v0.6"}
{"i": [["[\"9a995a41bc2ff7cdadb96550380f7c85\", [7, 8, 32, 32], [8, 8, 3, 3], [1, 8, 1, 1], [7, 8, 32, 32]]", "cuda -keys=cuda,gpu -arch=sm_80 -max_num_threads=1024 -thread_warp_size=32", [-1, 16, 64, 49152, 2147483647, 1024, 8, 32], "", 0, []], [[], [["SP", 3, 0, 7, [1, 1, 1, 7], 1], ["SP", 3, 5, 8, [8, 1, 1, 1], 1], ["SP", 3, 10, 32, [1, 4, 1, 8], 1], ["SP", 3, 15, 32, [1, 16, 1, 1], 1], ["SP", 3, 20, 8, [1, 2], 1], ["SP", 3, 23, 3, [1, 3], 1], ["SP", 3, 26, 3, [1, 1], 1], ["RE", 3, [0, 5, 10, 15, 1, 6, 11, 16, 2, 7, 12, 17, 20, 23, 26, 21, 24, 27, 3, 8, 13, 18, 22, 25, 28, 4, 9, 14, 19]], ["FSP", 5, 0, 0, 3], ["FSP", 5, 4, 1, 3], ["FSP", 5, 8, 2, 3], ["FSP", 5, 12, 3, 3], ["RE", 5, [0, 4, 8, 12, 1, 5, 9, 13, 2, 6, 10, 14, 3, 7, 11, 15]], ["CA", 3, 5, 11], ["CHR", 2, "shared", [3]], ["CA", 3, 4, 14], ["CHR", 1, "shared", [4]], ["CA", 2, 5, 14], ["CI", 1], ["FU", 7, [0, 1, 2, 3]], ["AN", 7, 0, 5], ["FU", 7, [1, 2, 3, 4]], ["AN", 7, 1, 4], ["FU", 7, [2, 3, 4, 5]], ["AN", 7, 2, 6], ["FU", 4, [0, 1, 2, 3]], ["SP", 4, 0, 6, [3], 1], ["AN", 4, 1, 2], ["FFSP", 4, 0, [3, 2, 1, 0], 1, 1], ["AN", 4, 1, 6], ["FU", 2, [0, 1, 2, 3]], ["SP", 2, 0, 140, [1], 1], ["AN", 2, 1, 2], ["FFSP", 2, 0, [3, 2, 1, 0], 1, 1], ["AN", 2, 1, 6], ["PR", 5, 0, "auto_unroll_max_step$16"]]]], "r": [[0.000447216, 0.000447243, 0.000447246, 0.00044722], 0, 3.75205, 1668696050], "v": "v0.6"}
{"i": [["[\"9a995a41bc2ff7cdadb96550380f7c85\", [7, 8, 32, 32], [8, 8, 3, 3], [1, 8, 1, 1], [7, 8, 32, 32]]", "cuda -keys=cuda,gpu -arch=sm_80 -max_num_threads=1024 -thread_warp_size=32", [-1, 16, 64, 49152, 2147483647, 1024, 8, 32], "", 0, []], [[], [["SP", 3, 0, 7, [1, 1, 1, 1], 1], ["SP", 3, 5, 8, [1, 1, 4, 2], 1], ["SP", 3, 10, 32, [1, 4, 1, 1], 1], ["SP", 3, 15, 32, [2, 8, 1, 2], 1], ["SP", 3, 20, 8, [2, 1], 1], ["SP", 3, 23, 3, [1, 3], 1], ["SP", 3, 26, 3, [3, 1], 1], ["RE", 3, [0, 5, 10, 15, 1, 6, 11, 16, 2, 7, 12, 17, 20, 23, 26, 21, 24, 27, 3, 8, 13, 18, 22, 25, 28, 4, 9, 14, 19]], ["FSP", 5, 0, 0, 3], ["FSP", 5, 4, 1, 3], ["FSP", 5, 8, 2, 3], ["FSP", 5, 12, 3, 3], ["RE", 5, [0, 4, 8, 12, 1, 5, 9, 13, 2, 6, 10, 14, 3, 7, 11, 15]], ["CA", 3, 5, 11], ["CHR", 2, "shared", [3]], ["CA", 3, 4, 14], ["CHR", 1, "shared", [4]], ["CA", 2, 5, 14], ["CI", 1], ["FU", 7, [0, 1, 2, 3]], ["AN", 7, 0, 5], ["FU", 7, [1, 2, 3, 4]], ["AN", 7, 1, 4], ["FU", 7, [2, 3, 4, 5]], ["AN", 7, 2, 6], ["FU", 4, [0, 1, 2, 3]], ["SP", 4, 0, 36, [3], 1], ["AN", 4, 1, 2], ["FFSP", 4, 0, [3, 2, 1, 0], 1, 1], ["AN", 4, 1, 6], ["FU", 2, [0, 1, 2, 3]], ["SP", 2, 0, 24, [1], 1], ["AN", 2, 1, 2], ["FFSP", 2, 0, [3, 2, 1, 0], 1, 1], ["AN", 2, 1, 6], ["PR", 5, 0, "auto_unroll_max_step$64"]]]], "r": [[1.04182e-05, 1.04182e-05, 1.04176e-05, 1.04181e-05], 0, 3.26913, 1668696052], "v": "v0.6"}
{"i": [["[\"9a995a41bc2ff7cdadb96550380f7c85\", [7, 8, 32, 32], [8, 8, 3, 3], [1, 8, 1, 1], [7, 8, 32, 32]]", "cuda -keys=cuda,gpu -arch=sm_80 -max_num_threads=1024 -thread_warp_size=32", [-1, 16, 64, 49152, 2147483647, 1024, 8, 32], "", 0, []], [[], [["SP", 3, 0, 7, [1, 7, 1, 1], 1], ["SP", 3, 5, 8, [1, 1, 1, 8], 1], ["SP", 3, 10, 32, [1, 2, 2, 2], 1], ["SP", 3, 15, 32, [1, 4, 1, 2], 1], ["SP", 3, 20, 8, [1, 2], 1], ["SP", 3, 23, 3, [3, 1], 1], ["SP", 3, 26, 3, [1, 1], 1], ["RE", 3, [0, 5, 10, 15, 1, 6, 11, 16, 2, 7, 12, 17, 20, 23, 26, 21, 24, 27, 3, 8, 13, 18, 22, 25, 28, 4, 9, 14, 19]], ["FSP", 5, 0, 0, 3], ["FSP", 5, 4, 1, 3], ["FSP", 5, 8, 2, 3], ["FSP", 5, 12, 3, 3], ["RE", 5, [0, 4, 8, 12, 1, 5, 9, 13, 2, 6, 10, 14, 3, 7, 11, 15]], ["CA", 3, 5, 11], ["CHR", 2, "shared", [3]], ["CA", 3, 4, 14], ["CHR", 1, "shared", [4]], ["CA", 2, 5, 14], ["CI", 1], ["FU", 7, [0, 1, 2, 3]], ["AN", 7, 0, 5], ["FU", 7, [1, 2, 3, 4]], ["AN", 7, 1, 4], ["FU", 7, [2, 3, 4, 5]], ["AN", 7, 2, 6], ["FU", 4, [0, 1, 2, 3]], ["SP", 4, 0, 48, [1], 1], ["AN", 4, 1, 2], ["FFSP", 4, 0, [3, 2, 1, 0], 1, 1], ["AN", 4, 1, 6], ["FU", 2, [0, 1, 2, 3]], ["SP", 2, 0, 24, [24], 1], ["AN", 2, 1, 2], ["FFSP", 2, 0, [3, 2, 1, 0], 1, 1], ["AN", 2, 1, 6], ["PR", 5, 0, "auto_unroll_max_step$64"]]]], "r": [[3.04258e-05, 3.04261e-05, 3.04261e-05, 3.04259e-05], 0, 3.37745, 1668696055], "v": "v0.6"}
{"i": [["[\"9a995a41bc2ff7cdadb96550380f7c85\", [7, 8, 32, 32], [8, 8, 3, 3], [1, 8, 1, 1], [7, 8, 32, 32]]", "cuda -keys=cuda,gpu -arch=sm_80 -max_num_threads=1024 -thread_warp_size=32", [-1, 16, 64, 49152, 2147483647, 1024, 8, 32], "", 0, []], [[], [["SP", 3, 0, 7, [1, 1, 1, 1], 1], ["SP", 3, 5, 8, [1, 2, 1, 2], 1], ["SP", 3, 10, 32, [1, 4, 1, 1], 1], ["SP", 3, 15, 32, [1, 32, 1, 1], 1], ["SP", 3, 20, 8, [2, 1], 1], ["SP", 3, 23, 3, [1, 3], 1], ["SP", 3, 26, 3, [3, 1], 1], ["RE", 3, [0, 5, 10, 15, 1, 6, 11, 16, 2, 7, 12, 17, 20, 23, 26, 21, 24, 27, 3, 8, 13, 18, 22, 25, 28, 4, 9, 14, 19]], ["FSP", 5, 0, 0, 3], ["FSP", 5, 4, 1, 3], ["FSP", 5, 8, 2, 3], ["FSP", 5, 12, 3, 3], ["RE", 5, [0, 4, 8, 12, 1, 5, 9, 13, 2, 6, 10, 14, 3, 7, 11, 15]], ["CA", 3, 5, 11], ["CHR", 2, "shared", [3]], ["CA", 3, 4, 14], ["CHR", 1, "shared", [4]], ["CA", 2, 5, 14], ["CI", 1], ["FU", 7, [0, 1, 2, 3]], ["AN", 7, 0, 5], ["FU", 7, [1, 2, 3, 4]], ["AN", 7, 1, 4], ["FU", 7, [2, 3, 4, 5]], ["AN", 7, 2, 6], ["FU", 4, [0, 1, 2, 3]], ["SP", 4, 0, 36, [12], 1], ["AN", 4, 1, 2], ["FFSP", 4, 0, [3, 2, 1, 0], 1, 1], ["AN", 4, 1, 6], ["FU", 2, [0, 1, 2, 3]], ["SP", 2, 0, 24, [12], 1], ["AN", 2, 1, 2], ["FFSP", 2, 0, [3, 2, 1, 0], 1, 1], ["AN", 2, 1, 6], ["PR", 5, 0, "auto_unroll_max_step$64"]]]], "r": [[8.24963e-06, 8.24274e-06, 8.24702e-06, 8.24652e-06], 0, 3.27533, 1668696057], "v": "v0.6"}
{"i": [["[\"9a995a41bc2ff7cdadb96550380f7c85\", [7, 8, 32, 32], [8, 8, 3, 3], [1, 8, 1, 1], [7, 8, 32, 32]]", "cuda -keys=cuda,gpu -arch=sm_80 -max_num_threads=1024 -thread_warp_size=32", [-1, 16, 64, 49152, 2147483647, 1024, 8, 32], "", 0, []], [[], [["SP", 3, 0, 7, [1, 1, 7, 1], 1], ["SP", 3, 5, 8, [1, 1, 2, 4], 1], ["SP", 3, 10, 32, [1, 4, 1, 4], 1], ["SP", 3, 15, 32, [1, 4, 4, 1], 1], ["SP", 3, 20, 8, [4, 1], 1], ["SP", 3, 23, 3, [3, 1], 1], ["SP", 3, 26, 3, [3, 1], 1], ["RE", 3, [0, 5, 10, 15, 1, 6, 11, 16, 2, 7, 12, 17, 20, 23, 26, 21, 24, 27, 3, 8, 13, 18, 22, 25, 28, 4, 9, 14, 19]], ["FSP", 5, 0, 0, 3], ["FSP", 5, 4, 1, 3], ["FSP", 5, 8, 2, 3], ["FSP", 5, 12, 3, 3], ["RE", 5, [0, 4, 8, 12, 1, 5, 9, 13, 2, 6, 10, 14, 3, 7, 11, 15]], ["CA", 3, 5, 11], ["CHR", 2, "shared", [3]], ["CA", 3, 4, 14], ["CHR", 1, "shared", [4]], ["CA", 2, 5, 14], ["CI", 1], ["FU", 7, [0, 1, 2, 3]], ["AN", 7, 0, 5], ["FU", 7, [1, 2, 3, 4]], ["AN", 7, 1, 4], ["FU", 7, [2, 3, 4, 5]], ["AN", 7, 2, 6], ["FU", 4, [0, 1, 2, 3]], ["SP", 4, 0, 48, [1], 1], ["AN", 4, 1, 2], ["FFSP", 4, 0, [3, 2, 1, 0], 1, 1], ["AN", 4, 1, 6], ["FU", 2, [0, 1, 2, 3]], ["SP", 2, 0, 336, [1], 1], ["AN", 2, 1, 2], ["FFSP", 2, 0, [3, 2, 1, 0], 1, 1], ["AN", 2, 1, 6], ["PR", 5, 0, "auto_unroll_max_step$1024"]]]], "r": [[0.000468598, 0.000468606, 0.000468599, 0.000469376], 0, 14.1309, 1668696060], "v": "v0.6"}
{"i": [["[\"9a995a41bc2ff7cdadb96550380f7c85\", [7, 8, 32, 32], [8, 8, 3, 3], [1, 8, 1, 1], [7, 8, 32, 32]]", "cuda -keys=cuda,gpu -arch=sm_80 -max_num_threads=1024 -thread_warp_size=32", [-1, 16, 64, 49152, 2147483647, 1024, 8, 32], "", 0, []], [[], [["SP", 3, 0, 7, [1, 1, 1, 1], 1], ["SP", 3, 5, 8, [2, 1, 4, 1], 1], ["SP", 3, 10, 32, [1, 4, 2, 2], 1], ["SP", 3, 15, 32, [1, 2, 2, 1], 1], ["SP", 3, 20, 8, [1, 4], 1], ["SP", 3, 23, 3, [1, 3], 1], ["SP", 3, 26, 3, [1, 3], 1], ["RE", 3, [0, 5, 10, 15, 1, 6, 11, 16, 2, 7, 12, 17, 20, 23, 26, 21, 24, 27, 3, 8, 13, 18, 22, 25, 28, 4, 9, 14, 19]], ["FSP", 5, 0, 0, 3], ["FSP", 5, 4, 1, 3], ["FSP", 5, 8, 2, 3], ["FSP", 5, 12, 3, 3], ["RE", 5, [0, 4, 8, 12, 1, 5, 9, 13, 2, 6, 10, 14, 3, 7, 11, 15]], ["CA", 3, 5, 11], ["CHR", 2, "shared", [3]], ["CA", 3, 4, 14], ["CHR", 1, "shared", [4]], ["CA", 2, 5, 14], ["CI", 1], ["FU", 7, [0, 1, 2, 3]], ["AN", 7, 0, 5], ["FU", 7, [1, 2, 3, 4]], ["AN", 7, 1, 4], ["FU", 7, [2, 3, 4, 5]], ["AN", 7, 2, 6], ["FU", 4, [0, 1, 2, 3]], ["SP", 4, 0, 144, [1], 1], ["AN", 4, 1, 2], ["FFSP", 4, 0, [3, 2, 1, 0], 1, 1], ["AN", 4, 1, 6], ["FU", 2, [0, 1, 2, 3]], ["SP", 2, 0, 96, [1], 1], ["AN", 2, 1, 2], ["FFSP", 2, 0, [3, 2, 1, 0], 1, 1], ["AN", 2, 1, 6], ["PR", 5, 0, "auto_unroll_max_step$0"]]]], "r": [[4.77656e-05, 4.77555e-05, 4.77601e-05, 4.77599e-05], 0, 3.37364, 1668696063], "v": "v0.6"}
{"i": [["[\"9a995a41bc2ff7cdadb96550380f7c85\", [7, 8, 32, 32], [8, 8, 3, 3], [1, 8, 1, 1], [7, 8, 32, 32]]", "cuda -keys=cuda,gpu -arch=sm_80 -max_num_threads=1024 -thread_warp_size=32", [-1, 16, 64, 49152, 2147483647, 1024, 8, 32], "", 0, []], [[], [["SP", 3, 0, 7, [1, 1, 1, 7], 1], ["SP", 3, 5, 8, [1, 2, 4, 1], 1], ["SP", 3, 10, 32, [1, 1, 1, 2], 1], ["SP", 3, 15, 32, [1, 8, 4, 1], 1], ["SP", 3, 20, 8, [1, 4], 1], ["SP", 3, 23, 3, [3, 1], 1], ["SP", 3, 26, 3, [1, 3], 1], ["RE", 3, [0, 5, 10, 15, 1, 6, 11, 16, 2, 7, 12, 17, 20, 23, 26, 21, 24, 27, 3, 8, 13, 18, 22, 25, 28, 4, 9, 14, 19]], ["FSP", 5, 0, 0, 3], ["FSP", 5, 4, 1, 3], ["FSP", 5, 8, 2, 3], ["FSP", 5, 12, 3, 3], ["RE", 5, [0, 4, 8, 12, 1, 5, 9, 13, 2, 6, 10, 14, 3, 7, 11, 15]], ["CA", 3, 5, 11], ["CHR", 2, "shared", [3]], ["CA", 3, 4, 14], ["CHR", 1, "shared", [4]], ["CA", 2, 5, 14], ["CI", 1], ["FU", 7, [0, 1, 2, 3]], ["AN", 7, 0, 5], ["FU", 7, [1, 2, 3, 4]], ["AN", 7, 1, 4], ["FU", 7, [2, 3, 4, 5]], ["AN", 7, 2, 6], ["FU", 4, [0, 1, 2, 3]], ["SP", 4, 0, 144, [1], 1], ["AN", 4, 1, 2], ["FFSP", 4, 0, [3, 2, 1, 0], 1, 1], ["AN", 4, 1, 6], ["FU", 2, [0, 1, 2, 3]], ["SP", 2, 0, 96, [1], 1], ["AN", 2, 1, 2], ["FFSP", 2, 0, [3, 2, 1, 0], 1, 1], ["AN", 2, 1, 6], ["PR", 5, 0, "auto_unroll_max_step$64"]]]], "r": [[0.000204213, 0.000204211, 0.000204213, 0.000204216], 0, 3.58961, 1668696065], "v": "v0.6"}
{"i": [["[\"9a995a41bc2ff7cdadb96550380f7c85\", [7, 8, 32, 32], [8, 8, 3, 3], [1, 8, 1, 1], [7, 8, 32, 32]]", "cuda -keys=cuda,gpu -arch=sm_80 -max_num_threads=1024 -thread_warp_size=32", [-1, 16, 64, 49152, 2147483647, 1024, 8, 32], "", 0, []], [[], [["SP", 3, 0, 7, [1, 1, 1, 1], 1], ["SP", 3, 5, 8, [1, 2, 2, 2], 1], ["SP", 3, 10, 32, [1, 16, 2, 1], 1], ["SP", 3, 15, 32, [4, 1, 1, 1], 1], ["SP", 3, 20, 8, [2, 2], 1], ["SP", 3, 23, 3, [3, 1], 1], ["SP", 3, 26, 3, [1, 3], 1], ["RE", 3, [0, 5, 10, 15, 1, 6, 11, 16, 2, 7, 12, 17, 20, 23, 26, 21, 24, 27, 3, 8, 13, 18, 22, 25, 28, 4, 9, 14, 19]], ["FSP", 5, 0, 0, 3], ["FSP", 5, 4, 1, 3], ["FSP", 5, 8, 2, 3], ["FSP", 5, 12, 3, 3], ["RE", 5, [0, 4, 8, 12, 1, 5, 9, 13, 2, 6, 10, 14, 3, 7, 11, 15]], ["CA", 3, 5, 11], ["CHR", 2, "shared", [3]], ["CA", 3, 4, 14], ["CHR", 1, "shared", [4]], ["CA", 2, 5, 14], ["CI", 1], ["FU", 7, [0, 1, 2, 3]], ["AN", 7, 0, 5], ["FU", 7, [1, 2, 3, 4]], ["AN", 7, 1, 4], ["FU", 7, [2, 3, 4, 5]], ["AN", 7, 2, 6], ["FU", 4, [0, 1, 2, 3]], ["SP", 4, 0, 144, [1], 1], ["AN", 4, 1, 2], ["FFSP", 4, 0, [3, 2, 1, 0], 1, 1], ["AN", 4, 1, 6], ["FU", 2, [0, 1, 2, 3]], ["SP", 2, 0, 48, [6], 1], ["AN", 2, 1, 2], ["FFSP", 2, 0, [3, 2, 1, 0], 1, 1], ["AN", 2, 1, 6], ["PR", 5, 0, "auto_unroll_max_step$64"]]]], "r": [[1.10397e-05, 1.10368e-05, 1.10372e-05, 1.10344e-05], 0, 3.10618, 1668696068], "v": "v0.6"}
{"i": [["[\"9a995a41bc2ff7cdadb96550380f7c85\", [7, 8, 32, 32], [8, 8, 3, 3], [1, 8, 1, 1], [7, 8, 32, 32]]", "cuda -keys=cuda,gpu -arch=sm_80 -max_num_threads=1024 -thread_warp_size=32", [-1, 16, 64, 49152, 2147483647, 1024, 8, 32], "", 0, []], [[], [["SP", 3, 0, 7, [1, 7, 1, 1], 1], ["SP", 3, 5, 8, [2, 2, 2, 1], 1], ["SP", 3, 10, 32, [2, 2, 1, 1], 1], ["SP", 3, 15, 32, [1, 2, 1, 16], 1], ["SP", 3, 20, 8, [2, 4], 1], ["SP", 3, 23, 3, [1, 3], 1], ["SP", 3, 26, 3, [3, 1], 1], ["RE", 3, [0, 5, 10, 15, 1, 6, 11, 16, 2, 7, 12, 17, 20, 23, 26, 21, 24, 27, 3, 8, 13, 18, 22, 25, 28, 4, 9, 14, 19]], ["FSP", 5, 0, 0, 3], ["FSP", 5, 4, 1, 3], ["FSP", 5, 8, 2, 3], ["FSP", 5, 12, 3, 3], ["RE", 5, [0, 4, 8, 12, 1, 5, 9, 13, 2, 6, 10, 14, 3, 7, 11, 15]], ["CA", 3, 5, 11], ["CHR", 2, "shared", [3]], ["CA", 3, 4, 14], ["CHR", 1, "shared", [4]], ["CA", 2, 5, 14], ["CI", 1], ["FU", 7, [0, 1, 2, 3]], ["AN", 7, 0, 5], ["FU", 7, [1, 2, 3, 4]], ["AN", 7, 1, 4], ["FU", 7, [2, 3, 4, 5]], ["AN", 7, 2, 6], ["FU", 4, [0, 1, 2, 3]], ["SP", 4, 0, 144, [1], 1], ["AN", 4, 1, 2], ["FFSP", 4, 0, [3, 2, 1, 0], 1, 1], ["AN", 4, 1, 6], ["FU", 2, [0, 1, 2, 3]], ["SP", 2, 0, 432, [16], 1], ["AN", 2, 1, 2], ["FFSP", 2, 0, [3, 2, 1, 0], 1, 1], ["AN", 2, 1, 6], ["PR", 5, 0, "auto_unroll_max_step$64"]]]], "r": [[7.62803e-05, 7.63181e-05, 7.62772e-05, 7.62684e-05], 0, 3.8917, 1668696070], "v": "v0.6"}
{"i": [["[\"9a995a41bc2ff7cdadb96550380f7c85\", [7, 8, 32, 32], [8, 8, 3, 3], [1, 8, 1, 1], [7, 8, 32, 32]]", "cuda -keys=cuda,gpu -arch=sm_80 -max_num_threads=1024 -thread_warp_size=32", [-1, 16, 64, 49152, 2147483647, 1024, 8, 32], "", 0, []], [[], [["SP", 3, 0, 7, [1, 7, 1, 1], 1], ["SP", 3, 5, 8, [1, 1, 1, 1], 1], ["SP", 3, 10, 32, [1, 4, 1, 1], 1], ["SP", 3, 15, 32, [1, 8, 2, 2], 1], ["SP", 3, 20, 8, [4, 2], 1], ["SP", 3, 23, 3, [1, 1], 1], ["SP", 3, 26, 3, [1, 1], 1], ["RE", 3, [0, 5, 10, 15, 1, 6, 11, 16, 2, 7, 12, 17, 20, 23, 26, 21, 24, 27, 3, 8, 13, 18, 22, 25, 28, 4, 9, 14, 19]], ["FSP", 5, 0, 0, 3], ["FSP", 5, 4, 1, 3], ["FSP", 5, 8, 2, 3], ["FSP", 5, 12, 3, 3], ["RE", 5, [0, 4, 8, 12, 1, 5, 9, 13, 2, 6, 10, 14, 3, 7, 11, 15]], ["CA", 3, 5, 11], ["CHR", 2, "shared", [3]], ["CA", 3, 4, 14], ["CHR", 1, "shared", [4]], ["CA", 2, 5, 14], ["CI", 1], ["FU", 7, [0, 1, 2, 3]], ["AN", 7, 0, 5], ["FU", 7, [1, 2, 3, 4]], ["AN", 7, 1, 4], ["FU", 7, [2, 3, 4, 5]], ["AN", 7, 2, 6], ["FU", 4, [0, 1, 2, 3]], ["SP", 4, 0, 24, [1], 1], ["AN", 4, 1, 2], ["FFSP", 4, 0, [3, 2, 1, 0], 1, 1], ["AN", 4, 1, 6], ["FU", 2, [0, 1, 2, 3]], ["SP", 2, 0, 672, [32], 1], ["AN", 2, 1, 2], ["FFSP", 2, 0, [3, 2, 1, 0], 1, 1], ["AN", 2, 1, 6], ["PR", 5, 0, "auto_unroll_max_step$1024"]]]], "r": [[7.55335e-05, 7.55337e-05, 7.55331e-05, 7.55327e-05], 0, 3.76562, 1668696073], "v": "v0.6"}
{"i": [["[\"9a995a41bc2ff7cdadb96550380f7c85\", [7, 8, 32, 32], [8, 8, 3, 3], [1, 8, 1, 1], [7, 8, 32, 32]]", "cuda -keys=cuda,gpu -arch=sm_80 -max_num_threads=1024 -thread_warp_size=32", [-1, 16, 64, 49152, 2147483647, 1024, 8, 32], "", 0, []], [[], [["SP", 3, 0, 7, [1, 1, 1, 1], 1], ["SP", 3, 5, 8, [1, 1, 1, 2], 1], ["SP", 3, 10, 32, [1, 4, 1, 1], 1], ["SP", 3, 15, 32, [1, 16, 1, 2], 1], ["SP", 3, 20, 8, [2, 1], 1], ["SP", 3, 23, 3, [3, 1], 1], ["SP", 3, 26, 3, [3, 1], 1], ["RE", 3, [0, 5, 10, 15, 1, 6, 11, 16, 2, 7, 12, 17, 20, 23, 26, 21, 24, 27, 3, 8, 13, 18, 22, 25, 28, 4, 9, 14, 19]], ["FSP", 5, 0, 0, 3], ["FSP", 5, 4, 1, 3], ["FSP", 5, 8, 2, 3], ["FSP", 5, 12, 3, 3], ["RE", 5, [0, 4, 8, 12, 1, 5, 9, 13, 2, 6, 10, 14, 3, 7, 11, 15]], ["CA", 3, 5, 11], ["CHR", 2, "shared", [3]], ["CA", 3, 4, 14], ["CHR", 1, "shared", [4]], ["CA", 2, 5, 14], ["CI", 1], ["FU", 7, [0, 1, 2, 3]], ["AN", 7, 0, 5], ["FU", 7, [1, 2, 3, 4]], ["AN", 7, 1, 4], ["FU", 7, [2, 3, 4, 5]], ["AN", 7, 2, 6], ["FU", 4, [0, 1, 2, 3]], ["SP", 4, 0, 36, [1], 1], ["AN", 4, 1, 2], ["FFSP", 4, 0, [3, 2, 1, 0], 1, 1], ["AN", 4, 1, 6], ["FU", 2, [0, 1, 2, 3]], ["SP", 2, 0, 24, [12], 1], ["AN", 2, 1, 2], ["FFSP", 2, 0, [3, 2, 1, 0], 1, 1], ["AN", 2, 1, 6], ["PR", 5, 0, "auto_unroll_max_step$64"]]]], "r": [[6.17268e-06, 6.17816e-06, 6.17632e-06, 6.17399e-06], 0, 2.89773, 1668696075], "v": "v0.6"}
{"i": [["[\"9a995a41bc2ff7cdadb96550380f7c85\", [7, 8, 32, 32], [8, 8, 3, 3], [1, 8, 1, 1], [7, 8, 32, 32]]", "cuda -keys=cuda,gpu -arch=sm_80 -max_num_threads=1024 -thread_warp_size=32", [-1, 16, 64, 49152, 2147483647, 1024, 8, 32], "", 0, []], [[], [["SP", 3, 0, 7, [1, 1, 1, 1], 1], ["SP", 3, 5, 8, [1, 2, 1, 2], 1], ["SP", 3, 10, 32, [2, 2, 1, 2], 1], ["SP", 3, 15, 32, [2, 16, 1, 1], 1], ["SP", 3, 20, 8, [8, 1], 1], ["SP", 3, 23, 3, [1, 3], 1], ["SP", 3, 26, 3, [1, 3], 1], ["RE", 3, [0, 5, 10, 15, 1, 6, 11, 16, 2, 7, 12, 17, 20, 23, 26, 21, 24, 27, 3, 8, 13, 18, 22, 25, 28, 4, 9, 14, 19]], ["FSP", 5, 0, 0, 3], ["FSP", 5, 4, 1, 3], ["FSP", 5, 8, 2, 3], ["FSP", 5, 12, 3, 3], ["RE", 5, [0, 4, 8, 12, 1, 5, 9, 13, 2, 6, 10, 14, 3, 7, 11, 15]], ["CA", 3, 5, 11], ["CHR", 2, "shared", [3]], ["CA", 3, 4, 14], ["CHR", 1, "shared", [4]], ["CA", 2, 5, 14], ["CI", 1], ["FU", 7, [0, 1, 2, 3]], ["AN", 7, 0, 5], ["FU", 7, [1, 2, 3, 4]], ["AN", 7, 1, 4], ["FU", 7, [2, 3, 4, 5]], ["AN", 7, 2, 6], ["FU", 4, [0, 1, 2, 3]], ["SP", 4, 0, 144, [1], 1], ["AN", 4, 1, 2], ["FFSP", 4, 0, [3, 2, 1, 0], 1, 1], ["AN", 4, 1, 6], ["FU", 2, [0, 1, 2, 3]], ["SP", 2, 0, 48, [1], 1], ["AN", 2, 1, 2], ["FFSP", 2, 0, [3, 2, 1, 0], 1, 1], ["AN", 2, 1, 6], ["PR", 5, 0, "auto_unroll_max_step$1024"]]]], "r": [[8.97034e-06, 8.96972e-06, 8.96226e-06, 8.96861e-06], 0, 3.14561, 1668696078], "v": "v0.6"}
{"i": [["[\"9a995a41bc2ff7cdadb96550380f7c85\", [7, 8, 32, 32], [8, 8, 3, 3], [1, 8, 1, 1], [7, 8, 32, 32]]", "cuda -keys=cuda,gpu -arch=sm_80 -max_num_threads=1024 -thread_warp_size=32", [-1, 16, 64, 49152, 2147483647, 1024, 8, 32], "", 0, []], [[], [["SP", 3, 0, 7, [1, 1, 1, 1], 1], ["SP", 3, 5, 8, [1, 1, 2, 4], 1], ["SP", 3, 10, 32, [1, 32, 1, 1], 1], ["SP", 3, 15, 32, [1, 1, 8, 4], 1], ["SP", 3, 20, 8, [8, 1], 1], ["SP", 3, 23, 3, [1, 1], 1], ["SP", 3, 26, 3, [1, 1], 1], ["RE", 3, [0, 5, 10, 15, 1, 6, 11, 16, 2, 7, 12, 17, 20, 23, 26, 21, 24, 27, 3, 8, 13, 18, 22, 25, 28, 4, 9, 14, 19]], ["FSP", 5, 0, 0, 3], ["FSP", 5, 4, 1, 3], ["FSP", 5, 8, 2, 3], ["FSP", 5, 12, 3, 3], ["RE", 5, [0, 4, 8, 12, 1, 5, 9, 13, 2, 6, 10, 14, 3, 7, 11, 15]], ["CA", 3, 5, 11], ["CHR", 2, "shared", [3]], ["CA", 3, 4, 14], ["CHR", 1, "shared", [4]], ["CA", 2, 5, 14], ["CI", 1], ["FU", 7, [0, 1, 2, 3]], ["AN", 7, 0, 5], ["FU", 7, [1, 2, 3, 4]], ["AN", 7, 1, 4], ["FU", 7, [2, 3, 4, 5]], ["AN", 7, 2, 6], ["FU", 4, [0, 1, 2, 3]], ["SP", 4, 0, 96, [1], 1], ["AN", 4, 1, 2], ["FFSP", 4, 0, [3, 2, 1, 0], 1, 1], ["AN", 4, 1, 6], ["FU", 2, [0, 1, 2, 3]], ["SP", 2, 0, 72, [1], 1], ["AN", 2, 1, 2], ["FFSP", 2, 0, [3, 2, 1, 0], 1, 1], ["AN", 2, 1, 6], ["PR", 5, 0, "auto_unroll_max_step$64"]]]], "r": [[0.000196604, 0.000196577, 0.00019659, 0.000196583], 0, 3.34826, 1668696080], "v": "v0.6"}
{"i": [["[\"9a995a41bc2ff7cdadb96550380f7c85\", [7, 8, 32, 32], [8, 8, 3, 3], [1, 8, 1, 1], [7, 8, 32, 32]]", "cuda -keys=cuda,gpu -arch=sm_80 -max_num_threads=1024 -thread_warp_size=32", [-1, 16, 64, 49152, 2147483647, 1024, 8, 32], "", 0, []], [[], [["SP", 3, 0, 7, [1, 7, 1, 1], 1], ["SP", 3, 5, 8, [4, 2, 1, 1], 1], ["SP", 3, 10, 32, [2, 2, 1, 1], 1], ["SP", 3, 15, 32, [1, 4, 2, 2], 1], ["SP", 3, 20, 8, [1, 1], 1], ["SP", 3, 23, 3, [1, 3], 1], ["SP", 3, 26, 3, [1, 3], 1], ["RE", 3, [0, 5, 10, 15, 1, 6, 11, 16, 2, 7, 12, 17, 20, 23, 26, 21, 24, 27, 3, 8, 13, 18, 22, 25, 28, 4, 9, 14, 19]], ["FSP", 5, 0, 0, 3], ["FSP", 5, 4, 1, 3], ["FSP", 5, 8, 2, 3], ["FSP", 5, 12, 3, 3], ["RE", 5, [0, 4, 8, 12, 1, 5, 9, 13, 2, 6, 10, 14, 3, 7, 11, 15]], ["CA", 3, 5, 11], ["CHR", 2, "shared", [3]], ["CA", 3, 4, 14], ["CHR", 1, "shared", [4]], ["CA", 2, 5, 14], ["CI", 1], ["FU", 7, [0, 1, 2, 3]], ["AN", 7, 0, 5], ["FU", 7, [1, 2, 3, 4]], ["AN", 7, 1, 4], ["FU", 7, [2, 3, 4, 5]], ["AN", 7, 2, 6], ["FU", 4, [0, 1, 2, 3]], ["SP", 4, 0, 9, [3], 1], ["AN", 4, 1, 2], ["FFSP", 4, 0, [3, 2, 1, 0], 1, 1], ["AN", 4, 1, 6], ["FU", 2, [0, 1, 2, 3]], ["SP", 2, 0, 16, [1], 1], ["AN", 2, 1, 2], ["FFSP", 2, 0, [3, 2, 1, 0], 1, 1], ["AN", 2, 1, 6], ["PR", 5, 0, "auto_unroll_max_step$512"]]]], "r": [[1.4187e-05, 1.41931e-05, 1.41852e-05, 1.41756e-05], 0, 3.17918, 1668696083], "v": "v0.6"}
{"i": [["[\"9a995a41bc2ff7cdadb96550380f7c85\", [7, 8, 32, 32], [8, 8, 3, 3], [1, 8, 1, 1], [7, 8, 32, 32]]", "cuda -keys=cuda,gpu -arch=sm_80 -max_num_threads=1024 -thread_warp_size=32", [-1, 16, 64, 49152, 2147483647, 1024, 8, 32], "", 0, []], [[], [["SP", 3, 0, 7, [1, 1, 7, 1], 1], ["SP", 3, 5, 8, [1, 4, 1, 2], 1], ["SP", 3, 10, 32, [2, 2, 1, 8], 1], ["SP", 3, 15, 32, [2, 1, 2, 2], 1], ["SP", 3, 20, 8, [4, 1], 1], ["SP", 3, 23, 3, [1, 3], 1], ["SP", 3, 26, 3, [1, 1], 1], ["RE", 3, [0, 5, 10, 15, 1, 6, 11, 16, 2, 7, 12, 17, 20, 23, 26, 21, 24, 27, 3, 8, 13, 18, 22, 25, 28, 4, 9, 14, 19]], ["FSP", 5, 0, 0, 3], ["FSP", 5, 4, 1, 3], ["FSP", 5, 8, 2, 3], ["FSP", 5, 12, 3, 3], ["RE", 5, [0, 4, 8, 12, 1, 5, 9, 13, 2, 6, 10, 14, 3, 7, 11, 15]], ["CA", 3, 5, 11], ["CHR", 2, "shared", [3]], ["CA", 3, 4, 14], ["CHR", 1, "shared", [4]], ["CA", 2, 5, 14], ["CI", 1], ["FU", 7, [0, 1, 2, 3]], ["AN", 7, 0, 5], ["FU", 7, [1, 2, 3, 4]], ["AN", 7, 1, 4], ["FU", 7, [2, 3, 4, 5]], ["AN", 7, 2, 6], ["FU", 4, [0, 1, 2, 3]], ["SP", 4, 0, 72, [1], 1], ["AN", 4, 1, 2], ["FFSP", 4, 0, [3, 2, 1, 0], 1, 1], ["AN", 4, 1, 6], ["FU", 2, [0, 1, 2, 3]], ["SP", 2, 0, 672, [1], 1], ["AN", 2, 1, 2], ["FFSP", 2, 0, [3, 2, 1, 0], 1, 1], ["AN", 2, 1, 6], ["PR", 5, 0, "auto_unroll_max_step$16"]]]], "r": [[0.000845193, 0.000845185, 0.000845131, 0.000845137], 0, 3.32922, 1668696085], "v": "v0.6"}
{"i": [["[\"9a995a41bc2ff7cdadb96550380f7c85\", [7, 8, 32, 32], [8, 8, 3, 3], [1, 8, 1, 1], [7, 8, 32, 32]]", "cuda -keys=cuda,gpu -arch=sm_80 -max_num_threads=1024 -thread_warp_size=32", [-1, 16, 64, 49152, 2147483647, 1024, 8, 32], "", 0, []], [[], [["SP", 3, 0, 7, [1, 1, 1, 1], 1], ["SP", 3, 5, 8, [1, 2, 1, 1], 1], ["SP", 3, 10, 32, [1, 8, 2, 1], 1], ["SP", 3, 15, 32, [2, 4, 1, 1], 1], ["SP", 3, 20, 8, [8, 1], 1], ["SP", 3, 23, 3, [3, 1], 1], ["SP", 3, 26, 3, [3, 1], 1], ["RE", 3, [0, 5, 10, 15, 1, 6, 11, 16, 2, 7, 12, 17, 20, 23, 26, 21, 24, 27, 3, 8, 13, 18, 22, 25, 28, 4, 9, 14, 19]], ["FSP", 5, 0, 0, 3], ["FSP", 5, 4, 1, 3], ["FSP", 5, 8, 2, 3], ["FSP", 5, 12, 3, 3], ["RE", 5, [0, 4, 8, 12, 1, 5, 9, 13, 2, 6, 10, 14, 3, 7, 11, 15]], ["CA", 3, 5, 11], ["CHR", 2, "shared", [3]], ["CA", 3, 4, 14], ["CHR", 1, "shared", [4]], ["CA", 2, 5, 14], ["CI", 1], ["FU", 7, [0, 1, 2, 3]], ["AN", 7, 0, 5], ["FU", 7, [1, 2, 3, 4]], ["AN", 7, 1, 4], ["FU", 7, [2, 3, 4, 5]], ["AN", 7, 2, 6], ["FU", 4, [0, 1, 2, 3]], ["SP", 4, 0, 72, [24], 1], ["AN", 4, 1, 2], ["FFSP", 4, 0, [3, 2, 1, 0], 1, 1], ["AN", 4, 1, 6], ["FU", 2, [0, 1, 2, 3]], ["SP", 2, 0, 144, [1], 1], ["AN", 2, 1, 2], ["FFSP", 2, 0, [3, 2, 1, 0], 1, 1], ["AN", 2, 1, 6], ["PR", 5, 0, "auto_unroll_max_step$512"]]]], "r": [[6.25205e-06, 6.2513e-06, 6.24928e-06, 6.24735e-06], 0, 3.1358, 1668696087], "v": "v0.6"}
{"i": [["[\"9a995a41bc2ff7cdadb96550380f7c85\", [7, 8, 32, 32], [8, 8, 3, 3], [1, 8, 1, 1], [7, 8, 32, 32]]", "cuda -keys=cuda,gpu -arch=sm_80 -max_num_threads=1024 -thread_warp_size=32", [-1, 16, 64, 49152, 2147483647, 1024, 8, 32], "", 0, []], [[], [["SP", 3, 0, 7, [1, 1, 1, 7], 1], ["SP", 3, 5, 8, [1, 2, 1, 4], 1], ["SP", 3, 10, 32, [1, 32, 1, 1], 1], ["SP", 3, 15, 32, [2, 2, 2, 1], 1], ["SP", 3, 20, 8, [1, 2], 1], ["SP", 3, 23, 3, [1, 1], 1], ["SP", 3, 26, 3, [1, 1], 1], ["RE", 3, [0, 5, 10, 15, 1, 6, 11, 16, 2, 7, 12, 17, 20, 23, 26, 21, 24, 27, 3, 8, 13, 18, 22, 25, 28, 4, 9, 14, 19]], ["FSP", 5, 0, 0, 3], ["FSP", 5, 4, 1, 3], ["FSP", 5, 8, 2, 3], ["FSP", 5, 12, 3, 3], ["RE", 5, [0, 4, 8, 12, 1, 5, 9, 13, 2, 6, 10, 14, 3, 7, 11, 15]], ["CA", 3, 5, 11], ["CHR", 2, "shared", [3]], ["CA", 3, 4, 14], ["CHR", 1, "shared", [4]], ["CA", 2, 5, 14], ["CI", 1], ["FU", 7, [0, 1, 2, 3]], ["AN", 7, 0, 5], ["FU", 7, [1, 2, 3, 4]], ["AN", 7, 1, 4], ["FU", 7, [2, 3, 4, 5]], ["AN", 7, 2, 6], ["FU", 4, [0, 1, 2, 3]], ["SP", 4, 0, 8, [8], 1], ["AN", 4, 1, 2], ["FFSP", 4, 0, [3, 2, 1, 0], 1, 1], ["AN", 4, 1, 6], ["FU", 2, [0, 1, 2, 3]], ["SP", 2, 0, 28, [1], 1], ["AN", 2, 1, 2], ["FFSP", 2, 0, [3, 2, 1, 0], 1, 1], ["AN", 2, 1, 6], ["PR", 5, 0, "auto_unroll_max_step$1024"]]]], "r": [[4.58028e-05, 4.58017e-05, 4.58024e-05, 4.58017e-05], 0, 4.39131, 1668696089], "v": "v0.6"}
{"i": [["[\"9a995a41bc2ff7cdadb96550380f7c85\", [7, 8, 32, 32], [8, 8, 3, 3], [1, 8, 1, 1], [7, 8, 32, 32]]", "cuda -keys=cuda,gpu -arch=sm_80 -max_num_threads=1024 -thread_warp_size=32", [-1, 16, 64, 49152, 2147483647, 1024, 8, 32], "", 0, []], [[], [["SP", 3, 0, 7, [1, 1, 7, 1], 1], ["SP", 3, 5, 8, [1, 4, 1, 1], 1], ["SP", 3, 10, 32, [2, 1, 4, 4], 1], ["SP", 3, 15, 32, [4, 4, 1, 1], 1], ["SP", 3, 20, 8, [1, 2], 1], ["SP", 3, 23, 3, [3, 1], 1], ["SP", 3, 26, 3, [3, 1], 1], ["RE", 3, [0, 5, 10, 15, 1, 6, 11, 16, 2, 7, 12, 17, 20, 23, 26, 21, 24, 27, 3, 8, 13, 18, 22, 25, 28, 4, 9, 14, 19]], ["FSP", 5, 0, 0, 3], ["FSP", 5, 4, 1, 3], ["FSP", 5, 8, 2, 3], ["FSP", 5, 12, 3, 3], ["RE", 5, [0, 4, 8, 12, 1, 5, 9, 13, 2, 6, 10, 14, 3, 7, 11, 15]], ["CA", 3, 5, 11], ["CHR", 2, "shared", [3]], ["CA", 3, 4, 14], ["CHR", 1, "shared", [4]], ["CA", 2, 5, 14], ["CI", 1], ["FU", 7, [0, 1, 2, 3]], ["AN", 7, 0, 5], ["FU", 7, [1, 2, 3, 4]], ["AN", 7, 1, 4], ["FU", 7, [2, 3, 4, 5]], ["AN", 7, 2, 6], ["FU", 4, [0, 1, 2, 3]], ["SP", 4, 0, 6, [1], 1], ["AN", 4, 1, 2], ["FFSP", 4, 0, [3, 2, 1, 0], 1, 1], ["AN", 4, 1, 6], ["FU", 2, [0, 1, 2, 3]], ["SP", 2, 0, 140, [10], 1], ["AN", 2, 1, 2], ["FFSP", 2, 0, [3, 2, 1, 0], 1, 1], ["AN", 2, 1, 6], ["PR", 5, 0, "auto_unroll_max_step$512"]]]], "r": [[0.000902578, 0.000902587, 0.000902576, 0.000902595], 0, 6.69591, 1668696092], "v": "v0.6"}
{"i": [["[\"9a995a41bc2ff7cdadb96550380f7c85\", [7, 8, 32, 32], [8, 8, 3, 3], [1, 8, 1, 1], [7, 8, 32, 32]]", "cuda -keys=cuda,gpu -arch=sm_80 -max_num_threads=1024 -thread_warp_size=32", [-1, 16, 64, 49152, 2147483647, 1024, 8, 32], "", 0, []], [[], [["SP", 3, 0, 7, [1, 7, 1, 1], 1], ["SP", 3, 5, 8, [4, 1, 1, 2], 1], ["SP", 3, 10, 32, [1, 1, 1, 32], 1], ["SP", 3, 15, 32, [1, 8, 1, 1], 1], ["SP", 3, 20, 8, [4, 1], 1], ["SP", 3, 23, 3, [1, 1], 1], ["SP", 3, 26, 3, [3, 1], 1], ["RE", 3, [0, 5, 10, 15, 1, 6, 11, 16, 2, 7, 12, 17, 20, 23, 26, 21, 24, 27, 3, 8, 13, 18, 22, 25, 28, 4, 9, 14, 19]], ["FSP", 5, 0, 0, 3], ["FSP", 5, 4, 1, 3], ["FSP", 5, 8, 2, 3], ["FSP", 5, 12, 3, 3], ["RE", 5, [0, 4, 8, 12, 1, 5, 9, 13, 2, 6, 10, 14, 3, 7, 11, 15]], ["CA", 3, 5, 11], ["CHR", 2, "shared", [3]], ["CA", 3, 4, 14], ["CHR", 1, "shared", [4]], ["CA", 2, 5, 14], ["CI", 1], ["FU", 7, [0, 1, 2, 3]], ["AN", 7, 0, 5], ["FU", 7, [1, 2, 3, 4]], ["AN", 7, 1, 4], ["FU", 7, [2, 3, 4, 5]], ["AN", 7, 2, 6], ["FU", 4, [0, 1, 2, 3]], ["SP", 4, 0, 12, [1], 1], ["AN", 4, 1, 2], ["FFSP", 4, 0, [3, 2, 1, 0], 1, 1], ["AN", 4, 1, 6], ["FU", 2, [0, 1, 2, 3]], ["SP", 2, 0, 384, [1], 1], ["AN", 2, 1, 2], ["FFSP", 2, 0, [3, 2, 1, 0], 1, 1], ["AN", 2, 1, 6], ["PR", 5, 0, "auto_unroll_max_step$64"]]]], "r": [[0.000354672, 0.000354665, 0.000354643, 0.00035468], 0, 3.37254, 1668696095], "v": "v0.6"}
{"i": [["[\"9a995a41bc2ff7cdadb96550380f7c85\", [7, 8, 32, 32], [8, 8, 3, 3], [1, 8, 1, 1], [7, 8, 32, 32]]", "cuda -keys=cuda,gpu -arch=sm_80 -max_num_threads=1024 -thread_warp_size=32", [-1, 16, 64, 49152, 2147483647, 1024, 8, 32], "", 0, []], [[], [["SP", 3, 0, 7, [1, 7, 1, 1], 1], ["SP", 3, 5, 8, [2, 1, 1, 4], 1], ["SP", 3, 10, 32, [2, 2, 2, 1], 1], ["SP", 3, 15, 32, [2, 4, 1, 1], 1], ["SP", 3, 20, 8, [1, 4], 1], ["SP", 3, 23, 3, [1, 3], 1], ["SP", 3, 26, 3, [1, 3], 1], ["RE", 3, [0, 5, 10, 15, 1, 6, 11, 16, 2, 7, 12, 17, 20, 23, 26, 21, 24, 27, 3, 8, 13, 18, 22, 25, 28, 4, 9, 14, 19]], ["FSP", 5, 0, 0, 3], ["FSP", 5, 4, 1, 3], ["FSP", 5, 8, 2, 3], ["FSP", 5, 12, 3, 3], ["RE", 5, [0, 4, 8, 12, 1, 5, 9, 13, 2, 6, 10, 14, 3, 7, 11, 15]], ["CA", 3, 5, 11], ["CHR", 2, "shared", [3]], ["CA", 3, 4, 14], ["CHR", 1, "shared", [4]], ["CA", 2, 5, 14], ["CI", 1], ["FU", 7, [0, 1, 2, 3]], ["AN", 7, 0, 5], ["FU", 7, [1, 2, 3, 4]], ["AN", 7, 1, 4], ["FU", 7, [2, 3, 4, 5]], ["AN", 7, 2, 6], ["FU", 4, [0, 1, 2, 3]], ["SP", 4, 0, 144, [1], 1], ["AN", 4, 1, 2], ["FFSP", 4, 0, [3, 2, 1, 0], 1, 1], ["AN", 4, 1, 6], ["FU", 2, [0, 1, 2, 3]], ["SP", 2, 0, 48, [1], 1], ["AN", 2, 1, 2], ["FFSP", 2, 0, [3, 2, 1, 0], 1, 1], ["AN", 2, 1, 6], ["PR", 5, 0, "auto_unroll_max_step$1024"]]]], "r": [[1.838e-05, 1.83796e-05, 1.83793e-05, 1.83792e-05], 0, 4.98819, 1668696097], "v": "v0.6"}
{"i": [["[\"9a995a41bc2ff7cdadb96550380f7c85\", [7, 8, 32, 32], [8, 8, 3, 3], [1, 8, 1, 1], [7, 8, 32, 32]]", "cuda -keys=cuda,gpu -arch=sm_80 -max_num_threads=1024 -thread_warp_size=32", [-1, 16, 64, 49152, 2147483647, 1024, 8, 32], "", 0, []], [[], [["SP", 3, 0, 7, [1, 7, 1, 1], 1], ["SP", 3, 5, 8, [1, 2, 1, 4], 1], ["SP", 3, 10, 32, [1, 4, 1, 1], 1], ["SP", 3, 15, 32, [1, 8, 2, 2], 1], ["SP", 3, 20, 8, [4, 2], 1], ["SP", 3, 23, 3, [3, 1], 1], ["SP", 3, 26, 3, [1, 1], 1], ["RE", 3, [0, 5, 10, 15, 1, 6, 11, 16, 2, 7, 12, 17, 20, 23, 26, 21, 24, 27, 3, 8, 13, 18, 22, 25, 28, 4, 9, 14, 19]], ["FSP", 5, 0, 0, 3], ["FSP", 5, 4, 1, 3], ["FSP", 5, 8, 2, 3], ["FSP", 5, 12, 3, 3], ["RE", 5, [0, 4, 8, 12, 1, 5, 9, 13, 2, 6, 10, 14, 3, 7, 11, 15]], ["CA", 3, 5, 11], ["CHR", 2, "shared", [3]], ["CA", 3, 4, 14], ["CHR", 1, "shared", [4]], ["CA", 2, 5, 14], ["CI", 1], ["FU", 7, [0, 1, 2, 3]], ["AN", 7, 0, 5], ["FU", 7, [1, 2, 3, 4]], ["AN", 7, 1, 4], ["FU", 7, [2, 3, 4, 5]], ["AN", 7, 2, 6], ["FU", 4, [0, 1, 2, 3]], ["SP", 4, 0, 96, [1], 1], ["AN", 4, 1, 2], ["FFSP", 4, 0, [3, 2, 1, 0], 1, 1], ["AN", 4, 1, 6], ["FU", 2, [0, 1, 2, 3]], ["SP", 2, 0, 96, [1], 1], ["AN", 2, 1, 2], ["FFSP", 2, 0, [3, 2, 1, 0], 1, 1], ["AN", 2, 1, 6], ["PR", 5, 0, "auto_unroll_max_step$512"]]]], "r": [[1.96063e-05, 1.9606e-05, 1.96086e-05, 1.96041e-05], 0, 3.3883, 1668696100], "v": "v0.6"}
{"i": [["[\"9a995a41bc2ff7cdadb96550380f7c85\", [7, 8, 32, 32], [8, 8, 3, 3], [1, 8, 1, 1], [7, 8, 32, 32]]", "cuda -keys=cuda,gpu -arch=sm_80 -max_num_threads=1024 -thread_warp_size=32", [-1, 16, 64, 49152, 2147483647, 1024, 8, 32], "", 0, []], [[], [["SP", 3, 0, 7, [1, 1, 1, 1], 1], ["SP", 3, 5, 8, [1, 2, 1, 4], 1], ["SP", 3, 10, 32, [4, 4, 1, 2], 1], ["SP", 3, 15, 32, [2, 16, 1, 1], 1], ["SP", 3, 20, 8, [4, 1], 1], ["SP", 3, 23, 3, [1, 1], 1], ["SP", 3, 26, 3, [1, 3], 1], ["RE", 3, [0, 5, 10, 15, 1, 6, 11, 16, 2, 7, 12, 17, 20, 23, 26, 21, 24, 27, 3, 8, 13, 18, 22, 25, 28, 4, 9, 14, 19]], ["FSP", 5, 0, 0, 3], ["FSP", 5, 4, 1, 3], ["FSP", 5, 8, 2, 3], ["FSP", 5, 12, 3, 3], ["RE", 5, [0, 4, 8, 12, 1, 5, 9, 13, 2, 6, 10, 14, 3, 7, 11, 15]], ["CA", 3, 5, 11], ["CHR", 2, "shared", [3]], ["CA", 3, 4, 14], ["CHR", 1, "shared", [4]], ["CA", 2, 5, 14], ["CI", 1], ["FU", 7, [0, 1, 2, 3]], ["AN", 7, 0, 5], ["FU", 7, [1, 2, 3, 4]], ["AN", 7, 1, 4], ["FU", 7, [2, 3, 4, 5]], ["AN", 7, 2, 6], ["FU", 4, [0, 1, 2, 3]], ["SP", 4, 0, 144, [3], 1], ["AN", 4, 1, 2], ["FFSP", 4, 0, [3, 2, 1, 0], 1, 1], ["AN", 4, 1, 6], ["FU", 2, [0, 1, 2, 3]], ["SP", 2, 0, 48, [1], 1], ["AN", 2, 1, 2], ["FFSP", 2, 0, [3, 2, 1, 0], 1, 1], ["AN", 2, 1, 6], ["PR", 5, 0, "auto_unroll_max_step$16"]]]], "r": [[4.95869e-05, 4.95864e-05, 4.95733e-05, 4.95841e-05], 0, 3.21799, 1668696103], "v": "v0.6"}
{"i": [["[\"9a995a41bc2ff7cdadb96550380f7c85\", [7, 8, 32, 32], [8, 8, 3, 3], [1, 8, 1, 1], [7, 8, 32, 32]]", "cuda -keys=cuda,gpu -arch=sm_80 -max_num_threads=1024 -thread_warp_size=32", [-1, 16, 64, 49152, 2147483647, 1024, 8, 32], "", 0, []], [[], [["SP", 3, 0, 7, [1, 7, 1, 1], 1], ["SP", 3, 5, 8, [1, 4, 1, 2], 1], ["SP", 3, 10, 32, [1, 2, 8, 1], 1], ["SP", 3, 15, 32, [1, 4, 1, 2], 1], ["SP", 3, 20, 8, [1, 4], 1], ["SP", 3, 23, 3, [1, 1], 1], ["SP", 3, 26, 3, [1, 1], 1], ["RE", 3, [0, 5, 10, 15, 1, 6, 11, 16, 2, 7, 12, 17, 20, 23, 26, 21, 24, 27, 3, 8, 13, 18, 22, 25, 28, 4, 9, 14, 19]], ["FSP", 5, 0, 0, 3], ["FSP", 5, 4, 1, 3], ["FSP", 5, 8, 2, 3], ["FSP", 5, 12, 3, 3], ["RE", 5, [0, 4, 8, 12, 1, 5, 9, 13, 2, 6, 10, 14, 3, 7, 11, 15]], ["CA", 3, 5, 11], ["CHR", 2, "shared", [3]], ["CA", 3, 4, 14], ["CHR", 1, "shared", [4]], ["CA", 2, 5, 14], ["CI", 1], ["FU", 7, [0, 1, 2, 3]], ["AN", 7, 0, 5], ["FU", 7, [1, 2, 3, 4]], ["AN", 7, 1, 4], ["FU", 7, [2, 3, 4, 5]], ["AN", 7, 2, 6], ["FU", 4, [0, 1, 2, 3]], ["SP", 4, 0, 4, [1], 1], ["AN", 4, 1, 2], ["FFSP", 4, 0, [3, 2, 1, 0], 1, 1], ["AN", 4, 1, 6], ["FU", 2, [0, 1, 2, 3]], ["SP", 2, 0, 32, [1], 1], ["AN", 2, 1, 2], ["FFSP", 2, 0, [3, 2, 1, 0], 1, 1], ["AN", 2, 1, 6], ["PR", 5, 0, "auto_unroll_max_step$0"]]]], "r": [[2.62194e-05, 2.62185e-05, 2.62185e-05, 2.62216e-05], 0, 3.24779, 1668696105], "v": "v0.6"}
{"i": [["[\"9a995a41bc2ff7cdadb96550380f7c85\", [7, 8, 32, 32], [8, 8, 3, 3], [1, 8, 1, 1], [7, 8, 32, 32]]", "cuda -keys=cuda,gpu -arch=sm_80 -max_num_threads=1024 -thread_warp_size=32", [-1, 16, 64, 49152, 2147483647, 1024, 8, 32], "", 0, []], [[], [["SP", 3, 0, 7, [1, 1, 1, 1], 1], ["SP", 3, 5, 8, [1, 1, 2, 2], 1], ["SP", 3, 10, 32, [8, 1, 2, 1], 1], ["SP", 3, 15, 32, [1, 16, 1, 2], 1], ["SP", 3, 20, 8, [2, 1], 1], ["SP", 3, 23, 3, [1, 1], 1], ["SP", 3, 26, 3, [1, 3], 1], ["RE", 3, [0, 5, 10, 15, 1, 6, 11, 16, 2, 7, 12, 17, 20, 23, 26, 21, 24, 27, 3, 8, 13, 18, 22, 25, 28, 4, 9, 14, 19]], ["FSP", 5, 0, 0, 3], ["FSP", 5, 4, 1, 3], ["FSP", 5, 8, 2, 3], ["FSP", 5, 12, 3, 3], ["RE", 5, [0, 4, 8, 12, 1, 5, 9, 13, 2, 6, 10, 14, 3, 7, 11, 15]], ["CA", 3, 5, 11], ["CHR", 2, "shared", [3]], ["CA", 3, 4, 14], ["CHR", 1, "shared", [4]], ["CA", 2, 5, 14], ["CI", 1], ["FU", 7, [0, 1, 2, 3]], ["AN", 7, 0, 5], ["FU", 7, [1, 2, 3, 4]], ["AN", 7, 1, 4], ["FU", 7, [2, 3, 4, 5]], ["AN", 7, 2, 6], ["FU", 4, [0, 1, 2, 3]], ["SP", 4, 0, 24, [1], 1], ["AN", 4, 1, 2], ["FFSP", 4, 0, [3, 2, 1, 0], 1, 1], ["AN", 4, 1, 6], ["FU", 2, [0, 1, 2, 3]], ["SP", 2, 0, 16, [1], 1], ["AN", 2, 1, 2], ["FFSP", 2, 0, [3, 2, 1, 0], 1, 1], ["AN", 2, 1, 6], ["PR", 5, 0, "auto_unroll_max_step$1024"]]]], "r": [[4.54858e-05, 4.5486e-05, 4.54859e-05, 4.54857e-05], 0, 4.41138, 1668696108], "v": "v0.6"}
{"i": [["[\"9a995a41bc2ff7cdadb96550380f7c85\", [7, 8, 32, 32], [8, 8, 3, 3], [1, 8, 1, 1], [7, 8, 32, 32]]", "cuda -keys=cuda,gpu -arch=sm_80 -max_num_threads=1024 -thread_warp_size=32", [-1, 16, 64, 49152, 2147483647, 1024, 8, 32], "", 0, []], [[], [["SP", 3, 0, 7, [1, 7, 1, 1], 1], ["SP", 3, 5, 8, [1, 1, 2, 2], 1], ["SP", 3, 10, 32, [1, 32, 1, 1], 1], ["SP", 3, 15, 32, [1, 4, 1, 2], 1], ["SP", 3, 20, 8, [1, 1], 1], ["SP", 3, 23, 3, [1, 1], 1], ["SP", 3, 26, 3, [1, 3], 1], ["RE", 3, [0, 5, 10, 15, 1, 6, 11, 16, 2, 7, 12, 17, 20, 23, 26, 21, 24, 27, 3, 8, 13, 18, 22, 25, 28, 4, 9, 14, 19]], ["FSP", 5, 0, 0, 3], ["FSP", 5, 4, 1, 3], ["FSP", 5, 8, 2, 3], ["FSP", 5, 12, 3, 3], ["RE", 5, [0, 4, 8, 12, 1, 5, 9, 13, 2, 6, 10, 14, 3, 7, 11, 15]], ["CA", 3, 5, 11], ["CHR", 2, "shared", [3]], ["CA", 3, 4, 14], ["CHR", 1, "shared", [4]], ["CA", 2, 5, 14], ["CI", 1], ["FU", 7, [0, 1, 2, 3]], ["AN", 7, 0, 5], ["FU", 7, [1, 2, 3, 4]], ["AN", 7, 1, 4], ["FU", 7, [2, 3, 4, 5]], ["AN", 7, 2, 6], ["FU", 4, [0, 1, 2, 3]], ["SP", 4, 0, 12, [1], 1], ["AN", 4, 1, 2], ["FFSP", 4, 0, [3, 2, 1, 0], 1, 1], ["AN", 4, 1, 6], ["FU", 2, [0, 1, 2, 3]], ["SP", 2, 0, 4, [4], 1], ["AN", 2, 1, 2], ["FFSP", 2, 0, [3, 2, 1, 0], 1, 1], ["AN", 2, 1, 6], ["PR", 5, 0, "auto_unroll_max_step$0"]]]], "r": [[3.65438e-05, 3.65421e-05, 3.65455e-05, 3.65438e-05], 0, 2.99362, 1668696111], "v": "v0.6"}
{"i": [["[\"9a995a41bc2ff7cdadb96550380f7c85\", [7, 8, 32, 32], [8, 8, 3, 3], [1, 8, 1, 1], [7, 8, 32, 32]]", "cuda -keys=cuda,gpu -arch=sm_80 -max_num_threads=1024 -thread_warp_size=32", [-1, 16, 64, 49152, 2147483647, 1024, 8, 32], "", 0, []], [[], [["SP", 3, 0, 7, [1, 1, 7, 1], 1], ["SP", 3, 5, 8, [2, 1, 2, 1], 1], ["SP", 3, 10, 32, [2, 16, 1, 1], 1], ["SP", 3, 15, 32, [2, 1, 1, 8], 1], ["SP", 3, 20, 8, [1, 2], 1], ["SP", 3, 23, 3, [1, 3], 1], ["SP", 3, 26, 3, [1, 1], 1], ["RE", 3, [0, 5, 10, 15, 1, 6, 11, 16, 2, 7, 12, 17, 20, 23, 26, 21, 24, 27, 3, 8, 13, 18, 22, 25, 28, 4, 9, 14, 19]], ["FSP", 5, 0, 0, 3], ["FSP", 5, 4, 1, 3], ["FSP", 5, 8, 2, 3], ["FSP", 5, 12, 3, 3], ["RE", 5, [0, 4, 8, 12, 1, 5, 9, 13, 2, 6, 10, 14, 3, 7, 11, 15]], ["CA", 3, 5, 11], ["CHR", 2, "shared", [3]], ["CA", 3, 4, 14], ["CHR", 1, "shared", [4]], ["CA", 2, 5, 14], ["CI", 1], ["FU", 7, [0, 1, 2, 3]], ["AN", 7, 0, 5], ["FU", 7, [1, 2, 3, 4]], ["AN", 7, 1, 4], ["FU", 7, [2, 3, 4, 5]], ["AN", 7, 2, 6], ["FU", 4, [0, 1, 2, 3]], ["SP", 4, 0, 12, [1], 1], ["AN", 4, 1, 2], ["FFSP", 4, 0, [3, 2, 1, 0], 1, 1], ["AN", 4, 1, 6], ["FU", 2, [0, 1, 2, 3]], ["SP", 2, 0, 48, [1], 1], ["AN", 2, 1, 2], ["FFSP", 2, 0, [3, 2, 1, 0], 1, 1], ["AN", 2, 1, 6], ["PR", 5, 0, "auto_unroll_max_step$64"]]]], "r": [[0.00055368, 0.000553693, 0.00055376, 0.000553731], 0, 3.78657, 1668696113], "v": "v0.6"}
{"i": [["[\"9a995a41bc2ff7cdadb96550380f7c85\", [7, 8, 32, 32], [8, 8, 3, 3], [1, 8, 1, 1], [7, 8, 32, 32]]", "cuda -keys=cuda,gpu -arch=sm_80 -max_num_threads=1024 -thread_warp_size=32", [-1, 16, 64, 49152, 2147483647, 1024, 8, 32], "", 0, []], [[], [["SP", 3, 0, 7, [1, 7, 1, 1], 1], ["SP", 3, 5, 8, [1, 1, 4, 1], 1], ["SP", 3, 10, 32, [2, 8, 1, 1], 1], ["SP", 3, 15, 32, [1, 1, 4, 1], 1], ["SP", 3, 20, 8, [1, 1], 1], ["SP", 3, 23, 3, [3, 1], 1], ["SP", 3, 26, 3, [1, 3], 1], ["RE", 3, [0, 5, 10, 15, 1, 6, 11, 16, 2, 7, 12, 17, 20, 23, 26, 21, 24, 27, 3, 8, 13, 18, 22, 25, 28, 4, 9, 14, 19]], ["FSP", 5, 0, 0, 3], ["FSP", 5, 4, 1, 3], ["FSP", 5, 8, 2, 3], ["FSP", 5, 12, 3, 3], ["RE", 5, [0, 4, 8, 12, 1, 5, 9, 13, 2, 6, 10, 14, 3, 7, 11, 15]], ["CA", 3, 5, 11], ["CHR", 2, "shared", [3]], ["CA", 3, 4, 14], ["CHR", 1, "shared", [4]], ["CA", 2, 5, 14], ["CI", 1], ["FU", 7, [0, 1, 2, 3]], ["AN", 7, 0, 5], ["FU", 7, [1, 2, 3, 4]], ["AN", 7, 1, 4], ["FU", 7, [2, 3, 4, 5]], ["AN", 7, 2, 6], ["FU", 4, [0, 1, 2, 3]], ["SP", 4, 0, 36, [1], 1], ["AN", 4, 1, 2], ["FFSP", 4, 0, [3, 2, 1, 0], 1, 1], ["AN", 4, 1, 6], ["FU", 2, [0, 1, 2, 3]], ["SP", 2, 0, 18, [1], 1], ["AN", 2, 1, 2], ["FFSP", 2, 0, [3, 2, 1, 0], 1, 1], ["AN", 2, 1, 6], ["PR", 5, 0, "auto_unroll_max_step$16"]]]], "r": [[1.62599e-05, 1.62723e-05, 1.62769e-05, 1.62761e-05], 0, 3.01206, 1668696116], "v": "v0.6"}
{"i": [["[\"9a995a41bc2ff7cdadb96550380f7c85\", [7, 8, 32, 32], [8, 8, 3, 3], [1, 8, 1, 1], [7, 8, 32, 32]]", "cuda -keys=cuda,gpu -arch=sm_80 -max_num_threads=1024 -thread_warp_size=32", [-1, 16, 64, 49152, 2147483647, 1024, 8, 32], "", 0, []], [[], [["SP", 3, 0, 7, [1, 1, 7, 1], 1], ["SP", 3, 5, 8, [1, 2, 4, 1], 1], ["SP", 3, 10, 32, [1, 4, 1, 4], 1], ["SP", 3, 15, 32, [1, 4, 4, 1], 1], ["SP", 3, 20, 8, [4, 1], 1], ["SP", 3, 23, 3, [3, 1], 1], ["SP", 3, 26, 3, [1, 1], 1], ["RE", 3, [0, 5, 10, 15, 1, 6, 11, 16, 2, 7, 12, 17, 20, 23, 26, 21, 24, 27, 3, 8, 13, 18, 22, 25, 28, 4, 9, 14, 19]], ["FSP", 5, 0, 0, 3], ["FSP", 5, 4, 1, 3], ["FSP", 5, 8, 2, 3], ["FSP", 5, 12, 3, 3], ["RE", 5, [0, 4, 8, 12, 1, 5, 9, 13, 2, 6, 10, 14, 3, 7, 11, 15]], ["CA", 3, 5, 11], ["CHR", 2, "shared", [3]], ["CA", 3, 4, 14], ["CHR", 1, "shared", [4]], ["CA", 2, 5, 14], ["CI", 1], ["FU", 7, [0, 1, 2, 3]], ["AN", 7, 0, 5], ["FU", 7, [1, 2, 3, 4]], ["AN", 7, 1, 4], ["FU", 7, [2, 3, 4, 5]], ["AN", 7, 2, 6], ["FU", 4, [0, 1, 2, 3]], ["SP", 4, 0, 48, [1], 1], ["AN", 4, 1, 2], ["FFSP", 4, 0, [3, 2, 1, 0], 1, 1], ["AN", 4, 1, 6], ["FU", 2, [0, 1, 2, 3]], ["SP", 2, 0, 336, [1], 1], ["AN", 2, 1, 2], ["FFSP", 2, 0, [3, 2, 1, 0], 1, 1], ["AN", 2, 1, 6], ["PR", 5, 0, "auto_unroll_max_step$1024"]]]], "r": [[0.000194625, 0.00019464, 0.000194623, 0.000194636], 0, 6.96843, 1668696119], "v": "v0.6"}
{"i": [["[\"9a995a41bc2ff7cdadb96550380f7c85\", [7, 8, 32, 32], [8, 8, 3, 3], [1, 8, 1, 1], [7, 8, 32, 32]]", "cuda -keys=cuda,gpu -arch=sm_80 -max_num_threads=1024 -thread_warp_size=32", [-1, 16, 64, 49152, 2147483647, 1024, 8, 32], "", 0, []], [[], [["SP", 3, 0, 7, [1, 1, 1, 1], 1], ["SP", 3, 5, 8, [1, 2, 1, 4], 1], ["SP", 3, 10, 32, [1, 16, 1, 2], 1], ["SP", 3, 15, 32, [1, 1, 8, 1], 1], ["SP", 3, 20, 8, [8, 1], 1], ["SP", 3, 23, 3, [3, 1], 1], ["SP", 3, 26, 3, [1, 1], 1], ["RE", 3, [0, 5, 10, 15, 1, 6, 11, 16, 2, 7, 12, 17, 20, 23, 26, 21, 24, 27, 3, 8, 13, 18, 22, 25, 28, 4, 9, 14, 19]], ["FSP", 5, 0, 0, 3], ["FSP", 5, 4, 1, 3], ["FSP", 5, 8, 2, 3], ["FSP", 5, 12, 3, 3], ["RE", 5, [0, 4, 8, 12, 1, 5, 9, 13, 2, 6, 10, 14, 3, 7, 11, 15]], ["CA", 3, 5, 11], ["CHR", 2, "shared", [3]], ["CA", 3, 4, 14], ["CHR", 1, "shared", [4]], ["CA", 2, 5, 14], ["CI", 1], ["FU", 7, [0, 1, 2, 3]], ["AN", 7, 0, 5], ["FU", 7, [1, 2, 3, 4]], ["AN", 7, 1, 4], ["FU", 7, [2, 3, 4, 5]], ["AN", 7, 2, 6], ["FU", 4, [0, 1, 2, 3]], ["SP", 4, 0, 192, [1], 1], ["AN", 4, 1, 2], ["FFSP", 4, 0, [3, 2, 1, 0], 1, 1], ["AN", 4, 1, 6], ["FU", 2, [0, 1, 2, 3]], ["SP", 2, 0, 96, [1], 1], ["AN", 2, 1, 2], ["FFSP", 2, 0, [3, 2, 1, 0], 1, 1], ["AN", 2, 1, 6], ["PR", 5, 0, "auto_unroll_max_step$512"]]]], "r": [[1.84789e-05, 1.84371e-05, 1.84404e-05, 1.84412e-05], 0, 3.47908, 1668696121], "v": "v0.6"}
{"i": [["[\"9a995a41bc2ff7cdadb96550380f7c85\", [7, 8, 32, 32], [8, 8, 3, 3], [1, 8, 1, 1], [7, 8, 32, 32]]", "cuda -keys=cuda,gpu -arch=sm_80 -max_num_threads=1024 -thread_warp_size=32", [-1, 16, 64, 49152, 2147483647, 1024, 8, 32], "", 0, []], [[], [["SP", 3, 0, 7, [1, 1, 7, 1], 1], ["SP", 3, 5, 8, [2, 2, 1, 2], 1], ["SP", 3, 10, 32, [4, 1, 1, 1], 1], ["SP", 3, 15, 32, [1, 1, 4, 1], 1], ["SP", 3, 20, 8, [2, 4], 1], ["SP", 3, 23, 3, [1, 3], 1], ["SP", 3, 26, 3, [1, 3], 1], ["RE", 3, [0, 5, 10, 15, 1, 6, 11, 16, 2, 7, 12, 17, 20, 23, 26, 21, 24, 27, 3, 8, 13, 18, 22, 25, 28, 4, 9, 14, 19]], ["FSP", 5, 0, 0, 3], ["FSP", 5, 4, 1, 3], ["FSP", 5, 8, 2, 3], ["FSP", 5, 12, 3, 3], ["RE", 5, [0, 4, 8, 12, 1, 5, 9, 13, 2, 6, 10, 14, 3, 7, 11, 15]], ["CA", 3, 5, 11], ["CHR", 2, "shared", [3]], ["CA", 3, 4, 14], ["CHR", 1, "shared", [4]], ["CA", 2, 5, 14], ["CI", 1], ["FU", 7, [0, 1, 2, 3]], ["AN", 7, 0, 5], ["FU", 7, [1, 2, 3, 4]], ["AN", 7, 1, 4], ["FU", 7, [2, 3, 4, 5]], ["AN", 7, 2, 6], ["FU", 4, [0, 1, 2, 3]], ["SP", 4, 0, 144, [1], 1], ["AN", 4, 1, 2], ["FFSP", 4, 0, [3, 2, 1, 0], 1, 1], ["AN", 4, 1, 6], ["FU", 2, [0, 1, 2, 3]], ["SP", 2, 0, 504, [1], 1], ["AN", 2, 1, 2], ["FFSP", 2, 0, [3, 2, 1, 0], 1, 1], ["AN", 2, 1, 6], ["PR", 5, 0, "auto_unroll_max_step$16"]]]], "r": [[0.000280165, 0.000280159, 0.000280153, 0.000280555], 0, 3.47155, 1668696124], "v": "v0.6"}
{"i": [["[\"9a995a41bc2ff7cdadb96550380f7c85\", [7, 8, 32, 32], [8, 8, 3, 3], [1, 8, 1, 1], [7, 8, 32, 32]]", "cuda -keys=cuda,gpu -arch=sm_80 -max_num_threads=1024 -thread_warp_size=32", [-1, 16, 64, 49152, 2147483647, 1024, 8, 32], "", 0, []], [[], [["SP", 3, 0, 7, [1, 1, 7, 1], 1], ["SP", 3, 5, 8, [1, 1, 1, 2], 1], ["SP", 3, 10, 32, [1, 2, 1, 4], 1], ["SP", 3, 15, 32, [1, 16, 1, 2], 1], ["SP", 3, 20, 8, [1, 4], 1], ["SP", 3, 23, 3, [1, 3], 1], ["SP", 3, 26, 3, [3, 1], 1], ["RE", 3, [0, 5, 10, 15, 1, 6, 11, 16, 2, 7, 12, 17, 20, 23, 26, 21, 24, 27, 3, 8, 13, 18, 22, 25, 28, 4, 9, 14, 19]], ["FSP", 5, 0, 0, 3], ["FSP", 5, 4, 1, 3], ["FSP", 5, 8, 2, 3], ["FSP", 5, 12, 3, 3], ["RE", 5, [0, 4, 8, 12, 1, 5, 9, 13, 2, 6, 10, 14, 3, 7, 11, 15]], ["CA", 3, 5, 11], ["CHR", 2, "shared", [3]], ["CA", 3, 4, 14], ["CHR", 1, "shared", [4]], ["CA", 2, 5, 14], ["CI", 1], ["FU", 7, [0, 1, 2, 3]], ["AN", 7, 0, 5], ["FU", 7, [1, 2, 3, 4]], ["AN", 7, 1, 4], ["FU", 7, [2, 3, 4, 5]], ["AN", 7, 2, 6], ["FU", 4, [0, 1, 2, 3]], ["SP", 4, 0, 72, [1], 1], ["AN", 4, 1, 2], ["FFSP", 4, 0, [3, 2, 1, 0], 1, 1], ["AN", 4, 1, 6], ["FU", 2, [0, 1, 2, 3]], ["SP", 2, 0, 96, [1], 1], ["AN", 2, 1, 2], ["FFSP", 2, 0, [3, 2, 1, 0], 1, 1], ["AN", 2, 1, 6], ["PR", 5, 0, "auto_unroll_max_step$64"]]]], "r": [[0.000214169, 0.000214166, 0.00021417, 0.000214168], 0, 3.3937, 1668696127], "v": "v0.6"}
{"i": [["[\"9a995a41bc2ff7cdadb96550380f7c85\", [7, 8, 32, 32], [8, 8, 3, 3], [1, 8, 1, 1], [7, 8, 32, 32]]", "cuda -keys=cuda,gpu -arch=sm_80 -max_num_threads=1024 -thread_warp_size=32", [-1, 16, 64, 49152, 2147483647, 1024, 8, 32], "", 0, []], [[], [["SP", 3, 0, 7, [1, 7, 1, 1], 1], ["SP", 3, 5, 8, [1, 1, 2, 2], 1], ["SP", 3, 10, 32, [1, 32, 1, 1], 1], ["SP", 3, 15, 32, [1, 1, 2, 16], 1], ["SP", 3, 20, 8, [1, 1], 1], ["SP", 3, 23, 3, [1, 3], 1], ["SP", 3, 26, 3, [1, 3], 1], ["RE", 3, [0, 5, 10, 15, 1, 6, 11, 16, 2, 7, 12, 17, 20, 23, 26, 21, 24, 27, 3, 8, 13, 18, 22, 25, 28, 4, 9, 14, 19]], ["FSP", 5, 0, 0, 3], ["FSP", 5, 4, 1, 3], ["FSP", 5, 8, 2, 3], ["FSP", 5, 12, 3, 3], ["RE", 5, [0, 4, 8, 12, 1, 5, 9, 13, 2, 6, 10, 14, 3, 7, 11, 15]], ["CA", 3, 5, 11], ["CHR", 2, "shared", [3]], ["CA", 3, 4, 14], ["CHR", 1, "shared", [4]], ["CA", 2, 5, 14], ["CI", 1], ["FU", 7, [0, 1, 2, 3]], ["AN", 7, 0, 5], ["FU", 7, [1, 2, 3, 4]], ["AN", 7, 1, 4], ["FU", 7, [2, 3, 4, 5]], ["AN", 7, 2, 6], ["FU", 4, [0, 1, 2, 3]], ["SP", 4, 0, 12, [1], 1], ["AN", 4, 1, 2], ["FFSP", 4, 0, [3, 2, 1, 0], 1, 1], ["AN", 4, 1, 6], ["FU", 2, [0, 1, 2, 3]], ["SP", 2, 0, 34, [1], 1], ["AN", 2, 1, 2], ["FFSP", 2, 0, [3, 2, 1, 0], 1, 1], ["AN", 2, 1, 6], ["PR", 5, 0, "auto_unroll_max_step$64"]]]], "r": [[7.97606e-05, 7.97606e-05, 7.97609e-05, 7.97612e-05], 0, 3.62709, 1668696129], "v": "v0.6"}
{"i": [["[\"9a995a41bc2ff7cdadb96550380f7c85\", [7, 8, 32, 32], [8, 8, 3, 3], [1, 8, 1, 1], [7, 8, 32, 32]]", "cuda -keys=cuda,gpu -arch=sm_80 -max_num_threads=1024 -thread_warp_size=32", [-1, 16, 64, 49152, 2147483647, 1024, 8, 32], "", 0, []], [[], [["SP", 3, 0, 7, [1, 7, 1, 1], 1], ["SP", 3, 5, 8, [1, 1, 1, 1], 1], ["SP", 3, 10, 32, [4, 1, 8, 1], 1], ["SP", 3, 15, 32, [2, 8, 1, 1], 1], ["SP", 3, 20, 8, [1, 2], 1], ["SP", 3, 23, 3, [3, 1], 1], ["SP", 3, 26, 3, [3, 1], 1], ["RE", 3, [0, 5, 10, 15, 1, 6, 11, 16, 2, 7, 12, 17, 20, 23, 26, 21, 24, 27, 3, 8, 13, 18, 22, 25, 28, 4, 9, 14, 19]], ["FSP", 5, 0, 0, 3], ["FSP", 5, 4, 1, 3], ["FSP", 5, 8, 2, 3], ["FSP", 5, 12, 3, 3], ["RE", 5, [0, 4, 8, 12, 1, 5, 9, 13, 2, 6, 10, 14, 3, 7, 11, 15]], ["CA", 3, 5, 11], ["CHR", 2, "shared", [3]], ["CA", 3, 4, 14], ["CHR", 1, "shared", [4]], ["CA", 2, 5, 14], ["CI", 1], ["FU", 7, [0, 1, 2, 3]], ["AN", 7, 0, 5], ["FU", 7, [1, 2, 3, 4]], ["AN", 7, 1, 4], ["FU", 7, [2, 3, 4, 5]], ["AN", 7, 2, 6], ["FU", 4, [0, 1, 2, 3]], ["SP", 4, 0, 18, [1], 1], ["AN", 4, 1, 2], ["FFSP", 4, 0, [3, 2, 1, 0], 1, 1], ["AN", 4, 1, 6], ["FU", 2, [0, 1, 2, 3]], ["SP", 2, 0, 60, [1], 1], ["AN", 2, 1, 2], ["FFSP", 2, 0, [3, 2, 1, 0], 1, 1], ["AN", 2, 1, 6], ["PR", 5, 0, "auto_unroll_max_step$0"]]]], "r": [[0.000217323, 0.000217321, 0.000217321, 0.000217326], 0, 3.26018, 1668696132], "v": "v0.6"}
{"i": [["[\"9a995a41bc2ff7cdadb96550380f7c85\", [7, 8, 32, 32], [8, 8, 3, 3], [1, 8, 1, 1], [7, 8, 32, 32]]", "cuda -keys=cuda,gpu -arch=sm_80 -max_num_threads=1024 -thread_warp_size=32", [-1, 16, 64, 49152, 2147483647, 1024, 8, 32], "", 0, []], [[], [["SP", 3, 0, 7, [1, 1, 1, 1], 1], ["SP", 3, 5, 8, [1, 4, 1, 2], 1], ["SP", 3, 10, 32, [2, 8, 1, 2], 1], ["SP", 3, 15, 32, [1, 4, 1, 2], 1], ["SP", 3, 20, 8, [2, 1], 1], ["SP", 3, 23, 3, [3, 1], 1], ["SP", 3, 26, 3, [3, 1], 1], ["RE", 3, [0, 5, 10, 15, 1, 6, 11, 16, 2, 7, 12, 17, 20, 23, 26, 21, 24, 27, 3, 8, 13, 18, 22, 25, 28, 4, 9, 14, 19]], ["FSP", 5, 0, 0, 3], ["FSP", 5, 4, 1, 3], ["FSP", 5, 8, 2, 3], ["FSP", 5, 12, 3, 3], ["RE", 5, [0, 4, 8, 12, 1, 5, 9, 13, 2, 6, 10, 14, 3, 7, 11, 15]], ["CA", 3, 5, 11], ["CHR", 2, "shared", [3]], ["CA", 3, 4, 14], ["CHR", 1, "shared", [4]], ["CA", 2, 5, 14], ["CI", 1], ["FU", 7, [0, 1, 2, 3]], ["AN", 7, 0, 5], ["FU", 7, [1, 2, 3, 4]], ["AN", 7, 1, 4], ["FU", 7, [2, 3, 4, 5]], ["AN", 7, 2, 6], ["FU", 4, [0, 1, 2, 3]], ["SP", 4, 0, 36, [1], 1], ["AN", 4, 1, 2], ["FFSP", 4, 0, [3, 2, 1, 0], 1, 1], ["AN", 4, 1, 6], ["FU", 2, [0, 1, 2, 3]], ["SP", 2, 0, 224, [28], 1], ["AN", 2, 1, 2], ["FFSP", 2, 0, [3, 2, 1, 0], 1, 1], ["AN", 2, 1, 6], ["PR", 5, 0, "auto_unroll_max_step$1024"]]]], "r": [[1.45489e-05, 1.45448e-05, 1.45431e-05, 1.45383e-05], 0, 3.34146, 1668696134], "v": "v0.6"}
{"i": [["[\"9a995a41bc2ff7cdadb96550380f7c85\", [7, 8, 32, 32], [8, 8, 3, 3], [1, 8, 1, 1], [7, 8, 32, 32]]", "cuda -keys=cuda,gpu -arch=sm_80 -max_num_threads=1024 -thread_warp_size=32", [-1, 16, 64, 49152, 2147483647, 1024, 8, 32], "", 0, []], [[], [["SP", 3, 0, 7, [1, 7, 1, 1], 1], ["SP", 3, 5, 8, [2, 1, 1, 4], 1], ["SP", 3, 10, 32, [2, 2, 2, 1], 1], ["SP", 3, 15, 32, [2, 4, 1, 1], 1], ["SP", 3, 20, 8, [1, 4], 1], ["SP", 3, 23, 3, [3, 1], 1], ["SP", 3, 26, 3, [3, 1], 1], ["RE", 3, [0, 5, 10, 15, 1, 6, 11, 16, 2, 7, 12, 17, 20, 23, 26, 21, 24, 27, 3, 8, 13, 18, 22, 25, 28, 4, 9, 14, 19]], ["FSP", 5, 0, 0, 3], ["FSP", 5, 4, 1, 3], ["FSP", 5, 8, 2, 3], ["FSP", 5, 12, 3, 3], ["RE", 5, [0, 4, 8, 12, 1, 5, 9, 13, 2, 6, 10, 14, 3, 7, 11, 15]], ["CA", 3, 5, 11], ["CHR", 2, "shared", [3]], ["CA", 3, 4, 14], ["CHR", 1, "shared", [4]], ["CA", 2, 5, 14], ["CI", 1], ["FU", 7, [0, 1, 2, 3]], ["AN", 7, 0, 5], ["FU", 7, [1, 2, 3, 4]], ["AN", 7, 1, 4], ["FU", 7, [2, 3, 4, 5]], ["AN", 7, 2, 6], ["FU", 4, [0, 1, 2, 3]], ["SP", 4, 0, 144, [6], 1], ["AN", 4, 1, 2], ["FFSP", 4, 0, [3, 2, 1, 0], 1, 1], ["AN", 4, 1, 6], ["FU", 2, [0, 1, 2, 3]], ["SP", 2, 0, 48, [1], 1], ["AN", 2, 1, 2], ["FFSP", 2, 0, [3, 2, 1, 0], 1, 1], ["AN", 2, 1, 6], ["PR", 5, 0, "auto_unroll_max_step$1024"]]]], "r": [[1.43717e-05, 1.43704e-05, 1.43701e-05, 1.43689e-05], 0, 5.65863, 1668696137], "v": "v0.6"}
{"i": [["[\"9a995a41bc2ff7cdadb96550380f7c85\", [7, 8, 32, 32], [8, 8, 3, 3], [1, 8, 1, 1], [7, 8, 32, 32]]", "cuda -keys=cuda,gpu -arch=sm_80 -max_num_threads=1024 -thread_warp_size=32", [-1, 16, 64, 49152, 2147483647, 1024, 8, 32], "", 0, []], [[], [["SP", 3, 0, 7, [1, 7, 1, 1], 1], ["SP", 3, 5, 8, [2, 2, 2, 1], 1], ["SP", 3, 10, 32, [2, 2, 1, 1], 1], ["SP", 3, 15, 32, [1, 2, 1, 16], 1], ["SP", 3, 20, 8, [2, 4], 1], ["SP", 3, 23, 3, [1, 3], 1], ["SP", 3, 26, 3, [3, 1], 1], ["RE", 3, [0, 5, 10, 15, 1, 6, 11, 16, 2, 7, 12, 17, 20, 23, 26, 21, 24, 27, 3, 8, 13, 18, 22, 25, 28, 4, 9, 14, 19]], ["FSP", 5, 0, 0, 3], ["FSP", 5, 4, 1, 3], ["FSP", 5, 8, 2, 3], ["FSP", 5, 12, 3, 3], ["RE", 5, [0, 4, 8, 12, 1, 5, 9, 13, 2, 6, 10, 14, 3, 7, 11, 15]], ["CA", 3, 5, 11], ["CHR", 2, "shared", [3]], ["CA", 3, 4, 14], ["CHR", 1, "shared", [4]], ["CA", 2, 5, 14], ["CI", 1], ["FU", 7, [0, 1, 2, 3]], ["AN", 7, 0, 5], ["FU", 7, [1, 2, 3, 4]], ["AN", 7, 1, 4], ["FU", 7, [2, 3, 4, 5]], ["AN", 7, 2, 6], ["FU", 4, [0, 1, 2, 3]], ["SP", 4, 0, 144, [1], 1], ["AN", 4, 1, 2], ["FFSP", 4, 0, [3, 2, 1, 0], 1, 1], ["AN", 4, 1, 6], ["FU", 2, [0, 1, 2, 3]], ["SP", 2, 0, 432, [8], 1], ["AN", 2, 1, 2], ["FFSP", 2, 0, [3, 2, 1, 0], 1, 1], ["AN", 2, 1, 6], ["PR", 5, 0, "auto_unroll_max_step$1024"]]]], "r": [[0.000103102, 0.000103106, 0.000103112, 0.000103112], 0, 10.3661, 1668696140], "v": "v0.6"}
{"i": [["[\"9a995a41bc2ff7cdadb96550380f7c85\", [7, 8, 32, 32], [8, 8, 3, 3], [1, 8, 1, 1], [7, 8, 32, 32]]", "cuda -keys=cuda,gpu -arch=sm_80 -max_num_threads=1024 -thread_warp_size=32", [-1, 16, 64, 49152, 2147483647, 1024, 8, 32], "", 0, []], [[], [["SP", 3, 0, 7, [1, 1, 1, 7], 1], ["SP", 3, 5, 8, [1, 4, 2, 1], 1], ["SP", 3, 10, 32, [1, 1, 4, 1], 1], ["SP", 3, 15, 32, [2, 2, 4, 2], 1], ["SP", 3, 20, 8, [1, 1], 1], ["SP", 3, 23, 3, [1, 1], 1], ["SP", 3, 26, 3, [1, 3], 1], ["RE", 3, [0, 5, 10, 15, 1, 6, 11, 16, 2, 7, 12, 17, 20, 23, 26, 21, 24, 27, 3, 8, 13, 18, 22, 25, 28, 4, 9, 14, 19]], ["FSP", 5, 0, 0, 3], ["FSP", 5, 4, 1, 3], ["FSP", 5, 8, 2, 3], ["FSP", 5, 12, 3, 3], ["RE", 5, [0, 4, 8, 12, 1, 5, 9, 13, 2, 6, 10, 14, 3, 7, 11, 15]], ["CA", 3, 5, 11], ["CHR", 2, "shared", [3]], ["CA", 3, 4, 14], ["CHR", 1, "shared", [4]], ["CA", 2, 5, 14], ["CI", 1], ["FU", 7, [0, 1, 2, 3]], ["AN", 7, 0, 5], ["FU", 7, [1, 2, 3, 4]], ["AN", 7, 1, 4], ["FU", 7, [2, 3, 4, 5]], ["AN", 7, 2, 6], ["FU", 4, [0, 1, 2, 3]], ["SP", 4, 0, 6, [1], 1], ["AN", 4, 1, 2], ["FFSP", 4, 0, [3, 2, 1, 0], 1, 1], ["AN", 4, 1, 6], ["FU", 2, [0, 1, 2, 3]], ["SP", 2, 0, 280, [1], 1], ["AN", 2, 1, 2], ["FFSP", 2, 0, [3, 2, 1, 0], 1, 1], ["AN", 2, 1, 6], ["PR", 5, 0, "auto_unroll_max_step$512"]]]], "r": [[0.000214274, 0.000214275, 0.000214295, 0.000214287], 0, 6.19443, 1668696142], "v": "v0.6"}
{"i": [["[\"9a995a41bc2ff7cdadb96550380f7c85\", [7, 8, 32, 32], [8, 8, 3, 3], [1, 8, 1, 1], [7, 8, 32, 32]]", "cuda -keys=cuda,gpu -arch=sm_80 -max_num_threads=1024 -thread_warp_size=32", [-1, 16, 64, 49152, 2147483647, 1024, 8, 32], "", 0, []], [[], [["SP", 3, 0, 7, [1, 1, 1, 1], 1], ["SP", 3, 5, 8, [2, 1, 1, 1], 1], ["SP", 3, 10, 32, [1, 4, 2, 2], 1], ["SP", 3, 15, 32, [2, 4, 1, 1], 1], ["SP", 3, 20, 8, [2, 4], 1], ["SP", 3, 23, 3, [3, 1], 1], ["SP", 3, 26, 3, [3, 1], 1], ["RE", 3, [0, 5, 10, 15, 1, 6, 11, 16, 2, 7, 12, 17, 20, 23, 26, 21, 24, 27, 3, 8, 13, 18, 22, 25, 28, 4, 9, 14, 19]], ["FSP", 5, 0, 0, 3], ["FSP", 5, 4, 1, 3], ["FSP", 5, 8, 2, 3], ["FSP", 5, 12, 3, 3], ["RE", 5, [0, 4, 8, 12, 1, 5, 9, 13, 2, 6, 10, 14, 3, 7, 11, 15]], ["CA", 3, 5, 11], ["CHR", 2, "shared", [3]], ["CA", 3, 4, 14], ["CHR", 1, "shared", [4]], ["CA", 2, 5, 14], ["CI", 1], ["FU", 7, [0, 1, 2, 3]], ["AN", 7, 0, 5], ["FU", 7, [1, 2, 3, 4]], ["AN", 7, 1, 4], ["FU", 7, [2, 3, 4, 5]], ["AN", 7, 2, 6], ["FU", 4, [0, 1, 2, 3]], ["SP", 4, 0, 72, [1], 1], ["AN", 4, 1, 2], ["FFSP", 4, 0, [3, 2, 1, 0], 1, 1], ["AN", 4, 1, 6], ["FU", 2, [0, 1, 2, 3]], ["SP", 2, 0, 144, [1], 1], ["AN", 2, 1, 2], ["FFSP", 2, 0, [3, 2, 1, 0], 1, 1], ["AN", 2, 1, 6], ["PR", 5, 0, "auto_unroll_max_step$1024"]]]], "r": [[8.72753e-06, 8.7205e-06, 8.70944e-06, 8.72085e-06], 0, 4.7792, 1668696145], "v": "v0.6"}
{"i": [["[\"9a995a41bc2ff7cdadb96550380f7c85\", [7, 8, 32, 32], [8, 8, 3, 3], [1, 8, 1, 1], [7, 8, 32, 32]]", "cuda -keys=cuda,gpu -arch=sm_80 -max_num_threads=1024 -thread_warp_size=32", [-1, 16, 64, 49152, 2147483647, 1024, 8, 32], "", 0, []], [[], [["SP", 3, 0, 7, [1, 7, 1, 1], 1], ["SP", 3, 5, 8, [1, 1, 8, 1], 1], ["SP", 3, 10, 32, [4, 1, 8, 1], 1], ["SP", 3, 15, 32, [1, 8, 2, 1], 1], ["SP", 3, 20, 8, [1, 1], 1], ["SP", 3, 23, 3, [1, 3], 1], ["SP", 3, 26, 3, [1, 1], 1], ["RE", 3, [0, 5, 10, 15, 1, 6, 11, 16, 2, 7, 12, 17, 20, 23, 26, 21, 24, 27, 3, 8, 13, 18, 22, 25, 28, 4, 9, 14, 19]], ["FSP", 5, 0, 0, 3], ["FSP", 5, 4, 1, 3], ["FSP", 5, 8, 2, 3], ["FSP", 5, 12, 3, 3], ["RE", 5, [0, 4, 8, 12, 1, 5, 9, 13, 2, 6, 10, 14, 3, 7, 11, 15]], ["CA", 3, 5, 11], ["CHR", 2, "shared", [3]], ["CA", 3, 4, 14], ["CHR", 1, "shared", [4]], ["CA", 2, 5, 14], ["CI", 1], ["FU", 7, [0, 1, 2, 3]], ["AN", 7, 0, 5], ["FU", 7, [1, 2, 3, 4]], ["AN", 7, 1, 4], ["FU", 7, [2, 3, 4, 5]], ["AN", 7, 2, 6], ["FU", 4, [0, 1, 2, 3]], ["SP", 4, 0, 6, [1], 1], ["AN", 4, 1, 2], ["FFSP", 4, 0, [3, 2, 1, 0], 1, 1], ["AN", 4, 1, 6], ["FU", 2, [0, 1, 2, 3]], ["SP", 2, 0, 80, [1], 1], ["AN", 2, 1, 2], ["FFSP", 2, 0, [3, 2, 1, 0], 1, 1], ["AN", 2, 1, 6], ["PR", 5, 0, "auto_unroll_max_step$1024"]]]], "r": [[0.000152503, 0.000152499, 0.000152666, 0.000152504], 0, 4.21021, 1668696147], "v": "v0.6"}
{"i": [["[\"9a995a41bc2ff7cdadb96550380f7c85\", [7, 8, 32, 32], [8, 8, 3, 3], [1, 8, 1, 1], [7, 8, 32, 32]]", "cuda -keys=cuda,gpu -arch=sm_80 -max_num_threads=1024 -thread_warp_size=32", [-1, 16, 64, 49152, 2147483647, 1024, 8, 32], "", 0, []], [[], [["SP", 3, 0, 7, [1, 1, 1, 1], 1], ["SP", 3, 5, 8, [2, 2, 1, 1], 1], ["SP", 3, 10, 32, [2, 1, 2, 4], 1], ["SP", 3, 15, 32, [1, 1, 32, 1], 1], ["SP", 3, 20, 8, [1, 1], 1], ["SP", 3, 23, 3, [3, 1], 1], ["SP", 3, 26, 3, [1, 3], 1], ["RE", 3, [0, 5, 10, 15, 1, 6, 11, 16, 2, 7, 12, 17, 20, 23, 26, 21, 24, 27, 3, 8, 13, 18, 22, 25, 28, 4, 9, 14, 19]], ["FSP", 5, 0, 0, 3], ["FSP", 5, 4, 1, 3], ["FSP", 5, 8, 2, 3], ["FSP", 5, 12, 3, 3], ["RE", 5, [0, 4, 8, 12, 1, 5, 9, 13, 2, 6, 10, 14, 3, 7, 11, 15]], ["CA", 3, 5, 11], ["CHR", 2, "shared", [3]], ["CA", 3, 4, 14], ["CHR", 1, "shared", [4]], ["CA", 2, 5, 14], ["CI", 1], ["FU", 7, [0, 1, 2, 3]], ["AN", 7, 0, 5], ["FU", 7, [1, 2, 3, 4]], ["AN", 7, 1, 4], ["FU", 7, [2, 3, 4, 5]], ["AN", 7, 2, 6], ["FU", 4, [0, 1, 2, 3]], ["SP", 4, 0, 9, [1], 1], ["AN", 4, 1, 2], ["FFSP", 4, 0, [3, 2, 1, 0], 1, 1], ["AN", 4, 1, 6], ["FU", 2, [0, 1, 2, 3]], ["SP", 2, 0, 30, [1], 1], ["AN", 2, 1, 2], ["FFSP", 2, 0, [3, 2, 1, 0], 1, 1], ["AN", 2, 1, 6], ["PR", 5, 0, "auto_unroll_max_step$0"]]]], "r": [[0.000941599, 0.000941595, 0.000941601, 0.000941602], 0, 3.92816, 1668696150], "v": "v0.6"}
{"i": [["[\"9a995a41bc2ff7cdadb96550380f7c85\", [7, 8, 32, 32], [8, 8, 3, 3], [1, 8, 1, 1], [7, 8, 32, 32]]", "cuda -keys=cuda,gpu -arch=sm_80 -max_num_threads=1024 -thread_warp_size=32", [-1, 16, 64, 49152, 2147483647, 1024, 8, 32], "", 0, []], [[], [["SP", 3, 0, 7, [1, 7, 1, 1], 1], ["SP", 3, 5, 8, [1, 1, 2, 4], 1], ["SP", 3, 10, 32, [8, 2, 2, 1], 1], ["SP", 3, 15, 32, [1, 4, 4, 1], 1], ["SP", 3, 20, 8, [1, 2], 1], ["SP", 3, 23, 3, [1, 1], 1], ["SP", 3, 26, 3, [1, 3], 1], ["RE", 3, [0, 5, 10, 15, 1, 6, 11, 16, 2, 7, 12, 17, 20, 23, 26, 21, 24, 27, 3, 8, 13, 18, 22, 25, 28, 4, 9, 14, 19]], ["FSP", 5, 0, 0, 3], ["FSP", 5, 4, 1, 3], ["FSP", 5, 8, 2, 3], ["FSP", 5, 12, 3, 3], ["RE", 5, [0, 4, 8, 12, 1, 5, 9, 13, 2, 6, 10, 14, 3, 7, 11, 15]], ["CA", 3, 5, 11], ["CHR", 2, "shared", [3]], ["CA", 3, 4, 14], ["CHR", 1, "shared", [4]], ["CA", 2, 5, 14], ["CI", 1], ["FU", 7, [0, 1, 2, 3]], ["AN", 7, 0, 5], ["FU", 7, [1, 2, 3, 4]], ["AN", 7, 1, 4], ["FU", 7, [2, 3, 4, 5]], ["AN", 7, 2, 6], ["FU", 4, [0, 1, 2, 3]], ["SP", 4, 0, 48, [1], 1], ["AN", 4, 1, 2], ["FFSP", 4, 0, [3, 2, 1, 0], 1, 1], ["AN", 4, 1, 6], ["FU", 2, [0, 1, 2, 3]], ["SP", 2, 0, 24, [1], 1], ["AN", 2, 1, 2], ["FFSP", 2, 0, [3, 2, 1, 0], 1, 1], ["AN", 2, 1, 6], ["PR", 5, 0, "auto_unroll_max_step$16"]]]], "r": [[0.000620914, 0.000620903, 0.000620911, 0.000620916], 0, 3.60207, 1668696153], "v": "v0.6"}
{"i": [["[\"9a995a41bc2ff7cdadb96550380f7c85\", [7, 8, 32, 32], [8, 8, 3, 3], [1, 8, 1, 1], [7, 8, 32, 32]]", "cuda -keys=cuda,gpu -arch=sm_80 -max_num_threads=1024 -thread_warp_size=32", [-1, 16, 64, 49152, 2147483647, 1024, 8, 32], "", 0, []], [[], [["SP", 3, 0, 7, [1, 1, 1, 1], 1], ["SP", 3, 5, 8, [1, 2, 2, 2], 1], ["SP", 3, 10, 32, [2, 4, 4, 1], 1], ["SP", 3, 15, 32, [1, 4, 1, 1], 1], ["SP", 3, 20, 8, [4, 1], 1], ["SP", 3, 23, 3, [3, 1], 1], ["SP", 3, 26, 3, [1, 3], 1], ["RE", 3, [0, 5, 10, 15, 1, 6, 11, 16, 2, 7, 12, 17, 20, 23, 26, 21, 24, 27, 3, 8, 13, 18, 22, 25, 28, 4, 9, 14, 19]], ["FSP", 5, 0, 0, 3], ["FSP", 5, 4, 1, 3], ["FSP", 5, 8, 2, 3], ["FSP", 5, 12, 3, 3], ["RE", 5, [0, 4, 8, 12, 1, 5, 9, 13, 2, 6, 10, 14, 3, 7, 11, 15]], ["CA", 3, 5, 11], ["CHR", 2, "shared", [3]], ["CA", 3, 4, 14], ["CHR", 1, "shared", [4]], ["CA", 2, 5, 14], ["CI", 1], ["FU", 7, [0, 1, 2, 3]], ["AN", 7, 0, 5], ["FU", 7, [1, 2, 3, 4]], ["AN", 7, 1, 4], ["FU", 7, [2, 3, 4, 5]], ["AN", 7, 2, 6], ["FU", 4, [0, 1, 2, 3]], ["SP", 4, 0, 144, [1], 1], ["AN", 4, 1, 2], ["FFSP", 4, 0, [3, 2, 1, 0], 1, 1], ["AN", 4, 1, 6], ["FU", 2, [0, 1, 2, 3]], ["SP", 2, 0, 48, [1], 1], ["AN", 2, 1, 2], ["FFSP", 2, 0, [3, 2, 1, 0], 1, 1], ["AN", 2, 1, 6], ["PR", 5, 0, "auto_unroll_max_step$1024"]]]], "r": [[9.24857e-06, 9.24945e-06, 9.27072e-06, 9.25407e-06], 0, 3.23839, 1668696155], "v": "v0.6"}
{"i": [["[\"9a995a41bc2ff7cdadb96550380f7c85\", [7, 8, 32, 32], [8, 8, 3, 3], [1, 8, 1, 1], [7, 8, 32, 32]]", "cuda -keys=cuda,gpu -arch=sm_80 -max_num_threads=1024 -thread_warp_size=32", [-1, 16, 64, 49152, 2147483647, 1024, 8, 32], "", 0, []], [[], [["SP", 3, 0, 7, [1, 7, 1, 1], 1], ["SP", 3, 5, 8, [1, 1, 1, 2], 1], ["SP", 3, 10, 32, [1, 1, 1, 4], 1], ["SP", 3, 15, 32, [1, 16, 1, 2], 1], ["SP", 3, 20, 8, [1, 4], 1], ["SP", 3, 23, 3, [1, 3], 1], ["SP", 3, 26, 3, [3, 1], 1], ["RE", 3, [0, 5, 10, 15, 1, 6, 11, 16, 2, 7, 12, 17, 20, 23, 26, 21, 24, 27, 3, 8, 13, 18, 22, 25, 28, 4, 9, 14, 19]], ["FSP", 5, 0, 0, 3], ["FSP", 5, 4, 1, 3], ["FSP", 5, 8, 2, 3], ["FSP", 5, 12, 3, 3], ["RE", 5, [0, 4, 8, 12, 1, 5, 9, 13, 2, 6, 10, 14, 3, 7, 11, 15]], ["CA", 3, 5, 11], ["CHR", 2, "shared", [3]], ["CA", 3, 4, 14], ["CHR", 1, "shared", [4]], ["CA", 2, 5, 14], ["CI", 1], ["FU", 7, [0, 1, 2, 3]], ["AN", 7, 0, 5], ["FU", 7, [1, 2, 3, 4]], ["AN", 7, 1, 4], ["FU", 7, [2, 3, 4, 5]], ["AN", 7, 2, 6], ["FU", 4, [0, 1, 2, 3]], ["SP", 4, 0, 72, [1], 1], ["AN", 4, 1, 2], ["FFSP", 4, 0, [3, 2, 1, 0], 1, 1], ["AN", 4, 1, 6], ["FU", 2, [0, 1, 2, 3]], ["SP", 2, 0, 96, [1], 1], ["AN", 2, 1, 2], ["FFSP", 2, 0, [3, 2, 1, 0], 1, 1], ["AN", 2, 1, 6], ["PR", 5, 0, "auto_unroll_max_step$64"]]]], "r": [[8.02168e-06, 8.02126e-06, 8.02102e-06, 8.0212e-06], 0, 3.31518, 1668696158], "v": "v0.6"}
{"i": [["[\"9a995a41bc2ff7cdadb96550380f7c85\", [7, 8, 32, 32], [8, 8, 3, 3], [1, 8, 1, 1], [7, 8, 32, 32]]", "cuda -keys=cuda,gpu -arch=sm_80 -max_num_threads=1024 -thread_warp_size=32", [-1, 16, 64, 49152, 2147483647, 1024, 8, 32], "", 0, []], [[], [["SP", 3, 0, 7, [1, 7, 1, 1], 1], ["SP", 3, 5, 8, [1, 1, 1, 1], 1], ["SP", 3, 10, 32, [1, 8, 1, 2], 1], ["SP", 3, 15, 32, [1, 16, 1, 1], 1], ["SP", 3, 20, 8, [2, 1], 1], ["SP", 3, 23, 3, [1, 3], 1], ["SP", 3, 26, 3, [1, 1], 1], ["RE", 3, [0, 5, 10, 15, 1, 6, 11, 16, 2, 7, 12, 17, 20, 23, 26, 21, 24, 27, 3, 8, 13, 18, 22, 25, 28, 4, 9, 14, 19]], ["FSP", 5, 0, 0, 3], ["FSP", 5, 4, 1, 3], ["FSP", 5, 8, 2, 3], ["FSP", 5, 12, 3, 3], ["RE", 5, [0, 4, 8, 12, 1, 5, 9, 13, 2, 6, 10, 14, 3, 7, 11, 15]], ["CA", 3, 5, 11], ["CHR", 2, "shared", [3]], ["CA", 3, 4, 14], ["CHR", 1, "shared", [4]], ["CA", 2, 5, 14], ["CI", 1], ["FU", 7, [0, 1, 2, 3]], ["AN", 7, 0, 5], ["FU", 7, [1, 2, 3, 4]], ["AN", 7, 1, 4], ["FU", 7, [2, 3, 4, 5]], ["AN", 7, 2, 6], ["FU", 4, [0, 1, 2, 3]], ["SP", 4, 0, 24, [1], 1], ["AN", 4, 1, 2], ["FFSP", 4, 0, [3, 2, 1, 0], 1, 1], ["AN", 4, 1, 6], ["FU", 2, [0, 1, 2, 3]], ["SP", 2, 0, 8, [4], 1], ["AN", 2, 1, 2], ["FFSP", 2, 0, [3, 2, 1, 0], 1, 1], ["AN", 2, 1, 6], ["PR", 5, 0, "auto_unroll_max_step$1024"]]]], "r": [[2.42662e-05, 2.42668e-05, 2.42666e-05, 2.42676e-05], 0, 3.62923, 1668696160], "v": "v0.6"}
