.cache/log/kernel_tune/NVIDIA_A100_80GB_PCIe/Conv2dBias_forward_input_0_21_8_32_32_output_0_21_8_32_32_in_channels_8_out_channels_8_kernel_size_3_3_stride_1_1_padding_1_1_dilation_1_1_groups_1.json
{"i": [["[\"9a995a41bc2ff7cdadb96550380f7c85\", [21, 8, 32, 32], [8, 8, 3, 3], [1, 8, 1, 1], [21, 8, 32, 32]]", "cuda -keys=cuda,gpu -arch=sm_80 -max_num_threads=1024 -thread_warp_size=32", [-1, 16, 64, 49152, 2147483647, 1024, 8, 32], "", 0, []], [[], [["SP", 3, 0, 21, [1, 1, 1, 21], 1], ["SP", 3, 5, 8, [1, 4, 2, 1], 1], ["SP", 3, 10, 32, [1, 2, 2, 1], 1], ["SP", 3, 15, 32, [4, 4, 1, 1], 1], ["SP", 3, 20, 8, [2, 1], 1], ["SP", 3, 23, 3, [1, 3], 1], ["SP", 3, 26, 3, [1, 1], 1], ["RE", 3, [0, 5, 10, 15, 1, 6, 11, 16, 2, 7, 12, 17, 20, 23, 26, 21, 24, 27, 3, 8, 13, 18, 22, 25, 28, 4, 9, 14, 19]], ["FSP", 5, 0, 0, 3], ["FSP", 5, 4, 1, 3], ["FSP", 5, 8, 2, 3], ["FSP", 5, 12, 3, 3], ["RE", 5, [0, 4, 8, 12, 1, 5, 9, 13, 2, 6, 10, 14, 3, 7, 11, 15]], ["CA", 3, 5, 11], ["CHR", 2, "shared", [3]], ["CA", 3, 4, 14], ["CHR", 1, "shared", [4]], ["CA", 2, 5, 14], ["CI", 1], ["FU", 7, [0, 1, 2, 3]], ["AN", 7, 0, 5], ["FU", 7, [1, 2, 3, 4]], ["AN", 7, 1, 4], ["FU", 7, [2, 3, 4, 5]], ["AN", 7, 2, 6], ["FU", 4, [0, 1, 2, 3]], ["SP", 4, 0, 12, [1], 1], ["AN", 4, 1, 2], ["FFSP", 4, 0, [3, 2, 1, 0], 1, 1], ["AN", 4, 1, 6], ["FU", 2, [0, 1, 2, 3]], ["SP", 2, 0, 126, [1], 1], ["AN", 2, 1, 2], ["FFSP", 2, 0, [3, 2, 1, 0], 1, 1], ["AN", 2, 1, 6], ["PR", 5, 0, "auto_unroll_max_step$0"]]]], "r": [[0.000186218, 0.000186108, 0.000186111, 0.00018612], 0, 4.14011, 1669741912], "v": "v0.6"}
{"i": [["[\"9a995a41bc2ff7cdadb96550380f7c85\", [21, 8, 32, 32], [8, 8, 3, 3], [1, 8, 1, 1], [21, 8, 32, 32]]", "cuda -keys=cuda,gpu -arch=sm_80 -max_num_threads=1024 -thread_warp_size=32", [-1, 16, 64, 49152, 2147483647, 1024, 8, 32], "", 0, []], [[], [["SP", 3, 0, 21, [1, 1, 1, 3], 1], ["SP", 3, 5, 8, [1, 2, 2, 2], 1], ["SP", 3, 10, 32, [1, 4, 2, 4], 1], ["SP", 3, 15, 32, [1, 2, 1, 1], 1], ["SP", 3, 20, 8, [2, 1], 1], ["SP", 3, 23, 3, [1, 3], 1], ["SP", 3, 26, 3, [1, 3], 1], ["RE", 3, [0, 5, 10, 15, 1, 6, 11, 16, 2, 7, 12, 17, 20, 23, 26, 21, 24, 27, 3, 8, 13, 18, 22, 25, 28, 4, 9, 14, 19]], ["FSP", 5, 0, 0, 3], ["FSP", 5, 4, 1, 3], ["FSP", 5, 8, 2, 3], ["FSP", 5, 12, 3, 3], ["RE", 5, [0, 4, 8, 12, 1, 5, 9, 13, 2, 6, 10, 14, 3, 7, 11, 15]], ["CA", 3, 5, 11], ["CHR", 2, "shared", [3]], ["CA", 3, 4, 14], ["CHR", 1, "shared", [4]], ["CA", 2, 5, 14], ["CI", 1], ["FU", 7, [0, 1, 2, 3]], ["AN", 7, 0, 5], ["FU", 7, [1, 2, 3, 4]], ["AN", 7, 1, 4], ["FU", 7, [2, 3, 4, 5]], ["AN", 7, 2, 6], ["FU", 4, [0, 1, 2, 3]], ["SP", 4, 0, 36, [1], 1], ["AN", 4, 1, 2], ["FFSP", 4, 0, [3, 2, 1, 0], 1, 1], ["AN", 4, 1, 6], ["FU", 2, [0, 1, 2, 3]], ["SP", 2, 0, 180, [1], 1], ["AN", 2, 1, 2], ["FFSP", 2, 0, [3, 2, 1, 0], 1, 1], ["AN", 2, 1, 6], ["PR", 5, 0, "auto_unroll_max_step$16"]]]], "r": [[5.04794e-05, 5.04816e-05, 5.04787e-05, 5.04807e-05], 0, 3.76055, 1669741915], "v": "v0.6"}
{"i": [["[\"9a995a41bc2ff7cdadb96550380f7c85\", [21, 8, 32, 32], [8, 8, 3, 3], [1, 8, 1, 1], [21, 8, 32, 32]]", "cuda -keys=cuda,gpu -arch=sm_80 -max_num_threads=1024 -thread_warp_size=32", [-1, 16, 64, 49152, 2147483647, 1024, 8, 32], "", 0, []], [[], [["SP", 3, 0, 21, [1, 21, 1, 1], 1], ["SP", 3, 5, 8, [1, 2, 2, 1], 1], ["SP", 3, 10, 32, [2, 1, 1, 8], 1], ["SP", 3, 15, 32, [4, 1, 1, 1], 1], ["SP", 3, 20, 8, [1, 2], 1], ["SP", 3, 23, 3, [1, 1], 1], ["SP", 3, 26, 3, [3, 1], 1], ["RE", 3, [0, 5, 10, 15, 1, 6, 11, 16, 2, 7, 12, 17, 20, 23, 26, 21, 24, 27, 3, 8, 13, 18, 22, 25, 28, 4, 9, 14, 19]], ["FSP", 5, 0, 0, 3], ["FSP", 5, 4, 1, 3], ["FSP", 5, 8, 2, 3], ["FSP", 5, 12, 3, 3], ["RE", 5, [0, 4, 8, 12, 1, 5, 9, 13, 2, 6, 10, 14, 3, 7, 11, 15]], ["CA", 3, 5, 11], ["CHR", 2, "shared", [3]], ["CA", 3, 4, 14], ["CHR", 1, "shared", [4]], ["CA", 2, 5, 14], ["CI", 1], ["FU", 7, [0, 1, 2, 3]], ["AN", 7, 0, 5], ["FU", 7, [1, 2, 3, 4]], ["AN", 7, 1, 4], ["FU", 7, [2, 3, 4, 5]], ["AN", 7, 2, 6], ["FU", 4, [0, 1, 2, 3]], ["SP", 4, 0, 12, [1], 1], ["AN", 4, 1, 2], ["FFSP", 4, 0, [3, 2, 1, 0], 1, 1], ["AN", 4, 1, 6], ["FU", 2, [0, 1, 2, 3]], ["SP", 2, 0, 48, [1], 1], ["AN", 2, 1, 2], ["FFSP", 2, 0, [3, 2, 1, 0], 1, 1], ["AN", 2, 1, 6], ["PR", 5, 0, "auto_unroll_max_step$0"]]]], "r": [[0.000212763, 0.000212767, 0.000212763, 0.000212767], 0, 3.67312, 1669741918], "v": "v0.6"}
{"i": [["[\"9a995a41bc2ff7cdadb96550380f7c85\", [21, 8, 32, 32], [8, 8, 3, 3], [1, 8, 1, 1], [21, 8, 32, 32]]", "cuda -keys=cuda,gpu -arch=sm_80 -max_num_threads=1024 -thread_warp_size=32", [-1, 16, 64, 49152, 2147483647, 1024, 8, 32], "", 0, []], [[], [["SP", 3, 0, 21, [1, 1, 7, 3], 1], ["SP", 3, 5, 8, [1, 2, 1, 2], 1], ["SP", 3, 10, 32, [2, 2, 2, 1], 1], ["SP", 3, 15, 32, [1, 8, 2, 1], 1], ["SP", 3, 20, 8, [1, 1], 1], ["SP", 3, 23, 3, [3, 1], 1], ["SP", 3, 26, 3, [3, 1], 1], ["RE", 3, [0, 5, 10, 15, 1, 6, 11, 16, 2, 7, 12, 17, 20, 23, 26, 21, 24, 27, 3, 8, 13, 18, 22, 25, 28, 4, 9, 14, 19]], ["FSP", 5, 0, 0, 3], ["FSP", 5, 4, 1, 3], ["FSP", 5, 8, 2, 3], ["FSP", 5, 12, 3, 3], ["RE", 5, [0, 4, 8, 12, 1, 5, 9, 13, 2, 6, 10, 14, 3, 7, 11, 15]], ["CA", 3, 5, 11], ["CHR", 2, "shared", [3]], ["CA", 3, 4, 14], ["CHR", 1, "shared", [4]], ["CA", 2, 5, 14], ["CI", 1], ["FU", 7, [0, 1, 2, 3]], ["AN", 7, 0, 5], ["FU", 7, [1, 2, 3, 4]], ["AN", 7, 1, 4], ["FU", 7, [2, 3, 4, 5]], ["AN", 7, 2, 6], ["FU", 4, [0, 1, 2, 3]], ["SP", 4, 0, 6, [1], 1], ["AN", 4, 1, 2], ["FFSP", 4, 0, [3, 2, 1, 0], 1, 1], ["AN", 4, 1, 6], ["FU", 2, [0, 1, 2, 3]], ["SP", 2, 0, 24, [1], 1], ["AN", 2, 1, 2], ["FFSP", 2, 0, [3, 2, 1, 0], 1, 1], ["AN", 2, 1, 6], ["PR", 5, 0, "auto_unroll_max_step$0"]]]], "r": [[0.000523752, 0.000523121, 0.000522103, 0.00052209], 0, 3.60724, 1669741921], "v": "v0.6"}
{"i": [["[\"9a995a41bc2ff7cdadb96550380f7c85\", [21, 8, 32, 32], [8, 8, 3, 3], [1, 8, 1, 1], [21, 8, 32, 32]]", "cuda -keys=cuda,gpu -arch=sm_80 -max_num_threads=1024 -thread_warp_size=32", [-1, 16, 64, 49152, 2147483647, 1024, 8, 32], "", 0, []], [[], [["SP", 3, 0, 21, [1, 1, 7, 1], 1], ["SP", 3, 5, 8, [1, 1, 1, 8], 1], ["SP", 3, 10, 32, [1, 8, 1, 1], 1], ["SP", 3, 15, 32, [1, 4, 1, 4], 1], ["SP", 3, 20, 8, [4, 1], 1], ["SP", 3, 23, 3, [1, 1], 1], ["SP", 3, 26, 3, [3, 1], 1], ["RE", 3, [0, 5, 10, 15, 1, 6, 11, 16, 2, 7, 12, 17, 20, 23, 26, 21, 24, 27, 3, 8, 13, 18, 22, 25, 28, 4, 9, 14, 19]], ["FSP", 5, 0, 0, 3], ["FSP", 5, 4, 1, 3], ["FSP", 5, 8, 2, 3], ["FSP", 5, 12, 3, 3], ["RE", 5, [0, 4, 8, 12, 1, 5, 9, 13, 2, 6, 10, 14, 3, 7, 11, 15]], ["CA", 3, 5, 11], ["CHR", 2, "shared", [3]], ["CA", 3, 4, 14], ["CHR", 1, "shared", [4]], ["CA", 2, 5, 14], ["CI", 1], ["FU", 7, [0, 1, 2, 3]], ["AN", 7, 0, 5], ["FU", 7, [1, 2, 3, 4]], ["AN", 7, 1, 4], ["FU", 7, [2, 3, 4, 5]], ["AN", 7, 2, 6], ["FU", 4, [0, 1, 2, 3]], ["SP", 4, 0, 288, [2], 1], ["AN", 4, 1, 2], ["FFSP", 4, 0, [3, 2, 1, 0], 1, 1], ["AN", 4, 1, 6], ["FU", 2, [0, 1, 2, 3]], ["SP", 2, 0, 504, [21], 1], ["AN", 2, 1, 2], ["FFSP", 2, 0, [3, 2, 1, 0], 1, 1], ["AN", 2, 1, 6], ["PR", 5, 0, "auto_unroll_max_step$0"]]]], "r": [[0.00027386, 0.000274803, 0.000274769, 0.000274894], 0, 3.60785, 1669741923], "v": "v0.6"}
{"i": [["[\"9a995a41bc2ff7cdadb96550380f7c85\", [21, 8, 32, 32], [8, 8, 3, 3], [1, 8, 1, 1], [21, 8, 32, 32]]", "cuda -keys=cuda,gpu -arch=sm_80 -max_num_threads=1024 -thread_warp_size=32", [-1, 16, 64, 49152, 2147483647, 1024, 8, 32], "", 0, []], [[], [["SP", 3, 0, 21, [1, 1, 1, 1], 1], ["SP", 3, 5, 8, [4, 2, 1, 1], 1], ["SP", 3, 10, 32, [1, 4, 1, 2], 1], ["SP", 3, 15, 32, [1, 4, 4, 2], 1], ["SP", 3, 20, 8, [8, 1], 1], ["SP", 3, 23, 3, [1, 1], 1], ["SP", 3, 26, 3, [1, 3], 1], ["RE", 3, [0, 5, 10, 15, 1, 6, 11, 16, 2, 7, 12, 17, 20, 23, 26, 21, 24, 27, 3, 8, 13, 18, 22, 25, 28, 4, 9, 14, 19]], ["FSP", 5, 0, 0, 3], ["FSP", 5, 4, 1, 3], ["FSP", 5, 8, 2, 3], ["FSP", 5, 12, 3, 3], ["RE", 5, [0, 4, 8, 12, 1, 5, 9, 13, 2, 6, 10, 14, 3, 7, 11, 15]], ["CA", 3, 5, 11], ["CHR", 2, "shared", [3]], ["CA", 3, 4, 14], ["CHR", 1, "shared", [4]], ["CA", 2, 5, 14], ["CI", 1], ["FU", 7, [0, 1, 2, 3]], ["AN", 7, 0, 5], ["FU", 7, [1, 2, 3, 4]], ["AN", 7, 1, 4], ["FU", 7, [2, 3, 4, 5]], ["AN", 7, 2, 6], ["FU", 4, [0, 1, 2, 3]], ["SP", 4, 0, 72, [1], 1], ["AN", 4, 1, 2], ["FFSP", 4, 0, [3, 2, 1, 0], 1, 1], ["AN", 4, 1, 6], ["FU", 2, [0, 1, 2, 3]], ["SP", 2, 0, 240, [1], 1], ["AN", 2, 1, 2], ["FFSP", 2, 0, [3, 2, 1, 0], 1, 1], ["AN", 2, 1, 6], ["PR", 5, 0, "auto_unroll_max_step$0"]]]], "r": [[5.37323e-05, 5.37316e-05, 5.37298e-05, 5.37283e-05], 0, 3.34852, 1669741926], "v": "v0.6"}
{"i": [["[\"9a995a41bc2ff7cdadb96550380f7c85\", [21, 8, 32, 32], [8, 8, 3, 3], [1, 8, 1, 1], [21, 8, 32, 32]]", "cuda -keys=cuda,gpu -arch=sm_80 -max_num_threads=1024 -thread_warp_size=32", [-1, 16, 64, 49152, 2147483647, 1024, 8, 32], "", 0, []], [[], [["SP", 3, 0, 21, [7, 1, 1, 3], 1], ["SP", 3, 5, 8, [1, 2, 4, 1], 1], ["SP", 3, 10, 32, [1, 1, 2, 2], 1], ["SP", 3, 15, 32, [2, 8, 1, 2], 1], ["SP", 3, 20, 8, [1, 2], 1], ["SP", 3, 23, 3, [1, 1], 1], ["SP", 3, 26, 3, [1, 3], 1], ["RE", 3, [0, 5, 10, 15, 1, 6, 11, 16, 2, 7, 12, 17, 20, 23, 26, 21, 24, 27, 3, 8, 13, 18, 22, 25, 28, 4, 9, 14, 19]], ["FSP", 5, 0, 0, 3], ["FSP", 5, 4, 1, 3], ["FSP", 5, 8, 2, 3], ["FSP", 5, 12, 3, 3], ["RE", 5, [0, 4, 8, 12, 1, 5, 9, 13, 2, 6, 10, 14, 3, 7, 11, 15]], ["CA", 3, 5, 11], ["CHR", 2, "shared", [3]], ["CA", 3, 4, 14], ["CHR", 1, "shared", [4]], ["CA", 2, 5, 14], ["CI", 1], ["FU", 7, [0, 1, 2, 3]], ["AN", 7, 0, 5], ["FU", 7, [1, 2, 3, 4]], ["AN", 7, 1, 4], ["FU", 7, [2, 3, 4, 5]], ["AN", 7, 2, 6], ["FU", 4, [0, 1, 2, 3]], ["SP", 4, 0, 12, [3], 1], ["AN", 4, 1, 2], ["FFSP", 4, 0, [3, 2, 1, 0], 1, 1], ["AN", 4, 1, 6], ["FU", 2, [0, 1, 2, 3]], ["SP", 2, 0, 96, [1], 1], ["AN", 2, 1, 2], ["FFSP", 2, 0, [3, 2, 1, 0], 1, 1], ["AN", 2, 1, 6], ["PR", 5, 0, "auto_unroll_max_step$512"]]]], "r": [[0.000358853, 0.000358865, 0.000358868, 0.000358871], 0, 12.0415, 1669741929], "v": "v0.6"}
{"i": [["[\"9a995a41bc2ff7cdadb96550380f7c85\", [21, 8, 32, 32], [8, 8, 3, 3], [1, 8, 1, 1], [21, 8, 32, 32]]", "cuda -keys=cuda,gpu -arch=sm_80 -max_num_threads=1024 -thread_warp_size=32", [-1, 16, 64, 49152, 2147483647, 1024, 8, 32], "", 0, []], [[], [["SP", 3, 0, 21, [1, 1, 21, 1], 1], ["SP", 3, 5, 8, [1, 4, 1, 1], 1], ["SP", 3, 10, 32, [1, 16, 1, 1], 1], ["SP", 3, 15, 32, [2, 1, 2, 2], 1], ["SP", 3, 20, 8, [2, 1], 1], ["SP", 3, 23, 3, [1, 1], 1], ["SP", 3, 26, 3, [1, 3], 1], ["RE", 3, [0, 5, 10, 15, 1, 6, 11, 16, 2, 7, 12, 17, 20, 23, 26, 21, 24, 27, 3, 8, 13, 18, 22, 25, 28, 4, 9, 14, 19]], ["FSP", 5, 0, 0, 3], ["FSP", 5, 4, 1, 3], ["FSP", 5, 8, 2, 3], ["FSP", 5, 12, 3, 3], ["RE", 5, [0, 4, 8, 12, 1, 5, 9, 13, 2, 6, 10, 14, 3, 7, 11, 15]], ["CA", 3, 5, 11], ["CHR", 2, "shared", [3]], ["CA", 3, 4, 14], ["CHR", 1, "shared", [4]], ["CA", 2, 5, 14], ["CI", 1], ["FU", 7, [0, 1, 2, 3]], ["AN", 7, 0, 5], ["FU", 7, [1, 2, 3, 4]], ["AN", 7, 1, 4], ["FU", 7, [2, 3, 4, 5]], ["AN", 7, 2, 6], ["FU", 4, [0, 1, 2, 3]], ["SP", 4, 0, 6, [1], 1], ["AN", 4, 1, 2], ["FFSP", 4, 0, [3, 2, 1, 0], 1, 1], ["AN", 4, 1, 6], ["FU", 2, [0, 1, 2, 3]], ["SP", 2, 0, 168, [56], 1], ["AN", 2, 1, 2], ["FFSP", 2, 0, [3, 2, 1, 0], 1, 1], ["AN", 2, 1, 6], ["PR", 5, 0, "auto_unroll_max_step$64"]]]], "r": [[0.000554349, 0.000554348, 0.000554346, 0.000554348], 0, 4.24782, 1669741932], "v": "v0.6"}
{"i": [["[\"9a995a41bc2ff7cdadb96550380f7c85\", [21, 8, 32, 32], [8, 8, 3, 3], [1, 8, 1, 1], [21, 8, 32, 32]]", "cuda -keys=cuda,gpu -arch=sm_80 -max_num_threads=1024 -thread_warp_size=32", [-1, 16, 64, 49152, 2147483647, 1024, 8, 32], "", 0, []], [[], [["SP", 3, 0, 21, [1, 21, 1, 1], 1], ["SP", 3, 5, 8, [4, 1, 1, 1], 1], ["SP", 3, 10, 32, [2, 1, 1, 1], 1], ["SP", 3, 15, 32, [1, 4, 1, 2], 1], ["SP", 3, 20, 8, [1, 2], 1], ["SP", 3, 23, 3, [1, 1], 1], ["SP", 3, 26, 3, [1, 1], 1], ["RE", 3, [0, 5, 10, 15, 1, 6, 11, 16, 2, 7, 12, 17, 20, 23, 26, 21, 24, 27, 3, 8, 13, 18, 22, 25, 28, 4, 9, 14, 19]], ["FSP", 5, 0, 0, 3], ["FSP", 5, 4, 1, 3], ["FSP", 5, 8, 2, 3], ["FSP", 5, 12, 3, 3], ["RE", 5, [0, 4, 8, 12, 1, 5, 9, 13, 2, 6, 10, 14, 3, 7, 11, 15]], ["CA", 3, 5, 11], ["CHR", 2, "shared", [3]], ["CA", 3, 4, 14], ["CHR", 1, "shared", [4]], ["CA", 2, 5, 14], ["CI", 1], ["FU", 7, [0, 1, 2, 3]], ["AN", 7, 0, 5], ["FU", 7, [1, 2, 3, 4]], ["AN", 7, 1, 4], ["FU", 7, [2, 3, 4, 5]], ["AN", 7, 2, 6], ["FU", 4, [0, 1, 2, 3]], ["SP", 4, 0, 12, [3], 1], ["AN", 4, 1, 2], ["FFSP", 4, 0, [3, 2, 1, 0], 1, 1], ["AN", 4, 1, 6], ["FU", 2, [0, 1, 2, 3]], ["SP", 2, 0, 8, [8], 1], ["AN", 2, 1, 2], ["FFSP", 2, 0, [3, 2, 1, 0], 1, 1], ["AN", 2, 1, 6], ["PR", 5, 0, "auto_unroll_max_step$16"]]]], "r": [[5.61207e-05, 5.61195e-05, 5.61332e-05, 5.61289e-05], 0, 3.22302, 1669741934], "v": "v0.6"}
{"i": [["[\"9a995a41bc2ff7cdadb96550380f7c85\", [21, 8, 32, 32], [8, 8, 3, 3], [1, 8, 1, 1], [21, 8, 32, 32]]", "cuda -keys=cuda,gpu -arch=sm_80 -max_num_threads=1024 -thread_warp_size=32", [-1, 16, 64, 49152, 2147483647, 1024, 8, 32], "", 0, []], [[], [["SP", 3, 0, 21, [1, 3, 1, 1], 1], ["SP", 3, 5, 8, [4, 1, 1, 1], 1], ["SP", 3, 10, 32, [1, 8, 1, 1], 1], ["SP", 3, 15, 32, [1, 4, 1, 4], 1], ["SP", 3, 20, 8, [4, 2], 1], ["SP", 3, 23, 3, [1, 1], 1], ["SP", 3, 26, 3, [1, 1], 1], ["RE", 3, [0, 5, 10, 15, 1, 6, 11, 16, 2, 7, 12, 17, 20, 23, 26, 21, 24, 27, 3, 8, 13, 18, 22, 25, 28, 4, 9, 14, 19]], ["FSP", 5, 0, 0, 3], ["FSP", 5, 4, 1, 3], ["FSP", 5, 8, 2, 3], ["FSP", 5, 12, 3, 3], ["RE", 5, [0, 4, 8, 12, 1, 5, 9, 13, 2, 6, 10, 14, 3, 7, 11, 15]], ["CA", 3, 5, 11], ["CHR", 2, "shared", [3]], ["CA", 3, 4, 14], ["CHR", 1, "shared", [4]], ["CA", 2, 5, 14], ["CI", 1], ["FU", 7, [0, 1, 2, 3]], ["AN", 7, 0, 5], ["FU", 7, [1, 2, 3, 4]], ["AN", 7, 1, 4], ["FU", 7, [2, 3, 4, 5]], ["AN", 7, 2, 6], ["FU", 4, [0, 1, 2, 3]], ["SP", 4, 0, 24, [1], 1], ["AN", 4, 1, 2], ["FFSP", 4, 0, [3, 2, 1, 0], 1, 1], ["AN", 4, 1, 6], ["FU", 2, [0, 1, 2, 3]], ["SP", 2, 0, 48, [1], 1], ["AN", 2, 1, 2], ["FFSP", 2, 0, [3, 2, 1, 0], 1, 1], ["AN", 2, 1, 6], ["PR", 5, 0, "auto_unroll_max_step$1024"]]]], "r": [[1.15733e-05, 1.15778e-05, 1.15844e-05, 1.15831e-05], 0, 3.8282, 1669741937], "v": "v0.6"}
{"i": [["[\"9a995a41bc2ff7cdadb96550380f7c85\", [21, 8, 32, 32], [8, 8, 3, 3], [1, 8, 1, 1], [21, 8, 32, 32]]", "cuda -keys=cuda,gpu -arch=sm_80 -max_num_threads=1024 -thread_warp_size=32", [-1, 16, 64, 49152, 2147483647, 1024, 8, 32], "", 0, []], [[], [["SP", 3, 0, 21, [1, 7, 3, 1], 1], ["SP", 3, 5, 8, [1, 4, 1, 2], 1], ["SP", 3, 10, 32, [1, 1, 16, 2], 1], ["SP", 3, 15, 32, [1, 16, 1, 1], 1], ["SP", 3, 20, 8, [1, 1], 1], ["SP", 3, 23, 3, [3, 1], 1], ["SP", 3, 26, 3, [1, 1], 1], ["RE", 3, [0, 5, 10, 15, 1, 6, 11, 16, 2, 7, 12, 17, 20, 23, 26, 21, 24, 27, 3, 8, 13, 18, 22, 25, 28, 4, 9, 14, 19]], ["FSP", 5, 0, 0, 3], ["FSP", 5, 4, 1, 3], ["FSP", 5, 8, 2, 3], ["FSP", 5, 12, 3, 3], ["RE", 5, [0, 4, 8, 12, 1, 5, 9, 13, 2, 6, 10, 14, 3, 7, 11, 15]], ["CA", 3, 5, 11], ["CHR", 2, "shared", [3]], ["CA", 3, 4, 14], ["CHR", 1, "shared", [4]], ["CA", 2, 5, 14], ["CI", 1], ["FU", 7, [0, 1, 2, 3]], ["AN", 7, 0, 5], ["FU", 7, [1, 2, 3, 4]], ["AN", 7, 1, 4], ["FU", 7, [2, 3, 4, 5]], ["AN", 7, 2, 6], ["FU", 4, [0, 1, 2, 3]], ["SP", 4, 0, 6, [1], 1], ["AN", 4, 1, 2], ["FFSP", 4, 0, [3, 2, 1, 0], 1, 1], ["AN", 4, 1, 6], ["FU", 2, [0, 1, 2, 3]], ["SP", 2, 0, 54, [6], 1], ["AN", 2, 1, 2], ["FFSP", 2, 0, [3, 2, 1, 0], 1, 1], ["AN", 2, 1, 6], ["PR", 5, 0, "auto_unroll_max_step$512"]]]], "r": [[0.000700605, 0.00070006, 0.000700151, 0.000700293], 0, 3.92802, 1669741939], "v": "v0.6"}
{"i": [["[\"9a995a41bc2ff7cdadb96550380f7c85\", [21, 8, 32, 32], [8, 8, 3, 3], [1, 8, 1, 1], [21, 8, 32, 32]]", "cuda -keys=cuda,gpu -arch=sm_80 -max_num_threads=1024 -thread_warp_size=32", [-1, 16, 64, 49152, 2147483647, 1024, 8, 32], "", 0, []], [[], [["SP", 3, 0, 21, [1, 1, 3, 1], 1], ["SP", 3, 5, 8, [1, 4, 1, 2], 1], ["SP", 3, 10, 32, [1, 1, 1, 2], 1], ["SP", 3, 15, 32, [1, 16, 2, 1], 1], ["SP", 3, 20, 8, [1, 1], 1], ["SP", 3, 23, 3, [3, 1], 1], ["SP", 3, 26, 3, [1, 1], 1], ["RE", 3, [0, 5, 10, 15, 1, 6, 11, 16, 2, 7, 12, 17, 20, 23, 26, 21, 24, 27, 3, 8, 13, 18, 22, 25, 28, 4, 9, 14, 19]], ["FSP", 5, 0, 0, 3], ["FSP", 5, 4, 1, 3], ["FSP", 5, 8, 2, 3], ["FSP", 5, 12, 3, 3], ["RE", 5, [0, 4, 8, 12, 1, 5, 9, 13, 2, 6, 10, 14, 3, 7, 11, 15]], ["CA", 3, 5, 11], ["CHR", 2, "shared", [3]], ["CA", 3, 4, 14], ["CHR", 1, "shared", [4]], ["CA", 2, 5, 14], ["CI", 1], ["FU", 7, [0, 1, 2, 3]], ["AN", 7, 0, 5], ["FU", 7, [1, 2, 3, 4]], ["AN", 7, 1, 4], ["FU", 7, [2, 3, 4, 5]], ["AN", 7, 2, 6], ["FU", 4, [0, 1, 2, 3]], ["SP", 4, 0, 6, [3], 1], ["AN", 4, 1, 2], ["FFSP", 4, 0, [3, 2, 1, 0], 1, 1], ["AN", 4, 1, 6], ["FU", 2, [0, 1, 2, 3]], ["SP", 2, 0, 18, [1], 1], ["AN", 2, 1, 2], ["FFSP", 2, 0, [3, 2, 1, 0], 1, 1], ["AN", 2, 1, 6], ["PR", 5, 0, "auto_unroll_max_step$0"]]]], "r": [[1.03169e-05, 1.03238e-05, 1.03187e-05, 1.03228e-05], 0, 2.81312, 1669741942], "v": "v0.6"}
{"i": [["[\"9a995a41bc2ff7cdadb96550380f7c85\", [21, 8, 32, 32], [8, 8, 3, 3], [1, 8, 1, 1], [21, 8, 32, 32]]", "cuda -keys=cuda,gpu -arch=sm_80 -max_num_threads=1024 -thread_warp_size=32", [-1, 16, 64, 49152, 2147483647, 1024, 8, 32], "", 0, []], [[], [["SP", 3, 0, 21, [3, 1, 7, 1], 1], ["SP", 3, 5, 8, [2, 1, 1, 4], 1], ["SP", 3, 10, 32, [1, 8, 1, 2], 1], ["SP", 3, 15, 32, [1, 4, 2, 2], 1], ["SP", 3, 20, 8, [1, 1], 1], ["SP", 3, 23, 3, [1, 1], 1], ["SP", 3, 26, 3, [3, 1], 1], ["RE", 3, [0, 5, 10, 15, 1, 6, 11, 16, 2, 7, 12, 17, 20, 23, 26, 21, 24, 27, 3, 8, 13, 18, 22, 25, 28, 4, 9, 14, 19]], ["FSP", 5, 0, 0, 3], ["FSP", 5, 4, 1, 3], ["FSP", 5, 8, 2, 3], ["FSP", 5, 12, 3, 3], ["RE", 5, [0, 4, 8, 12, 1, 5, 9, 13, 2, 6, 10, 14, 3, 7, 11, 15]], ["CA", 3, 5, 11], ["CHR", 2, "shared", [3]], ["CA", 3, 4, 14], ["CHR", 1, "shared", [4]], ["CA", 2, 5, 14], ["CI", 1], ["FU", 7, [0, 1, 2, 3]], ["AN", 7, 0, 5], ["FU", 7, [1, 2, 3, 4]], ["AN", 7, 1, 4], ["FU", 7, [2, 3, 4, 5]], ["AN", 7, 2, 6], ["FU", 4, [0, 1, 2, 3]], ["SP", 4, 0, 12, [1], 1], ["AN", 4, 1, 2], ["FFSP", 4, 0, [3, 2, 1, 0], 1, 1], ["AN", 4, 1, 6], ["FU", 2, [0, 1, 2, 3]], ["SP", 2, 0, 84, [42], 1], ["AN", 2, 1, 2], ["FFSP", 2, 0, [3, 2, 1, 0], 1, 1], ["AN", 2, 1, 6], ["PR", 5, 0, "auto_unroll_max_step$1024"]]]], "r": [[0.000812402, 0.000813334, 0.000813381, 0.000813613], 0, 7.83648, 1669741945], "v": "v0.6"}
{"i": [["[\"9a995a41bc2ff7cdadb96550380f7c85\", [21, 8, 32, 32], [8, 8, 3, 3], [1, 8, 1, 1], [21, 8, 32, 32]]", "cuda -keys=cuda,gpu -arch=sm_80 -max_num_threads=1024 -thread_warp_size=32", [-1, 16, 64, 49152, 2147483647, 1024, 8, 32], "", 0, []], [[], [["SP", 3, 0, 21, [1, 3, 1, 1], 1], ["SP", 3, 5, 8, [1, 1, 1, 2], 1], ["SP", 3, 10, 32, [2, 16, 1, 1], 1], ["SP", 3, 15, 32, [1, 4, 2, 2], 1], ["SP", 3, 20, 8, [1, 4], 1], ["SP", 3, 23, 3, [1, 1], 1], ["SP", 3, 26, 3, [1, 3], 1], ["RE", 3, [0, 5, 10, 15, 1, 6, 11, 16, 2, 7, 12, 17, 20, 23, 26, 21, 24, 27, 3, 8, 13, 18, 22, 25, 28, 4, 9, 14, 19]], ["FSP", 5, 0, 0, 3], ["FSP", 5, 4, 1, 3], ["FSP", 5, 8, 2, 3], ["FSP", 5, 12, 3, 3], ["RE", 5, [0, 4, 8, 12, 1, 5, 9, 13, 2, 6, 10, 14, 3, 7, 11, 15]], ["CA", 3, 5, 11], ["CHR", 2, "shared", [3]], ["CA", 3, 4, 14], ["CHR", 1, "shared", [4]], ["CA", 2, 5, 14], ["CI", 1], ["FU", 7, [0, 1, 2, 3]], ["AN", 7, 0, 5], ["FU", 7, [1, 2, 3, 4]], ["AN", 7, 1, 4], ["FU", 7, [2, 3, 4, 5]], ["AN", 7, 2, 6], ["FU", 4, [0, 1, 2, 3]], ["SP", 4, 0, 12, [1], 1], ["AN", 4, 1, 2], ["FFSP", 4, 0, [3, 2, 1, 0], 1, 1], ["AN", 4, 1, 6], ["FU", 2, [0, 1, 2, 3]], ["SP", 2, 0, 24, [1], 1], ["AN", 2, 1, 2], ["FFSP", 2, 0, [3, 2, 1, 0], 1, 1], ["AN", 2, 1, 6], ["PR", 5, 0, "auto_unroll_max_step$64"]]]], "r": [[1.28845e-05, 1.28846e-05, 1.28844e-05, 1.28846e-05], 0, 3.13502, 1669741947], "v": "v0.6"}
{"i": [["[\"9a995a41bc2ff7cdadb96550380f7c85\", [21, 8, 32, 32], [8, 8, 3, 3], [1, 8, 1, 1], [21, 8, 32, 32]]", "cuda -keys=cuda,gpu -arch=sm_80 -max_num_threads=1024 -thread_warp_size=32", [-1, 16, 64, 49152, 2147483647, 1024, 8, 32], "", 0, []], [[], [["SP", 3, 0, 21, [3, 1, 1, 1], 1], ["SP", 3, 5, 8, [1, 1, 8, 1], 1], ["SP", 3, 10, 32, [1, 16, 1, 2], 1], ["SP", 3, 15, 32, [1, 4, 1, 2], 1], ["SP", 3, 20, 8, [4, 2], 1], ["SP", 3, 23, 3, [3, 1], 1], ["SP", 3, 26, 3, [3, 1], 1], ["RE", 3, [0, 5, 10, 15, 1, 6, 11, 16, 2, 7, 12, 17, 20, 23, 26, 21, 24, 27, 3, 8, 13, 18, 22, 25, 28, 4, 9, 14, 19]], ["FSP", 5, 0, 0, 3], ["FSP", 5, 4, 1, 3], ["FSP", 5, 8, 2, 3], ["FSP", 5, 12, 3, 3], ["RE", 5, [0, 4, 8, 12, 1, 5, 9, 13, 2, 6, 10, 14, 3, 7, 11, 15]], ["CA", 3, 5, 11], ["CHR", 2, "shared", [3]], ["CA", 3, 4, 14], ["CHR", 1, "shared", [4]], ["CA", 2, 5, 14], ["CI", 1], ["FU", 7, [0, 1, 2, 3]], ["AN", 7, 0, 5], ["FU", 7, [1, 2, 3, 4]], ["AN", 7, 1, 4], ["FU", 7, [2, 3, 4, 5]], ["AN", 7, 2, 6], ["FU", 4, [0, 1, 2, 3]], ["SP", 4, 0, 576, [3], 1], ["AN", 4, 1, 2], ["FFSP", 4, 0, [3, 2, 1, 0], 1, 1], ["AN", 4, 1, 6], ["FU", 2, [0, 1, 2, 3]], ["SP", 2, 0, 96, [1], 1], ["AN", 2, 1, 2], ["FFSP", 2, 0, [3, 2, 1, 0], 1, 1], ["AN", 2, 1, 6], ["PR", 5, 0, "auto_unroll_max_step$1024"]]]], "r": [[2.35733e-05, 2.35727e-05, 2.35962e-05, 2.36012e-05], 0, 5.32742, 1669741950], "v": "v0.6"}
{"i": [["[\"9a995a41bc2ff7cdadb96550380f7c85\", [21, 8, 32, 32], [8, 8, 3, 3], [1, 8, 1, 1], [21, 8, 32, 32]]", "cuda -keys=cuda,gpu -arch=sm_80 -max_num_threads=1024 -thread_warp_size=32", [-1, 16, 64, 49152, 2147483647, 1024, 8, 32], "", 0, []], [[], [["SP", 3, 0, 21, [1, 1, 1, 3], 1], ["SP", 3, 5, 8, [1, 4, 1, 1], 1], ["SP", 3, 10, 32, [1, 16, 1, 1], 1], ["SP", 3, 15, 32, [1, 2, 4, 2], 1], ["SP", 3, 20, 8, [4, 2], 1], ["SP", 3, 23, 3, [1, 1], 1], ["SP", 3, 26, 3, [1, 3], 1], ["RE", 3, [0, 5, 10, 15, 1, 6, 11, 16, 2, 7, 12, 17, 20, 23, 26, 21, 24, 27, 3, 8, 13, 18, 22, 25, 28, 4, 9, 14, 19]], ["FSP", 5, 0, 0, 3], ["FSP", 5, 4, 1, 3], ["FSP", 5, 8, 2, 3], ["FSP", 5, 12, 3, 3], ["RE", 5, [0, 4, 8, 12, 1, 5, 9, 13, 2, 6, 10, 14, 3, 7, 11, 15]], ["CA", 3, 5, 11], ["CHR", 2, "shared", [3]], ["CA", 3, 4, 14], ["CHR", 1, "shared", [4]], ["CA", 2, 5, 14], ["CI", 1], ["FU", 7, [0, 1, 2, 3]], ["AN", 7, 0, 5], ["FU", 7, [1, 2, 3, 4]], ["AN", 7, 1, 4], ["FU", 7, [2, 3, 4, 5]], ["AN", 7, 2, 6], ["FU", 4, [0, 1, 2, 3]], ["SP", 4, 0, 72, [1], 1], ["AN", 4, 1, 2], ["FFSP", 4, 0, [3, 2, 1, 0], 1, 1], ["AN", 4, 1, 6], ["FU", 2, [0, 1, 2, 3]], ["SP", 2, 0, 432, [1], 1], ["AN", 2, 1, 2], ["FFSP", 2, 0, [3, 2, 1, 0], 1, 1], ["AN", 2, 1, 6], ["PR", 5, 0, "auto_unroll_max_step$1024"]]]], "r": [[1.54008e-05, 1.53918e-05, 1.53908e-05, 1.54021e-05], 0, 4.03436, 1669741952], "v": "v0.6"}
{"i": [["[\"9a995a41bc2ff7cdadb96550380f7c85\", [21, 8, 32, 32], [8, 8, 3, 3], [1, 8, 1, 1], [21, 8, 32, 32]]", "cuda -keys=cuda,gpu -arch=sm_80 -max_num_threads=1024 -thread_warp_size=32", [-1, 16, 64, 49152, 2147483647, 1024, 8, 32], "", 0, []], [[], [["SP", 3, 0, 21, [3, 1, 7, 1], 1], ["SP", 3, 5, 8, [1, 4, 2, 1], 1], ["SP", 3, 10, 32, [1, 4, 2, 1], 1], ["SP", 3, 15, 32, [1, 16, 1, 1], 1], ["SP", 3, 20, 8, [2, 1], 1], ["SP", 3, 23, 3, [1, 1], 1], ["SP", 3, 26, 3, [3, 1], 1], ["RE", 3, [0, 5, 10, 15, 1, 6, 11, 16, 2, 7, 12, 17, 20, 23, 26, 21, 24, 27, 3, 8, 13, 18, 22, 25, 28, 4, 9, 14, 19]], ["FSP", 5, 0, 0, 3], ["FSP", 5, 4, 1, 3], ["FSP", 5, 8, 2, 3], ["FSP", 5, 12, 3, 3], ["RE", 5, [0, 4, 8, 12, 1, 5, 9, 13, 2, 6, 10, 14, 3, 7, 11, 15]], ["CA", 3, 5, 11], ["CHR", 2, "shared", [3]], ["CA", 3, 4, 14], ["CHR", 1, "shared", [4]], ["CA", 2, 5, 14], ["CI", 1], ["FU", 7, [0, 1, 2, 3]], ["AN", 7, 0, 5], ["FU", 7, [1, 2, 3, 4]], ["AN", 7, 1, 4], ["FU", 7, [2, 3, 4, 5]], ["AN", 7, 2, 6], ["FU", 4, [0, 1, 2, 3]], ["SP", 4, 0, 12, [12], 1], ["AN", 4, 1, 2], ["FFSP", 4, 0, [3, 2, 1, 0], 1, 1], ["AN", 4, 1, 6], ["FU", 2, [0, 1, 2, 3]], ["SP", 2, 0, 84, [1], 1], ["AN", 2, 1, 2], ["FFSP", 2, 0, [3, 2, 1, 0], 1, 1], ["AN", 2, 1, 6], ["PR", 5, 0, "auto_unroll_max_step$16"]]]], "r": [[0.000130426, 0.00013043, 0.000130435, 0.000130432], 0, 3.19853, 1669741955], "v": "v0.6"}
{"i": [["[\"9a995a41bc2ff7cdadb96550380f7c85\", [21, 8, 32, 32], [8, 8, 3, 3], [1, 8, 1, 1], [21, 8, 32, 32]]", "cuda -keys=cuda,gpu -arch=sm_80 -max_num_threads=1024 -thread_warp_size=32", [-1, 16, 64, 49152, 2147483647, 1024, 8, 32], "", 0, []], [[], [["SP", 3, 0, 21, [1, 21, 1, 1], 1], ["SP", 3, 5, 8, [1, 1, 1, 1], 1], ["SP", 3, 10, 32, [1, 2, 4, 1], 1], ["SP", 3, 15, 32, [1, 2, 1, 1], 1], ["SP", 3, 20, 8, [1, 4], 1], ["SP", 3, 23, 3, [1, 1], 1], ["SP", 3, 26, 3, [3, 1], 1], ["RE", 3, [0, 5, 10, 15, 1, 6, 11, 16, 2, 7, 12, 17, 20, 23, 26, 21, 24, 27, 3, 8, 13, 18, 22, 25, 28, 4, 9, 14, 19]], ["FSP", 5, 0, 0, 3], ["FSP", 5, 4, 1, 3], ["FSP", 5, 8, 2, 3], ["FSP", 5, 12, 3, 3], ["RE", 5, [0, 4, 8, 12, 1, 5, 9, 13, 2, 6, 10, 14, 3, 7, 11, 15]], ["CA", 3, 5, 11], ["CHR", 2, "shared", [3]], ["CA", 3, 4, 14], ["CHR", 1, "shared", [4]], ["CA", 2, 5, 14], ["CI", 1], ["FU", 7, [0, 1, 2, 3]], ["AN", 7, 0, 5], ["FU", 7, [1, 2, 3, 4]], ["AN", 7, 1, 4], ["FU", 7, [2, 3, 4, 5]], ["AN", 7, 2, 6], ["FU", 4, [0, 1, 2, 3]], ["SP", 4, 0, 12, [1], 1], ["AN", 4, 1, 2], ["FFSP", 4, 0, [3, 2, 1, 0], 1, 1], ["AN", 4, 1, 6], ["FU", 2, [0, 1, 2, 3]], ["SP", 2, 0, 12, [1], 1], ["AN", 2, 1, 2], ["FFSP", 2, 0, [3, 2, 1, 0], 1, 1], ["AN", 2, 1, 6], ["PR", 5, 0, "auto_unroll_max_step$64"]]]], "r": [[5.29473e-05, 5.2943e-05, 5.29431e-05, 5.29475e-05], 0, 3.52077, 1669741958], "v": "v0.6"}
{"i": [["[\"9a995a41bc2ff7cdadb96550380f7c85\", [21, 8, 32, 32], [8, 8, 3, 3], [1, 8, 1, 1], [21, 8, 32, 32]]", "cuda -keys=cuda,gpu -arch=sm_80 -max_num_threads=1024 -thread_warp_size=32", [-1, 16, 64, 49152, 2147483647, 1024, 8, 32], "", 0, []], [[], [["SP", 3, 0, 21, [1, 21, 1, 1], 1], ["SP", 3, 5, 8, [1, 2, 1, 2], 1], ["SP", 3, 10, 32, [1, 1, 4, 8], 1], ["SP", 3, 15, 32, [4, 1, 4, 1], 1], ["SP", 3, 20, 8, [1, 1], 1], ["SP", 3, 23, 3, [3, 1], 1], ["SP", 3, 26, 3, [1, 1], 1], ["RE", 3, [0, 5, 10, 15, 1, 6, 11, 16, 2, 7, 12, 17, 20, 23, 26, 21, 24, 27, 3, 8, 13, 18, 22, 25, 28, 4, 9, 14, 19]], ["FSP", 5, 0, 0, 3], ["FSP", 5, 4, 1, 3], ["FSP", 5, 8, 2, 3], ["FSP", 5, 12, 3, 3], ["RE", 5, [0, 4, 8, 12, 1, 5, 9, 13, 2, 6, 10, 14, 3, 7, 11, 15]], ["CA", 3, 5, 11], ["CHR", 2, "shared", [3]], ["CA", 3, 4, 14], ["CHR", 1, "shared", [4]], ["CA", 2, 5, 14], ["CI", 1], ["FU", 7, [0, 1, 2, 3]], ["AN", 7, 0, 5], ["FU", 7, [1, 2, 3, 4]], ["AN", 7, 1, 4], ["FU", 7, [2, 3, 4, 5]], ["AN", 7, 2, 6], ["FU", 4, [0, 1, 2, 3]], ["SP", 4, 0, 6, [1], 1], ["AN", 4, 1, 2], ["FFSP", 4, 0, [3, 2, 1, 0], 1, 1], ["AN", 4, 1, 6], ["FU", 2, [0, 1, 2, 3]], ["SP", 2, 0, 136, [1], 1], ["AN", 2, 1, 2], ["FFSP", 2, 0, [3, 2, 1, 0], 1, 1], ["AN", 2, 1, 6], ["PR", 5, 0, "auto_unroll_max_step$0"]]]], "r": [[0.00279553, 0.00279458, 0.00279542, 0.00279103], 0, 3.00851, 1669741959], "v": "v0.6"}
{"i": [["[\"9a995a41bc2ff7cdadb96550380f7c85\", [21, 8, 32, 32], [8, 8, 3, 3], [1, 8, 1, 1], [21, 8, 32, 32]]", "cuda -keys=cuda,gpu -arch=sm_80 -max_num_threads=1024 -thread_warp_size=32", [-1, 16, 64, 49152, 2147483647, 1024, 8, 32], "", 0, []], [[], [["SP", 3, 0, 21, [1, 21, 1, 1], 1], ["SP", 3, 5, 8, [4, 1, 2, 1], 1], ["SP", 3, 10, 32, [1, 1, 4, 2], 1], ["SP", 3, 15, 32, [1, 4, 2, 2], 1], ["SP", 3, 20, 8, [1, 2], 1], ["SP", 3, 23, 3, [1, 3], 1], ["SP", 3, 26, 3, [3, 1], 1], ["RE", 3, [0, 5, 10, 15, 1, 6, 11, 16, 2, 7, 12, 17, 20, 23, 26, 21, 24, 27, 3, 8, 13, 18, 22, 25, 28, 4, 9, 14, 19]], ["FSP", 5, 0, 0, 3], ["FSP", 5, 4, 1, 3], ["FSP", 5, 8, 2, 3], ["FSP", 5, 12, 3, 3], ["RE", 5, [0, 4, 8, 12, 1, 5, 9, 13, 2, 6, 10, 14, 3, 7, 11, 15]], ["CA", 3, 5, 11], ["CHR", 2, "shared", [3]], ["CA", 3, 4, 14], ["CHR", 1, "shared", [4]], ["CA", 2, 5, 14], ["CI", 1], ["FU", 7, [0, 1, 2, 3]], ["AN", 7, 0, 5], ["FU", 7, [1, 2, 3, 4]], ["AN", 7, 1, 4], ["FU", 7, [2, 3, 4, 5]], ["AN", 7, 2, 6], ["FU", 4, [0, 1, 2, 3]], ["SP", 4, 0, 36, [1], 1], ["AN", 4, 1, 2], ["FFSP", 4, 0, [3, 2, 1, 0], 1, 1], ["AN", 4, 1, 6], ["FU", 2, [0, 1, 2, 3]], ["SP", 2, 0, 120, [1], 1], ["AN", 2, 1, 2], ["FFSP", 2, 0, [3, 2, 1, 0], 1, 1], ["AN", 2, 1, 6], ["PR", 5, 0, "auto_unroll_max_step$64"]]]], "r": [[0.000185176, 0.000185192, 0.000185229, 0.00018521], 0, 3.86476, 1669741962], "v": "v0.6"}
{"i": [["[\"9a995a41bc2ff7cdadb96550380f7c85\", [21, 8, 32, 32], [8, 8, 3, 3], [1, 8, 1, 1], [21, 8, 32, 32]]", "cuda -keys=cuda,gpu -arch=sm_80 -max_num_threads=1024 -thread_warp_size=32", [-1, 16, 64, 49152, 2147483647, 1024, 8, 32], "", 0, []], [[], [["SP", 3, 0, 21, [3, 1, 1, 1], 1], ["SP", 3, 5, 8, [1, 4, 1, 1], 1], ["SP", 3, 10, 32, [1, 4, 2, 2], 1], ["SP", 3, 15, 32, [1, 2, 2, 2], 1], ["SP", 3, 20, 8, [1, 2], 1], ["SP", 3, 23, 3, [1, 1], 1], ["SP", 3, 26, 3, [1, 1], 1], ["RE", 3, [0, 5, 10, 15, 1, 6, 11, 16, 2, 7, 12, 17, 20, 23, 26, 21, 24, 27, 3, 8, 13, 18, 22, 25, 28, 4, 9, 14, 19]], ["FSP", 5, 0, 0, 3], ["FSP", 5, 4, 1, 3], ["FSP", 5, 8, 2, 3], ["FSP", 5, 12, 3, 3], ["RE", 5, [0, 4, 8, 12, 1, 5, 9, 13, 2, 6, 10, 14, 3, 7, 11, 15]], ["CA", 3, 5, 11], ["CHR", 2, "shared", [3]], ["CA", 3, 4, 14], ["CHR", 1, "shared", [4]], ["CA", 2, 5, 14], ["CI", 1], ["FU", 7, [0, 1, 2, 3]], ["AN", 7, 0, 5], ["FU", 7, [1, 2, 3, 4]], ["AN", 7, 1, 4], ["FU", 7, [2, 3, 4, 5]], ["AN", 7, 2, 6], ["FU", 4, [0, 1, 2, 3]], ["SP", 4, 0, 4, [1], 1], ["AN", 4, 1, 2], ["FFSP", 4, 0, [3, 2, 1, 0], 1, 1], ["AN", 4, 1, 6], ["FU", 2, [0, 1, 2, 3]], ["SP", 2, 0, 32, [1], 1], ["AN", 2, 1, 2], ["FFSP", 2, 0, [3, 2, 1, 0], 1, 1], ["AN", 2, 1, 6], ["PR", 5, 0, "auto_unroll_max_step$0"]]]], "r": [[3.71488e-05, 3.7144e-05, 3.7154e-05, 3.71544e-05], 0, 3.26798, 1669741965], "v": "v0.6"}
{"i": [["[\"9a995a41bc2ff7cdadb96550380f7c85\", [21, 8, 32, 32], [8, 8, 3, 3], [1, 8, 1, 1], [21, 8, 32, 32]]", "cuda -keys=cuda,gpu -arch=sm_80 -max_num_threads=1024 -thread_warp_size=32", [-1, 16, 64, 49152, 2147483647, 1024, 8, 32], "", 0, []], [[], [["SP", 3, 0, 21, [1, 7, 1, 3], 1], ["SP", 3, 5, 8, [1, 2, 2, 1], 1], ["SP", 3, 10, 32, [1, 1, 2, 2], 1], ["SP", 3, 15, 32, [2, 8, 1, 2], 1], ["SP", 3, 20, 8, [2, 2], 1], ["SP", 3, 23, 3, [1, 1], 1], ["SP", 3, 26, 3, [3, 1], 1], ["RE", 3, [0, 5, 10, 15, 1, 6, 11, 16, 2, 7, 12, 17, 20, 23, 26, 21, 24, 27, 3, 8, 13, 18, 22, 25, 28, 4, 9, 14, 19]], ["FSP", 5, 0, 0, 3], ["FSP", 5, 4, 1, 3], ["FSP", 5, 8, 2, 3], ["FSP", 5, 12, 3, 3], ["RE", 5, [0, 4, 8, 12, 1, 5, 9, 13, 2, 6, 10, 14, 3, 7, 11, 15]], ["CA", 3, 5, 11], ["CHR", 2, "shared", [3]], ["CA", 3, 4, 14], ["CHR", 1, "shared", [4]], ["CA", 2, 5, 14], ["CI", 1], ["FU", 7, [0, 1, 2, 3]], ["AN", 7, 0, 5], ["FU", 7, [1, 2, 3, 4]], ["AN", 7, 1, 4], ["FU", 7, [2, 3, 4, 5]], ["AN", 7, 2, 6], ["FU", 4, [0, 1, 2, 3]], ["SP", 4, 0, 12, [3], 1], ["AN", 4, 1, 2], ["FFSP", 4, 0, [3, 2, 1, 0], 1, 1], ["AN", 4, 1, 6], ["FU", 2, [0, 1, 2, 3]], ["SP", 2, 0, 96, [32], 1], ["AN", 2, 1, 2], ["FFSP", 2, 0, [3, 2, 1, 0], 1, 1], ["AN", 2, 1, 6], ["PR", 5, 0, "auto_unroll_max_step$512"]]]], "r": [[8.823e-05, 8.81962e-05, 8.8191e-05, 8.83254e-05], 0, 5.37473, 1669741967], "v": "v0.6"}
{"i": [["[\"9a995a41bc2ff7cdadb96550380f7c85\", [21, 8, 32, 32], [8, 8, 3, 3], [1, 8, 1, 1], [21, 8, 32, 32]]", "cuda -keys=cuda,gpu -arch=sm_80 -max_num_threads=1024 -thread_warp_size=32", [-1, 16, 64, 49152, 2147483647, 1024, 8, 32], "", 0, []], [[], [["SP", 3, 0, 21, [1, 7, 1, 1], 1], ["SP", 3, 5, 8, [2, 2, 1, 1], 1], ["SP", 3, 10, 32, [2, 2, 4, 2], 1], ["SP", 3, 15, 32, [1, 4, 1, 1], 1], ["SP", 3, 20, 8, [2, 4], 1], ["SP", 3, 23, 3, [1, 1], 1], ["SP", 3, 26, 3, [3, 1], 1], ["RE", 3, [0, 5, 10, 15, 1, 6, 11, 16, 2, 7, 12, 17, 20, 23, 26, 21, 24, 27, 3, 8, 13, 18, 22, 25, 28, 4, 9, 14, 19]], ["FSP", 5, 0, 0, 3], ["FSP", 5, 4, 1, 3], ["FSP", 5, 8, 2, 3], ["FSP", 5, 12, 3, 3], ["RE", 5, [0, 4, 8, 12, 1, 5, 9, 13, 2, 6, 10, 14, 3, 7, 11, 15]], ["CA", 3, 5, 11], ["CHR", 2, "shared", [3]], ["CA", 3, 4, 14], ["CHR", 1, "shared", [4]], ["CA", 2, 5, 14], ["CI", 1], ["FU", 7, [0, 1, 2, 3]], ["AN", 7, 0, 5], ["FU", 7, [1, 2, 3, 4]], ["AN", 7, 1, 4], ["FU", 7, [2, 3, 4, 5]], ["AN", 7, 2, 6], ["FU", 4, [0, 1, 2, 3]], ["SP", 4, 0, 24, [1], 1], ["AN", 4, 1, 2], ["FFSP", 4, 0, [3, 2, 1, 0], 1, 1], ["AN", 4, 1, 6], ["FU", 2, [0, 1, 2, 3]], ["SP", 2, 0, 192, [32], 1], ["AN", 2, 1, 2], ["FFSP", 2, 0, [3, 2, 1, 0], 1, 1], ["AN", 2, 1, 6], ["PR", 5, 0, "auto_unroll_max_step$512"]]]], "r": [[5.21865e-05, 5.21797e-05, 5.21914e-05, 5.21855e-05], 0, 4.6503, 1669741970], "v": "v0.6"}
{"i": [["[\"9a995a41bc2ff7cdadb96550380f7c85\", [21, 8, 32, 32], [8, 8, 3, 3], [1, 8, 1, 1], [21, 8, 32, 32]]", "cuda -keys=cuda,gpu -arch=sm_80 -max_num_threads=1024 -thread_warp_size=32", [-1, 16, 64, 49152, 2147483647, 1024, 8, 32], "", 0, []], [[], [["SP", 3, 0, 21, [3, 1, 7, 1], 1], ["SP", 3, 5, 8, [1, 8, 1, 1], 1], ["SP", 3, 10, 32, [4, 2, 4, 1], 1], ["SP", 3, 15, 32, [1, 2, 2, 1], 1], ["SP", 3, 20, 8, [2, 1], 1], ["SP", 3, 23, 3, [3, 1], 1], ["SP", 3, 26, 3, [3, 1], 1], ["RE", 3, [0, 5, 10, 15, 1, 6, 11, 16, 2, 7, 12, 17, 20, 23, 26, 21, 24, 27, 3, 8, 13, 18, 22, 25, 28, 4, 9, 14, 19]], ["FSP", 5, 0, 0, 3], ["FSP", 5, 4, 1, 3], ["FSP", 5, 8, 2, 3], ["FSP", 5, 12, 3, 3], ["RE", 5, [0, 4, 8, 12, 1, 5, 9, 13, 2, 6, 10, 14, 3, 7, 11, 15]], ["CA", 3, 5, 11], ["CHR", 2, "shared", [3]], ["CA", 3, 4, 14], ["CHR", 1, "shared", [4]], ["CA", 2, 5, 14], ["CI", 1], ["FU", 7, [0, 1, 2, 3]], ["AN", 7, 0, 5], ["FU", 7, [1, 2, 3, 4]], ["AN", 7, 1, 4], ["FU", 7, [2, 3, 4, 5]], ["AN", 7, 2, 6], ["FU", 4, [0, 1, 2, 3]], ["SP", 4, 0, 18, [1], 1], ["AN", 4, 1, 2], ["FFSP", 4, 0, [3, 2, 1, 0], 1, 1], ["AN", 4, 1, 6], ["FU", 2, [0, 1, 2, 3]], ["SP", 2, 0, 560, [1], 1], ["AN", 2, 1, 2], ["FFSP", 2, 0, [3, 2, 1, 0], 1, 1], ["AN", 2, 1, 6], ["PR", 5, 0, "auto_unroll_max_step$512"]]]], "r": [[0.00105816, 0.00105826, 0.00105775, 0.0010563], 0, 8.61902, 1669741973], "v": "v0.6"}
{"i": [["[\"9a995a41bc2ff7cdadb96550380f7c85\", [21, 8, 32, 32], [8, 8, 3, 3], [1, 8, 1, 1], [21, 8, 32, 32]]", "cuda -keys=cuda,gpu -arch=sm_80 -max_num_threads=1024 -thread_warp_size=32", [-1, 16, 64, 49152, 2147483647, 1024, 8, 32], "", 0, []], [[], [["SP", 3, 0, 21, [1, 1, 1, 1], 1], ["SP", 3, 5, 8, [2, 2, 2, 1], 1], ["SP", 3, 10, 32, [1, 8, 2, 2], 1], ["SP", 3, 15, 32, [4, 2, 4, 1], 1], ["SP", 3, 20, 8, [4, 2], 1], ["SP", 3, 23, 3, [1, 3], 1], ["SP", 3, 26, 3, [3, 1], 1], ["RE", 3, [0, 5, 10, 15, 1, 6, 11, 16, 2, 7, 12, 17, 20, 23, 26, 21, 24, 27, 3, 8, 13, 18, 22, 25, 28, 4, 9, 14, 19]], ["FSP", 5, 0, 0, 3], ["FSP", 5, 4, 1, 3], ["FSP", 5, 8, 2, 3], ["FSP", 5, 12, 3, 3], ["RE", 5, [0, 4, 8, 12, 1, 5, 9, 13, 2, 6, 10, 14, 3, 7, 11, 15]], ["CA", 3, 5, 11], ["CHR", 2, "shared", [3]], ["CA", 3, 4, 14], ["CHR", 1, "shared", [4]], ["CA", 2, 5, 14], ["CI", 1], ["FU", 7, [0, 1, 2, 3]], ["AN", 7, 0, 5], ["FU", 7, [1, 2, 3, 4]], ["AN", 7, 1, 4], ["FU", 7, [2, 3, 4, 5]], ["AN", 7, 2, 6], ["FU", 4, [0, 1, 2, 3]], ["SP", 4, 0, 48, [1], 1], ["AN", 4, 1, 2], ["FFSP", 4, 0, [3, 2, 1, 0], 1, 1], ["AN", 4, 1, 6], ["FU", 2, [0, 1, 2, 3]], ["SP", 2, 0, 192, [48], 1], ["AN", 2, 1, 2], ["FFSP", 2, 0, [3, 2, 1, 0], 1, 1], ["AN", 2, 1, 6], ["PR", 5, 0, "auto_unroll_max_step$512"]]]], "r": [[0.000129822, 0.000129472, 0.000129736, 0.000129963], 0, 10.1434, 1669741976], "v": "v0.6"}
{"i": [["[\"9a995a41bc2ff7cdadb96550380f7c85\", [21, 8, 32, 32], [8, 8, 3, 3], [1, 8, 1, 1], [21, 8, 32, 32]]", "cuda -keys=cuda,gpu -arch=sm_80 -max_num_threads=1024 -thread_warp_size=32", [-1, 16, 64, 49152, 2147483647, 1024, 8, 32], "", 0, []], [[], [["SP", 3, 0, 21, [1, 1, 7, 1], 1], ["SP", 3, 5, 8, [1, 8, 1, 1], 1], ["SP", 3, 10, 32, [1, 1, 2, 4], 1], ["SP", 3, 15, 32, [1, 1, 16, 2], 1], ["SP", 3, 20, 8, [1, 4], 1], ["SP", 3, 23, 3, [1, 3], 1], ["SP", 3, 26, 3, [3, 1], 1], ["RE", 3, [0, 5, 10, 15, 1, 6, 11, 16, 2, 7, 12, 17, 20, 23, 26, 21, 24, 27, 3, 8, 13, 18, 22, 25, 28, 4, 9, 14, 19]], ["FSP", 5, 0, 0, 3], ["FSP", 5, 4, 1, 3], ["FSP", 5, 8, 2, 3], ["FSP", 5, 12, 3, 3], ["RE", 5, [0, 4, 8, 12, 1, 5, 9, 13, 2, 6, 10, 14, 3, 7, 11, 15]], ["CA", 3, 5, 11], ["CHR", 2, "shared", [3]], ["CA", 3, 4, 14], ["CHR", 1, "shared", [4]], ["CA", 2, 5, 14], ["CI", 1], ["FU", 7, [0, 1, 2, 3]], ["AN", 7, 0, 5], ["FU", 7, [1, 2, 3, 4]], ["AN", 7, 1, 4], ["FU", 7, [2, 3, 4, 5]], ["AN", 7, 2, 6], ["FU", 4, [0, 1, 2, 3]], ["SP", 4, 0, 36, [1], 1], ["AN", 4, 1, 2], ["FFSP", 4, 0, [3, 2, 1, 0], 1, 1], ["AN", 4, 1, 6], ["FU", 2, [0, 1, 2, 3]], ["SP", 2, 0, 3808, [1], 1], ["AN", 2, 1, 2], ["FFSP", 2, 0, [3, 2, 1, 0], 1, 1], ["AN", 2, 1, 6], ["PR", 5, 0, "auto_unroll_max_step$512"]]]], "r": [[0.00110517, 0.00110521, 0.00110515, 0.00110515], 0, 4.28649, 1669741978], "v": "v0.6"}
{"i": [["[\"9a995a41bc2ff7cdadb96550380f7c85\", [21, 8, 32, 32], [8, 8, 3, 3], [1, 8, 1, 1], [21, 8, 32, 32]]", "cuda -keys=cuda,gpu -arch=sm_80 -max_num_threads=1024 -thread_warp_size=32", [-1, 16, 64, 49152, 2147483647, 1024, 8, 32], "", 0, []], [[], [["SP", 3, 0, 21, [1, 3, 1, 7], 1], ["SP", 3, 5, 8, [1, 2, 2, 2], 1], ["SP", 3, 10, 32, [2, 8, 2, 1], 1], ["SP", 3, 15, 32, [1, 1, 1, 2], 1], ["SP", 3, 20, 8, [1, 4], 1], ["SP", 3, 23, 3, [3, 1], 1], ["SP", 3, 26, 3, [3, 1], 1], ["RE", 3, [0, 5, 10, 15, 1, 6, 11, 16, 2, 7, 12, 17, 20, 23, 26, 21, 24, 27, 3, 8, 13, 18, 22, 25, 28, 4, 9, 14, 19]], ["FSP", 5, 0, 0, 3], ["FSP", 5, 4, 1, 3], ["FSP", 5, 8, 2, 3], ["FSP", 5, 12, 3, 3], ["RE", 5, [0, 4, 8, 12, 1, 5, 9, 13, 2, 6, 10, 14, 3, 7, 11, 15]], ["CA", 3, 5, 11], ["CHR", 2, "shared", [3]], ["CA", 3, 4, 14], ["CHR", 1, "shared", [4]], ["CA", 2, 5, 14], ["CI", 1], ["FU", 7, [0, 1, 2, 3]], ["AN", 7, 0, 5], ["FU", 7, [1, 2, 3, 4]], ["AN", 7, 1, 4], ["FU", 7, [2, 3, 4, 5]], ["AN", 7, 2, 6], ["FU", 4, [0, 1, 2, 3]], ["SP", 4, 0, 72, [1], 1], ["AN", 4, 1, 2], ["FFSP", 4, 0, [3, 2, 1, 0], 1, 1], ["AN", 4, 1, 6], ["FU", 2, [0, 1, 2, 3]], ["SP", 2, 0, 224, [14], 1], ["AN", 2, 1, 2], ["FFSP", 2, 0, [3, 2, 1, 0], 1, 1], ["AN", 2, 1, 6], ["PR", 5, 0, "auto_unroll_max_step$0"]]]], "r": [[9.79549e-05, 9.77891e-05, 9.77923e-05, 9.77821e-05], 0, 4.06716, 1669741981], "v": "v0.6"}
{"i": [["[\"9a995a41bc2ff7cdadb96550380f7c85\", [21, 8, 32, 32], [8, 8, 3, 3], [1, 8, 1, 1], [21, 8, 32, 32]]", "cuda -keys=cuda,gpu -arch=sm_80 -max_num_threads=1024 -thread_warp_size=32", [-1, 16, 64, 49152, 2147483647, 1024, 8, 32], "", 0, []], [[], [["SP", 3, 0, 21, [1, 1, 1, 1], 1], ["SP", 3, 5, 8, [2, 4, 1, 1], 1], ["SP", 3, 10, 32, [1, 16, 1, 2], 1], ["SP", 3, 15, 32, [1, 1, 16, 1], 1], ["SP", 3, 20, 8, [2, 1], 1], ["SP", 3, 23, 3, [1, 1], 1], ["SP", 3, 26, 3, [1, 1], 1], ["RE", 3, [0, 5, 10, 15, 1, 6, 11, 16, 2, 7, 12, 17, 20, 23, 26, 21, 24, 27, 3, 8, 13, 18, 22, 25, 28, 4, 9, 14, 19]], ["FSP", 5, 0, 0, 3], ["FSP", 5, 4, 1, 3], ["FSP", 5, 8, 2, 3], ["FSP", 5, 12, 3, 3], ["RE", 5, [0, 4, 8, 12, 1, 5, 9, 13, 2, 6, 10, 14, 3, 7, 11, 15]], ["CA", 3, 5, 11], ["CHR", 2, "shared", [3]], ["CA", 3, 4, 14], ["CHR", 1, "shared", [4]], ["CA", 2, 5, 14], ["CI", 1], ["FU", 7, [0, 1, 2, 3]], ["AN", 7, 0, 5], ["FU", 7, [1, 2, 3, 4]], ["AN", 7, 1, 4], ["FU", 7, [2, 3, 4, 5]], ["AN", 7, 2, 6], ["FU", 4, [0, 1, 2, 3]], ["SP", 4, 0, 2, [1], 1], ["AN", 4, 1, 2], ["FFSP", 4, 0, [3, 2, 1, 0], 1, 1], ["AN", 4, 1, 6], ["FU", 2, [0, 1, 2, 3]], ["SP", 2, 0, 224, [1], 1], ["AN", 2, 1, 2], ["FFSP", 2, 0, [3, 2, 1, 0], 1, 1], ["AN", 2, 1, 6], ["PR", 5, 0, "auto_unroll_max_step$1024"]]]], "r": [[4.08362e-05, 4.0835e-05, 4.08349e-05, 4.08372e-05], 0, 3.5761, 1669741984], "v": "v0.6"}
{"i": [["[\"9a995a41bc2ff7cdadb96550380f7c85\", [21, 8, 32, 32], [8, 8, 3, 3], [1, 8, 1, 1], [21, 8, 32, 32]]", "cuda -keys=cuda,gpu -arch=sm_80 -max_num_threads=1024 -thread_warp_size=32", [-1, 16, 64, 49152, 2147483647, 1024, 8, 32], "", 0, []], [[], [["SP", 3, 0, 21, [1, 1, 7, 1], 1], ["SP", 3, 5, 8, [2, 2, 1, 1], 1], ["SP", 3, 10, 32, [1, 8, 1, 4], 1], ["SP", 3, 15, 32, [2, 2, 2, 2], 1], ["SP", 3, 20, 8, [2, 1], 1], ["SP", 3, 23, 3, [1, 3], 1], ["SP", 3, 26, 3, [3, 1], 1], ["RE", 3, [0, 5, 10, 15, 1, 6, 11, 16, 2, 7, 12, 17, 20, 23, 26, 21, 24, 27, 3, 8, 13, 18, 22, 25, 28, 4, 9, 14, 19]], ["FSP", 5, 0, 0, 3], ["FSP", 5, 4, 1, 3], ["FSP", 5, 8, 2, 3], ["FSP", 5, 12, 3, 3], ["RE", 5, [0, 4, 8, 12, 1, 5, 9, 13, 2, 6, 10, 14, 3, 7, 11, 15]], ["CA", 3, 5, 11], ["CHR", 2, "shared", [3]], ["CA", 3, 4, 14], ["CHR", 1, "shared", [4]], ["CA", 2, 5, 14], ["CI", 1], ["FU", 7, [0, 1, 2, 3]], ["AN", 7, 0, 5], ["FU", 7, [1, 2, 3, 4]], ["AN", 7, 1, 4], ["FU", 7, [2, 3, 4, 5]], ["AN", 7, 2, 6], ["FU", 4, [0, 1, 2, 3]], ["SP", 4, 0, 36, [1], 1], ["AN", 4, 1, 2], ["FFSP", 4, 0, [3, 2, 1, 0], 1, 1], ["AN", 4, 1, 6], ["FU", 2, [0, 1, 2, 3]], ["SP", 2, 0, 672, [1], 1], ["AN", 2, 1, 2], ["FFSP", 2, 0, [3, 2, 1, 0], 1, 1], ["AN", 2, 1, 6], ["PR", 5, 0, "auto_unroll_max_step$1024"]]]], "r": [[0.000214554, 0.000214553, 0.000214562, 0.000214553], 0, 9.2377, 1669741986], "v": "v0.6"}
{"i": [["[\"9a995a41bc2ff7cdadb96550380f7c85\", [21, 8, 32, 32], [8, 8, 3, 3], [1, 8, 1, 1], [21, 8, 32, 32]]", "cuda -keys=cuda,gpu -arch=sm_80 -max_num_threads=1024 -thread_warp_size=32", [-1, 16, 64, 49152, 2147483647, 1024, 8, 32], "", 0, []], [[], [["SP", 3, 0, 21, [1, 1, 1, 3], 1], ["SP", 3, 5, 8, [4, 1, 1, 2], 1], ["SP", 3, 10, 32, [2, 4, 2, 1], 1], ["SP", 3, 15, 32, [1, 4, 1, 1], 1], ["SP", 3, 20, 8, [4, 2], 1], ["SP", 3, 23, 3, [1, 3], 1], ["SP", 3, 26, 3, [3, 1], 1], ["RE", 3, [0, 5, 10, 15, 1, 6, 11, 16, 2, 7, 12, 17, 20, 23, 26, 21, 24, 27, 3, 8, 13, 18, 22, 25, 28, 4, 9, 14, 19]], ["FSP", 5, 0, 0, 3], ["FSP", 5, 4, 1, 3], ["FSP", 5, 8, 2, 3], ["FSP", 5, 12, 3, 3], ["RE", 5, [0, 4, 8, 12, 1, 5, 9, 13, 2, 6, 10, 14, 3, 7, 11, 15]], ["CA", 3, 5, 11], ["CHR", 2, "shared", [3]], ["CA", 3, 4, 14], ["CHR", 1, "shared", [4]], ["CA", 2, 5, 14], ["CI", 1], ["FU", 7, [0, 1, 2, 3]], ["AN", 7, 0, 5], ["FU", 7, [1, 2, 3, 4]], ["AN", 7, 1, 4], ["FU", 7, [2, 3, 4, 5]], ["AN", 7, 2, 6], ["FU", 4, [0, 1, 2, 3]], ["SP", 4, 0, 288, [24], 1], ["AN", 4, 1, 2], ["FFSP", 4, 0, [3, 2, 1, 0], 1, 1], ["AN", 4, 1, 6], ["FU", 2, [0, 1, 2, 3]], ["SP", 2, 0, 96, [1], 1], ["AN", 2, 1, 2], ["FFSP", 2, 0, [3, 2, 1, 0], 1, 1], ["AN", 2, 1, 6], ["PR", 5, 0, "auto_unroll_max_step$64"]]]], "r": [[6.17795e-05, 6.1778e-05, 6.17668e-05, 6.1783e-05], 0, 3.45498, 1669741989], "v": "v0.6"}
{"i": [["[\"9a995a41bc2ff7cdadb96550380f7c85\", [21, 8, 32, 32], [8, 8, 3, 3], [1, 8, 1, 1], [21, 8, 32, 32]]", "cuda -keys=cuda,gpu -arch=sm_80 -max_num_threads=1024 -thread_warp_size=32", [-1, 16, 64, 49152, 2147483647, 1024, 8, 32], "", 0, []], [[], [["SP", 3, 0, 21, [1, 3, 1, 7], 1], ["SP", 3, 5, 8, [2, 2, 2, 1], 1], ["SP", 3, 10, 32, [2, 2, 1, 8], 1], ["SP", 3, 15, 32, [1, 1, 8, 1], 1], ["SP", 3, 20, 8, [1, 1], 1], ["SP", 3, 23, 3, [3, 1], 1], ["SP", 3, 26, 3, [1, 1], 1], ["RE", 3, [0, 5, 10, 15, 1, 6, 11, 16, 2, 7, 12, 17, 20, 23, 26, 21, 24, 27, 3, 8, 13, 18, 22, 25, 28, 4, 9, 14, 19]], ["FSP", 5, 0, 0, 3], ["FSP", 5, 4, 1, 3], ["FSP", 5, 8, 2, 3], ["FSP", 5, 12, 3, 3], ["RE", 5, [0, 4, 8, 12, 1, 5, 9, 13, 2, 6, 10, 14, 3, 7, 11, 15]], ["CA", 3, 5, 11], ["CHR", 2, "shared", [3]], ["CA", 3, 4, 14], ["CHR", 1, "shared", [4]], ["CA", 2, 5, 14], ["CI", 1], ["FU", 7, [0, 1, 2, 3]], ["AN", 7, 0, 5], ["FU", 7, [1, 2, 3, 4]], ["AN", 7, 1, 4], ["FU", 7, [2, 3, 4, 5]], ["AN", 7, 2, 6], ["FU", 4, [0, 1, 2, 3]], ["SP", 4, 0, 2, [1], 1], ["AN", 4, 1, 2], ["FFSP", 4, 0, [3, 2, 1, 0], 1, 1], ["AN", 4, 1, 6], ["FU", 2, [0, 1, 2, 3]], ["SP", 2, 0, 112, [1], 1], ["AN", 2, 1, 2], ["FFSP", 2, 0, [3, 2, 1, 0], 1, 1], ["AN", 2, 1, 6], ["PR", 5, 0, "auto_unroll_max_step$0"]]]], "r": [[0.0034285, 0.00342976, 0.0034302, 0.00342821], 0, 4.50172, 1669741992], "v": "v0.6"}
{"i": [["[\"9a995a41bc2ff7cdadb96550380f7c85\", [21, 8, 32, 32], [8, 8, 3, 3], [1, 8, 1, 1], [21, 8, 32, 32]]", "cuda -keys=cuda,gpu -arch=sm_80 -max_num_threads=1024 -thread_warp_size=32", [-1, 16, 64, 49152, 2147483647, 1024, 8, 32], "", 0, []], [[], [["SP", 3, 0, 21, [1, 21, 1, 1], 1], ["SP", 3, 5, 8, [1, 1, 2, 1], 1], ["SP", 3, 10, 32, [2, 1, 1, 8], 1], ["SP", 3, 15, 32, [4, 1, 1, 1], 1], ["SP", 3, 20, 8, [1, 2], 1], ["SP", 3, 23, 3, [1, 1], 1], ["SP", 3, 26, 3, [1, 3], 1], ["RE", 3, [0, 5, 10, 15, 1, 6, 11, 16, 2, 7, 12, 17, 20, 23, 26, 21, 24, 27, 3, 8, 13, 18, 22, 25, 28, 4, 9, 14, 19]], ["FSP", 5, 0, 0, 3], ["FSP", 5, 4, 1, 3], ["FSP", 5, 8, 2, 3], ["FSP", 5, 12, 3, 3], ["RE", 5, [0, 4, 8, 12, 1, 5, 9, 13, 2, 6, 10, 14, 3, 7, 11, 15]], ["CA", 3, 5, 11], ["CHR", 2, "shared", [3]], ["CA", 3, 4, 14], ["CHR", 1, "shared", [4]], ["CA", 2, 5, 14], ["CI", 1], ["FU", 7, [0, 1, 2, 3]], ["AN", 7, 0, 5], ["FU", 7, [1, 2, 3, 4]], ["AN", 7, 1, 4], ["FU", 7, [2, 3, 4, 5]], ["AN", 7, 2, 6], ["FU", 4, [0, 1, 2, 3]], ["SP", 4, 0, 12, [12], 1], ["AN", 4, 1, 2], ["FFSP", 4, 0, [3, 2, 1, 0], 1, 1], ["AN", 4, 1, 6], ["FU", 2, [0, 1, 2, 3]], ["SP", 2, 0, 48, [8], 1], ["AN", 2, 1, 2], ["FFSP", 2, 0, [3, 2, 1, 0], 1, 1], ["AN", 2, 1, 6], ["PR", 5, 0, "auto_unroll_max_step$0"]]]], "r": [[0.000166369, 0.000166369, 0.000166373, 0.000166371], 0, 3.39678, 1669741995], "v": "v0.6"}
{"i": [["[\"9a995a41bc2ff7cdadb96550380f7c85\", [21, 8, 32, 32], [8, 8, 3, 3], [1, 8, 1, 1], [21, 8, 32, 32]]", "cuda -keys=cuda,gpu -arch=sm_80 -max_num_threads=1024 -thread_warp_size=32", [-1, 16, 64, 49152, 2147483647, 1024, 8, 32], "", 0, []], [[], [["SP", 3, 0, 21, [1, 1, 1, 1], 1], ["SP", 3, 5, 8, [2, 2, 1, 2], 1], ["SP", 3, 10, 32, [1, 4, 2, 1], 1], ["SP", 3, 15, 32, [4, 4, 1, 2], 1], ["SP", 3, 20, 8, [2, 4], 1], ["SP", 3, 23, 3, [1, 1], 1], ["SP", 3, 26, 3, [1, 1], 1], ["RE", 3, [0, 5, 10, 15, 1, 6, 11, 16, 2, 7, 12, 17, 20, 23, 26, 21, 24, 27, 3, 8, 13, 18, 22, 25, 28, 4, 9, 14, 19]], ["FSP", 5, 0, 0, 3], ["FSP", 5, 4, 1, 3], ["FSP", 5, 8, 2, 3], ["FSP", 5, 12, 3, 3], ["RE", 5, [0, 4, 8, 12, 1, 5, 9, 13, 2, 6, 10, 14, 3, 7, 11, 15]], ["CA", 3, 5, 11], ["CHR", 2, "shared", [3]], ["CA", 3, 4, 14], ["CHR", 1, "shared", [4]], ["CA", 2, 5, 14], ["CI", 1], ["FU", 7, [0, 1, 2, 3]], ["AN", 7, 0, 5], ["FU", 7, [1, 2, 3, 4]], ["AN", 7, 1, 4], ["FU", 7, [2, 3, 4, 5]], ["AN", 7, 2, 6], ["FU", 4, [0, 1, 2, 3]], ["SP", 4, 0, 24, [1], 1], ["AN", 4, 1, 2], ["FFSP", 4, 0, [3, 2, 1, 0], 1, 1], ["AN", 4, 1, 6], ["FU", 2, [0, 1, 2, 3]], ["SP", 2, 0, 96, [1], 1], ["AN", 2, 1, 2], ["FFSP", 2, 0, [3, 2, 1, 0], 1, 1], ["AN", 2, 1, 6], ["PR", 5, 0, "auto_unroll_max_step$1024"]]]], "r": [[1.81525e-05, 1.81456e-05, 1.81565e-05, 1.8158e-05], 0, 3.79477, 1669741997], "v": "v0.6"}
{"i": [["[\"9a995a41bc2ff7cdadb96550380f7c85\", [21, 8, 32, 32], [8, 8, 3, 3], [1, 8, 1, 1], [21, 8, 32, 32]]", "cuda -keys=cuda,gpu -arch=sm_80 -max_num_threads=1024 -thread_warp_size=32", [-1, 16, 64, 49152, 2147483647, 1024, 8, 32], "", 0, []], [[], [["SP", 3, 0, 21, [1, 3, 1, 1], 1], ["SP", 3, 5, 8, [2, 1, 1, 1], 1], ["SP", 3, 10, 32, [2, 16, 1, 1], 1], ["SP", 3, 15, 32, [1, 1, 2, 16], 1], ["SP", 3, 20, 8, [2, 1], 1], ["SP", 3, 23, 3, [1, 3], 1], ["SP", 3, 26, 3, [1, 1], 1], ["RE", 3, [0, 5, 10, 15, 1, 6, 11, 16, 2, 7, 12, 17, 20, 23, 26, 21, 24, 27, 3, 8, 13, 18, 22, 25, 28, 4, 9, 14, 19]], ["FSP", 5, 0, 0, 3], ["FSP", 5, 4, 1, 3], ["FSP", 5, 8, 2, 3], ["FSP", 5, 12, 3, 3], ["RE", 5, [0, 4, 8, 12, 1, 5, 9, 13, 2, 6, 10, 14, 3, 7, 11, 15]], ["CA", 3, 5, 11], ["CHR", 2, "shared", [3]], ["CA", 3, 4, 14], ["CHR", 1, "shared", [4]], ["CA", 2, 5, 14], ["CI", 1], ["FU", 7, [0, 1, 2, 3]], ["AN", 7, 0, 5], ["FU", 7, [1, 2, 3, 4]], ["AN", 7, 1, 4], ["FU", 7, [2, 3, 4, 5]], ["AN", 7, 2, 6], ["FU", 4, [0, 1, 2, 3]], ["SP", 4, 0, 1, [1], 1], ["AN", 4, 1, 2], ["FFSP", 4, 0, [3, 2, 1, 0], 1, 1], ["AN", 4, 1, 6], ["FU", 2, [0, 1, 2, 3]], ["SP", 2, 0, 32, [2], 1], ["AN", 2, 1, 2], ["FFSP", 2, 0, [3, 2, 1, 0], 1, 1], ["AN", 2, 1, 6], ["PR", 5, 0, "auto_unroll_max_step$512"]]]], "r": [[0.000139494, 0.000139503, 0.000139497, 0.000139269], 0, 4.89644, 1669742000], "v": "v0.6"}
{"i": [["[\"9a995a41bc2ff7cdadb96550380f7c85\", [21, 8, 32, 32], [8, 8, 3, 3], [1, 8, 1, 1], [21, 8, 32, 32]]", "cuda -keys=cuda,gpu -arch=sm_80 -max_num_threads=1024 -thread_warp_size=32", [-1, 16, 64, 49152, 2147483647, 1024, 8, 32], "", 0, []], [[], [["SP", 3, 0, 21, [7, 3, 1, 1], 1], ["SP", 3, 5, 8, [1, 4, 1, 1], 1], ["SP", 3, 10, 32, [1, 4, 1, 1], 1], ["SP", 3, 15, 32, [1, 1, 1, 2], 1], ["SP", 3, 20, 8, [1, 1], 1], ["SP", 3, 23, 3, [3, 1], 1], ["SP", 3, 26, 3, [1, 3], 1], ["RE", 3, [0, 5, 10, 15, 1, 6, 11, 16, 2, 7, 12, 17, 20, 23, 26, 21, 24, 27, 3, 8, 13, 18, 22, 25, 28, 4, 9, 14, 19]], ["FSP", 5, 0, 0, 3], ["FSP", 5, 4, 1, 3], ["FSP", 5, 8, 2, 3], ["FSP", 5, 12, 3, 3], ["RE", 5, [0, 4, 8, 12, 1, 5, 9, 13, 2, 6, 10, 14, 3, 7, 11, 15]], ["CA", 3, 5, 11], ["CHR", 2, "shared", [3]], ["CA", 3, 4, 14], ["CHR", 1, "shared", [4]], ["CA", 2, 5, 14], ["CI", 1], ["FU", 7, [0, 1, 2, 3]], ["AN", 7, 0, 5], ["FU", 7, [1, 2, 3, 4]], ["AN", 7, 1, 4], ["FU", 7, [2, 3, 4, 5]], ["AN", 7, 2, 6], ["FU", 4, [0, 1, 2, 3]], ["SP", 4, 0, 18, [1], 1], ["AN", 4, 1, 2], ["FFSP", 4, 0, [3, 2, 1, 0], 1, 1], ["AN", 4, 1, 6], ["FU", 2, [0, 1, 2, 3]], ["SP", 2, 0, 24, [6], 1], ["AN", 2, 1, 2], ["FFSP", 2, 0, [3, 2, 1, 0], 1, 1], ["AN", 2, 1, 6], ["PR", 5, 0, "auto_unroll_max_step$512"]]]], "r": [[1.84727e-05, 1.84746e-05, 1.8477e-05, 1.84758e-05], 0, 3.07631, 1669742002], "v": "v0.6"}
{"i": [["[\"9a995a41bc2ff7cdadb96550380f7c85\", [21, 8, 32, 32], [8, 8, 3, 3], [1, 8, 1, 1], [21, 8, 32, 32]]", "cuda -keys=cuda,gpu -arch=sm_80 -max_num_threads=1024 -thread_warp_size=32", [-1, 16, 64, 49152, 2147483647, 1024, 8, 32], "", 0, []], [[], [["SP", 3, 0, 21, [1, 1, 7, 3], 1], ["SP", 3, 5, 8, [1, 2, 4, 1], 1], ["SP", 3, 10, 32, [1, 2, 1, 1], 1], ["SP", 3, 15, 32, [1, 32, 1, 1], 1], ["SP", 3, 20, 8, [2, 2], 1], ["SP", 3, 23, 3, [1, 3], 1], ["SP", 3, 26, 3, [3, 1], 1], ["RE", 3, [0, 5, 10, 15, 1, 6, 11, 16, 2, 7, 12, 17, 20, 23, 26, 21, 24, 27, 3, 8, 13, 18, 22, 25, 28, 4, 9, 14, 19]], ["FSP", 5, 0, 0, 3], ["FSP", 5, 4, 1, 3], ["FSP", 5, 8, 2, 3], ["FSP", 5, 12, 3, 3], ["RE", 5, [0, 4, 8, 12, 1, 5, 9, 13, 2, 6, 10, 14, 3, 7, 11, 15]], ["CA", 3, 5, 11], ["CHR", 2, "shared", [3]], ["CA", 3, 4, 14], ["CHR", 1, "shared", [4]], ["CA", 2, 5, 14], ["CI", 1], ["FU", 7, [0, 1, 2, 3]], ["AN", 7, 0, 5], ["FU", 7, [1, 2, 3, 4]], ["AN", 7, 1, 4], ["FU", 7, [2, 3, 4, 5]], ["AN", 7, 2, 6], ["FU", 4, [0, 1, 2, 3]], ["SP", 4, 0, 144, [1], 1], ["AN", 4, 1, 2], ["FFSP", 4, 0, [3, 2, 1, 0], 1, 1], ["AN", 4, 1, 6], ["FU", 2, [0, 1, 2, 3]], ["SP", 2, 0, 756, [27], 1], ["AN", 2, 1, 2], ["FFSP", 2, 0, [3, 2, 1, 0], 1, 1], ["AN", 2, 1, 6], ["PR", 5, 0, "auto_unroll_max_step$512"]]]], "r": [[3.67163e-05, 3.67173e-05, 3.67139e-05, 3.672e-05], 0, 6.52966, 1669742005], "v": "v0.6"}
{"i": [["[\"9a995a41bc2ff7cdadb96550380f7c85\", [21, 8, 32, 32], [8, 8, 3, 3], [1, 8, 1, 1], [21, 8, 32, 32]]", "cuda -keys=cuda,gpu -arch=sm_80 -max_num_threads=1024 -thread_warp_size=32", [-1, 16, 64, 49152, 2147483647, 1024, 8, 32], "", 0, []], [[], [["SP", 3, 0, 21, [1, 3, 1, 1], 1], ["SP", 3, 5, 8, [4, 1, 2, 1], 1], ["SP", 3, 10, 32, [2, 1, 1, 2], 1], ["SP", 3, 15, 32, [1, 32, 1, 1], 1], ["SP", 3, 20, 8, [8, 1], 1], ["SP", 3, 23, 3, [3, 1], 1], ["SP", 3, 26, 3, [1, 3], 1], ["RE", 3, [0, 5, 10, 15, 1, 6, 11, 16, 2, 7, 12, 17, 20, 23, 26, 21, 24, 27, 3, 8, 13, 18, 22, 25, 28, 4, 9, 14, 19]], ["FSP", 5, 0, 0, 3], ["FSP", 5, 4, 1, 3], ["FSP", 5, 8, 2, 3], ["FSP", 5, 12, 3, 3], ["RE", 5, [0, 4, 8, 12, 1, 5, 9, 13, 2, 6, 10, 14, 3, 7, 11, 15]], ["CA", 3, 5, 11], ["CHR", 2, "shared", [3]], ["CA", 3, 4, 14], ["CHR", 1, "shared", [4]], ["CA", 2, 5, 14], ["CI", 1], ["FU", 7, [0, 1, 2, 3]], ["AN", 7, 0, 5], ["FU", 7, [1, 2, 3, 4]], ["AN", 7, 1, 4], ["FU", 7, [2, 3, 4, 5]], ["AN", 7, 2, 6], ["FU", 4, [0, 1, 2, 3]], ["SP", 4, 0, 16, [1], 1], ["AN", 4, 1, 2], ["FFSP", 4, 0, [3, 2, 1, 0], 1, 1], ["AN", 4, 1, 6], ["FU", 2, [0, 1, 2, 3]], ["SP", 2, 0, 16, [1], 1], ["AN", 2, 1, 2], ["FFSP", 2, 0, [3, 2, 1, 0], 1, 1], ["AN", 2, 1, 6], ["PR", 5, 0, "auto_unroll_max_step$1024"]]]], "r": [[1.88995e-05, 1.89005e-05, 1.88991e-05, 1.8899e-05], 0, 3.88092, 1669742007], "v": "v0.6"}
{"i": [["[\"9a995a41bc2ff7cdadb96550380f7c85\", [21, 8, 32, 32], [8, 8, 3, 3], [1, 8, 1, 1], [21, 8, 32, 32]]", "cuda -keys=cuda,gpu -arch=sm_80 -max_num_threads=1024 -thread_warp_size=32", [-1, 16, 64, 49152, 2147483647, 1024, 8, 32], "", 0, []], [[], [["SP", 3, 0, 21, [1, 7, 3, 1], 1], ["SP", 3, 5, 8, [1, 2, 1, 2], 1], ["SP", 3, 10, 32, [1, 1, 16, 1], 1], ["SP", 3, 15, 32, [1, 16, 1, 1], 1], ["SP", 3, 20, 8, [1, 1], 1], ["SP", 3, 23, 3, [3, 1], 1], ["SP", 3, 26, 3, [1, 1], 1], ["RE", 3, [0, 5, 10, 15, 1, 6, 11, 16, 2, 7, 12, 17, 20, 23, 26, 21, 24, 27, 3, 8, 13, 18, 22, 25, 28, 4, 9, 14, 19]], ["FSP", 5, 0, 0, 3], ["FSP", 5, 4, 1, 3], ["FSP", 5, 8, 2, 3], ["FSP", 5, 12, 3, 3], ["RE", 5, [0, 4, 8, 12, 1, 5, 9, 13, 2, 6, 10, 14, 3, 7, 11, 15]], ["CA", 3, 5, 11], ["CHR", 2, "shared", [3]], ["CA", 3, 4, 14], ["CHR", 1, "shared", [4]], ["CA", 2, 5, 14], ["CI", 1], ["FU", 7, [0, 1, 2, 3]], ["AN", 7, 0, 5], ["FU", 7, [1, 2, 3, 4]], ["AN", 7, 1, 4], ["FU", 7, [2, 3, 4, 5]], ["AN", 7, 2, 6], ["FU", 4, [0, 1, 2, 3]], ["SP", 4, 0, 6, [1], 1], ["AN", 4, 1, 2], ["FFSP", 4, 0, [3, 2, 1, 0], 1, 1], ["AN", 4, 1, 6], ["FU", 2, [0, 1, 2, 3]], ["SP", 2, 0, 54, [1], 1], ["AN", 2, 1, 2], ["FFSP", 2, 0, [3, 2, 1, 0], 1, 1], ["AN", 2, 1, 6], ["PR", 5, 0, "auto_unroll_max_step$512"]]]], "r": [[5.5476e-05, 5.54774e-05, 5.54779e-05, 5.5481e-05], 0, 3.63321, 1669742010], "v": "v0.6"}
{"i": [["[\"9a995a41bc2ff7cdadb96550380f7c85\", [21, 8, 32, 32], [8, 8, 3, 3], [1, 8, 1, 1], [21, 8, 32, 32]]", "cuda -keys=cuda,gpu -arch=sm_80 -max_num_threads=1024 -thread_warp_size=32", [-1, 16, 64, 49152, 2147483647, 1024, 8, 32], "", 0, []], [[], [["SP", 3, 0, 21, [1, 1, 7, 1], 1], ["SP", 3, 5, 8, [2, 2, 2, 1], 1], ["SP", 3, 10, 32, [2, 8, 1, 2], 1], ["SP", 3, 15, 32, [1, 8, 2, 1], 1], ["SP", 3, 20, 8, [2, 1], 1], ["SP", 3, 23, 3, [3, 1], 1], ["SP", 3, 26, 3, [1, 1], 1], ["RE", 3, [0, 5, 10, 15, 1, 6, 11, 16, 2, 7, 12, 17, 20, 23, 26, 21, 24, 27, 3, 8, 13, 18, 22, 25, 28, 4, 9, 14, 19]], ["FSP", 5, 0, 0, 3], ["FSP", 5, 4, 1, 3], ["FSP", 5, 8, 2, 3], ["FSP", 5, 12, 3, 3], ["RE", 5, [0, 4, 8, 12, 1, 5, 9, 13, 2, 6, 10, 14, 3, 7, 11, 15]], ["CA", 3, 5, 11], ["CHR", 2, "shared", [3]], ["CA", 3, 4, 14], ["CHR", 1, "shared", [4]], ["CA", 2, 5, 14], ["CI", 1], ["FU", 7, [0, 1, 2, 3]], ["AN", 7, 0, 5], ["FU", 7, [1, 2, 3, 4]], ["AN", 7, 1, 4], ["FU", 7, [2, 3, 4, 5]], ["AN", 7, 2, 6], ["FU", 4, [0, 1, 2, 3]], ["SP", 4, 0, 12, [4], 1], ["AN", 4, 1, 2], ["FFSP", 4, 0, [3, 2, 1, 0], 1, 1], ["AN", 4, 1, 6], ["FU", 2, [0, 1, 2, 3]], ["SP", 2, 0, 112, [1], 1], ["AN", 2, 1, 2], ["FFSP", 2, 0, [3, 2, 1, 0], 1, 1], ["AN", 2, 1, 6], ["PR", 5, 0, "auto_unroll_max_step$64"]]]], "r": [[8.71094e-05, 8.71215e-05, 8.71297e-05, 8.71567e-05], 0, 3.96053, 1669742013], "v": "v0.6"}
{"i": [["[\"9a995a41bc2ff7cdadb96550380f7c85\", [21, 8, 32, 32], [8, 8, 3, 3], [1, 8, 1, 1], [21, 8, 32, 32]]", "cuda -keys=cuda,gpu -arch=sm_80 -max_num_threads=1024 -thread_warp_size=32", [-1, 16, 64, 49152, 2147483647, 1024, 8, 32], "", 0, []], [[], [["SP", 3, 0, 21, [1, 21, 1, 1], 1], ["SP", 3, 5, 8, [4, 2, 1, 1], 1], ["SP", 3, 10, 32, [1, 2, 2, 1], 1], ["SP", 3, 15, 32, [1, 2, 4, 2], 1], ["SP", 3, 20, 8, [1, 8], 1], ["SP", 3, 23, 3, [1, 1], 1], ["SP", 3, 26, 3, [1, 1], 1], ["RE", 3, [0, 5, 10, 15, 1, 6, 11, 16, 2, 7, 12, 17, 20, 23, 26, 21, 24, 27, 3, 8, 13, 18, 22, 25, 28, 4, 9, 14, 19]], ["FSP", 5, 0, 0, 3], ["FSP", 5, 4, 1, 3], ["FSP", 5, 8, 2, 3], ["FSP", 5, 12, 3, 3], ["RE", 5, [0, 4, 8, 12, 1, 5, 9, 13, 2, 6, 10, 14, 3, 7, 11, 15]], ["CA", 3, 5, 11], ["CHR", 2, "shared", [3]], ["CA", 3, 4, 14], ["CHR", 1, "shared", [4]], ["CA", 2, 5, 14], ["CI", 1], ["FU", 7, [0, 1, 2, 3]], ["AN", 7, 0, 5], ["FU", 7, [1, 2, 3, 4]], ["AN", 7, 1, 4], ["FU", 7, [2, 3, 4, 5]], ["AN", 7, 2, 6], ["FU", 4, [0, 1, 2, 3]], ["SP", 4, 0, 4, [1], 1], ["AN", 4, 1, 2], ["FFSP", 4, 0, [3, 2, 1, 0], 1, 1], ["AN", 4, 1, 6], ["FU", 2, [0, 1, 2, 3]], ["SP", 2, 0, 64, [8], 1], ["AN", 2, 1, 2], ["FFSP", 2, 0, [3, 2, 1, 0], 1, 1], ["AN", 2, 1, 6], ["PR", 5, 0, "auto_unroll_max_step$1024"]]]], "r": [[7.83544e-05, 7.83528e-05, 7.83551e-05, 7.83559e-05], 0, 4.2373, 1669742016], "v": "v0.6"}
{"i": [["[\"9a995a41bc2ff7cdadb96550380f7c85\", [21, 8, 32, 32], [8, 8, 3, 3], [1, 8, 1, 1], [21, 8, 32, 32]]", "cuda -keys=cuda,gpu -arch=sm_80 -max_num_threads=1024 -thread_warp_size=32", [-1, 16, 64, 49152, 2147483647, 1024, 8, 32], "", 0, []], [[], [["SP", 3, 0, 21, [1, 1, 3, 1], 1], ["SP", 3, 5, 8, [1, 2, 1, 2], 1], ["SP", 3, 10, 32, [1, 2, 16, 1], 1], ["SP", 3, 15, 32, [1, 4, 1, 8], 1], ["SP", 3, 20, 8, [1, 1], 1], ["SP", 3, 23, 3, [1, 3], 1], ["SP", 3, 26, 3, [3, 1], 1], ["RE", 3, [0, 5, 10, 15, 1, 6, 11, 16, 2, 7, 12, 17, 20, 23, 26, 21, 24, 27, 3, 8, 13, 18, 22, 25, 28, 4, 9, 14, 19]], ["FSP", 5, 0, 0, 3], ["FSP", 5, 4, 1, 3], ["FSP", 5, 8, 2, 3], ["FSP", 5, 12, 3, 3], ["RE", 5, [0, 4, 8, 12, 1, 5, 9, 13, 2, 6, 10, 14, 3, 7, 11, 15]], ["CA", 3, 5, 11], ["CHR", 2, "shared", [3]], ["CA", 3, 4, 14], ["CHR", 1, "shared", [4]], ["CA", 2, 5, 14], ["CI", 1], ["FU", 7, [0, 1, 2, 3]], ["AN", 7, 0, 5], ["FU", 7, [1, 2, 3, 4]], ["AN", 7, 1, 4], ["FU", 7, [2, 3, 4, 5]], ["AN", 7, 2, 6], ["FU", 4, [0, 1, 2, 3]], ["SP", 4, 0, 6, [1], 1], ["AN", 4, 1, 2], ["FFSP", 4, 0, [3, 2, 1, 0], 1, 1], ["AN", 4, 1, 6], ["FU", 2, [0, 1, 2, 3]], ["SP", 2, 0, 160, [1], 1], ["AN", 2, 1, 2], ["FFSP", 2, 0, [3, 2, 1, 0], 1, 1], ["AN", 2, 1, 6], ["PR", 5, 0, "auto_unroll_max_step$0"]]]], "r": [[0.000802021, 0.000801707, 0.000801794, 0.000801848], 0, 3.82662, 1669742018], "v": "v0.6"}
{"i": [["[\"9a995a41bc2ff7cdadb96550380f7c85\", [21, 8, 32, 32], [8, 8, 3, 3], [1, 8, 1, 1], [21, 8, 32, 32]]", "cuda -keys=cuda,gpu -arch=sm_80 -max_num_threads=1024 -thread_warp_size=32", [-1, 16, 64, 49152, 2147483647, 1024, 8, 32], "", 0, []], [[], [["SP", 3, 0, 21, [1, 3, 1, 7], 1], ["SP", 3, 5, 8, [2, 2, 1, 1], 1], ["SP", 3, 10, 32, [1, 8, 2, 2], 1], ["SP", 3, 15, 32, [1, 1, 4, 1], 1], ["SP", 3, 20, 8, [1, 1], 1], ["SP", 3, 23, 3, [1, 1], 1], ["SP", 3, 26, 3, [1, 1], 1], ["RE", 3, [0, 5, 10, 15, 1, 6, 11, 16, 2, 7, 12, 17, 20, 23, 26, 21, 24, 27, 3, 8, 13, 18, 22, 25, 28, 4, 9, 14, 19]], ["FSP", 5, 0, 0, 3], ["FSP", 5, 4, 1, 3], ["FSP", 5, 8, 2, 3], ["FSP", 5, 12, 3, 3], ["RE", 5, [0, 4, 8, 12, 1, 5, 9, 13, 2, 6, 10, 14, 3, 7, 11, 15]], ["CA", 3, 5, 11], ["CHR", 2, "shared", [3]], ["CA", 3, 4, 14], ["CHR", 1, "shared", [4]], ["CA", 2, 5, 14], ["CI", 1], ["FU", 7, [0, 1, 2, 3]], ["AN", 7, 0, 5], ["FU", 7, [1, 2, 3, 4]], ["AN", 7, 1, 4], ["FU", 7, [2, 3, 4, 5]], ["AN", 7, 2, 6], ["FU", 4, [0, 1, 2, 3]], ["SP", 4, 0, 3, [1], 1], ["AN", 4, 1, 2], ["FFSP", 4, 0, [3, 2, 1, 0], 1, 1], ["AN", 4, 1, 6], ["FU", 2, [0, 1, 2, 3]], ["SP", 2, 0, 112, [1], 1], ["AN", 2, 1, 2], ["FFSP", 2, 0, [3, 2, 1, 0], 1, 1], ["AN", 2, 1, 6], ["PR", 5, 0, "auto_unroll_max_step$16"]]]], "r": [[0.000357844, 0.00035787, 0.000357967, 0.000358029], 0, 3.37528, 1669742021], "v": "v0.6"}
{"i": [["[\"9a995a41bc2ff7cdadb96550380f7c85\", [21, 8, 32, 32], [8, 8, 3, 3], [1, 8, 1, 1], [21, 8, 32, 32]]", "cuda -keys=cuda,gpu -arch=sm_80 -max_num_threads=1024 -thread_warp_size=32", [-1, 16, 64, 49152, 2147483647, 1024, 8, 32], "", 0, []], [[], [["SP", 3, 0, 21, [7, 1, 1, 1], 1], ["SP", 3, 5, 8, [1, 4, 1, 2], 1], ["SP", 3, 10, 32, [1, 2, 4, 2], 1], ["SP", 3, 15, 32, [1, 4, 1, 4], 1], ["SP", 3, 20, 8, [1, 4], 1], ["SP", 3, 23, 3, [3, 1], 1], ["SP", 3, 26, 3, [1, 3], 1], ["RE", 3, [0, 5, 10, 15, 1, 6, 11, 16, 2, 7, 12, 17, 20, 23, 26, 21, 24, 27, 3, 8, 13, 18, 22, 25, 28, 4, 9, 14, 19]], ["FSP", 5, 0, 0, 3], ["FSP", 5, 4, 1, 3], ["FSP", 5, 8, 2, 3], ["FSP", 5, 12, 3, 3], ["RE", 5, [0, 4, 8, 12, 1, 5, 9, 13, 2, 6, 10, 14, 3, 7, 11, 15]], ["CA", 3, 5, 11], ["CHR", 2, "shared", [3]], ["CA", 3, 4, 14], ["CHR", 1, "shared", [4]], ["CA", 2, 5, 14], ["CI", 1], ["FU", 7, [0, 1, 2, 3]], ["AN", 7, 0, 5], ["FU", 7, [1, 2, 3, 4]], ["AN", 7, 1, 4], ["FU", 7, [2, 3, 4, 5]], ["AN", 7, 2, 6], ["FU", 4, [0, 1, 2, 3]], ["SP", 4, 0, 24, [1], 1], ["AN", 4, 1, 2], ["FFSP", 4, 0, [3, 2, 1, 0], 1, 1], ["AN", 4, 1, 6], ["FU", 2, [0, 1, 2, 3]], ["SP", 2, 0, 160, [16], 1], ["AN", 2, 1, 2], ["FFSP", 2, 0, [3, 2, 1, 0], 1, 1], ["AN", 2, 1, 6], ["PR", 5, 0, "auto_unroll_max_step$16"]]]], "r": [[0.000232617, 0.000232617, 0.000232618, 0.000232617], 0, 4.16753, 1669742024], "v": "v0.6"}
{"i": [["[\"9a995a41bc2ff7cdadb96550380f7c85\", [21, 8, 32, 32], [8, 8, 3, 3], [1, 8, 1, 1], [21, 8, 32, 32]]", "cuda -keys=cuda,gpu -arch=sm_80 -max_num_threads=1024 -thread_warp_size=32", [-1, 16, 64, 49152, 2147483647, 1024, 8, 32], "", 0, []], [[], [["SP", 3, 0, 21, [1, 7, 1, 3], 1], ["SP", 3, 5, 8, [1, 2, 1, 2], 1], ["SP", 3, 10, 32, [1, 8, 1, 1], 1], ["SP", 3, 15, 32, [1, 2, 2, 1], 1], ["SP", 3, 20, 8, [4, 2], 1], ["SP", 3, 23, 3, [1, 3], 1], ["SP", 3, 26, 3, [1, 3], 1], ["RE", 3, [0, 5, 10, 15, 1, 6, 11, 16, 2, 7, 12, 17, 20, 23, 26, 21, 24, 27, 3, 8, 13, 18, 22, 25, 28, 4, 9, 14, 19]], ["FSP", 5, 0, 0, 3], ["FSP", 5, 4, 1, 3], ["FSP", 5, 8, 2, 3], ["FSP", 5, 12, 3, 3], ["RE", 5, [0, 4, 8, 12, 1, 5, 9, 13, 2, 6, 10, 14, 3, 7, 11, 15]], ["CA", 3, 5, 11], ["CHR", 2, "shared", [3]], ["CA", 3, 4, 14], ["CHR", 1, "shared", [4]], ["CA", 2, 5, 14], ["CI", 1], ["FU", 7, [0, 1, 2, 3]], ["AN", 7, 0, 5], ["FU", 7, [1, 2, 3, 4]], ["AN", 7, 1, 4], ["FU", 7, [2, 3, 4, 5]], ["AN", 7, 2, 6], ["FU", 4, [0, 1, 2, 3]], ["SP", 4, 0, 72, [1], 1], ["AN", 4, 1, 2], ["FFSP", 4, 0, [3, 2, 1, 0], 1, 1], ["AN", 4, 1, 6], ["FU", 2, [0, 1, 2, 3]], ["SP", 2, 0, 144, [1], 1], ["AN", 2, 1, 2], ["FFSP", 2, 0, [3, 2, 1, 0], 1, 1], ["AN", 2, 1, 6], ["PR", 5, 0, "auto_unroll_max_step$512"]]]], "r": [[1.47602e-05, 1.47627e-05, 1.47619e-05, 1.4761e-05], 0, 3.6187, 1669742026], "v": "v0.6"}
{"i": [["[\"9a995a41bc2ff7cdadb96550380f7c85\", [21, 8, 32, 32], [8, 8, 3, 3], [1, 8, 1, 1], [21, 8, 32, 32]]", "cuda -keys=cuda,gpu -arch=sm_80 -max_num_threads=1024 -thread_warp_size=32", [-1, 16, 64, 49152, 2147483647, 1024, 8, 32], "", 0, []], [[], [["SP", 3, 0, 21, [1, 1, 3, 7], 1], ["SP", 3, 5, 8, [1, 4, 1, 1], 1], ["SP", 3, 10, 32, [1, 2, 2, 4], 1], ["SP", 3, 15, 32, [4, 8, 1, 1], 1], ["SP", 3, 20, 8, [1, 1], 1], ["SP", 3, 23, 3, [1, 1], 1], ["SP", 3, 26, 3, [1, 1], 1], ["RE", 3, [0, 5, 10, 15, 1, 6, 11, 16, 2, 7, 12, 17, 20, 23, 26, 21, 24, 27, 3, 8, 13, 18, 22, 25, 28, 4, 9, 14, 19]], ["FSP", 5, 0, 0, 3], ["FSP", 5, 4, 1, 3], ["FSP", 5, 8, 2, 3], ["FSP", 5, 12, 3, 3], ["RE", 5, [0, 4, 8, 12, 1, 5, 9, 13, 2, 6, 10, 14, 3, 7, 11, 15]], ["CA", 3, 5, 11], ["CHR", 2, "shared", [3]], ["CA", 3, 4, 14], ["CHR", 1, "shared", [4]], ["CA", 2, 5, 14], ["CI", 1], ["FU", 7, [0, 1, 2, 3]], ["AN", 7, 0, 5], ["FU", 7, [1, 2, 3, 4]], ["AN", 7, 1, 4], ["FU", 7, [2, 3, 4, 5]], ["AN", 7, 2, 6], ["FU", 4, [0, 1, 2, 3]], ["SP", 4, 0, 3, [1], 1], ["AN", 4, 1, 2], ["FFSP", 4, 0, [3, 2, 1, 0], 1, 1], ["AN", 4, 1, 6], ["FU", 2, [0, 1, 2, 3]], ["SP", 2, 0, 420, [12], 1], ["AN", 2, 1, 2], ["FFSP", 2, 0, [3, 2, 1, 0], 1, 1], ["AN", 2, 1, 6], ["PR", 5, 0, "auto_unroll_max_step$512"]]]], "r": [[0.000706158, 0.000706062, 0.000706041, 0.00070597], 0, 9.90458, 1669742029], "v": "v0.6"}
{"i": [["[\"9a995a41bc2ff7cdadb96550380f7c85\", [21, 8, 32, 32], [8, 8, 3, 3], [1, 8, 1, 1], [21, 8, 32, 32]]", "cuda -keys=cuda,gpu -arch=sm_80 -max_num_threads=1024 -thread_warp_size=32", [-1, 16, 64, 49152, 2147483647, 1024, 8, 32], "", 0, []], [[], [["SP", 3, 0, 21, [1, 7, 1, 1], 1], ["SP", 3, 5, 8, [1, 1, 2, 2], 1], ["SP", 3, 10, 32, [1, 4, 1, 4], 1], ["SP", 3, 15, 32, [1, 8, 1, 2], 1], ["SP", 3, 20, 8, [4, 1], 1], ["SP", 3, 23, 3, [1, 3], 1], ["SP", 3, 26, 3, [1, 1], 1], ["RE", 3, [0, 5, 10, 15, 1, 6, 11, 16, 2, 7, 12, 17, 20, 23, 26, 21, 24, 27, 3, 8, 13, 18, 22, 25, 28, 4, 9, 14, 19]], ["FSP", 5, 0, 0, 3], ["FSP", 5, 4, 1, 3], ["FSP", 5, 8, 2, 3], ["FSP", 5, 12, 3, 3], ["RE", 5, [0, 4, 8, 12, 1, 5, 9, 13, 2, 6, 10, 14, 3, 7, 11, 15]], ["CA", 3, 5, 11], ["CHR", 2, "shared", [3]], ["CA", 3, 4, 14], ["CHR", 1, "shared", [4]], ["CA", 2, 5, 14], ["CI", 1], ["FU", 7, [0, 1, 2, 3]], ["AN", 7, 0, 5], ["FU", 7, [1, 2, 3, 4]], ["AN", 7, 1, 4], ["FU", 7, [2, 3, 4, 5]], ["AN", 7, 2, 6], ["FU", 4, [0, 1, 2, 3]], ["SP", 4, 0, 48, [1], 1], ["AN", 4, 1, 2], ["FFSP", 4, 0, [3, 2, 1, 0], 1, 1], ["AN", 4, 1, 6], ["FU", 2, [0, 1, 2, 3]], ["SP", 2, 0, 96, [1], 1], ["AN", 2, 1, 2], ["FFSP", 2, 0, [3, 2, 1, 0], 1, 1], ["AN", 2, 1, 6], ["PR", 5, 0, "auto_unroll_max_step$16"]]]], "r": [[2.04314e-05, 2.04283e-05, 2.04514e-05, 2.04777e-05], 0, 3.28828, 1669742032], "v": "v0.6"}
