.cache/log/kernel_tune/NVIDIA_A100_80GB_PCIe/Conv2dBiasReLU_forward_input_0_27_36_1_1_output_0_27_2_1_1_in_channels_36_out_channels_2_kernel_size_1_1_stride_1_1_padding_0_0_dilation_1_1_groups_1.json
{"i": [["[\"202242e10b6ca40b0d7329fe3a725f1f\", [27, 36, 1, 1], [2, 36, 1, 1], [1, 2, 1, 1], [27, 2, 1, 1]]", "cuda -keys=cuda,gpu -arch=sm_80 -max_num_threads=1024 -thread_warp_size=32", [-1, 16, 64, 49152, 2147483647, 1024, 8, 32], "", 0, []], [[], [["CI", 5], ["SP", 3, 0, 27, [3, 3, 1, 3], 1], ["SP", 3, 5, 2, [1, 1, 2, 1], 1], ["SP", 3, 10, 1, [1, 1, 1, 1], 1], ["SP", 3, 15, 1, [1, 1, 1, 1], 1], ["SP", 3, 20, 36, [36, 1], 1], ["SP", 3, 23, 1, [1, 1], 1], ["SP", 3, 26, 1, [1, 1], 1], ["RE", 3, [0, 5, 10, 15, 1, 6, 11, 16, 2, 7, 12, 17, 20, 23, 26, 21, 24, 27, 3, 8, 13, 18, 22, 25, 28, 4, 9, 14, 19]], ["FSP", 6, 0, 1, 3], ["FSP", 6, 4, 2, 3], ["FSP", 6, 8, 3, 3], ["FSP", 6, 12, 4, 3], ["RE", 6, [0, 4, 8, 12, 1, 5, 9, 13, 2, 6, 10, 14, 3, 7, 11, 15]], ["CA", 3, 6, 11], ["CHR", 2, "shared", [3]], ["CA", 3, 4, 14], ["CHR", 1, "shared", [4]], ["CA", 2, 5, 14], ["CI", 1], ["FU", 8, [0, 1, 2, 3]], ["AN", 8, 0, 5], ["FU", 8, [1, 2, 3, 4]], ["AN", 8, 1, 4], ["FU", 8, [2, 3, 4, 5]], ["AN", 8, 2, 6], ["FU", 4, [0, 1, 2, 3]], ["SP", 4, 0, 72, [1], 1], ["AN", 4, 1, 2], ["FFSP", 4, 0, [4, 3, 2, 1], 1, 1], ["AN", 4, 1, 6], ["FU", 2, [0, 1, 2, 3]], ["SP", 2, 0, 324, [1], 1], ["AN", 2, 1, 2], ["FFSP", 2, 0, [4, 3, 2, 1], 1, 1], ["AN", 2, 1, 6], ["PR", 5, 0, "auto_unroll_max_step$0"]]]], "r": [[6.45355e-06, 6.45723e-06, 6.45069e-06, 6.45086e-06], 0, 2.4908, 1664295064], "v": "v0.6"}
{"i": [["[\"202242e10b6ca40b0d7329fe3a725f1f\", [27, 36, 1, 1], [2, 36, 1, 1], [1, 2, 1, 1], [27, 2, 1, 1]]", "cuda -keys=cuda,gpu -arch=sm_80 -max_num_threads=1024 -thread_warp_size=32", [-1, 16, 64, 49152, 2147483647, 1024, 8, 32], "", 0, []], [[], [["CI", 5], ["SP", 3, 0, 27, [3, 9, 1, 1], 1], ["SP", 3, 5, 2, [1, 1, 1, 2], 1], ["SP", 3, 10, 1, [1, 1, 1, 1], 1], ["SP", 3, 15, 1, [1, 1, 1, 1], 1], ["SP", 3, 20, 36, [3, 4], 1], ["SP", 3, 23, 1, [1, 1], 1], ["SP", 3, 26, 1, [1, 1], 1], ["RE", 3, [0, 5, 10, 15, 1, 6, 11, 16, 2, 7, 12, 17, 20, 23, 26, 21, 24, 27, 3, 8, 13, 18, 22, 25, 28, 4, 9, 14, 19]], ["FSP", 6, 0, 1, 3], ["FSP", 6, 4, 2, 3], ["FSP", 6, 8, 3, 3], ["FSP", 6, 12, 4, 3], ["RE", 6, [0, 4, 8, 12, 1, 5, 9, 13, 2, 6, 10, 14, 3, 7, 11, 15]], ["CA", 3, 6, 11], ["CHR", 2, "shared", [3]], ["CA", 3, 4, 14], ["CHR", 1, "shared", [4]], ["CA", 2, 5, 14], ["CI", 1], ["FU", 8, [0, 1, 2, 3]], ["AN", 8, 0, 5], ["FU", 8, [1, 2, 3, 4]], ["AN", 8, 1, 4], ["FU", 8, [2, 3, 4, 5]], ["AN", 8, 2, 6], ["FU", 4, [0, 1, 2, 3]], ["SP", 4, 0, 24, [1], 1], ["AN", 4, 1, 2], ["FFSP", 4, 0, [4, 3, 2, 1], 1, 1], ["AN", 4, 1, 6], ["FU", 2, [0, 1, 2, 3]], ["SP", 2, 0, 12, [2], 1], ["AN", 2, 1, 2], ["FFSP", 2, 0, [4, 3, 2, 1], 1, 1], ["AN", 2, 1, 6], ["PR", 5, 0, "auto_unroll_max_step$64"]]]], "r": [[3.73699e-06, 3.73693e-06, 3.73694e-06, 3.73695e-06], 0, 2.5523, 1664295065], "v": "v0.6"}
{"i": [["[\"202242e10b6ca40b0d7329fe3a725f1f\", [27, 36, 1, 1], [2, 36, 1, 1], [1, 2, 1, 1], [27, 2, 1, 1]]", "cuda -keys=cuda,gpu -arch=sm_80 -max_num_threads=1024 -thread_warp_size=32", [-1, 16, 64, 49152, 2147483647, 1024, 8, 32], "", 0, []], [[], [["CI", 5], ["SP", 3, 0, 27, [3, 1, 3, 3], 1], ["SP", 3, 5, 2, [1, 1, 1, 1], 1], ["SP", 3, 10, 1, [1, 1, 1, 1], 1], ["SP", 3, 15, 1, [1, 1, 1, 1], 1], ["SP", 3, 20, 36, [2, 18], 1], ["SP", 3, 23, 1, [1, 1], 1], ["SP", 3, 26, 1, [1, 1], 1], ["RE", 3, [0, 5, 10, 15, 1, 6, 11, 16, 2, 7, 12, 17, 20, 23, 26, 21, 24, 27, 3, 8, 13, 18, 22, 25, 28, 4, 9, 14, 19]], ["FSP", 6, 0, 1, 3], ["FSP", 6, 4, 2, 3], ["FSP", 6, 8, 3, 3], ["FSP", 6, 12, 4, 3], ["RE", 6, [0, 4, 8, 12, 1, 5, 9, 13, 2, 6, 10, 14, 3, 7, 11, 15]], ["CA", 3, 6, 11], ["CHR", 2, "shared", [3]], ["CA", 3, 4, 14], ["CHR", 1, "shared", [4]], ["CA", 2, 5, 14], ["CI", 1], ["FU", 8, [0, 1, 2, 3]], ["AN", 8, 0, 5], ["FU", 8, [1, 2, 3, 4]], ["AN", 8, 1, 4], ["FU", 8, [2, 3, 4, 5]], ["AN", 8, 2, 6], ["FU", 4, [0, 1, 2, 3]], ["SP", 4, 0, 36, [1], 1], ["AN", 4, 1, 2], ["FFSP", 4, 0, [4, 3, 2, 1], 1, 1], ["AN", 4, 1, 6], ["FU", 2, [0, 1, 2, 3]], ["SP", 2, 0, 324, [1], 1], ["AN", 2, 1, 2], ["FFSP", 2, 0, [4, 3, 2, 1], 1, 1], ["AN", 2, 1, 6], ["PR", 5, 0, "auto_unroll_max_step$64"]]]], "r": [[1.43654e-05, 1.4383e-05, 1.4367e-05, 1.43602e-05], 0, 3.077, 1664295068], "v": "v0.6"}
{"i": [["[\"202242e10b6ca40b0d7329fe3a725f1f\", [27, 36, 1, 1], [2, 36, 1, 1], [1, 2, 1, 1], [27, 2, 1, 1]]", "cuda -keys=cuda,gpu -arch=sm_80 -max_num_threads=1024 -thread_warp_size=32", [-1, 16, 64, 49152, 2147483647, 1024, 8, 32], "", 0, []], [[], [["CI", 5], ["SP", 3, 0, 27, [1, 1, 1, 27], 1], ["SP", 3, 5, 2, [1, 1, 2, 1], 1], ["SP", 3, 10, 1, [1, 1, 1, 1], 1], ["SP", 3, 15, 1, [1, 1, 1, 1], 1], ["SP", 3, 20, 36, [1, 12], 1], ["SP", 3, 23, 1, [1, 1], 1], ["SP", 3, 26, 1, [1, 1], 1], ["RE", 3, [0, 5, 10, 15, 1, 6, 11, 16, 2, 7, 12, 17, 20, 23, 26, 21, 24, 27, 3, 8, 13, 18, 22, 25, 28, 4, 9, 14, 19]], ["FSP", 6, 0, 1, 3], ["FSP", 6, 4, 2, 3], ["FSP", 6, 8, 3, 3], ["FSP", 6, 12, 4, 3], ["RE", 6, [0, 4, 8, 12, 1, 5, 9, 13, 2, 6, 10, 14, 3, 7, 11, 15]], ["CA", 3, 6, 11], ["CHR", 2, "shared", [3]], ["CA", 3, 4, 14], ["CHR", 1, "shared", [4]], ["CA", 2, 5, 14], ["CI", 1], ["FU", 8, [0, 1, 2, 3]], ["AN", 8, 0, 5], ["FU", 8, [1, 2, 3, 4]], ["AN", 8, 1, 4], ["FU", 8, [2, 3, 4, 5]], ["AN", 8, 2, 6], ["FU", 4, [0, 1, 2, 3]], ["SP", 4, 0, 24, [4], 1], ["AN", 4, 1, 2], ["FFSP", 4, 0, [4, 3, 2, 1], 1, 1], ["AN", 4, 1, 6], ["FU", 2, [0, 1, 2, 3]], ["SP", 2, 0, 324, [1], 1], ["AN", 2, 1, 2], ["FFSP", 2, 0, [4, 3, 2, 1], 1, 1], ["AN", 2, 1, 6], ["PR", 5, 0, "auto_unroll_max_step$0"]]]], "r": [[2.25924e-05, 2.25925e-05, 2.25911e-05, 2.25911e-05], 0, 3.49909, 1664295070], "v": "v0.6"}
{"i": [["[\"202242e10b6ca40b0d7329fe3a725f1f\", [27, 36, 1, 1], [2, 36, 1, 1], [1, 2, 1, 1], [27, 2, 1, 1]]", "cuda -keys=cuda,gpu -arch=sm_80 -max_num_threads=1024 -thread_warp_size=32", [-1, 16, 64, 49152, 2147483647, 1024, 8, 32], "", 0, []], [[], [["CI", 5], ["SP", 3, 0, 27, [1, 9, 1, 1], 1], ["SP", 3, 5, 2, [2, 1, 1, 1], 1], ["SP", 3, 10, 1, [1, 1, 1, 1], 1], ["SP", 3, 15, 1, [1, 1, 1, 1], 1], ["SP", 3, 20, 36, [3, 2], 1], ["SP", 3, 23, 1, [1, 1], 1], ["SP", 3, 26, 1, [1, 1], 1], ["RE", 3, [0, 5, 10, 15, 1, 6, 11, 16, 2, 7, 12, 17, 20, 23, 26, 21, 24, 27, 3, 8, 13, 18, 22, 25, 28, 4, 9, 14, 19]], ["FSP", 6, 0, 1, 3], ["FSP", 6, 4, 2, 3], ["FSP", 6, 8, 3, 3], ["FSP", 6, 12, 4, 3], ["RE", 6, [0, 4, 8, 12, 1, 5, 9, 13, 2, 6, 10, 14, 3, 7, 11, 15]], ["CA", 3, 6, 11], ["CHR", 2, "shared", [3]], ["CA", 3, 4, 14], ["CHR", 1, "shared", [4]], ["CA", 2, 5, 14], ["CI", 1], ["FU", 8, [0, 1, 2, 3]], ["AN", 8, 0, 5], ["FU", 8, [1, 2, 3, 4]], ["AN", 8, 1, 4], ["FU", 8, [2, 3, 4, 5]], ["AN", 8, 2, 6], ["FU", 4, [0, 1, 2, 3]], ["SP", 4, 0, 6, [2], 1], ["AN", 4, 1, 2], ["FFSP", 4, 0, [4, 3, 2, 1], 1, 1], ["AN", 4, 1, 6], ["FU", 2, [0, 1, 2, 3]], ["SP", 2, 0, 6, [1], 1], ["AN", 2, 1, 2], ["FFSP", 2, 0, [4, 3, 2, 1], 1, 1], ["AN", 2, 1, 6], ["PR", 5, 0, "auto_unroll_max_step$512"]]]], "r": [[3.10982e-06, 3.10981e-06, 3.10983e-06, 3.10983e-06], 0, 2.25649, 1664295072], "v": "v0.6"}
{"i": [["[\"202242e10b6ca40b0d7329fe3a725f1f\", [27, 36, 1, 1], [2, 36, 1, 1], [1, 2, 1, 1], [27, 2, 1, 1]]", "cuda -keys=cuda,gpu -arch=sm_80 -max_num_threads=1024 -thread_warp_size=32", [-1, 16, 64, 49152, 2147483647, 1024, 8, 32], "", 0, []], [[], [["CI", 5], ["SP", 3, 0, 27, [1, 3, 1, 9], 1], ["SP", 3, 5, 2, [1, 1, 2, 1], 1], ["SP", 3, 10, 1, [1, 1, 1, 1], 1], ["SP", 3, 15, 1, [1, 1, 1, 1], 1], ["SP", 3, 20, 36, [2, 6], 1], ["SP", 3, 23, 1, [1, 1], 1], ["SP", 3, 26, 1, [1, 1], 1], ["RE", 3, [0, 5, 10, 15, 1, 6, 11, 16, 2, 7, 12, 17, 20, 23, 26, 21, 24, 27, 3, 8, 13, 18, 22, 25, 28, 4, 9, 14, 19]], ["FSP", 6, 0, 1, 3], ["FSP", 6, 4, 2, 3], ["FSP", 6, 8, 3, 3], ["FSP", 6, 12, 4, 3], ["RE", 6, [0, 4, 8, 12, 1, 5, 9, 13, 2, 6, 10, 14, 3, 7, 11, 15]], ["CA", 3, 6, 11], ["CHR", 2, "shared", [3]], ["CA", 3, 4, 14], ["CHR", 1, "shared", [4]], ["CA", 2, 5, 14], ["CI", 1], ["FU", 8, [0, 1, 2, 3]], ["AN", 8, 0, 5], ["FU", 8, [1, 2, 3, 4]], ["AN", 8, 1, 4], ["FU", 8, [2, 3, 4, 5]], ["AN", 8, 2, 6], ["FU", 4, [0, 1, 2, 3]], ["SP", 4, 0, 24, [1], 1], ["AN", 4, 1, 2], ["FFSP", 4, 0, [4, 3, 2, 1], 1, 1], ["AN", 4, 1, 6], ["FU", 2, [0, 1, 2, 3]], ["SP", 2, 0, 108, [1], 1], ["AN", 2, 1, 2], ["FFSP", 2, 0, [4, 3, 2, 1], 1, 1], ["AN", 2, 1, 6], ["PR", 5, 0, "auto_unroll_max_step$64"]]]], "r": [[6.74906e-06, 6.751e-06, 6.74799e-06, 6.74978e-06], 0, 2.8051, 1664295074], "v": "v0.6"}
{"i": [["[\"202242e10b6ca40b0d7329fe3a725f1f\", [27, 36, 1, 1], [2, 36, 1, 1], [1, 2, 1, 1], [27, 2, 1, 1]]", "cuda -keys=cuda,gpu -arch=sm_80 -max_num_threads=1024 -thread_warp_size=32", [-1, 16, 64, 49152, 2147483647, 1024, 8, 32], "", 0, []], [[], [["CI", 5], ["SP", 3, 0, 27, [9, 3, 1, 1], 1], ["SP", 3, 5, 2, [1, 1, 1, 2], 1], ["SP", 3, 10, 1, [1, 1, 1, 1], 1], ["SP", 3, 15, 1, [1, 1, 1, 1], 1], ["SP", 3, 20, 36, [6, 1], 1], ["SP", 3, 23, 1, [1, 1], 1], ["SP", 3, 26, 1, [1, 1], 1], ["RE", 3, [0, 5, 10, 15, 1, 6, 11, 16, 2, 7, 12, 17, 20, 23, 26, 21, 24, 27, 3, 8, 13, 18, 22, 25, 28, 4, 9, 14, 19]], ["FSP", 6, 0, 1, 3], ["FSP", 6, 4, 2, 3], ["FSP", 6, 8, 3, 3], ["FSP", 6, 12, 4, 3], ["RE", 6, [0, 4, 8, 12, 1, 5, 9, 13, 2, 6, 10, 14, 3, 7, 11, 15]], ["CA", 3, 6, 11], ["CHR", 2, "shared", [3]], ["CA", 3, 4, 14], ["CHR", 1, "shared", [4]], ["CA", 2, 5, 14], ["CI", 1], ["FU", 8, [0, 1, 2, 3]], ["AN", 8, 0, 5], ["FU", 8, [1, 2, 3, 4]], ["AN", 8, 1, 4], ["FU", 8, [2, 3, 4, 5]], ["AN", 8, 2, 6], ["FU", 4, [0, 1, 2, 3]], ["SP", 4, 0, 6, [2], 1], ["AN", 4, 1, 2], ["FFSP", 4, 0, [4, 3, 2, 1], 1, 1], ["AN", 4, 1, 6], ["FU", 2, [0, 1, 2, 3]], ["SP", 2, 0, 6, [1], 1], ["AN", 2, 1, 2], ["FFSP", 2, 0, [4, 3, 2, 1], 1, 1], ["AN", 2, 1, 6], ["PR", 5, 0, "auto_unroll_max_step$0"]]]], "r": [[8.06872e-06, 8.06904e-06, 8.06902e-06, 8.06876e-06], 0, 2.6163, 1664295077], "v": "v0.6"}
{"i": [["[\"202242e10b6ca40b0d7329fe3a725f1f\", [27, 36, 1, 1], [2, 36, 1, 1], [1, 2, 1, 1], [27, 2, 1, 1]]", "cuda -keys=cuda,gpu -arch=sm_80 -max_num_threads=1024 -thread_warp_size=32", [-1, 16, 64, 49152, 2147483647, 1024, 8, 32], "", 0, []], [[], [["CI", 5], ["SP", 3, 0, 27, [1, 3, 1, 3], 1], ["SP", 3, 5, 2, [1, 1, 2, 1], 1], ["SP", 3, 10, 1, [1, 1, 1, 1], 1], ["SP", 3, 15, 1, [1, 1, 1, 1], 1], ["SP", 3, 20, 36, [6, 1], 1], ["SP", 3, 23, 1, [1, 1], 1], ["SP", 3, 26, 1, [1, 1], 1], ["RE", 3, [0, 5, 10, 15, 1, 6, 11, 16, 2, 7, 12, 17, 20, 23, 26, 21, 24, 27, 3, 8, 13, 18, 22, 25, 28, 4, 9, 14, 19]], ["FSP", 6, 0, 1, 3], ["FSP", 6, 4, 2, 3], ["FSP", 6, 8, 3, 3], ["FSP", 6, 12, 4, 3], ["RE", 6, [0, 4, 8, 12, 1, 5, 9, 13, 2, 6, 10, 14, 3, 7, 11, 15]], ["CA", 3, 6, 11], ["CHR", 2, "shared", [3]], ["CA", 3, 4, 14], ["CHR", 1, "shared", [4]], ["CA", 2, 5, 14], ["CI", 1], ["FU", 8, [0, 1, 2, 3]], ["AN", 8, 0, 5], ["FU", 8, [1, 2, 3, 4]], ["AN", 8, 1, 4], ["FU", 8, [2, 3, 4, 5]], ["AN", 8, 2, 6], ["FU", 4, [0, 1, 2, 3]], ["SP", 4, 0, 4, [1], 1], ["AN", 4, 1, 2], ["FFSP", 4, 0, [4, 3, 2, 1], 1, 1], ["AN", 4, 1, 6], ["FU", 2, [0, 1, 2, 3]], ["SP", 2, 0, 12, [1], 1], ["AN", 2, 1, 2], ["FFSP", 2, 0, [4, 3, 2, 1], 1, 1], ["AN", 2, 1, 6], ["PR", 5, 0, "auto_unroll_max_step$16"]]]], "r": [[4.80664e-06, 4.80783e-06, 4.8075e-06, 4.8062e-06], 0, 2.43024, 1664295079], "v": "v0.6"}
{"i": [["[\"202242e10b6ca40b0d7329fe3a725f1f\", [27, 36, 1, 1], [2, 36, 1, 1], [1, 2, 1, 1], [27, 2, 1, 1]]", "cuda -keys=cuda,gpu -arch=sm_80 -max_num_threads=1024 -thread_warp_size=32", [-1, 16, 64, 49152, 2147483647, 1024, 8, 32], "", 0, []], [[], [["CI", 5], ["SP", 3, 0, 27, [3, 1, 1, 1], 1], ["SP", 3, 5, 2, [1, 1, 1, 2], 1], ["SP", 3, 10, 1, [1, 1, 1, 1], 1], ["SP", 3, 15, 1, [1, 1, 1, 1], 1], ["SP", 3, 20, 36, [1, 1], 1], ["SP", 3, 23, 1, [1, 1], 1], ["SP", 3, 26, 1, [1, 1], 1], ["RE", 3, [0, 5, 10, 15, 1, 6, 11, 16, 2, 7, 12, 17, 20, 23, 26, 21, 24, 27, 3, 8, 13, 18, 22, 25, 28, 4, 9, 14, 19]], ["FSP", 6, 0, 1, 3], ["FSP", 6, 4, 2, 3], ["FSP", 6, 8, 3, 3], ["FSP", 6, 12, 4, 3], ["RE", 6, [0, 4, 8, 12, 1, 5, 9, 13, 2, 6, 10, 14, 3, 7, 11, 15]], ["CA", 3, 6, 11], ["CHR", 2, "shared", [3]], ["CA", 3, 4, 14], ["CHR", 1, "shared", [4]], ["CA", 2, 5, 14], ["CI", 1], ["FU", 8, [0, 1, 2, 3]], ["AN", 8, 0, 5], ["FU", 8, [1, 2, 3, 4]], ["AN", 8, 1, 4], ["FU", 8, [2, 3, 4, 5]], ["AN", 8, 2, 6], ["FU", 4, [0, 1, 2, 3]], ["SP", 4, 0, 4, [1], 1], ["AN", 4, 1, 2], ["FFSP", 4, 0, [4, 3, 2, 1], 1, 1], ["AN", 4, 1, 6], ["FU", 2, [0, 1, 2, 3]], ["SP", 2, 0, 2, [1], 1], ["AN", 2, 1, 2], ["FFSP", 2, 0, [4, 3, 2, 1], 1, 1], ["AN", 2, 1, 6], ["PR", 5, 0, "auto_unroll_max_step$1024"]]]], "r": [[6.0639e-06, 6.05526e-06, 6.05617e-06, 6.05717e-06], 0, 2.5835, 1664295081], "v": "v0.6"}
{"i": [["[\"202242e10b6ca40b0d7329fe3a725f1f\", [27, 36, 1, 1], [2, 36, 1, 1], [1, 2, 1, 1], [27, 2, 1, 1]]", "cuda -keys=cuda,gpu -arch=sm_80 -max_num_threads=1024 -thread_warp_size=32", [-1, 16, 64, 49152, 2147483647, 1024, 8, 32], "", 0, []], [[], [["CI", 5], ["SP", 3, 0, 27, [1, 3, 1, 1], 1], ["SP", 3, 5, 2, [2, 1, 1, 1], 1], ["SP", 3, 10, 1, [1, 1, 1, 1], 1], ["SP", 3, 15, 1, [1, 1, 1, 1], 1], ["SP", 3, 20, 36, [1, 9], 1], ["SP", 3, 23, 1, [1, 1], 1], ["SP", 3, 26, 1, [1, 1], 1], ["RE", 3, [0, 5, 10, 15, 1, 6, 11, 16, 2, 7, 12, 17, 20, 23, 26, 21, 24, 27, 3, 8, 13, 18, 22, 25, 28, 4, 9, 14, 19]], ["FSP", 6, 0, 1, 3], ["FSP", 6, 4, 2, 3], ["FSP", 6, 8, 3, 3], ["FSP", 6, 12, 4, 3], ["RE", 6, [0, 4, 8, 12, 1, 5, 9, 13, 2, 6, 10, 14, 3, 7, 11, 15]], ["CA", 3, 6, 11], ["CHR", 2, "shared", [3]], ["CA", 3, 4, 14], ["CHR", 1, "shared", [4]], ["CA", 2, 5, 14], ["CI", 1], ["FU", 8, [0, 1, 2, 3]], ["AN", 8, 0, 5], ["FU", 8, [1, 2, 3, 4]], ["AN", 8, 1, 4], ["FU", 8, [2, 3, 4, 5]], ["AN", 8, 2, 6], ["FU", 4, [0, 1, 2, 3]], ["SP", 4, 0, 9, [1], 1], ["AN", 4, 1, 2], ["FFSP", 4, 0, [4, 3, 2, 1], 1, 1], ["AN", 4, 1, 6], ["FU", 2, [0, 1, 2, 3]], ["SP", 2, 0, 9, [1], 1], ["AN", 2, 1, 2], ["FFSP", 2, 0, [4, 3, 2, 1], 1, 1], ["AN", 2, 1, 6], ["PR", 5, 0, "auto_unroll_max_step$0"]]]], "r": [[3.21545e-06, 3.21544e-06, 3.21546e-06, 3.21548e-06], 0, 2.26318, 1664295083], "v": "v0.6"}
{"i": [["[\"202242e10b6ca40b0d7329fe3a725f1f\", [27, 36, 1, 1], [2, 36, 1, 1], [1, 2, 1, 1], [27, 2, 1, 1]]", "cuda -keys=cuda,gpu -arch=sm_80 -max_num_threads=1024 -thread_warp_size=32", [-1, 16, 64, 49152, 2147483647, 1024, 8, 32], "", 0, []], [[], [["CI", 5], ["SP", 3, 0, 27, [1, 1, 1, 3], 1], ["SP", 3, 5, 2, [1, 1, 2, 1], 1], ["SP", 3, 10, 1, [1, 1, 1, 1], 1], ["SP", 3, 15, 1, [1, 1, 1, 1], 1], ["SP", 3, 20, 36, [3, 4], 1], ["SP", 3, 23, 1, [1, 1], 1], ["SP", 3, 26, 1, [1, 1], 1], ["RE", 3, [0, 5, 10, 15, 1, 6, 11, 16, 2, 7, 12, 17, 20, 23, 26, 21, 24, 27, 3, 8, 13, 18, 22, 25, 28, 4, 9, 14, 19]], ["FSP", 6, 0, 1, 3], ["FSP", 6, 4, 2, 3], ["FSP", 6, 8, 3, 3], ["FSP", 6, 12, 4, 3], ["RE", 6, [0, 4, 8, 12, 1, 5, 9, 13, 2, 6, 10, 14, 3, 7, 11, 15]], ["CA", 3, 6, 11], ["CHR", 2, "shared", [3]], ["CA", 3, 4, 14], ["CHR", 1, "shared", [4]], ["CA", 2, 5, 14], ["CI", 1], ["FU", 8, [0, 1, 2, 3]], ["AN", 8, 0, 5], ["FU", 8, [1, 2, 3, 4]], ["AN", 8, 1, 4], ["FU", 8, [2, 3, 4, 5]], ["AN", 8, 2, 6], ["FU", 4, [0, 1, 2, 3]], ["SP", 4, 0, 24, [1], 1], ["AN", 4, 1, 2], ["FFSP", 4, 0, [4, 3, 2, 1], 1, 1], ["AN", 4, 1, 6], ["FU", 2, [0, 1, 2, 3]], ["SP", 2, 0, 36, [1], 1], ["AN", 2, 1, 2], ["FFSP", 2, 0, [4, 3, 2, 1], 1, 1], ["AN", 2, 1, 6], ["PR", 5, 0, "auto_unroll_max_step$64"]]]], "r": [[5.78183e-06, 5.75913e-06, 5.75877e-06, 5.75936e-06], 0, 2.51956, 1664295085], "v": "v0.6"}
{"i": [["[\"202242e10b6ca40b0d7329fe3a725f1f\", [27, 36, 1, 1], [2, 36, 1, 1], [1, 2, 1, 1], [27, 2, 1, 1]]", "cuda -keys=cuda,gpu -arch=sm_80 -max_num_threads=1024 -thread_warp_size=32", [-1, 16, 64, 49152, 2147483647, 1024, 8, 32], "", 0, []], [[], [["CI", 5], ["SP", 3, 0, 27, [1, 1, 1, 27], 1], ["SP", 3, 5, 2, [1, 1, 2, 1], 1], ["SP", 3, 10, 1, [1, 1, 1, 1], 1], ["SP", 3, 15, 1, [1, 1, 1, 1], 1], ["SP", 3, 20, 36, [18, 1], 1], ["SP", 3, 23, 1, [1, 1], 1], ["SP", 3, 26, 1, [1, 1], 1], ["RE", 3, [0, 5, 10, 15, 1, 6, 11, 16, 2, 7, 12, 17, 20, 23, 26, 21, 24, 27, 3, 8, 13, 18, 22, 25, 28, 4, 9, 14, 19]], ["FSP", 6, 0, 1, 3], ["FSP", 6, 4, 2, 3], ["FSP", 6, 8, 3, 3], ["FSP", 6, 12, 4, 3], ["RE", 6, [0, 4, 8, 12, 1, 5, 9, 13, 2, 6, 10, 14, 3, 7, 11, 15]], ["CA", 3, 6, 11], ["CHR", 2, "shared", [3]], ["CA", 3, 4, 14], ["CHR", 1, "shared", [4]], ["CA", 2, 5, 14], ["CI", 1], ["FU", 8, [0, 1, 2, 3]], ["AN", 8, 0, 5], ["FU", 8, [1, 2, 3, 4]], ["AN", 8, 1, 4], ["FU", 8, [2, 3, 4, 5]], ["AN", 8, 2, 6], ["FU", 4, [0, 1, 2, 3]], ["SP", 4, 0, 36, [1], 1], ["AN", 4, 1, 2], ["FFSP", 4, 0, [4, 3, 2, 1], 1, 1], ["AN", 4, 1, 6], ["FU", 2, [0, 1, 2, 3]], ["SP", 2, 0, 486, [1], 1], ["AN", 2, 1, 2], ["FFSP", 2, 0, [4, 3, 2, 1], 1, 1], ["AN", 2, 1, 6], ["PR", 5, 0, "auto_unroll_max_step$1024"]]]], "r": [[1.09915e-05, 1.0991e-05, 1.0991e-05, 1.09851e-05], 0, 4.70565, 1664295087], "v": "v0.6"}
{"i": [["[\"202242e10b6ca40b0d7329fe3a725f1f\", [27, 36, 1, 1], [2, 36, 1, 1], [1, 2, 1, 1], [27, 2, 1, 1]]", "cuda -keys=cuda,gpu -arch=sm_80 -max_num_threads=1024 -thread_warp_size=32", [-1, 16, 64, 49152, 2147483647, 1024, 8, 32], "", 0, []], [[], [["CI", 5], ["SP", 3, 0, 27, [1, 1, 1, 1], 1], ["SP", 3, 5, 2, [1, 1, 2, 1], 1], ["SP", 3, 10, 1, [1, 1, 1, 1], 1], ["SP", 3, 15, 1, [1, 1, 1, 1], 1], ["SP", 3, 20, 36, [4, 3], 1], ["SP", 3, 23, 1, [1, 1], 1], ["SP", 3, 26, 1, [1, 1], 1], ["RE", 3, [0, 5, 10, 15, 1, 6, 11, 16, 2, 7, 12, 17, 20, 23, 26, 21, 24, 27, 3, 8, 13, 18, 22, 25, 28, 4, 9, 14, 19]], ["FSP", 6, 0, 1, 3], ["FSP", 6, 4, 2, 3], ["FSP", 6, 8, 3, 3], ["FSP", 6, 12, 4, 3], ["RE", 6, [0, 4, 8, 12, 1, 5, 9, 13, 2, 6, 10, 14, 3, 7, 11, 15]], ["CA", 3, 6, 11], ["CHR", 2, "shared", [3]], ["CA", 3, 4, 14], ["CHR", 1, "shared", [4]], ["CA", 2, 5, 14], ["CI", 1], ["FU", 8, [0, 1, 2, 3]], ["AN", 8, 0, 5], ["FU", 8, [1, 2, 3, 4]], ["AN", 8, 1, 4], ["FU", 8, [2, 3, 4, 5]], ["AN", 8, 2, 6], ["FU", 4, [0, 1, 2, 3]], ["SP", 4, 0, 24, [1], 1], ["AN", 4, 1, 2], ["FFSP", 4, 0, [4, 3, 2, 1], 1, 1], ["AN", 4, 1, 6], ["FU", 2, [0, 1, 2, 3]], ["SP", 2, 0, 12, [1], 1], ["AN", 2, 1, 2], ["FFSP", 2, 0, [4, 3, 2, 1], 1, 1], ["AN", 2, 1, 6], ["PR", 5, 0, "auto_unroll_max_step$512"]]]], "r": [[3.87707e-06, 3.8767e-06, 3.87683e-06, 3.87253e-06], 0, 2.2835, 1664295089], "v": "v0.6"}
{"i": [["[\"202242e10b6ca40b0d7329fe3a725f1f\", [27, 36, 1, 1], [2, 36, 1, 1], [1, 2, 1, 1], [27, 2, 1, 1]]", "cuda -keys=cuda,gpu -arch=sm_80 -max_num_threads=1024 -thread_warp_size=32", [-1, 16, 64, 49152, 2147483647, 1024, 8, 32], "", 0, []], [[], [["CI", 5], ["SP", 3, 0, 27, [3, 1, 1, 3], 1], ["SP", 3, 5, 2, [1, 1, 2, 1], 1], ["SP", 3, 10, 1, [1, 1, 1, 1], 1], ["SP", 3, 15, 1, [1, 1, 1, 1], 1], ["SP", 3, 20, 36, [12, 1], 1], ["SP", 3, 23, 1, [1, 1], 1], ["SP", 3, 26, 1, [1, 1], 1], ["RE", 3, [0, 5, 10, 15, 1, 6, 11, 16, 2, 7, 12, 17, 20, 23, 26, 21, 24, 27, 3, 8, 13, 18, 22, 25, 28, 4, 9, 14, 19]], ["FSP", 6, 0, 1, 3], ["FSP", 6, 4, 2, 3], ["FSP", 6, 8, 3, 3], ["FSP", 6, 12, 4, 3], ["RE", 6, [0, 4, 8, 12, 1, 5, 9, 13, 2, 6, 10, 14, 3, 7, 11, 15]], ["CA", 3, 6, 11], ["CHR", 2, "shared", [3]], ["CA", 3, 4, 14], ["CHR", 1, "shared", [4]], ["CA", 2, 5, 14], ["CI", 1], ["FU", 8, [0, 1, 2, 3]], ["AN", 8, 0, 5], ["FU", 8, [1, 2, 3, 4]], ["AN", 8, 1, 4], ["FU", 8, [2, 3, 4, 5]], ["AN", 8, 2, 6], ["FU", 4, [0, 1, 2, 3]], ["SP", 4, 0, 24, [1], 1], ["AN", 4, 1, 2], ["FFSP", 4, 0, [4, 3, 2, 1], 1, 1], ["AN", 4, 1, 6], ["FU", 2, [0, 1, 2, 3]], ["SP", 2, 0, 36, [1], 1], ["AN", 2, 1, 2], ["FFSP", 2, 0, [4, 3, 2, 1], 1, 1], ["AN", 2, 1, 6], ["PR", 5, 0, "auto_unroll_max_step$16"]]]], "r": [[7.40472e-06, 7.40482e-06, 7.40523e-06, 7.40458e-06], 0, 2.64497, 1664295091], "v": "v0.6"}
{"i": [["[\"202242e10b6ca40b0d7329fe3a725f1f\", [27, 36, 1, 1], [2, 36, 1, 1], [1, 2, 1, 1], [27, 2, 1, 1]]", "cuda -keys=cuda,gpu -arch=sm_80 -max_num_threads=1024 -thread_warp_size=32", [-1, 16, 64, 49152, 2147483647, 1024, 8, 32], "", 0, []], [[], [["CI", 5], ["SP", 3, 0, 27, [3, 1, 1, 1], 1], ["SP", 3, 5, 2, [1, 1, 1, 1], 1], ["SP", 3, 10, 1, [1, 1, 1, 1], 1], ["SP", 3, 15, 1, [1, 1, 1, 1], 1], ["SP", 3, 20, 36, [3, 6], 1], ["SP", 3, 23, 1, [1, 1], 1], ["SP", 3, 26, 1, [1, 1], 1], ["RE", 3, [0, 5, 10, 15, 1, 6, 11, 16, 2, 7, 12, 17, 20, 23, 26, 21, 24, 27, 3, 8, 13, 18, 22, 25, 28, 4, 9, 14, 19]], ["FSP", 6, 0, 1, 3], ["FSP", 6, 4, 2, 3], ["FSP", 6, 8, 3, 3], ["FSP", 6, 12, 4, 3], ["RE", 6, [0, 4, 8, 12, 1, 5, 9, 13, 2, 6, 10, 14, 3, 7, 11, 15]], ["CA", 3, 6, 11], ["CHR", 2, "shared", [3]], ["CA", 3, 4, 14], ["CHR", 1, "shared", [4]], ["CA", 2, 5, 14], ["CI", 1], ["FU", 8, [0, 1, 2, 3]], ["AN", 8, 0, 5], ["FU", 8, [1, 2, 3, 4]], ["AN", 8, 1, 4], ["FU", 8, [2, 3, 4, 5]], ["AN", 8, 2, 6], ["FU", 4, [0, 1, 2, 3]], ["SP", 4, 0, 18, [1], 1], ["AN", 4, 1, 2], ["FFSP", 4, 0, [4, 3, 2, 1], 1, 1], ["AN", 4, 1, 6], ["FU", 2, [0, 1, 2, 3]], ["SP", 2, 0, 18, [1], 1], ["AN", 2, 1, 2], ["FFSP", 2, 0, [4, 3, 2, 1], 1, 1], ["AN", 2, 1, 6], ["PR", 5, 0, "auto_unroll_max_step$1024"]]]], "r": [[4.84486e-06, 4.84483e-06, 4.8446e-06, 4.84458e-06], 0, 2.47279, 1664295093], "v": "v0.6"}
{"i": [["[\"202242e10b6ca40b0d7329fe3a725f1f\", [27, 36, 1, 1], [2, 36, 1, 1], [1, 2, 1, 1], [27, 2, 1, 1]]", "cuda -keys=cuda,gpu -arch=sm_80 -max_num_threads=1024 -thread_warp_size=32", [-1, 16, 64, 49152, 2147483647, 1024, 8, 32], "", 0, []], [[], [["CI", 5], ["SP", 3, 0, 27, [1, 9, 1, 1], 1], ["SP", 3, 5, 2, [1, 1, 1, 2], 1], ["SP", 3, 10, 1, [1, 1, 1, 1], 1], ["SP", 3, 15, 1, [1, 1, 1, 1], 1], ["SP", 3, 20, 36, [2, 18], 1], ["SP", 3, 23, 1, [1, 1], 1], ["SP", 3, 26, 1, [1, 1], 1], ["RE", 3, [0, 5, 10, 15, 1, 6, 11, 16, 2, 7, 12, 17, 20, 23, 26, 21, 24, 27, 3, 8, 13, 18, 22, 25, 28, 4, 9, 14, 19]], ["FSP", 6, 0, 1, 3], ["FSP", 6, 4, 2, 3], ["FSP", 6, 8, 3, 3], ["FSP", 6, 12, 4, 3], ["RE", 6, [0, 4, 8, 12, 1, 5, 9, 13, 2, 6, 10, 14, 3, 7, 11, 15]], ["CA", 3, 6, 11], ["CHR", 2, "shared", [3]], ["CA", 3, 4, 14], ["CHR", 1, "shared", [4]], ["CA", 2, 5, 14], ["CI", 1], ["FU", 8, [0, 1, 2, 3]], ["AN", 8, 0, 5], ["FU", 8, [1, 2, 3, 4]], ["AN", 8, 1, 4], ["FU", 8, [2, 3, 4, 5]], ["AN", 8, 2, 6], ["FU", 4, [0, 1, 2, 3]], ["SP", 4, 0, 72, [24], 1], ["AN", 4, 1, 2], ["FFSP", 4, 0, [4, 3, 2, 1], 1, 1], ["AN", 4, 1, 6], ["FU", 2, [0, 1, 2, 3]], ["SP", 2, 0, 36, [1], 1], ["AN", 2, 1, 2], ["FFSP", 2, 0, [4, 3, 2, 1], 1, 1], ["AN", 2, 1, 6], ["PR", 5, 0, "auto_unroll_max_step$1024"]]]], "r": [[3.12506e-06, 3.12527e-06, 3.12683e-06, 3.12739e-06], 0, 3.11053, 1664295096], "v": "v0.6"}
{"i": [["[\"202242e10b6ca40b0d7329fe3a725f1f\", [27, 36, 1, 1], [2, 36, 1, 1], [1, 2, 1, 1], [27, 2, 1, 1]]", "cuda -keys=cuda,gpu -arch=sm_80 -max_num_threads=1024 -thread_warp_size=32", [-1, 16, 64, 49152, 2147483647, 1024, 8, 32], "", 0, []], [[], [["CI", 5], ["SP", 3, 0, 27, [1, 1, 1, 1], 1], ["SP", 3, 5, 2, [1, 2, 1, 1], 1], ["SP", 3, 10, 1, [1, 1, 1, 1], 1], ["SP", 3, 15, 1, [1, 1, 1, 1], 1], ["SP", 3, 20, 36, [9, 2], 1], ["SP", 3, 23, 1, [1, 1], 1], ["SP", 3, 26, 1, [1, 1], 1], ["RE", 3, [0, 5, 10, 15, 1, 6, 11, 16, 2, 7, 12, 17, 20, 23, 26, 21, 24, 27, 3, 8, 13, 18, 22, 25, 28, 4, 9, 14, 19]], ["FSP", 6, 0, 1, 3], ["FSP", 6, 4, 2, 3], ["FSP", 6, 8, 3, 3], ["FSP", 6, 12, 4, 3], ["RE", 6, [0, 4, 8, 12, 1, 5, 9, 13, 2, 6, 10, 14, 3, 7, 11, 15]], ["CA", 3, 6, 11], ["CHR", 2, "shared", [3]], ["CA", 3, 4, 14], ["CHR", 1, "shared", [4]], ["CA", 2, 5, 14], ["CI", 1], ["FU", 8, [0, 1, 2, 3]], ["AN", 8, 0, 5], ["FU", 8, [1, 2, 3, 4]], ["AN", 8, 1, 4], ["FU", 8, [2, 3, 4, 5]], ["AN", 8, 2, 6], ["FU", 4, [0, 1, 2, 3]], ["SP", 4, 0, 18, [1], 1], ["AN", 4, 1, 2], ["FFSP", 4, 0, [4, 3, 2, 1], 1, 1], ["AN", 4, 1, 6], ["FU", 2, [0, 1, 2, 3]], ["SP", 2, 0, 162, [1], 1], ["AN", 2, 1, 2], ["FFSP", 2, 0, [4, 3, 2, 1], 1, 1], ["AN", 2, 1, 6], ["PR", 5, 0, "auto_unroll_max_step$1024"]]]], "r": [[2.95136e-06, 2.95138e-06, 2.9514e-06, 2.95137e-06], 0, 2.21004, 1664295098], "v": "v0.6"}
{"i": [["[\"202242e10b6ca40b0d7329fe3a725f1f\", [27, 36, 1, 1], [2, 36, 1, 1], [1, 2, 1, 1], [27, 2, 1, 1]]", "cuda -keys=cuda,gpu -arch=sm_80 -max_num_threads=1024 -thread_warp_size=32", [-1, 16, 64, 49152, 2147483647, 1024, 8, 32], "", 0, []], [[], [["CI", 5], ["SP", 3, 0, 27, [1, 9, 3, 1], 1], ["SP", 3, 5, 2, [1, 1, 2, 1], 1], ["SP", 3, 10, 1, [1, 1, 1, 1], 1], ["SP", 3, 15, 1, [1, 1, 1, 1], 1], ["SP", 3, 20, 36, [1, 18], 1], ["SP", 3, 23, 1, [1, 1], 1], ["SP", 3, 26, 1, [1, 1], 1], ["RE", 3, [0, 5, 10, 15, 1, 6, 11, 16, 2, 7, 12, 17, 20, 23, 26, 21, 24, 27, 3, 8, 13, 18, 22, 25, 28, 4, 9, 14, 19]], ["FSP", 6, 0, 1, 3], ["FSP", 6, 4, 2, 3], ["FSP", 6, 8, 3, 3], ["FSP", 6, 12, 4, 3], ["RE", 6, [0, 4, 8, 12, 1, 5, 9, 13, 2, 6, 10, 14, 3, 7, 11, 15]], ["CA", 3, 6, 11], ["CHR", 2, "shared", [3]], ["CA", 3, 4, 14], ["CHR", 1, "shared", [4]], ["CA", 2, 5, 14], ["CI", 1], ["FU", 8, [0, 1, 2, 3]], ["AN", 8, 0, 5], ["FU", 8, [1, 2, 3, 4]], ["AN", 8, 1, 4], ["FU", 8, [2, 3, 4, 5]], ["AN", 8, 2, 6], ["FU", 4, [0, 1, 2, 3]], ["SP", 4, 0, 36, [1], 1], ["AN", 4, 1, 2], ["FFSP", 4, 0, [4, 3, 2, 1], 1, 1], ["AN", 4, 1, 6], ["FU", 2, [0, 1, 2, 3]], ["SP", 2, 0, 54, [1], 1], ["AN", 2, 1, 2], ["FFSP", 2, 0, [4, 3, 2, 1], 1, 1], ["AN", 2, 1, 6], ["PR", 5, 0, "auto_unroll_max_step$1024"]]]], "r": [[3.56738e-06, 3.56714e-06, 3.56739e-06, 3.56754e-06], 0, 2.38328, 1664295100], "v": "v0.6"}
{"i": [["[\"202242e10b6ca40b0d7329fe3a725f1f\", [27, 36, 1, 1], [2, 36, 1, 1], [1, 2, 1, 1], [27, 2, 1, 1]]", "cuda -keys=cuda,gpu -arch=sm_80 -max_num_threads=1024 -thread_warp_size=32", [-1, 16, 64, 49152, 2147483647, 1024, 8, 32], "", 0, []], [[], [["CI", 5], ["SP", 3, 0, 27, [1, 1, 9, 1], 1], ["SP", 3, 5, 2, [2, 1, 1, 1], 1], ["SP", 3, 10, 1, [1, 1, 1, 1], 1], ["SP", 3, 15, 1, [1, 1, 1, 1], 1], ["SP", 3, 20, 36, [4, 1], 1], ["SP", 3, 23, 1, [1, 1], 1], ["SP", 3, 26, 1, [1, 1], 1], ["RE", 3, [0, 5, 10, 15, 1, 6, 11, 16, 2, 7, 12, 17, 20, 23, 26, 21, 24, 27, 3, 8, 13, 18, 22, 25, 28, 4, 9, 14, 19]], ["FSP", 6, 0, 1, 3], ["FSP", 6, 4, 2, 3], ["FSP", 6, 8, 3, 3], ["FSP", 6, 12, 4, 3], ["RE", 6, [0, 4, 8, 12, 1, 5, 9, 13, 2, 6, 10, 14, 3, 7, 11, 15]], ["CA", 3, 6, 11], ["CHR", 2, "shared", [3]], ["CA", 3, 4, 14], ["CHR", 1, "shared", [4]], ["CA", 2, 5, 14], ["CI", 1], ["FU", 8, [0, 1, 2, 3]], ["AN", 8, 0, 5], ["FU", 8, [1, 2, 3, 4]], ["AN", 8, 1, 4], ["FU", 8, [2, 3, 4, 5]], ["AN", 8, 2, 6], ["FU", 4, [0, 1, 2, 3]], ["SP", 4, 0, 8, [2], 1], ["AN", 4, 1, 2], ["FFSP", 4, 0, [4, 3, 2, 1], 1, 1], ["AN", 4, 1, 6], ["FU", 2, [0, 1, 2, 3]], ["SP", 2, 0, 36, [1], 1], ["AN", 2, 1, 2], ["FFSP", 2, 0, [4, 3, 2, 1], 1, 1], ["AN", 2, 1, 6], ["PR", 5, 0, "auto_unroll_max_step$16"]]]], "r": [[7.48949e-06, 7.48953e-06, 7.48946e-06, 7.48942e-06], 0, 2.5812, 1664295102], "v": "v0.6"}
{"i": [["[\"202242e10b6ca40b0d7329fe3a725f1f\", [27, 36, 1, 1], [2, 36, 1, 1], [1, 2, 1, 1], [27, 2, 1, 1]]", "cuda -keys=cuda,gpu -arch=sm_80 -max_num_threads=1024 -thread_warp_size=32", [-1, 16, 64, 49152, 2147483647, 1024, 8, 32], "", 0, []], [[], [["CI", 5], ["SP", 3, 0, 27, [1, 1, 1, 1], 1], ["SP", 3, 5, 2, [1, 1, 2, 1], 1], ["SP", 3, 10, 1, [1, 1, 1, 1], 1], ["SP", 3, 15, 1, [1, 1, 1, 1], 1], ["SP", 3, 20, 36, [1, 18], 1], ["SP", 3, 23, 1, [1, 1], 1], ["SP", 3, 26, 1, [1, 1], 1], ["RE", 3, [0, 5, 10, 15, 1, 6, 11, 16, 2, 7, 12, 17, 20, 23, 26, 21, 24, 27, 3, 8, 13, 18, 22, 25, 28, 4, 9, 14, 19]], ["FSP", 6, 0, 1, 3], ["FSP", 6, 4, 2, 3], ["FSP", 6, 8, 3, 3], ["FSP", 6, 12, 4, 3], ["RE", 6, [0, 4, 8, 12, 1, 5, 9, 13, 2, 6, 10, 14, 3, 7, 11, 15]], ["CA", 3, 6, 11], ["CHR", 2, "shared", [3]], ["CA", 3, 4, 14], ["CHR", 1, "shared", [4]], ["CA", 2, 5, 14], ["CI", 1], ["FU", 8, [0, 1, 2, 3]], ["AN", 8, 0, 5], ["FU", 8, [1, 2, 3, 4]], ["AN", 8, 1, 4], ["FU", 8, [2, 3, 4, 5]], ["AN", 8, 2, 6], ["FU", 4, [0, 1, 2, 3]], ["SP", 4, 0, 18, [1], 1], ["AN", 4, 1, 2], ["FFSP", 4, 0, [4, 3, 2, 1], 1, 1], ["AN", 4, 1, 6], ["FU", 2, [0, 1, 2, 3]], ["SP", 2, 0, 18, [1], 1], ["AN", 2, 1, 2], ["FFSP", 2, 0, [4, 3, 2, 1], 1, 1], ["AN", 2, 1, 6], ["PR", 5, 0, "auto_unroll_max_step$1024"]]]], "r": [[3.91734e-06, 3.91737e-06, 3.91734e-06, 3.91738e-06], 0, 2.32853, 1664295104], "v": "v0.6"}
{"i": [["[\"202242e10b6ca40b0d7329fe3a725f1f\", [27, 36, 1, 1], [2, 36, 1, 1], [1, 2, 1, 1], [27, 2, 1, 1]]", "cuda -keys=cuda,gpu -arch=sm_80 -max_num_threads=1024 -thread_warp_size=32", [-1, 16, 64, 49152, 2147483647, 1024, 8, 32], "", 0, []], [[], [["CI", 5], ["SP", 3, 0, 27, [1, 27, 1, 1], 1], ["SP", 3, 5, 2, [1, 1, 1, 1], 1], ["SP", 3, 10, 1, [1, 1, 1, 1], 1], ["SP", 3, 15, 1, [1, 1, 1, 1], 1], ["SP", 3, 20, 36, [18, 1], 1], ["SP", 3, 23, 1, [1, 1], 1], ["SP", 3, 26, 1, [1, 1], 1], ["RE", 3, [0, 5, 10, 15, 1, 6, 11, 16, 2, 7, 12, 17, 20, 23, 26, 21, 24, 27, 3, 8, 13, 18, 22, 25, 28, 4, 9, 14, 19]], ["FSP", 6, 0, 1, 3], ["FSP", 6, 4, 2, 3], ["FSP", 6, 8, 3, 3], ["FSP", 6, 12, 4, 3], ["RE", 6, [0, 4, 8, 12, 1, 5, 9, 13, 2, 6, 10, 14, 3, 7, 11, 15]], ["CA", 3, 6, 11], ["CHR", 2, "shared", [3]], ["CA", 3, 4, 14], ["CHR", 1, "shared", [4]], ["CA", 2, 5, 14], ["CI", 1], ["FU", 8, [0, 1, 2, 3]], ["AN", 8, 0, 5], ["FU", 8, [1, 2, 3, 4]], ["AN", 8, 1, 4], ["FU", 8, [2, 3, 4, 5]], ["AN", 8, 2, 6], ["FU", 4, [0, 1, 2, 3]], ["SP", 4, 0, 18, [1], 1], ["AN", 4, 1, 2], ["FFSP", 4, 0, [4, 3, 2, 1], 1, 1], ["AN", 4, 1, 6], ["FU", 2, [0, 1, 2, 3]], ["SP", 2, 0, 18, [1], 1], ["AN", 2, 1, 2], ["FFSP", 2, 0, [4, 3, 2, 1], 1, 1], ["AN", 2, 1, 6], ["PR", 5, 0, "auto_unroll_max_step$64"]]]], "r": [[2.97115e-06, 2.97119e-06, 2.97119e-06, 2.97111e-06], 0, 2.16468, 1664295106], "v": "v0.6"}
{"i": [["[\"202242e10b6ca40b0d7329fe3a725f1f\", [27, 36, 1, 1], [2, 36, 1, 1], [1, 2, 1, 1], [27, 2, 1, 1]]", "cuda -keys=cuda,gpu -arch=sm_80 -max_num_threads=1024 -thread_warp_size=32", [-1, 16, 64, 49152, 2147483647, 1024, 8, 32], "", 0, []], [[], [["CI", 5], ["SP", 3, 0, 27, [1, 1, 1, 3], 1], ["SP", 3, 5, 2, [1, 2, 1, 1], 1], ["SP", 3, 10, 1, [1, 1, 1, 1], 1], ["SP", 3, 15, 1, [1, 1, 1, 1], 1], ["SP", 3, 20, 36, [6, 3], 1], ["SP", 3, 23, 1, [1, 1], 1], ["SP", 3, 26, 1, [1, 1], 1], ["RE", 3, [0, 5, 10, 15, 1, 6, 11, 16, 2, 7, 12, 17, 20, 23, 26, 21, 24, 27, 3, 8, 13, 18, 22, 25, 28, 4, 9, 14, 19]], ["FSP", 6, 0, 1, 3], ["FSP", 6, 4, 2, 3], ["FSP", 6, 8, 3, 3], ["FSP", 6, 12, 4, 3], ["RE", 6, [0, 4, 8, 12, 1, 5, 9, 13, 2, 6, 10, 14, 3, 7, 11, 15]], ["CA", 3, 6, 11], ["CHR", 2, "shared", [3]], ["CA", 3, 4, 14], ["CHR", 1, "shared", [4]], ["CA", 2, 5, 14], ["CI", 1], ["FU", 8, [0, 1, 2, 3]], ["AN", 8, 0, 5], ["FU", 8, [1, 2, 3, 4]], ["AN", 8, 1, 4], ["FU", 8, [2, 3, 4, 5]], ["AN", 8, 2, 6], ["FU", 4, [0, 1, 2, 3]], ["SP", 4, 0, 18, [1], 1], ["AN", 4, 1, 2], ["FFSP", 4, 0, [4, 3, 2, 1], 1, 1], ["AN", 4, 1, 6], ["FU", 2, [0, 1, 2, 3]], ["SP", 2, 0, 54, [1], 1], ["AN", 2, 1, 2], ["FFSP", 2, 0, [4, 3, 2, 1], 1, 1], ["AN", 2, 1, 6], ["PR", 5, 0, "auto_unroll_max_step$16"]]]], "r": [[4.01542e-06, 4.0175e-06, 4.01824e-06, 4.01805e-06], 0, 2.31356, 1664295107], "v": "v0.6"}
{"i": [["[\"202242e10b6ca40b0d7329fe3a725f1f\", [27, 36, 1, 1], [2, 36, 1, 1], [1, 2, 1, 1], [27, 2, 1, 1]]", "cuda -keys=cuda,gpu -arch=sm_80 -max_num_threads=1024 -thread_warp_size=32", [-1, 16, 64, 49152, 2147483647, 1024, 8, 32], "", 0, []], [[], [["CI", 5], ["SP", 3, 0, 27, [3, 3, 1, 1], 1], ["SP", 3, 5, 2, [2, 1, 1, 1], 1], ["SP", 3, 10, 1, [1, 1, 1, 1], 1], ["SP", 3, 15, 1, [1, 1, 1, 1], 1], ["SP", 3, 20, 36, [3, 2], 1], ["SP", 3, 23, 1, [1, 1], 1], ["SP", 3, 26, 1, [1, 1], 1], ["RE", 3, [0, 5, 10, 15, 1, 6, 11, 16, 2, 7, 12, 17, 20, 23, 26, 21, 24, 27, 3, 8, 13, 18, 22, 25, 28, 4, 9, 14, 19]], ["FSP", 6, 0, 1, 3], ["FSP", 6, 4, 2, 3], ["FSP", 6, 8, 3, 3], ["FSP", 6, 12, 4, 3], ["RE", 6, [0, 4, 8, 12, 1, 5, 9, 13, 2, 6, 10, 14, 3, 7, 11, 15]], ["CA", 3, 6, 11], ["CHR", 2, "shared", [3]], ["CA", 3, 4, 14], ["CHR", 1, "shared", [4]], ["CA", 2, 5, 14], ["CI", 1], ["FU", 8, [0, 1, 2, 3]], ["AN", 8, 0, 5], ["FU", 8, [1, 2, 3, 4]], ["AN", 8, 1, 4], ["FU", 8, [2, 3, 4, 5]], ["AN", 8, 2, 6], ["FU", 4, [0, 1, 2, 3]], ["SP", 4, 0, 6, [1], 1], ["AN", 4, 1, 2], ["FFSP", 4, 0, [4, 3, 2, 1], 1, 1], ["AN", 4, 1, 6], ["FU", 2, [0, 1, 2, 3]], ["SP", 2, 0, 6, [1], 1], ["AN", 2, 1, 2], ["FFSP", 2, 0, [4, 3, 2, 1], 1, 1], ["AN", 2, 1, 6], ["PR", 5, 0, "auto_unroll_max_step$16"]]]], "r": [[4.60066e-06, 4.60067e-06, 4.60062e-06, 4.60056e-06], 0, 2.34829, 1664295110], "v": "v0.6"}
{"i": [["[\"202242e10b6ca40b0d7329fe3a725f1f\", [27, 36, 1, 1], [2, 36, 1, 1], [1, 2, 1, 1], [27, 2, 1, 1]]", "cuda -keys=cuda,gpu -arch=sm_80 -max_num_threads=1024 -thread_warp_size=32", [-1, 16, 64, 49152, 2147483647, 1024, 8, 32], "", 0, []], [[], [["CI", 5], ["SP", 3, 0, 27, [1, 9, 3, 1], 1], ["SP", 3, 5, 2, [1, 1, 1, 1], 1], ["SP", 3, 10, 1, [1, 1, 1, 1], 1], ["SP", 3, 15, 1, [1, 1, 1, 1], 1], ["SP", 3, 20, 36, [4, 3], 1], ["SP", 3, 23, 1, [1, 1], 1], ["SP", 3, 26, 1, [1, 1], 1], ["RE", 3, [0, 5, 10, 15, 1, 6, 11, 16, 2, 7, 12, 17, 20, 23, 26, 21, 24, 27, 3, 8, 13, 18, 22, 25, 28, 4, 9, 14, 19]], ["FSP", 6, 0, 1, 3], ["FSP", 6, 4, 2, 3], ["FSP", 6, 8, 3, 3], ["FSP", 6, 12, 4, 3], ["RE", 6, [0, 4, 8, 12, 1, 5, 9, 13, 2, 6, 10, 14, 3, 7, 11, 15]], ["CA", 3, 6, 11], ["CHR", 2, "shared", [3]], ["CA", 3, 4, 14], ["CHR", 1, "shared", [4]], ["CA", 2, 5, 14], ["CI", 1], ["FU", 8, [0, 1, 2, 3]], ["AN", 8, 0, 5], ["FU", 8, [1, 2, 3, 4]], ["AN", 8, 1, 4], ["FU", 8, [2, 3, 4, 5]], ["AN", 8, 2, 6], ["FU", 4, [0, 1, 2, 3]], ["SP", 4, 0, 12, [1], 1], ["AN", 4, 1, 2], ["FFSP", 4, 0, [4, 3, 2, 1], 1, 1], ["AN", 4, 1, 6], ["FU", 2, [0, 1, 2, 3]], ["SP", 2, 0, 36, [1], 1], ["AN", 2, 1, 2], ["FFSP", 2, 0, [4, 3, 2, 1], 1, 1], ["AN", 2, 1, 6], ["PR", 5, 0, "auto_unroll_max_step$64"]]]], "r": [[5.36573e-06, 5.3657e-06, 5.36584e-06, 5.36577e-06], 0, 2.45204, 1664295112], "v": "v0.6"}
{"i": [["[\"202242e10b6ca40b0d7329fe3a725f1f\", [27, 36, 1, 1], [2, 36, 1, 1], [1, 2, 1, 1], [27, 2, 1, 1]]", "cuda -keys=cuda,gpu -arch=sm_80 -max_num_threads=1024 -thread_warp_size=32", [-1, 16, 64, 49152, 2147483647, 1024, 8, 32], "", 0, []], [[], [["CI", 5], ["SP", 3, 0, 27, [1, 3, 1, 3], 1], ["SP", 3, 5, 2, [1, 1, 1, 2], 1], ["SP", 3, 10, 1, [1, 1, 1, 1], 1], ["SP", 3, 15, 1, [1, 1, 1, 1], 1], ["SP", 3, 20, 36, [6, 6], 1], ["SP", 3, 23, 1, [1, 1], 1], ["SP", 3, 26, 1, [1, 1], 1], ["RE", 3, [0, 5, 10, 15, 1, 6, 11, 16, 2, 7, 12, 17, 20, 23, 26, 21, 24, 27, 3, 8, 13, 18, 22, 25, 28, 4, 9, 14, 19]], ["FSP", 6, 0, 1, 3], ["FSP", 6, 4, 2, 3], ["FSP", 6, 8, 3, 3], ["FSP", 6, 12, 4, 3], ["RE", 6, [0, 4, 8, 12, 1, 5, 9, 13, 2, 6, 10, 14, 3, 7, 11, 15]], ["CA", 3, 6, 11], ["CHR", 2, "shared", [3]], ["CA", 3, 4, 14], ["CHR", 1, "shared", [4]], ["CA", 2, 5, 14], ["CI", 1], ["FU", 8, [0, 1, 2, 3]], ["AN", 8, 0, 5], ["FU", 8, [1, 2, 3, 4]], ["AN", 8, 1, 4], ["FU", 8, [2, 3, 4, 5]], ["AN", 8, 2, 6], ["FU", 4, [0, 1, 2, 3]], ["SP", 4, 0, 72, [1], 1], ["AN", 4, 1, 2], ["FFSP", 4, 0, [4, 3, 2, 1], 1, 1], ["AN", 4, 1, 6], ["FU", 2, [0, 1, 2, 3]], ["SP", 2, 0, 108, [1], 1], ["AN", 2, 1, 2], ["FFSP", 2, 0, [4, 3, 2, 1], 1, 1], ["AN", 2, 1, 6], ["PR", 5, 0, "auto_unroll_max_step$1024"]]]], "r": [[3.86467e-06, 3.86522e-06, 3.86476e-06, 3.87106e-06], 0, 2.48726, 1664295113], "v": "v0.6"}
{"i": [["[\"202242e10b6ca40b0d7329fe3a725f1f\", [27, 36, 1, 1], [2, 36, 1, 1], [1, 2, 1, 1], [27, 2, 1, 1]]", "cuda -keys=cuda,gpu -arch=sm_80 -max_num_threads=1024 -thread_warp_size=32", [-1, 16, 64, 49152, 2147483647, 1024, 8, 32], "", 0, []], [[], [["CI", 5], ["SP", 3, 0, 27, [3, 1, 3, 1], 1], ["SP", 3, 5, 2, [1, 1, 2, 1], 1], ["SP", 3, 10, 1, [1, 1, 1, 1], 1], ["SP", 3, 15, 1, [1, 1, 1, 1], 1], ["SP", 3, 20, 36, [3, 12], 1], ["SP", 3, 23, 1, [1, 1], 1], ["SP", 3, 26, 1, [1, 1], 1], ["RE", 3, [0, 5, 10, 15, 1, 6, 11, 16, 2, 7, 12, 17, 20, 23, 26, 21, 24, 27, 3, 8, 13, 18, 22, 25, 28, 4, 9, 14, 19]], ["FSP", 6, 0, 1, 3], ["FSP", 6, 4, 2, 3], ["FSP", 6, 8, 3, 3], ["FSP", 6, 12, 4, 3], ["RE", 6, [0, 4, 8, 12, 1, 5, 9, 13, 2, 6, 10, 14, 3, 7, 11, 15]], ["CA", 3, 6, 11], ["CHR", 2, "shared", [3]], ["CA", 3, 4, 14], ["CHR", 1, "shared", [4]], ["CA", 2, 5, 14], ["CI", 1], ["FU", 8, [0, 1, 2, 3]], ["AN", 8, 0, 5], ["FU", 8, [1, 2, 3, 4]], ["AN", 8, 1, 4], ["FU", 8, [2, 3, 4, 5]], ["AN", 8, 2, 6], ["FU", 4, [0, 1, 2, 3]], ["SP", 4, 0, 36, [1], 1], ["AN", 4, 1, 2], ["FFSP", 4, 0, [4, 3, 2, 1], 1, 1], ["AN", 4, 1, 6], ["FU", 2, [0, 1, 2, 3]], ["SP", 2, 0, 108, [1], 1], ["AN", 2, 1, 2], ["FFSP", 2, 0, [4, 3, 2, 1], 1, 1], ["AN", 2, 1, 6], ["PR", 5, 0, "auto_unroll_max_step$0"]]]], "r": [[5.87975e-06, 5.87644e-06, 5.87587e-06, 5.87608e-06], 0, 2.61829, 1664295116], "v": "v0.6"}
{"i": [["[\"202242e10b6ca40b0d7329fe3a725f1f\", [27, 36, 1, 1], [2, 36, 1, 1], [1, 2, 1, 1], [27, 2, 1, 1]]", "cuda -keys=cuda,gpu -arch=sm_80 -max_num_threads=1024 -thread_warp_size=32", [-1, 16, 64, 49152, 2147483647, 1024, 8, 32], "", 0, []], [[], [["CI", 5], ["SP", 3, 0, 27, [1, 3, 3, 1], 1], ["SP", 3, 5, 2, [1, 1, 2, 1], 1], ["SP", 3, 10, 1, [1, 1, 1, 1], 1], ["SP", 3, 15, 1, [1, 1, 1, 1], 1], ["SP", 3, 20, 36, [18, 2], 1], ["SP", 3, 23, 1, [1, 1], 1], ["SP", 3, 26, 1, [1, 1], 1], ["RE", 3, [0, 5, 10, 15, 1, 6, 11, 16, 2, 7, 12, 17, 20, 23, 26, 21, 24, 27, 3, 8, 13, 18, 22, 25, 28, 4, 9, 14, 19]], ["FSP", 6, 0, 1, 3], ["FSP", 6, 4, 2, 3], ["FSP", 6, 8, 3, 3], ["FSP", 6, 12, 4, 3], ["RE", 6, [0, 4, 8, 12, 1, 5, 9, 13, 2, 6, 10, 14, 3, 7, 11, 15]], ["CA", 3, 6, 11], ["CHR", 2, "shared", [3]], ["CA", 3, 4, 14], ["CHR", 1, "shared", [4]], ["CA", 2, 5, 14], ["CI", 1], ["FU", 8, [0, 1, 2, 3]], ["AN", 8, 0, 5], ["FU", 8, [1, 2, 3, 4]], ["AN", 8, 1, 4], ["FU", 8, [2, 3, 4, 5]], ["AN", 8, 2, 6], ["FU", 4, [0, 1, 2, 3]], ["SP", 4, 0, 36, [1], 1], ["AN", 4, 1, 2], ["FFSP", 4, 0, [4, 3, 2, 1], 1, 1], ["AN", 4, 1, 6], ["FU", 2, [0, 1, 2, 3]], ["SP", 2, 0, 108, [1], 1], ["AN", 2, 1, 2], ["FFSP", 2, 0, [4, 3, 2, 1], 1, 1], ["AN", 2, 1, 6], ["PR", 5, 0, "auto_unroll_max_step$512"]]]], "r": [[3.77056e-06, 3.77054e-06, 3.77605e-06, 3.77781e-06], 0, 2.43568, 1664295117], "v": "v0.6"}
{"i": [["[\"202242e10b6ca40b0d7329fe3a725f1f\", [27, 36, 1, 1], [2, 36, 1, 1], [1, 2, 1, 1], [27, 2, 1, 1]]", "cuda -keys=cuda,gpu -arch=sm_80 -max_num_threads=1024 -thread_warp_size=32", [-1, 16, 64, 49152, 2147483647, 1024, 8, 32], "", 0, []], [[], [["CI", 5], ["SP", 3, 0, 27, [1, 1, 9, 1], 1], ["SP", 3, 5, 2, [1, 2, 1, 1], 1], ["SP", 3, 10, 1, [1, 1, 1, 1], 1], ["SP", 3, 15, 1, [1, 1, 1, 1], 1], ["SP", 3, 20, 36, [1, 18], 1], ["SP", 3, 23, 1, [1, 1], 1], ["SP", 3, 26, 1, [1, 1], 1], ["RE", 3, [0, 5, 10, 15, 1, 6, 11, 16, 2, 7, 12, 17, 20, 23, 26, 21, 24, 27, 3, 8, 13, 18, 22, 25, 28, 4, 9, 14, 19]], ["FSP", 6, 0, 1, 3], ["FSP", 6, 4, 2, 3], ["FSP", 6, 8, 3, 3], ["FSP", 6, 12, 4, 3], ["RE", 6, [0, 4, 8, 12, 1, 5, 9, 13, 2, 6, 10, 14, 3, 7, 11, 15]], ["CA", 3, 6, 11], ["CHR", 2, "shared", [3]], ["CA", 3, 4, 14], ["CHR", 1, "shared", [4]], ["CA", 2, 5, 14], ["CI", 1], ["FU", 8, [0, 1, 2, 3]], ["AN", 8, 0, 5], ["FU", 8, [1, 2, 3, 4]], ["AN", 8, 1, 4], ["FU", 8, [2, 3, 4, 5]], ["AN", 8, 2, 6], ["FU", 4, [0, 1, 2, 3]], ["SP", 4, 0, 18, [1], 1], ["AN", 4, 1, 2], ["FFSP", 4, 0, [4, 3, 2, 1], 1, 1], ["AN", 4, 1, 6], ["FU", 2, [0, 1, 2, 3]], ["SP", 2, 0, 162, [1], 1], ["AN", 2, 1, 2], ["FFSP", 2, 0, [4, 3, 2, 1], 1, 1], ["AN", 2, 1, 6], ["PR", 5, 0, "auto_unroll_max_step$16"]]]], "r": [[5.27153e-06, 5.27324e-06, 5.27496e-06, 5.25048e-06], 0, 2.46155, 1664295119], "v": "v0.6"}
{"i": [["[\"202242e10b6ca40b0d7329fe3a725f1f\", [27, 36, 1, 1], [2, 36, 1, 1], [1, 2, 1, 1], [27, 2, 1, 1]]", "cuda -keys=cuda,gpu -arch=sm_80 -max_num_threads=1024 -thread_warp_size=32", [-1, 16, 64, 49152, 2147483647, 1024, 8, 32], "", 0, []], [[], [["CI", 5], ["SP", 3, 0, 27, [1, 1, 9, 1], 1], ["SP", 3, 5, 2, [1, 2, 1, 1], 1], ["SP", 3, 10, 1, [1, 1, 1, 1], 1], ["SP", 3, 15, 1, [1, 1, 1, 1], 1], ["SP", 3, 20, 36, [6, 6], 1], ["SP", 3, 23, 1, [1, 1], 1], ["SP", 3, 26, 1, [1, 1], 1], ["RE", 3, [0, 5, 10, 15, 1, 6, 11, 16, 2, 7, 12, 17, 20, 23, 26, 21, 24, 27, 3, 8, 13, 18, 22, 25, 28, 4, 9, 14, 19]], ["FSP", 6, 0, 1, 3], ["FSP", 6, 4, 2, 3], ["FSP", 6, 8, 3, 3], ["FSP", 6, 12, 4, 3], ["RE", 6, [0, 4, 8, 12, 1, 5, 9, 13, 2, 6, 10, 14, 3, 7, 11, 15]], ["CA", 3, 6, 11], ["CHR", 2, "shared", [3]], ["CA", 3, 4, 14], ["CHR", 1, "shared", [4]], ["CA", 2, 5, 14], ["CI", 1], ["FU", 8, [0, 1, 2, 3]], ["AN", 8, 0, 5], ["FU", 8, [1, 2, 3, 4]], ["AN", 8, 1, 4], ["FU", 8, [2, 3, 4, 5]], ["AN", 8, 2, 6], ["FU", 4, [0, 1, 2, 3]], ["SP", 4, 0, 36, [1], 1], ["AN", 4, 1, 2], ["FFSP", 4, 0, [4, 3, 2, 1], 1, 1], ["AN", 4, 1, 6], ["FU", 2, [0, 1, 2, 3]], ["SP", 2, 0, 324, [1], 1], ["AN", 2, 1, 2], ["FFSP", 2, 0, [4, 3, 2, 1], 1, 1], ["AN", 2, 1, 6], ["PR", 5, 0, "auto_unroll_max_step$512"]]]], "r": [[4.72922e-06, 4.7291e-06, 4.72928e-06, 4.72918e-06], 0, 2.79989, 1664295121], "v": "v0.6"}
{"i": [["[\"202242e10b6ca40b0d7329fe3a725f1f\", [27, 36, 1, 1], [2, 36, 1, 1], [1, 2, 1, 1], [27, 2, 1, 1]]", "cuda -keys=cuda,gpu -arch=sm_80 -max_num_threads=1024 -thread_warp_size=32", [-1, 16, 64, 49152, 2147483647, 1024, 8, 32], "", 0, []], [[], [["CI", 5], ["SP", 3, 0, 27, [1, 1, 3, 3], 1], ["SP", 3, 5, 2, [1, 1, 2, 1], 1], ["SP", 3, 10, 1, [1, 1, 1, 1], 1], ["SP", 3, 15, 1, [1, 1, 1, 1], 1], ["SP", 3, 20, 36, [2, 18], 1], ["SP", 3, 23, 1, [1, 1], 1], ["SP", 3, 26, 1, [1, 1], 1], ["RE", 3, [0, 5, 10, 15, 1, 6, 11, 16, 2, 7, 12, 17, 20, 23, 26, 21, 24, 27, 3, 8, 13, 18, 22, 25, 28, 4, 9, 14, 19]], ["FSP", 6, 0, 1, 3], ["FSP", 6, 4, 2, 3], ["FSP", 6, 8, 3, 3], ["FSP", 6, 12, 4, 3], ["RE", 6, [0, 4, 8, 12, 1, 5, 9, 13, 2, 6, 10, 14, 3, 7, 11, 15]], ["CA", 3, 6, 11], ["CHR", 2, "shared", [3]], ["CA", 3, 4, 14], ["CHR", 1, "shared", [4]], ["CA", 2, 5, 14], ["CI", 1], ["FU", 8, [0, 1, 2, 3]], ["AN", 8, 0, 5], ["FU", 8, [1, 2, 3, 4]], ["AN", 8, 1, 4], ["FU", 8, [2, 3, 4, 5]], ["AN", 8, 2, 6], ["FU", 4, [0, 1, 2, 3]], ["SP", 4, 0, 72, [1], 1], ["AN", 4, 1, 2], ["FFSP", 4, 0, [4, 3, 2, 1], 1, 1], ["AN", 4, 1, 6], ["FU", 2, [0, 1, 2, 3]], ["SP", 2, 0, 324, [1], 1], ["AN", 2, 1, 2], ["FFSP", 2, 0, [4, 3, 2, 1], 1, 1], ["AN", 2, 1, 6], ["PR", 5, 0, "auto_unroll_max_step$512"]]]], "r": [[5.89657e-06, 5.89655e-06, 5.89653e-06, 5.89658e-06], 0, 3.44357, 1664295124], "v": "v0.6"}
{"i": [["[\"202242e10b6ca40b0d7329fe3a725f1f\", [27, 36, 1, 1], [2, 36, 1, 1], [1, 2, 1, 1], [27, 2, 1, 1]]", "cuda -keys=cuda,gpu -arch=sm_80 -max_num_threads=1024 -thread_warp_size=32", [-1, 16, 64, 49152, 2147483647, 1024, 8, 32], "", 0, []], [[], [["CI", 5], ["SP", 3, 0, 27, [1, 1, 1, 27], 1], ["SP", 3, 5, 2, [1, 1, 1, 1], 1], ["SP", 3, 10, 1, [1, 1, 1, 1], 1], ["SP", 3, 15, 1, [1, 1, 1, 1], 1], ["SP", 3, 20, 36, [1, 36], 1], ["SP", 3, 23, 1, [1, 1], 1], ["SP", 3, 26, 1, [1, 1], 1], ["RE", 3, [0, 5, 10, 15, 1, 6, 11, 16, 2, 7, 12, 17, 20, 23, 26, 21, 24, 27, 3, 8, 13, 18, 22, 25, 28, 4, 9, 14, 19]], ["FSP", 6, 0, 1, 3], ["FSP", 6, 4, 2, 3], ["FSP", 6, 8, 3, 3], ["FSP", 6, 12, 4, 3], ["RE", 6, [0, 4, 8, 12, 1, 5, 9, 13, 2, 6, 10, 14, 3, 7, 11, 15]], ["CA", 3, 6, 11], ["CHR", 2, "shared", [3]], ["CA", 3, 4, 14], ["CHR", 1, "shared", [4]], ["CA", 2, 5, 14], ["CI", 1], ["FU", 8, [0, 1, 2, 3]], ["AN", 8, 0, 5], ["FU", 8, [1, 2, 3, 4]], ["AN", 8, 1, 4], ["FU", 8, [2, 3, 4, 5]], ["AN", 8, 2, 6], ["FU", 4, [0, 1, 2, 3]], ["SP", 4, 0, 8, [1], 1], ["AN", 4, 1, 2], ["FFSP", 4, 0, [4, 3, 2, 1], 1, 1], ["AN", 4, 1, 6], ["FU", 2, [0, 1, 2, 3]], ["SP", 2, 0, 108, [1], 1], ["AN", 2, 1, 2], ["FFSP", 2, 0, [4, 3, 2, 1], 1, 1], ["AN", 2, 1, 6], ["PR", 5, 0, "auto_unroll_max_step$64"]]]], "r": [[1.06497e-05, 1.06496e-05, 1.06494e-05, 1.06491e-05], 0, 2.94324, 1664295126], "v": "v0.6"}
{"i": [["[\"202242e10b6ca40b0d7329fe3a725f1f\", [27, 36, 1, 1], [2, 36, 1, 1], [1, 2, 1, 1], [27, 2, 1, 1]]", "cuda -keys=cuda,gpu -arch=sm_80 -max_num_threads=1024 -thread_warp_size=32", [-1, 16, 64, 49152, 2147483647, 1024, 8, 32], "", 0, []], [[], [["CI", 5], ["SP", 3, 0, 27, [3, 1, 3, 3], 1], ["SP", 3, 5, 2, [1, 2, 1, 1], 1], ["SP", 3, 10, 1, [1, 1, 1, 1], 1], ["SP", 3, 15, 1, [1, 1, 1, 1], 1], ["SP", 3, 20, 36, [3, 6], 1], ["SP", 3, 23, 1, [1, 1], 1], ["SP", 3, 26, 1, [1, 1], 1], ["RE", 3, [0, 5, 10, 15, 1, 6, 11, 16, 2, 7, 12, 17, 20, 23, 26, 21, 24, 27, 3, 8, 13, 18, 22, 25, 28, 4, 9, 14, 19]], ["FSP", 6, 0, 1, 3], ["FSP", 6, 4, 2, 3], ["FSP", 6, 8, 3, 3], ["FSP", 6, 12, 4, 3], ["RE", 6, [0, 4, 8, 12, 1, 5, 9, 13, 2, 6, 10, 14, 3, 7, 11, 15]], ["CA", 3, 6, 11], ["CHR", 2, "shared", [3]], ["CA", 3, 4, 14], ["CHR", 1, "shared", [4]], ["CA", 2, 5, 14], ["CI", 1], ["FU", 8, [0, 1, 2, 3]], ["AN", 8, 0, 5], ["FU", 8, [1, 2, 3, 4]], ["AN", 8, 1, 4], ["FU", 8, [2, 3, 4, 5]], ["AN", 8, 2, 6], ["FU", 4, [0, 1, 2, 3]], ["SP", 4, 0, 18, [1], 1], ["AN", 4, 1, 2], ["FFSP", 4, 0, [4, 3, 2, 1], 1, 1], ["AN", 4, 1, 6], ["FU", 2, [0, 1, 2, 3]], ["SP", 2, 0, 162, [6], 1], ["AN", 2, 1, 2], ["FFSP", 2, 0, [4, 3, 2, 1], 1, 1], ["AN", 2, 1, 6], ["PR", 5, 0, "auto_unroll_max_step$0"]]]], "r": [[2.42789e-05, 2.42772e-05, 2.42777e-05, 2.42783e-05], 0, 3.0413, 1664295128], "v": "v0.6"}
{"i": [["[\"202242e10b6ca40b0d7329fe3a725f1f\", [27, 36, 1, 1], [2, 36, 1, 1], [1, 2, 1, 1], [27, 2, 1, 1]]", "cuda -keys=cuda,gpu -arch=sm_80 -max_num_threads=1024 -thread_warp_size=32", [-1, 16, 64, 49152, 2147483647, 1024, 8, 32], "", 0, []], [[], [["CI", 5], ["SP", 3, 0, 27, [3, 1, 3, 1], 1], ["SP", 3, 5, 2, [1, 1, 1, 2], 1], ["SP", 3, 10, 1, [1, 1, 1, 1], 1], ["SP", 3, 15, 1, [1, 1, 1, 1], 1], ["SP", 3, 20, 36, [1, 1], 1], ["SP", 3, 23, 1, [1, 1], 1], ["SP", 3, 26, 1, [1, 1], 1], ["RE", 3, [0, 5, 10, 15, 1, 6, 11, 16, 2, 7, 12, 17, 20, 23, 26, 21, 24, 27, 3, 8, 13, 18, 22, 25, 28, 4, 9, 14, 19]], ["FSP", 6, 0, 1, 3], ["FSP", 6, 4, 2, 3], ["FSP", 6, 8, 3, 3], ["FSP", 6, 12, 4, 3], ["RE", 6, [0, 4, 8, 12, 1, 5, 9, 13, 2, 6, 10, 14, 3, 7, 11, 15]], ["CA", 3, 6, 11], ["CHR", 2, "shared", [3]], ["CA", 3, 4, 14], ["CHR", 1, "shared", [4]], ["CA", 2, 5, 14], ["CI", 1], ["FU", 8, [0, 1, 2, 3]], ["AN", 8, 0, 5], ["FU", 8, [1, 2, 3, 4]], ["AN", 8, 1, 4], ["FU", 8, [2, 3, 4, 5]], ["AN", 8, 2, 6], ["FU", 4, [0, 1, 2, 3]], ["SP", 4, 0, 2, [2], 1], ["AN", 4, 1, 2], ["FFSP", 4, 0, [4, 3, 2, 1], 1, 1], ["AN", 4, 1, 6], ["FU", 2, [0, 1, 2, 3]], ["SP", 2, 0, 3, [3], 1], ["AN", 2, 1, 2], ["FFSP", 2, 0, [4, 3, 2, 1], 1, 1], ["AN", 2, 1, 6], ["PR", 5, 0, "auto_unroll_max_step$16"]]]], "r": [[9.73456e-06, 9.73463e-06, 9.73369e-06, 9.73447e-06], 0, 2.6093, 1664295131], "v": "v0.6"}
{"i": [["[\"202242e10b6ca40b0d7329fe3a725f1f\", [27, 36, 1, 1], [2, 36, 1, 1], [1, 2, 1, 1], [27, 2, 1, 1]]", "cuda -keys=cuda,gpu -arch=sm_80 -max_num_threads=1024 -thread_warp_size=32", [-1, 16, 64, 49152, 2147483647, 1024, 8, 32], "", 0, []], [[], [["CI", 5], ["SP", 3, 0, 27, [3, 1, 1, 3], 1], ["SP", 3, 5, 2, [1, 1, 2, 1], 1], ["SP", 3, 10, 1, [1, 1, 1, 1], 1], ["SP", 3, 15, 1, [1, 1, 1, 1], 1], ["SP", 3, 20, 36, [3, 12], 1], ["SP", 3, 23, 1, [1, 1], 1], ["SP", 3, 26, 1, [1, 1], 1], ["RE", 3, [0, 5, 10, 15, 1, 6, 11, 16, 2, 7, 12, 17, 20, 23, 26, 21, 24, 27, 3, 8, 13, 18, 22, 25, 28, 4, 9, 14, 19]], ["FSP", 6, 0, 1, 3], ["FSP", 6, 4, 2, 3], ["FSP", 6, 8, 3, 3], ["FSP", 6, 12, 4, 3], ["RE", 6, [0, 4, 8, 12, 1, 5, 9, 13, 2, 6, 10, 14, 3, 7, 11, 15]], ["CA", 3, 6, 11], ["CHR", 2, "shared", [3]], ["CA", 3, 4, 14], ["CHR", 1, "shared", [4]], ["CA", 2, 5, 14], ["CI", 1], ["FU", 8, [0, 1, 2, 3]], ["AN", 8, 0, 5], ["FU", 8, [1, 2, 3, 4]], ["AN", 8, 1, 4], ["FU", 8, [2, 3, 4, 5]], ["AN", 8, 2, 6], ["FU", 4, [0, 1, 2, 3]], ["SP", 4, 0, 72, [1], 1], ["AN", 4, 1, 2], ["FFSP", 4, 0, [4, 3, 2, 1], 1, 1], ["AN", 4, 1, 6], ["FU", 2, [0, 1, 2, 3]], ["SP", 2, 0, 108, [1], 1], ["AN", 2, 1, 2], ["FFSP", 2, 0, [4, 3, 2, 1], 1, 1], ["AN", 2, 1, 6], ["PR", 5, 0, "auto_unroll_max_step$1024"]]]], "r": [[6.02054e-06, 6.01883e-06, 6.02318e-06, 6.00966e-06], 0, 3.31915, 1664295133], "v": "v0.6"}
{"i": [["[\"202242e10b6ca40b0d7329fe3a725f1f\", [27, 36, 1, 1], [2, 36, 1, 1], [1, 2, 1, 1], [27, 2, 1, 1]]", "cuda -keys=cuda,gpu -arch=sm_80 -max_num_threads=1024 -thread_warp_size=32", [-1, 16, 64, 49152, 2147483647, 1024, 8, 32], "", 0, []], [[], [["CI", 5], ["SP", 3, 0, 27, [1, 1, 9, 3], 1], ["SP", 3, 5, 2, [1, 1, 1, 1], 1], ["SP", 3, 10, 1, [1, 1, 1, 1], 1], ["SP", 3, 15, 1, [1, 1, 1, 1], 1], ["SP", 3, 20, 36, [1, 36], 1], ["SP", 3, 23, 1, [1, 1], 1], ["SP", 3, 26, 1, [1, 1], 1], ["RE", 3, [0, 5, 10, 15, 1, 6, 11, 16, 2, 7, 12, 17, 20, 23, 26, 21, 24, 27, 3, 8, 13, 18, 22, 25, 28, 4, 9, 14, 19]], ["FSP", 6, 0, 1, 3], ["FSP", 6, 4, 2, 3], ["FSP", 6, 8, 3, 3], ["FSP", 6, 12, 4, 3], ["RE", 6, [0, 4, 8, 12, 1, 5, 9, 13, 2, 6, 10, 14, 3, 7, 11, 15]], ["CA", 3, 6, 11], ["CHR", 2, "shared", [3]], ["CA", 3, 4, 14], ["CHR", 1, "shared", [4]], ["CA", 2, 5, 14], ["CI", 1], ["FU", 8, [0, 1, 2, 3]], ["AN", 8, 0, 5], ["FU", 8, [1, 2, 3, 4]], ["AN", 8, 1, 4], ["FU", 8, [2, 3, 4, 5]], ["AN", 8, 2, 6], ["FU", 4, [0, 1, 2, 3]], ["SP", 4, 0, 36, [1], 1], ["AN", 4, 1, 2], ["FFSP", 4, 0, [4, 3, 2, 1], 1, 1], ["AN", 4, 1, 6], ["FU", 2, [0, 1, 2, 3]], ["SP", 2, 0, 972, [1], 1], ["AN", 2, 1, 2], ["FFSP", 2, 0, [4, 3, 2, 1], 1, 1], ["AN", 2, 1, 6], ["PR", 5, 0, "auto_unroll_max_step$64"]]]], "r": [[1.25966e-05, 1.2591e-05, 1.25942e-05, 1.26016e-05], 0, 2.92291, 1664295135], "v": "v0.6"}
{"i": [["[\"202242e10b6ca40b0d7329fe3a725f1f\", [27, 36, 1, 1], [2, 36, 1, 1], [1, 2, 1, 1], [27, 2, 1, 1]]", "cuda -keys=cuda,gpu -arch=sm_80 -max_num_threads=1024 -thread_warp_size=32", [-1, 16, 64, 49152, 2147483647, 1024, 8, 32], "", 0, []], [[], [["CI", 5], ["SP", 3, 0, 27, [3, 1, 1, 1], 1], ["SP", 3, 5, 2, [2, 1, 1, 1], 1], ["SP", 3, 10, 1, [1, 1, 1, 1], 1], ["SP", 3, 15, 1, [1, 1, 1, 1], 1], ["SP", 3, 20, 36, [3, 12], 1], ["SP", 3, 23, 1, [1, 1], 1], ["SP", 3, 26, 1, [1, 1], 1], ["RE", 3, [0, 5, 10, 15, 1, 6, 11, 16, 2, 7, 12, 17, 20, 23, 26, 21, 24, 27, 3, 8, 13, 18, 22, 25, 28, 4, 9, 14, 19]], ["FSP", 6, 0, 1, 3], ["FSP", 6, 4, 2, 3], ["FSP", 6, 8, 3, 3], ["FSP", 6, 12, 4, 3], ["RE", 6, [0, 4, 8, 12, 1, 5, 9, 13, 2, 6, 10, 14, 3, 7, 11, 15]], ["CA", 3, 6, 11], ["CHR", 2, "shared", [3]], ["CA", 3, 4, 14], ["CHR", 1, "shared", [4]], ["CA", 2, 5, 14], ["CI", 1], ["FU", 8, [0, 1, 2, 3]], ["AN", 8, 0, 5], ["FU", 8, [1, 2, 3, 4]], ["AN", 8, 1, 4], ["FU", 8, [2, 3, 4, 5]], ["AN", 8, 2, 6], ["FU", 4, [0, 1, 2, 3]], ["SP", 4, 0, 72, [2], 1], ["AN", 4, 1, 2], ["FFSP", 4, 0, [4, 3, 2, 1], 1, 1], ["AN", 4, 1, 6], ["FU", 2, [0, 1, 2, 3]], ["SP", 2, 0, 108, [1], 1], ["AN", 2, 1, 2], ["FFSP", 2, 0, [4, 3, 2, 1], 1, 1], ["AN", 2, 1, 6], ["PR", 5, 0, "auto_unroll_max_step$1024"]]]], "r": [[4.26922e-06, 4.26913e-06, 4.27081e-06, 4.26965e-06], 0, 2.42385, 1664295137], "v": "v0.6"}
{"i": [["[\"202242e10b6ca40b0d7329fe3a725f1f\", [27, 36, 1, 1], [2, 36, 1, 1], [1, 2, 1, 1], [27, 2, 1, 1]]", "cuda -keys=cuda,gpu -arch=sm_80 -max_num_threads=1024 -thread_warp_size=32", [-1, 16, 64, 49152, 2147483647, 1024, 8, 32], "", 0, []], [[], [["CI", 5], ["SP", 3, 0, 27, [1, 9, 3, 1], 1], ["SP", 3, 5, 2, [1, 1, 2, 1], 1], ["SP", 3, 10, 1, [1, 1, 1, 1], 1], ["SP", 3, 15, 1, [1, 1, 1, 1], 1], ["SP", 3, 20, 36, [3, 2], 1], ["SP", 3, 23, 1, [1, 1], 1], ["SP", 3, 26, 1, [1, 1], 1], ["RE", 3, [0, 5, 10, 15, 1, 6, 11, 16, 2, 7, 12, 17, 20, 23, 26, 21, 24, 27, 3, 8, 13, 18, 22, 25, 28, 4, 9, 14, 19]], ["FSP", 6, 0, 1, 3], ["FSP", 6, 4, 2, 3], ["FSP", 6, 8, 3, 3], ["FSP", 6, 12, 4, 3], ["RE", 6, [0, 4, 8, 12, 1, 5, 9, 13, 2, 6, 10, 14, 3, 7, 11, 15]], ["CA", 3, 6, 11], ["CHR", 2, "shared", [3]], ["CA", 3, 4, 14], ["CHR", 1, "shared", [4]], ["CA", 2, 5, 14], ["CI", 1], ["FU", 8, [0, 1, 2, 3]], ["AN", 8, 0, 5], ["FU", 8, [1, 2, 3, 4]], ["AN", 8, 1, 4], ["FU", 8, [2, 3, 4, 5]], ["AN", 8, 2, 6], ["FU", 4, [0, 1, 2, 3]], ["SP", 4, 0, 12, [1], 1], ["AN", 4, 1, 2], ["FFSP", 4, 0, [4, 3, 2, 1], 1, 1], ["AN", 4, 1, 6], ["FU", 2, [0, 1, 2, 3]], ["SP", 2, 0, 54, [1], 1], ["AN", 2, 1, 2], ["FFSP", 2, 0, [4, 3, 2, 1], 1, 1], ["AN", 2, 1, 6], ["PR", 5, 0, "auto_unroll_max_step$64"]]]], "r": [[4.65477e-06, 4.65472e-06, 4.65489e-06, 4.65494e-06], 0, 2.2791, 1664295139], "v": "v0.6"}
{"i": [["[\"202242e10b6ca40b0d7329fe3a725f1f\", [27, 36, 1, 1], [2, 36, 1, 1], [1, 2, 1, 1], [27, 2, 1, 1]]", "cuda -keys=cuda,gpu -arch=sm_80 -max_num_threads=1024 -thread_warp_size=32", [-1, 16, 64, 49152, 2147483647, 1024, 8, 32], "", 0, []], [[], [["CI", 5], ["SP", 3, 0, 27, [3, 3, 3, 1], 1], ["SP", 3, 5, 2, [1, 1, 2, 1], 1], ["SP", 3, 10, 1, [1, 1, 1, 1], 1], ["SP", 3, 15, 1, [1, 1, 1, 1], 1], ["SP", 3, 20, 36, [6, 6], 1], ["SP", 3, 23, 1, [1, 1], 1], ["SP", 3, 26, 1, [1, 1], 1], ["RE", 3, [0, 5, 10, 15, 1, 6, 11, 16, 2, 7, 12, 17, 20, 23, 26, 21, 24, 27, 3, 8, 13, 18, 22, 25, 28, 4, 9, 14, 19]], ["FSP", 6, 0, 1, 3], ["FSP", 6, 4, 2, 3], ["FSP", 6, 8, 3, 3], ["FSP", 6, 12, 4, 3], ["RE", 6, [0, 4, 8, 12, 1, 5, 9, 13, 2, 6, 10, 14, 3, 7, 11, 15]], ["CA", 3, 6, 11], ["CHR", 2, "shared", [3]], ["CA", 3, 4, 14], ["CHR", 1, "shared", [4]], ["CA", 2, 5, 14], ["CI", 1], ["FU", 8, [0, 1, 2, 3]], ["AN", 8, 0, 5], ["FU", 8, [1, 2, 3, 4]], ["AN", 8, 1, 4], ["FU", 8, [2, 3, 4, 5]], ["AN", 8, 2, 6], ["FU", 4, [0, 1, 2, 3]], ["SP", 4, 0, 72, [1], 1], ["AN", 4, 1, 2], ["FFSP", 4, 0, [4, 3, 2, 1], 1, 1], ["AN", 4, 1, 6], ["FU", 2, [0, 1, 2, 3]], ["SP", 2, 0, 108, [1], 1], ["AN", 2, 1, 2], ["FFSP", 2, 0, [4, 3, 2, 1], 1, 1], ["AN", 2, 1, 6], ["PR", 5, 0, "auto_unroll_max_step$0"]]]], "r": [[6.53262e-06, 6.5329e-06, 6.53299e-06, 6.53313e-06], 0, 2.60793, 1664295141], "v": "v0.6"}
{"i": [["[\"202242e10b6ca40b0d7329fe3a725f1f\", [27, 36, 1, 1], [2, 36, 1, 1], [1, 2, 1, 1], [27, 2, 1, 1]]", "cuda -keys=cuda,gpu -arch=sm_80 -max_num_threads=1024 -thread_warp_size=32", [-1, 16, 64, 49152, 2147483647, 1024, 8, 32], "", 0, []], [[], [["CI", 5], ["SP", 3, 0, 27, [1, 1, 9, 1], 1], ["SP", 3, 5, 2, [1, 1, 1, 2], 1], ["SP", 3, 10, 1, [1, 1, 1, 1], 1], ["SP", 3, 15, 1, [1, 1, 1, 1], 1], ["SP", 3, 20, 36, [6, 3], 1], ["SP", 3, 23, 1, [1, 1], 1], ["SP", 3, 26, 1, [1, 1], 1], ["RE", 3, [0, 5, 10, 15, 1, 6, 11, 16, 2, 7, 12, 17, 20, 23, 26, 21, 24, 27, 3, 8, 13, 18, 22, 25, 28, 4, 9, 14, 19]], ["FSP", 6, 0, 1, 3], ["FSP", 6, 4, 2, 3], ["FSP", 6, 8, 3, 3], ["FSP", 6, 12, 4, 3], ["RE", 6, [0, 4, 8, 12, 1, 5, 9, 13, 2, 6, 10, 14, 3, 7, 11, 15]], ["CA", 3, 6, 11], ["CHR", 2, "shared", [3]], ["CA", 3, 4, 14], ["CHR", 1, "shared", [4]], ["CA", 2, 5, 14], ["CI", 1], ["FU", 8, [0, 1, 2, 3]], ["AN", 8, 0, 5], ["FU", 8, [1, 2, 3, 4]], ["AN", 8, 1, 4], ["FU", 8, [2, 3, 4, 5]], ["AN", 8, 2, 6], ["FU", 4, [0, 1, 2, 3]], ["SP", 4, 0, 36, [1], 1], ["AN", 4, 1, 2], ["FFSP", 4, 0, [4, 3, 2, 1], 1, 1], ["AN", 4, 1, 6], ["FU", 2, [0, 1, 2, 3]], ["SP", 2, 0, 162, [2], 1], ["AN", 2, 1, 2], ["FFSP", 2, 0, [4, 3, 2, 1], 1, 1], ["AN", 2, 1, 6], ["PR", 5, 0, "auto_unroll_max_step$1024"]]]], "r": [[7.59631e-06, 7.59625e-06, 7.59662e-06, 7.59712e-06], 0, 3.16151, 1664295143], "v": "v0.6"}
{"i": [["[\"202242e10b6ca40b0d7329fe3a725f1f\", [27, 36, 1, 1], [2, 36, 1, 1], [1, 2, 1, 1], [27, 2, 1, 1]]", "cuda -keys=cuda,gpu -arch=sm_80 -max_num_threads=1024 -thread_warp_size=32", [-1, 16, 64, 49152, 2147483647, 1024, 8, 32], "", 0, []], [[], [["CI", 5], ["SP", 3, 0, 27, [1, 1, 1, 27], 1], ["SP", 3, 5, 2, [1, 1, 1, 2], 1], ["SP", 3, 10, 1, [1, 1, 1, 1], 1], ["SP", 3, 15, 1, [1, 1, 1, 1], 1], ["SP", 3, 20, 36, [9, 4], 1], ["SP", 3, 23, 1, [1, 1], 1], ["SP", 3, 26, 1, [1, 1], 1], ["RE", 3, [0, 5, 10, 15, 1, 6, 11, 16, 2, 7, 12, 17, 20, 23, 26, 21, 24, 27, 3, 8, 13, 18, 22, 25, 28, 4, 9, 14, 19]], ["FSP", 6, 0, 1, 3], ["FSP", 6, 4, 2, 3], ["FSP", 6, 8, 3, 3], ["FSP", 6, 12, 4, 3], ["RE", 6, [0, 4, 8, 12, 1, 5, 9, 13, 2, 6, 10, 14, 3, 7, 11, 15]], ["CA", 3, 6, 11], ["CHR", 2, "shared", [3]], ["CA", 3, 4, 14], ["CHR", 1, "shared", [4]], ["CA", 2, 5, 14], ["CI", 1], ["FU", 8, [0, 1, 2, 3]], ["AN", 8, 0, 5], ["FU", 8, [1, 2, 3, 4]], ["AN", 8, 1, 4], ["FU", 8, [2, 3, 4, 5]], ["AN", 8, 2, 6], ["FU", 4, [0, 1, 2, 3]], ["SP", 4, 0, 72, [1], 1], ["AN", 4, 1, 2], ["FFSP", 4, 0, [4, 3, 2, 1], 1, 1], ["AN", 4, 1, 6], ["FU", 2, [0, 1, 2, 3]], ["SP", 2, 0, 324, [1], 1], ["AN", 2, 1, 2], ["FFSP", 2, 0, [4, 3, 2, 1], 1, 1], ["AN", 2, 1, 6], ["PR", 5, 0, "auto_unroll_max_step$16"]]]], "r": [[1.24829e-05, 1.24819e-05, 1.24827e-05, 1.24741e-05], 0, 3.0369, 1664295146], "v": "v0.6"}
{"i": [["[\"202242e10b6ca40b0d7329fe3a725f1f\", [27, 36, 1, 1], [2, 36, 1, 1], [1, 2, 1, 1], [27, 2, 1, 1]]", "cuda -keys=cuda,gpu -arch=sm_80 -max_num_threads=1024 -thread_warp_size=32", [-1, 16, 64, 49152, 2147483647, 1024, 8, 32], "", 0, []], [[], [["CI", 5], ["SP", 3, 0, 27, [1, 3, 3, 3], 1], ["SP", 3, 5, 2, [1, 1, 2, 1], 1], ["SP", 3, 10, 1, [1, 1, 1, 1], 1], ["SP", 3, 15, 1, [1, 1, 1, 1], 1], ["SP", 3, 20, 36, [1, 6], 1], ["SP", 3, 23, 1, [1, 1], 1], ["SP", 3, 26, 1, [1, 1], 1], ["RE", 3, [0, 5, 10, 15, 1, 6, 11, 16, 2, 7, 12, 17, 20, 23, 26, 21, 24, 27, 3, 8, 13, 18, 22, 25, 28, 4, 9, 14, 19]], ["FSP", 6, 0, 1, 3], ["FSP", 6, 4, 2, 3], ["FSP", 6, 8, 3, 3], ["FSP", 6, 12, 4, 3], ["RE", 6, [0, 4, 8, 12, 1, 5, 9, 13, 2, 6, 10, 14, 3, 7, 11, 15]], ["CA", 3, 6, 11], ["CHR", 2, "shared", [3]], ["CA", 3, 4, 14], ["CHR", 1, "shared", [4]], ["CA", 2, 5, 14], ["CI", 1], ["FU", 8, [0, 1, 2, 3]], ["AN", 8, 0, 5], ["FU", 8, [1, 2, 3, 4]], ["AN", 8, 1, 4], ["FU", 8, [2, 3, 4, 5]], ["AN", 8, 2, 6], ["FU", 4, [0, 1, 2, 3]], ["SP", 4, 0, 36, [1], 1], ["AN", 4, 1, 2], ["FFSP", 4, 0, [4, 3, 2, 1], 1, 1], ["AN", 4, 1, 6], ["FU", 2, [0, 1, 2, 3]], ["SP", 2, 0, 162, [1], 1], ["AN", 2, 1, 2], ["FFSP", 2, 0, [4, 3, 2, 1], 1, 1], ["AN", 2, 1, 6], ["PR", 5, 0, "auto_unroll_max_step$64"]]]], "r": [[7.20354e-06, 7.18461e-06, 7.17153e-06, 7.20842e-06], 0, 2.65825, 1664295148], "v": "v0.6"}
{"i": [["[\"202242e10b6ca40b0d7329fe3a725f1f\", [27, 36, 1, 1], [2, 36, 1, 1], [1, 2, 1, 1], [27, 2, 1, 1]]", "cuda -keys=cuda,gpu -arch=sm_80 -max_num_threads=1024 -thread_warp_size=32", [-1, 16, 64, 49152, 2147483647, 1024, 8, 32], "", 0, []], [[], [["CI", 5], ["SP", 3, 0, 27, [1, 1, 1, 3], 1], ["SP", 3, 5, 2, [1, 1, 1, 1], 1], ["SP", 3, 10, 1, [1, 1, 1, 1], 1], ["SP", 3, 15, 1, [1, 1, 1, 1], 1], ["SP", 3, 20, 36, [2, 2], 1], ["SP", 3, 23, 1, [1, 1], 1], ["SP", 3, 26, 1, [1, 1], 1], ["RE", 3, [0, 5, 10, 15, 1, 6, 11, 16, 2, 7, 12, 17, 20, 23, 26, 21, 24, 27, 3, 8, 13, 18, 22, 25, 28, 4, 9, 14, 19]], ["FSP", 6, 0, 1, 3], ["FSP", 6, 4, 2, 3], ["FSP", 6, 8, 3, 3], ["FSP", 6, 12, 4, 3], ["RE", 6, [0, 4, 8, 12, 1, 5, 9, 13, 2, 6, 10, 14, 3, 7, 11, 15]], ["CA", 3, 6, 11], ["CHR", 2, "shared", [3]], ["CA", 3, 4, 14], ["CHR", 1, "shared", [4]], ["CA", 2, 5, 14], ["CI", 1], ["FU", 8, [0, 1, 2, 3]], ["AN", 8, 0, 5], ["FU", 8, [1, 2, 3, 4]], ["AN", 8, 1, 4], ["FU", 8, [2, 3, 4, 5]], ["AN", 8, 2, 6], ["FU", 4, [0, 1, 2, 3]], ["SP", 4, 0, 8, [1], 1], ["AN", 4, 1, 2], ["FFSP", 4, 0, [4, 3, 2, 1], 1, 1], ["AN", 4, 1, 6], ["FU", 2, [0, 1, 2, 3]], ["SP", 2, 0, 12, [1], 1], ["AN", 2, 1, 2], ["FFSP", 2, 0, [4, 3, 2, 1], 1, 1], ["AN", 2, 1, 6], ["PR", 5, 0, "auto_unroll_max_step$1024"]]]], "r": [[4.67397e-06, 4.67371e-06, 4.67377e-06, 4.67372e-06], 0, 2.44328, 1664295150], "v": "v0.6"}
{"i": [["[\"202242e10b6ca40b0d7329fe3a725f1f\", [27, 36, 1, 1], [2, 36, 1, 1], [1, 2, 1, 1], [27, 2, 1, 1]]", "cuda -keys=cuda,gpu -arch=sm_80 -max_num_threads=1024 -thread_warp_size=32", [-1, 16, 64, 49152, 2147483647, 1024, 8, 32], "", 0, []], [[], [["CI", 5], ["SP", 3, 0, 27, [1, 1, 1, 1], 1], ["SP", 3, 5, 2, [1, 1, 2, 1], 1], ["SP", 3, 10, 1, [1, 1, 1, 1], 1], ["SP", 3, 15, 1, [1, 1, 1, 1], 1], ["SP", 3, 20, 36, [36, 1], 1], ["SP", 3, 23, 1, [1, 1], 1], ["SP", 3, 26, 1, [1, 1], 1], ["RE", 3, [0, 5, 10, 15, 1, 6, 11, 16, 2, 7, 12, 17, 20, 23, 26, 21, 24, 27, 3, 8, 13, 18, 22, 25, 28, 4, 9, 14, 19]], ["FSP", 6, 0, 1, 3], ["FSP", 6, 4, 2, 3], ["FSP", 6, 8, 3, 3], ["FSP", 6, 12, 4, 3], ["RE", 6, [0, 4, 8, 12, 1, 5, 9, 13, 2, 6, 10, 14, 3, 7, 11, 15]], ["CA", 3, 6, 11], ["CHR", 2, "shared", [3]], ["CA", 3, 4, 14], ["CHR", 1, "shared", [4]], ["CA", 2, 5, 14], ["CI", 1], ["FU", 8, [0, 1, 2, 3]], ["AN", 8, 0, 5], ["FU", 8, [1, 2, 3, 4]], ["AN", 8, 1, 4], ["FU", 8, [2, 3, 4, 5]], ["AN", 8, 2, 6], ["FU", 4, [0, 1, 2, 3]], ["SP", 4, 0, 72, [1], 1], ["AN", 4, 1, 2], ["FFSP", 4, 0, [4, 3, 2, 1], 1, 1], ["AN", 4, 1, 6], ["FU", 2, [0, 1, 2, 3]], ["SP", 2, 0, 36, [1], 1], ["AN", 2, 1, 2], ["FFSP", 2, 0, [4, 3, 2, 1], 1, 1], ["AN", 2, 1, 6], ["PR", 5, 0, "auto_unroll_max_step$0"]]]], "r": [[3.58221e-06, 3.58109e-06, 3.57452e-06, 3.57493e-06], 0, 2.19286, 1664295152], "v": "v0.6"}
{"i": [["[\"202242e10b6ca40b0d7329fe3a725f1f\", [27, 36, 1, 1], [2, 36, 1, 1], [1, 2, 1, 1], [27, 2, 1, 1]]", "cuda -keys=cuda,gpu -arch=sm_80 -max_num_threads=1024 -thread_warp_size=32", [-1, 16, 64, 49152, 2147483647, 1024, 8, 32], "", 0, []], [[], [["CI", 5], ["SP", 3, 0, 27, [1, 9, 1, 1], 1], ["SP", 3, 5, 2, [1, 1, 2, 1], 1], ["SP", 3, 10, 1, [1, 1, 1, 1], 1], ["SP", 3, 15, 1, [1, 1, 1, 1], 1], ["SP", 3, 20, 36, [36, 1], 1], ["SP", 3, 23, 1, [1, 1], 1], ["SP", 3, 26, 1, [1, 1], 1], ["RE", 3, [0, 5, 10, 15, 1, 6, 11, 16, 2, 7, 12, 17, 20, 23, 26, 21, 24, 27, 3, 8, 13, 18, 22, 25, 28, 4, 9, 14, 19]], ["FSP", 6, 0, 1, 3], ["FSP", 6, 4, 2, 3], ["FSP", 6, 8, 3, 3], ["FSP", 6, 12, 4, 3], ["RE", 6, [0, 4, 8, 12, 1, 5, 9, 13, 2, 6, 10, 14, 3, 7, 11, 15]], ["CA", 3, 6, 11], ["CHR", 2, "shared", [3]], ["CA", 3, 4, 14], ["CHR", 1, "shared", [4]], ["CA", 2, 5, 14], ["CI", 1], ["FU", 8, [0, 1, 2, 3]], ["AN", 8, 0, 5], ["FU", 8, [1, 2, 3, 4]], ["AN", 8, 1, 4], ["FU", 8, [2, 3, 4, 5]], ["AN", 8, 2, 6], ["FU", 4, [0, 1, 2, 3]], ["SP", 4, 0, 36, [1], 1], ["AN", 4, 1, 2], ["FFSP", 4, 0, [4, 3, 2, 1], 1, 1], ["AN", 4, 1, 6], ["FU", 2, [0, 1, 2, 3]], ["SP", 2, 0, 36, [1], 1], ["AN", 2, 1, 2], ["FFSP", 2, 0, [4, 3, 2, 1], 1, 1], ["AN", 2, 1, 6], ["PR", 5, 0, "auto_unroll_max_step$1024"]]]], "r": [[3.16192e-06, 3.16191e-06, 3.16202e-06, 3.16199e-06], 0, 2.25045, 1664295154], "v": "v0.6"}
{"i": [["[\"202242e10b6ca40b0d7329fe3a725f1f\", [27, 36, 1, 1], [2, 36, 1, 1], [1, 2, 1, 1], [27, 2, 1, 1]]", "cuda -keys=cuda,gpu -arch=sm_80 -max_num_threads=1024 -thread_warp_size=32", [-1, 16, 64, 49152, 2147483647, 1024, 8, 32], "", 0, []], [[], [["CI", 5], ["SP", 3, 0, 27, [1, 3, 9, 1], 1], ["SP", 3, 5, 2, [1, 1, 2, 1], 1], ["SP", 3, 10, 1, [1, 1, 1, 1], 1], ["SP", 3, 15, 1, [1, 1, 1, 1], 1], ["SP", 3, 20, 36, [1, 3], 1], ["SP", 3, 23, 1, [1, 1], 1], ["SP", 3, 26, 1, [1, 1], 1], ["RE", 3, [0, 5, 10, 15, 1, 6, 11, 16, 2, 7, 12, 17, 20, 23, 26, 21, 24, 27, 3, 8, 13, 18, 22, 25, 28, 4, 9, 14, 19]], ["FSP", 6, 0, 1, 3], ["FSP", 6, 4, 2, 3], ["FSP", 6, 8, 3, 3], ["FSP", 6, 12, 4, 3], ["RE", 6, [0, 4, 8, 12, 1, 5, 9, 13, 2, 6, 10, 14, 3, 7, 11, 15]], ["CA", 3, 6, 11], ["CHR", 2, "shared", [3]], ["CA", 3, 4, 14], ["CHR", 1, "shared", [4]], ["CA", 2, 5, 14], ["CI", 1], ["FU", 8, [0, 1, 2, 3]], ["AN", 8, 0, 5], ["FU", 8, [1, 2, 3, 4]], ["AN", 8, 1, 4], ["FU", 8, [2, 3, 4, 5]], ["AN", 8, 2, 6], ["FU", 4, [0, 1, 2, 3]], ["SP", 4, 0, 12, [12], 1], ["AN", 4, 1, 2], ["FFSP", 4, 0, [4, 3, 2, 1], 1, 1], ["AN", 4, 1, 6], ["FU", 2, [0, 1, 2, 3]], ["SP", 2, 0, 54, [3], 1], ["AN", 2, 1, 2], ["FFSP", 2, 0, [4, 3, 2, 1], 1, 1], ["AN", 2, 1, 6], ["PR", 5, 0, "auto_unroll_max_step$64"]]]], "r": [[8.22351e-06, 8.21667e-06, 8.2144e-06, 8.21559e-06], 0, 2.58907, 1664295156], "v": "v0.6"}
{"i": [["[\"202242e10b6ca40b0d7329fe3a725f1f\", [27, 36, 1, 1], [2, 36, 1, 1], [1, 2, 1, 1], [27, 2, 1, 1]]", "cuda -keys=cuda,gpu -arch=sm_80 -max_num_threads=1024 -thread_warp_size=32", [-1, 16, 64, 49152, 2147483647, 1024, 8, 32], "", 0, []], [[], [["CI", 5], ["SP", 3, 0, 27, [1, 1, 1, 1], 1], ["SP", 3, 5, 2, [2, 1, 1, 1], 1], ["SP", 3, 10, 1, [1, 1, 1, 1], 1], ["SP", 3, 15, 1, [1, 1, 1, 1], 1], ["SP", 3, 20, 36, [2, 9], 1], ["SP", 3, 23, 1, [1, 1], 1], ["SP", 3, 26, 1, [1, 1], 1], ["RE", 3, [0, 5, 10, 15, 1, 6, 11, 16, 2, 7, 12, 17, 20, 23, 26, 21, 24, 27, 3, 8, 13, 18, 22, 25, 28, 4, 9, 14, 19]], ["FSP", 6, 0, 1, 3], ["FSP", 6, 4, 2, 3], ["FSP", 6, 8, 3, 3], ["FSP", 6, 12, 4, 3], ["RE", 6, [0, 4, 8, 12, 1, 5, 9, 13, 2, 6, 10, 14, 3, 7, 11, 15]], ["CA", 3, 6, 11], ["CHR", 2, "shared", [3]], ["CA", 3, 4, 14], ["CHR", 1, "shared", [4]], ["CA", 2, 5, 14], ["CI", 1], ["FU", 8, [0, 1, 2, 3]], ["AN", 8, 0, 5], ["FU", 8, [1, 2, 3, 4]], ["AN", 8, 1, 4], ["FU", 8, [2, 3, 4, 5]], ["AN", 8, 2, 6], ["FU", 4, [0, 1, 2, 3]], ["SP", 4, 0, 18, [1], 1], ["AN", 4, 1, 2], ["FFSP", 4, 0, [4, 3, 2, 1], 1, 1], ["AN", 4, 1, 6], ["FU", 2, [0, 1, 2, 3]], ["SP", 2, 0, 18, [1], 1], ["AN", 2, 1, 2], ["FFSP", 2, 0, [4, 3, 2, 1], 1, 1], ["AN", 2, 1, 6], ["PR", 5, 0, "auto_unroll_max_step$0"]]]], "r": [[3.84866e-06, 3.84642e-06, 3.84909e-06, 3.85107e-06], 0, 2.24818, 1664295158], "v": "v0.6"}
