.cache/log/kernel_tune/NVIDIA_A100_80GB_PCIe/Conv2dBiasAdd_forward_input_0_6_20_32_32-input_1_6_20_32_32_output_0_6_20_32_32_in_channels_20_out_channels_20_kernel_size_3_3_stride_1_1_padding_1_1_dilation_1_1_groups_1.json
{"i": [["[\"a7de7210b6587109a1ca064f9b471c63\", [6, 20, 32, 32], [20, 20, 3, 3], [1, 20, 1, 1], [6, 20, 32, 32], [6, 20, 32, 32]]", "cuda -keys=cuda,gpu -arch=sm_80 -max_num_threads=1024 -thread_warp_size=32", [-1, 16, 64, 49152, 2147483647, 1024, 8, 32], "", 0, []], [[], [["CI", 5], ["SP", 3, 0, 6, [1, 2, 1, 1], 1], ["SP", 3, 5, 20, [1, 10, 2, 1], 1], ["SP", 3, 10, 32, [2, 4, 1, 2], 1], ["SP", 3, 15, 32, [1, 2, 4, 1], 1], ["SP", 3, 20, 20, [5, 2], 1], ["SP", 3, 23, 3, [3, 1], 1], ["SP", 3, 26, 3, [1, 1], 1], ["RE", 3, [0, 5, 10, 15, 1, 6, 11, 16, 2, 7, 12, 17, 20, 23, 26, 21, 24, 27, 3, 8, 13, 18, 22, 25, 28, 4, 9, 14, 19]], ["FSP", 7, 0, 1, 3], ["FSP", 7, 4, 2, 3], ["FSP", 7, 8, 3, 3], ["FSP", 7, 12, 4, 3], ["RE", 7, [0, 4, 8, 12, 1, 5, 9, 13, 2, 6, 10, 14, 3, 7, 11, 15]], ["CA", 3, 7, 11], ["CHR", 2, "shared", [3]], ["CA", 3, 4, 14], ["CHR", 1, "shared", [4]], ["CA", 2, 5, 14], ["CI", 1], ["FU", 9, [0, 1, 2, 3]], ["AN", 9, 0, 5], ["FU", 9, [1, 2, 3, 4]], ["AN", 9, 1, 4], ["FU", 9, [2, 3, 4, 5]], ["AN", 9, 2, 6], ["FU", 4, [0, 1, 2, 3]], ["SP", 4, 0, 180, [1], 1], ["AN", 4, 1, 2], ["FFSP", 4, 0, [4, 3, 2, 1], 1, 1], ["AN", 4, 1, 6], ["FU", 2, [0, 1, 2, 3]], ["SP", 2, 0, 240, [1], 1], ["AN", 2, 1, 2], ["FFSP", 2, 0, [4, 3, 2, 1], 1, 1], ["AN", 2, 1, 6], ["PR", 5, 0, "auto_unroll_max_step$512"]]]], "r": [[3.45857e-05, 3.45855e-05, 3.45872e-05, 3.45835e-05], 0, 3.87274, 1670121615], "v": "v0.6"}
{"i": [["[\"a7de7210b6587109a1ca064f9b471c63\", [6, 20, 32, 32], [20, 20, 3, 3], [1, 20, 1, 1], [6, 20, 32, 32], [6, 20, 32, 32]]", "cuda -keys=cuda,gpu -arch=sm_80 -max_num_threads=1024 -thread_warp_size=32", [-1, 16, 64, 49152, 2147483647, 1024, 8, 32], "", 0, []], [[], [["CI", 5], ["SP", 3, 0, 6, [1, 1, 1, 1], 1], ["SP", 3, 5, 20, [1, 4, 1, 1], 1], ["SP", 3, 10, 32, [1, 2, 1, 4], 1], ["SP", 3, 15, 32, [2, 2, 1, 8], 1], ["SP", 3, 20, 20, [4, 5], 1], ["SP", 3, 23, 3, [1, 3], 1], ["SP", 3, 26, 3, [1, 1], 1], ["RE", 3, [0, 5, 10, 15, 1, 6, 11, 16, 2, 7, 12, 17, 20, 23, 26, 21, 24, 27, 3, 8, 13, 18, 22, 25, 28, 4, 9, 14, 19]], ["FSP", 7, 0, 1, 3], ["FSP", 7, 4, 2, 3], ["FSP", 7, 8, 3, 3], ["FSP", 7, 12, 4, 3], ["RE", 7, [0, 4, 8, 12, 1, 5, 9, 13, 2, 6, 10, 14, 3, 7, 11, 15]], ["CA", 3, 7, 11], ["CHR", 2, "shared", [3]], ["CA", 3, 4, 14], ["CHR", 1, "shared", [4]], ["CA", 2, 5, 14], ["CI", 1], ["FU", 9, [0, 1, 2, 3]], ["AN", 9, 0, 5], ["FU", 9, [1, 2, 3, 4]], ["AN", 9, 1, 4], ["FU", 9, [2, 3, 4, 5]], ["AN", 9, 2, 6], ["FU", 4, [0, 1, 2, 3]], ["SP", 4, 0, 180, [1], 1], ["AN", 4, 1, 2], ["FFSP", 4, 0, [4, 3, 2, 1], 1, 1], ["AN", 4, 1, 6], ["FU", 2, [0, 1, 2, 3]], ["SP", 2, 0, 800, [1], 1], ["AN", 2, 1, 2], ["FFSP", 2, 0, [4, 3, 2, 1], 1, 1], ["AN", 2, 1, 6], ["PR", 5, 0, "auto_unroll_max_step$512"]]]], "r": [[3.20961e-05, 3.2098e-05, 3.20964e-05, 3.20957e-05], 0, 5.69387, 1670121618], "v": "v0.6"}
{"i": [["[\"a7de7210b6587109a1ca064f9b471c63\", [6, 20, 32, 32], [20, 20, 3, 3], [1, 20, 1, 1], [6, 20, 32, 32], [6, 20, 32, 32]]", "cuda -keys=cuda,gpu -arch=sm_80 -max_num_threads=1024 -thread_warp_size=32", [-1, 16, 64, 49152, 2147483647, 1024, 8, 32], "", 0, []], [[], [["CI", 5], ["SP", 3, 0, 6, [2, 1, 1, 1], 1], ["SP", 3, 5, 20, [1, 5, 1, 4], 1], ["SP", 3, 10, 32, [1, 4, 1, 1], 1], ["SP", 3, 15, 32, [2, 4, 1, 1], 1], ["SP", 3, 20, 20, [2, 10], 1], ["SP", 3, 23, 3, [3, 1], 1], ["SP", 3, 26, 3, [1, 3], 1], ["RE", 3, [0, 5, 10, 15, 1, 6, 11, 16, 2, 7, 12, 17, 20, 23, 26, 21, 24, 27, 3, 8, 13, 18, 22, 25, 28, 4, 9, 14, 19]], ["FSP", 7, 0, 1, 3], ["FSP", 7, 4, 2, 3], ["FSP", 7, 8, 3, 3], ["FSP", 7, 12, 4, 3], ["RE", 7, [0, 4, 8, 12, 1, 5, 9, 13, 2, 6, 10, 14, 3, 7, 11, 15]], ["CA", 3, 7, 11], ["CHR", 2, "shared", [3]], ["CA", 3, 4, 14], ["CHR", 1, "shared", [4]], ["CA", 2, 5, 14], ["CI", 1], ["FU", 9, [0, 1, 2, 3]], ["AN", 9, 0, 5], ["FU", 9, [1, 2, 3, 4]], ["AN", 9, 1, 4], ["FU", 9, [2, 3, 4, 5]], ["AN", 9, 2, 6], ["FU", 4, [0, 1, 2, 3]], ["SP", 4, 0, 360, [1], 1], ["AN", 4, 1, 2], ["FFSP", 4, 0, [4, 3, 2, 1], 1, 1], ["AN", 4, 1, 6], ["FU", 2, [0, 1, 2, 3]], ["SP", 2, 0, 90, [1], 1], ["AN", 2, 1, 2], ["FFSP", 2, 0, [4, 3, 2, 1], 1, 1], ["AN", 2, 1, 6], ["PR", 5, 0, "auto_unroll_max_step$64"]]]], "r": [[1.72529e-05, 1.72581e-05, 1.72562e-05, 1.72588e-05], 0, 3.7189, 1670121621], "v": "v0.6"}
{"i": [["[\"a7de7210b6587109a1ca064f9b471c63\", [6, 20, 32, 32], [20, 20, 3, 3], [1, 20, 1, 1], [6, 20, 32, 32], [6, 20, 32, 32]]", "cuda -keys=cuda,gpu -arch=sm_80 -max_num_threads=1024 -thread_warp_size=32", [-1, 16, 64, 49152, 2147483647, 1024, 8, 32], "", 0, []], [[], [["CI", 5], ["SP", 3, 0, 6, [1, 1, 1, 6], 1], ["SP", 3, 5, 20, [2, 1, 10, 1], 1], ["SP", 3, 10, 32, [1, 8, 4, 1], 1], ["SP", 3, 15, 32, [1, 8, 1, 1], 1], ["SP", 3, 20, 20, [2, 1], 1], ["SP", 3, 23, 3, [1, 3], 1], ["SP", 3, 26, 3, [1, 1], 1], ["RE", 3, [0, 5, 10, 15, 1, 6, 11, 16, 2, 7, 12, 17, 20, 23, 26, 21, 24, 27, 3, 8, 13, 18, 22, 25, 28, 4, 9, 14, 19]], ["FSP", 7, 0, 1, 3], ["FSP", 7, 4, 2, 3], ["FSP", 7, 8, 3, 3], ["FSP", 7, 12, 4, 3], ["RE", 7, [0, 4, 8, 12, 1, 5, 9, 13, 2, 6, 10, 14, 3, 7, 11, 15]], ["CA", 3, 7, 11], ["CHR", 2, "shared", [3]], ["CA", 3, 4, 14], ["CHR", 1, "shared", [4]], ["CA", 2, 5, 14], ["CI", 1], ["FU", 9, [0, 1, 2, 3]], ["AN", 9, 0, 5], ["FU", 9, [1, 2, 3, 4]], ["AN", 9, 1, 4], ["FU", 9, [2, 3, 4, 5]], ["AN", 9, 2, 6], ["FU", 4, [0, 1, 2, 3]], ["SP", 4, 0, 60, [1], 1], ["AN", 4, 1, 2], ["FFSP", 4, 0, [4, 3, 2, 1], 1, 1], ["AN", 4, 1, 6], ["FU", 2, [0, 1, 2, 3]], ["SP", 2, 0, 72, [1], 1], ["AN", 2, 1, 2], ["FFSP", 2, 0, [4, 3, 2, 1], 1, 1], ["AN", 2, 1, 6], ["PR", 5, 0, "auto_unroll_max_step$0"]]]], "r": [[0.000862879, 0.000862694, 0.000862645, 0.000861734], 0, 3.63247, 1670121623], "v": "v0.6"}
{"i": [["[\"a7de7210b6587109a1ca064f9b471c63\", [6, 20, 32, 32], [20, 20, 3, 3], [1, 20, 1, 1], [6, 20, 32, 32], [6, 20, 32, 32]]", "cuda -keys=cuda,gpu -arch=sm_80 -max_num_threads=1024 -thread_warp_size=32", [-1, 16, 64, 49152, 2147483647, 1024, 8, 32], "", 0, []], [[], [["CI", 5], ["SP", 3, 0, 6, [2, 1, 1, 1], 1], ["SP", 3, 5, 20, [1, 10, 2, 1], 1], ["SP", 3, 10, 32, [2, 4, 2, 1], 1], ["SP", 3, 15, 32, [2, 1, 2, 2], 1], ["SP", 3, 20, 20, [10, 1], 1], ["SP", 3, 23, 3, [1, 1], 1], ["SP", 3, 26, 3, [1, 1], 1], ["RE", 3, [0, 5, 10, 15, 1, 6, 11, 16, 2, 7, 12, 17, 20, 23, 26, 21, 24, 27, 3, 8, 13, 18, 22, 25, 28, 4, 9, 14, 19]], ["FSP", 7, 0, 1, 3], ["FSP", 7, 4, 2, 3], ["FSP", 7, 8, 3, 3], ["FSP", 7, 12, 4, 3], ["RE", 7, [0, 4, 8, 12, 1, 5, 9, 13, 2, 6, 10, 14, 3, 7, 11, 15]], ["CA", 3, 7, 11], ["CHR", 2, "shared", [3]], ["CA", 3, 4, 14], ["CHR", 1, "shared", [4]], ["CA", 2, 5, 14], ["CI", 1], ["FU", 9, [0, 1, 2, 3]], ["AN", 9, 0, 5], ["FU", 9, [1, 2, 3, 4]], ["AN", 9, 1, 4], ["FU", 9, [2, 3, 4, 5]], ["AN", 9, 2, 6], ["FU", 4, [0, 1, 2, 3]], ["SP", 4, 0, 20, [1], 1], ["AN", 4, 1, 2], ["FFSP", 4, 0, [4, 3, 2, 1], 1, 1], ["AN", 4, 1, 6], ["FU", 2, [0, 1, 2, 3]], ["SP", 2, 0, 160, [1], 1], ["AN", 2, 1, 2], ["FFSP", 2, 0, [4, 3, 2, 1], 1, 1], ["AN", 2, 1, 6], ["PR", 5, 0, "auto_unroll_max_step$16"]]]], "r": [[0.000141558, 0.000141536, 0.000141551, 0.000141543], 0, 3.70346, 1670121626], "v": "v0.6"}
{"i": [["[\"a7de7210b6587109a1ca064f9b471c63\", [6, 20, 32, 32], [20, 20, 3, 3], [1, 20, 1, 1], [6, 20, 32, 32], [6, 20, 32, 32]]", "cuda -keys=cuda,gpu -arch=sm_80 -max_num_threads=1024 -thread_warp_size=32", [-1, 16, 64, 49152, 2147483647, 1024, 8, 32], "", 0, []], [[], [["CI", 5], ["SP", 3, 0, 6, [1, 1, 1, 2], 1], ["SP", 3, 5, 20, [1, 5, 1, 4], 1], ["SP", 3, 10, 32, [1, 4, 1, 1], 1], ["SP", 3, 15, 32, [2, 4, 1, 1], 1], ["SP", 3, 20, 20, [1, 10], 1], ["SP", 3, 23, 3, [1, 3], 1], ["SP", 3, 26, 3, [3, 1], 1], ["RE", 3, [0, 5, 10, 15, 1, 6, 11, 16, 2, 7, 12, 17, 20, 23, 26, 21, 24, 27, 3, 8, 13, 18, 22, 25, 28, 4, 9, 14, 19]], ["FSP", 7, 0, 1, 3], ["FSP", 7, 4, 2, 3], ["FSP", 7, 8, 3, 3], ["FSP", 7, 12, 4, 3], ["RE", 7, [0, 4, 8, 12, 1, 5, 9, 13, 2, 6, 10, 14, 3, 7, 11, 15]], ["CA", 3, 7, 11], ["CHR", 2, "shared", [3]], ["CA", 3, 4, 14], ["CHR", 1, "shared", [4]], ["CA", 2, 5, 14], ["CI", 1], ["FU", 9, [0, 1, 2, 3]], ["AN", 9, 0, 5], ["FU", 9, [1, 2, 3, 4]], ["AN", 9, 1, 4], ["FU", 9, [2, 3, 4, 5]], ["AN", 9, 2, 6], ["FU", 4, [0, 1, 2, 3]], ["SP", 4, 0, 360, [1], 1], ["AN", 4, 1, 2], ["FFSP", 4, 0, [4, 3, 2, 1], 1, 1], ["AN", 4, 1, 6], ["FU", 2, [0, 1, 2, 3]], ["SP", 2, 0, 90, [6], 1], ["AN", 2, 1, 2], ["FFSP", 2, 0, [4, 3, 2, 1], 1, 1], ["AN", 2, 1, 6], ["PR", 5, 0, "auto_unroll_max_step$1024"]]]], "r": [[1.3138e-05, 1.31397e-05, 1.31445e-05, 1.31389e-05], 0, 4.10077, 1670121629], "v": "v0.6"}
{"i": [["[\"a7de7210b6587109a1ca064f9b471c63\", [6, 20, 32, 32], [20, 20, 3, 3], [1, 20, 1, 1], [6, 20, 32, 32], [6, 20, 32, 32]]", "cuda -keys=cuda,gpu -arch=sm_80 -max_num_threads=1024 -thread_warp_size=32", [-1, 16, 64, 49152, 2147483647, 1024, 8, 32], "", 0, []], [[], [["CI", 5], ["SP", 3, 0, 6, [1, 2, 1, 1], 1], ["SP", 3, 5, 20, [1, 10, 2, 1], 1], ["SP", 3, 10, 32, [2, 4, 1, 2], 1], ["SP", 3, 15, 32, [1, 2, 4, 1], 1], ["SP", 3, 20, 20, [5, 2], 1], ["SP", 3, 23, 3, [1, 1], 1], ["SP", 3, 26, 3, [1, 1], 1], ["RE", 3, [0, 5, 10, 15, 1, 6, 11, 16, 2, 7, 12, 17, 20, 23, 26, 21, 24, 27, 3, 8, 13, 18, 22, 25, 28, 4, 9, 14, 19]], ["FSP", 7, 0, 1, 3], ["FSP", 7, 4, 2, 3], ["FSP", 7, 8, 3, 3], ["FSP", 7, 12, 4, 3], ["RE", 7, [0, 4, 8, 12, 1, 5, 9, 13, 2, 6, 10, 14, 3, 7, 11, 15]], ["CA", 3, 7, 11], ["CHR", 2, "shared", [3]], ["CA", 3, 4, 14], ["CHR", 1, "shared", [4]], ["CA", 2, 5, 14], ["CI", 1], ["FU", 9, [0, 1, 2, 3]], ["AN", 9, 0, 5], ["FU", 9, [1, 2, 3, 4]], ["AN", 9, 1, 4], ["FU", 9, [2, 3, 4, 5]], ["AN", 9, 2, 6], ["FU", 4, [0, 1, 2, 3]], ["SP", 4, 0, 180, [1], 1], ["AN", 4, 1, 2], ["FFSP", 4, 0, [4, 3, 2, 1], 1, 1], ["AN", 4, 1, 6], ["FU", 2, [0, 1, 2, 3]], ["SP", 2, 0, 240, [1], 1], ["AN", 2, 1, 2], ["FFSP", 2, 0, [4, 3, 2, 1], 1, 1], ["AN", 2, 1, 6], ["PR", 5, 0, "auto_unroll_max_step$512"]]]], "r": [[5.42294e-05, 5.42391e-05, 5.42367e-05, 5.4229e-05], 0, 4.24571, 1670121631], "v": "v0.6"}
{"i": [["[\"a7de7210b6587109a1ca064f9b471c63\", [6, 20, 32, 32], [20, 20, 3, 3], [1, 20, 1, 1], [6, 20, 32, 32], [6, 20, 32, 32]]", "cuda -keys=cuda,gpu -arch=sm_80 -max_num_threads=1024 -thread_warp_size=32", [-1, 16, 64, 49152, 2147483647, 1024, 8, 32], "", 0, []], [[], [["CI", 5], ["SP", 3, 0, 6, [3, 1, 2, 1], 1], ["SP", 3, 5, 20, [1, 1, 1, 1], 1], ["SP", 3, 10, 32, [1, 8, 1, 2], 1], ["SP", 3, 15, 32, [4, 4, 1, 2], 1], ["SP", 3, 20, 20, [2, 1], 1], ["SP", 3, 23, 3, [3, 1], 1], ["SP", 3, 26, 3, [1, 3], 1], ["RE", 3, [0, 5, 10, 15, 1, 6, 11, 16, 2, 7, 12, 17, 20, 23, 26, 21, 24, 27, 3, 8, 13, 18, 22, 25, 28, 4, 9, 14, 19]], ["FSP", 7, 0, 1, 3], ["FSP", 7, 4, 2, 3], ["FSP", 7, 8, 3, 3], ["FSP", 7, 12, 4, 3], ["RE", 7, [0, 4, 8, 12, 1, 5, 9, 13, 2, 6, 10, 14, 3, 7, 11, 15]], ["CA", 3, 7, 11], ["CHR", 2, "shared", [3]], ["CA", 3, 4, 14], ["CHR", 1, "shared", [4]], ["CA", 2, 5, 14], ["CI", 1], ["FU", 9, [0, 1, 2, 3]], ["AN", 9, 0, 5], ["FU", 9, [1, 2, 3, 4]], ["AN", 9, 1, 4], ["FU", 9, [2, 3, 4, 5]], ["AN", 9, 2, 6], ["FU", 4, [0, 1, 2, 3]], ["SP", 4, 0, 6, [3], 1], ["AN", 4, 1, 2], ["FFSP", 4, 0, [4, 3, 2, 1], 1, 1], ["AN", 4, 1, 6], ["FU", 2, [0, 1, 2, 3]], ["SP", 2, 0, 32, [1], 1], ["AN", 2, 1, 2], ["FFSP", 2, 0, [4, 3, 2, 1], 1, 1], ["AN", 2, 1, 6], ["PR", 5, 0, "auto_unroll_max_step$512"]]]], "r": [[0.000178337, 0.000178329, 0.000178314, 0.000178329], 0, 7.19988, 1670121634], "v": "v0.6"}
{"i": [["[\"a7de7210b6587109a1ca064f9b471c63\", [6, 20, 32, 32], [20, 20, 3, 3], [1, 20, 1, 1], [6, 20, 32, 32], [6, 20, 32, 32]]", "cuda -keys=cuda,gpu -arch=sm_80 -max_num_threads=1024 -thread_warp_size=32", [-1, 16, 64, 49152, 2147483647, 1024, 8, 32], "", 0, []], [[], [["CI", 5], ["SP", 3, 0, 6, [2, 1, 3, 1], 1], ["SP", 3, 5, 20, [1, 5, 2, 2], 1], ["SP", 3, 10, 32, [4, 8, 1, 1], 1], ["SP", 3, 15, 32, [1, 1, 1, 8], 1], ["SP", 3, 20, 20, [2, 2], 1], ["SP", 3, 23, 3, [1, 3], 1], ["SP", 3, 26, 3, [1, 1], 1], ["RE", 3, [0, 5, 10, 15, 1, 6, 11, 16, 2, 7, 12, 17, 20, 23, 26, 21, 24, 27, 3, 8, 13, 18, 22, 25, 28, 4, 9, 14, 19]], ["FSP", 7, 0, 1, 3], ["FSP", 7, 4, 2, 3], ["FSP", 7, 8, 3, 3], ["FSP", 7, 12, 4, 3], ["RE", 7, [0, 4, 8, 12, 1, 5, 9, 13, 2, 6, 10, 14, 3, 7, 11, 15]], ["CA", 3, 7, 11], ["CHR", 2, "shared", [3]], ["CA", 3, 4, 14], ["CHR", 1, "shared", [4]], ["CA", 2, 5, 14], ["CI", 1], ["FU", 9, [0, 1, 2, 3]], ["AN", 9, 0, 5], ["FU", 9, [1, 2, 3, 4]], ["AN", 9, 1, 4], ["FU", 9, [2, 3, 4, 5]], ["AN", 9, 2, 6], ["FU", 4, [0, 1, 2, 3]], ["SP", 4, 0, 144, [1], 1], ["AN", 4, 1, 2], ["FFSP", 4, 0, [4, 3, 2, 1], 1, 1], ["AN", 4, 1, 6], ["FU", 2, [0, 1, 2, 3]], ["SP", 2, 0, 360, [1], 1], ["AN", 2, 1, 2], ["FFSP", 2, 0, [4, 3, 2, 1], 1, 1], ["AN", 2, 1, 6], ["PR", 5, 0, "auto_unroll_max_step$16"]]]], "r": [[0.00127271, 0.00127407, 0.00127271, 0.00127315], 0, 4.579, 1670121637], "v": "v0.6"}
{"i": [["[\"a7de7210b6587109a1ca064f9b471c63\", [6, 20, 32, 32], [20, 20, 3, 3], [1, 20, 1, 1], [6, 20, 32, 32], [6, 20, 32, 32]]", "cuda -keys=cuda,gpu -arch=sm_80 -max_num_threads=1024 -thread_warp_size=32", [-1, 16, 64, 49152, 2147483647, 1024, 8, 32], "", 0, []], [[], [["CI", 5], ["SP", 3, 0, 6, [1, 6, 1, 1], 1], ["SP", 3, 5, 20, [2, 10, 1, 1], 1], ["SP", 3, 10, 32, [1, 2, 1, 16], 1], ["SP", 3, 15, 32, [2, 2, 4, 1], 1], ["SP", 3, 20, 20, [1, 1], 1], ["SP", 3, 23, 3, [3, 1], 1], ["SP", 3, 26, 3, [1, 3], 1], ["RE", 3, [0, 5, 10, 15, 1, 6, 11, 16, 2, 7, 12, 17, 20, 23, 26, 21, 24, 27, 3, 8, 13, 18, 22, 25, 28, 4, 9, 14, 19]], ["FSP", 7, 0, 1, 3], ["FSP", 7, 4, 2, 3], ["FSP", 7, 8, 3, 3], ["FSP", 7, 12, 4, 3], ["RE", 7, [0, 4, 8, 12, 1, 5, 9, 13, 2, 6, 10, 14, 3, 7, 11, 15]], ["CA", 3, 7, 11], ["CHR", 2, "shared", [3]], ["CA", 3, 4, 14], ["CHR", 1, "shared", [4]], ["CA", 2, 5, 14], ["CI", 1], ["FU", 9, [0, 1, 2, 3]], ["AN", 9, 0, 5], ["FU", 9, [1, 2, 3, 4]], ["AN", 9, 1, 4], ["FU", 9, [2, 3, 4, 5]], ["AN", 9, 2, 6], ["FU", 4, [0, 1, 2, 3]], ["SP", 4, 0, 45, [1], 1], ["AN", 4, 1, 2], ["FFSP", 4, 0, [4, 3, 2, 1], 1, 1], ["AN", 4, 1, 6], ["FU", 2, [0, 1, 2, 3]], ["SP", 2, 0, 180, [1], 1], ["AN", 2, 1, 2], ["FFSP", 2, 0, [4, 3, 2, 1], 1, 1], ["AN", 2, 1, 6], ["PR", 5, 0, "auto_unroll_max_step$1024"]]]], "r": [[0.000414026, 0.000413939, 0.000414479, 0.000413324], 0, 5.22851, 1670121640], "v": "v0.6"}
{"i": [["[\"a7de7210b6587109a1ca064f9b471c63\", [6, 20, 32, 32], [20, 20, 3, 3], [1, 20, 1, 1], [6, 20, 32, 32], [6, 20, 32, 32]]", "cuda -keys=cuda,gpu -arch=sm_80 -max_num_threads=1024 -thread_warp_size=32", [-1, 16, 64, 49152, 2147483647, 1024, 8, 32], "", 0, []], [[], [["CI", 5], ["SP", 3, 0, 6, [1, 1, 3, 2], 1], ["SP", 3, 5, 20, [1, 5, 1, 1], 1], ["SP", 3, 10, 32, [1, 8, 2, 1], 1], ["SP", 3, 15, 32, [1, 1, 1, 32], 1], ["SP", 3, 20, 20, [1, 1], 1], ["SP", 3, 23, 3, [1, 3], 1], ["SP", 3, 26, 3, [3, 1], 1], ["RE", 3, [0, 5, 10, 15, 1, 6, 11, 16, 2, 7, 12, 17, 20, 23, 26, 21, 24, 27, 3, 8, 13, 18, 22, 25, 28, 4, 9, 14, 19]], ["FSP", 7, 0, 1, 3], ["FSP", 7, 4, 2, 3], ["FSP", 7, 8, 3, 3], ["FSP", 7, 12, 4, 3], ["RE", 7, [0, 4, 8, 12, 1, 5, 9, 13, 2, 6, 10, 14, 3, 7, 11, 15]], ["CA", 3, 7, 11], ["CHR", 2, "shared", [3]], ["CA", 3, 4, 14], ["CHR", 1, "shared", [4]], ["CA", 2, 5, 14], ["CI", 1], ["FU", 9, [0, 1, 2, 3]], ["AN", 9, 0, 5], ["FU", 9, [1, 2, 3, 4]], ["AN", 9, 1, 4], ["FU", 9, [2, 3, 4, 5]], ["AN", 9, 2, 6], ["FU", 4, [0, 1, 2, 3]], ["SP", 4, 0, 9, [1], 1], ["AN", 4, 1, 2], ["FFSP", 4, 0, [4, 3, 2, 1], 1, 1], ["AN", 4, 1, 6], ["FU", 2, [0, 1, 2, 3]], ["SP", 2, 0, 272, [1], 1], ["AN", 2, 1, 2], ["FFSP", 2, 0, [4, 3, 2, 1], 1, 1], ["AN", 2, 1, 6], ["PR", 5, 0, "auto_unroll_max_step$0"]]]], "r": [[0.000898437, 0.000898609, 0.000898441, 0.00089817], 0, 4.00971, 1670121642], "v": "v0.6"}
{"i": [["[\"a7de7210b6587109a1ca064f9b471c63\", [6, 20, 32, 32], [20, 20, 3, 3], [1, 20, 1, 1], [6, 20, 32, 32], [6, 20, 32, 32]]", "cuda -keys=cuda,gpu -arch=sm_80 -max_num_threads=1024 -thread_warp_size=32", [-1, 16, 64, 49152, 2147483647, 1024, 8, 32], "", 0, []], [[], [["CI", 5], ["SP", 3, 0, 6, [1, 2, 1, 1], 1], ["SP", 3, 5, 20, [2, 5, 2, 1], 1], ["SP", 3, 10, 32, [1, 4, 8, 1], 1], ["SP", 3, 15, 32, [4, 1, 1, 8], 1], ["SP", 3, 20, 20, [4, 1], 1], ["SP", 3, 23, 3, [1, 1], 1], ["SP", 3, 26, 3, [1, 3], 1], ["RE", 3, [0, 5, 10, 15, 1, 6, 11, 16, 2, 7, 12, 17, 20, 23, 26, 21, 24, 27, 3, 8, 13, 18, 22, 25, 28, 4, 9, 14, 19]], ["FSP", 7, 0, 1, 3], ["FSP", 7, 4, 2, 3], ["FSP", 7, 8, 3, 3], ["FSP", 7, 12, 4, 3], ["RE", 7, [0, 4, 8, 12, 1, 5, 9, 13, 2, 6, 10, 14, 3, 7, 11, 15]], ["CA", 3, 7, 11], ["CHR", 2, "shared", [3]], ["CA", 3, 4, 14], ["CHR", 1, "shared", [4]], ["CA", 2, 5, 14], ["CI", 1], ["FU", 9, [0, 1, 2, 3]], ["AN", 9, 0, 5], ["FU", 9, [1, 2, 3, 4]], ["AN", 9, 1, 4], ["FU", 9, [2, 3, 4, 5]], ["AN", 9, 2, 6], ["FU", 4, [0, 1, 2, 3]], ["SP", 4, 0, 24, [1], 1], ["AN", 4, 1, 2], ["FFSP", 4, 0, [4, 3, 2, 1], 1, 1], ["AN", 4, 1, 6], ["FU", 2, [0, 1, 2, 3]], ["SP", 2, 0, 576, [1], 1], ["AN", 2, 1, 2], ["FFSP", 2, 0, [4, 3, 2, 1], 1, 1], ["AN", 2, 1, 6], ["PR", 5, 0, "auto_unroll_max_step$64"]]]], "r": [[0.00178066, 0.00178067, 0.00178069, 0.00177962], 0, 3.78008, 1670121644], "v": "v0.6"}
{"i": [["[\"a7de7210b6587109a1ca064f9b471c63\", [6, 20, 32, 32], [20, 20, 3, 3], [1, 20, 1, 1], [6, 20, 32, 32], [6, 20, 32, 32]]", "cuda -keys=cuda,gpu -arch=sm_80 -max_num_threads=1024 -thread_warp_size=32", [-1, 16, 64, 49152, 2147483647, 1024, 8, 32], "", 0, []], [[], [["CI", 5], ["SP", 3, 0, 6, [1, 3, 2, 1], 1], ["SP", 3, 5, 20, [1, 10, 2, 1], 1], ["SP", 3, 10, 32, [8, 4, 1, 1], 1], ["SP", 3, 15, 32, [1, 2, 4, 1], 1], ["SP", 3, 20, 20, [2, 1], 1], ["SP", 3, 23, 3, [3, 1], 1], ["SP", 3, 26, 3, [1, 3], 1], ["RE", 3, [0, 5, 10, 15, 1, 6, 11, 16, 2, 7, 12, 17, 20, 23, 26, 21, 24, 27, 3, 8, 13, 18, 22, 25, 28, 4, 9, 14, 19]], ["FSP", 7, 0, 1, 3], ["FSP", 7, 4, 2, 3], ["FSP", 7, 8, 3, 3], ["FSP", 7, 12, 4, 3], ["RE", 7, [0, 4, 8, 12, 1, 5, 9, 13, 2, 6, 10, 14, 3, 7, 11, 15]], ["CA", 3, 7, 11], ["CHR", 2, "shared", [3]], ["CA", 3, 4, 14], ["CHR", 1, "shared", [4]], ["CA", 2, 5, 14], ["CI", 1], ["FU", 9, [0, 1, 2, 3]], ["AN", 9, 0, 5], ["FU", 9, [1, 2, 3, 4]], ["AN", 9, 1, 4], ["FU", 9, [2, 3, 4, 5]], ["AN", 9, 2, 6], ["FU", 4, [0, 1, 2, 3]], ["SP", 4, 0, 36, [1], 1], ["AN", 4, 1, 2], ["FFSP", 4, 0, [4, 3, 2, 1], 1, 1], ["AN", 4, 1, 6], ["FU", 2, [0, 1, 2, 3]], ["SP", 2, 0, 72, [6], 1], ["AN", 2, 1, 2], ["FFSP", 2, 0, [4, 3, 2, 1], 1, 1], ["AN", 2, 1, 6], ["PR", 5, 0, "auto_unroll_max_step$16"]]]], "r": [[0.000273691, 0.000273345, 0.000273818, 0.000273749], 0, 3.74879, 1670121647], "v": "v0.6"}
{"i": [["[\"a7de7210b6587109a1ca064f9b471c63\", [6, 20, 32, 32], [20, 20, 3, 3], [1, 20, 1, 1], [6, 20, 32, 32], [6, 20, 32, 32]]", "cuda -keys=cuda,gpu -arch=sm_80 -max_num_threads=1024 -thread_warp_size=32", [-1, 16, 64, 49152, 2147483647, 1024, 8, 32], "", 0, []], [[], [["CI", 5], ["SP", 3, 0, 6, [1, 1, 1, 6], 1], ["SP", 3, 5, 20, [1, 10, 1, 2], 1], ["SP", 3, 10, 32, [2, 1, 1, 1], 1], ["SP", 3, 15, 32, [1, 4, 1, 1], 1], ["SP", 3, 20, 20, [2, 5], 1], ["SP", 3, 23, 3, [1, 1], 1], ["SP", 3, 26, 3, [1, 3], 1], ["RE", 3, [0, 5, 10, 15, 1, 6, 11, 16, 2, 7, 12, 17, 20, 23, 26, 21, 24, 27, 3, 8, 13, 18, 22, 25, 28, 4, 9, 14, 19]], ["FSP", 7, 0, 1, 3], ["FSP", 7, 4, 2, 3], ["FSP", 7, 8, 3, 3], ["FSP", 7, 12, 4, 3], ["RE", 7, [0, 4, 8, 12, 1, 5, 9, 13, 2, 6, 10, 14, 3, 7, 11, 15]], ["CA", 3, 7, 11], ["CHR", 2, "shared", [3]], ["CA", 3, 4, 14], ["CHR", 1, "shared", [4]], ["CA", 2, 5, 14], ["CI", 1], ["FU", 9, [0, 1, 2, 3]], ["AN", 9, 0, 5], ["FU", 9, [1, 2, 3, 4]], ["AN", 9, 1, 4], ["FU", 9, [2, 3, 4, 5]], ["AN", 9, 2, 6], ["FU", 4, [0, 1, 2, 3]], ["SP", 4, 0, 60, [1], 1], ["AN", 4, 1, 2], ["FFSP", 4, 0, [4, 3, 2, 1], 1, 1], ["AN", 4, 1, 6], ["FU", 2, [0, 1, 2, 3]], ["SP", 2, 0, 90, [18], 1], ["AN", 2, 1, 2], ["FFSP", 2, 0, [4, 3, 2, 1], 1, 1], ["AN", 2, 1, 6], ["PR", 5, 0, "auto_unroll_max_step$1024"]]]], "r": [[3.46947e-05, 3.46751e-05, 3.46742e-05, 3.46742e-05], 0, 4.34987, 1670121649], "v": "v0.6"}
{"i": [["[\"a7de7210b6587109a1ca064f9b471c63\", [6, 20, 32, 32], [20, 20, 3, 3], [1, 20, 1, 1], [6, 20, 32, 32], [6, 20, 32, 32]]", "cuda -keys=cuda,gpu -arch=sm_80 -max_num_threads=1024 -thread_warp_size=32", [-1, 16, 64, 49152, 2147483647, 1024, 8, 32], "", 0, []], [[], [["CI", 5], ["SP", 3, 0, 6, [1, 1, 6, 1], 1], ["SP", 3, 5, 20, [1, 2, 1, 1], 1], ["SP", 3, 10, 32, [1, 1, 1, 2], 1], ["SP", 3, 15, 32, [1, 16, 1, 2], 1], ["SP", 3, 20, 20, [1, 2], 1], ["SP", 3, 23, 3, [3, 1], 1], ["SP", 3, 26, 3, [1, 1], 1], ["RE", 3, [0, 5, 10, 15, 1, 6, 11, 16, 2, 7, 12, 17, 20, 23, 26, 21, 24, 27, 3, 8, 13, 18, 22, 25, 28, 4, 9, 14, 19]], ["FSP", 7, 0, 1, 3], ["FSP", 7, 4, 2, 3], ["FSP", 7, 8, 3, 3], ["FSP", 7, 12, 4, 3], ["RE", 7, [0, 4, 8, 12, 1, 5, 9, 13, 2, 6, 10, 14, 3, 7, 11, 15]], ["CA", 3, 7, 11], ["CHR", 2, "shared", [3]], ["CA", 3, 4, 14], ["CHR", 1, "shared", [4]], ["CA", 2, 5, 14], ["CI", 1], ["FU", 9, [0, 1, 2, 3]], ["AN", 9, 0, 5], ["FU", 9, [1, 2, 3, 4]], ["AN", 9, 1, 4], ["FU", 9, [2, 3, 4, 5]], ["AN", 9, 2, 6], ["FU", 4, [0, 1, 2, 3]], ["SP", 4, 0, 6, [1], 1], ["AN", 4, 1, 2], ["FFSP", 4, 0, [4, 3, 2, 1], 1, 1], ["AN", 4, 1, 6], ["FU", 2, [0, 1, 2, 3]], ["SP", 2, 0, 36, [1], 1], ["AN", 2, 1, 2], ["FFSP", 2, 0, [4, 3, 2, 1], 1, 1], ["AN", 2, 1, 6], ["PR", 5, 0, "auto_unroll_max_step$0"]]]], "r": [[3.90067e-05, 3.90042e-05, 3.90062e-05, 3.90086e-05], 0, 3.3169, 1670121652], "v": "v0.6"}
{"i": [["[\"a7de7210b6587109a1ca064f9b471c63\", [6, 20, 32, 32], [20, 20, 3, 3], [1, 20, 1, 1], [6, 20, 32, 32], [6, 20, 32, 32]]", "cuda -keys=cuda,gpu -arch=sm_80 -max_num_threads=1024 -thread_warp_size=32", [-1, 16, 64, 49152, 2147483647, 1024, 8, 32], "", 0, []], [[], [["CI", 5], ["SP", 3, 0, 6, [1, 1, 1, 3], 1], ["SP", 3, 5, 20, [2, 1, 2, 1], 1], ["SP", 3, 10, 32, [1, 16, 1, 1], 1], ["SP", 3, 15, 32, [1, 16, 1, 2], 1], ["SP", 3, 20, 20, [5, 1], 1], ["SP", 3, 23, 3, [1, 1], 1], ["SP", 3, 26, 3, [3, 1], 1], ["RE", 3, [0, 5, 10, 15, 1, 6, 11, 16, 2, 7, 12, 17, 20, 23, 26, 21, 24, 27, 3, 8, 13, 18, 22, 25, 28, 4, 9, 14, 19]], ["FSP", 7, 0, 1, 3], ["FSP", 7, 4, 2, 3], ["FSP", 7, 8, 3, 3], ["FSP", 7, 12, 4, 3], ["RE", 7, [0, 4, 8, 12, 1, 5, 9, 13, 2, 6, 10, 14, 3, 7, 11, 15]], ["CA", 3, 7, 11], ["CHR", 2, "shared", [3]], ["CA", 3, 4, 14], ["CHR", 1, "shared", [4]], ["CA", 2, 5, 14], ["CI", 1], ["FU", 9, [0, 1, 2, 3]], ["AN", 9, 0, 5], ["FU", 9, [1, 2, 3, 4]], ["AN", 9, 1, 4], ["FU", 9, [2, 3, 4, 5]], ["AN", 9, 2, 6], ["FU", 4, [0, 1, 2, 3]], ["SP", 4, 0, 150, [1], 1], ["AN", 4, 1, 2], ["FFSP", 4, 0, [4, 3, 2, 1], 1, 1], ["AN", 4, 1, 6], ["FU", 2, [0, 1, 2, 3]], ["SP", 2, 0, 120, [1], 1], ["AN", 2, 1, 2], ["FFSP", 2, 0, [4, 3, 2, 1], 1, 1], ["AN", 2, 1, 6], ["PR", 5, 0, "auto_unroll_max_step$16"]]]], "r": [[0.000148476, 0.000148518, 0.000148391, 0.000148391], 0, 3.18408, 1670121655], "v": "v0.6"}
{"i": [["[\"a7de7210b6587109a1ca064f9b471c63\", [6, 20, 32, 32], [20, 20, 3, 3], [1, 20, 1, 1], [6, 20, 32, 32], [6, 20, 32, 32]]", "cuda -keys=cuda,gpu -arch=sm_80 -max_num_threads=1024 -thread_warp_size=32", [-1, 16, 64, 49152, 2147483647, 1024, 8, 32], "", 0, []], [[], [["CI", 5], ["SP", 3, 0, 6, [1, 1, 2, 1], 1], ["SP", 3, 5, 20, [1, 5, 2, 1], 1], ["SP", 3, 10, 32, [8, 4, 1, 1], 1], ["SP", 3, 15, 32, [1, 2, 8, 1], 1], ["SP", 3, 20, 20, [1, 4], 1], ["SP", 3, 23, 3, [1, 3], 1], ["SP", 3, 26, 3, [1, 1], 1], ["RE", 3, [0, 5, 10, 15, 1, 6, 11, 16, 2, 7, 12, 17, 20, 23, 26, 21, 24, 27, 3, 8, 13, 18, 22, 25, 28, 4, 9, 14, 19]], ["FSP", 7, 0, 1, 3], ["FSP", 7, 4, 2, 3], ["FSP", 7, 8, 3, 3], ["FSP", 7, 12, 4, 3], ["RE", 7, [0, 4, 8, 12, 1, 5, 9, 13, 2, 6, 10, 14, 3, 7, 11, 15]], ["CA", 3, 7, 11], ["CHR", 2, "shared", [3]], ["CA", 3, 4, 14], ["CHR", 1, "shared", [4]], ["CA", 2, 5, 14], ["CI", 1], ["FU", 9, [0, 1, 2, 3]], ["AN", 9, 0, 5], ["FU", 9, [1, 2, 3, 4]], ["AN", 9, 1, 4], ["FU", 9, [2, 3, 4, 5]], ["AN", 9, 2, 6], ["FU", 4, [0, 1, 2, 3]], ["SP", 4, 0, 18, [1], 1], ["AN", 4, 1, 2], ["FFSP", 4, 0, [4, 3, 2, 1], 1, 1], ["AN", 4, 1, 6], ["FU", 2, [0, 1, 2, 3]], ["SP", 2, 0, 60, [30], 1], ["AN", 2, 1, 2], ["FFSP", 2, 0, [4, 3, 2, 1], 1, 1], ["AN", 2, 1, 6], ["PR", 5, 0, "auto_unroll_max_step$512"]]]], "r": [[0.000735605, 0.000735202, 0.000735862, 0.000735915], 0, 5.98053, 1670121658], "v": "v0.6"}
{"i": [["[\"a7de7210b6587109a1ca064f9b471c63\", [6, 20, 32, 32], [20, 20, 3, 3], [1, 20, 1, 1], [6, 20, 32, 32], [6, 20, 32, 32]]", "cuda -keys=cuda,gpu -arch=sm_80 -max_num_threads=1024 -thread_warp_size=32", [-1, 16, 64, 49152, 2147483647, 1024, 8, 32], "", 0, []], [[], [["CI", 5], ["SP", 3, 0, 6, [1, 3, 1, 2], 1], ["SP", 3, 5, 20, [1, 10, 1, 1], 1], ["SP", 3, 10, 32, [2, 2, 2, 1], 1], ["SP", 3, 15, 32, [1, 4, 1, 2], 1], ["SP", 3, 20, 20, [20, 1], 1], ["SP", 3, 23, 3, [1, 1], 1], ["SP", 3, 26, 3, [3, 1], 1], ["RE", 3, [0, 5, 10, 15, 1, 6, 11, 16, 2, 7, 12, 17, 20, 23, 26, 21, 24, 27, 3, 8, 13, 18, 22, 25, 28, 4, 9, 14, 19]], ["FSP", 7, 0, 1, 3], ["FSP", 7, 4, 2, 3], ["FSP", 7, 8, 3, 3], ["FSP", 7, 12, 4, 3], ["RE", 7, [0, 4, 8, 12, 1, 5, 9, 13, 2, 6, 10, 14, 3, 7, 11, 15]], ["CA", 3, 7, 11], ["CHR", 2, "shared", [3]], ["CA", 3, 4, 14], ["CHR", 1, "shared", [4]], ["CA", 2, 5, 14], ["CI", 1], ["FU", 9, [0, 1, 2, 3]], ["AN", 9, 0, 5], ["FU", 9, [1, 2, 3, 4]], ["AN", 9, 1, 4], ["FU", 9, [2, 3, 4, 5]], ["AN", 9, 2, 6], ["FU", 4, [0, 1, 2, 3]], ["SP", 4, 0, 20, [1], 1], ["AN", 4, 1, 2], ["FFSP", 4, 0, [4, 3, 2, 1], 1, 1], ["AN", 4, 1, 6], ["FU", 2, [0, 1, 2, 3]], ["SP", 2, 0, 160, [16], 1], ["AN", 2, 1, 2], ["FFSP", 2, 0, [4, 3, 2, 1], 1, 1], ["AN", 2, 1, 6], ["PR", 5, 0, "auto_unroll_max_step$64"]]]], "r": [[3.93163e-05, 3.93355e-05, 3.94041e-05, 3.93284e-05], 0, 3.65235, 1670121660], "v": "v0.6"}
{"i": [["[\"a7de7210b6587109a1ca064f9b471c63\", [6, 20, 32, 32], [20, 20, 3, 3], [1, 20, 1, 1], [6, 20, 32, 32], [6, 20, 32, 32]]", "cuda -keys=cuda,gpu -arch=sm_80 -max_num_threads=1024 -thread_warp_size=32", [-1, 16, 64, 49152, 2147483647, 1024, 8, 32], "", 0, []], [[], [["CI", 5], ["SP", 3, 0, 6, [1, 1, 6, 1], 1], ["SP", 3, 5, 20, [1, 5, 1, 1], 1], ["SP", 3, 10, 32, [2, 1, 1, 4], 1], ["SP", 3, 15, 32, [1, 4, 1, 4], 1], ["SP", 3, 20, 20, [2, 1], 1], ["SP", 3, 23, 3, [3, 1], 1], ["SP", 3, 26, 3, [3, 1], 1], ["RE", 3, [0, 5, 10, 15, 1, 6, 11, 16, 2, 7, 12, 17, 20, 23, 26, 21, 24, 27, 3, 8, 13, 18, 22, 25, 28, 4, 9, 14, 19]], ["FSP", 7, 0, 1, 3], ["FSP", 7, 4, 2, 3], ["FSP", 7, 8, 3, 3], ["FSP", 7, 12, 4, 3], ["RE", 7, [0, 4, 8, 12, 1, 5, 9, 13, 2, 6, 10, 14, 3, 7, 11, 15]], ["CA", 3, 7, 11], ["CHR", 2, "shared", [3]], ["CA", 3, 4, 14], ["CHR", 1, "shared", [4]], ["CA", 2, 5, 14], ["CI", 1], ["FU", 9, [0, 1, 2, 3]], ["AN", 9, 0, 5], ["FU", 9, [1, 2, 3, 4]], ["AN", 9, 1, 4], ["FU", 9, [2, 3, 4, 5]], ["AN", 9, 2, 6], ["FU", 4, [0, 1, 2, 3]], ["SP", 4, 0, 6, [1], 1], ["AN", 4, 1, 2], ["FFSP", 4, 0, [4, 3, 2, 1], 1, 1], ["AN", 4, 1, 6], ["FU", 2, [0, 1, 2, 3]], ["SP", 2, 0, 96, [1], 1], ["AN", 2, 1, 2], ["FFSP", 2, 0, [4, 3, 2, 1], 1, 1], ["AN", 2, 1, 6], ["PR", 5, 0, "auto_unroll_max_step$0"]]]], "r": [[0.000331588, 0.000331345, 0.000331282, 0.000331299], 0, 4.11347, 1670121663], "v": "v0.6"}
{"i": [["[\"a7de7210b6587109a1ca064f9b471c63\", [6, 20, 32, 32], [20, 20, 3, 3], [1, 20, 1, 1], [6, 20, 32, 32], [6, 20, 32, 32]]", "cuda -keys=cuda,gpu -arch=sm_80 -max_num_threads=1024 -thread_warp_size=32", [-1, 16, 64, 49152, 2147483647, 1024, 8, 32], "", 0, []], [[], [["CI", 5], ["SP", 3, 0, 6, [3, 2, 1, 1], 1], ["SP", 3, 5, 20, [4, 5, 1, 1], 1], ["SP", 3, 10, 32, [1, 1, 1, 8], 1], ["SP", 3, 15, 32, [1, 4, 2, 1], 1], ["SP", 3, 20, 20, [2, 10], 1], ["SP", 3, 23, 3, [1, 3], 1], ["SP", 3, 26, 3, [1, 1], 1], ["RE", 3, [0, 5, 10, 15, 1, 6, 11, 16, 2, 7, 12, 17, 20, 23, 26, 21, 24, 27, 3, 8, 13, 18, 22, 25, 28, 4, 9, 14, 19]], ["FSP", 7, 0, 1, 3], ["FSP", 7, 4, 2, 3], ["FSP", 7, 8, 3, 3], ["FSP", 7, 12, 4, 3], ["RE", 7, [0, 4, 8, 12, 1, 5, 9, 13, 2, 6, 10, 14, 3, 7, 11, 15]], ["CA", 3, 7, 11], ["CHR", 2, "shared", [3]], ["CA", 3, 4, 14], ["CHR", 1, "shared", [4]], ["CA", 2, 5, 14], ["CI", 1], ["FU", 9, [0, 1, 2, 3]], ["AN", 9, 0, 5], ["FU", 9, [1, 2, 3, 4]], ["AN", 9, 1, 4], ["FU", 9, [2, 3, 4, 5]], ["AN", 9, 2, 6], ["FU", 4, [0, 1, 2, 3]], ["SP", 4, 0, 120, [1], 1], ["AN", 4, 1, 2], ["FFSP", 4, 0, [4, 3, 2, 1], 1, 1], ["AN", 4, 1, 6], ["FU", 2, [0, 1, 2, 3]], ["SP", 2, 0, 400, [1], 1], ["AN", 2, 1, 2], ["FFSP", 2, 0, [4, 3, 2, 1], 1, 1], ["AN", 2, 1, 6], ["PR", 5, 0, "auto_unroll_max_step$0"]]]], "r": [[9.76536e-05, 9.76778e-05, 9.76141e-05, 9.76739e-05], 0, 3.91706, 1670121666], "v": "v0.6"}
{"i": [["[\"a7de7210b6587109a1ca064f9b471c63\", [6, 20, 32, 32], [20, 20, 3, 3], [1, 20, 1, 1], [6, 20, 32, 32], [6, 20, 32, 32]]", "cuda -keys=cuda,gpu -arch=sm_80 -max_num_threads=1024 -thread_warp_size=32", [-1, 16, 64, 49152, 2147483647, 1024, 8, 32], "", 0, []], [[], [["CI", 5], ["SP", 3, 0, 6, [3, 1, 1, 1], 1], ["SP", 3, 5, 20, [1, 4, 1, 1], 1], ["SP", 3, 10, 32, [1, 1, 16, 1], 1], ["SP", 3, 15, 32, [1, 8, 1, 2], 1], ["SP", 3, 20, 20, [2, 2], 1], ["SP", 3, 23, 3, [1, 1], 1], ["SP", 3, 26, 3, [1, 1], 1], ["RE", 3, [0, 5, 10, 15, 1, 6, 11, 16, 2, 7, 12, 17, 20, 23, 26, 21, 24, 27, 3, 8, 13, 18, 22, 25, 28, 4, 9, 14, 19]], ["FSP", 7, 0, 1, 3], ["FSP", 7, 4, 2, 3], ["FSP", 7, 8, 3, 3], ["FSP", 7, 12, 4, 3], ["RE", 7, [0, 4, 8, 12, 1, 5, 9, 13, 2, 6, 10, 14, 3, 7, 11, 15]], ["CA", 3, 7, 11], ["CHR", 2, "shared", [3]], ["CA", 3, 4, 14], ["CHR", 1, "shared", [4]], ["CA", 2, 5, 14], ["CI", 1], ["FU", 9, [0, 1, 2, 3]], ["AN", 9, 0, 5], ["FU", 9, [1, 2, 3, 4]], ["AN", 9, 1, 4], ["FU", 9, [2, 3, 4, 5]], ["AN", 9, 2, 6], ["FU", 4, [0, 1, 2, 3]], ["SP", 4, 0, 12, [1], 1], ["AN", 4, 1, 2], ["FFSP", 4, 0, [4, 3, 2, 1], 1, 1], ["AN", 4, 1, 6], ["FU", 2, [0, 1, 2, 3]], ["SP", 2, 0, 256, [2], 1], ["AN", 2, 1, 2], ["FFSP", 2, 0, [4, 3, 2, 1], 1, 1], ["AN", 2, 1, 6], ["PR", 5, 0, "auto_unroll_max_step$1024"]]]], "r": [[8.86159e-05, 8.84739e-05, 8.86212e-05, 8.86147e-05], 0, 4.96542, 1670121668], "v": "v0.6"}
{"i": [["[\"a7de7210b6587109a1ca064f9b471c63\", [6, 20, 32, 32], [20, 20, 3, 3], [1, 20, 1, 1], [6, 20, 32, 32], [6, 20, 32, 32]]", "cuda -keys=cuda,gpu -arch=sm_80 -max_num_threads=1024 -thread_warp_size=32", [-1, 16, 64, 49152, 2147483647, 1024, 8, 32], "", 0, []], [[], [["CI", 5], ["SP", 3, 0, 6, [3, 1, 2, 1], 1], ["SP", 3, 5, 20, [1, 1, 1, 1], 1], ["SP", 3, 10, 32, [1, 8, 1, 2], 1], ["SP", 3, 15, 32, [2, 4, 1, 2], 1], ["SP", 3, 20, 20, [2, 1], 1], ["SP", 3, 23, 3, [3, 1], 1], ["SP", 3, 26, 3, [3, 1], 1], ["RE", 3, [0, 5, 10, 15, 1, 6, 11, 16, 2, 7, 12, 17, 20, 23, 26, 21, 24, 27, 3, 8, 13, 18, 22, 25, 28, 4, 9, 14, 19]], ["FSP", 7, 0, 1, 3], ["FSP", 7, 4, 2, 3], ["FSP", 7, 8, 3, 3], ["FSP", 7, 12, 4, 3], ["RE", 7, [0, 4, 8, 12, 1, 5, 9, 13, 2, 6, 10, 14, 3, 7, 11, 15]], ["CA", 3, 7, 11], ["CHR", 2, "shared", [3]], ["CA", 3, 4, 14], ["CHR", 1, "shared", [4]], ["CA", 2, 5, 14], ["CI", 1], ["FU", 9, [0, 1, 2, 3]], ["AN", 9, 0, 5], ["FU", 9, [1, 2, 3, 4]], ["AN", 9, 1, 4], ["FU", 9, [2, 3, 4, 5]], ["AN", 9, 2, 6], ["FU", 4, [0, 1, 2, 3]], ["SP", 4, 0, 6, [3], 1], ["AN", 4, 1, 2], ["FFSP", 4, 0, [4, 3, 2, 1], 1, 1], ["AN", 4, 1, 6], ["FU", 2, [0, 1, 2, 3]], ["SP", 2, 0, 32, [1], 1], ["AN", 2, 1, 2], ["FFSP", 2, 0, [4, 3, 2, 1], 1, 1], ["AN", 2, 1, 6], ["PR", 5, 0, "auto_unroll_max_step$512"]]]], "r": [[4.78796e-05, 4.79121e-05, 4.78584e-05, 4.78553e-05], 0, 5.30972, 1670121671], "v": "v0.6"}
{"i": [["[\"a7de7210b6587109a1ca064f9b471c63\", [6, 20, 32, 32], [20, 20, 3, 3], [1, 20, 1, 1], [6, 20, 32, 32], [6, 20, 32, 32]]", "cuda -keys=cuda,gpu -arch=sm_80 -max_num_threads=1024 -thread_warp_size=32", [-1, 16, 64, 49152, 2147483647, 1024, 8, 32], "", 0, []], [[], [["CI", 5], ["SP", 3, 0, 6, [1, 2, 3, 1], 1], ["SP", 3, 5, 20, [1, 1, 20, 1], 1], ["SP", 3, 10, 32, [1, 4, 4, 1], 1], ["SP", 3, 15, 32, [8, 4, 1, 1], 1], ["SP", 3, 20, 20, [1, 2], 1], ["SP", 3, 23, 3, [1, 3], 1], ["SP", 3, 26, 3, [1, 3], 1], ["RE", 3, [0, 5, 10, 15, 1, 6, 11, 16, 2, 7, 12, 17, 20, 23, 26, 21, 24, 27, 3, 8, 13, 18, 22, 25, 28, 4, 9, 14, 19]], ["FSP", 7, 0, 1, 3], ["FSP", 7, 4, 2, 3], ["FSP", 7, 8, 3, 3], ["FSP", 7, 12, 4, 3], ["RE", 7, [0, 4, 8, 12, 1, 5, 9, 13, 2, 6, 10, 14, 3, 7, 11, 15]], ["CA", 3, 7, 11], ["CHR", 2, "shared", [3]], ["CA", 3, 4, 14], ["CHR", 1, "shared", [4]], ["CA", 2, 5, 14], ["CI", 1], ["FU", 9, [0, 1, 2, 3]], ["AN", 9, 0, 5], ["FU", 9, [1, 2, 3, 4]], ["AN", 9, 1, 4], ["FU", 9, [2, 3, 4, 5]], ["AN", 9, 2, 6], ["FU", 4, [0, 1, 2, 3]], ["SP", 4, 0, 180, [1], 1], ["AN", 4, 1, 2], ["FFSP", 4, 0, [4, 3, 2, 1], 1, 1], ["AN", 4, 1, 6], ["FU", 2, [0, 1, 2, 3]], ["SP", 2, 0, 108, [1], 1], ["AN", 2, 1, 2], ["FFSP", 2, 0, [4, 3, 2, 1], 1, 1], ["AN", 2, 1, 6], ["PR", 5, 0, "auto_unroll_max_step$16"]]]], "r": [[0.00207046, 0.00207286, 0.00207054, 0.00207142], 0, 4.53227, 1670121673], "v": "v0.6"}
{"i": [["[\"a7de7210b6587109a1ca064f9b471c63\", [6, 20, 32, 32], [20, 20, 3, 3], [1, 20, 1, 1], [6, 20, 32, 32], [6, 20, 32, 32]]", "cuda -keys=cuda,gpu -arch=sm_80 -max_num_threads=1024 -thread_warp_size=32", [-1, 16, 64, 49152, 2147483647, 1024, 8, 32], "", 0, []], [[], [["CI", 5], ["SP", 3, 0, 6, [2, 1, 1, 3], 1], ["SP", 3, 5, 20, [1, 4, 5, 1], 1], ["SP", 3, 10, 32, [4, 1, 2, 1], 1], ["SP", 3, 15, 32, [1, 8, 2, 1], 1], ["SP", 3, 20, 20, [1, 4], 1], ["SP", 3, 23, 3, [1, 3], 1], ["SP", 3, 26, 3, [3, 1], 1], ["RE", 3, [0, 5, 10, 15, 1, 6, 11, 16, 2, 7, 12, 17, 20, 23, 26, 21, 24, 27, 3, 8, 13, 18, 22, 25, 28, 4, 9, 14, 19]], ["FSP", 7, 0, 1, 3], ["FSP", 7, 4, 2, 3], ["FSP", 7, 8, 3, 3], ["FSP", 7, 12, 4, 3], ["RE", 7, [0, 4, 8, 12, 1, 5, 9, 13, 2, 6, 10, 14, 3, 7, 11, 15]], ["CA", 3, 7, 11], ["CHR", 2, "shared", [3]], ["CA", 3, 4, 14], ["CHR", 1, "shared", [4]], ["CA", 2, 5, 14], ["CI", 1], ["FU", 9, [0, 1, 2, 3]], ["AN", 9, 0, 5], ["FU", 9, [1, 2, 3, 4]], ["AN", 9, 1, 4], ["FU", 9, [2, 3, 4, 5]], ["AN", 9, 2, 6], ["FU", 4, [0, 1, 2, 3]], ["SP", 4, 0, 180, [1], 1], ["AN", 4, 1, 2], ["FFSP", 4, 0, [4, 3, 2, 1], 1, 1], ["AN", 4, 1, 6], ["FU", 2, [0, 1, 2, 3]], ["SP", 2, 0, 192, [1], 1], ["AN", 2, 1, 2], ["FFSP", 2, 0, [4, 3, 2, 1], 1, 1], ["AN", 2, 1, 6], ["PR", 5, 0, "auto_unroll_max_step$16"]]]], "r": [[0.00056618, 0.000566624, 0.000566509, 0.000566281], 0, 4.34468, 1670121676], "v": "v0.6"}
{"i": [["[\"a7de7210b6587109a1ca064f9b471c63\", [6, 20, 32, 32], [20, 20, 3, 3], [1, 20, 1, 1], [6, 20, 32, 32], [6, 20, 32, 32]]", "cuda -keys=cuda,gpu -arch=sm_80 -max_num_threads=1024 -thread_warp_size=32", [-1, 16, 64, 49152, 2147483647, 1024, 8, 32], "", 0, []], [[], [["CI", 5], ["SP", 3, 0, 6, [1, 6, 1, 1], 1], ["SP", 3, 5, 20, [2, 2, 5, 1], 1], ["SP", 3, 10, 32, [1, 1, 2, 16], 1], ["SP", 3, 15, 32, [2, 2, 4, 2], 1], ["SP", 3, 20, 20, [1, 1], 1], ["SP", 3, 23, 3, [3, 1], 1], ["SP", 3, 26, 3, [1, 3], 1], ["RE", 3, [0, 5, 10, 15, 1, 6, 11, 16, 2, 7, 12, 17, 20, 23, 26, 21, 24, 27, 3, 8, 13, 18, 22, 25, 28, 4, 9, 14, 19]], ["FSP", 7, 0, 1, 3], ["FSP", 7, 4, 2, 3], ["FSP", 7, 8, 3, 3], ["FSP", 7, 12, 4, 3], ["RE", 7, [0, 4, 8, 12, 1, 5, 9, 13, 2, 6, 10, 14, 3, 7, 11, 15]], ["CA", 3, 7, 11], ["CHR", 2, "shared", [3]], ["CA", 3, 4, 14], ["CHR", 1, "shared", [4]], ["CA", 2, 5, 14], ["CI", 1], ["FU", 9, [0, 1, 2, 3]], ["AN", 9, 0, 5], ["FU", 9, [1, 2, 3, 4]], ["AN", 9, 1, 4], ["FU", 9, [2, 3, 4, 5]], ["AN", 9, 2, 6], ["FU", 4, [0, 1, 2, 3]], ["SP", 4, 0, 45, [15], 1], ["AN", 4, 1, 2], ["FFSP", 4, 0, [4, 3, 2, 1], 1, 1], ["AN", 4, 1, 6], ["FU", 2, [0, 1, 2, 3]], ["SP", 2, 0, 180, [5], 1], ["AN", 2, 1, 2], ["FFSP", 2, 0, [4, 3, 2, 1], 1, 1], ["AN", 2, 1, 6], ["PR", 5, 0, "auto_unroll_max_step$1024"]]]], "r": [[0.00418024, 0.00419061, 0.00418728, 0.00417945], 0, 13.9944, 1670121678], "v": "v0.6"}
{"i": [["[\"a7de7210b6587109a1ca064f9b471c63\", [6, 20, 32, 32], [20, 20, 3, 3], [1, 20, 1, 1], [6, 20, 32, 32], [6, 20, 32, 32]]", "cuda -keys=cuda,gpu -arch=sm_80 -max_num_threads=1024 -thread_warp_size=32", [-1, 16, 64, 49152, 2147483647, 1024, 8, 32], "", 0, []], [[], [["CI", 5], ["SP", 3, 0, 6, [1, 1, 1, 3], 1], ["SP", 3, 5, 20, [1, 10, 1, 2], 1], ["SP", 3, 10, 32, [2, 1, 1, 1], 1], ["SP", 3, 15, 32, [1, 4, 1, 1], 1], ["SP", 3, 20, 20, [2, 5], 1], ["SP", 3, 23, 3, [1, 1], 1], ["SP", 3, 26, 3, [1, 3], 1], ["RE", 3, [0, 5, 10, 15, 1, 6, 11, 16, 2, 7, 12, 17, 20, 23, 26, 21, 24, 27, 3, 8, 13, 18, 22, 25, 28, 4, 9, 14, 19]], ["FSP", 7, 0, 1, 3], ["FSP", 7, 4, 2, 3], ["FSP", 7, 8, 3, 3], ["FSP", 7, 12, 4, 3], ["RE", 7, [0, 4, 8, 12, 1, 5, 9, 13, 2, 6, 10, 14, 3, 7, 11, 15]], ["CA", 3, 7, 11], ["CHR", 2, "shared", [3]], ["CA", 3, 4, 14], ["CHR", 1, "shared", [4]], ["CA", 2, 5, 14], ["CI", 1], ["FU", 9, [0, 1, 2, 3]], ["AN", 9, 0, 5], ["FU", 9, [1, 2, 3, 4]], ["AN", 9, 1, 4], ["FU", 9, [2, 3, 4, 5]], ["AN", 9, 2, 6], ["FU", 4, [0, 1, 2, 3]], ["SP", 4, 0, 60, [1], 1], ["AN", 4, 1, 2], ["FFSP", 4, 0, [4, 3, 2, 1], 1, 1], ["AN", 4, 1, 6], ["FU", 2, [0, 1, 2, 3]], ["SP", 2, 0, 90, [18], 1], ["AN", 2, 1, 2], ["FFSP", 2, 0, [4, 3, 2, 1], 1, 1], ["AN", 2, 1, 6], ["PR", 5, 0, "auto_unroll_max_step$1024"]]]], "r": [[2.09118e-05, 2.0911e-05, 2.09115e-05, 2.09107e-05], 0, 3.64832, 1670121680], "v": "v0.6"}
{"i": [["[\"a7de7210b6587109a1ca064f9b471c63\", [6, 20, 32, 32], [20, 20, 3, 3], [1, 20, 1, 1], [6, 20, 32, 32], [6, 20, 32, 32]]", "cuda -keys=cuda,gpu -arch=sm_80 -max_num_threads=1024 -thread_warp_size=32", [-1, 16, 64, 49152, 2147483647, 1024, 8, 32], "", 0, []], [[], [["CI", 5], ["SP", 3, 0, 6, [1, 3, 1, 2], 1], ["SP", 3, 5, 20, [1, 2, 10, 1], 1], ["SP", 3, 10, 32, [2, 8, 1, 1], 1], ["SP", 3, 15, 32, [1, 2, 2, 1], 1], ["SP", 3, 20, 20, [2, 5], 1], ["SP", 3, 23, 3, [1, 1], 1], ["SP", 3, 26, 3, [1, 1], 1], ["RE", 3, [0, 5, 10, 15, 1, 6, 11, 16, 2, 7, 12, 17, 20, 23, 26, 21, 24, 27, 3, 8, 13, 18, 22, 25, 28, 4, 9, 14, 19]], ["FSP", 7, 0, 1, 3], ["FSP", 7, 4, 2, 3], ["FSP", 7, 8, 3, 3], ["FSP", 7, 12, 4, 3], ["RE", 7, [0, 4, 8, 12, 1, 5, 9, 13, 2, 6, 10, 14, 3, 7, 11, 15]], ["CA", 3, 7, 11], ["CHR", 2, "shared", [3]], ["CA", 3, 4, 14], ["CHR", 1, "shared", [4]], ["CA", 2, 5, 14], ["CI", 1], ["FU", 9, [0, 1, 2, 3]], ["AN", 9, 0, 5], ["FU", 9, [1, 2, 3, 4]], ["AN", 9, 1, 4], ["FU", 9, [2, 3, 4, 5]], ["AN", 9, 2, 6], ["FU", 4, [0, 1, 2, 3]], ["SP", 4, 0, 100, [1], 1], ["AN", 4, 1, 2], ["FFSP", 4, 0, [4, 3, 2, 1], 1, 1], ["AN", 4, 1, 6], ["FU", 2, [0, 1, 2, 3]], ["SP", 2, 0, 40, [1], 1], ["AN", 2, 1, 2], ["FFSP", 2, 0, [4, 3, 2, 1], 1, 1], ["AN", 2, 1, 6], ["PR", 5, 0, "auto_unroll_max_step$0"]]]], "r": [[9.70119e-05, 9.69884e-05, 9.70075e-05, 9.69891e-05], 0, 3.80072, 1670121683], "v": "v0.6"}
{"i": [["[\"a7de7210b6587109a1ca064f9b471c63\", [6, 20, 32, 32], [20, 20, 3, 3], [1, 20, 1, 1], [6, 20, 32, 32], [6, 20, 32, 32]]", "cuda -keys=cuda,gpu -arch=sm_80 -max_num_threads=1024 -thread_warp_size=32", [-1, 16, 64, 49152, 2147483647, 1024, 8, 32], "", 0, []], [[], [["CI", 5], ["SP", 3, 0, 6, [3, 1, 2, 1], 1], ["SP", 3, 5, 20, [1, 20, 1, 1], 1], ["SP", 3, 10, 32, [1, 1, 1, 4], 1], ["SP", 3, 15, 32, [1, 8, 1, 4], 1], ["SP", 3, 20, 20, [5, 2], 1], ["SP", 3, 23, 3, [1, 1], 1], ["SP", 3, 26, 3, [1, 3], 1], ["RE", 3, [0, 5, 10, 15, 1, 6, 11, 16, 2, 7, 12, 17, 20, 23, 26, 21, 24, 27, 3, 8, 13, 18, 22, 25, 28, 4, 9, 14, 19]], ["FSP", 7, 0, 1, 3], ["FSP", 7, 4, 2, 3], ["FSP", 7, 8, 3, 3], ["FSP", 7, 12, 4, 3], ["RE", 7, [0, 4, 8, 12, 1, 5, 9, 13, 2, 6, 10, 14, 3, 7, 11, 15]], ["CA", 3, 7, 11], ["CHR", 2, "shared", [3]], ["CA", 3, 4, 14], ["CHR", 1, "shared", [4]], ["CA", 2, 5, 14], ["CI", 1], ["FU", 9, [0, 1, 2, 3]], ["AN", 9, 0, 5], ["FU", 9, [1, 2, 3, 4]], ["AN", 9, 1, 4], ["FU", 9, [2, 3, 4, 5]], ["AN", 9, 2, 6], ["FU", 4, [0, 1, 2, 3]], ["SP", 4, 0, 30, [1], 1], ["AN", 4, 1, 2], ["FFSP", 4, 0, [4, 3, 2, 1], 1, 1], ["AN", 4, 1, 6], ["FU", 2, [0, 1, 2, 3]], ["SP", 2, 0, 480, [10], 1], ["AN", 2, 1, 2], ["FFSP", 2, 0, [4, 3, 2, 1], 1, 1], ["AN", 2, 1, 6], ["PR", 5, 0, "auto_unroll_max_step$512"]]]], "r": [[9.54273e-05, 9.52899e-05, 9.54259e-05, 9.54253e-05], 0, 5.02487, 1670121686], "v": "v0.6"}
{"i": [["[\"a7de7210b6587109a1ca064f9b471c63\", [6, 20, 32, 32], [20, 20, 3, 3], [1, 20, 1, 1], [6, 20, 32, 32], [6, 20, 32, 32]]", "cuda -keys=cuda,gpu -arch=sm_80 -max_num_threads=1024 -thread_warp_size=32", [-1, 16, 64, 49152, 2147483647, 1024, 8, 32], "", 0, []], [[], [["CI", 5], ["SP", 3, 0, 6, [3, 1, 1, 1], 1], ["SP", 3, 5, 20, [1, 4, 1, 1], 1], ["SP", 3, 10, 32, [1, 2, 16, 1], 1], ["SP", 3, 15, 32, [1, 8, 1, 2], 1], ["SP", 3, 20, 20, [2, 2], 1], ["SP", 3, 23, 3, [1, 1], 1], ["SP", 3, 26, 3, [1, 3], 1], ["RE", 3, [0, 5, 10, 15, 1, 6, 11, 16, 2, 7, 12, 17, 20, 23, 26, 21, 24, 27, 3, 8, 13, 18, 22, 25, 28, 4, 9, 14, 19]], ["FSP", 7, 0, 1, 3], ["FSP", 7, 4, 2, 3], ["FSP", 7, 8, 3, 3], ["FSP", 7, 12, 4, 3], ["RE", 7, [0, 4, 8, 12, 1, 5, 9, 13, 2, 6, 10, 14, 3, 7, 11, 15]], ["CA", 3, 7, 11], ["CHR", 2, "shared", [3]], ["CA", 3, 4, 14], ["CHR", 1, "shared", [4]], ["CA", 2, 5, 14], ["CI", 1], ["FU", 9, [0, 1, 2, 3]], ["AN", 9, 0, 5], ["FU", 9, [1, 2, 3, 4]], ["AN", 9, 1, 4], ["FU", 9, [2, 3, 4, 5]], ["AN", 9, 2, 6], ["FU", 4, [0, 1, 2, 3]], ["SP", 4, 0, 12, [1], 1], ["AN", 4, 1, 2], ["FFSP", 4, 0, [4, 3, 2, 1], 1, 1], ["AN", 4, 1, 6], ["FU", 2, [0, 1, 2, 3]], ["SP", 2, 0, 256, [1], 1], ["AN", 2, 1, 2], ["FFSP", 2, 0, [4, 3, 2, 1], 1, 1], ["AN", 2, 1, 6], ["PR", 5, 0, "auto_unroll_max_step$16"]]]], "r": [[0.000597384, 0.000597052, 0.000597132, 0.000597595], 0, 3.39785, 1670121689], "v": "v0.6"}
{"i": [["[\"a7de7210b6587109a1ca064f9b471c63\", [6, 20, 32, 32], [20, 20, 3, 3], [1, 20, 1, 1], [6, 20, 32, 32], [6, 20, 32, 32]]", "cuda -keys=cuda,gpu -arch=sm_80 -max_num_threads=1024 -thread_warp_size=32", [-1, 16, 64, 49152, 2147483647, 1024, 8, 32], "", 0, []], [[], [["CI", 5], ["SP", 3, 0, 6, [2, 3, 1, 1], 1], ["SP", 3, 5, 20, [1, 5, 2, 1], 1], ["SP", 3, 10, 32, [2, 2, 2, 1], 1], ["SP", 3, 15, 32, [1, 1, 1, 1], 1], ["SP", 3, 20, 20, [2, 1], 1], ["SP", 3, 23, 3, [3, 1], 1], ["SP", 3, 26, 3, [1, 1], 1], ["RE", 3, [0, 5, 10, 15, 1, 6, 11, 16, 2, 7, 12, 17, 20, 23, 26, 21, 24, 27, 3, 8, 13, 18, 22, 25, 28, 4, 9, 14, 19]], ["FSP", 7, 0, 1, 3], ["FSP", 7, 4, 2, 3], ["FSP", 7, 8, 3, 3], ["FSP", 7, 12, 4, 3], ["RE", 7, [0, 4, 8, 12, 1, 5, 9, 13, 2, 6, 10, 14, 3, 7, 11, 15]], ["CA", 3, 7, 11], ["CHR", 2, "shared", [3]], ["CA", 3, 4, 14], ["CHR", 1, "shared", [4]], ["CA", 2, 5, 14], ["CI", 1], ["FU", 9, [0, 1, 2, 3]], ["AN", 9, 0, 5], ["FU", 9, [1, 2, 3, 4]], ["AN", 9, 1, 4], ["FU", 9, [2, 3, 4, 5]], ["AN", 9, 2, 6], ["FU", 4, [0, 1, 2, 3]], ["SP", 4, 0, 12, [1], 1], ["AN", 4, 1, 2], ["FFSP", 4, 0, [4, 3, 2, 1], 1, 1], ["AN", 4, 1, 6], ["FU", 2, [0, 1, 2, 3]], ["SP", 2, 0, 8, [1], 1], ["AN", 2, 1, 2], ["FFSP", 2, 0, [4, 3, 2, 1], 1, 1], ["AN", 2, 1, 6], ["PR", 5, 0, "auto_unroll_max_step$1024"]]]], "r": [[2.20712e-05, 2.20678e-05, 2.2068e-05, 2.2068e-05], 0, 3.35463, 1670121691], "v": "v0.6"}
{"i": [["[\"a7de7210b6587109a1ca064f9b471c63\", [6, 20, 32, 32], [20, 20, 3, 3], [1, 20, 1, 1], [6, 20, 32, 32], [6, 20, 32, 32]]", "cuda -keys=cuda,gpu -arch=sm_80 -max_num_threads=1024 -thread_warp_size=32", [-1, 16, 64, 49152, 2147483647, 1024, 8, 32], "", 0, []], [[], [["CI", 5], ["SP", 3, 0, 6, [1, 1, 2, 1], 1], ["SP", 3, 5, 20, [1, 4, 5, 1], 1], ["SP", 3, 10, 32, [1, 4, 1, 1], 1], ["SP", 3, 15, 32, [1, 1, 1, 8], 1], ["SP", 3, 20, 20, [4, 1], 1], ["SP", 3, 23, 3, [1, 1], 1], ["SP", 3, 26, 3, [1, 1], 1], ["RE", 3, [0, 5, 10, 15, 1, 6, 11, 16, 2, 7, 12, 17, 20, 23, 26, 21, 24, 27, 3, 8, 13, 18, 22, 25, 28, 4, 9, 14, 19]], ["FSP", 7, 0, 1, 3], ["FSP", 7, 4, 2, 3], ["FSP", 7, 8, 3, 3], ["FSP", 7, 12, 4, 3], ["RE", 7, [0, 4, 8, 12, 1, 5, 9, 13, 2, 6, 10, 14, 3, 7, 11, 15]], ["CA", 3, 7, 11], ["CHR", 2, "shared", [3]], ["CA", 3, 4, 14], ["CHR", 1, "shared", [4]], ["CA", 2, 5, 14], ["CI", 1], ["FU", 9, [0, 1, 2, 3]], ["AN", 9, 0, 5], ["FU", 9, [1, 2, 3, 4]], ["AN", 9, 1, 4], ["FU", 9, [2, 3, 4, 5]], ["AN", 9, 2, 6], ["FU", 4, [0, 1, 2, 3]], ["SP", 4, 0, 20, [1], 1], ["AN", 4, 1, 2], ["FFSP", 4, 0, [4, 3, 2, 1], 1, 1], ["AN", 4, 1, 6], ["FU", 2, [0, 1, 2, 3]], ["SP", 2, 0, 64, [1], 1], ["AN", 2, 1, 2], ["FFSP", 2, 0, [4, 3, 2, 1], 1, 1], ["AN", 2, 1, 6], ["PR", 5, 0, "auto_unroll_max_step$0"]]]], "r": [[4.94395e-05, 4.95182e-05, 4.94443e-05, 4.94839e-05], 0, 3.19433, 1670121694], "v": "v0.6"}
{"i": [["[\"a7de7210b6587109a1ca064f9b471c63\", [6, 20, 32, 32], [20, 20, 3, 3], [1, 20, 1, 1], [6, 20, 32, 32], [6, 20, 32, 32]]", "cuda -keys=cuda,gpu -arch=sm_80 -max_num_threads=1024 -thread_warp_size=32", [-1, 16, 64, 49152, 2147483647, 1024, 8, 32], "", 0, []], [[], [["CI", 5], ["SP", 3, 0, 6, [1, 3, 1, 2], 1], ["SP", 3, 5, 20, [1, 2, 10, 1], 1], ["SP", 3, 10, 32, [4, 4, 1, 1], 1], ["SP", 3, 15, 32, [1, 2, 2, 1], 1], ["SP", 3, 20, 20, [2, 5], 1], ["SP", 3, 23, 3, [3, 1], 1], ["SP", 3, 26, 3, [1, 1], 1], ["RE", 3, [0, 5, 10, 15, 1, 6, 11, 16, 2, 7, 12, 17, 20, 23, 26, 21, 24, 27, 3, 8, 13, 18, 22, 25, 28, 4, 9, 14, 19]], ["FSP", 7, 0, 1, 3], ["FSP", 7, 4, 2, 3], ["FSP", 7, 8, 3, 3], ["FSP", 7, 12, 4, 3], ["RE", 7, [0, 4, 8, 12, 1, 5, 9, 13, 2, 6, 10, 14, 3, 7, 11, 15]], ["CA", 3, 7, 11], ["CHR", 2, "shared", [3]], ["CA", 3, 4, 14], ["CHR", 1, "shared", [4]], ["CA", 2, 5, 14], ["CI", 1], ["FU", 9, [0, 1, 2, 3]], ["AN", 9, 0, 5], ["FU", 9, [1, 2, 3, 4]], ["AN", 9, 1, 4], ["FU", 9, [2, 3, 4, 5]], ["AN", 9, 2, 6], ["FU", 4, [0, 1, 2, 3]], ["SP", 4, 0, 100, [1], 1], ["AN", 4, 1, 2], ["FFSP", 4, 0, [4, 3, 2, 1], 1, 1], ["AN", 4, 1, 6], ["FU", 2, [0, 1, 2, 3]], ["SP", 2, 0, 40, [1], 1], ["AN", 2, 1, 2], ["FFSP", 2, 0, [4, 3, 2, 1], 1, 1], ["AN", 2, 1, 6], ["PR", 5, 0, "auto_unroll_max_step$64"]]]], "r": [[0.000228874, 0.000228874, 0.000228773, 0.000228751], 0, 4.23541, 1670121697], "v": "v0.6"}
{"i": [["[\"a7de7210b6587109a1ca064f9b471c63\", [6, 20, 32, 32], [20, 20, 3, 3], [1, 20, 1, 1], [6, 20, 32, 32], [6, 20, 32, 32]]", "cuda -keys=cuda,gpu -arch=sm_80 -max_num_threads=1024 -thread_warp_size=32", [-1, 16, 64, 49152, 2147483647, 1024, 8, 32], "", 0, []], [[], [["CI", 5], ["SP", 3, 0, 6, [1, 1, 3, 1], 1], ["SP", 3, 5, 20, [1, 10, 1, 2], 1], ["SP", 3, 10, 32, [2, 1, 1, 1], 1], ["SP", 3, 15, 32, [1, 4, 1, 1], 1], ["SP", 3, 20, 20, [2, 5], 1], ["SP", 3, 23, 3, [1, 1], 1], ["SP", 3, 26, 3, [1, 1], 1], ["RE", 3, [0, 5, 10, 15, 1, 6, 11, 16, 2, 7, 12, 17, 20, 23, 26, 21, 24, 27, 3, 8, 13, 18, 22, 25, 28, 4, 9, 14, 19]], ["FSP", 7, 0, 1, 3], ["FSP", 7, 4, 2, 3], ["FSP", 7, 8, 3, 3], ["FSP", 7, 12, 4, 3], ["RE", 7, [0, 4, 8, 12, 1, 5, 9, 13, 2, 6, 10, 14, 3, 7, 11, 15]], ["CA", 3, 7, 11], ["CHR", 2, "shared", [3]], ["CA", 3, 4, 14], ["CHR", 1, "shared", [4]], ["CA", 2, 5, 14], ["CI", 1], ["FU", 9, [0, 1, 2, 3]], ["AN", 9, 0, 5], ["FU", 9, [1, 2, 3, 4]], ["AN", 9, 1, 4], ["FU", 9, [2, 3, 4, 5]], ["AN", 9, 2, 6], ["FU", 4, [0, 1, 2, 3]], ["SP", 4, 0, 60, [1], 1], ["AN", 4, 1, 2], ["FFSP", 4, 0, [4, 3, 2, 1], 1, 1], ["AN", 4, 1, 6], ["FU", 2, [0, 1, 2, 3]], ["SP", 2, 0, 90, [1], 1], ["AN", 2, 1, 2], ["FFSP", 2, 0, [4, 3, 2, 1], 1, 1], ["AN", 2, 1, 6], ["PR", 5, 0, "auto_unroll_max_step$64"]]]], "r": [[2.08567e-05, 2.08587e-05, 2.08572e-05, 2.086e-05], 0, 3.49861, 1670121700], "v": "v0.6"}
{"i": [["[\"a7de7210b6587109a1ca064f9b471c63\", [6, 20, 32, 32], [20, 20, 3, 3], [1, 20, 1, 1], [6, 20, 32, 32], [6, 20, 32, 32]]", "cuda -keys=cuda,gpu -arch=sm_80 -max_num_threads=1024 -thread_warp_size=32", [-1, 16, 64, 49152, 2147483647, 1024, 8, 32], "", 0, []], [[], [["CI", 5], ["SP", 3, 0, 6, [1, 3, 1, 1], 1], ["SP", 3, 5, 20, [5, 1, 1, 4], 1], ["SP", 3, 10, 32, [1, 8, 2, 2], 1], ["SP", 3, 15, 32, [1, 8, 2, 2], 1], ["SP", 3, 20, 20, [2, 1], 1], ["SP", 3, 23, 3, [3, 1], 1], ["SP", 3, 26, 3, [3, 1], 1], ["RE", 3, [0, 5, 10, 15, 1, 6, 11, 16, 2, 7, 12, 17, 20, 23, 26, 21, 24, 27, 3, 8, 13, 18, 22, 25, 28, 4, 9, 14, 19]], ["FSP", 7, 0, 1, 3], ["FSP", 7, 4, 2, 3], ["FSP", 7, 8, 3, 3], ["FSP", 7, 12, 4, 3], ["RE", 7, [0, 4, 8, 12, 1, 5, 9, 13, 2, 6, 10, 14, 3, 7, 11, 15]], ["CA", 3, 7, 11], ["CHR", 2, "shared", [3]], ["CA", 3, 4, 14], ["CHR", 1, "shared", [4]], ["CA", 2, 5, 14], ["CI", 1], ["FU", 9, [0, 1, 2, 3]], ["AN", 9, 0, 5], ["FU", 9, [1, 2, 3, 4]], ["AN", 9, 1, 4], ["FU", 9, [2, 3, 4, 5]], ["AN", 9, 2, 6], ["FU", 4, [0, 1, 2, 3]], ["SP", 4, 0, 72, [1], 1], ["AN", 4, 1, 2], ["FFSP", 4, 0, [4, 3, 2, 1], 1, 1], ["AN", 4, 1, 6], ["FU", 2, [0, 1, 2, 3]], ["SP", 2, 0, 72, [4], 1], ["AN", 2, 1, 2], ["FFSP", 2, 0, [4, 3, 2, 1], 1, 1], ["AN", 2, 1, 6], ["PR", 5, 0, "auto_unroll_max_step$1024"]]]], "r": [[0.00100236, 0.00100301, 0.0010045, 0.0010017], 0, 7.45191, 1670121703], "v": "v0.6"}
{"i": [["[\"a7de7210b6587109a1ca064f9b471c63\", [6, 20, 32, 32], [20, 20, 3, 3], [1, 20, 1, 1], [6, 20, 32, 32], [6, 20, 32, 32]]", "cuda -keys=cuda,gpu -arch=sm_80 -max_num_threads=1024 -thread_warp_size=32", [-1, 16, 64, 49152, 2147483647, 1024, 8, 32], "", 0, []], [[], [["CI", 5], ["SP", 3, 0, 6, [1, 3, 1, 1], 1], ["SP", 3, 5, 20, [1, 10, 2, 1], 1], ["SP", 3, 10, 32, [1, 8, 2, 2], 1], ["SP", 3, 15, 32, [4, 1, 1, 1], 1], ["SP", 3, 20, 20, [1, 2], 1], ["SP", 3, 23, 3, [1, 3], 1], ["SP", 3, 26, 3, [3, 1], 1], ["RE", 3, [0, 5, 10, 15, 1, 6, 11, 16, 2, 7, 12, 17, 20, 23, 26, 21, 24, 27, 3, 8, 13, 18, 22, 25, 28, 4, 9, 14, 19]], ["FSP", 7, 0, 1, 3], ["FSP", 7, 4, 2, 3], ["FSP", 7, 8, 3, 3], ["FSP", 7, 12, 4, 3], ["RE", 7, [0, 4, 8, 12, 1, 5, 9, 13, 2, 6, 10, 14, 3, 7, 11, 15]], ["CA", 3, 7, 11], ["CHR", 2, "shared", [3]], ["CA", 3, 4, 14], ["CHR", 1, "shared", [4]], ["CA", 2, 5, 14], ["CI", 1], ["FU", 9, [0, 1, 2, 3]], ["AN", 9, 0, 5], ["FU", 9, [1, 2, 3, 4]], ["AN", 9, 1, 4], ["FU", 9, [2, 3, 4, 5]], ["AN", 9, 2, 6], ["FU", 4, [0, 1, 2, 3]], ["SP", 4, 0, 6, [1], 1], ["AN", 4, 1, 2], ["FFSP", 4, 0, [4, 3, 2, 1], 1, 1], ["AN", 4, 1, 6], ["FU", 2, [0, 1, 2, 3]], ["SP", 2, 0, 32, [1], 1], ["AN", 2, 1, 2], ["FFSP", 2, 0, [4, 3, 2, 1], 1, 1], ["AN", 2, 1, 6], ["PR", 5, 0, "auto_unroll_max_step$512"]]]], "r": [[5.04759e-05, 5.04091e-05, 5.04658e-05, 5.05326e-05], 0, 3.44663, 1670121706], "v": "v0.6"}
{"i": [["[\"a7de7210b6587109a1ca064f9b471c63\", [6, 20, 32, 32], [20, 20, 3, 3], [1, 20, 1, 1], [6, 20, 32, 32], [6, 20, 32, 32]]", "cuda -keys=cuda,gpu -arch=sm_80 -max_num_threads=1024 -thread_warp_size=32", [-1, 16, 64, 49152, 2147483647, 1024, 8, 32], "", 0, []], [[], [["CI", 5], ["SP", 3, 0, 6, [1, 3, 2, 1], 1], ["SP", 3, 5, 20, [1, 10, 2, 1], 1], ["SP", 3, 10, 32, [2, 4, 1, 1], 1], ["SP", 3, 15, 32, [1, 2, 4, 1], 1], ["SP", 3, 20, 20, [2, 1], 1], ["SP", 3, 23, 3, [3, 1], 1], ["SP", 3, 26, 3, [1, 3], 1], ["RE", 3, [0, 5, 10, 15, 1, 6, 11, 16, 2, 7, 12, 17, 20, 23, 26, 21, 24, 27, 3, 8, 13, 18, 22, 25, 28, 4, 9, 14, 19]], ["FSP", 7, 0, 1, 3], ["FSP", 7, 4, 2, 3], ["FSP", 7, 8, 3, 3], ["FSP", 7, 12, 4, 3], ["RE", 7, [0, 4, 8, 12, 1, 5, 9, 13, 2, 6, 10, 14, 3, 7, 11, 15]], ["CA", 3, 7, 11], ["CHR", 2, "shared", [3]], ["CA", 3, 4, 14], ["CHR", 1, "shared", [4]], ["CA", 2, 5, 14], ["CI", 1], ["FU", 9, [0, 1, 2, 3]], ["AN", 9, 0, 5], ["FU", 9, [1, 2, 3, 4]], ["AN", 9, 1, 4], ["FU", 9, [2, 3, 4, 5]], ["AN", 9, 2, 6], ["FU", 4, [0, 1, 2, 3]], ["SP", 4, 0, 36, [1], 1], ["AN", 4, 1, 2], ["FFSP", 4, 0, [4, 3, 2, 1], 1, 1], ["AN", 4, 1, 6], ["FU", 2, [0, 1, 2, 3]], ["SP", 2, 0, 72, [4], 1], ["AN", 2, 1, 2], ["FFSP", 2, 0, [4, 3, 2, 1], 1, 1], ["AN", 2, 1, 6], ["PR", 5, 0, "auto_unroll_max_step$16"]]]], "r": [[3.90957e-05, 3.90715e-05, 3.90493e-05, 3.90342e-05], 0, 3.23807, 1670121709], "v": "v0.6"}
{"i": [["[\"a7de7210b6587109a1ca064f9b471c63\", [6, 20, 32, 32], [20, 20, 3, 3], [1, 20, 1, 1], [6, 20, 32, 32], [6, 20, 32, 32]]", "cuda -keys=cuda,gpu -arch=sm_80 -max_num_threads=1024 -thread_warp_size=32", [-1, 16, 64, 49152, 2147483647, 1024, 8, 32], "", 0, []], [[], [["CI", 5], ["SP", 3, 0, 6, [2, 1, 1, 1], 1], ["SP", 3, 5, 20, [1, 5, 2, 2], 1], ["SP", 3, 10, 32, [4, 1, 8, 1], 1], ["SP", 3, 15, 32, [1, 8, 1, 1], 1], ["SP", 3, 20, 20, [10, 1], 1], ["SP", 3, 23, 3, [3, 1], 1], ["SP", 3, 26, 3, [3, 1], 1], ["RE", 3, [0, 5, 10, 15, 1, 6, 11, 16, 2, 7, 12, 17, 20, 23, 26, 21, 24, 27, 3, 8, 13, 18, 22, 25, 28, 4, 9, 14, 19]], ["FSP", 7, 0, 1, 3], ["FSP", 7, 4, 2, 3], ["FSP", 7, 8, 3, 3], ["FSP", 7, 12, 4, 3], ["RE", 7, [0, 4, 8, 12, 1, 5, 9, 13, 2, 6, 10, 14, 3, 7, 11, 15]], ["CA", 3, 7, 11], ["CHR", 2, "shared", [3]], ["CA", 3, 4, 14], ["CHR", 1, "shared", [4]], ["CA", 2, 5, 14], ["CI", 1], ["FU", 9, [0, 1, 2, 3]], ["AN", 9, 0, 5], ["FU", 9, [1, 2, 3, 4]], ["AN", 9, 1, 4], ["FU", 9, [2, 3, 4, 5]], ["AN", 9, 2, 6], ["FU", 4, [0, 1, 2, 3]], ["SP", 4, 0, 180, [1], 1], ["AN", 4, 1, 2], ["FFSP", 4, 0, [4, 3, 2, 1], 1, 1], ["AN", 4, 1, 6], ["FU", 2, [0, 1, 2, 3]], ["SP", 2, 0, 300, [25], 1], ["AN", 2, 1, 2], ["FFSP", 2, 0, [4, 3, 2, 1], 1, 1], ["AN", 2, 1, 6], ["PR", 5, 0, "auto_unroll_max_step$0"]]]], "r": [[0.000399025, 0.0003998, 0.000399542, 0.000399486], 0, 3.99055, 1670121711], "v": "v0.6"}
{"i": [["[\"a7de7210b6587109a1ca064f9b471c63\", [6, 20, 32, 32], [20, 20, 3, 3], [1, 20, 1, 1], [6, 20, 32, 32], [6, 20, 32, 32]]", "cuda -keys=cuda,gpu -arch=sm_80 -max_num_threads=1024 -thread_warp_size=32", [-1, 16, 64, 49152, 2147483647, 1024, 8, 32], "", 0, []], [[], [["CI", 5], ["SP", 3, 0, 6, [1, 1, 1, 2], 1], ["SP", 3, 5, 20, [1, 10, 2, 1], 1], ["SP", 3, 10, 32, [2, 2, 1, 4], 1], ["SP", 3, 15, 32, [1, 1, 2, 8], 1], ["SP", 3, 20, 20, [10, 1], 1], ["SP", 3, 23, 3, [3, 1], 1], ["SP", 3, 26, 3, [3, 1], 1], ["RE", 3, [0, 5, 10, 15, 1, 6, 11, 16, 2, 7, 12, 17, 20, 23, 26, 21, 24, 27, 3, 8, 13, 18, 22, 25, 28, 4, 9, 14, 19]], ["FSP", 7, 0, 1, 3], ["FSP", 7, 4, 2, 3], ["FSP", 7, 8, 3, 3], ["FSP", 7, 12, 4, 3], ["RE", 7, [0, 4, 8, 12, 1, 5, 9, 13, 2, 6, 10, 14, 3, 7, 11, 15]], ["CA", 3, 7, 11], ["CHR", 2, "shared", [3]], ["CA", 3, 4, 14], ["CHR", 1, "shared", [4]], ["CA", 2, 5, 14], ["CI", 1], ["FU", 9, [0, 1, 2, 3]], ["AN", 9, 0, 5], ["FU", 9, [1, 2, 3, 4]], ["AN", 9, 1, 4], ["FU", 9, [2, 3, 4, 5]], ["AN", 9, 2, 6], ["FU", 4, [0, 1, 2, 3]], ["SP", 4, 0, 180, [1], 1], ["AN", 4, 1, 2], ["FFSP", 4, 0, [4, 3, 2, 1], 1, 1], ["AN", 4, 1, 6], ["FU", 2, [0, 1, 2, 3]], ["SP", 2, 0, 1200, [1], 1], ["AN", 2, 1, 2], ["FFSP", 2, 0, [4, 3, 2, 1], 1, 1], ["AN", 2, 1, 6], ["PR", 5, 0, "auto_unroll_max_step$16"]]]], "r": [[0.00195135, 0.00195048, 0.00195055, 0.0019512], 0, 4.50294, 1670121714], "v": "v0.6"}
{"i": [["[\"a7de7210b6587109a1ca064f9b471c63\", [6, 20, 32, 32], [20, 20, 3, 3], [1, 20, 1, 1], [6, 20, 32, 32], [6, 20, 32, 32]]", "cuda -keys=cuda,gpu -arch=sm_80 -max_num_threads=1024 -thread_warp_size=32", [-1, 16, 64, 49152, 2147483647, 1024, 8, 32], "", 0, []], [[], [["CI", 5], ["SP", 3, 0, 6, [1, 1, 1, 2], 1], ["SP", 3, 5, 20, [1, 2, 1, 5], 1], ["SP", 3, 10, 32, [1, 16, 2, 1], 1], ["SP", 3, 15, 32, [4, 1, 2, 4], 1], ["SP", 3, 20, 20, [1, 4], 1], ["SP", 3, 23, 3, [1, 3], 1], ["SP", 3, 26, 3, [1, 1], 1], ["RE", 3, [0, 5, 10, 15, 1, 6, 11, 16, 2, 7, 12, 17, 20, 23, 26, 21, 24, 27, 3, 8, 13, 18, 22, 25, 28, 4, 9, 14, 19]], ["FSP", 7, 0, 1, 3], ["FSP", 7, 4, 2, 3], ["FSP", 7, 8, 3, 3], ["FSP", 7, 12, 4, 3], ["RE", 7, [0, 4, 8, 12, 1, 5, 9, 13, 2, 6, 10, 14, 3, 7, 11, 15]], ["CA", 3, 7, 11], ["CHR", 2, "shared", [3]], ["CA", 3, 4, 14], ["CHR", 1, "shared", [4]], ["CA", 2, 5, 14], ["CI", 1], ["FU", 9, [0, 1, 2, 3]], ["AN", 9, 0, 5], ["FU", 9, [1, 2, 3, 4]], ["AN", 9, 1, 4], ["FU", 9, [2, 3, 4, 5]], ["AN", 9, 2, 6], ["FU", 4, [0, 1, 2, 3]], ["SP", 4, 0, 60, [1], 1], ["AN", 4, 1, 2], ["FFSP", 4, 0, [4, 3, 2, 1], 1, 1], ["AN", 4, 1, 6], ["FU", 2, [0, 1, 2, 3]], ["SP", 2, 0, 256, [1], 1], ["AN", 2, 1, 2], ["FFSP", 2, 0, [4, 3, 2, 1], 1, 1], ["AN", 2, 1, 6], ["PR", 5, 0, "auto_unroll_max_step$16"]]]], "r": [[0.000675959, 0.000675977, 0.000676117, 0.000676951], 0, 4.10175, 1670121716], "v": "v0.6"}
{"i": [["[\"a7de7210b6587109a1ca064f9b471c63\", [6, 20, 32, 32], [20, 20, 3, 3], [1, 20, 1, 1], [6, 20, 32, 32], [6, 20, 32, 32]]", "cuda -keys=cuda,gpu -arch=sm_80 -max_num_threads=1024 -thread_warp_size=32", [-1, 16, 64, 49152, 2147483647, 1024, 8, 32], "", 0, []], [[], [["CI", 5], ["SP", 3, 0, 6, [1, 1, 1, 1], 1], ["SP", 3, 5, 20, [1, 10, 1, 2], 1], ["SP", 3, 10, 32, [1, 1, 4, 8], 1], ["SP", 3, 15, 32, [1, 16, 1, 1], 1], ["SP", 3, 20, 20, [1, 1], 1], ["SP", 3, 23, 3, [1, 3], 1], ["SP", 3, 26, 3, [3, 1], 1], ["RE", 3, [0, 5, 10, 15, 1, 6, 11, 16, 2, 7, 12, 17, 20, 23, 26, 21, 24, 27, 3, 8, 13, 18, 22, 25, 28, 4, 9, 14, 19]], ["FSP", 7, 0, 1, 3], ["FSP", 7, 4, 2, 3], ["FSP", 7, 8, 3, 3], ["FSP", 7, 12, 4, 3], ["RE", 7, [0, 4, 8, 12, 1, 5, 9, 13, 2, 6, 10, 14, 3, 7, 11, 15]], ["CA", 3, 7, 11], ["CHR", 2, "shared", [3]], ["CA", 3, 4, 14], ["CHR", 1, "shared", [4]], ["CA", 2, 5, 14], ["CI", 1], ["FU", 9, [0, 1, 2, 3]], ["AN", 9, 0, 5], ["FU", 9, [1, 2, 3, 4]], ["AN", 9, 1, 4], ["FU", 9, [2, 3, 4, 5]], ["AN", 9, 2, 6], ["FU", 4, [0, 1, 2, 3]], ["SP", 4, 0, 18, [1], 1], ["AN", 4, 1, 2], ["FFSP", 4, 0, [4, 3, 2, 1], 1, 1], ["AN", 4, 1, 6], ["FU", 2, [0, 1, 2, 3]], ["SP", 2, 0, 136, [2], 1], ["AN", 2, 1, 2], ["FFSP", 2, 0, [4, 3, 2, 1], 1, 1], ["AN", 2, 1, 6], ["PR", 5, 0, "auto_unroll_max_step$512"]]]], "r": [[5.08597e-05, 5.07758e-05, 5.07896e-05, 5.07985e-05], 0, 3.28802, 1670121719], "v": "v0.6"}
{"i": [["[\"a7de7210b6587109a1ca064f9b471c63\", [6, 20, 32, 32], [20, 20, 3, 3], [1, 20, 1, 1], [6, 20, 32, 32], [6, 20, 32, 32]]", "cuda -keys=cuda,gpu -arch=sm_80 -max_num_threads=1024 -thread_warp_size=32", [-1, 16, 64, 49152, 2147483647, 1024, 8, 32], "", 0, []], [[], [["CI", 5], ["SP", 3, 0, 6, [1, 3, 1, 1], 1], ["SP", 3, 5, 20, [2, 10, 1, 1], 1], ["SP", 3, 10, 32, [1, 8, 2, 2], 1], ["SP", 3, 15, 32, [2, 1, 2, 1], 1], ["SP", 3, 20, 20, [1, 1], 1], ["SP", 3, 23, 3, [1, 3], 1], ["SP", 3, 26, 3, [3, 1], 1], ["RE", 3, [0, 5, 10, 15, 1, 6, 11, 16, 2, 7, 12, 17, 20, 23, 26, 21, 24, 27, 3, 8, 13, 18, 22, 25, 28, 4, 9, 14, 19]], ["FSP", 7, 0, 1, 3], ["FSP", 7, 4, 2, 3], ["FSP", 7, 8, 3, 3], ["FSP", 7, 12, 4, 3], ["RE", 7, [0, 4, 8, 12, 1, 5, 9, 13, 2, 6, 10, 14, 3, 7, 11, 15]], ["CA", 3, 7, 11], ["CHR", 2, "shared", [3]], ["CA", 3, 4, 14], ["CHR", 1, "shared", [4]], ["CA", 2, 5, 14], ["CI", 1], ["FU", 9, [0, 1, 2, 3]], ["AN", 9, 0, 5], ["FU", 9, [1, 2, 3, 4]], ["AN", 9, 1, 4], ["FU", 9, [2, 3, 4, 5]], ["AN", 9, 2, 6], ["FU", 4, [0, 1, 2, 3]], ["SP", 4, 0, 6, [1], 1], ["AN", 4, 1, 2], ["FFSP", 4, 0, [4, 3, 2, 1], 1, 1], ["AN", 4, 1, 6], ["FU", 2, [0, 1, 2, 3]], ["SP", 2, 0, 32, [1], 1], ["AN", 2, 1, 2], ["FFSP", 2, 0, [4, 3, 2, 1], 1, 1], ["AN", 2, 1, 6], ["PR", 5, 0, "auto_unroll_max_step$512"]]]], "r": [[5.36972e-05, 5.38352e-05, 5.38373e-05, 5.36894e-05], 0, 3.41168, 1670121722], "v": "v0.6"}
{"i": [["[\"a7de7210b6587109a1ca064f9b471c63\", [6, 20, 32, 32], [20, 20, 3, 3], [1, 20, 1, 1], [6, 20, 32, 32], [6, 20, 32, 32]]", "cuda -keys=cuda,gpu -arch=sm_80 -max_num_threads=1024 -thread_warp_size=32", [-1, 16, 64, 49152, 2147483647, 1024, 8, 32], "", 0, []], [[], [["CI", 5], ["SP", 3, 0, 6, [1, 3, 2, 1], 1], ["SP", 3, 5, 20, [1, 2, 5, 2], 1], ["SP", 3, 10, 32, [1, 16, 1, 1], 1], ["SP", 3, 15, 32, [1, 4, 1, 4], 1], ["SP", 3, 20, 20, [5, 1], 1], ["SP", 3, 23, 3, [3, 1], 1], ["SP", 3, 26, 3, [1, 1], 1], ["RE", 3, [0, 5, 10, 15, 1, 6, 11, 16, 2, 7, 12, 17, 20, 23, 26, 21, 24, 27, 3, 8, 13, 18, 22, 25, 28, 4, 9, 14, 19]], ["FSP", 7, 0, 1, 3], ["FSP", 7, 4, 2, 3], ["FSP", 7, 8, 3, 3], ["FSP", 7, 12, 4, 3], ["RE", 7, [0, 4, 8, 12, 1, 5, 9, 13, 2, 6, 10, 14, 3, 7, 11, 15]], ["CA", 3, 7, 11], ["CHR", 2, "shared", [3]], ["CA", 3, 4, 14], ["CHR", 1, "shared", [4]], ["CA", 2, 5, 14], ["CI", 1], ["FU", 9, [0, 1, 2, 3]], ["AN", 9, 0, 5], ["FU", 9, [1, 2, 3, 4]], ["AN", 9, 1, 4], ["FU", 9, [2, 3, 4, 5]], ["AN", 9, 2, 6], ["FU", 4, [0, 1, 2, 3]], ["SP", 4, 0, 450, [1], 1], ["AN", 4, 1, 2], ["FFSP", 4, 0, [4, 3, 2, 1], 1, 1], ["AN", 4, 1, 6], ["FU", 2, [0, 1, 2, 3]], ["SP", 2, 0, 180, [15], 1], ["AN", 2, 1, 2], ["FFSP", 2, 0, [4, 3, 2, 1], 1, 1], ["AN", 2, 1, 6], ["PR", 5, 0, "auto_unroll_max_step$0"]]]], "r": [[0.000184905, 0.000184818, 0.000184826, 0.000184669], 0, 3.25627, 1670121725], "v": "v0.6"}
{"i": [["[\"a7de7210b6587109a1ca064f9b471c63\", [6, 20, 32, 32], [20, 20, 3, 3], [1, 20, 1, 1], [6, 20, 32, 32], [6, 20, 32, 32]]", "cuda -keys=cuda,gpu -arch=sm_80 -max_num_threads=1024 -thread_warp_size=32", [-1, 16, 64, 49152, 2147483647, 1024, 8, 32], "", 0, []], [[], [["CI", 5], ["SP", 3, 0, 6, [2, 1, 1, 1], 1], ["SP", 3, 5, 20, [1, 10, 2, 1], 1], ["SP", 3, 10, 32, [2, 4, 2, 2], 1], ["SP", 3, 15, 32, [2, 1, 2, 2], 1], ["SP", 3, 20, 20, [10, 2], 1], ["SP", 3, 23, 3, [1, 1], 1], ["SP", 3, 26, 3, [1, 1], 1], ["RE", 3, [0, 5, 10, 15, 1, 6, 11, 16, 2, 7, 12, 17, 20, 23, 26, 21, 24, 27, 3, 8, 13, 18, 22, 25, 28, 4, 9, 14, 19]], ["FSP", 7, 0, 1, 3], ["FSP", 7, 4, 2, 3], ["FSP", 7, 8, 3, 3], ["FSP", 7, 12, 4, 3], ["RE", 7, [0, 4, 8, 12, 1, 5, 9, 13, 2, 6, 10, 14, 3, 7, 11, 15]], ["CA", 3, 7, 11], ["CHR", 2, "shared", [3]], ["CA", 3, 4, 14], ["CHR", 1, "shared", [4]], ["CA", 2, 5, 14], ["CI", 1], ["FU", 9, [0, 1, 2, 3]], ["AN", 9, 0, 5], ["FU", 9, [1, 2, 3, 4]], ["AN", 9, 1, 4], ["FU", 9, [2, 3, 4, 5]], ["AN", 9, 2, 6], ["FU", 4, [0, 1, 2, 3]], ["SP", 4, 0, 20, [1], 1], ["AN", 4, 1, 2], ["FFSP", 4, 0, [4, 3, 2, 1], 1, 1], ["AN", 4, 1, 6], ["FU", 2, [0, 1, 2, 3]], ["SP", 2, 0, 160, [1], 1], ["AN", 2, 1, 2], ["FFSP", 2, 0, [4, 3, 2, 1], 1, 1], ["AN", 2, 1, 6], ["PR", 5, 0, "auto_unroll_max_step$512"]]]], "r": [[0.000411853, 0.000411465, 0.000411475, 0.00041144], 0, 6.6108, 1670121727], "v": "v0.6"}
{"i": [["[\"a7de7210b6587109a1ca064f9b471c63\", [6, 20, 32, 32], [20, 20, 3, 3], [1, 20, 1, 1], [6, 20, 32, 32], [6, 20, 32, 32]]", "cuda -keys=cuda,gpu -arch=sm_80 -max_num_threads=1024 -thread_warp_size=32", [-1, 16, 64, 49152, 2147483647, 1024, 8, 32], "", 0, []], [[], [["CI", 5], ["SP", 3, 0, 6, [2, 1, 1, 1], 1], ["SP", 3, 5, 20, [1, 1, 10, 2], 1], ["SP", 3, 10, 32, [2, 8, 1, 2], 1], ["SP", 3, 15, 32, [2, 4, 1, 1], 1], ["SP", 3, 20, 20, [4, 5], 1], ["SP", 3, 23, 3, [3, 1], 1], ["SP", 3, 26, 3, [1, 1], 1], ["RE", 3, [0, 5, 10, 15, 1, 6, 11, 16, 2, 7, 12, 17, 20, 23, 26, 21, 24, 27, 3, 8, 13, 18, 22, 25, 28, 4, 9, 14, 19]], ["FSP", 7, 0, 1, 3], ["FSP", 7, 4, 2, 3], ["FSP", 7, 8, 3, 3], ["FSP", 7, 12, 4, 3], ["RE", 7, [0, 4, 8, 12, 1, 5, 9, 13, 2, 6, 10, 14, 3, 7, 11, 15]], ["CA", 3, 7, 11], ["CHR", 2, "shared", [3]], ["CA", 3, 4, 14], ["CHR", 1, "shared", [4]], ["CA", 2, 5, 14], ["CI", 1], ["FU", 9, [0, 1, 2, 3]], ["AN", 9, 0, 5], ["FU", 9, [1, 2, 3, 4]], ["AN", 9, 1, 4], ["FU", 9, [2, 3, 4, 5]], ["AN", 9, 2, 6], ["FU", 4, [0, 1, 2, 3]], ["SP", 4, 0, 1200, [4], 1], ["AN", 4, 1, 2], ["FFSP", 4, 0, [4, 3, 2, 1], 1, 1], ["AN", 4, 1, 6], ["FU", 2, [0, 1, 2, 3]], ["SP", 2, 0, 80, [2], 1], ["AN", 2, 1, 2], ["FFSP", 2, 0, [4, 3, 2, 1], 1, 1], ["AN", 2, 1, 6], ["PR", 5, 0, "auto_unroll_max_step$0"]]]], "r": [[0.000271513, 0.000271707, 0.000271724, 0.000271842], 0, 3.39651, 1670121730], "v": "v0.6"}
{"i": [["[\"a7de7210b6587109a1ca064f9b471c63\", [6, 20, 32, 32], [20, 20, 3, 3], [1, 20, 1, 1], [6, 20, 32, 32], [6, 20, 32, 32]]", "cuda -keys=cuda,gpu -arch=sm_80 -max_num_threads=1024 -thread_warp_size=32", [-1, 16, 64, 49152, 2147483647, 1024, 8, 32], "", 0, []], [[], [["CI", 5], ["SP", 3, 0, 6, [3, 1, 2, 1], 1], ["SP", 3, 5, 20, [1, 1, 1, 1], 1], ["SP", 3, 10, 32, [1, 16, 1, 2], 1], ["SP", 3, 15, 32, [2, 2, 2, 2], 1], ["SP", 3, 20, 20, [2, 1], 1], ["SP", 3, 23, 3, [3, 1], 1], ["SP", 3, 26, 3, [1, 1], 1], ["RE", 3, [0, 5, 10, 15, 1, 6, 11, 16, 2, 7, 12, 17, 20, 23, 26, 21, 24, 27, 3, 8, 13, 18, 22, 25, 28, 4, 9, 14, 19]], ["FSP", 7, 0, 1, 3], ["FSP", 7, 4, 2, 3], ["FSP", 7, 8, 3, 3], ["FSP", 7, 12, 4, 3], ["RE", 7, [0, 4, 8, 12, 1, 5, 9, 13, 2, 6, 10, 14, 3, 7, 11, 15]], ["CA", 3, 7, 11], ["CHR", 2, "shared", [3]], ["CA", 3, 4, 14], ["CHR", 1, "shared", [4]], ["CA", 2, 5, 14], ["CI", 1], ["FU", 9, [0, 1, 2, 3]], ["AN", 9, 0, 5], ["FU", 9, [1, 2, 3, 4]], ["AN", 9, 1, 4], ["FU", 9, [2, 3, 4, 5]], ["AN", 9, 2, 6], ["FU", 4, [0, 1, 2, 3]], ["SP", 4, 0, 6, [1], 1], ["AN", 4, 1, 2], ["FFSP", 4, 0, [4, 3, 2, 1], 1, 1], ["AN", 4, 1, 6], ["FU", 2, [0, 1, 2, 3]], ["SP", 2, 0, 32, [1], 1], ["AN", 2, 1, 2], ["FFSP", 2, 0, [4, 3, 2, 1], 1, 1], ["AN", 2, 1, 6], ["PR", 5, 0, "auto_unroll_max_step$0"]]]], "r": [[0.000532022, 0.000532513, 0.000531692, 0.000532171], 0, 3.3832, 1670121733], "v": "v0.6"}
