.cache/log/kernel_tune/NVIDIA_A100_80GB_PCIe/Conv2dBiasMulAdd_forward_input_0_32_8_32_32-input_1_32_8_32_32_output_0_32_8_32_32_in_channels_8_out_channels_8_kernel_size_3_3_stride_1_1_padding_1_1_dilation_1_1_groups_1.json
{"i": [["[\"a7de7210b6587109a1ca064f9b471c63\", [32, 8, 32, 32], [8, 8, 3, 3], [1, 8, 1, 1], [32, 8, 32, 32], [32, 8, 32, 32]]", "cuda -keys=cuda,gpu -arch=sm_80 -max_num_threads=1024 -thread_warp_size=32", [-1, 16, 64, 49152, 2147483647, 1024, 8, 32], "", 0, []], [[], [["CI", 5], ["SP", 3, 0, 32, [1, 2, 1, 2], 1], ["SP", 3, 5, 8, [1, 2, 1, 4], 1], ["SP", 3, 10, 32, [2, 4, 2, 1], 1], ["SP", 3, 15, 32, [1, 2, 1, 2], 1], ["SP", 3, 20, 8, [8, 1], 1], ["SP", 3, 23, 3, [1, 3], 1], ["SP", 3, 26, 3, [1, 1], 1], ["RE", 3, [0, 5, 10, 15, 1, 6, 11, 16, 2, 7, 12, 17, 20, 23, 26, 21, 24, 27, 3, 8, 13, 18, 22, 25, 28, 4, 9, 14, 19]], ["FSP", 7, 0, 1, 3], ["FSP", 7, 4, 2, 3], ["FSP", 7, 8, 3, 3], ["FSP", 7, 12, 4, 3], ["RE", 7, [0, 4, 8, 12, 1, 5, 9, 13, 2, 6, 10, 14, 3, 7, 11, 15]], ["CA", 3, 7, 11], ["CHR", 2, "shared", [3]], ["CA", 3, 4, 14], ["CHR", 1, "shared", [4]], ["CA", 2, 5, 14], ["CI", 1], ["FU", 9, [0, 1, 2, 3]], ["AN", 9, 0, 5], ["FU", 9, [1, 2, 3, 4]], ["AN", 9, 1, 4], ["FU", 9, [2, 3, 4, 5]], ["AN", 9, 2, 6], ["FU", 4, [0, 1, 2, 3]], ["SP", 4, 0, 48, [1], 1], ["AN", 4, 1, 2], ["FFSP", 4, 0, [4, 3, 2, 1], 1, 1], ["AN", 4, 1, 6], ["FU", 2, [0, 1, 2, 3]], ["SP", 2, 0, 64, [1], 1], ["AN", 2, 1, 2], ["FFSP", 2, 0, [4, 3, 2, 1], 1, 1], ["AN", 2, 1, 6], ["PR", 5, 0, "auto_unroll_max_step$16"]]]], "r": [[3.41101e-05, 3.41093e-05, 3.41088e-05, 3.41086e-05], 0, 3.54022, 1669784435], "v": "v0.6"}
{"i": [["[\"a7de7210b6587109a1ca064f9b471c63\", [32, 8, 32, 32], [8, 8, 3, 3], [1, 8, 1, 1], [32, 8, 32, 32], [32, 8, 32, 32]]", "cuda -keys=cuda,gpu -arch=sm_80 -max_num_threads=1024 -thread_warp_size=32", [-1, 16, 64, 49152, 2147483647, 1024, 8, 32], "", 0, []], [[], [["CI", 5], ["SP", 3, 0, 32, [1, 4, 2, 2], 1], ["SP", 3, 5, 8, [1, 1, 4, 2], 1], ["SP", 3, 10, 32, [1, 8, 1, 2], 1], ["SP", 3, 15, 32, [1, 2, 2, 1], 1], ["SP", 3, 20, 8, [2, 1], 1], ["SP", 3, 23, 3, [1, 1], 1], ["SP", 3, 26, 3, [1, 3], 1], ["RE", 3, [0, 5, 10, 15, 1, 6, 11, 16, 2, 7, 12, 17, 20, 23, 26, 21, 24, 27, 3, 8, 13, 18, 22, 25, 28, 4, 9, 14, 19]], ["FSP", 7, 0, 1, 3], ["FSP", 7, 4, 2, 3], ["FSP", 7, 8, 3, 3], ["FSP", 7, 12, 4, 3], ["RE", 7, [0, 4, 8, 12, 1, 5, 9, 13, 2, 6, 10, 14, 3, 7, 11, 15]], ["CA", 3, 7, 11], ["CHR", 2, "shared", [3]], ["CA", 3, 4, 14], ["CHR", 1, "shared", [4]], ["CA", 2, 5, 14], ["CI", 1], ["FU", 9, [0, 1, 2, 3]], ["AN", 9, 0, 5], ["FU", 9, [1, 2, 3, 4]], ["AN", 9, 1, 4], ["FU", 9, [2, 3, 4, 5]], ["AN", 9, 2, 6], ["FU", 4, [0, 1, 2, 3]], ["SP", 4, 0, 16, [1], 1], ["AN", 4, 1, 2], ["FFSP", 4, 0, [4, 3, 2, 1], 1, 1], ["AN", 4, 1, 6], ["FU", 2, [0, 1, 2, 3]], ["SP", 2, 0, 32, [1], 1], ["AN", 2, 1, 2], ["FFSP", 2, 0, [4, 3, 2, 1], 1, 1], ["AN", 2, 1, 6], ["PR", 5, 0, "auto_unroll_max_step$16"]]]], "r": [[0.000176863, 0.000176852, 0.000176914, 0.000176865], 0, 3.87061, 1669784437], "v": "v0.6"}
{"i": [["[\"a7de7210b6587109a1ca064f9b471c63\", [32, 8, 32, 32], [8, 8, 3, 3], [1, 8, 1, 1], [32, 8, 32, 32], [32, 8, 32, 32]]", "cuda -keys=cuda,gpu -arch=sm_80 -max_num_threads=1024 -thread_warp_size=32", [-1, 16, 64, 49152, 2147483647, 1024, 8, 32], "", 0, []], [[], [["CI", 5], ["SP", 3, 0, 32, [1, 2, 4, 1], 1], ["SP", 3, 5, 8, [1, 4, 2, 1], 1], ["SP", 3, 10, 32, [1, 2, 1, 4], 1], ["SP", 3, 15, 32, [1, 2, 1, 16], 1], ["SP", 3, 20, 8, [4, 1], 1], ["SP", 3, 23, 3, [3, 1], 1], ["SP", 3, 26, 3, [1, 1], 1], ["RE", 3, [0, 5, 10, 15, 1, 6, 11, 16, 2, 7, 12, 17, 20, 23, 26, 21, 24, 27, 3, 8, 13, 18, 22, 25, 28, 4, 9, 14, 19]], ["FSP", 7, 0, 1, 3], ["FSP", 7, 4, 2, 3], ["FSP", 7, 8, 3, 3], ["FSP", 7, 12, 4, 3], ["RE", 7, [0, 4, 8, 12, 1, 5, 9, 13, 2, 6, 10, 14, 3, 7, 11, 15]], ["CA", 3, 7, 11], ["CHR", 2, "shared", [3]], ["CA", 3, 4, 14], ["CHR", 1, "shared", [4]], ["CA", 2, 5, 14], ["CI", 1], ["FU", 9, [0, 1, 2, 3]], ["AN", 9, 0, 5], ["FU", 9, [1, 2, 3, 4]], ["AN", 9, 1, 4], ["FU", 9, [2, 3, 4, 5]], ["AN", 9, 2, 6], ["FU", 4, [0, 1, 2, 3]], ["SP", 4, 0, 24, [1], 1], ["AN", 4, 1, 2], ["FFSP", 4, 0, [4, 3, 2, 1], 1, 1], ["AN", 4, 1, 6], ["FU", 2, [0, 1, 2, 3]], ["SP", 2, 0, 768, [1], 1], ["AN", 2, 1, 2], ["FFSP", 2, 0, [4, 3, 2, 1], 1, 1], ["AN", 2, 1, 6], ["PR", 5, 0, "auto_unroll_max_step$1024"]]]], "r": [[0.000276323, 0.000276265, 0.000276254, 0.000276316], 0, 8.64224, 1669784440], "v": "v0.6"}
{"i": [["[\"a7de7210b6587109a1ca064f9b471c63\", [32, 8, 32, 32], [8, 8, 3, 3], [1, 8, 1, 1], [32, 8, 32, 32], [32, 8, 32, 32]]", "cuda -keys=cuda,gpu -arch=sm_80 -max_num_threads=1024 -thread_warp_size=32", [-1, 16, 64, 49152, 2147483647, 1024, 8, 32], "", 0, []], [[], [["CI", 5], ["SP", 3, 0, 32, [2, 1, 1, 2], 1], ["SP", 3, 5, 8, [2, 1, 2, 1], 1], ["SP", 3, 10, 32, [1, 8, 1, 1], 1], ["SP", 3, 15, 32, [1, 8, 1, 2], 1], ["SP", 3, 20, 8, [8, 1], 1], ["SP", 3, 23, 3, [1, 3], 1], ["SP", 3, 26, 3, [1, 3], 1], ["RE", 3, [0, 5, 10, 15, 1, 6, 11, 16, 2, 7, 12, 17, 20, 23, 26, 21, 24, 27, 3, 8, 13, 18, 22, 25, 28, 4, 9, 14, 19]], ["FSP", 7, 0, 1, 3], ["FSP", 7, 4, 2, 3], ["FSP", 7, 8, 3, 3], ["FSP", 7, 12, 4, 3], ["RE", 7, [0, 4, 8, 12, 1, 5, 9, 13, 2, 6, 10, 14, 3, 7, 11, 15]], ["CA", 3, 7, 11], ["CHR", 2, "shared", [3]], ["CA", 3, 4, 14], ["CHR", 1, "shared", [4]], ["CA", 2, 5, 14], ["CI", 1], ["FU", 9, [0, 1, 2, 3]], ["AN", 9, 0, 5], ["FU", 9, [1, 2, 3, 4]], ["AN", 9, 1, 4], ["FU", 9, [2, 3, 4, 5]], ["AN", 9, 2, 6], ["FU", 4, [0, 1, 2, 3]], ["SP", 4, 0, 48, [4], 1], ["AN", 4, 1, 2], ["FFSP", 4, 0, [4, 3, 2, 1], 1, 1], ["AN", 4, 1, 6], ["FU", 2, [0, 1, 2, 3]], ["SP", 2, 0, 48, [1], 1], ["AN", 2, 1, 2], ["FFSP", 2, 0, [4, 3, 2, 1], 1, 1], ["AN", 2, 1, 6], ["PR", 5, 0, "auto_unroll_max_step$0"]]]], "r": [[3.40972e-05, 3.40983e-05, 3.40949e-05, 3.40932e-05], 0, 3.62503, 1669784443], "v": "v0.6"}
{"i": [["[\"a7de7210b6587109a1ca064f9b471c63\", [32, 8, 32, 32], [8, 8, 3, 3], [1, 8, 1, 1], [32, 8, 32, 32], [32, 8, 32, 32]]", "cuda -keys=cuda,gpu -arch=sm_80 -max_num_threads=1024 -thread_warp_size=32", [-1, 16, 64, 49152, 2147483647, 1024, 8, 32], "", 0, []], [[], [["CI", 5], ["SP", 3, 0, 32, [1, 16, 1, 1], 1], ["SP", 3, 5, 8, [1, 1, 4, 2], 1], ["SP", 3, 10, 32, [1, 2, 4, 1], 1], ["SP", 3, 15, 32, [1, 8, 2, 1], 1], ["SP", 3, 20, 8, [2, 2], 1], ["SP", 3, 23, 3, [3, 1], 1], ["SP", 3, 26, 3, [1, 3], 1], ["RE", 3, [0, 5, 10, 15, 1, 6, 11, 16, 2, 7, 12, 17, 20, 23, 26, 21, 24, 27, 3, 8, 13, 18, 22, 25, 28, 4, 9, 14, 19]], ["FSP", 7, 0, 1, 3], ["FSP", 7, 4, 2, 3], ["FSP", 7, 8, 3, 3], ["FSP", 7, 12, 4, 3], ["RE", 7, [0, 4, 8, 12, 1, 5, 9, 13, 2, 6, 10, 14, 3, 7, 11, 15]], ["CA", 3, 7, 11], ["CHR", 2, "shared", [3]], ["CA", 3, 4, 14], ["CHR", 1, "shared", [4]], ["CA", 2, 5, 14], ["CI", 1], ["FU", 9, [0, 1, 2, 3]], ["AN", 9, 0, 5], ["FU", 9, [1, 2, 3, 4]], ["AN", 9, 1, 4], ["FU", 9, [2, 3, 4, 5]], ["AN", 9, 2, 6], ["FU", 4, [0, 1, 2, 3]], ["SP", 4, 0, 288, [1], 1], ["AN", 4, 1, 2], ["FFSP", 4, 0, [4, 3, 2, 1], 1, 1], ["AN", 4, 1, 6], ["FU", 2, [0, 1, 2, 3]], ["SP", 2, 0, 96, [1], 1], ["AN", 2, 1, 2], ["FFSP", 2, 0, [4, 3, 2, 1], 1, 1], ["AN", 2, 1, 6], ["PR", 5, 0, "auto_unroll_max_step$0"]]]], "r": [[6.32383e-05, 6.32376e-05, 6.32375e-05, 6.32405e-05], 0, 3.65113, 1669784445], "v": "v0.6"}
{"i": [["[\"a7de7210b6587109a1ca064f9b471c63\", [32, 8, 32, 32], [8, 8, 3, 3], [1, 8, 1, 1], [32, 8, 32, 32], [32, 8, 32, 32]]", "cuda -keys=cuda,gpu -arch=sm_80 -max_num_threads=1024 -thread_warp_size=32", [-1, 16, 64, 49152, 2147483647, 1024, 8, 32], "", 0, []], [[], [["CI", 5], ["SP", 3, 0, 32, [1, 4, 8, 1], 1], ["SP", 3, 5, 8, [2, 2, 1, 1], 1], ["SP", 3, 10, 32, [1, 2, 1, 1], 1], ["SP", 3, 15, 32, [1, 16, 1, 2], 1], ["SP", 3, 20, 8, [2, 1], 1], ["SP", 3, 23, 3, [1, 1], 1], ["SP", 3, 26, 3, [1, 3], 1], ["RE", 3, [0, 5, 10, 15, 1, 6, 11, 16, 2, 7, 12, 17, 20, 23, 26, 21, 24, 27, 3, 8, 13, 18, 22, 25, 28, 4, 9, 14, 19]], ["FSP", 7, 0, 1, 3], ["FSP", 7, 4, 2, 3], ["FSP", 7, 8, 3, 3], ["FSP", 7, 12, 4, 3], ["RE", 7, [0, 4, 8, 12, 1, 5, 9, 13, 2, 6, 10, 14, 3, 7, 11, 15]], ["CA", 3, 7, 11], ["CHR", 2, "shared", [3]], ["CA", 3, 4, 14], ["CHR", 1, "shared", [4]], ["CA", 2, 5, 14], ["CI", 1], ["FU", 9, [0, 1, 2, 3]], ["AN", 9, 0, 5], ["FU", 9, [1, 2, 3, 4]], ["AN", 9, 1, 4], ["FU", 9, [2, 3, 4, 5]], ["AN", 9, 2, 6], ["FU", 4, [0, 1, 2, 3]], ["SP", 4, 0, 6, [1], 1], ["AN", 4, 1, 2], ["FFSP", 4, 0, [4, 3, 2, 1], 1, 1], ["AN", 4, 1, 6], ["FU", 2, [0, 1, 2, 3]], ["SP", 2, 0, 128, [1], 1], ["AN", 2, 1, 2], ["FFSP", 2, 0, [4, 3, 2, 1], 1, 1], ["AN", 2, 1, 6], ["PR", 5, 0, "auto_unroll_max_step$512"]]]], "r": [[2.3925e-05, 2.39269e-05, 2.39284e-05, 2.39277e-05], 0, 3.65903, 1669784448], "v": "v0.6"}
{"i": [["[\"a7de7210b6587109a1ca064f9b471c63\", [32, 8, 32, 32], [8, 8, 3, 3], [1, 8, 1, 1], [32, 8, 32, 32], [32, 8, 32, 32]]", "cuda -keys=cuda,gpu -arch=sm_80 -max_num_threads=1024 -thread_warp_size=32", [-1, 16, 64, 49152, 2147483647, 1024, 8, 32], "", 0, []], [[], [["CI", 5], ["SP", 3, 0, 32, [1, 1, 4, 1], 1], ["SP", 3, 5, 8, [1, 2, 1, 1], 1], ["SP", 3, 10, 32, [1, 8, 1, 2], 1], ["SP", 3, 15, 32, [2, 4, 2, 1], 1], ["SP", 3, 20, 8, [2, 2], 1], ["SP", 3, 23, 3, [3, 1], 1], ["SP", 3, 26, 3, [1, 3], 1], ["RE", 3, [0, 5, 10, 15, 1, 6, 11, 16, 2, 7, 12, 17, 20, 23, 26, 21, 24, 27, 3, 8, 13, 18, 22, 25, 28, 4, 9, 14, 19]], ["FSP", 7, 0, 1, 3], ["FSP", 7, 4, 2, 3], ["FSP", 7, 8, 3, 3], ["FSP", 7, 12, 4, 3], ["RE", 7, [0, 4, 8, 12, 1, 5, 9, 13, 2, 6, 10, 14, 3, 7, 11, 15]], ["CA", 3, 7, 11], ["CHR", 2, "shared", [3]], ["CA", 3, 4, 14], ["CHR", 1, "shared", [4]], ["CA", 2, 5, 14], ["CI", 1], ["FU", 9, [0, 1, 2, 3]], ["AN", 9, 0, 5], ["FU", 9, [1, 2, 3, 4]], ["AN", 9, 1, 4], ["FU", 9, [2, 3, 4, 5]], ["AN", 9, 2, 6], ["FU", 4, [0, 1, 2, 3]], ["SP", 4, 0, 36, [1], 1], ["AN", 4, 1, 2], ["FFSP", 4, 0, [4, 3, 2, 1], 1, 1], ["AN", 4, 1, 6], ["FU", 2, [0, 1, 2, 3]], ["SP", 2, 0, 256, [1], 1], ["AN", 2, 1, 2], ["FFSP", 2, 0, [4, 3, 2, 1], 1, 1], ["AN", 2, 1, 6], ["PR", 5, 0, "auto_unroll_max_step$64"]]]], "r": [[6.28686e-05, 6.28741e-05, 6.28758e-05, 6.28731e-05], 0, 3.59997, 1669784451], "v": "v0.6"}
{"i": [["[\"a7de7210b6587109a1ca064f9b471c63\", [32, 8, 32, 32], [8, 8, 3, 3], [1, 8, 1, 1], [32, 8, 32, 32], [32, 8, 32, 32]]", "cuda -keys=cuda,gpu -arch=sm_80 -max_num_threads=1024 -thread_warp_size=32", [-1, 16, 64, 49152, 2147483647, 1024, 8, 32], "", 0, []], [[], [["CI", 5], ["SP", 3, 0, 32, [4, 1, 1, 1], 1], ["SP", 3, 5, 8, [1, 2, 2, 1], 1], ["SP", 3, 10, 32, [1, 4, 1, 2], 1], ["SP", 3, 15, 32, [1, 8, 1, 2], 1], ["SP", 3, 20, 8, [8, 1], 1], ["SP", 3, 23, 3, [3, 1], 1], ["SP", 3, 26, 3, [1, 1], 1], ["RE", 3, [0, 5, 10, 15, 1, 6, 11, 16, 2, 7, 12, 17, 20, 23, 26, 21, 24, 27, 3, 8, 13, 18, 22, 25, 28, 4, 9, 14, 19]], ["FSP", 7, 0, 1, 3], ["FSP", 7, 4, 2, 3], ["FSP", 7, 8, 3, 3], ["FSP", 7, 12, 4, 3], ["RE", 7, [0, 4, 8, 12, 1, 5, 9, 13, 2, 6, 10, 14, 3, 7, 11, 15]], ["CA", 3, 7, 11], ["CHR", 2, "shared", [3]], ["CA", 3, 4, 14], ["CHR", 1, "shared", [4]], ["CA", 2, 5, 14], ["CI", 1], ["FU", 9, [0, 1, 2, 3]], ["AN", 9, 0, 5], ["FU", 9, [1, 2, 3, 4]], ["AN", 9, 1, 4], ["FU", 9, [2, 3, 4, 5]], ["AN", 9, 2, 6], ["FU", 4, [0, 1, 2, 3]], ["SP", 4, 0, 48, [1], 1], ["AN", 4, 1, 2], ["FFSP", 4, 0, [4, 3, 2, 1], 1, 1], ["AN", 4, 1, 6], ["FU", 2, [0, 1, 2, 3]], ["SP", 2, 0, 48, [1], 1], ["AN", 2, 1, 2], ["FFSP", 2, 0, [4, 3, 2, 1], 1, 1], ["AN", 2, 1, 6], ["PR", 5, 0, "auto_unroll_max_step$0"]]]], "r": [[3.10529e-05, 3.10961e-05, 3.10967e-05, 3.11044e-05], 0, 3.22894, 1669784453], "v": "v0.6"}
{"i": [["[\"a7de7210b6587109a1ca064f9b471c63\", [32, 8, 32, 32], [8, 8, 3, 3], [1, 8, 1, 1], [32, 8, 32, 32], [32, 8, 32, 32]]", "cuda -keys=cuda,gpu -arch=sm_80 -max_num_threads=1024 -thread_warp_size=32", [-1, 16, 64, 49152, 2147483647, 1024, 8, 32], "", 0, []], [[], [["CI", 5], ["SP", 3, 0, 32, [1, 1, 8, 4], 1], ["SP", 3, 5, 8, [1, 2, 2, 2], 1], ["SP", 3, 10, 32, [1, 1, 4, 1], 1], ["SP", 3, 15, 32, [1, 16, 2, 1], 1], ["SP", 3, 20, 8, [2, 1], 1], ["SP", 3, 23, 3, [1, 1], 1], ["SP", 3, 26, 3, [3, 1], 1], ["RE", 3, [0, 5, 10, 15, 1, 6, 11, 16, 2, 7, 12, 17, 20, 23, 26, 21, 24, 27, 3, 8, 13, 18, 22, 25, 28, 4, 9, 14, 19]], ["FSP", 7, 0, 1, 3], ["FSP", 7, 4, 2, 3], ["FSP", 7, 8, 3, 3], ["FSP", 7, 12, 4, 3], ["RE", 7, [0, 4, 8, 12, 1, 5, 9, 13, 2, 6, 10, 14, 3, 7, 11, 15]], ["CA", 3, 7, 11], ["CHR", 2, "shared", [3]], ["CA", 3, 4, 14], ["CHR", 1, "shared", [4]], ["CA", 2, 5, 14], ["CI", 1], ["FU", 9, [0, 1, 2, 3]], ["AN", 9, 0, 5], ["FU", 9, [1, 2, 3, 4]], ["AN", 9, 1, 4], ["FU", 9, [2, 3, 4, 5]], ["AN", 9, 2, 6], ["FU", 4, [0, 1, 2, 3]], ["SP", 4, 0, 24, [1], 1], ["AN", 4, 1, 2], ["FFSP", 4, 0, [4, 3, 2, 1], 1, 1], ["AN", 4, 1, 6], ["FU", 2, [0, 1, 2, 3]], ["SP", 2, 0, 1024, [1], 1], ["AN", 2, 1, 2], ["FFSP", 2, 0, [4, 3, 2, 1], 1, 1], ["AN", 2, 1, 6], ["PR", 5, 0, "auto_unroll_max_step$512"]]]], "r": [[0.00146193, 0.00146196, 0.00146189, 0.00146253], 0, 7.78535, 1669784455], "v": "v0.6"}
{"i": [["[\"a7de7210b6587109a1ca064f9b471c63\", [32, 8, 32, 32], [8, 8, 3, 3], [1, 8, 1, 1], [32, 8, 32, 32], [32, 8, 32, 32]]", "cuda -keys=cuda,gpu -arch=sm_80 -max_num_threads=1024 -thread_warp_size=32", [-1, 16, 64, 49152, 2147483647, 1024, 8, 32], "", 0, []], [[], [["CI", 5], ["SP", 3, 0, 32, [4, 1, 1, 1], 1], ["SP", 3, 5, 8, [1, 1, 2, 4], 1], ["SP", 3, 10, 32, [1, 16, 1, 2], 1], ["SP", 3, 15, 32, [1, 8, 2, 1], 1], ["SP", 3, 20, 8, [2, 2], 1], ["SP", 3, 23, 3, [1, 1], 1], ["SP", 3, 26, 3, [3, 1], 1], ["RE", 3, [0, 5, 10, 15, 1, 6, 11, 16, 2, 7, 12, 17, 20, 23, 26, 21, 24, 27, 3, 8, 13, 18, 22, 25, 28, 4, 9, 14, 19]], ["FSP", 7, 0, 1, 3], ["FSP", 7, 4, 2, 3], ["FSP", 7, 8, 3, 3], ["FSP", 7, 12, 4, 3], ["RE", 7, [0, 4, 8, 12, 1, 5, 9, 13, 2, 6, 10, 14, 3, 7, 11, 15]], ["CA", 3, 7, 11], ["CHR", 2, "shared", [3]], ["CA", 3, 4, 14], ["CHR", 1, "shared", [4]], ["CA", 2, 5, 14], ["CI", 1], ["FU", 9, [0, 1, 2, 3]], ["AN", 9, 0, 5], ["FU", 9, [1, 2, 3, 4]], ["AN", 9, 1, 4], ["FU", 9, [2, 3, 4, 5]], ["AN", 9, 2, 6], ["FU", 4, [0, 1, 2, 3]], ["SP", 4, 0, 96, [4], 1], ["AN", 4, 1, 2], ["FFSP", 4, 0, [4, 3, 2, 1], 1, 1], ["AN", 4, 1, 6], ["FU", 2, [0, 1, 2, 3]], ["SP", 2, 0, 32, [8], 1], ["AN", 2, 1, 2], ["FFSP", 2, 0, [4, 3, 2, 1], 1, 1], ["AN", 2, 1, 6], ["PR", 5, 0, "auto_unroll_max_step$1024"]]]], "r": [[5.27831e-05, 5.27789e-05, 5.27734e-05, 5.27843e-05], 0, 5.59942, 1669784458], "v": "v0.6"}
{"i": [["[\"a7de7210b6587109a1ca064f9b471c63\", [32, 8, 32, 32], [8, 8, 3, 3], [1, 8, 1, 1], [32, 8, 32, 32], [32, 8, 32, 32]]", "cuda -keys=cuda,gpu -arch=sm_80 -max_num_threads=1024 -thread_warp_size=32", [-1, 16, 64, 49152, 2147483647, 1024, 8, 32], "", 0, []], [[], [["CI", 5], ["SP", 3, 0, 32, [1, 8, 1, 2], 1], ["SP", 3, 5, 8, [1, 4, 1, 1], 1], ["SP", 3, 10, 32, [1, 1, 1, 1], 1], ["SP", 3, 15, 32, [2, 2, 8, 1], 1], ["SP", 3, 20, 8, [4, 2], 1], ["SP", 3, 23, 3, [1, 1], 1], ["SP", 3, 26, 3, [1, 3], 1], ["RE", 3, [0, 5, 10, 15, 1, 6, 11, 16, 2, 7, 12, 17, 20, 23, 26, 21, 24, 27, 3, 8, 13, 18, 22, 25, 28, 4, 9, 14, 19]], ["FSP", 7, 0, 1, 3], ["FSP", 7, 4, 2, 3], ["FSP", 7, 8, 3, 3], ["FSP", 7, 12, 4, 3], ["RE", 7, [0, 4, 8, 12, 1, 5, 9, 13, 2, 6, 10, 14, 3, 7, 11, 15]], ["CA", 3, 7, 11], ["CHR", 2, "shared", [3]], ["CA", 3, 4, 14], ["CHR", 1, "shared", [4]], ["CA", 2, 5, 14], ["CI", 1], ["FU", 9, [0, 1, 2, 3]], ["AN", 9, 0, 5], ["FU", 9, [1, 2, 3, 4]], ["AN", 9, 1, 4], ["FU", 9, [2, 3, 4, 5]], ["AN", 9, 2, 6], ["FU", 4, [0, 1, 2, 3]], ["SP", 4, 0, 8, [1], 1], ["AN", 4, 1, 2], ["FFSP", 4, 0, [4, 3, 2, 1], 1, 1], ["AN", 4, 1, 6], ["FU", 2, [0, 1, 2, 3]], ["SP", 2, 0, 256, [1], 1], ["AN", 2, 1, 2], ["FFSP", 2, 0, [4, 3, 2, 1], 1, 1], ["AN", 2, 1, 6], ["PR", 5, 0, "auto_unroll_max_step$1024"]]]], "r": [[5.51442e-05, 5.52397e-05, 5.51377e-05, 5.51468e-05], 0, 4.68917, 1669784461], "v": "v0.6"}
{"i": [["[\"a7de7210b6587109a1ca064f9b471c63\", [32, 8, 32, 32], [8, 8, 3, 3], [1, 8, 1, 1], [32, 8, 32, 32], [32, 8, 32, 32]]", "cuda -keys=cuda,gpu -arch=sm_80 -max_num_threads=1024 -thread_warp_size=32", [-1, 16, 64, 49152, 2147483647, 1024, 8, 32], "", 0, []], [[], [["CI", 5], ["SP", 3, 0, 32, [1, 2, 1, 4], 1], ["SP", 3, 5, 8, [2, 1, 1, 2], 1], ["SP", 3, 10, 32, [1, 4, 1, 2], 1], ["SP", 3, 15, 32, [2, 16, 1, 1], 1], ["SP", 3, 20, 8, [1, 2], 1], ["SP", 3, 23, 3, [1, 3], 1], ["SP", 3, 26, 3, [1, 3], 1], ["RE", 3, [0, 5, 10, 15, 1, 6, 11, 16, 2, 7, 12, 17, 20, 23, 26, 21, 24, 27, 3, 8, 13, 18, 22, 25, 28, 4, 9, 14, 19]], ["FSP", 7, 0, 1, 3], ["FSP", 7, 4, 2, 3], ["FSP", 7, 8, 3, 3], ["FSP", 7, 12, 4, 3], ["RE", 7, [0, 4, 8, 12, 1, 5, 9, 13, 2, 6, 10, 14, 3, 7, 11, 15]], ["CA", 3, 7, 11], ["CHR", 2, "shared", [3]], ["CA", 3, 4, 14], ["CHR", 1, "shared", [4]], ["CA", 2, 5, 14], ["CI", 1], ["FU", 9, [0, 1, 2, 3]], ["AN", 9, 0, 5], ["FU", 9, [1, 2, 3, 4]], ["AN", 9, 1, 4], ["FU", 9, [2, 3, 4, 5]], ["AN", 9, 2, 6], ["FU", 4, [0, 1, 2, 3]], ["SP", 4, 0, 36, [1], 1], ["AN", 4, 1, 2], ["FFSP", 4, 0, [4, 3, 2, 1], 1, 1], ["AN", 4, 1, 6], ["FU", 2, [0, 1, 2, 3]], ["SP", 2, 0, 96, [1], 1], ["AN", 2, 1, 2], ["FFSP", 2, 0, [4, 3, 2, 1], 1, 1], ["AN", 2, 1, 6], ["PR", 5, 0, "auto_unroll_max_step$512"]]]], "r": [[1.83287e-05, 1.83174e-05, 1.83247e-05, 1.83265e-05], 0, 3.83373, 1669784463], "v": "v0.6"}
{"i": [["[\"a7de7210b6587109a1ca064f9b471c63\", [32, 8, 32, 32], [8, 8, 3, 3], [1, 8, 1, 1], [32, 8, 32, 32], [32, 8, 32, 32]]", "cuda -keys=cuda,gpu -arch=sm_80 -max_num_threads=1024 -thread_warp_size=32", [-1, 16, 64, 49152, 2147483647, 1024, 8, 32], "", 0, []], [[], [["CI", 5], ["SP", 3, 0, 32, [1, 16, 1, 2], 1], ["SP", 3, 5, 8, [1, 2, 2, 1], 1], ["SP", 3, 10, 32, [4, 1, 1, 2], 1], ["SP", 3, 15, 32, [1, 2, 2, 1], 1], ["SP", 3, 20, 8, [1, 4], 1], ["SP", 3, 23, 3, [1, 1], 1], ["SP", 3, 26, 3, [1, 1], 1], ["RE", 3, [0, 5, 10, 15, 1, 6, 11, 16, 2, 7, 12, 17, 20, 23, 26, 21, 24, 27, 3, 8, 13, 18, 22, 25, 28, 4, 9, 14, 19]], ["FSP", 7, 0, 1, 3], ["FSP", 7, 4, 2, 3], ["FSP", 7, 8, 3, 3], ["FSP", 7, 12, 4, 3], ["RE", 7, [0, 4, 8, 12, 1, 5, 9, 13, 2, 6, 10, 14, 3, 7, 11, 15]], ["CA", 3, 7, 11], ["CHR", 2, "shared", [3]], ["CA", 3, 4, 14], ["CHR", 1, "shared", [4]], ["CA", 2, 5, 14], ["CI", 1], ["FU", 9, [0, 1, 2, 3]], ["AN", 9, 0, 5], ["FU", 9, [1, 2, 3, 4]], ["AN", 9, 1, 4], ["FU", 9, [2, 3, 4, 5]], ["AN", 9, 2, 6], ["FU", 4, [0, 1, 2, 3]], ["SP", 4, 0, 24, [1], 1], ["AN", 4, 1, 2], ["FFSP", 4, 0, [4, 3, 2, 1], 1, 1], ["AN", 4, 1, 6], ["FU", 2, [0, 1, 2, 3]], ["SP", 2, 0, 128, [1], 1], ["AN", 2, 1, 2], ["FFSP", 2, 0, [4, 3, 2, 1], 1, 1], ["AN", 2, 1, 6], ["PR", 5, 0, "auto_unroll_max_step$1024"]]]], "r": [[4.33134e-05, 4.33162e-05, 4.33008e-05, 4.32104e-05], 0, 6.6995, 1669784466], "v": "v0.6"}
{"i": [["[\"a7de7210b6587109a1ca064f9b471c63\", [32, 8, 32, 32], [8, 8, 3, 3], [1, 8, 1, 1], [32, 8, 32, 32], [32, 8, 32, 32]]", "cuda -keys=cuda,gpu -arch=sm_80 -max_num_threads=1024 -thread_warp_size=32", [-1, 16, 64, 49152, 2147483647, 1024, 8, 32], "", 0, []], [[], [["CI", 5], ["SP", 3, 0, 32, [2, 16, 1, 1], 1], ["SP", 3, 5, 8, [1, 4, 2, 1], 1], ["SP", 3, 10, 32, [2, 1, 1, 1], 1], ["SP", 3, 15, 32, [1, 4, 2, 1], 1], ["SP", 3, 20, 8, [1, 8], 1], ["SP", 3, 23, 3, [3, 1], 1], ["SP", 3, 26, 3, [1, 3], 1], ["RE", 3, [0, 5, 10, 15, 1, 6, 11, 16, 2, 7, 12, 17, 20, 23, 26, 21, 24, 27, 3, 8, 13, 18, 22, 25, 28, 4, 9, 14, 19]], ["FSP", 7, 0, 1, 3], ["FSP", 7, 4, 2, 3], ["FSP", 7, 8, 3, 3], ["FSP", 7, 12, 4, 3], ["RE", 7, [0, 4, 8, 12, 1, 5, 9, 13, 2, 6, 10, 14, 3, 7, 11, 15]], ["CA", 3, 7, 11], ["CHR", 2, "shared", [3]], ["CA", 3, 4, 14], ["CHR", 1, "shared", [4]], ["CA", 2, 5, 14], ["CI", 1], ["FU", 9, [0, 1, 2, 3]], ["AN", 9, 0, 5], ["FU", 9, [1, 2, 3, 4]], ["AN", 9, 1, 4], ["FU", 9, [2, 3, 4, 5]], ["AN", 9, 2, 6], ["FU", 4, [0, 1, 2, 3]], ["SP", 4, 0, 288, [1], 1], ["AN", 4, 1, 2], ["FFSP", 4, 0, [4, 3, 2, 1], 1, 1], ["AN", 4, 1, 6], ["FU", 2, [0, 1, 2, 3]], ["SP", 2, 0, 96, [1], 1], ["AN", 2, 1, 2], ["FFSP", 2, 0, [4, 3, 2, 1], 1, 1], ["AN", 2, 1, 6], ["PR", 5, 0, "auto_unroll_max_step$0"]]]], "r": [[2.15622e-05, 2.15622e-05, 2.15613e-05, 2.15628e-05], 0, 3.0599, 1669784469], "v": "v0.6"}
{"i": [["[\"a7de7210b6587109a1ca064f9b471c63\", [32, 8, 32, 32], [8, 8, 3, 3], [1, 8, 1, 1], [32, 8, 32, 32], [32, 8, 32, 32]]", "cuda -keys=cuda,gpu -arch=sm_80 -max_num_threads=1024 -thread_warp_size=32", [-1, 16, 64, 49152, 2147483647, 1024, 8, 32], "", 0, []], [[], [["CI", 5], ["SP", 3, 0, 32, [1, 1, 2, 4], 1], ["SP", 3, 5, 8, [2, 4, 1, 1], 1], ["SP", 3, 10, 32, [2, 8, 1, 2], 1], ["SP", 3, 15, 32, [1, 4, 2, 1], 1], ["SP", 3, 20, 8, [4, 1], 1], ["SP", 3, 23, 3, [1, 3], 1], ["SP", 3, 26, 3, [1, 3], 1], ["RE", 3, [0, 5, 10, 15, 1, 6, 11, 16, 2, 7, 12, 17, 20, 23, 26, 21, 24, 27, 3, 8, 13, 18, 22, 25, 28, 4, 9, 14, 19]], ["FSP", 7, 0, 1, 3], ["FSP", 7, 4, 2, 3], ["FSP", 7, 8, 3, 3], ["FSP", 7, 12, 4, 3], ["RE", 7, [0, 4, 8, 12, 1, 5, 9, 13, 2, 6, 10, 14, 3, 7, 11, 15]], ["CA", 3, 7, 11], ["CHR", 2, "shared", [3]], ["CA", 3, 4, 14], ["CHR", 1, "shared", [4]], ["CA", 2, 5, 14], ["CI", 1], ["FU", 9, [0, 1, 2, 3]], ["AN", 9, 0, 5], ["FU", 9, [1, 2, 3, 4]], ["AN", 9, 1, 4], ["FU", 9, [2, 3, 4, 5]], ["AN", 9, 2, 6], ["FU", 4, [0, 1, 2, 3]], ["SP", 4, 0, 36, [1], 1], ["AN", 4, 1, 2], ["FFSP", 4, 0, [4, 3, 2, 1], 1, 1], ["AN", 4, 1, 6], ["FU", 2, [0, 1, 2, 3]], ["SP", 2, 0, 512, [1], 1], ["AN", 2, 1, 2], ["FFSP", 2, 0, [4, 3, 2, 1], 1, 1], ["AN", 2, 1, 6], ["PR", 5, 0, "auto_unroll_max_step$0"]]]], "r": [[9.57189e-05, 9.57276e-05, 9.57228e-05, 9.58879e-05], 0, 3.63233, 1669784471], "v": "v0.6"}
{"i": [["[\"a7de7210b6587109a1ca064f9b471c63\", [32, 8, 32, 32], [8, 8, 3, 3], [1, 8, 1, 1], [32, 8, 32, 32], [32, 8, 32, 32]]", "cuda -keys=cuda,gpu -arch=sm_80 -max_num_threads=1024 -thread_warp_size=32", [-1, 16, 64, 49152, 2147483647, 1024, 8, 32], "", 0, []], [[], [["CI", 5], ["SP", 3, 0, 32, [2, 16, 1, 1], 1], ["SP", 3, 5, 8, [2, 4, 1, 1], 1], ["SP", 3, 10, 32, [1, 2, 4, 4], 1], ["SP", 3, 15, 32, [2, 1, 1, 1], 1], ["SP", 3, 20, 8, [1, 1], 1], ["SP", 3, 23, 3, [3, 1], 1], ["SP", 3, 26, 3, [1, 3], 1], ["RE", 3, [0, 5, 10, 15, 1, 6, 11, 16, 2, 7, 12, 17, 20, 23, 26, 21, 24, 27, 3, 8, 13, 18, 22, 25, 28, 4, 9, 14, 19]], ["FSP", 7, 0, 1, 3], ["FSP", 7, 4, 2, 3], ["FSP", 7, 8, 3, 3], ["FSP", 7, 12, 4, 3], ["RE", 7, [0, 4, 8, 12, 1, 5, 9, 13, 2, 6, 10, 14, 3, 7, 11, 15]], ["CA", 3, 7, 11], ["CHR", 2, "shared", [3]], ["CA", 3, 4, 14], ["CHR", 1, "shared", [4]], ["CA", 2, 5, 14], ["CI", 1], ["FU", 9, [0, 1, 2, 3]], ["AN", 9, 0, 5], ["FU", 9, [1, 2, 3, 4]], ["AN", 9, 1, 4], ["FU", 9, [2, 3, 4, 5]], ["AN", 9, 2, 6], ["FU", 4, [0, 1, 2, 3]], ["SP", 4, 0, 18, [1], 1], ["AN", 4, 1, 2], ["FFSP", 4, 0, [4, 3, 2, 1], 1, 1], ["AN", 4, 1, 6], ["FU", 2, [0, 1, 2, 3]], ["SP", 2, 0, 60, [1], 1], ["AN", 2, 1, 2], ["FFSP", 2, 0, [4, 3, 2, 1], 1, 1], ["AN", 2, 1, 6], ["PR", 5, 0, "auto_unroll_max_step$16"]]]], "r": [[0.000145428, 0.000145603, 0.000145796, 0.000145442], 0, 3.49216, 1669784474], "v": "v0.6"}
{"i": [["[\"a7de7210b6587109a1ca064f9b471c63\", [32, 8, 32, 32], [8, 8, 3, 3], [1, 8, 1, 1], [32, 8, 32, 32], [32, 8, 32, 32]]", "cuda -keys=cuda,gpu -arch=sm_80 -max_num_threads=1024 -thread_warp_size=32", [-1, 16, 64, 49152, 2147483647, 1024, 8, 32], "", 0, []], [[], [["CI", 5], ["SP", 3, 0, 32, [2, 2, 1, 1], 1], ["SP", 3, 5, 8, [1, 4, 1, 2], 1], ["SP", 3, 10, 32, [2, 4, 1, 1], 1], ["SP", 3, 15, 32, [2, 2, 4, 2], 1], ["SP", 3, 20, 8, [1, 1], 1], ["SP", 3, 23, 3, [3, 1], 1], ["SP", 3, 26, 3, [1, 3], 1], ["RE", 3, [0, 5, 10, 15, 1, 6, 11, 16, 2, 7, 12, 17, 20, 23, 26, 21, 24, 27, 3, 8, 13, 18, 22, 25, 28, 4, 9, 14, 19]], ["FSP", 7, 0, 1, 3], ["FSP", 7, 4, 2, 3], ["FSP", 7, 8, 3, 3], ["FSP", 7, 12, 4, 3], ["RE", 7, [0, 4, 8, 12, 1, 5, 9, 13, 2, 6, 10, 14, 3, 7, 11, 15]], ["CA", 3, 7, 11], ["CHR", 2, "shared", [3]], ["CA", 3, 4, 14], ["CHR", 1, "shared", [4]], ["CA", 2, 5, 14], ["CI", 1], ["FU", 9, [0, 1, 2, 3]], ["AN", 9, 0, 5], ["FU", 9, [1, 2, 3, 4]], ["AN", 9, 1, 4], ["FU", 9, [2, 3, 4, 5]], ["AN", 9, 2, 6], ["FU", 4, [0, 1, 2, 3]], ["SP", 4, 0, 18, [1], 1], ["AN", 4, 1, 2], ["FFSP", 4, 0, [4, 3, 2, 1], 1, 1], ["AN", 4, 1, 6], ["FU", 2, [0, 1, 2, 3]], ["SP", 2, 0, 30, [1], 1], ["AN", 2, 1, 2], ["FFSP", 2, 0, [4, 3, 2, 1], 1, 1], ["AN", 2, 1, 6], ["PR", 5, 0, "auto_unroll_max_step$0"]]]], "r": [[0.000115162, 0.000115131, 0.000115164, 0.000115223], 0, 3.51548, 1669784477], "v": "v0.6"}
{"i": [["[\"a7de7210b6587109a1ca064f9b471c63\", [32, 8, 32, 32], [8, 8, 3, 3], [1, 8, 1, 1], [32, 8, 32, 32], [32, 8, 32, 32]]", "cuda -keys=cuda,gpu -arch=sm_80 -max_num_threads=1024 -thread_warp_size=32", [-1, 16, 64, 49152, 2147483647, 1024, 8, 32], "", 0, []], [[], [["CI", 5], ["SP", 3, 0, 32, [1, 4, 2, 2], 1], ["SP", 3, 5, 8, [2, 1, 4, 1], 1], ["SP", 3, 10, 32, [1, 8, 1, 2], 1], ["SP", 3, 15, 32, [1, 2, 1, 1], 1], ["SP", 3, 20, 8, [2, 1], 1], ["SP", 3, 23, 3, [1, 1], 1], ["SP", 3, 26, 3, [1, 1], 1], ["RE", 3, [0, 5, 10, 15, 1, 6, 11, 16, 2, 7, 12, 17, 20, 23, 26, 21, 24, 27, 3, 8, 13, 18, 22, 25, 28, 4, 9, 14, 19]], ["FSP", 7, 0, 1, 3], ["FSP", 7, 4, 2, 3], ["FSP", 7, 8, 3, 3], ["FSP", 7, 12, 4, 3], ["RE", 7, [0, 4, 8, 12, 1, 5, 9, 13, 2, 6, 10, 14, 3, 7, 11, 15]], ["CA", 3, 7, 11], ["CHR", 2, "shared", [3]], ["CA", 3, 4, 14], ["CHR", 1, "shared", [4]], ["CA", 2, 5, 14], ["CI", 1], ["FU", 9, [0, 1, 2, 3]], ["AN", 9, 0, 5], ["FU", 9, [1, 2, 3, 4]], ["AN", 9, 1, 4], ["FU", 9, [2, 3, 4, 5]], ["AN", 9, 2, 6], ["FU", 4, [0, 1, 2, 3]], ["SP", 4, 0, 16, [1], 1], ["AN", 4, 1, 2], ["FFSP", 4, 0, [4, 3, 2, 1], 1, 1], ["AN", 4, 1, 6], ["FU", 2, [0, 1, 2, 3]], ["SP", 2, 0, 32, [16], 1], ["AN", 2, 1, 2], ["FFSP", 2, 0, [4, 3, 2, 1], 1, 1], ["AN", 2, 1, 6], ["PR", 5, 0, "auto_unroll_max_step$16"]]]], "r": [[5.31665e-05, 5.31622e-05, 5.31439e-05, 5.31438e-05], 0, 3.3454, 1669784480], "v": "v0.6"}
{"i": [["[\"a7de7210b6587109a1ca064f9b471c63\", [32, 8, 32, 32], [8, 8, 3, 3], [1, 8, 1, 1], [32, 8, 32, 32], [32, 8, 32, 32]]", "cuda -keys=cuda,gpu -arch=sm_80 -max_num_threads=1024 -thread_warp_size=32", [-1, 16, 64, 49152, 2147483647, 1024, 8, 32], "", 0, []], [[], [["CI", 5], ["SP", 3, 0, 32, [1, 8, 4, 1], 1], ["SP", 3, 5, 8, [1, 1, 2, 1], 1], ["SP", 3, 10, 32, [2, 1, 2, 2], 1], ["SP", 3, 15, 32, [1, 4, 8, 1], 1], ["SP", 3, 20, 8, [1, 1], 1], ["SP", 3, 23, 3, [3, 1], 1], ["SP", 3, 26, 3, [3, 1], 1], ["RE", 3, [0, 5, 10, 15, 1, 6, 11, 16, 2, 7, 12, 17, 20, 23, 26, 21, 24, 27, 3, 8, 13, 18, 22, 25, 28, 4, 9, 14, 19]], ["FSP", 7, 0, 1, 3], ["FSP", 7, 4, 2, 3], ["FSP", 7, 8, 3, 3], ["FSP", 7, 12, 4, 3], ["RE", 7, [0, 4, 8, 12, 1, 5, 9, 13, 2, 6, 10, 14, 3, 7, 11, 15]], ["CA", 3, 7, 11], ["CHR", 2, "shared", [3]], ["CA", 3, 4, 14], ["CHR", 1, "shared", [4]], ["CA", 2, 5, 14], ["CI", 1], ["FU", 9, [0, 1, 2, 3]], ["AN", 9, 0, 5], ["FU", 9, [1, 2, 3, 4]], ["AN", 9, 1, 4], ["FU", 9, [2, 3, 4, 5]], ["AN", 9, 2, 6], ["FU", 4, [0, 1, 2, 3]], ["SP", 4, 0, 6, [1], 1], ["AN", 4, 1, 2], ["FFSP", 4, 0, [4, 3, 2, 1], 1, 1], ["AN", 4, 1, 6], ["FU", 2, [0, 1, 2, 3]], ["SP", 2, 0, 192, [1], 1], ["AN", 2, 1, 2], ["FFSP", 2, 0, [4, 3, 2, 1], 1, 1], ["AN", 2, 1, 6], ["PR", 5, 0, "auto_unroll_max_step$512"]]]], "r": [[0.000416265, 0.000416229, 0.000416254, 0.000416266], 0, 10.6202, 1669784482], "v": "v0.6"}
{"i": [["[\"a7de7210b6587109a1ca064f9b471c63\", [32, 8, 32, 32], [8, 8, 3, 3], [1, 8, 1, 1], [32, 8, 32, 32], [32, 8, 32, 32]]", "cuda -keys=cuda,gpu -arch=sm_80 -max_num_threads=1024 -thread_warp_size=32", [-1, 16, 64, 49152, 2147483647, 1024, 8, 32], "", 0, []], [[], [["CI", 5], ["SP", 3, 0, 32, [2, 1, 1, 2], 1], ["SP", 3, 5, 8, [1, 1, 1, 8], 1], ["SP", 3, 10, 32, [1, 16, 1, 1], 1], ["SP", 3, 15, 32, [4, 2, 1, 1], 1], ["SP", 3, 20, 8, [8, 1], 1], ["SP", 3, 23, 3, [3, 1], 1], ["SP", 3, 26, 3, [3, 1], 1], ["RE", 3, [0, 5, 10, 15, 1, 6, 11, 16, 2, 7, 12, 17, 20, 23, 26, 21, 24, 27, 3, 8, 13, 18, 22, 25, 28, 4, 9, 14, 19]], ["FSP", 7, 0, 1, 3], ["FSP", 7, 4, 2, 3], ["FSP", 7, 8, 3, 3], ["FSP", 7, 12, 4, 3], ["RE", 7, [0, 4, 8, 12, 1, 5, 9, 13, 2, 6, 10, 14, 3, 7, 11, 15]], ["CA", 3, 7, 11], ["CHR", 2, "shared", [3]], ["CA", 3, 4, 14], ["CHR", 1, "shared", [4]], ["CA", 2, 5, 14], ["CI", 1], ["FU", 9, [0, 1, 2, 3]], ["AN", 9, 0, 5], ["FU", 9, [1, 2, 3, 4]], ["AN", 9, 1, 4], ["FU", 9, [2, 3, 4, 5]], ["AN", 9, 2, 6], ["FU", 4, [0, 1, 2, 3]], ["SP", 4, 0, 192, [1], 1], ["AN", 4, 1, 2], ["FFSP", 4, 0, [4, 3, 2, 1], 1, 1], ["AN", 4, 1, 6], ["FU", 2, [0, 1, 2, 3]], ["SP", 2, 0, 48, [1], 1], ["AN", 2, 1, 2], ["FFSP", 2, 0, [4, 3, 2, 1], 1, 1], ["AN", 2, 1, 6], ["PR", 5, 0, "auto_unroll_max_step$16"]]]], "r": [[7.26827e-05, 7.26793e-05, 7.26855e-05, 7.26851e-05], 0, 3.41044, 1669784485], "v": "v0.6"}
{"i": [["[\"a7de7210b6587109a1ca064f9b471c63\", [32, 8, 32, 32], [8, 8, 3, 3], [1, 8, 1, 1], [32, 8, 32, 32], [32, 8, 32, 32]]", "cuda -keys=cuda,gpu -arch=sm_80 -max_num_threads=1024 -thread_warp_size=32", [-1, 16, 64, 49152, 2147483647, 1024, 8, 32], "", 0, []], [[], [["CI", 5], ["SP", 3, 0, 32, [1, 1, 1, 4], 1], ["SP", 3, 5, 8, [1, 2, 2, 1], 1], ["SP", 3, 10, 32, [2, 4, 1, 1], 1], ["SP", 3, 15, 32, [1, 4, 2, 2], 1], ["SP", 3, 20, 8, [1, 1], 1], ["SP", 3, 23, 3, [1, 3], 1], ["SP", 3, 26, 3, [1, 3], 1], ["RE", 3, [0, 5, 10, 15, 1, 6, 11, 16, 2, 7, 12, 17, 20, 23, 26, 21, 24, 27, 3, 8, 13, 18, 22, 25, 28, 4, 9, 14, 19]], ["FSP", 7, 0, 1, 3], ["FSP", 7, 4, 2, 3], ["FSP", 7, 8, 3, 3], ["FSP", 7, 12, 4, 3], ["RE", 7, [0, 4, 8, 12, 1, 5, 9, 13, 2, 6, 10, 14, 3, 7, 11, 15]], ["CA", 3, 7, 11], ["CHR", 2, "shared", [3]], ["CA", 3, 4, 14], ["CHR", 1, "shared", [4]], ["CA", 2, 5, 14], ["CI", 1], ["FU", 9, [0, 1, 2, 3]], ["AN", 9, 0, 5], ["FU", 9, [1, 2, 3, 4]], ["AN", 9, 1, 4], ["FU", 9, [2, 3, 4, 5]], ["AN", 9, 2, 6], ["FU", 4, [0, 1, 2, 3]], ["SP", 4, 0, 18, [6], 1], ["AN", 4, 1, 2], ["FFSP", 4, 0, [4, 3, 2, 1], 1, 1], ["AN", 4, 1, 6], ["FU", 2, [0, 1, 2, 3]], ["SP", 2, 0, 72, [2], 1], ["AN", 2, 1, 2], ["FFSP", 2, 0, [4, 3, 2, 1], 1, 1], ["AN", 2, 1, 6], ["PR", 5, 0, "auto_unroll_max_step$512"]]]], "r": [[1.93047e-05, 1.92718e-05, 1.93178e-05, 1.93428e-05], 0, 4.0372, 1669784488], "v": "v0.6"}
{"i": [["[\"a7de7210b6587109a1ca064f9b471c63\", [32, 8, 32, 32], [8, 8, 3, 3], [1, 8, 1, 1], [32, 8, 32, 32], [32, 8, 32, 32]]", "cuda -keys=cuda,gpu -arch=sm_80 -max_num_threads=1024 -thread_warp_size=32", [-1, 16, 64, 49152, 2147483647, 1024, 8, 32], "", 0, []], [[], [["CI", 5], ["SP", 3, 0, 32, [1, 2, 2, 2], 1], ["SP", 3, 5, 8, [2, 1, 2, 1], 1], ["SP", 3, 10, 32, [4, 2, 4, 1], 1], ["SP", 3, 15, 32, [1, 8, 1, 1], 1], ["SP", 3, 20, 8, [1, 2], 1], ["SP", 3, 23, 3, [1, 3], 1], ["SP", 3, 26, 3, [1, 1], 1], ["RE", 3, [0, 5, 10, 15, 1, 6, 11, 16, 2, 7, 12, 17, 20, 23, 26, 21, 24, 27, 3, 8, 13, 18, 22, 25, 28, 4, 9, 14, 19]], ["FSP", 7, 0, 1, 3], ["FSP", 7, 4, 2, 3], ["FSP", 7, 8, 3, 3], ["FSP", 7, 12, 4, 3], ["RE", 7, [0, 4, 8, 12, 1, 5, 9, 13, 2, 6, 10, 14, 3, 7, 11, 15]], ["CA", 3, 7, 11], ["CHR", 2, "shared", [3]], ["CA", 3, 4, 14], ["CHR", 1, "shared", [4]], ["CA", 2, 5, 14], ["CI", 1], ["FU", 9, [0, 1, 2, 3]], ["AN", 9, 0, 5], ["FU", 9, [1, 2, 3, 4]], ["AN", 9, 1, 4], ["FU", 9, [2, 3, 4, 5]], ["AN", 9, 2, 6], ["FU", 4, [0, 1, 2, 3]], ["SP", 4, 0, 4, [1], 1], ["AN", 4, 1, 2], ["FFSP", 4, 0, [4, 3, 2, 1], 1, 1], ["AN", 4, 1, 6], ["FU", 2, [0, 1, 2, 3]], ["SP", 2, 0, 32, [1], 1], ["AN", 2, 1, 2], ["FFSP", 2, 0, [4, 3, 2, 1], 1, 1], ["AN", 2, 1, 6], ["PR", 5, 0, "auto_unroll_max_step$0"]]]], "r": [[0.000235797, 0.000235555, 0.000235562, 0.000235554], 0, 3.51662, 1669784490], "v": "v0.6"}
{"i": [["[\"a7de7210b6587109a1ca064f9b471c63\", [32, 8, 32, 32], [8, 8, 3, 3], [1, 8, 1, 1], [32, 8, 32, 32], [32, 8, 32, 32]]", "cuda -keys=cuda,gpu -arch=sm_80 -max_num_threads=1024 -thread_warp_size=32", [-1, 16, 64, 49152, 2147483647, 1024, 8, 32], "", 0, []], [[], [["CI", 5], ["SP", 3, 0, 32, [1, 8, 2, 2], 1], ["SP", 3, 5, 8, [1, 2, 2, 2], 1], ["SP", 3, 10, 32, [1, 1, 8, 1], 1], ["SP", 3, 15, 32, [1, 4, 1, 1], 1], ["SP", 3, 20, 8, [2, 2], 1], ["SP", 3, 23, 3, [1, 3], 1], ["SP", 3, 26, 3, [1, 1], 1], ["RE", 3, [0, 5, 10, 15, 1, 6, 11, 16, 2, 7, 12, 17, 20, 23, 26, 21, 24, 27, 3, 8, 13, 18, 22, 25, 28, 4, 9, 14, 19]], ["FSP", 7, 0, 1, 3], ["FSP", 7, 4, 2, 3], ["FSP", 7, 8, 3, 3], ["FSP", 7, 12, 4, 3], ["RE", 7, [0, 4, 8, 12, 1, 5, 9, 13, 2, 6, 10, 14, 3, 7, 11, 15]], ["CA", 3, 7, 11], ["CHR", 2, "shared", [3]], ["CA", 3, 4, 14], ["CHR", 1, "shared", [4]], ["CA", 2, 5, 14], ["CI", 1], ["FU", 9, [0, 1, 2, 3]], ["AN", 9, 0, 5], ["FU", 9, [1, 2, 3, 4]], ["AN", 9, 1, 4], ["FU", 9, [2, 3, 4, 5]], ["AN", 9, 2, 6], ["FU", 4, [0, 1, 2, 3]], ["SP", 4, 0, 16, [1], 1], ["AN", 4, 1, 2], ["FFSP", 4, 0, [4, 3, 2, 1], 1, 1], ["AN", 4, 1, 6], ["FU", 2, [0, 1, 2, 3]], ["SP", 2, 0, 128, [1], 1], ["AN", 2, 1, 2], ["FFSP", 2, 0, [4, 3, 2, 1], 1, 1], ["AN", 2, 1, 6], ["PR", 5, 0, "auto_unroll_max_step$64"]]]], "r": [[0.000128938, 0.000128944, 0.000128945, 0.000129027], 0, 3.6528, 1669784493], "v": "v0.6"}
{"i": [["[\"a7de7210b6587109a1ca064f9b471c63\", [32, 8, 32, 32], [8, 8, 3, 3], [1, 8, 1, 1], [32, 8, 32, 32], [32, 8, 32, 32]]", "cuda -keys=cuda,gpu -arch=sm_80 -max_num_threads=1024 -thread_warp_size=32", [-1, 16, 64, 49152, 2147483647, 1024, 8, 32], "", 0, []], [[], [["CI", 5], ["SP", 3, 0, 32, [1, 1, 4, 1], 1], ["SP", 3, 5, 8, [1, 2, 1, 1], 1], ["SP", 3, 10, 32, [1, 8, 4, 1], 1], ["SP", 3, 15, 32, [2, 4, 2, 1], 1], ["SP", 3, 20, 8, [2, 2], 1], ["SP", 3, 23, 3, [3, 1], 1], ["SP", 3, 26, 3, [1, 3], 1], ["RE", 3, [0, 5, 10, 15, 1, 6, 11, 16, 2, 7, 12, 17, 20, 23, 26, 21, 24, 27, 3, 8, 13, 18, 22, 25, 28, 4, 9, 14, 19]], ["FSP", 7, 0, 1, 3], ["FSP", 7, 4, 2, 3], ["FSP", 7, 8, 3, 3], ["FSP", 7, 12, 4, 3], ["RE", 7, [0, 4, 8, 12, 1, 5, 9, 13, 2, 6, 10, 14, 3, 7, 11, 15]], ["CA", 3, 7, 11], ["CHR", 2, "shared", [3]], ["CA", 3, 4, 14], ["CHR", 1, "shared", [4]], ["CA", 2, 5, 14], ["CI", 1], ["FU", 9, [0, 1, 2, 3]], ["AN", 9, 0, 5], ["FU", 9, [1, 2, 3, 4]], ["AN", 9, 1, 4], ["FU", 9, [2, 3, 4, 5]], ["AN", 9, 2, 6], ["FU", 4, [0, 1, 2, 3]], ["SP", 4, 0, 36, [1], 1], ["AN", 4, 1, 2], ["FFSP", 4, 0, [4, 3, 2, 1], 1, 1], ["AN", 4, 1, 6], ["FU", 2, [0, 1, 2, 3]], ["SP", 2, 0, 256, [1], 1], ["AN", 2, 1, 2], ["FFSP", 2, 0, [4, 3, 2, 1], 1, 1], ["AN", 2, 1, 6], ["PR", 5, 0, "auto_unroll_max_step$1024"]]]], "r": [[3.10876e-05, 3.1067e-05, 3.10866e-05, 3.10675e-05], 0, 6.12747, 1669784496], "v": "v0.6"}
{"i": [["[\"a7de7210b6587109a1ca064f9b471c63\", [32, 8, 32, 32], [8, 8, 3, 3], [1, 8, 1, 1], [32, 8, 32, 32], [32, 8, 32, 32]]", "cuda -keys=cuda,gpu -arch=sm_80 -max_num_threads=1024 -thread_warp_size=32", [-1, 16, 64, 49152, 2147483647, 1024, 8, 32], "", 0, []], [[], [["CI", 5], ["SP", 3, 0, 32, [1, 1, 1, 4], 1], ["SP", 3, 5, 8, [1, 2, 2, 1], 1], ["SP", 3, 10, 32, [8, 4, 1, 1], 1], ["SP", 3, 15, 32, [1, 4, 2, 2], 1], ["SP", 3, 20, 8, [1, 1], 1], ["SP", 3, 23, 3, [1, 3], 1], ["SP", 3, 26, 3, [1, 3], 1], ["RE", 3, [0, 5, 10, 15, 1, 6, 11, 16, 2, 7, 12, 17, 20, 23, 26, 21, 24, 27, 3, 8, 13, 18, 22, 25, 28, 4, 9, 14, 19]], ["FSP", 7, 0, 1, 3], ["FSP", 7, 4, 2, 3], ["FSP", 7, 8, 3, 3], ["FSP", 7, 12, 4, 3], ["RE", 7, [0, 4, 8, 12, 1, 5, 9, 13, 2, 6, 10, 14, 3, 7, 11, 15]], ["CA", 3, 7, 11], ["CHR", 2, "shared", [3]], ["CA", 3, 4, 14], ["CHR", 1, "shared", [4]], ["CA", 2, 5, 14], ["CI", 1], ["FU", 9, [0, 1, 2, 3]], ["AN", 9, 0, 5], ["FU", 9, [1, 2, 3, 4]], ["AN", 9, 1, 4], ["FU", 9, [2, 3, 4, 5]], ["AN", 9, 2, 6], ["FU", 4, [0, 1, 2, 3]], ["SP", 4, 0, 18, [1], 1], ["AN", 4, 1, 2], ["FFSP", 4, 0, [4, 3, 2, 1], 1, 1], ["AN", 4, 1, 6], ["FU", 2, [0, 1, 2, 3]], ["SP", 2, 0, 72, [9], 1], ["AN", 2, 1, 2], ["FFSP", 2, 0, [4, 3, 2, 1], 1, 1], ["AN", 2, 1, 6], ["PR", 5, 0, "auto_unroll_max_step$512"]]]], "r": [[7.81798e-05, 7.81781e-05, 7.81793e-05, 7.81155e-05], 0, 4.94802, 1669784498], "v": "v0.6"}
{"i": [["[\"a7de7210b6587109a1ca064f9b471c63\", [32, 8, 32, 32], [8, 8, 3, 3], [1, 8, 1, 1], [32, 8, 32, 32], [32, 8, 32, 32]]", "cuda -keys=cuda,gpu -arch=sm_80 -max_num_threads=1024 -thread_warp_size=32", [-1, 16, 64, 49152, 2147483647, 1024, 8, 32], "", 0, []], [[], [["CI", 5], ["SP", 3, 0, 32, [1, 2, 8, 2], 1], ["SP", 3, 5, 8, [1, 4, 2, 1], 1], ["SP", 3, 10, 32, [8, 2, 1, 1], 1], ["SP", 3, 15, 32, [1, 1, 2, 4], 1], ["SP", 3, 20, 8, [1, 2], 1], ["SP", 3, 23, 3, [3, 1], 1], ["SP", 3, 26, 3, [3, 1], 1], ["RE", 3, [0, 5, 10, 15, 1, 6, 11, 16, 2, 7, 12, 17, 20, 23, 26, 21, 24, 27, 3, 8, 13, 18, 22, 25, 28, 4, 9, 14, 19]], ["FSP", 7, 0, 1, 3], ["FSP", 7, 4, 2, 3], ["FSP", 7, 8, 3, 3], ["FSP", 7, 12, 4, 3], ["RE", 7, [0, 4, 8, 12, 1, 5, 9, 13, 2, 6, 10, 14, 3, 7, 11, 15]], ["CA", 3, 7, 11], ["CHR", 2, "shared", [3]], ["CA", 3, 4, 14], ["CHR", 1, "shared", [4]], ["CA", 2, 5, 14], ["CI", 1], ["FU", 9, [0, 1, 2, 3]], ["AN", 9, 0, 5], ["FU", 9, [1, 2, 3, 4]], ["AN", 9, 1, 4], ["FU", 9, [2, 3, 4, 5]], ["AN", 9, 2, 6], ["FU", 4, [0, 1, 2, 3]], ["SP", 4, 0, 12, [1], 1], ["AN", 4, 1, 2], ["FFSP", 4, 0, [4, 3, 2, 1], 1, 1], ["AN", 4, 1, 6], ["FU", 2, [0, 1, 2, 3]], ["SP", 2, 0, 320, [1], 1], ["AN", 2, 1, 2], ["FFSP", 2, 0, [4, 3, 2, 1], 1, 1], ["AN", 2, 1, 6], ["PR", 5, 0, "auto_unroll_max_step$16"]]]], "r": [[0.00256973, 0.00257023, 0.00257007, 0.00257026], 0, 3.42184, 1669784500], "v": "v0.6"}
{"i": [["[\"a7de7210b6587109a1ca064f9b471c63\", [32, 8, 32, 32], [8, 8, 3, 3], [1, 8, 1, 1], [32, 8, 32, 32], [32, 8, 32, 32]]", "cuda -keys=cuda,gpu -arch=sm_80 -max_num_threads=1024 -thread_warp_size=32", [-1, 16, 64, 49152, 2147483647, 1024, 8, 32], "", 0, []], [[], [["CI", 5], ["SP", 3, 0, 32, [1, 2, 2, 4], 1], ["SP", 3, 5, 8, [1, 2, 1, 1], 1], ["SP", 3, 10, 32, [1, 8, 2, 2], 1], ["SP", 3, 15, 32, [1, 1, 1, 2], 1], ["SP", 3, 20, 8, [1, 2], 1], ["SP", 3, 23, 3, [3, 1], 1], ["SP", 3, 26, 3, [1, 1], 1], ["RE", 3, [0, 5, 10, 15, 1, 6, 11, 16, 2, 7, 12, 17, 20, 23, 26, 21, 24, 27, 3, 8, 13, 18, 22, 25, 28, 4, 9, 14, 19]], ["FSP", 7, 0, 1, 3], ["FSP", 7, 4, 2, 3], ["FSP", 7, 8, 3, 3], ["FSP", 7, 12, 4, 3], ["RE", 7, [0, 4, 8, 12, 1, 5, 9, 13, 2, 6, 10, 14, 3, 7, 11, 15]], ["CA", 3, 7, 11], ["CHR", 2, "shared", [3]], ["CA", 3, 4, 14], ["CHR", 1, "shared", [4]], ["CA", 2, 5, 14], ["CI", 1], ["FU", 9, [0, 1, 2, 3]], ["AN", 9, 0, 5], ["FU", 9, [1, 2, 3, 4]], ["AN", 9, 1, 4], ["FU", 9, [2, 3, 4, 5]], ["AN", 9, 2, 6], ["FU", 4, [0, 1, 2, 3]], ["SP", 4, 0, 24, [1], 1], ["AN", 4, 1, 2], ["FFSP", 4, 0, [4, 3, 2, 1], 1, 1], ["AN", 4, 1, 6], ["FU", 2, [0, 1, 2, 3]], ["SP", 2, 0, 512, [1], 1], ["AN", 2, 1, 2], ["FFSP", 2, 0, [4, 3, 2, 1], 1, 1], ["AN", 2, 1, 6], ["PR", 5, 0, "auto_unroll_max_step$1024"]]]], "r": [[4.97959e-05, 4.98677e-05, 4.99222e-05, 4.99154e-05], 0, 4.75868, 1669784503], "v": "v0.6"}
{"i": [["[\"a7de7210b6587109a1ca064f9b471c63\", [32, 8, 32, 32], [8, 8, 3, 3], [1, 8, 1, 1], [32, 8, 32, 32], [32, 8, 32, 32]]", "cuda -keys=cuda,gpu -arch=sm_80 -max_num_threads=1024 -thread_warp_size=32", [-1, 16, 64, 49152, 2147483647, 1024, 8, 32], "", 0, []], [[], [["CI", 5], ["SP", 3, 0, 32, [4, 2, 1, 1], 1], ["SP", 3, 5, 8, [1, 1, 2, 2], 1], ["SP", 3, 10, 32, [1, 1, 2, 1], 1], ["SP", 3, 15, 32, [1, 1, 1, 16], 1], ["SP", 3, 20, 8, [2, 4], 1], ["SP", 3, 23, 3, [1, 3], 1], ["SP", 3, 26, 3, [1, 3], 1], ["RE", 3, [0, 5, 10, 15, 1, 6, 11, 16, 2, 7, 12, 17, 20, 23, 26, 21, 24, 27, 3, 8, 13, 18, 22, 25, 28, 4, 9, 14, 19]], ["FSP", 7, 0, 1, 3], ["FSP", 7, 4, 2, 3], ["FSP", 7, 8, 3, 3], ["FSP", 7, 12, 4, 3], ["RE", 7, [0, 4, 8, 12, 1, 5, 9, 13, 2, 6, 10, 14, 3, 7, 11, 15]], ["CA", 3, 7, 11], ["CHR", 2, "shared", [3]], ["CA", 3, 4, 14], ["CHR", 1, "shared", [4]], ["CA", 2, 5, 14], ["CI", 1], ["FU", 9, [0, 1, 2, 3]], ["AN", 9, 0, 5], ["FU", 9, [1, 2, 3, 4]], ["AN", 9, 1, 4], ["FU", 9, [2, 3, 4, 5]], ["AN", 9, 2, 6], ["FU", 4, [0, 1, 2, 3]], ["SP", 4, 0, 96, [1], 1], ["AN", 4, 1, 2], ["FFSP", 4, 0, [4, 3, 2, 1], 1, 1], ["AN", 4, 1, 6], ["FU", 2, [0, 1, 2, 3]], ["SP", 2, 0, 48, [1], 1], ["AN", 2, 1, 2], ["FFSP", 2, 0, [4, 3, 2, 1], 1, 1], ["AN", 2, 1, 6], ["PR", 5, 0, "auto_unroll_max_step$0"]]]], "r": [[0.000439892, 0.000440005, 0.00044018, 0.000440284], 0, 4.42199, 1669784506], "v": "v0.6"}
{"i": [["[\"a7de7210b6587109a1ca064f9b471c63\", [32, 8, 32, 32], [8, 8, 3, 3], [1, 8, 1, 1], [32, 8, 32, 32], [32, 8, 32, 32]]", "cuda -keys=cuda,gpu -arch=sm_80 -max_num_threads=1024 -thread_warp_size=32", [-1, 16, 64, 49152, 2147483647, 1024, 8, 32], "", 0, []], [[], [["CI", 5], ["SP", 3, 0, 32, [1, 1, 1, 4], 1], ["SP", 3, 5, 8, [1, 2, 2, 1], 1], ["SP", 3, 10, 32, [8, 1, 1, 1], 1], ["SP", 3, 15, 32, [1, 4, 2, 2], 1], ["SP", 3, 20, 8, [1, 1], 1], ["SP", 3, 23, 3, [1, 3], 1], ["SP", 3, 26, 3, [3, 1], 1], ["RE", 3, [0, 5, 10, 15, 1, 6, 11, 16, 2, 7, 12, 17, 20, 23, 26, 21, 24, 27, 3, 8, 13, 18, 22, 25, 28, 4, 9, 14, 19]], ["FSP", 7, 0, 1, 3], ["FSP", 7, 4, 2, 3], ["FSP", 7, 8, 3, 3], ["FSP", 7, 12, 4, 3], ["RE", 7, [0, 4, 8, 12, 1, 5, 9, 13, 2, 6, 10, 14, 3, 7, 11, 15]], ["CA", 3, 7, 11], ["CHR", 2, "shared", [3]], ["CA", 3, 4, 14], ["CHR", 1, "shared", [4]], ["CA", 2, 5, 14], ["CI", 1], ["FU", 9, [0, 1, 2, 3]], ["AN", 9, 0, 5], ["FU", 9, [1, 2, 3, 4]], ["AN", 9, 1, 4], ["FU", 9, [2, 3, 4, 5]], ["AN", 9, 2, 6], ["FU", 4, [0, 1, 2, 3]], ["SP", 4, 0, 18, [1], 1], ["AN", 4, 1, 2], ["FFSP", 4, 0, [4, 3, 2, 1], 1, 1], ["AN", 4, 1, 6], ["FU", 2, [0, 1, 2, 3]], ["SP", 2, 0, 72, [6], 1], ["AN", 2, 1, 2], ["FFSP", 2, 0, [4, 3, 2, 1], 1, 1], ["AN", 2, 1, 6], ["PR", 5, 0, "auto_unroll_max_step$512"]]]], "r": [[7.9238e-05, 7.9243e-05, 7.92659e-05, 7.9302e-05], 0, 6.00673, 1669784508], "v": "v0.6"}
{"i": [["[\"a7de7210b6587109a1ca064f9b471c63\", [32, 8, 32, 32], [8, 8, 3, 3], [1, 8, 1, 1], [32, 8, 32, 32], [32, 8, 32, 32]]", "cuda -keys=cuda,gpu -arch=sm_80 -max_num_threads=1024 -thread_warp_size=32", [-1, 16, 64, 49152, 2147483647, 1024, 8, 32], "", 0, []], [[], [["CI", 5], ["SP", 3, 0, 32, [1, 2, 2, 2], 1], ["SP", 3, 5, 8, [1, 2, 2, 2], 1], ["SP", 3, 10, 32, [2, 2, 2, 1], 1], ["SP", 3, 15, 32, [2, 4, 1, 1], 1], ["SP", 3, 20, 8, [4, 2], 1], ["SP", 3, 23, 3, [3, 1], 1], ["SP", 3, 26, 3, [1, 3], 1], ["RE", 3, [0, 5, 10, 15, 1, 6, 11, 16, 2, 7, 12, 17, 20, 23, 26, 21, 24, 27, 3, 8, 13, 18, 22, 25, 28, 4, 9, 14, 19]], ["FSP", 7, 0, 1, 3], ["FSP", 7, 4, 2, 3], ["FSP", 7, 8, 3, 3], ["FSP", 7, 12, 4, 3], ["RE", 7, [0, 4, 8, 12, 1, 5, 9, 13, 2, 6, 10, 14, 3, 7, 11, 15]], ["CA", 3, 7, 11], ["CHR", 2, "shared", [3]], ["CA", 3, 4, 14], ["CHR", 1, "shared", [4]], ["CA", 2, 5, 14], ["CI", 1], ["FU", 9, [0, 1, 2, 3]], ["AN", 9, 0, 5], ["FU", 9, [1, 2, 3, 4]], ["AN", 9, 1, 4], ["FU", 9, [2, 3, 4, 5]], ["AN", 9, 2, 6], ["FU", 4, [0, 1, 2, 3]], ["SP", 4, 0, 288, [1], 1], ["AN", 4, 1, 2], ["FFSP", 4, 0, [4, 3, 2, 1], 1, 1], ["AN", 4, 1, 6], ["FU", 2, [0, 1, 2, 3]], ["SP", 2, 0, 384, [1], 1], ["AN", 2, 1, 2], ["FFSP", 2, 0, [4, 3, 2, 1], 1, 1], ["AN", 2, 1, 6], ["PR", 5, 0, "auto_unroll_max_step$16"]]]], "r": [[8.47411e-05, 8.47383e-05, 8.47345e-05, 8.47384e-05], 0, 3.86702, 1669784511], "v": "v0.6"}
{"i": [["[\"a7de7210b6587109a1ca064f9b471c63\", [32, 8, 32, 32], [8, 8, 3, 3], [1, 8, 1, 1], [32, 8, 32, 32], [32, 8, 32, 32]]", "cuda -keys=cuda,gpu -arch=sm_80 -max_num_threads=1024 -thread_warp_size=32", [-1, 16, 64, 49152, 2147483647, 1024, 8, 32], "", 0, []], [[], [["CI", 5], ["SP", 3, 0, 32, [1, 1, 4, 4], 1], ["SP", 3, 5, 8, [1, 8, 1, 1], 1], ["SP", 3, 10, 32, [1, 1, 1, 1], 1], ["SP", 3, 15, 32, [4, 8, 1, 1], 1], ["SP", 3, 20, 8, [1, 4], 1], ["SP", 3, 23, 3, [1, 1], 1], ["SP", 3, 26, 3, [1, 3], 1], ["RE", 3, [0, 5, 10, 15, 1, 6, 11, 16, 2, 7, 12, 17, 20, 23, 26, 21, 24, 27, 3, 8, 13, 18, 22, 25, 28, 4, 9, 14, 19]], ["FSP", 7, 0, 1, 3], ["FSP", 7, 4, 2, 3], ["FSP", 7, 8, 3, 3], ["FSP", 7, 12, 4, 3], ["RE", 7, [0, 4, 8, 12, 1, 5, 9, 13, 2, 6, 10, 14, 3, 7, 11, 15]], ["CA", 3, 7, 11], ["CHR", 2, "shared", [3]], ["CA", 3, 4, 14], ["CHR", 1, "shared", [4]], ["CA", 2, 5, 14], ["CI", 1], ["FU", 9, [0, 1, 2, 3]], ["AN", 9, 0, 5], ["FU", 9, [1, 2, 3, 4]], ["AN", 9, 1, 4], ["FU", 9, [2, 3, 4, 5]], ["AN", 9, 2, 6], ["FU", 4, [0, 1, 2, 3]], ["SP", 4, 0, 12, [3], 1], ["AN", 4, 1, 2], ["FFSP", 4, 0, [4, 3, 2, 1], 1, 1], ["AN", 4, 1, 6], ["FU", 2, [0, 1, 2, 3]], ["SP", 2, 0, 192, [1], 1], ["AN", 2, 1, 2], ["FFSP", 2, 0, [4, 3, 2, 1], 1, 1], ["AN", 2, 1, 6], ["PR", 5, 0, "auto_unroll_max_step$1024"]]]], "r": [[5.15835e-05, 5.15865e-05, 5.15875e-05, 5.16259e-05], 0, 5.73156, 1669784514], "v": "v0.6"}
{"i": [["[\"a7de7210b6587109a1ca064f9b471c63\", [32, 8, 32, 32], [8, 8, 3, 3], [1, 8, 1, 1], [32, 8, 32, 32], [32, 8, 32, 32]]", "cuda -keys=cuda,gpu -arch=sm_80 -max_num_threads=1024 -thread_warp_size=32", [-1, 16, 64, 49152, 2147483647, 1024, 8, 32], "", 0, []], [[], [["CI", 5], ["SP", 3, 0, 32, [2, 16, 1, 1], 1], ["SP", 3, 5, 8, [2, 1, 4, 1], 1], ["SP", 3, 10, 32, [2, 1, 1, 1], 1], ["SP", 3, 15, 32, [1, 4, 2, 1], 1], ["SP", 3, 20, 8, [1, 2], 1], ["SP", 3, 23, 3, [1, 3], 1], ["SP", 3, 26, 3, [1, 3], 1], ["RE", 3, [0, 5, 10, 15, 1, 6, 11, 16, 2, 7, 12, 17, 20, 23, 26, 21, 24, 27, 3, 8, 13, 18, 22, 25, 28, 4, 9, 14, 19]], ["FSP", 7, 0, 1, 3], ["FSP", 7, 4, 2, 3], ["FSP", 7, 8, 3, 3], ["FSP", 7, 12, 4, 3], ["RE", 7, [0, 4, 8, 12, 1, 5, 9, 13, 2, 6, 10, 14, 3, 7, 11, 15]], ["CA", 3, 7, 11], ["CHR", 2, "shared", [3]], ["CA", 3, 4, 14], ["CHR", 1, "shared", [4]], ["CA", 2, 5, 14], ["CI", 1], ["FU", 9, [0, 1, 2, 3]], ["AN", 9, 0, 5], ["FU", 9, [1, 2, 3, 4]], ["AN", 9, 1, 4], ["FU", 9, [2, 3, 4, 5]], ["AN", 9, 2, 6], ["FU", 4, [0, 1, 2, 3]], ["SP", 4, 0, 288, [1], 1], ["AN", 4, 1, 2], ["FFSP", 4, 0, [4, 3, 2, 1], 1, 1], ["AN", 4, 1, 6], ["FU", 2, [0, 1, 2, 3]], ["SP", 2, 0, 96, [1], 1], ["AN", 2, 1, 2], ["FFSP", 2, 0, [4, 3, 2, 1], 1, 1], ["AN", 2, 1, 6], ["PR", 5, 0, "auto_unroll_max_step$0"]]]], "r": [[6.88017e-05, 6.87661e-05, 6.877e-05, 6.87644e-05], 0, 3.34453, 1669784516], "v": "v0.6"}
{"i": [["[\"a7de7210b6587109a1ca064f9b471c63\", [32, 8, 32, 32], [8, 8, 3, 3], [1, 8, 1, 1], [32, 8, 32, 32], [32, 8, 32, 32]]", "cuda -keys=cuda,gpu -arch=sm_80 -max_num_threads=1024 -thread_warp_size=32", [-1, 16, 64, 49152, 2147483647, 1024, 8, 32], "", 0, []], [[], [["CI", 5], ["SP", 3, 0, 32, [1, 2, 8, 2], 1], ["SP", 3, 5, 8, [1, 4, 2, 1], 1], ["SP", 3, 10, 32, [4, 4, 1, 1], 1], ["SP", 3, 15, 32, [1, 1, 2, 4], 1], ["SP", 3, 20, 8, [1, 2], 1], ["SP", 3, 23, 3, [3, 1], 1], ["SP", 3, 26, 3, [3, 1], 1], ["RE", 3, [0, 5, 10, 15, 1, 6, 11, 16, 2, 7, 12, 17, 20, 23, 26, 21, 24, 27, 3, 8, 13, 18, 22, 25, 28, 4, 9, 14, 19]], ["FSP", 7, 0, 1, 3], ["FSP", 7, 4, 2, 3], ["FSP", 7, 8, 3, 3], ["FSP", 7, 12, 4, 3], ["RE", 7, [0, 4, 8, 12, 1, 5, 9, 13, 2, 6, 10, 14, 3, 7, 11, 15]], ["CA", 3, 7, 11], ["CHR", 2, "shared", [3]], ["CA", 3, 4, 14], ["CHR", 1, "shared", [4]], ["CA", 2, 5, 14], ["CI", 1], ["FU", 9, [0, 1, 2, 3]], ["AN", 9, 0, 5], ["FU", 9, [1, 2, 3, 4]], ["AN", 9, 1, 4], ["FU", 9, [2, 3, 4, 5]], ["AN", 9, 2, 6], ["FU", 4, [0, 1, 2, 3]], ["SP", 4, 0, 12, [1], 1], ["AN", 4, 1, 2], ["FFSP", 4, 0, [4, 3, 2, 1], 1, 1], ["AN", 4, 1, 6], ["FU", 2, [0, 1, 2, 3]], ["SP", 2, 0, 320, [1], 1], ["AN", 2, 1, 2], ["FFSP", 2, 0, [4, 3, 2, 1], 1, 1], ["AN", 2, 1, 6], ["PR", 5, 0, "auto_unroll_max_step$64"]]]], "r": [[0.000801049, 0.000801071, 0.000801055, 0.000801067], 0, 4.39149, 1669784519], "v": "v0.6"}
{"i": [["[\"a7de7210b6587109a1ca064f9b471c63\", [32, 8, 32, 32], [8, 8, 3, 3], [1, 8, 1, 1], [32, 8, 32, 32], [32, 8, 32, 32]]", "cuda -keys=cuda,gpu -arch=sm_80 -max_num_threads=1024 -thread_warp_size=32", [-1, 16, 64, 49152, 2147483647, 1024, 8, 32], "", 0, []], [[], [["CI", 5], ["SP", 3, 0, 32, [1, 4, 2, 1], 1], ["SP", 3, 5, 8, [1, 4, 1, 2], 1], ["SP", 3, 10, 32, [1, 4, 4, 2], 1], ["SP", 3, 15, 32, [1, 1, 1, 4], 1], ["SP", 3, 20, 8, [2, 2], 1], ["SP", 3, 23, 3, [1, 1], 1], ["SP", 3, 26, 3, [1, 3], 1], ["RE", 3, [0, 5, 10, 15, 1, 6, 11, 16, 2, 7, 12, 17, 20, 23, 26, 21, 24, 27, 3, 8, 13, 18, 22, 25, 28, 4, 9, 14, 19]], ["FSP", 7, 0, 1, 3], ["FSP", 7, 4, 2, 3], ["FSP", 7, 8, 3, 3], ["FSP", 7, 12, 4, 3], ["RE", 7, [0, 4, 8, 12, 1, 5, 9, 13, 2, 6, 10, 14, 3, 7, 11, 15]], ["CA", 3, 7, 11], ["CHR", 2, "shared", [3]], ["CA", 3, 4, 14], ["CHR", 1, "shared", [4]], ["CA", 2, 5, 14], ["CI", 1], ["FU", 9, [0, 1, 2, 3]], ["AN", 9, 0, 5], ["FU", 9, [1, 2, 3, 4]], ["AN", 9, 1, 4], ["FU", 9, [2, 3, 4, 5]], ["AN", 9, 2, 6], ["FU", 4, [0, 1, 2, 3]], ["SP", 4, 0, 8, [1], 1], ["AN", 4, 1, 2], ["FFSP", 4, 0, [4, 3, 2, 1], 1, 1], ["AN", 4, 1, 6], ["FU", 2, [0, 1, 2, 3]], ["SP", 2, 0, 128, [1], 1], ["AN", 2, 1, 2], ["FFSP", 2, 0, [4, 3, 2, 1], 1, 1], ["AN", 2, 1, 6], ["PR", 5, 0, "auto_unroll_max_step$0"]]]], "r": [[0.000228157, 0.000228145, 0.000228145, 0.00022814], 0, 3.44992, 1669784522], "v": "v0.6"}
{"i": [["[\"a7de7210b6587109a1ca064f9b471c63\", [32, 8, 32, 32], [8, 8, 3, 3], [1, 8, 1, 1], [32, 8, 32, 32], [32, 8, 32, 32]]", "cuda -keys=cuda,gpu -arch=sm_80 -max_num_threads=1024 -thread_warp_size=32", [-1, 16, 64, 49152, 2147483647, 1024, 8, 32], "", 0, []], [[], [["CI", 5], ["SP", 3, 0, 32, [1, 4, 2, 1], 1], ["SP", 3, 5, 8, [1, 4, 1, 2], 1], ["SP", 3, 10, 32, [1, 4, 4, 1], 1], ["SP", 3, 15, 32, [1, 1, 1, 4], 1], ["SP", 3, 20, 8, [1, 4], 1], ["SP", 3, 23, 3, [1, 1], 1], ["SP", 3, 26, 3, [1, 1], 1], ["RE", 3, [0, 5, 10, 15, 1, 6, 11, 16, 2, 7, 12, 17, 20, 23, 26, 21, 24, 27, 3, 8, 13, 18, 22, 25, 28, 4, 9, 14, 19]], ["FSP", 7, 0, 1, 3], ["FSP", 7, 4, 2, 3], ["FSP", 7, 8, 3, 3], ["FSP", 7, 12, 4, 3], ["RE", 7, [0, 4, 8, 12, 1, 5, 9, 13, 2, 6, 10, 14, 3, 7, 11, 15]], ["CA", 3, 7, 11], ["CHR", 2, "shared", [3]], ["CA", 3, 4, 14], ["CHR", 1, "shared", [4]], ["CA", 2, 5, 14], ["CI", 1], ["FU", 9, [0, 1, 2, 3]], ["AN", 9, 0, 5], ["FU", 9, [1, 2, 3, 4]], ["AN", 9, 1, 4], ["FU", 9, [2, 3, 4, 5]], ["AN", 9, 2, 6], ["FU", 4, [0, 1, 2, 3]], ["SP", 4, 0, 8, [1], 1], ["AN", 4, 1, 2], ["FFSP", 4, 0, [4, 3, 2, 1], 1, 1], ["AN", 4, 1, 6], ["FU", 2, [0, 1, 2, 3]], ["SP", 2, 0, 128, [1], 1], ["AN", 2, 1, 2], ["FFSP", 2, 0, [4, 3, 2, 1], 1, 1], ["AN", 2, 1, 6], ["PR", 5, 0, "auto_unroll_max_step$512"]]]], "r": [[0.00011259, 0.000112743, 0.000112576, 0.000112577], 0, 3.86065, 1669784525], "v": "v0.6"}
{"i": [["[\"a7de7210b6587109a1ca064f9b471c63\", [32, 8, 32, 32], [8, 8, 3, 3], [1, 8, 1, 1], [32, 8, 32, 32], [32, 8, 32, 32]]", "cuda -keys=cuda,gpu -arch=sm_80 -max_num_threads=1024 -thread_warp_size=32", [-1, 16, 64, 49152, 2147483647, 1024, 8, 32], "", 0, []], [[], [["CI", 5], ["SP", 3, 0, 32, [1, 1, 1, 4], 1], ["SP", 3, 5, 8, [1, 2, 2, 1], 1], ["SP", 3, 10, 32, [2, 4, 1, 1], 1], ["SP", 3, 15, 32, [1, 4, 2, 1], 1], ["SP", 3, 20, 8, [1, 1], 1], ["SP", 3, 23, 3, [1, 3], 1], ["SP", 3, 26, 3, [1, 3], 1], ["RE", 3, [0, 5, 10, 15, 1, 6, 11, 16, 2, 7, 12, 17, 20, 23, 26, 21, 24, 27, 3, 8, 13, 18, 22, 25, 28, 4, 9, 14, 19]], ["FSP", 7, 0, 1, 3], ["FSP", 7, 4, 2, 3], ["FSP", 7, 8, 3, 3], ["FSP", 7, 12, 4, 3], ["RE", 7, [0, 4, 8, 12, 1, 5, 9, 13, 2, 6, 10, 14, 3, 7, 11, 15]], ["CA", 3, 7, 11], ["CHR", 2, "shared", [3]], ["CA", 3, 4, 14], ["CHR", 1, "shared", [4]], ["CA", 2, 5, 14], ["CI", 1], ["FU", 9, [0, 1, 2, 3]], ["AN", 9, 0, 5], ["FU", 9, [1, 2, 3, 4]], ["AN", 9, 1, 4], ["FU", 9, [2, 3, 4, 5]], ["AN", 9, 2, 6], ["FU", 4, [0, 1, 2, 3]], ["SP", 4, 0, 18, [1], 1], ["AN", 4, 1, 2], ["FFSP", 4, 0, [4, 3, 2, 1], 1, 1], ["AN", 4, 1, 6], ["FU", 2, [0, 1, 2, 3]], ["SP", 2, 0, 72, [1], 1], ["AN", 2, 1, 2], ["FFSP", 2, 0, [4, 3, 2, 1], 1, 1], ["AN", 2, 1, 6], ["PR", 5, 0, "auto_unroll_max_step$512"]]]], "r": [[1.5093e-05, 1.50948e-05, 1.50957e-05, 1.50961e-05], 0, 3.28737, 1669784527], "v": "v0.6"}
{"i": [["[\"a7de7210b6587109a1ca064f9b471c63\", [32, 8, 32, 32], [8, 8, 3, 3], [1, 8, 1, 1], [32, 8, 32, 32], [32, 8, 32, 32]]", "cuda -keys=cuda,gpu -arch=sm_80 -max_num_threads=1024 -thread_warp_size=32", [-1, 16, 64, 49152, 2147483647, 1024, 8, 32], "", 0, []], [[], [["CI", 5], ["SP", 3, 0, 32, [1, 2, 1, 2], 1], ["SP", 3, 5, 8, [1, 2, 4, 1], 1], ["SP", 3, 10, 32, [1, 2, 1, 16], 1], ["SP", 3, 15, 32, [2, 4, 4, 1], 1], ["SP", 3, 20, 8, [1, 2], 1], ["SP", 3, 23, 3, [1, 1], 1], ["SP", 3, 26, 3, [1, 1], 1], ["RE", 3, [0, 5, 10, 15, 1, 6, 11, 16, 2, 7, 12, 17, 20, 23, 26, 21, 24, 27, 3, 8, 13, 18, 22, 25, 28, 4, 9, 14, 19]], ["FSP", 7, 0, 1, 3], ["FSP", 7, 4, 2, 3], ["FSP", 7, 8, 3, 3], ["FSP", 7, 12, 4, 3], ["RE", 7, [0, 4, 8, 12, 1, 5, 9, 13, 2, 6, 10, 14, 3, 7, 11, 15]], ["CA", 3, 7, 11], ["CHR", 2, "shared", [3]], ["CA", 3, 4, 14], ["CHR", 1, "shared", [4]], ["CA", 2, 5, 14], ["CI", 1], ["FU", 9, [0, 1, 2, 3]], ["AN", 9, 0, 5], ["FU", 9, [1, 2, 3, 4]], ["AN", 9, 1, 4], ["FU", 9, [2, 3, 4, 5]], ["AN", 9, 2, 6], ["FU", 4, [0, 1, 2, 3]], ["SP", 4, 0, 24, [1], 1], ["AN", 4, 1, 2], ["FFSP", 4, 0, [4, 3, 2, 1], 1, 1], ["AN", 4, 1, 6], ["FU", 2, [0, 1, 2, 3]], ["SP", 2, 0, 288, [1], 1], ["AN", 2, 1, 2], ["FFSP", 2, 0, [4, 3, 2, 1], 1, 1], ["AN", 2, 1, 6], ["PR", 5, 0, "auto_unroll_max_step$512"]]]], "r": [[0.00127992, 0.00127993, 0.00127986, 0.00127986], 0, 16.2981, 1669784529], "v": "v0.6"}
{"i": [["[\"a7de7210b6587109a1ca064f9b471c63\", [32, 8, 32, 32], [8, 8, 3, 3], [1, 8, 1, 1], [32, 8, 32, 32], [32, 8, 32, 32]]", "cuda -keys=cuda,gpu -arch=sm_80 -max_num_threads=1024 -thread_warp_size=32", [-1, 16, 64, 49152, 2147483647, 1024, 8, 32], "", 0, []], [[], [["CI", 5], ["SP", 3, 0, 32, [1, 8, 1, 2], 1], ["SP", 3, 5, 8, [1, 4, 1, 1], 1], ["SP", 3, 10, 32, [1, 1, 1, 2], 1], ["SP", 3, 15, 32, [2, 2, 8, 1], 1], ["SP", 3, 20, 8, [4, 2], 1], ["SP", 3, 23, 3, [1, 1], 1], ["SP", 3, 26, 3, [1, 1], 1], ["RE", 3, [0, 5, 10, 15, 1, 6, 11, 16, 2, 7, 12, 17, 20, 23, 26, 21, 24, 27, 3, 8, 13, 18, 22, 25, 28, 4, 9, 14, 19]], ["FSP", 7, 0, 1, 3], ["FSP", 7, 4, 2, 3], ["FSP", 7, 8, 3, 3], ["FSP", 7, 12, 4, 3], ["RE", 7, [0, 4, 8, 12, 1, 5, 9, 13, 2, 6, 10, 14, 3, 7, 11, 15]], ["CA", 3, 7, 11], ["CHR", 2, "shared", [3]], ["CA", 3, 4, 14], ["CHR", 1, "shared", [4]], ["CA", 2, 5, 14], ["CI", 1], ["FU", 9, [0, 1, 2, 3]], ["AN", 9, 0, 5], ["FU", 9, [1, 2, 3, 4]], ["AN", 9, 1, 4], ["FU", 9, [2, 3, 4, 5]], ["AN", 9, 2, 6], ["FU", 4, [0, 1, 2, 3]], ["SP", 4, 0, 8, [1], 1], ["AN", 4, 1, 2], ["FFSP", 4, 0, [4, 3, 2, 1], 1, 1], ["AN", 4, 1, 6], ["FU", 2, [0, 1, 2, 3]], ["SP", 2, 0, 256, [4], 1], ["AN", 2, 1, 2], ["FFSP", 2, 0, [4, 3, 2, 1], 1, 1], ["AN", 2, 1, 6], ["PR", 5, 0, "auto_unroll_max_step$1024"]]]], "r": [[3.58341e-05, 3.58571e-05, 3.5828e-05, 3.57762e-05], 0, 5.21641, 1669784531], "v": "v0.6"}
{"i": [["[\"a7de7210b6587109a1ca064f9b471c63\", [32, 8, 32, 32], [8, 8, 3, 3], [1, 8, 1, 1], [32, 8, 32, 32], [32, 8, 32, 32]]", "cuda -keys=cuda,gpu -arch=sm_80 -max_num_threads=1024 -thread_warp_size=32", [-1, 16, 64, 49152, 2147483647, 1024, 8, 32], "", 0, []], [[], [["CI", 5], ["SP", 3, 0, 32, [1, 2, 2, 2], 1], ["SP", 3, 5, 8, [1, 2, 2, 2], 1], ["SP", 3, 10, 32, [2, 2, 2, 1], 1], ["SP", 3, 15, 32, [2, 4, 1, 1], 1], ["SP", 3, 20, 8, [4, 2], 1], ["SP", 3, 23, 3, [3, 1], 1], ["SP", 3, 26, 3, [1, 1], 1], ["RE", 3, [0, 5, 10, 15, 1, 6, 11, 16, 2, 7, 12, 17, 20, 23, 26, 21, 24, 27, 3, 8, 13, 18, 22, 25, 28, 4, 9, 14, 19]], ["FSP", 7, 0, 1, 3], ["FSP", 7, 4, 2, 3], ["FSP", 7, 8, 3, 3], ["FSP", 7, 12, 4, 3], ["RE", 7, [0, 4, 8, 12, 1, 5, 9, 13, 2, 6, 10, 14, 3, 7, 11, 15]], ["CA", 3, 7, 11], ["CHR", 2, "shared", [3]], ["CA", 3, 4, 14], ["CHR", 1, "shared", [4]], ["CA", 2, 5, 14], ["CI", 1], ["FU", 9, [0, 1, 2, 3]], ["AN", 9, 0, 5], ["FU", 9, [1, 2, 3, 4]], ["AN", 9, 1, 4], ["FU", 9, [2, 3, 4, 5]], ["AN", 9, 2, 6], ["FU", 4, [0, 1, 2, 3]], ["SP", 4, 0, 288, [1], 1], ["AN", 4, 1, 2], ["FFSP", 4, 0, [4, 3, 2, 1], 1, 1], ["AN", 4, 1, 6], ["FU", 2, [0, 1, 2, 3]], ["SP", 2, 0, 384, [24], 1], ["AN", 2, 1, 2], ["FFSP", 2, 0, [4, 3, 2, 1], 1, 1], ["AN", 2, 1, 6], ["PR", 5, 0, "auto_unroll_max_step$0"]]]], "r": [[7.87343e-05, 7.87329e-05, 7.87314e-05, 7.87325e-05], 0, 3.54773, 1669784534], "v": "v0.6"}
{"i": [["[\"a7de7210b6587109a1ca064f9b471c63\", [32, 8, 32, 32], [8, 8, 3, 3], [1, 8, 1, 1], [32, 8, 32, 32], [32, 8, 32, 32]]", "cuda -keys=cuda,gpu -arch=sm_80 -max_num_threads=1024 -thread_warp_size=32", [-1, 16, 64, 49152, 2147483647, 1024, 8, 32], "", 0, []], [[], [["CI", 5], ["SP", 3, 0, 32, [2, 2, 1, 1], 1], ["SP", 3, 5, 8, [1, 4, 1, 2], 1], ["SP", 3, 10, 32, [2, 4, 1, 1], 1], ["SP", 3, 15, 32, [2, 2, 4, 2], 1], ["SP", 3, 20, 8, [1, 1], 1], ["SP", 3, 23, 3, [3, 1], 1], ["SP", 3, 26, 3, [1, 3], 1], ["RE", 3, [0, 5, 10, 15, 1, 6, 11, 16, 2, 7, 12, 17, 20, 23, 26, 21, 24, 27, 3, 8, 13, 18, 22, 25, 28, 4, 9, 14, 19]], ["FSP", 7, 0, 1, 3], ["FSP", 7, 4, 2, 3], ["FSP", 7, 8, 3, 3], ["FSP", 7, 12, 4, 3], ["RE", 7, [0, 4, 8, 12, 1, 5, 9, 13, 2, 6, 10, 14, 3, 7, 11, 15]], ["CA", 3, 7, 11], ["CHR", 2, "shared", [3]], ["CA", 3, 4, 14], ["CHR", 1, "shared", [4]], ["CA", 2, 5, 14], ["CI", 1], ["FU", 9, [0, 1, 2, 3]], ["AN", 9, 0, 5], ["FU", 9, [1, 2, 3, 4]], ["AN", 9, 1, 4], ["FU", 9, [2, 3, 4, 5]], ["AN", 9, 2, 6], ["FU", 4, [0, 1, 2, 3]], ["SP", 4, 0, 18, [1], 1], ["AN", 4, 1, 2], ["FFSP", 4, 0, [4, 3, 2, 1], 1, 1], ["AN", 4, 1, 6], ["FU", 2, [0, 1, 2, 3]], ["SP", 2, 0, 30, [3], 1], ["AN", 2, 1, 2], ["FFSP", 2, 0, [4, 3, 2, 1], 1, 1], ["AN", 2, 1, 6], ["PR", 5, 0, "auto_unroll_max_step$64"]]]], "r": [[3.76855e-05, 3.76149e-05, 3.76153e-05, 3.76158e-05], 0, 3.62121, 1669784537], "v": "v0.6"}
{"i": [["[\"a7de7210b6587109a1ca064f9b471c63\", [32, 8, 32, 32], [8, 8, 3, 3], [1, 8, 1, 1], [32, 8, 32, 32], [32, 8, 32, 32]]", "cuda -keys=cuda,gpu -arch=sm_80 -max_num_threads=1024 -thread_warp_size=32", [-1, 16, 64, 49152, 2147483647, 1024, 8, 32], "", 0, []], [[], [["CI", 5], ["SP", 3, 0, 32, [2, 2, 1, 1], 1], ["SP", 3, 5, 8, [1, 2, 1, 2], 1], ["SP", 3, 10, 32, [2, 4, 1, 1], 1], ["SP", 3, 15, 32, [2, 2, 4, 2], 1], ["SP", 3, 20, 8, [1, 1], 1], ["SP", 3, 23, 3, [3, 1], 1], ["SP", 3, 26, 3, [1, 3], 1], ["RE", 3, [0, 5, 10, 15, 1, 6, 11, 16, 2, 7, 12, 17, 20, 23, 26, 21, 24, 27, 3, 8, 13, 18, 22, 25, 28, 4, 9, 14, 19]], ["FSP", 7, 0, 1, 3], ["FSP", 7, 4, 2, 3], ["FSP", 7, 8, 3, 3], ["FSP", 7, 12, 4, 3], ["RE", 7, [0, 4, 8, 12, 1, 5, 9, 13, 2, 6, 10, 14, 3, 7, 11, 15]], ["CA", 3, 7, 11], ["CHR", 2, "shared", [3]], ["CA", 3, 4, 14], ["CHR", 1, "shared", [4]], ["CA", 2, 5, 14], ["CI", 1], ["FU", 9, [0, 1, 2, 3]], ["AN", 9, 0, 5], ["FU", 9, [1, 2, 3, 4]], ["AN", 9, 1, 4], ["FU", 9, [2, 3, 4, 5]], ["AN", 9, 2, 6], ["FU", 4, [0, 1, 2, 3]], ["SP", 4, 0, 18, [1], 1], ["AN", 4, 1, 2], ["FFSP", 4, 0, [4, 3, 2, 1], 1, 1], ["AN", 4, 1, 6], ["FU", 2, [0, 1, 2, 3]], ["SP", 2, 0, 30, [3], 1], ["AN", 2, 1, 2], ["FFSP", 2, 0, [4, 3, 2, 1], 1, 1], ["AN", 2, 1, 6], ["PR", 5, 0, "auto_unroll_max_step$512"]]]], "r": [[3.63376e-05, 3.63368e-05, 3.63373e-05, 3.63381e-05], 0, 4.28869, 1669784539], "v": "v0.6"}
{"i": [["[\"a7de7210b6587109a1ca064f9b471c63\", [32, 8, 32, 32], [8, 8, 3, 3], [1, 8, 1, 1], [32, 8, 32, 32], [32, 8, 32, 32]]", "cuda -keys=cuda,gpu -arch=sm_80 -max_num_threads=1024 -thread_warp_size=32", [-1, 16, 64, 49152, 2147483647, 1024, 8, 32], "", 0, []], [[], [["CI", 5], ["SP", 3, 0, 32, [1, 8, 1, 2], 1], ["SP", 3, 5, 8, [1, 1, 4, 2], 1], ["SP", 3, 10, 32, [1, 1, 16, 1], 1], ["SP", 3, 15, 32, [1, 4, 1, 2], 1], ["SP", 3, 20, 8, [2, 1], 1], ["SP", 3, 23, 3, [3, 1], 1], ["SP", 3, 26, 3, [1, 1], 1], ["RE", 3, [0, 5, 10, 15, 1, 6, 11, 16, 2, 7, 12, 17, 20, 23, 26, 21, 24, 27, 3, 8, 13, 18, 22, 25, 28, 4, 9, 14, 19]], ["FSP", 7, 0, 1, 3], ["FSP", 7, 4, 2, 3], ["FSP", 7, 8, 3, 3], ["FSP", 7, 12, 4, 3], ["RE", 7, [0, 4, 8, 12, 1, 5, 9, 13, 2, 6, 10, 14, 3, 7, 11, 15]], ["CA", 3, 7, 11], ["CHR", 2, "shared", [3]], ["CA", 3, 4, 14], ["CHR", 1, "shared", [4]], ["CA", 2, 5, 14], ["CI", 1], ["FU", 9, [0, 1, 2, 3]], ["AN", 9, 0, 5], ["FU", 9, [1, 2, 3, 4]], ["AN", 9, 1, 4], ["FU", 9, [2, 3, 4, 5]], ["AN", 9, 2, 6], ["FU", 4, [0, 1, 2, 3]], ["SP", 4, 0, 48, [24], 1], ["AN", 4, 1, 2], ["FFSP", 4, 0, [4, 3, 2, 1], 1, 1], ["AN", 4, 1, 6], ["FU", 2, [0, 1, 2, 3]], ["SP", 2, 0, 144, [18], 1], ["AN", 2, 1, 2], ["FFSP", 2, 0, [4, 3, 2, 1], 1, 1], ["AN", 2, 1, 6], ["PR", 5, 0, "auto_unroll_max_step$16"]]]], "r": [[0.000355049, 0.00035607, 0.000356035, 0.000355501], 0, 3.92213, 1669784542], "v": "v0.6"}
{"i": [["[\"a7de7210b6587109a1ca064f9b471c63\", [32, 8, 32, 32], [8, 8, 3, 3], [1, 8, 1, 1], [32, 8, 32, 32], [32, 8, 32, 32]]", "cuda -keys=cuda,gpu -arch=sm_80 -max_num_threads=1024 -thread_warp_size=32", [-1, 16, 64, 49152, 2147483647, 1024, 8, 32], "", 0, []], [[], [["CI", 5], ["SP", 3, 0, 32, [1, 1, 1, 8], 1], ["SP", 3, 5, 8, [1, 8, 1, 1], 1], ["SP", 3, 10, 32, [1, 1, 4, 8], 1], ["SP", 3, 15, 32, [2, 8, 1, 1], 1], ["SP", 3, 20, 8, [1, 2], 1], ["SP", 3, 23, 3, [3, 1], 1], ["SP", 3, 26, 3, [1, 3], 1], ["RE", 3, [0, 5, 10, 15, 1, 6, 11, 16, 2, 7, 12, 17, 20, 23, 26, 21, 24, 27, 3, 8, 13, 18, 22, 25, 28, 4, 9, 14, 19]], ["FSP", 7, 0, 1, 3], ["FSP", 7, 4, 2, 3], ["FSP", 7, 8, 3, 3], ["FSP", 7, 12, 4, 3], ["RE", 7, [0, 4, 8, 12, 1, 5, 9, 13, 2, 6, 10, 14, 3, 7, 11, 15]], ["CA", 3, 7, 11], ["CHR", 2, "shared", [3]], ["CA", 3, 4, 14], ["CHR", 1, "shared", [4]], ["CA", 2, 5, 14], ["CI", 1], ["FU", 9, [0, 1, 2, 3]], ["AN", 9, 0, 5], ["FU", 9, [1, 2, 3, 4]], ["AN", 9, 1, 4], ["FU", 9, [2, 3, 4, 5]], ["AN", 9, 2, 6], ["FU", 4, [0, 1, 2, 3]], ["SP", 4, 0, 18, [1], 1], ["AN", 4, 1, 2], ["FFSP", 4, 0, [4, 3, 2, 1], 1, 1], ["AN", 4, 1, 6], ["FU", 2, [0, 1, 2, 3]], ["SP", 2, 0, 288, [1], 1], ["AN", 2, 1, 2], ["FFSP", 2, 0, [4, 3, 2, 1], 1, 1], ["AN", 2, 1, 6], ["PR", 5, 0, "auto_unroll_max_step$512"]]]], "r": [[0.00020931, 0.000209314, 0.00020931, 0.000209315], 0, 10.8732, 1669784545], "v": "v0.6"}
{"i": [["[\"a7de7210b6587109a1ca064f9b471c63\", [32, 8, 32, 32], [8, 8, 3, 3], [1, 8, 1, 1], [32, 8, 32, 32], [32, 8, 32, 32]]", "cuda -keys=cuda,gpu -arch=sm_80 -max_num_threads=1024 -thread_warp_size=32", [-1, 16, 64, 49152, 2147483647, 1024, 8, 32], "", 0, []], [[], [["CI", 5], ["SP", 3, 0, 32, [1, 16, 1, 2], 1], ["SP", 3, 5, 8, [1, 2, 2, 1], 1], ["SP", 3, 10, 32, [4, 1, 1, 2], 1], ["SP", 3, 15, 32, [1, 2, 2, 2], 1], ["SP", 3, 20, 8, [1, 4], 1], ["SP", 3, 23, 3, [3, 1], 1], ["SP", 3, 26, 3, [1, 1], 1], ["RE", 3, [0, 5, 10, 15, 1, 6, 11, 16, 2, 7, 12, 17, 20, 23, 26, 21, 24, 27, 3, 8, 13, 18, 22, 25, 28, 4, 9, 14, 19]], ["FSP", 7, 0, 1, 3], ["FSP", 7, 4, 2, 3], ["FSP", 7, 8, 3, 3], ["FSP", 7, 12, 4, 3], ["RE", 7, [0, 4, 8, 12, 1, 5, 9, 13, 2, 6, 10, 14, 3, 7, 11, 15]], ["CA", 3, 7, 11], ["CHR", 2, "shared", [3]], ["CA", 3, 4, 14], ["CHR", 1, "shared", [4]], ["CA", 2, 5, 14], ["CI", 1], ["FU", 9, [0, 1, 2, 3]], ["AN", 9, 0, 5], ["FU", 9, [1, 2, 3, 4]], ["AN", 9, 1, 4], ["FU", 9, [2, 3, 4, 5]], ["AN", 9, 2, 6], ["FU", 4, [0, 1, 2, 3]], ["SP", 4, 0, 24, [1], 1], ["AN", 4, 1, 2], ["FFSP", 4, 0, [4, 3, 2, 1], 1, 1], ["AN", 4, 1, 6], ["FU", 2, [0, 1, 2, 3]], ["SP", 2, 0, 128, [1], 1], ["AN", 2, 1, 2], ["FFSP", 2, 0, [4, 3, 2, 1], 1, 1], ["AN", 2, 1, 6], ["PR", 5, 0, "auto_unroll_max_step$1024"]]]], "r": [[0.000220411, 0.000220409, 0.000220406, 0.000220407], 0, 5.8641, 1669784548], "v": "v0.6"}
{"i": [["[\"a7de7210b6587109a1ca064f9b471c63\", [32, 8, 32, 32], [8, 8, 3, 3], [1, 8, 1, 1], [32, 8, 32, 32], [32, 8, 32, 32]]", "cuda -keys=cuda,gpu -arch=sm_80 -max_num_threads=1024 -thread_warp_size=32", [-1, 16, 64, 49152, 2147483647, 1024, 8, 32], "", 0, []], [[], [["CI", 5], ["SP", 3, 0, 32, [1, 8, 1, 2], 1], ["SP", 3, 5, 8, [1, 1, 2, 2], 1], ["SP", 3, 10, 32, [1, 4, 4, 1], 1], ["SP", 3, 15, 32, [2, 8, 1, 1], 1], ["SP", 3, 20, 8, [1, 2], 1], ["SP", 3, 23, 3, [3, 1], 1], ["SP", 3, 26, 3, [1, 1], 1], ["RE", 3, [0, 5, 10, 15, 1, 6, 11, 16, 2, 7, 12, 17, 20, 23, 26, 21, 24, 27, 3, 8, 13, 18, 22, 25, 28, 4, 9, 14, 19]], ["FSP", 7, 0, 1, 3], ["FSP", 7, 4, 2, 3], ["FSP", 7, 8, 3, 3], ["FSP", 7, 12, 4, 3], ["RE", 7, [0, 4, 8, 12, 1, 5, 9, 13, 2, 6, 10, 14, 3, 7, 11, 15]], ["CA", 3, 7, 11], ["CHR", 2, "shared", [3]], ["CA", 3, 4, 14], ["CHR", 1, "shared", [4]], ["CA", 2, 5, 14], ["CI", 1], ["FU", 9, [0, 1, 2, 3]], ["AN", 9, 0, 5], ["FU", 9, [1, 2, 3, 4]], ["AN", 9, 1, 4], ["FU", 9, [2, 3, 4, 5]], ["AN", 9, 2, 6], ["FU", 4, [0, 1, 2, 3]], ["SP", 4, 0, 24, [1], 1], ["AN", 4, 1, 2], ["FFSP", 4, 0, [4, 3, 2, 1], 1, 1], ["AN", 4, 1, 6], ["FU", 2, [0, 1, 2, 3]], ["SP", 2, 0, 48, [1], 1], ["AN", 2, 1, 2], ["FFSP", 2, 0, [4, 3, 2, 1], 1, 1], ["AN", 2, 1, 6], ["PR", 5, 0, "auto_unroll_max_step$0"]]]], "r": [[4.22298e-05, 4.22614e-05, 4.22331e-05, 4.22305e-05], 0, 3.55033, 1669784550], "v": "v0.6"}
