.cache/log/kernel_tune/NVIDIA_A100_80GB_PCIe/Conv2dBias_forward_input_0_50_3_32_32_output_0_50_3_32_32_in_channels_3_out_channels_3_kernel_size_1_1_stride_1_1_padding_0_0_dilation_1_1_groups_1.json
{"i": [["[\"f730d9b2b7d3686ece20335c9cd6eaa4\", [50, 3, 32, 32], [3, 3, 1, 1], [1, 3, 1, 1], [50, 3, 32, 32]]", "cuda -keys=cuda,gpu -arch=sm_80 -max_num_threads=1024 -thread_warp_size=32", [-1, 16, 64, 49152, 2147483647, 1024, 8, 32], "", 0, []], [[], [["SP", 3, 0, 50, [1, 5, 1, 2], 1], ["SP", 3, 5, 3, [1, 1, 1, 3], 1], ["SP", 3, 10, 32, [4, 8, 1, 1], 1], ["SP", 3, 15, 32, [2, 2, 1, 2], 1], ["SP", 3, 20, 3, [1, 3], 1], ["SP", 3, 23, 1, [1, 1], 1], ["SP", 3, 26, 1, [1, 1], 1], ["RE", 3, [0, 5, 10, 15, 1, 6, 11, 16, 2, 7, 12, 17, 20, 23, 26, 21, 24, 27, 3, 8, 13, 18, 22, 25, 28, 4, 9, 14, 19]], ["FSP", 5, 0, 0, 3], ["FSP", 5, 4, 1, 3], ["FSP", 5, 8, 2, 3], ["FSP", 5, 12, 3, 3], ["RE", 5, [0, 4, 8, 12, 1, 5, 9, 13, 2, 6, 10, 14, 3, 7, 11, 15]], ["CA", 3, 5, 11], ["CHR", 2, "shared", [3]], ["CA", 3, 4, 14], ["CHR", 1, "shared", [4]], ["CA", 2, 5, 14], ["CI", 1], ["FU", 7, [0, 1, 2, 3]], ["AN", 7, 0, 5], ["FU", 7, [1, 2, 3, 4]], ["AN", 7, 1, 4], ["FU", 7, [2, 3, 4, 5]], ["AN", 7, 2, 6], ["FU", 4, [0, 1, 2, 3]], ["SP", 4, 0, 9, [1], 1], ["AN", 4, 1, 2], ["FFSP", 4, 0, [3, 2, 1, 0], 1, 1], ["AN", 4, 1, 6], ["FU", 2, [0, 1, 2, 3]], ["SP", 2, 0, 12, [1], 1], ["AN", 2, 1, 2], ["FFSP", 2, 0, [3, 2, 1, 0], 1, 1], ["AN", 2, 1, 6], ["PR", 5, 0, "auto_unroll_max_step$64"]]]], "r": [[9.02021e-06, 9.02085e-06, 9.02102e-06, 9.02156e-06], 0, 2.75001, 1664418856], "v": "v0.6"}
{"i": [["[\"f730d9b2b7d3686ece20335c9cd6eaa4\", [50, 3, 32, 32], [3, 3, 1, 1], [1, 3, 1, 1], [50, 3, 32, 32]]", "cuda -keys=cuda,gpu -arch=sm_80 -max_num_threads=1024 -thread_warp_size=32", [-1, 16, 64, 49152, 2147483647, 1024, 8, 32], "", 0, []], [[], [["SP", 3, 0, 50, [1, 2, 1, 1], 1], ["SP", 3, 5, 3, [3, 1, 1, 1], 1], ["SP", 3, 10, 32, [2, 8, 2, 1], 1], ["SP", 3, 15, 32, [1, 2, 8, 1], 1], ["SP", 3, 20, 3, [3, 1], 1], ["SP", 3, 23, 1, [1, 1], 1], ["SP", 3, 26, 1, [1, 1], 1], ["RE", 3, [0, 5, 10, 15, 1, 6, 11, 16, 2, 7, 12, 17, 20, 23, 26, 21, 24, 27, 3, 8, 13, 18, 22, 25, 28, 4, 9, 14, 19]], ["FSP", 5, 0, 0, 3], ["FSP", 5, 4, 1, 3], ["FSP", 5, 8, 2, 3], ["FSP", 5, 12, 3, 3], ["RE", 5, [0, 4, 8, 12, 1, 5, 9, 13, 2, 6, 10, 14, 3, 7, 11, 15]], ["CA", 3, 5, 11], ["CHR", 2, "shared", [3]], ["CA", 3, 4, 14], ["CHR", 1, "shared", [4]], ["CA", 2, 5, 14], ["CI", 1], ["FU", 7, [0, 1, 2, 3]], ["AN", 7, 0, 5], ["FU", 7, [1, 2, 3, 4]], ["AN", 7, 1, 4], ["FU", 7, [2, 3, 4, 5]], ["AN", 7, 2, 6], ["FU", 4, [0, 1, 2, 3]], ["SP", 4, 0, 3, [1], 1], ["AN", 4, 1, 2], ["FFSP", 4, 0, [3, 2, 1, 0], 1, 1], ["AN", 4, 1, 6], ["FU", 2, [0, 1, 2, 3]], ["SP", 2, 0, 48, [1], 1], ["AN", 2, 1, 2], ["FFSP", 2, 0, [3, 2, 1, 0], 1, 1], ["AN", 2, 1, 6], ["PR", 5, 0, "auto_unroll_max_step$0"]]]], "r": [[6.32235e-06, 6.32136e-06, 6.321e-06, 6.32081e-06], 0, 2.97688, 1664418859], "v": "v0.6"}
{"i": [["[\"f730d9b2b7d3686ece20335c9cd6eaa4\", [50, 3, 32, 32], [3, 3, 1, 1], [1, 3, 1, 1], [50, 3, 32, 32]]", "cuda -keys=cuda,gpu -arch=sm_80 -max_num_threads=1024 -thread_warp_size=32", [-1, 16, 64, 49152, 2147483647, 1024, 8, 32], "", 0, []], [[], [["SP", 3, 0, 50, [1, 1, 10, 1], 1], ["SP", 3, 5, 3, [1, 3, 1, 1], 1], ["SP", 3, 10, 32, [4, 4, 1, 1], 1], ["SP", 3, 15, 32, [1, 4, 4, 1], 1], ["SP", 3, 20, 3, [3, 1], 1], ["SP", 3, 23, 1, [1, 1], 1], ["SP", 3, 26, 1, [1, 1], 1], ["RE", 3, [0, 5, 10, 15, 1, 6, 11, 16, 2, 7, 12, 17, 20, 23, 26, 21, 24, 27, 3, 8, 13, 18, 22, 25, 28, 4, 9, 14, 19]], ["FSP", 5, 0, 0, 3], ["FSP", 5, 4, 1, 3], ["FSP", 5, 8, 2, 3], ["FSP", 5, 12, 3, 3], ["RE", 5, [0, 4, 8, 12, 1, 5, 9, 13, 2, 6, 10, 14, 3, 7, 11, 15]], ["CA", 3, 5, 11], ["CHR", 2, "shared", [3]], ["CA", 3, 4, 14], ["CHR", 1, "shared", [4]], ["CA", 2, 5, 14], ["CI", 1], ["FU", 7, [0, 1, 2, 3]], ["AN", 7, 0, 5], ["FU", 7, [1, 2, 3, 4]], ["AN", 7, 1, 4], ["FU", 7, [2, 3, 4, 5]], ["AN", 7, 2, 6], ["FU", 4, [0, 1, 2, 3]], ["SP", 4, 0, 1, [1], 1], ["AN", 4, 1, 2], ["FFSP", 4, 0, [3, 2, 1, 0], 1, 1], ["AN", 4, 1, 6], ["FU", 2, [0, 1, 2, 3]], ["SP", 2, 0, 40, [1], 1], ["AN", 2, 1, 2], ["FFSP", 2, 0, [3, 2, 1, 0], 1, 1], ["AN", 2, 1, 6], ["PR", 5, 0, "auto_unroll_max_step$64"]]]], "r": [[1.39766e-05, 1.3975e-05, 1.39758e-05, 1.39759e-05], 0, 3.10665, 1664418861], "v": "v0.6"}
{"i": [["[\"f730d9b2b7d3686ece20335c9cd6eaa4\", [50, 3, 32, 32], [3, 3, 1, 1], [1, 3, 1, 1], [50, 3, 32, 32]]", "cuda -keys=cuda,gpu -arch=sm_80 -max_num_threads=1024 -thread_warp_size=32", [-1, 16, 64, 49152, 2147483647, 1024, 8, 32], "", 0, []], [[], [["SP", 3, 0, 50, [2, 1, 1, 1], 1], ["SP", 3, 5, 3, [1, 1, 1, 3], 1], ["SP", 3, 10, 32, [1, 8, 2, 1], 1], ["SP", 3, 15, 32, [1, 4, 2, 4], 1], ["SP", 3, 20, 3, [1, 3], 1], ["SP", 3, 23, 1, [1, 1], 1], ["SP", 3, 26, 1, [1, 1], 1], ["RE", 3, [0, 5, 10, 15, 1, 6, 11, 16, 2, 7, 12, 17, 20, 23, 26, 21, 24, 27, 3, 8, 13, 18, 22, 25, 28, 4, 9, 14, 19]], ["FSP", 5, 0, 0, 3], ["FSP", 5, 4, 1, 3], ["FSP", 5, 8, 2, 3], ["FSP", 5, 12, 3, 3], ["RE", 5, [0, 4, 8, 12, 1, 5, 9, 13, 2, 6, 10, 14, 3, 7, 11, 15]], ["CA", 3, 5, 11], ["CHR", 2, "shared", [3]], ["CA", 3, 4, 14], ["CHR", 1, "shared", [4]], ["CA", 2, 5, 14], ["CI", 1], ["FU", 7, [0, 1, 2, 3]], ["AN", 7, 0, 5], ["FU", 7, [1, 2, 3, 4]], ["AN", 7, 1, 4], ["FU", 7, [2, 3, 4, 5]], ["AN", 7, 2, 6], ["FU", 4, [0, 1, 2, 3]], ["SP", 4, 0, 9, [1], 1], ["AN", 4, 1, 2], ["FFSP", 4, 0, [3, 2, 1, 0], 1, 1], ["AN", 4, 1, 6], ["FU", 2, [0, 1, 2, 3]], ["SP", 2, 0, 48, [1], 1], ["AN", 2, 1, 2], ["FFSP", 2, 0, [3, 2, 1, 0], 1, 1], ["AN", 2, 1, 6], ["PR", 5, 0, "auto_unroll_max_step$64"]]]], "r": [[4.44069e-06, 4.44084e-06, 4.44069e-06, 4.44082e-06], 0, 2.42528, 1664418863], "v": "v0.6"}
{"i": [["[\"f730d9b2b7d3686ece20335c9cd6eaa4\", [50, 3, 32, 32], [3, 3, 1, 1], [1, 3, 1, 1], [50, 3, 32, 32]]", "cuda -keys=cuda,gpu -arch=sm_80 -max_num_threads=1024 -thread_warp_size=32", [-1, 16, 64, 49152, 2147483647, 1024, 8, 32], "", 0, []], [[], [["SP", 3, 0, 50, [1, 25, 1, 1], 1], ["SP", 3, 5, 3, [1, 1, 1, 3], 1], ["SP", 3, 10, 32, [1, 1, 4, 1], 1], ["SP", 3, 15, 32, [2, 4, 1, 4], 1], ["SP", 3, 20, 3, [1, 3], 1], ["SP", 3, 23, 1, [1, 1], 1], ["SP", 3, 26, 1, [1, 1], 1], ["RE", 3, [0, 5, 10, 15, 1, 6, 11, 16, 2, 7, 12, 17, 20, 23, 26, 21, 24, 27, 3, 8, 13, 18, 22, 25, 28, 4, 9, 14, 19]], ["FSP", 5, 0, 0, 3], ["FSP", 5, 4, 1, 3], ["FSP", 5, 8, 2, 3], ["FSP", 5, 12, 3, 3], ["RE", 5, [0, 4, 8, 12, 1, 5, 9, 13, 2, 6, 10, 14, 3, 7, 11, 15]], ["CA", 3, 5, 11], ["CHR", 2, "shared", [3]], ["CA", 3, 4, 14], ["CHR", 1, "shared", [4]], ["CA", 2, 5, 14], ["CI", 1], ["FU", 7, [0, 1, 2, 3]], ["AN", 7, 0, 5], ["FU", 7, [1, 2, 3, 4]], ["AN", 7, 1, 4], ["FU", 7, [2, 3, 4, 5]], ["AN", 7, 2, 6], ["FU", 4, [0, 1, 2, 3]], ["SP", 4, 0, 3, [1], 1], ["AN", 4, 1, 2], ["FFSP", 4, 0, [3, 2, 1, 0], 1, 1], ["AN", 4, 1, 6], ["FU", 2, [0, 1, 2, 3]], ["SP", 2, 0, 4, [4], 1], ["AN", 2, 1, 2], ["FFSP", 2, 0, [3, 2, 1, 0], 1, 1], ["AN", 2, 1, 6], ["PR", 5, 0, "auto_unroll_max_step$512"]]]], "r": [[8.80753e-06, 8.80657e-06, 8.80571e-06, 8.80548e-06], 0, 3.04549, 1664418865], "v": "v0.6"}
{"i": [["[\"f730d9b2b7d3686ece20335c9cd6eaa4\", [50, 3, 32, 32], [3, 3, 1, 1], [1, 3, 1, 1], [50, 3, 32, 32]]", "cuda -keys=cuda,gpu -arch=sm_80 -max_num_threads=1024 -thread_warp_size=32", [-1, 16, 64, 49152, 2147483647, 1024, 8, 32], "", 0, []], [[], [["SP", 3, 0, 50, [2, 1, 25, 1], 1], ["SP", 3, 5, 3, [1, 1, 1, 3], 1], ["SP", 3, 10, 32, [1, 2, 1, 1], 1], ["SP", 3, 15, 32, [1, 8, 1, 1], 1], ["SP", 3, 20, 3, [1, 1], 1], ["SP", 3, 23, 1, [1, 1], 1], ["SP", 3, 26, 1, [1, 1], 1], ["RE", 3, [0, 5, 10, 15, 1, 6, 11, 16, 2, 7, 12, 17, 20, 23, 26, 21, 24, 27, 3, 8, 13, 18, 22, 25, 28, 4, 9, 14, 19]], ["FSP", 5, 0, 0, 3], ["FSP", 5, 4, 1, 3], ["FSP", 5, 8, 2, 3], ["FSP", 5, 12, 3, 3], ["RE", 5, [0, 4, 8, 12, 1, 5, 9, 13, 2, 6, 10, 14, 3, 7, 11, 15]], ["CA", 3, 5, 11], ["CHR", 2, "shared", [3]], ["CA", 3, 4, 14], ["CHR", 1, "shared", [4]], ["CA", 2, 5, 14], ["CI", 1], ["FU", 7, [0, 1, 2, 3]], ["AN", 7, 0, 5], ["FU", 7, [1, 2, 3, 4]], ["AN", 7, 1, 4], ["FU", 7, [2, 3, 4, 5]], ["AN", 7, 2, 6], ["FU", 4, [0, 1, 2, 3]], ["SP", 4, 0, 3, [1], 1], ["AN", 4, 1, 2], ["FFSP", 4, 0, [3, 2, 1, 0], 1, 1], ["AN", 4, 1, 6], ["FU", 2, [0, 1, 2, 3]], ["SP", 2, 0, 25, [1], 1], ["AN", 2, 1, 2], ["FFSP", 2, 0, [3, 2, 1, 0], 1, 1], ["AN", 2, 1, 6], ["PR", 5, 0, "auto_unroll_max_step$512"]]]], "r": [[1.05991e-05, 1.0594e-05, 1.05945e-05, 1.05972e-05], 0, 2.89036, 1664418868], "v": "v0.6"}
{"i": [["[\"f730d9b2b7d3686ece20335c9cd6eaa4\", [50, 3, 32, 32], [3, 3, 1, 1], [1, 3, 1, 1], [50, 3, 32, 32]]", "cuda -keys=cuda,gpu -arch=sm_80 -max_num_threads=1024 -thread_warp_size=32", [-1, 16, 64, 49152, 2147483647, 1024, 8, 32], "", 0, []], [[], [["SP", 3, 0, 50, [2, 5, 5, 1], 1], ["SP", 3, 5, 3, [1, 3, 1, 1], 1], ["SP", 3, 10, 32, [1, 4, 2, 1], 1], ["SP", 3, 15, 32, [2, 1, 2, 1], 1], ["SP", 3, 20, 3, [3, 1], 1], ["SP", 3, 23, 1, [1, 1], 1], ["SP", 3, 26, 1, [1, 1], 1], ["RE", 3, [0, 5, 10, 15, 1, 6, 11, 16, 2, 7, 12, 17, 20, 23, 26, 21, 24, 27, 3, 8, 13, 18, 22, 25, 28, 4, 9, 14, 19]], ["FSP", 5, 0, 0, 3], ["FSP", 5, 4, 1, 3], ["FSP", 5, 8, 2, 3], ["FSP", 5, 12, 3, 3], ["RE", 5, [0, 4, 8, 12, 1, 5, 9, 13, 2, 6, 10, 14, 3, 7, 11, 15]], ["CA", 3, 5, 11], ["CHR", 2, "shared", [3]], ["CA", 3, 4, 14], ["CHR", 1, "shared", [4]], ["CA", 2, 5, 14], ["CI", 1], ["FU", 7, [0, 1, 2, 3]], ["AN", 7, 0, 5], ["FU", 7, [1, 2, 3, 4]], ["AN", 7, 1, 4], ["FU", 7, [2, 3, 4, 5]], ["AN", 7, 2, 6], ["FU", 4, [0, 1, 2, 3]], ["SP", 4, 0, 3, [3], 1], ["AN", 4, 1, 2], ["FFSP", 4, 0, [3, 2, 1, 0], 1, 1], ["AN", 4, 1, 6], ["FU", 2, [0, 1, 2, 3]], ["SP", 2, 0, 60, [1], 1], ["AN", 2, 1, 2], ["FFSP", 2, 0, [3, 2, 1, 0], 1, 1], ["AN", 2, 1, 6], ["PR", 5, 0, "auto_unroll_max_step$64"]]]], "r": [[1.35939e-05, 1.35929e-05, 1.35924e-05, 1.35921e-05], 0, 2.94036, 1664418870], "v": "v0.6"}
{"i": [["[\"f730d9b2b7d3686ece20335c9cd6eaa4\", [50, 3, 32, 32], [3, 3, 1, 1], [1, 3, 1, 1], [50, 3, 32, 32]]", "cuda -keys=cuda,gpu -arch=sm_80 -max_num_threads=1024 -thread_warp_size=32", [-1, 16, 64, 49152, 2147483647, 1024, 8, 32], "", 0, []], [[], [["SP", 3, 0, 50, [1, 5, 1, 2], 1], ["SP", 3, 5, 3, [1, 3, 1, 1], 1], ["SP", 3, 10, 32, [2, 4, 1, 2], 1], ["SP", 3, 15, 32, [1, 1, 4, 1], 1], ["SP", 3, 20, 3, [1, 3], 1], ["SP", 3, 23, 1, [1, 1], 1], ["SP", 3, 26, 1, [1, 1], 1], ["RE", 3, [0, 5, 10, 15, 1, 6, 11, 16, 2, 7, 12, 17, 20, 23, 26, 21, 24, 27, 3, 8, 13, 18, 22, 25, 28, 4, 9, 14, 19]], ["FSP", 5, 0, 0, 3], ["FSP", 5, 4, 1, 3], ["FSP", 5, 8, 2, 3], ["FSP", 5, 12, 3, 3], ["RE", 5, [0, 4, 8, 12, 1, 5, 9, 13, 2, 6, 10, 14, 3, 7, 11, 15]], ["CA", 3, 5, 11], ["CHR", 2, "shared", [3]], ["CA", 3, 4, 14], ["CHR", 1, "shared", [4]], ["CA", 2, 5, 14], ["CI", 1], ["FU", 7, [0, 1, 2, 3]], ["AN", 7, 0, 5], ["FU", 7, [1, 2, 3, 4]], ["AN", 7, 1, 4], ["FU", 7, [2, 3, 4, 5]], ["AN", 7, 2, 6], ["FU", 4, [0, 1, 2, 3]], ["SP", 4, 0, 3, [1], 1], ["AN", 4, 1, 2], ["FFSP", 4, 0, [3, 2, 1, 0], 1, 1], ["AN", 4, 1, 6], ["FU", 2, [0, 1, 2, 3]], ["SP", 2, 0, 96, [1], 1], ["AN", 2, 1, 2], ["FFSP", 2, 0, [3, 2, 1, 0], 1, 1], ["AN", 2, 1, 6], ["PR", 5, 0, "auto_unroll_max_step$16"]]]], "r": [[8.57484e-06, 8.57573e-06, 8.57398e-06, 8.57441e-06], 0, 2.7496, 1664418872], "v": "v0.6"}
{"i": [["[\"f730d9b2b7d3686ece20335c9cd6eaa4\", [50, 3, 32, 32], [3, 3, 1, 1], [1, 3, 1, 1], [50, 3, 32, 32]]", "cuda -keys=cuda,gpu -arch=sm_80 -max_num_threads=1024 -thread_warp_size=32", [-1, 16, 64, 49152, 2147483647, 1024, 8, 32], "", 0, []], [[], [["SP", 3, 0, 50, [2, 1, 1, 1], 1], ["SP", 3, 5, 3, [1, 3, 1, 1], 1], ["SP", 3, 10, 32, [1, 8, 4, 1], 1], ["SP", 3, 15, 32, [1, 16, 1, 1], 1], ["SP", 3, 20, 3, [3, 1], 1], ["SP", 3, 23, 1, [1, 1], 1], ["SP", 3, 26, 1, [1, 1], 1], ["RE", 3, [0, 5, 10, 15, 1, 6, 11, 16, 2, 7, 12, 17, 20, 23, 26, 21, 24, 27, 3, 8, 13, 18, 22, 25, 28, 4, 9, 14, 19]], ["FSP", 5, 0, 0, 3], ["FSP", 5, 4, 1, 3], ["FSP", 5, 8, 2, 3], ["FSP", 5, 12, 3, 3], ["RE", 5, [0, 4, 8, 12, 1, 5, 9, 13, 2, 6, 10, 14, 3, 7, 11, 15]], ["CA", 3, 5, 11], ["CHR", 2, "shared", [3]], ["CA", 3, 4, 14], ["CHR", 1, "shared", [4]], ["CA", 2, 5, 14], ["CI", 1], ["FU", 7, [0, 1, 2, 3]], ["AN", 7, 0, 5], ["FU", 7, [1, 2, 3, 4]], ["AN", 7, 1, 4], ["FU", 7, [2, 3, 4, 5]], ["AN", 7, 2, 6], ["FU", 4, [0, 1, 2, 3]], ["SP", 4, 0, 9, [1], 1], ["AN", 4, 1, 2], ["FFSP", 4, 0, [3, 2, 1, 0], 1, 1], ["AN", 4, 1, 6], ["FU", 2, [0, 1, 2, 3]], ["SP", 2, 0, 12, [3], 1], ["AN", 2, 1, 2], ["FFSP", 2, 0, [3, 2, 1, 0], 1, 1], ["AN", 2, 1, 6], ["PR", 5, 0, "auto_unroll_max_step$64"]]]], "r": [[3.85702e-06, 3.85722e-06, 3.85497e-06, 3.85476e-06], 0, 2.24771, 1664418874], "v": "v0.6"}
{"i": [["[\"f730d9b2b7d3686ece20335c9cd6eaa4\", [50, 3, 32, 32], [3, 3, 1, 1], [1, 3, 1, 1], [50, 3, 32, 32]]", "cuda -keys=cuda,gpu -arch=sm_80 -max_num_threads=1024 -thread_warp_size=32", [-1, 16, 64, 49152, 2147483647, 1024, 8, 32], "", 0, []], [[], [["SP", 3, 0, 50, [1, 1, 1, 1], 1], ["SP", 3, 5, 3, [1, 3, 1, 1], 1], ["SP", 3, 10, 32, [2, 8, 1, 1], 1], ["SP", 3, 15, 32, [1, 1, 1, 16], 1], ["SP", 3, 20, 3, [3, 1], 1], ["SP", 3, 23, 1, [1, 1], 1], ["SP", 3, 26, 1, [1, 1], 1], ["RE", 3, [0, 5, 10, 15, 1, 6, 11, 16, 2, 7, 12, 17, 20, 23, 26, 21, 24, 27, 3, 8, 13, 18, 22, 25, 28, 4, 9, 14, 19]], ["FSP", 5, 0, 0, 3], ["FSP", 5, 4, 1, 3], ["FSP", 5, 8, 2, 3], ["FSP", 5, 12, 3, 3], ["RE", 5, [0, 4, 8, 12, 1, 5, 9, 13, 2, 6, 10, 14, 3, 7, 11, 15]], ["CA", 3, 5, 11], ["CHR", 2, "shared", [3]], ["CA", 3, 4, 14], ["CHR", 1, "shared", [4]], ["CA", 2, 5, 14], ["CI", 1], ["FU", 7, [0, 1, 2, 3]], ["AN", 7, 0, 5], ["FU", 7, [1, 2, 3, 4]], ["AN", 7, 1, 4], ["FU", 7, [2, 3, 4, 5]], ["AN", 7, 2, 6], ["FU", 4, [0, 1, 2, 3]], ["SP", 4, 0, 3, [3], 1], ["AN", 4, 1, 2], ["FFSP", 4, 0, [3, 2, 1, 0], 1, 1], ["AN", 4, 1, 6], ["FU", 2, [0, 1, 2, 3]], ["SP", 2, 0, 48, [1], 1], ["AN", 2, 1, 2], ["FFSP", 2, 0, [3, 2, 1, 0], 1, 1], ["AN", 2, 1, 6], ["PR", 5, 0, "auto_unroll_max_step$512"]]]], "r": [[6.5909e-06, 6.59049e-06, 6.59074e-06, 6.59031e-06], 0, 2.67312, 1664418876], "v": "v0.6"}
{"i": [["[\"f730d9b2b7d3686ece20335c9cd6eaa4\", [50, 3, 32, 32], [3, 3, 1, 1], [1, 3, 1, 1], [50, 3, 32, 32]]", "cuda -keys=cuda,gpu -arch=sm_80 -max_num_threads=1024 -thread_warp_size=32", [-1, 16, 64, 49152, 2147483647, 1024, 8, 32], "", 0, []], [[], [["SP", 3, 0, 50, [1, 5, 5, 1], 1], ["SP", 3, 5, 3, [1, 1, 1, 1], 1], ["SP", 3, 10, 32, [2, 8, 1, 1], 1], ["SP", 3, 15, 32, [4, 2, 1, 1], 1], ["SP", 3, 20, 3, [3, 1], 1], ["SP", 3, 23, 1, [1, 1], 1], ["SP", 3, 26, 1, [1, 1], 1], ["RE", 3, [0, 5, 10, 15, 1, 6, 11, 16, 2, 7, 12, 17, 20, 23, 26, 21, 24, 27, 3, 8, 13, 18, 22, 25, 28, 4, 9, 14, 19]], ["FSP", 5, 0, 0, 3], ["FSP", 5, 4, 1, 3], ["FSP", 5, 8, 2, 3], ["FSP", 5, 12, 3, 3], ["RE", 5, [0, 4, 8, 12, 1, 5, 9, 13, 2, 6, 10, 14, 3, 7, 11, 15]], ["CA", 3, 5, 11], ["CHR", 2, "shared", [3]], ["CA", 3, 4, 14], ["CHR", 1, "shared", [4]], ["CA", 2, 5, 14], ["CI", 1], ["FU", 7, [0, 1, 2, 3]], ["AN", 7, 0, 5], ["FU", 7, [1, 2, 3, 4]], ["AN", 7, 1, 4], ["FU", 7, [2, 3, 4, 5]], ["AN", 7, 2, 6], ["FU", 4, [0, 1, 2, 3]], ["SP", 4, 0, 9, [1], 1], ["AN", 4, 1, 2], ["FFSP", 4, 0, [3, 2, 1, 0], 1, 1], ["AN", 4, 1, 6], ["FU", 2, [0, 1, 2, 3]], ["SP", 2, 0, 30, [1], 1], ["AN", 2, 1, 2], ["FFSP", 2, 0, [3, 2, 1, 0], 1, 1], ["AN", 2, 1, 6], ["PR", 5, 0, "auto_unroll_max_step$1024"]]]], "r": [[7.73594e-06, 7.73607e-06, 7.73635e-06, 7.73671e-06], 0, 3.36094, 1664418879], "v": "v0.6"}
{"i": [["[\"f730d9b2b7d3686ece20335c9cd6eaa4\", [50, 3, 32, 32], [3, 3, 1, 1], [1, 3, 1, 1], [50, 3, 32, 32]]", "cuda -keys=cuda,gpu -arch=sm_80 -max_num_threads=1024 -thread_warp_size=32", [-1, 16, 64, 49152, 2147483647, 1024, 8, 32], "", 0, []], [[], [["SP", 3, 0, 50, [2, 1, 25, 1], 1], ["SP", 3, 5, 3, [1, 1, 1, 3], 1], ["SP", 3, 10, 32, [1, 2, 1, 1], 1], ["SP", 3, 15, 32, [2, 16, 1, 1], 1], ["SP", 3, 20, 3, [1, 1], 1], ["SP", 3, 23, 1, [1, 1], 1], ["SP", 3, 26, 1, [1, 1], 1], ["RE", 3, [0, 5, 10, 15, 1, 6, 11, 16, 2, 7, 12, 17, 20, 23, 26, 21, 24, 27, 3, 8, 13, 18, 22, 25, 28, 4, 9, 14, 19]], ["FSP", 5, 0, 0, 3], ["FSP", 5, 4, 1, 3], ["FSP", 5, 8, 2, 3], ["FSP", 5, 12, 3, 3], ["RE", 5, [0, 4, 8, 12, 1, 5, 9, 13, 2, 6, 10, 14, 3, 7, 11, 15]], ["CA", 3, 5, 11], ["CHR", 2, "shared", [3]], ["CA", 3, 4, 14], ["CHR", 1, "shared", [4]], ["CA", 2, 5, 14], ["CI", 1], ["FU", 7, [0, 1, 2, 3]], ["AN", 7, 0, 5], ["FU", 7, [1, 2, 3, 4]], ["AN", 7, 1, 4], ["FU", 7, [2, 3, 4, 5]], ["AN", 7, 2, 6], ["FU", 4, [0, 1, 2, 3]], ["SP", 4, 0, 3, [1], 1], ["AN", 4, 1, 2], ["FFSP", 4, 0, [3, 2, 1, 0], 1, 1], ["AN", 4, 1, 6], ["FU", 2, [0, 1, 2, 3]], ["SP", 2, 0, 25, [1], 1], ["AN", 2, 1, 2], ["FFSP", 2, 0, [3, 2, 1, 0], 1, 1], ["AN", 2, 1, 6], ["PR", 5, 0, "auto_unroll_max_step$16"]]]], "r": [[1.94669e-05, 1.94689e-05, 1.94579e-05, 1.9454e-05], 0, 3.21886, 1664418881], "v": "v0.6"}
{"i": [["[\"f730d9b2b7d3686ece20335c9cd6eaa4\", [50, 3, 32, 32], [3, 3, 1, 1], [1, 3, 1, 1], [50, 3, 32, 32]]", "cuda -keys=cuda,gpu -arch=sm_80 -max_num_threads=1024 -thread_warp_size=32", [-1, 16, 64, 49152, 2147483647, 1024, 8, 32], "", 0, []], [[], [["SP", 3, 0, 50, [1, 25, 1, 2], 1], ["SP", 3, 5, 3, [3, 1, 1, 1], 1], ["SP", 3, 10, 32, [2, 2, 1, 1], 1], ["SP", 3, 15, 32, [1, 2, 1, 1], 1], ["SP", 3, 20, 3, [3, 1], 1], ["SP", 3, 23, 1, [1, 1], 1], ["SP", 3, 26, 1, [1, 1], 1], ["RE", 3, [0, 5, 10, 15, 1, 6, 11, 16, 2, 7, 12, 17, 20, 23, 26, 21, 24, 27, 3, 8, 13, 18, 22, 25, 28, 4, 9, 14, 19]], ["FSP", 5, 0, 0, 3], ["FSP", 5, 4, 1, 3], ["FSP", 5, 8, 2, 3], ["FSP", 5, 12, 3, 3], ["RE", 5, [0, 4, 8, 12, 1, 5, 9, 13, 2, 6, 10, 14, 3, 7, 11, 15]], ["CA", 3, 5, 11], ["CHR", 2, "shared", [3]], ["CA", 3, 4, 14], ["CHR", 1, "shared", [4]], ["CA", 2, 5, 14], ["CI", 1], ["FU", 7, [0, 1, 2, 3]], ["AN", 7, 0, 5], ["FU", 7, [1, 2, 3, 4]], ["AN", 7, 1, 4], ["FU", 7, [2, 3, 4, 5]], ["AN", 7, 2, 6], ["FU", 4, [0, 1, 2, 3]], ["SP", 4, 0, 9, [3], 1], ["AN", 4, 1, 2], ["FFSP", 4, 0, [3, 2, 1, 0], 1, 1], ["AN", 4, 1, 6], ["FU", 2, [0, 1, 2, 3]], ["SP", 2, 0, 6, [3], 1], ["AN", 2, 1, 2], ["FFSP", 2, 0, [3, 2, 1, 0], 1, 1], ["AN", 2, 1, 6], ["PR", 5, 0, "auto_unroll_max_step$0"]]]], "r": [[6.9011e-06, 6.90493e-06, 6.90497e-06, 6.90472e-06], 0, 2.54561, 1664418883], "v": "v0.6"}
{"i": [["[\"f730d9b2b7d3686ece20335c9cd6eaa4\", [50, 3, 32, 32], [3, 3, 1, 1], [1, 3, 1, 1], [50, 3, 32, 32]]", "cuda -keys=cuda,gpu -arch=sm_80 -max_num_threads=1024 -thread_warp_size=32", [-1, 16, 64, 49152, 2147483647, 1024, 8, 32], "", 0, []], [[], [["SP", 3, 0, 50, [1, 25, 1, 2], 1], ["SP", 3, 5, 3, [1, 1, 3, 1], 1], ["SP", 3, 10, 32, [1, 2, 1, 2], 1], ["SP", 3, 15, 32, [1, 2, 1, 1], 1], ["SP", 3, 20, 3, [1, 3], 1], ["SP", 3, 23, 1, [1, 1], 1], ["SP", 3, 26, 1, [1, 1], 1], ["RE", 3, [0, 5, 10, 15, 1, 6, 11, 16, 2, 7, 12, 17, 20, 23, 26, 21, 24, 27, 3, 8, 13, 18, 22, 25, 28, 4, 9, 14, 19]], ["FSP", 5, 0, 0, 3], ["FSP", 5, 4, 1, 3], ["FSP", 5, 8, 2, 3], ["FSP", 5, 12, 3, 3], ["RE", 5, [0, 4, 8, 12, 1, 5, 9, 13, 2, 6, 10, 14, 3, 7, 11, 15]], ["CA", 3, 5, 11], ["CHR", 2, "shared", [3]], ["CA", 3, 4, 14], ["CHR", 1, "shared", [4]], ["CA", 2, 5, 14], ["CI", 1], ["FU", 7, [0, 1, 2, 3]], ["AN", 7, 0, 5], ["FU", 7, [1, 2, 3, 4]], ["AN", 7, 1, 4], ["FU", 7, [2, 3, 4, 5]], ["AN", 7, 2, 6], ["FU", 4, [0, 1, 2, 3]], ["SP", 4, 0, 9, [1], 1], ["AN", 4, 1, 2], ["FFSP", 4, 0, [3, 2, 1, 0], 1, 1], ["AN", 4, 1, 6], ["FU", 2, [0, 1, 2, 3]], ["SP", 2, 0, 6, [2], 1], ["AN", 2, 1, 2], ["FFSP", 2, 0, [3, 2, 1, 0], 1, 1], ["AN", 2, 1, 6], ["PR", 5, 0, "auto_unroll_max_step$0"]]]], "r": [[6.6556e-06, 6.65723e-06, 6.65628e-06, 6.65663e-06], 0, 2.49031, 1664418885], "v": "v0.6"}
{"i": [["[\"f730d9b2b7d3686ece20335c9cd6eaa4\", [50, 3, 32, 32], [3, 3, 1, 1], [1, 3, 1, 1], [50, 3, 32, 32]]", "cuda -keys=cuda,gpu -arch=sm_80 -max_num_threads=1024 -thread_warp_size=32", [-1, 16, 64, 49152, 2147483647, 1024, 8, 32], "", 0, []], [[], [["SP", 3, 0, 50, [1, 1, 10, 1], 1], ["SP", 3, 5, 3, [3, 1, 1, 1], 1], ["SP", 3, 10, 32, [4, 4, 1, 1], 1], ["SP", 3, 15, 32, [1, 4, 4, 1], 1], ["SP", 3, 20, 3, [1, 1], 1], ["SP", 3, 23, 1, [1, 1], 1], ["SP", 3, 26, 1, [1, 1], 1], ["RE", 3, [0, 5, 10, 15, 1, 6, 11, 16, 2, 7, 12, 17, 20, 23, 26, 21, 24, 27, 3, 8, 13, 18, 22, 25, 28, 4, 9, 14, 19]], ["FSP", 5, 0, 0, 3], ["FSP", 5, 4, 1, 3], ["FSP", 5, 8, 2, 3], ["FSP", 5, 12, 3, 3], ["RE", 5, [0, 4, 8, 12, 1, 5, 9, 13, 2, 6, 10, 14, 3, 7, 11, 15]], ["CA", 3, 5, 11], ["CHR", 2, "shared", [3]], ["CA", 3, 4, 14], ["CHR", 1, "shared", [4]], ["CA", 2, 5, 14], ["CI", 1], ["FU", 7, [0, 1, 2, 3]], ["AN", 7, 0, 5], ["FU", 7, [1, 2, 3, 4]], ["AN", 7, 1, 4], ["FU", 7, [2, 3, 4, 5]], ["AN", 7, 2, 6], ["FU", 4, [0, 1, 2, 3]], ["SP", 4, 0, 1, [1], 1], ["AN", 4, 1, 2], ["FFSP", 4, 0, [3, 2, 1, 0], 1, 1], ["AN", 4, 1, 6], ["FU", 2, [0, 1, 2, 3]], ["SP", 2, 0, 40, [1], 1], ["AN", 2, 1, 2], ["FFSP", 2, 0, [3, 2, 1, 0], 1, 1], ["AN", 2, 1, 6], ["PR", 5, 0, "auto_unroll_max_step$512"]]]], "r": [[3.46972e-05, 3.47022e-05, 3.47025e-05, 3.4732e-05], 0, 4.50602, 1664418888], "v": "v0.6"}
{"i": [["[\"f730d9b2b7d3686ece20335c9cd6eaa4\", [50, 3, 32, 32], [3, 3, 1, 1], [1, 3, 1, 1], [50, 3, 32, 32]]", "cuda -keys=cuda,gpu -arch=sm_80 -max_num_threads=1024 -thread_warp_size=32", [-1, 16, 64, 49152, 2147483647, 1024, 8, 32], "", 0, []], [[], [["SP", 3, 0, 50, [1, 1, 10, 1], 1], ["SP", 3, 5, 3, [1, 1, 3, 1], 1], ["SP", 3, 10, 32, [4, 4, 1, 1], 1], ["SP", 3, 15, 32, [1, 4, 4, 1], 1], ["SP", 3, 20, 3, [1, 1], 1], ["SP", 3, 23, 1, [1, 1], 1], ["SP", 3, 26, 1, [1, 1], 1], ["RE", 3, [0, 5, 10, 15, 1, 6, 11, 16, 2, 7, 12, 17, 20, 23, 26, 21, 24, 27, 3, 8, 13, 18, 22, 25, 28, 4, 9, 14, 19]], ["FSP", 5, 0, 0, 3], ["FSP", 5, 4, 1, 3], ["FSP", 5, 8, 2, 3], ["FSP", 5, 12, 3, 3], ["RE", 5, [0, 4, 8, 12, 1, 5, 9, 13, 2, 6, 10, 14, 3, 7, 11, 15]], ["CA", 3, 5, 11], ["CHR", 2, "shared", [3]], ["CA", 3, 4, 14], ["CHR", 1, "shared", [4]], ["CA", 2, 5, 14], ["CI", 1], ["FU", 7, [0, 1, 2, 3]], ["AN", 7, 0, 5], ["FU", 7, [1, 2, 3, 4]], ["AN", 7, 1, 4], ["FU", 7, [2, 3, 4, 5]], ["AN", 7, 2, 6], ["FU", 4, [0, 1, 2, 3]], ["SP", 4, 0, 1, [1], 1], ["AN", 4, 1, 2], ["FFSP", 4, 0, [3, 2, 1, 0], 1, 1], ["AN", 4, 1, 6], ["FU", 2, [0, 1, 2, 3]], ["SP", 2, 0, 40, [1], 1], ["AN", 2, 1, 2], ["FFSP", 2, 0, [3, 2, 1, 0], 1, 1], ["AN", 2, 1, 6], ["PR", 5, 0, "auto_unroll_max_step$64"]]]], "r": [[2.21146e-05, 2.21189e-05, 2.21126e-05, 2.20824e-05], 0, 3.27236, 1664418890], "v": "v0.6"}
{"i": [["[\"f730d9b2b7d3686ece20335c9cd6eaa4\", [50, 3, 32, 32], [3, 3, 1, 1], [1, 3, 1, 1], [50, 3, 32, 32]]", "cuda -keys=cuda,gpu -arch=sm_80 -max_num_threads=1024 -thread_warp_size=32", [-1, 16, 64, 49152, 2147483647, 1024, 8, 32], "", 0, []], [[], [["SP", 3, 0, 50, [1, 5, 2, 1], 1], ["SP", 3, 5, 3, [1, 1, 1, 1], 1], ["SP", 3, 10, 32, [8, 2, 1, 2], 1], ["SP", 3, 15, 32, [1, 8, 1, 1], 1], ["SP", 3, 20, 3, [3, 1], 1], ["SP", 3, 23, 1, [1, 1], 1], ["SP", 3, 26, 1, [1, 1], 1], ["RE", 3, [0, 5, 10, 15, 1, 6, 11, 16, 2, 7, 12, 17, 20, 23, 26, 21, 24, 27, 3, 8, 13, 18, 22, 25, 28, 4, 9, 14, 19]], ["FSP", 5, 0, 0, 3], ["FSP", 5, 4, 1, 3], ["FSP", 5, 8, 2, 3], ["FSP", 5, 12, 3, 3], ["RE", 5, [0, 4, 8, 12, 1, 5, 9, 13, 2, 6, 10, 14, 3, 7, 11, 15]], ["CA", 3, 5, 11], ["CHR", 2, "shared", [3]], ["CA", 3, 4, 14], ["CHR", 1, "shared", [4]], ["CA", 2, 5, 14], ["CI", 1], ["FU", 7, [0, 1, 2, 3]], ["AN", 7, 0, 5], ["FU", 7, [1, 2, 3, 4]], ["AN", 7, 1, 4], ["FU", 7, [2, 3, 4, 5]], ["AN", 7, 2, 6], ["FU", 4, [0, 1, 2, 3]], ["SP", 4, 0, 9, [1], 1], ["AN", 4, 1, 2], ["FFSP", 4, 0, [3, 2, 1, 0], 1, 1], ["AN", 4, 1, 6], ["FU", 2, [0, 1, 2, 3]], ["SP", 2, 0, 12, [1], 1], ["AN", 2, 1, 2], ["FFSP", 2, 0, [3, 2, 1, 0], 1, 1], ["AN", 2, 1, 6], ["PR", 5, 0, "auto_unroll_max_step$0"]]]], "r": [[4.56622e-06, 4.5684e-06, 4.56684e-06, 4.56743e-06], 0, 2.44891, 1664418892], "v": "v0.6"}
{"i": [["[\"f730d9b2b7d3686ece20335c9cd6eaa4\", [50, 3, 32, 32], [3, 3, 1, 1], [1, 3, 1, 1], [50, 3, 32, 32]]", "cuda -keys=cuda,gpu -arch=sm_80 -max_num_threads=1024 -thread_warp_size=32", [-1, 16, 64, 49152, 2147483647, 1024, 8, 32], "", 0, []], [[], [["SP", 3, 0, 50, [1, 1, 1, 50], 1], ["SP", 3, 5, 3, [1, 1, 3, 1], 1], ["SP", 3, 10, 32, [1, 1, 1, 4], 1], ["SP", 3, 15, 32, [4, 4, 1, 1], 1], ["SP", 3, 20, 3, [3, 1], 1], ["SP", 3, 23, 1, [1, 1], 1], ["SP", 3, 26, 1, [1, 1], 1], ["RE", 3, [0, 5, 10, 15, 1, 6, 11, 16, 2, 7, 12, 17, 20, 23, 26, 21, 24, 27, 3, 8, 13, 18, 22, 25, 28, 4, 9, 14, 19]], ["FSP", 5, 0, 0, 3], ["FSP", 5, 4, 1, 3], ["FSP", 5, 8, 2, 3], ["FSP", 5, 12, 3, 3], ["RE", 5, [0, 4, 8, 12, 1, 5, 9, 13, 2, 6, 10, 14, 3, 7, 11, 15]], ["CA", 3, 5, 11], ["CHR", 2, "shared", [3]], ["CA", 3, 4, 14], ["CHR", 1, "shared", [4]], ["CA", 2, 5, 14], ["CI", 1], ["FU", 7, [0, 1, 2, 3]], ["AN", 7, 0, 5], ["FU", 7, [1, 2, 3, 4]], ["AN", 7, 1, 4], ["FU", 7, [2, 3, 4, 5]], ["AN", 7, 2, 6], ["FU", 4, [0, 1, 2, 3]], ["SP", 4, 0, 9, [1], 1], ["AN", 4, 1, 2], ["FFSP", 4, 0, [3, 2, 1, 0], 1, 1], ["AN", 4, 1, 6], ["FU", 2, [0, 1, 2, 3]], ["SP", 2, 0, 24, [1], 1], ["AN", 2, 1, 2], ["FFSP", 2, 0, [3, 2, 1, 0], 1, 1], ["AN", 2, 1, 6], ["PR", 5, 0, "auto_unroll_max_step$512"]]]], "r": [[0.000114923, 0.000114958, 0.000114921, 0.000114955], 0, 3.16233, 1664418895], "v": "v0.6"}
{"i": [["[\"f730d9b2b7d3686ece20335c9cd6eaa4\", [50, 3, 32, 32], [3, 3, 1, 1], [1, 3, 1, 1], [50, 3, 32, 32]]", "cuda -keys=cuda,gpu -arch=sm_80 -max_num_threads=1024 -thread_warp_size=32", [-1, 16, 64, 49152, 2147483647, 1024, 8, 32], "", 0, []], [[], [["SP", 3, 0, 50, [1, 5, 5, 1], 1], ["SP", 3, 5, 3, [3, 1, 1, 1], 1], ["SP", 3, 10, 32, [1, 1, 1, 2], 1], ["SP", 3, 15, 32, [1, 4, 8, 1], 1], ["SP", 3, 20, 3, [1, 1], 1], ["SP", 3, 23, 1, [1, 1], 1], ["SP", 3, 26, 1, [1, 1], 1], ["RE", 3, [0, 5, 10, 15, 1, 6, 11, 16, 2, 7, 12, 17, 20, 23, 26, 21, 24, 27, 3, 8, 13, 18, 22, 25, 28, 4, 9, 14, 19]], ["FSP", 5, 0, 0, 3], ["FSP", 5, 4, 1, 3], ["FSP", 5, 8, 2, 3], ["FSP", 5, 12, 3, 3], ["RE", 5, [0, 4, 8, 12, 1, 5, 9, 13, 2, 6, 10, 14, 3, 7, 11, 15]], ["CA", 3, 5, 11], ["CHR", 2, "shared", [3]], ["CA", 3, 4, 14], ["CHR", 1, "shared", [4]], ["CA", 2, 5, 14], ["CI", 1], ["FU", 7, [0, 1, 2, 3]], ["AN", 7, 0, 5], ["FU", 7, [1, 2, 3, 4]], ["AN", 7, 1, 4], ["FU", 7, [2, 3, 4, 5]], ["AN", 7, 2, 6], ["FU", 4, [0, 1, 2, 3]], ["SP", 4, 0, 3, [1], 1], ["AN", 4, 1, 2], ["FFSP", 4, 0, [3, 2, 1, 0], 1, 1], ["AN", 4, 1, 6], ["FU", 2, [0, 1, 2, 3]], ["SP", 2, 0, 120, [4], 1], ["AN", 2, 1, 2], ["FFSP", 2, 0, [3, 2, 1, 0], 1, 1], ["AN", 2, 1, 6], ["PR", 5, 0, "auto_unroll_max_step$1024"]]]], "r": [[6.86698e-06, 6.87461e-06, 6.87967e-06, 6.87978e-06], 0, 3.80222, 1664418897], "v": "v0.6"}
{"i": [["[\"f730d9b2b7d3686ece20335c9cd6eaa4\", [50, 3, 32, 32], [3, 3, 1, 1], [1, 3, 1, 1], [50, 3, 32, 32]]", "cuda -keys=cuda,gpu -arch=sm_80 -max_num_threads=1024 -thread_warp_size=32", [-1, 16, 64, 49152, 2147483647, 1024, 8, 32], "", 0, []], [[], [["SP", 3, 0, 50, [1, 10, 1, 1], 1], ["SP", 3, 5, 3, [1, 1, 1, 1], 1], ["SP", 3, 10, 32, [1, 8, 1, 1], 1], ["SP", 3, 15, 32, [2, 1, 8, 2], 1], ["SP", 3, 20, 3, [1, 1], 1], ["SP", 3, 23, 1, [1, 1], 1], ["SP", 3, 26, 1, [1, 1], 1], ["RE", 3, [0, 5, 10, 15, 1, 6, 11, 16, 2, 7, 12, 17, 20, 23, 26, 21, 24, 27, 3, 8, 13, 18, 22, 25, 28, 4, 9, 14, 19]], ["FSP", 5, 0, 0, 3], ["FSP", 5, 4, 1, 3], ["FSP", 5, 8, 2, 3], ["FSP", 5, 12, 3, 3], ["RE", 5, [0, 4, 8, 12, 1, 5, 9, 13, 2, 6, 10, 14, 3, 7, 11, 15]], ["CA", 3, 5, 11], ["CHR", 2, "shared", [3]], ["CA", 3, 4, 14], ["CHR", 1, "shared", [4]], ["CA", 2, 5, 14], ["CI", 1], ["FU", 7, [0, 1, 2, 3]], ["AN", 7, 0, 5], ["FU", 7, [1, 2, 3, 4]], ["AN", 7, 1, 4], ["FU", 7, [2, 3, 4, 5]], ["AN", 7, 2, 6], ["FU", 4, [0, 1, 2, 3]], ["SP", 4, 0, 1, [1], 1], ["AN", 4, 1, 2], ["FFSP", 4, 0, [3, 2, 1, 0], 1, 1], ["AN", 4, 1, 6], ["FU", 2, [0, 1, 2, 3]], ["SP", 2, 0, 16, [1], 1], ["AN", 2, 1, 2], ["FFSP", 2, 0, [3, 2, 1, 0], 1, 1], ["AN", 2, 1, 6], ["PR", 5, 0, "auto_unroll_max_step$1024"]]]], "r": [[1.08258e-05, 1.08261e-05, 1.08266e-05, 1.08351e-05], 0, 3.02847, 1664418900], "v": "v0.6"}
{"i": [["[\"f730d9b2b7d3686ece20335c9cd6eaa4\", [50, 3, 32, 32], [3, 3, 1, 1], [1, 3, 1, 1], [50, 3, 32, 32]]", "cuda -keys=cuda,gpu -arch=sm_80 -max_num_threads=1024 -thread_warp_size=32", [-1, 16, 64, 49152, 2147483647, 1024, 8, 32], "", 0, []], [[], [["SP", 3, 0, 50, [1, 25, 1, 2], 1], ["SP", 3, 5, 3, [1, 3, 1, 1], 1], ["SP", 3, 10, 32, [8, 1, 1, 2], 1], ["SP", 3, 15, 32, [1, 1, 2, 2], 1], ["SP", 3, 20, 3, [1, 3], 1], ["SP", 3, 23, 1, [1, 1], 1], ["SP", 3, 26, 1, [1, 1], 1], ["RE", 3, [0, 5, 10, 15, 1, 6, 11, 16, 2, 7, 12, 17, 20, 23, 26, 21, 24, 27, 3, 8, 13, 18, 22, 25, 28, 4, 9, 14, 19]], ["FSP", 5, 0, 0, 3], ["FSP", 5, 4, 1, 3], ["FSP", 5, 8, 2, 3], ["FSP", 5, 12, 3, 3], ["RE", 5, [0, 4, 8, 12, 1, 5, 9, 13, 2, 6, 10, 14, 3, 7, 11, 15]], ["CA", 3, 5, 11], ["CHR", 2, "shared", [3]], ["CA", 3, 4, 14], ["CHR", 1, "shared", [4]], ["CA", 2, 5, 14], ["CI", 1], ["FU", 7, [0, 1, 2, 3]], ["AN", 7, 0, 5], ["FU", 7, [1, 2, 3, 4]], ["AN", 7, 1, 4], ["FU", 7, [2, 3, 4, 5]], ["AN", 7, 2, 6], ["FU", 4, [0, 1, 2, 3]], ["SP", 4, 0, 3, [1], 1], ["AN", 4, 1, 2], ["FFSP", 4, 0, [3, 2, 1, 0], 1, 1], ["AN", 4, 1, 6], ["FU", 2, [0, 1, 2, 3]], ["SP", 2, 0, 48, [4], 1], ["AN", 2, 1, 2], ["FFSP", 2, 0, [3, 2, 1, 0], 1, 1], ["AN", 2, 1, 6], ["PR", 5, 0, "auto_unroll_max_step$16"]]]], "r": [[2.54753e-05, 2.54619e-05, 2.54794e-05, 2.54688e-05], 0, 3.27544, 1664418902], "v": "v0.6"}
{"i": [["[\"f730d9b2b7d3686ece20335c9cd6eaa4\", [50, 3, 32, 32], [3, 3, 1, 1], [1, 3, 1, 1], [50, 3, 32, 32]]", "cuda -keys=cuda,gpu -arch=sm_80 -max_num_threads=1024 -thread_warp_size=32", [-1, 16, 64, 49152, 2147483647, 1024, 8, 32], "", 0, []], [[], [["SP", 3, 0, 50, [2, 1, 25, 1], 1], ["SP", 3, 5, 3, [1, 1, 1, 3], 1], ["SP", 3, 10, 32, [1, 2, 1, 1], 1], ["SP", 3, 15, 32, [1, 32, 1, 1], 1], ["SP", 3, 20, 3, [1, 1], 1], ["SP", 3, 23, 1, [1, 1], 1], ["SP", 3, 26, 1, [1, 1], 1], ["RE", 3, [0, 5, 10, 15, 1, 6, 11, 16, 2, 7, 12, 17, 20, 23, 26, 21, 24, 27, 3, 8, 13, 18, 22, 25, 28, 4, 9, 14, 19]], ["FSP", 5, 0, 0, 3], ["FSP", 5, 4, 1, 3], ["FSP", 5, 8, 2, 3], ["FSP", 5, 12, 3, 3], ["RE", 5, [0, 4, 8, 12, 1, 5, 9, 13, 2, 6, 10, 14, 3, 7, 11, 15]], ["CA", 3, 5, 11], ["CHR", 2, "shared", [3]], ["CA", 3, 4, 14], ["CHR", 1, "shared", [4]], ["CA", 2, 5, 14], ["CI", 1], ["FU", 7, [0, 1, 2, 3]], ["AN", 7, 0, 5], ["FU", 7, [1, 2, 3, 4]], ["AN", 7, 1, 4], ["FU", 7, [2, 3, 4, 5]], ["AN", 7, 2, 6], ["FU", 4, [0, 1, 2, 3]], ["SP", 4, 0, 3, [1], 1], ["AN", 4, 1, 2], ["FFSP", 4, 0, [3, 2, 1, 0], 1, 1], ["AN", 4, 1, 6], ["FU", 2, [0, 1, 2, 3]], ["SP", 2, 0, 25, [1], 1], ["AN", 2, 1, 2], ["FFSP", 2, 0, [3, 2, 1, 0], 1, 1], ["AN", 2, 1, 6], ["PR", 5, 0, "auto_unroll_max_step$0"]]]], "r": [[7.29901e-06, 7.29913e-06, 7.30648e-06, 7.30282e-06], 0, 2.6579, 1664418904], "v": "v0.6"}
{"i": [["[\"f730d9b2b7d3686ece20335c9cd6eaa4\", [50, 3, 32, 32], [3, 3, 1, 1], [1, 3, 1, 1], [50, 3, 32, 32]]", "cuda -keys=cuda,gpu -arch=sm_80 -max_num_threads=1024 -thread_warp_size=32", [-1, 16, 64, 49152, 2147483647, 1024, 8, 32], "", 0, []], [[], [["SP", 3, 0, 50, [2, 1, 5, 1], 1], ["SP", 3, 5, 3, [1, 3, 1, 1], 1], ["SP", 3, 10, 32, [4, 2, 2, 2], 1], ["SP", 3, 15, 32, [1, 4, 1, 2], 1], ["SP", 3, 20, 3, [1, 1], 1], ["SP", 3, 23, 1, [1, 1], 1], ["SP", 3, 26, 1, [1, 1], 1], ["RE", 3, [0, 5, 10, 15, 1, 6, 11, 16, 2, 7, 12, 17, 20, 23, 26, 21, 24, 27, 3, 8, 13, 18, 22, 25, 28, 4, 9, 14, 19]], ["FSP", 5, 0, 0, 3], ["FSP", 5, 4, 1, 3], ["FSP", 5, 8, 2, 3], ["FSP", 5, 12, 3, 3], ["RE", 5, [0, 4, 8, 12, 1, 5, 9, 13, 2, 6, 10, 14, 3, 7, 11, 15]], ["CA", 3, 5, 11], ["CHR", 2, "shared", [3]], ["CA", 3, 4, 14], ["CHR", 1, "shared", [4]], ["CA", 2, 5, 14], ["CI", 1], ["FU", 7, [0, 1, 2, 3]], ["AN", 7, 0, 5], ["FU", 7, [1, 2, 3, 4]], ["AN", 7, 1, 4], ["FU", 7, [2, 3, 4, 5]], ["AN", 7, 2, 6], ["FU", 4, [0, 1, 2, 3]], ["SP", 4, 0, 1, [1], 1], ["AN", 4, 1, 2], ["FFSP", 4, 0, [3, 2, 1, 0], 1, 1], ["AN", 4, 1, 6], ["FU", 2, [0, 1, 2, 3]], ["SP", 2, 0, 40, [1], 1], ["AN", 2, 1, 2], ["FFSP", 2, 0, [3, 2, 1, 0], 1, 1], ["AN", 2, 1, 6], ["PR", 5, 0, "auto_unroll_max_step$1024"]]]], "r": [[3.25235e-05, 3.2501e-05, 3.2504e-05, 3.24976e-05], 0, 4.76296, 1664418907], "v": "v0.6"}
{"i": [["[\"f730d9b2b7d3686ece20335c9cd6eaa4\", [50, 3, 32, 32], [3, 3, 1, 1], [1, 3, 1, 1], [50, 3, 32, 32]]", "cuda -keys=cuda,gpu -arch=sm_80 -max_num_threads=1024 -thread_warp_size=32", [-1, 16, 64, 49152, 2147483647, 1024, 8, 32], "", 0, []], [[], [["SP", 3, 0, 50, [1, 2, 1, 1], 1], ["SP", 3, 5, 3, [1, 1, 3, 1], 1], ["SP", 3, 10, 32, [4, 2, 1, 2], 1], ["SP", 3, 15, 32, [2, 8, 1, 1], 1], ["SP", 3, 20, 3, [3, 1], 1], ["SP", 3, 23, 1, [1, 1], 1], ["SP", 3, 26, 1, [1, 1], 1], ["RE", 3, [0, 5, 10, 15, 1, 6, 11, 16, 2, 7, 12, 17, 20, 23, 26, 21, 24, 27, 3, 8, 13, 18, 22, 25, 28, 4, 9, 14, 19]], ["FSP", 5, 0, 0, 3], ["FSP", 5, 4, 1, 3], ["FSP", 5, 8, 2, 3], ["FSP", 5, 12, 3, 3], ["RE", 5, [0, 4, 8, 12, 1, 5, 9, 13, 2, 6, 10, 14, 3, 7, 11, 15]], ["CA", 3, 5, 11], ["CHR", 2, "shared", [3]], ["CA", 3, 4, 14], ["CHR", 1, "shared", [4]], ["CA", 2, 5, 14], ["CI", 1], ["FU", 7, [0, 1, 2, 3]], ["AN", 7, 0, 5], ["FU", 7, [1, 2, 3, 4]], ["AN", 7, 1, 4], ["FU", 7, [2, 3, 4, 5]], ["AN", 7, 2, 6], ["FU", 4, [0, 1, 2, 3]], ["SP", 4, 0, 9, [3], 1], ["AN", 4, 1, 2], ["FFSP", 4, 0, [3, 2, 1, 0], 1, 1], ["AN", 4, 1, 6], ["FU", 2, [0, 1, 2, 3]], ["SP", 2, 0, 12, [1], 1], ["AN", 2, 1, 2], ["FFSP", 2, 0, [3, 2, 1, 0], 1, 1], ["AN", 2, 1, 6], ["PR", 5, 0, "auto_unroll_max_step$512"]]]], "r": [[3.58963e-06, 3.58956e-06, 3.58965e-06, 3.58947e-06], 0, 2.33105, 1664418909], "v": "v0.6"}
{"i": [["[\"f730d9b2b7d3686ece20335c9cd6eaa4\", [50, 3, 32, 32], [3, 3, 1, 1], [1, 3, 1, 1], [50, 3, 32, 32]]", "cuda -keys=cuda,gpu -arch=sm_80 -max_num_threads=1024 -thread_warp_size=32", [-1, 16, 64, 49152, 2147483647, 1024, 8, 32], "", 0, []], [[], [["SP", 3, 0, 50, [1, 2, 25, 1], 1], ["SP", 3, 5, 3, [1, 3, 1, 1], 1], ["SP", 3, 10, 32, [4, 1, 2, 1], 1], ["SP", 3, 15, 32, [1, 1, 8, 1], 1], ["SP", 3, 20, 3, [1, 3], 1], ["SP", 3, 23, 1, [1, 1], 1], ["SP", 3, 26, 1, [1, 1], 1], ["RE", 3, [0, 5, 10, 15, 1, 6, 11, 16, 2, 7, 12, 17, 20, 23, 26, 21, 24, 27, 3, 8, 13, 18, 22, 25, 28, 4, 9, 14, 19]], ["FSP", 5, 0, 0, 3], ["FSP", 5, 4, 1, 3], ["FSP", 5, 8, 2, 3], ["FSP", 5, 12, 3, 3], ["RE", 5, [0, 4, 8, 12, 1, 5, 9, 13, 2, 6, 10, 14, 3, 7, 11, 15]], ["CA", 3, 5, 11], ["CHR", 2, "shared", [3]], ["CA", 3, 4, 14], ["CHR", 1, "shared", [4]], ["CA", 2, 5, 14], ["CI", 1], ["FU", 7, [0, 1, 2, 3]], ["AN", 7, 0, 5], ["FU", 7, [1, 2, 3, 4]], ["AN", 7, 1, 4], ["FU", 7, [2, 3, 4, 5]], ["AN", 7, 2, 6], ["FU", 4, [0, 1, 2, 3]], ["SP", 4, 0, 3, [1], 1], ["AN", 4, 1, 2], ["FFSP", 4, 0, [3, 2, 1, 0], 1, 1], ["AN", 4, 1, 6], ["FU", 2, [0, 1, 2, 3]], ["SP", 2, 0, 300, [1], 1], ["AN", 2, 1, 2], ["FFSP", 2, 0, [3, 2, 1, 0], 1, 1], ["AN", 2, 1, 6], ["PR", 5, 0, "auto_unroll_max_step$0"]]]], "r": [[9.50376e-05, 9.50768e-05, 9.50543e-05, 9.50525e-05], 0, 3.10822, 1664418911], "v": "v0.6"}
{"i": [["[\"f730d9b2b7d3686ece20335c9cd6eaa4\", [50, 3, 32, 32], [3, 3, 1, 1], [1, 3, 1, 1], [50, 3, 32, 32]]", "cuda -keys=cuda,gpu -arch=sm_80 -max_num_threads=1024 -thread_warp_size=32", [-1, 16, 64, 49152, 2147483647, 1024, 8, 32], "", 0, []], [[], [["SP", 3, 0, 50, [1, 5, 1, 2], 1], ["SP", 3, 5, 3, [1, 1, 1, 3], 1], ["SP", 3, 10, 32, [1, 1, 1, 16], 1], ["SP", 3, 15, 32, [1, 16, 1, 1], 1], ["SP", 3, 20, 3, [1, 1], 1], ["SP", 3, 23, 1, [1, 1], 1], ["SP", 3, 26, 1, [1, 1], 1], ["RE", 3, [0, 5, 10, 15, 1, 6, 11, 16, 2, 7, 12, 17, 20, 23, 26, 21, 24, 27, 3, 8, 13, 18, 22, 25, 28, 4, 9, 14, 19]], ["FSP", 5, 0, 0, 3], ["FSP", 5, 4, 1, 3], ["FSP", 5, 8, 2, 3], ["FSP", 5, 12, 3, 3], ["RE", 5, [0, 4, 8, 12, 1, 5, 9, 13, 2, 6, 10, 14, 3, 7, 11, 15]], ["CA", 3, 5, 11], ["CHR", 2, "shared", [3]], ["CA", 3, 4, 14], ["CHR", 1, "shared", [4]], ["CA", 2, 5, 14], ["CI", 1], ["FU", 7, [0, 1, 2, 3]], ["AN", 7, 0, 5], ["FU", 7, [1, 2, 3, 4]], ["AN", 7, 1, 4], ["FU", 7, [2, 3, 4, 5]], ["AN", 7, 2, 6], ["FU", 4, [0, 1, 2, 3]], ["SP", 4, 0, 3, [3], 1], ["AN", 4, 1, 2], ["FFSP", 4, 0, [3, 2, 1, 0], 1, 1], ["AN", 4, 1, 6], ["FU", 2, [0, 1, 2, 3]], ["SP", 2, 0, 32, [1], 1], ["AN", 2, 1, 2], ["FFSP", 2, 0, [3, 2, 1, 0], 1, 1], ["AN", 2, 1, 6], ["PR", 5, 0, "auto_unroll_max_step$16"]]]], "r": [[7.50458e-06, 7.50689e-06, 7.50645e-06, 7.50794e-06], 0, 2.70623, 1664418913], "v": "v0.6"}
{"i": [["[\"f730d9b2b7d3686ece20335c9cd6eaa4\", [50, 3, 32, 32], [3, 3, 1, 1], [1, 3, 1, 1], [50, 3, 32, 32]]", "cuda -keys=cuda,gpu -arch=sm_80 -max_num_threads=1024 -thread_warp_size=32", [-1, 16, 64, 49152, 2147483647, 1024, 8, 32], "", 0, []], [[], [["SP", 3, 0, 50, [1, 25, 2, 1], 1], ["SP", 3, 5, 3, [1, 1, 3, 1], 1], ["SP", 3, 10, 32, [2, 2, 1, 2], 1], ["SP", 3, 15, 32, [2, 4, 1, 1], 1], ["SP", 3, 20, 3, [1, 3], 1], ["SP", 3, 23, 1, [1, 1], 1], ["SP", 3, 26, 1, [1, 1], 1], ["RE", 3, [0, 5, 10, 15, 1, 6, 11, 16, 2, 7, 12, 17, 20, 23, 26, 21, 24, 27, 3, 8, 13, 18, 22, 25, 28, 4, 9, 14, 19]], ["FSP", 5, 0, 0, 3], ["FSP", 5, 4, 1, 3], ["FSP", 5, 8, 2, 3], ["FSP", 5, 12, 3, 3], ["RE", 5, [0, 4, 8, 12, 1, 5, 9, 13, 2, 6, 10, 14, 3, 7, 11, 15]], ["CA", 3, 5, 11], ["CHR", 2, "shared", [3]], ["CA", 3, 4, 14], ["CHR", 1, "shared", [4]], ["CA", 2, 5, 14], ["CI", 1], ["FU", 7, [0, 1, 2, 3]], ["AN", 7, 0, 5], ["FU", 7, [1, 2, 3, 4]], ["AN", 7, 1, 4], ["FU", 7, [2, 3, 4, 5]], ["AN", 7, 2, 6], ["FU", 4, [0, 1, 2, 3]], ["SP", 4, 0, 9, [1], 1], ["AN", 4, 1, 2], ["FFSP", 4, 0, [3, 2, 1, 0], 1, 1], ["AN", 4, 1, 6], ["FU", 2, [0, 1, 2, 3]], ["SP", 2, 0, 12, [1], 1], ["AN", 2, 1, 2], ["FFSP", 2, 0, [3, 2, 1, 0], 1, 1], ["AN", 2, 1, 6], ["PR", 5, 0, "auto_unroll_max_step$1024"]]]], "r": [[7.66083e-06, 7.66114e-06, 7.66068e-06, 7.66106e-06], 0, 2.76374, 1664418916], "v": "v0.6"}
{"i": [["[\"f730d9b2b7d3686ece20335c9cd6eaa4\", [50, 3, 32, 32], [3, 3, 1, 1], [1, 3, 1, 1], [50, 3, 32, 32]]", "cuda -keys=cuda,gpu -arch=sm_80 -max_num_threads=1024 -thread_warp_size=32", [-1, 16, 64, 49152, 2147483647, 1024, 8, 32], "", 0, []], [[], [["SP", 3, 0, 50, [1, 2, 1, 5], 1], ["SP", 3, 5, 3, [3, 1, 1, 1], 1], ["SP", 3, 10, 32, [1, 8, 1, 2], 1], ["SP", 3, 15, 32, [1, 2, 1, 1], 1], ["SP", 3, 20, 3, [3, 1], 1], ["SP", 3, 23, 1, [1, 1], 1], ["SP", 3, 26, 1, [1, 1], 1], ["RE", 3, [0, 5, 10, 15, 1, 6, 11, 16, 2, 7, 12, 17, 20, 23, 26, 21, 24, 27, 3, 8, 13, 18, 22, 25, 28, 4, 9, 14, 19]], ["FSP", 5, 0, 0, 3], ["FSP", 5, 4, 1, 3], ["FSP", 5, 8, 2, 3], ["FSP", 5, 12, 3, 3], ["RE", 5, [0, 4, 8, 12, 1, 5, 9, 13, 2, 6, 10, 14, 3, 7, 11, 15]], ["CA", 3, 5, 11], ["CHR", 2, "shared", [3]], ["CA", 3, 4, 14], ["CHR", 1, "shared", [4]], ["CA", 2, 5, 14], ["CI", 1], ["FU", 7, [0, 1, 2, 3]], ["AN", 7, 0, 5], ["FU", 7, [1, 2, 3, 4]], ["AN", 7, 1, 4], ["FU", 7, [2, 3, 4, 5]], ["AN", 7, 2, 6], ["FU", 4, [0, 1, 2, 3]], ["SP", 4, 0, 9, [1], 1], ["AN", 4, 1, 2], ["FFSP", 4, 0, [3, 2, 1, 0], 1, 1], ["AN", 4, 1, 6], ["FU", 2, [0, 1, 2, 3]], ["SP", 2, 0, 30, [3], 1], ["AN", 2, 1, 2], ["FFSP", 2, 0, [3, 2, 1, 0], 1, 1], ["AN", 2, 1, 6], ["PR", 5, 0, "auto_unroll_max_step$0"]]]], "r": [[7.59604e-06, 7.59483e-06, 7.59597e-06, 7.59566e-06], 0, 2.553, 1664418918], "v": "v0.6"}
{"i": [["[\"f730d9b2b7d3686ece20335c9cd6eaa4\", [50, 3, 32, 32], [3, 3, 1, 1], [1, 3, 1, 1], [50, 3, 32, 32]]", "cuda -keys=cuda,gpu -arch=sm_80 -max_num_threads=1024 -thread_warp_size=32", [-1, 16, 64, 49152, 2147483647, 1024, 8, 32], "", 0, []], [[], [["SP", 3, 0, 50, [1, 1, 5, 1], 1], ["SP", 3, 5, 3, [1, 3, 1, 1], 1], ["SP", 3, 10, 32, [4, 2, 2, 2], 1], ["SP", 3, 15, 32, [1, 4, 2, 1], 1], ["SP", 3, 20, 3, [1, 1], 1], ["SP", 3, 23, 1, [1, 1], 1], ["SP", 3, 26, 1, [1, 1], 1], ["RE", 3, [0, 5, 10, 15, 1, 6, 11, 16, 2, 7, 12, 17, 20, 23, 26, 21, 24, 27, 3, 8, 13, 18, 22, 25, 28, 4, 9, 14, 19]], ["FSP", 5, 0, 0, 3], ["FSP", 5, 4, 1, 3], ["FSP", 5, 8, 2, 3], ["FSP", 5, 12, 3, 3], ["RE", 5, [0, 4, 8, 12, 1, 5, 9, 13, 2, 6, 10, 14, 3, 7, 11, 15]], ["CA", 3, 5, 11], ["CHR", 2, "shared", [3]], ["CA", 3, 4, 14], ["CHR", 1, "shared", [4]], ["CA", 2, 5, 14], ["CI", 1], ["FU", 7, [0, 1, 2, 3]], ["AN", 7, 0, 5], ["FU", 7, [1, 2, 3, 4]], ["AN", 7, 1, 4], ["FU", 7, [2, 3, 4, 5]], ["AN", 7, 2, 6], ["FU", 4, [0, 1, 2, 3]], ["SP", 4, 0, 1, [1], 1], ["AN", 4, 1, 2], ["FFSP", 4, 0, [3, 2, 1, 0], 1, 1], ["AN", 4, 1, 6], ["FU", 2, [0, 1, 2, 3]], ["SP", 2, 0, 40, [1], 1], ["AN", 2, 1, 2], ["FFSP", 2, 0, [3, 2, 1, 0], 1, 1], ["AN", 2, 1, 6], ["PR", 5, 0, "auto_unroll_max_step$1024"]]]], "r": [[6.82551e-06, 6.8254e-06, 6.82562e-06, 6.82237e-06], 0, 3.85253, 1664418920], "v": "v0.6"}
{"i": [["[\"f730d9b2b7d3686ece20335c9cd6eaa4\", [50, 3, 32, 32], [3, 3, 1, 1], [1, 3, 1, 1], [50, 3, 32, 32]]", "cuda -keys=cuda,gpu -arch=sm_80 -max_num_threads=1024 -thread_warp_size=32", [-1, 16, 64, 49152, 2147483647, 1024, 8, 32], "", 0, []], [[], [["SP", 3, 0, 50, [1, 1, 10, 1], 1], ["SP", 3, 5, 3, [1, 3, 1, 1], 1], ["SP", 3, 10, 32, [1, 1, 2, 4], 1], ["SP", 3, 15, 32, [2, 1, 4, 4], 1], ["SP", 3, 20, 3, [1, 3], 1], ["SP", 3, 23, 1, [1, 1], 1], ["SP", 3, 26, 1, [1, 1], 1], ["RE", 3, [0, 5, 10, 15, 1, 6, 11, 16, 2, 7, 12, 17, 20, 23, 26, 21, 24, 27, 3, 8, 13, 18, 22, 25, 28, 4, 9, 14, 19]], ["FSP", 5, 0, 0, 3], ["FSP", 5, 4, 1, 3], ["FSP", 5, 8, 2, 3], ["FSP", 5, 12, 3, 3], ["RE", 5, [0, 4, 8, 12, 1, 5, 9, 13, 2, 6, 10, 14, 3, 7, 11, 15]], ["CA", 3, 5, 11], ["CHR", 2, "shared", [3]], ["CA", 3, 4, 14], ["CHR", 1, "shared", [4]], ["CA", 2, 5, 14], ["CI", 1], ["FU", 7, [0, 1, 2, 3]], ["AN", 7, 0, 5], ["FU", 7, [1, 2, 3, 4]], ["AN", 7, 1, 4], ["FU", 7, [2, 3, 4, 5]], ["AN", 7, 2, 6], ["FU", 4, [0, 1, 2, 3]], ["SP", 4, 0, 1, [1], 1], ["AN", 4, 1, 2], ["FFSP", 4, 0, [3, 2, 1, 0], 1, 1], ["AN", 4, 1, 6], ["FU", 2, [0, 1, 2, 3]], ["SP", 2, 0, 128, [1], 1], ["AN", 2, 1, 2], ["FFSP", 2, 0, [3, 2, 1, 0], 1, 1], ["AN", 2, 1, 6], ["PR", 5, 0, "auto_unroll_max_step$512"]]]], "r": [[0.000145938, 0.000146003, 0.000146044, 0.000146041], 0, 5.96683, 1664418922], "v": "v0.6"}
{"i": [["[\"f730d9b2b7d3686ece20335c9cd6eaa4\", [50, 3, 32, 32], [3, 3, 1, 1], [1, 3, 1, 1], [50, 3, 32, 32]]", "cuda -keys=cuda,gpu -arch=sm_80 -max_num_threads=1024 -thread_warp_size=32", [-1, 16, 64, 49152, 2147483647, 1024, 8, 32], "", 0, []], [[], [["SP", 3, 0, 50, [1, 1, 10, 1], 1], ["SP", 3, 5, 3, [3, 1, 1, 1], 1], ["SP", 3, 10, 32, [2, 16, 1, 1], 1], ["SP", 3, 15, 32, [1, 4, 2, 1], 1], ["SP", 3, 20, 3, [3, 1], 1], ["SP", 3, 23, 1, [1, 1], 1], ["SP", 3, 26, 1, [1, 1], 1], ["RE", 3, [0, 5, 10, 15, 1, 6, 11, 16, 2, 7, 12, 17, 20, 23, 26, 21, 24, 27, 3, 8, 13, 18, 22, 25, 28, 4, 9, 14, 19]], ["FSP", 5, 0, 0, 3], ["FSP", 5, 4, 1, 3], ["FSP", 5, 8, 2, 3], ["FSP", 5, 12, 3, 3], ["RE", 5, [0, 4, 8, 12, 1, 5, 9, 13, 2, 6, 10, 14, 3, 7, 11, 15]], ["CA", 3, 5, 11], ["CHR", 2, "shared", [3]], ["CA", 3, 4, 14], ["CHR", 1, "shared", [4]], ["CA", 2, 5, 14], ["CI", 1], ["FU", 7, [0, 1, 2, 3]], ["AN", 7, 0, 5], ["FU", 7, [1, 2, 3, 4]], ["AN", 7, 1, 4], ["FU", 7, [2, 3, 4, 5]], ["AN", 7, 2, 6], ["FU", 4, [0, 1, 2, 3]], ["SP", 4, 0, 3, [1], 1], ["AN", 4, 1, 2], ["FFSP", 4, 0, [3, 2, 1, 0], 1, 1], ["AN", 4, 1, 6], ["FU", 2, [0, 1, 2, 3]], ["SP", 2, 0, 60, [1], 1], ["AN", 2, 1, 2], ["FFSP", 2, 0, [3, 2, 1, 0], 1, 1], ["AN", 2, 1, 6], ["PR", 5, 0, "auto_unroll_max_step$1024"]]]], "r": [[6.13696e-06, 6.1342e-06, 6.13262e-06, 6.13723e-06], 0, 2.97525, 1664418925], "v": "v0.6"}
{"i": [["[\"f730d9b2b7d3686ece20335c9cd6eaa4\", [50, 3, 32, 32], [3, 3, 1, 1], [1, 3, 1, 1], [50, 3, 32, 32]]", "cuda -keys=cuda,gpu -arch=sm_80 -max_num_threads=1024 -thread_warp_size=32", [-1, 16, 64, 49152, 2147483647, 1024, 8, 32], "", 0, []], [[], [["SP", 3, 0, 50, [1, 5, 1, 1], 1], ["SP", 3, 5, 3, [1, 3, 1, 1], 1], ["SP", 3, 10, 32, [1, 1, 1, 8], 1], ["SP", 3, 15, 32, [1, 4, 1, 4], 1], ["SP", 3, 20, 3, [1, 1], 1], ["SP", 3, 23, 1, [1, 1], 1], ["SP", 3, 26, 1, [1, 1], 1], ["RE", 3, [0, 5, 10, 15, 1, 6, 11, 16, 2, 7, 12, 17, 20, 23, 26, 21, 24, 27, 3, 8, 13, 18, 22, 25, 28, 4, 9, 14, 19]], ["FSP", 5, 0, 0, 3], ["FSP", 5, 4, 1, 3], ["FSP", 5, 8, 2, 3], ["FSP", 5, 12, 3, 3], ["RE", 5, [0, 4, 8, 12, 1, 5, 9, 13, 2, 6, 10, 14, 3, 7, 11, 15]], ["CA", 3, 5, 11], ["CHR", 2, "shared", [3]], ["CA", 3, 4, 14], ["CHR", 1, "shared", [4]], ["CA", 2, 5, 14], ["CI", 1], ["FU", 7, [0, 1, 2, 3]], ["AN", 7, 0, 5], ["FU", 7, [1, 2, 3, 4]], ["AN", 7, 1, 4], ["FU", 7, [2, 3, 4, 5]], ["AN", 7, 2, 6], ["FU", 4, [0, 1, 2, 3]], ["SP", 4, 0, 3, [1], 1], ["AN", 4, 1, 2], ["FFSP", 4, 0, [3, 2, 1, 0], 1, 1], ["AN", 4, 1, 6], ["FU", 2, [0, 1, 2, 3]], ["SP", 2, 0, 96, [1], 1], ["AN", 2, 1, 2], ["FFSP", 2, 0, [3, 2, 1, 0], 1, 1], ["AN", 2, 1, 6], ["PR", 5, 0, "auto_unroll_max_step$0"]]]], "r": [[4.86375e-06, 4.8659e-06, 4.86399e-06, 4.86353e-06], 0, 2.34155, 1664418927], "v": "v0.6"}
{"i": [["[\"f730d9b2b7d3686ece20335c9cd6eaa4\", [50, 3, 32, 32], [3, 3, 1, 1], [1, 3, 1, 1], [50, 3, 32, 32]]", "cuda -keys=cuda,gpu -arch=sm_80 -max_num_threads=1024 -thread_warp_size=32", [-1, 16, 64, 49152, 2147483647, 1024, 8, 32], "", 0, []], [[], [["SP", 3, 0, 50, [1, 1, 10, 1], 1], ["SP", 3, 5, 3, [3, 1, 1, 1], 1], ["SP", 3, 10, 32, [4, 4, 1, 1], 1], ["SP", 3, 15, 32, [1, 4, 4, 1], 1], ["SP", 3, 20, 3, [1, 1], 1], ["SP", 3, 23, 1, [1, 1], 1], ["SP", 3, 26, 1, [1, 1], 1], ["RE", 3, [0, 5, 10, 15, 1, 6, 11, 16, 2, 7, 12, 17, 20, 23, 26, 21, 24, 27, 3, 8, 13, 18, 22, 25, 28, 4, 9, 14, 19]], ["FSP", 5, 0, 0, 3], ["FSP", 5, 4, 1, 3], ["FSP", 5, 8, 2, 3], ["FSP", 5, 12, 3, 3], ["RE", 5, [0, 4, 8, 12, 1, 5, 9, 13, 2, 6, 10, 14, 3, 7, 11, 15]], ["CA", 3, 5, 11], ["CHR", 2, "shared", [3]], ["CA", 3, 4, 14], ["CHR", 1, "shared", [4]], ["CA", 2, 5, 14], ["CI", 1], ["FU", 7, [0, 1, 2, 3]], ["AN", 7, 0, 5], ["FU", 7, [1, 2, 3, 4]], ["AN", 7, 1, 4], ["FU", 7, [2, 3, 4, 5]], ["AN", 7, 2, 6], ["FU", 4, [0, 1, 2, 3]], ["SP", 4, 0, 1, [1], 1], ["AN", 4, 1, 2], ["FFSP", 4, 0, [3, 2, 1, 0], 1, 1], ["AN", 4, 1, 6], ["FU", 2, [0, 1, 2, 3]], ["SP", 2, 0, 40, [1], 1], ["AN", 2, 1, 2], ["FFSP", 2, 0, [3, 2, 1, 0], 1, 1], ["AN", 2, 1, 6], ["PR", 5, 0, "auto_unroll_max_step$16"]]]], "r": [[2.199e-05, 2.2008e-05, 2.20188e-05, 2.19956e-05], 0, 3.23238, 1664418929], "v": "v0.6"}
{"i": [["[\"f730d9b2b7d3686ece20335c9cd6eaa4\", [50, 3, 32, 32], [3, 3, 1, 1], [1, 3, 1, 1], [50, 3, 32, 32]]", "cuda -keys=cuda,gpu -arch=sm_80 -max_num_threads=1024 -thread_warp_size=32", [-1, 16, 64, 49152, 2147483647, 1024, 8, 32], "", 0, []], [[], [["SP", 3, 0, 50, [1, 2, 5, 5], 1], ["SP", 3, 5, 3, [1, 1, 3, 1], 1], ["SP", 3, 10, 32, [1, 4, 1, 2], 1], ["SP", 3, 15, 32, [1, 4, 1, 1], 1], ["SP", 3, 20, 3, [1, 3], 1], ["SP", 3, 23, 1, [1, 1], 1], ["SP", 3, 26, 1, [1, 1], 1], ["RE", 3, [0, 5, 10, 15, 1, 6, 11, 16, 2, 7, 12, 17, 20, 23, 26, 21, 24, 27, 3, 8, 13, 18, 22, 25, 28, 4, 9, 14, 19]], ["FSP", 5, 0, 0, 3], ["FSP", 5, 4, 1, 3], ["FSP", 5, 8, 2, 3], ["FSP", 5, 12, 3, 3], ["RE", 5, [0, 4, 8, 12, 1, 5, 9, 13, 2, 6, 10, 14, 3, 7, 11, 15]], ["CA", 3, 5, 11], ["CHR", 2, "shared", [3]], ["CA", 3, 4, 14], ["CHR", 1, "shared", [4]], ["CA", 2, 5, 14], ["CI", 1], ["FU", 7, [0, 1, 2, 3]], ["AN", 7, 0, 5], ["FU", 7, [1, 2, 3, 4]], ["AN", 7, 1, 4], ["FU", 7, [2, 3, 4, 5]], ["AN", 7, 2, 6], ["FU", 4, [0, 1, 2, 3]], ["SP", 4, 0, 1, [1], 1], ["AN", 4, 1, 2], ["FFSP", 4, 0, [3, 2, 1, 0], 1, 1], ["AN", 4, 1, 6], ["FU", 2, [0, 1, 2, 3]], ["SP", 2, 0, 10, [1], 1], ["AN", 2, 1, 2], ["FFSP", 2, 0, [3, 2, 1, 0], 1, 1], ["AN", 2, 1, 6], ["PR", 5, 0, "auto_unroll_max_step$16"]]]], "r": [[8.49963e-06, 8.49077e-06, 8.49155e-06, 8.50712e-06], 0, 2.8034, 1664418931], "v": "v0.6"}
{"i": [["[\"f730d9b2b7d3686ece20335c9cd6eaa4\", [50, 3, 32, 32], [3, 3, 1, 1], [1, 3, 1, 1], [50, 3, 32, 32]]", "cuda -keys=cuda,gpu -arch=sm_80 -max_num_threads=1024 -thread_warp_size=32", [-1, 16, 64, 49152, 2147483647, 1024, 8, 32], "", 0, []], [[], [["SP", 3, 0, 50, [2, 25, 1, 1], 1], ["SP", 3, 5, 3, [3, 1, 1, 1], 1], ["SP", 3, 10, 32, [2, 2, 1, 1], 1], ["SP", 3, 15, 32, [1, 1, 16, 1], 1], ["SP", 3, 20, 3, [3, 1], 1], ["SP", 3, 23, 1, [1, 1], 1], ["SP", 3, 26, 1, [1, 1], 1], ["RE", 3, [0, 5, 10, 15, 1, 6, 11, 16, 2, 7, 12, 17, 20, 23, 26, 21, 24, 27, 3, 8, 13, 18, 22, 25, 28, 4, 9, 14, 19]], ["FSP", 5, 0, 0, 3], ["FSP", 5, 4, 1, 3], ["FSP", 5, 8, 2, 3], ["FSP", 5, 12, 3, 3], ["RE", 5, [0, 4, 8, 12, 1, 5, 9, 13, 2, 6, 10, 14, 3, 7, 11, 15]], ["CA", 3, 5, 11], ["CHR", 2, "shared", [3]], ["CA", 3, 4, 14], ["CHR", 1, "shared", [4]], ["CA", 2, 5, 14], ["CI", 1], ["FU", 7, [0, 1, 2, 3]], ["AN", 7, 0, 5], ["FU", 7, [1, 2, 3, 4]], ["AN", 7, 1, 4], ["FU", 7, [2, 3, 4, 5]], ["AN", 7, 2, 6], ["FU", 4, [0, 1, 2, 3]], ["SP", 4, 0, 3, [1], 1], ["AN", 4, 1, 2], ["FFSP", 4, 0, [3, 2, 1, 0], 1, 1], ["AN", 4, 1, 6], ["FU", 2, [0, 1, 2, 3]], ["SP", 2, 0, 96, [4], 1], ["AN", 2, 1, 2], ["FFSP", 2, 0, [3, 2, 1, 0], 1, 1], ["AN", 2, 1, 6], ["PR", 5, 0, "auto_unroll_max_step$64"]]]], "r": [[2.22241e-05, 2.21903e-05, 2.22049e-05, 2.22059e-05], 0, 3.334, 1664418934], "v": "v0.6"}
{"i": [["[\"f730d9b2b7d3686ece20335c9cd6eaa4\", [50, 3, 32, 32], [3, 3, 1, 1], [1, 3, 1, 1], [50, 3, 32, 32]]", "cuda -keys=cuda,gpu -arch=sm_80 -max_num_threads=1024 -thread_warp_size=32", [-1, 16, 64, 49152, 2147483647, 1024, 8, 32], "", 0, []], [[], [["SP", 3, 0, 50, [1, 50, 1, 1], 1], ["SP", 3, 5, 3, [1, 1, 1, 3], 1], ["SP", 3, 10, 32, [1, 2, 2, 1], 1], ["SP", 3, 15, 32, [4, 4, 1, 1], 1], ["SP", 3, 20, 3, [1, 1], 1], ["SP", 3, 23, 1, [1, 1], 1], ["SP", 3, 26, 1, [1, 1], 1], ["RE", 3, [0, 5, 10, 15, 1, 6, 11, 16, 2, 7, 12, 17, 20, 23, 26, 21, 24, 27, 3, 8, 13, 18, 22, 25, 28, 4, 9, 14, 19]], ["FSP", 5, 0, 0, 3], ["FSP", 5, 4, 1, 3], ["FSP", 5, 8, 2, 3], ["FSP", 5, 12, 3, 3], ["RE", 5, [0, 4, 8, 12, 1, 5, 9, 13, 2, 6, 10, 14, 3, 7, 11, 15]], ["CA", 3, 5, 11], ["CHR", 2, "shared", [3]], ["CA", 3, 4, 14], ["CHR", 1, "shared", [4]], ["CA", 2, 5, 14], ["CI", 1], ["FU", 7, [0, 1, 2, 3]], ["AN", 7, 0, 5], ["FU", 7, [1, 2, 3, 4]], ["AN", 7, 1, 4], ["FU", 7, [2, 3, 4, 5]], ["AN", 7, 2, 6], ["FU", 4, [0, 1, 2, 3]], ["SP", 4, 0, 3, [1], 1], ["AN", 4, 1, 2], ["FFSP", 4, 0, [3, 2, 1, 0], 1, 1], ["AN", 4, 1, 6], ["FU", 2, [0, 1, 2, 3]], ["SP", 2, 0, 2, [1], 1], ["AN", 2, 1, 2], ["FFSP", 2, 0, [3, 2, 1, 0], 1, 1], ["AN", 2, 1, 6], ["PR", 5, 0, "auto_unroll_max_step$64"]]]], "r": [[8.70237e-06, 8.69962e-06, 8.71243e-06, 8.70845e-06], 0, 2.58846, 1664418936], "v": "v0.6"}
{"i": [["[\"f730d9b2b7d3686ece20335c9cd6eaa4\", [50, 3, 32, 32], [3, 3, 1, 1], [1, 3, 1, 1], [50, 3, 32, 32]]", "cuda -keys=cuda,gpu -arch=sm_80 -max_num_threads=1024 -thread_warp_size=32", [-1, 16, 64, 49152, 2147483647, 1024, 8, 32], "", 0, []], [[], [["SP", 3, 0, 50, [1, 5, 1, 2], 1], ["SP", 3, 5, 3, [1, 3, 1, 1], 1], ["SP", 3, 10, 32, [1, 4, 2, 2], 1], ["SP", 3, 15, 32, [1, 1, 8, 1], 1], ["SP", 3, 20, 3, [3, 1], 1], ["SP", 3, 23, 1, [1, 1], 1], ["SP", 3, 26, 1, [1, 1], 1], ["RE", 3, [0, 5, 10, 15, 1, 6, 11, 16, 2, 7, 12, 17, 20, 23, 26, 21, 24, 27, 3, 8, 13, 18, 22, 25, 28, 4, 9, 14, 19]], ["FSP", 5, 0, 0, 3], ["FSP", 5, 4, 1, 3], ["FSP", 5, 8, 2, 3], ["FSP", 5, 12, 3, 3], ["RE", 5, [0, 4, 8, 12, 1, 5, 9, 13, 2, 6, 10, 14, 3, 7, 11, 15]], ["CA", 3, 5, 11], ["CHR", 2, "shared", [3]], ["CA", 3, 4, 14], ["CHR", 1, "shared", [4]], ["CA", 2, 5, 14], ["CI", 1], ["FU", 7, [0, 1, 2, 3]], ["AN", 7, 0, 5], ["FU", 7, [1, 2, 3, 4]], ["AN", 7, 1, 4], ["FU", 7, [2, 3, 4, 5]], ["AN", 7, 2, 6], ["FU", 4, [0, 1, 2, 3]], ["SP", 4, 0, 1, [1], 1], ["AN", 4, 1, 2], ["FFSP", 4, 0, [3, 2, 1, 0], 1, 1], ["AN", 4, 1, 6], ["FU", 2, [0, 1, 2, 3]], ["SP", 2, 0, 32, [1], 1], ["AN", 2, 1, 2], ["FFSP", 2, 0, [3, 2, 1, 0], 1, 1], ["AN", 2, 1, 6], ["PR", 5, 0, "auto_unroll_max_step$512"]]]], "r": [[9.73841e-06, 9.73751e-06, 9.73763e-06, 9.73933e-06], 0, 3.09596, 1664418938], "v": "v0.6"}
{"i": [["[\"f730d9b2b7d3686ece20335c9cd6eaa4\", [50, 3, 32, 32], [3, 3, 1, 1], [1, 3, 1, 1], [50, 3, 32, 32]]", "cuda -keys=cuda,gpu -arch=sm_80 -max_num_threads=1024 -thread_warp_size=32", [-1, 16, 64, 49152, 2147483647, 1024, 8, 32], "", 0, []], [[], [["SP", 3, 0, 50, [1, 5, 5, 1], 1], ["SP", 3, 5, 3, [1, 3, 1, 1], 1], ["SP", 3, 10, 32, [1, 8, 2, 1], 1], ["SP", 3, 15, 32, [4, 2, 1, 1], 1], ["SP", 3, 20, 3, [3, 1], 1], ["SP", 3, 23, 1, [1, 1], 1], ["SP", 3, 26, 1, [1, 1], 1], ["RE", 3, [0, 5, 10, 15, 1, 6, 11, 16, 2, 7, 12, 17, 20, 23, 26, 21, 24, 27, 3, 8, 13, 18, 22, 25, 28, 4, 9, 14, 19]], ["FSP", 5, 0, 0, 3], ["FSP", 5, 4, 1, 3], ["FSP", 5, 8, 2, 3], ["FSP", 5, 12, 3, 3], ["RE", 5, [0, 4, 8, 12, 1, 5, 9, 13, 2, 6, 10, 14, 3, 7, 11, 15]], ["CA", 3, 5, 11], ["CHR", 2, "shared", [3]], ["CA", 3, 4, 14], ["CHR", 1, "shared", [4]], ["CA", 2, 5, 14], ["CI", 1], ["FU", 7, [0, 1, 2, 3]], ["AN", 7, 0, 5], ["FU", 7, [1, 2, 3, 4]], ["AN", 7, 1, 4], ["FU", 7, [2, 3, 4, 5]], ["AN", 7, 2, 6], ["FU", 4, [0, 1, 2, 3]], ["SP", 4, 0, 9, [1], 1], ["AN", 4, 1, 2], ["FFSP", 4, 0, [3, 2, 1, 0], 1, 1], ["AN", 4, 1, 6], ["FU", 2, [0, 1, 2, 3]], ["SP", 2, 0, 30, [1], 1], ["AN", 2, 1, 2], ["FFSP", 2, 0, [3, 2, 1, 0], 1, 1], ["AN", 2, 1, 6], ["PR", 5, 0, "auto_unroll_max_step$64"]]]], "r": [[1.46556e-05, 1.46542e-05, 1.46588e-05, 1.46587e-05], 0, 2.93967, 1664418941], "v": "v0.6"}
{"i": [["[\"f730d9b2b7d3686ece20335c9cd6eaa4\", [50, 3, 32, 32], [3, 3, 1, 1], [1, 3, 1, 1], [50, 3, 32, 32]]", "cuda -keys=cuda,gpu -arch=sm_80 -max_num_threads=1024 -thread_warp_size=32", [-1, 16, 64, 49152, 2147483647, 1024, 8, 32], "", 0, []], [[], [["SP", 3, 0, 50, [1, 2, 1, 5], 1], ["SP", 3, 5, 3, [1, 3, 1, 1], 1], ["SP", 3, 10, 32, [4, 8, 1, 1], 1], ["SP", 3, 15, 32, [2, 2, 4, 2], 1], ["SP", 3, 20, 3, [1, 1], 1], ["SP", 3, 23, 1, [1, 1], 1], ["SP", 3, 26, 1, [1, 1], 1], ["RE", 3, [0, 5, 10, 15, 1, 6, 11, 16, 2, 7, 12, 17, 20, 23, 26, 21, 24, 27, 3, 8, 13, 18, 22, 25, 28, 4, 9, 14, 19]], ["FSP", 5, 0, 0, 3], ["FSP", 5, 4, 1, 3], ["FSP", 5, 8, 2, 3], ["FSP", 5, 12, 3, 3], ["RE", 5, [0, 4, 8, 12, 1, 5, 9, 13, 2, 6, 10, 14, 3, 7, 11, 15]], ["CA", 3, 5, 11], ["CHR", 2, "shared", [3]], ["CA", 3, 4, 14], ["CHR", 1, "shared", [4]], ["CA", 2, 5, 14], ["CI", 1], ["FU", 7, [0, 1, 2, 3]], ["AN", 7, 0, 5], ["FU", 7, [1, 2, 3, 4]], ["AN", 7, 1, 4], ["FU", 7, [2, 3, 4, 5]], ["AN", 7, 2, 6], ["FU", 4, [0, 1, 2, 3]], ["SP", 4, 0, 1, [1], 1], ["AN", 4, 1, 2], ["FFSP", 4, 0, [3, 2, 1, 0], 1, 1], ["AN", 4, 1, 6], ["FU", 2, [0, 1, 2, 3]], ["SP", 2, 0, 20, [5], 1], ["AN", 2, 1, 2], ["FFSP", 2, 0, [3, 2, 1, 0], 1, 1], ["AN", 2, 1, 6], ["PR", 5, 0, "auto_unroll_max_step$64"]]]], "r": [[8.11423e-05, 8.11595e-05, 8.11773e-05, 8.11487e-05], 0, 3.25913, 1664418943], "v": "v0.6"}
{"i": [["[\"f730d9b2b7d3686ece20335c9cd6eaa4\", [50, 3, 32, 32], [3, 3, 1, 1], [1, 3, 1, 1], [50, 3, 32, 32]]", "cuda -keys=cuda,gpu -arch=sm_80 -max_num_threads=1024 -thread_warp_size=32", [-1, 16, 64, 49152, 2147483647, 1024, 8, 32], "", 0, []], [[], [["SP", 3, 0, 50, [1, 2, 1, 1], 1], ["SP", 3, 5, 3, [3, 1, 1, 1], 1], ["SP", 3, 10, 32, [2, 8, 2, 1], 1], ["SP", 3, 15, 32, [1, 2, 8, 1], 1], ["SP", 3, 20, 3, [1, 3], 1], ["SP", 3, 23, 1, [1, 1], 1], ["SP", 3, 26, 1, [1, 1], 1], ["RE", 3, [0, 5, 10, 15, 1, 6, 11, 16, 2, 7, 12, 17, 20, 23, 26, 21, 24, 27, 3, 8, 13, 18, 22, 25, 28, 4, 9, 14, 19]], ["FSP", 5, 0, 0, 3], ["FSP", 5, 4, 1, 3], ["FSP", 5, 8, 2, 3], ["FSP", 5, 12, 3, 3], ["RE", 5, [0, 4, 8, 12, 1, 5, 9, 13, 2, 6, 10, 14, 3, 7, 11, 15]], ["CA", 3, 5, 11], ["CHR", 2, "shared", [3]], ["CA", 3, 4, 14], ["CHR", 1, "shared", [4]], ["CA", 2, 5, 14], ["CI", 1], ["FU", 7, [0, 1, 2, 3]], ["AN", 7, 0, 5], ["FU", 7, [1, 2, 3, 4]], ["AN", 7, 1, 4], ["FU", 7, [2, 3, 4, 5]], ["AN", 7, 2, 6], ["FU", 4, [0, 1, 2, 3]], ["SP", 4, 0, 3, [1], 1], ["AN", 4, 1, 2], ["FFSP", 4, 0, [3, 2, 1, 0], 1, 1], ["AN", 4, 1, 6], ["FU", 2, [0, 1, 2, 3]], ["SP", 2, 0, 48, [1], 1], ["AN", 2, 1, 2], ["FFSP", 2, 0, [3, 2, 1, 0], 1, 1], ["AN", 2, 1, 6], ["PR", 5, 0, "auto_unroll_max_step$16"]]]], "r": [[6.51696e-06, 6.51623e-06, 6.51671e-06, 6.51778e-06], 0, 2.63423, 1664418946], "v": "v0.6"}
{"i": [["[\"f730d9b2b7d3686ece20335c9cd6eaa4\", [50, 3, 32, 32], [3, 3, 1, 1], [1, 3, 1, 1], [50, 3, 32, 32]]", "cuda -keys=cuda,gpu -arch=sm_80 -max_num_threads=1024 -thread_warp_size=32", [-1, 16, 64, 49152, 2147483647, 1024, 8, 32], "", 0, []], [[], [["SP", 3, 0, 50, [5, 1, 1, 2], 1], ["SP", 3, 5, 3, [1, 3, 1, 1], 1], ["SP", 3, 10, 32, [1, 32, 1, 1], 1], ["SP", 3, 15, 32, [1, 1, 4, 1], 1], ["SP", 3, 20, 3, [3, 1], 1], ["SP", 3, 23, 1, [1, 1], 1], ["SP", 3, 26, 1, [1, 1], 1], ["RE", 3, [0, 5, 10, 15, 1, 6, 11, 16, 2, 7, 12, 17, 20, 23, 26, 21, 24, 27, 3, 8, 13, 18, 22, 25, 28, 4, 9, 14, 19]], ["FSP", 5, 0, 0, 3], ["FSP", 5, 4, 1, 3], ["FSP", 5, 8, 2, 3], ["FSP", 5, 12, 3, 3], ["RE", 5, [0, 4, 8, 12, 1, 5, 9, 13, 2, 6, 10, 14, 3, 7, 11, 15]], ["CA", 3, 5, 11], ["CHR", 2, "shared", [3]], ["CA", 3, 4, 14], ["CHR", 1, "shared", [4]], ["CA", 2, 5, 14], ["CI", 1], ["FU", 7, [0, 1, 2, 3]], ["AN", 7, 0, 5], ["FU", 7, [1, 2, 3, 4]], ["AN", 7, 1, 4], ["FU", 7, [2, 3, 4, 5]], ["AN", 7, 2, 6], ["FU", 4, [0, 1, 2, 3]], ["SP", 4, 0, 3, [1], 1], ["AN", 4, 1, 2], ["FFSP", 4, 0, [3, 2, 1, 0], 1, 1], ["AN", 4, 1, 6], ["FU", 2, [0, 1, 2, 3]], ["SP", 2, 0, 24, [2], 1], ["AN", 2, 1, 2], ["FFSP", 2, 0, [3, 2, 1, 0], 1, 1], ["AN", 2, 1, 6], ["PR", 5, 0, "auto_unroll_max_step$64"]]]], "r": [[1.0167e-05, 1.01681e-05, 1.01528e-05, 1.01444e-05], 0, 2.76806, 1664418948], "v": "v0.6"}
{"i": [["[\"f730d9b2b7d3686ece20335c9cd6eaa4\", [50, 3, 32, 32], [3, 3, 1, 1], [1, 3, 1, 1], [50, 3, 32, 32]]", "cuda -keys=cuda,gpu -arch=sm_80 -max_num_threads=1024 -thread_warp_size=32", [-1, 16, 64, 49152, 2147483647, 1024, 8, 32], "", 0, []], [[], [["SP", 3, 0, 50, [1, 10, 1, 1], 1], ["SP", 3, 5, 3, [3, 1, 1, 1], 1], ["SP", 3, 10, 32, [1, 32, 1, 1], 1], ["SP", 3, 15, 32, [2, 1, 8, 2], 1], ["SP", 3, 20, 3, [1, 1], 1], ["SP", 3, 23, 1, [1, 1], 1], ["SP", 3, 26, 1, [1, 1], 1], ["RE", 3, [0, 5, 10, 15, 1, 6, 11, 16, 2, 7, 12, 17, 20, 23, 26, 21, 24, 27, 3, 8, 13, 18, 22, 25, 28, 4, 9, 14, 19]], ["FSP", 5, 0, 0, 3], ["FSP", 5, 4, 1, 3], ["FSP", 5, 8, 2, 3], ["FSP", 5, 12, 3, 3], ["RE", 5, [0, 4, 8, 12, 1, 5, 9, 13, 2, 6, 10, 14, 3, 7, 11, 15]], ["CA", 3, 5, 11], ["CHR", 2, "shared", [3]], ["CA", 3, 4, 14], ["CHR", 1, "shared", [4]], ["CA", 2, 5, 14], ["CI", 1], ["FU", 7, [0, 1, 2, 3]], ["AN", 7, 0, 5], ["FU", 7, [1, 2, 3, 4]], ["AN", 7, 1, 4], ["FU", 7, [2, 3, 4, 5]], ["AN", 7, 2, 6], ["FU", 4, [0, 1, 2, 3]], ["SP", 4, 0, 1, [1], 1], ["AN", 4, 1, 2], ["FFSP", 4, 0, [3, 2, 1, 0], 1, 1], ["AN", 4, 1, 6], ["FU", 2, [0, 1, 2, 3]], ["SP", 2, 0, 16, [1], 1], ["AN", 2, 1, 2], ["FFSP", 2, 0, [3, 2, 1, 0], 1, 1], ["AN", 2, 1, 6], ["PR", 5, 0, "auto_unroll_max_step$1024"]]]], "r": [[5.32407e-05, 5.31809e-05, 5.32377e-05, 5.31948e-05], 0, 3.28932, 1664418951], "v": "v0.6"}
{"i": [["[\"f730d9b2b7d3686ece20335c9cd6eaa4\", [50, 3, 32, 32], [3, 3, 1, 1], [1, 3, 1, 1], [50, 3, 32, 32]]", "cuda -keys=cuda,gpu -arch=sm_80 -max_num_threads=1024 -thread_warp_size=32", [-1, 16, 64, 49152, 2147483647, 1024, 8, 32], "", 0, []], [[], [["SP", 3, 0, 50, [1, 10, 1, 1], 1], ["SP", 3, 5, 3, [1, 1, 1, 3], 1], ["SP", 3, 10, 32, [2, 4, 1, 1], 1], ["SP", 3, 15, 32, [1, 4, 8, 1], 1], ["SP", 3, 20, 3, [3, 1], 1], ["SP", 3, 23, 1, [1, 1], 1], ["SP", 3, 26, 1, [1, 1], 1], ["RE", 3, [0, 5, 10, 15, 1, 6, 11, 16, 2, 7, 12, 17, 20, 23, 26, 21, 24, 27, 3, 8, 13, 18, 22, 25, 28, 4, 9, 14, 19]], ["FSP", 5, 0, 0, 3], ["FSP", 5, 4, 1, 3], ["FSP", 5, 8, 2, 3], ["FSP", 5, 12, 3, 3], ["RE", 5, [0, 4, 8, 12, 1, 5, 9, 13, 2, 6, 10, 14, 3, 7, 11, 15]], ["CA", 3, 5, 11], ["CHR", 2, "shared", [3]], ["CA", 3, 4, 14], ["CHR", 1, "shared", [4]], ["CA", 2, 5, 14], ["CI", 1], ["FU", 7, [0, 1, 2, 3]], ["AN", 7, 0, 5], ["FU", 7, [1, 2, 3, 4]], ["AN", 7, 1, 4], ["FU", 7, [2, 3, 4, 5]], ["AN", 7, 2, 6], ["FU", 4, [0, 1, 2, 3]], ["SP", 4, 0, 9, [1], 1], ["AN", 4, 1, 2], ["FFSP", 4, 0, [3, 2, 1, 0], 1, 1], ["AN", 4, 1, 6], ["FU", 2, [0, 1, 2, 3]], ["SP", 2, 0, 24, [1], 1], ["AN", 2, 1, 2], ["FFSP", 2, 0, [3, 2, 1, 0], 1, 1], ["AN", 2, 1, 6], ["PR", 5, 0, "auto_unroll_max_step$1024"]]]], "r": [[9.36344e-06, 9.3645e-06, 9.36395e-06, 9.35993e-06], 0, 2.80083, 1664418953], "v": "v0.6"}
{"i": [["[\"f730d9b2b7d3686ece20335c9cd6eaa4\", [50, 3, 32, 32], [3, 3, 1, 1], [1, 3, 1, 1], [50, 3, 32, 32]]", "cuda -keys=cuda,gpu -arch=sm_80 -max_num_threads=1024 -thread_warp_size=32", [-1, 16, 64, 49152, 2147483647, 1024, 8, 32], "", 0, []], [[], [["SP", 3, 0, 50, [1, 2, 1, 1], 1], ["SP", 3, 5, 3, [1, 1, 3, 1], 1], ["SP", 3, 10, 32, [4, 2, 1, 4], 1], ["SP", 3, 15, 32, [2, 8, 1, 1], 1], ["SP", 3, 20, 3, [3, 1], 1], ["SP", 3, 23, 1, [1, 1], 1], ["SP", 3, 26, 1, [1, 1], 1], ["RE", 3, [0, 5, 10, 15, 1, 6, 11, 16, 2, 7, 12, 17, 20, 23, 26, 21, 24, 27, 3, 8, 13, 18, 22, 25, 28, 4, 9, 14, 19]], ["FSP", 5, 0, 0, 3], ["FSP", 5, 4, 1, 3], ["FSP", 5, 8, 2, 3], ["FSP", 5, 12, 3, 3], ["RE", 5, [0, 4, 8, 12, 1, 5, 9, 13, 2, 6, 10, 14, 3, 7, 11, 15]], ["CA", 3, 5, 11], ["CHR", 2, "shared", [3]], ["CA", 3, 4, 14], ["CHR", 1, "shared", [4]], ["CA", 2, 5, 14], ["CI", 1], ["FU", 7, [0, 1, 2, 3]], ["AN", 7, 0, 5], ["FU", 7, [1, 2, 3, 4]], ["AN", 7, 1, 4], ["FU", 7, [2, 3, 4, 5]], ["AN", 7, 2, 6], ["FU", 4, [0, 1, 2, 3]], ["SP", 4, 0, 9, [9], 1], ["AN", 4, 1, 2], ["FFSP", 4, 0, [3, 2, 1, 0], 1, 1], ["AN", 4, 1, 6], ["FU", 2, [0, 1, 2, 3]], ["SP", 2, 0, 12, [1], 1], ["AN", 2, 1, 2], ["FFSP", 2, 0, [3, 2, 1, 0], 1, 1], ["AN", 2, 1, 6], ["PR", 5, 0, "auto_unroll_max_step$512"]]]], "r": [[4.52624e-06, 4.52763e-06, 4.52851e-06, 4.52852e-06], 0, 2.83545, 1664418955], "v": "v0.6"}
{"i": [["[\"f730d9b2b7d3686ece20335c9cd6eaa4\", [50, 3, 32, 32], [3, 3, 1, 1], [1, 3, 1, 1], [50, 3, 32, 32]]", "cuda -keys=cuda,gpu -arch=sm_80 -max_num_threads=1024 -thread_warp_size=32", [-1, 16, 64, 49152, 2147483647, 1024, 8, 32], "", 0, []], [[], [["SP", 3, 0, 50, [1, 5, 1, 1], 1], ["SP", 3, 5, 3, [1, 1, 1, 1], 1], ["SP", 3, 10, 32, [2, 8, 1, 1], 1], ["SP", 3, 15, 32, [4, 2, 1, 2], 1], ["SP", 3, 20, 3, [1, 3], 1], ["SP", 3, 23, 1, [1, 1], 1], ["SP", 3, 26, 1, [1, 1], 1], ["RE", 3, [0, 5, 10, 15, 1, 6, 11, 16, 2, 7, 12, 17, 20, 23, 26, 21, 24, 27, 3, 8, 13, 18, 22, 25, 28, 4, 9, 14, 19]], ["FSP", 5, 0, 0, 3], ["FSP", 5, 4, 1, 3], ["FSP", 5, 8, 2, 3], ["FSP", 5, 12, 3, 3], ["RE", 5, [0, 4, 8, 12, 1, 5, 9, 13, 2, 6, 10, 14, 3, 7, 11, 15]], ["CA", 3, 5, 11], ["CHR", 2, "shared", [3]], ["CA", 3, 4, 14], ["CHR", 1, "shared", [4]], ["CA", 2, 5, 14], ["CI", 1], ["FU", 7, [0, 1, 2, 3]], ["AN", 7, 0, 5], ["FU", 7, [1, 2, 3, 4]], ["AN", 7, 1, 4], ["FU", 7, [2, 3, 4, 5]], ["AN", 7, 2, 6], ["FU", 4, [0, 1, 2, 3]], ["SP", 4, 0, 3, [1], 1], ["AN", 4, 1, 2], ["FFSP", 4, 0, [3, 2, 1, 0], 1, 1], ["AN", 4, 1, 6], ["FU", 2, [0, 1, 2, 3]], ["SP", 2, 0, 6, [1], 1], ["AN", 2, 1, 2], ["FFSP", 2, 0, [3, 2, 1, 0], 1, 1], ["AN", 2, 1, 6], ["PR", 5, 0, "auto_unroll_max_step$0"]]]], "r": [[6.81445e-06, 6.81463e-06, 6.81428e-06, 6.81379e-06], 0, 2.538, 1664418957], "v": "v0.6"}
{"i": [["[\"f730d9b2b7d3686ece20335c9cd6eaa4\", [50, 3, 32, 32], [3, 3, 1, 1], [1, 3, 1, 1], [50, 3, 32, 32]]", "cuda -keys=cuda,gpu -arch=sm_80 -max_num_threads=1024 -thread_warp_size=32", [-1, 16, 64, 49152, 2147483647, 1024, 8, 32], "", 0, []], [[], [["SP", 3, 0, 50, [2, 25, 1, 1], 1], ["SP", 3, 5, 3, [1, 3, 1, 1], 1], ["SP", 3, 10, 32, [1, 4, 2, 1], 1], ["SP", 3, 15, 32, [2, 1, 2, 1], 1], ["SP", 3, 20, 3, [3, 1], 1], ["SP", 3, 23, 1, [1, 1], 1], ["SP", 3, 26, 1, [1, 1], 1], ["RE", 3, [0, 5, 10, 15, 1, 6, 11, 16, 2, 7, 12, 17, 20, 23, 26, 21, 24, 27, 3, 8, 13, 18, 22, 25, 28, 4, 9, 14, 19]], ["FSP", 5, 0, 0, 3], ["FSP", 5, 4, 1, 3], ["FSP", 5, 8, 2, 3], ["FSP", 5, 12, 3, 3], ["RE", 5, [0, 4, 8, 12, 1, 5, 9, 13, 2, 6, 10, 14, 3, 7, 11, 15]], ["CA", 3, 5, 11], ["CHR", 2, "shared", [3]], ["CA", 3, 4, 14], ["CHR", 1, "shared", [4]], ["CA", 2, 5, 14], ["CI", 1], ["FU", 7, [0, 1, 2, 3]], ["AN", 7, 0, 5], ["FU", 7, [1, 2, 3, 4]], ["AN", 7, 1, 4], ["FU", 7, [2, 3, 4, 5]], ["AN", 7, 2, 6], ["FU", 4, [0, 1, 2, 3]], ["SP", 4, 0, 3, [1], 1], ["AN", 4, 1, 2], ["FFSP", 4, 0, [3, 2, 1, 0], 1, 1], ["AN", 4, 1, 6], ["FU", 2, [0, 1, 2, 3]], ["SP", 2, 0, 60, [1], 1], ["AN", 2, 1, 2], ["FFSP", 2, 0, [3, 2, 1, 0], 1, 1], ["AN", 2, 1, 6], ["PR", 5, 0, "auto_unroll_max_step$64"]]]], "r": [[1.09998e-05, 1.09984e-05, 1.09967e-05, 1.09978e-05], 0, 2.69291, 1664418959], "v": "v0.6"}
