.cache/log/kernel_tune/NVIDIA_A100_80GB_PCIe/LinearBias_forward_input_0_4_512_output_0_4_1024_in_features_512_out_features_1024.json
{"i": [["[\"3458e75493bb4bb042e539b5ff4818fb\", [4, 512], [1024, 512], [1, 1024], [4, 1024]]", "cuda -keys=cuda,gpu -arch=sm_80 -max_num_threads=1024 -thread_warp_size=32", [-1, 16, 64, 49152, 2147483647, 1024, 8, 32], "", 0, []], [[], [["SP", 2, 0, 4, [1, 4, 1, 1], 1], ["SP", 2, 5, 1024, [2, 16, 2, 1], 1], ["SP", 2, 10, 512, [1, 32], 1], ["RE", 2, [0, 5, 1, 6, 2, 7, 10, 11, 3, 8, 12, 4, 9]], ["FSP", 4, 0, 0, 3], ["FSP", 4, 4, 1, 3], ["RE", 4, [0, 4, 1, 5, 2, 6, 3, 7]], ["CA", 2, 4, 5], ["CHR", 1, "shared", [2]], ["CA", 2, 3, 6], ["CHR", 0, "shared", [3]], ["CA", 1, 4, 6], ["FU", 6, [0, 1]], ["AN", 6, 0, 5], ["FU", 6, [1, 2]], ["AN", 6, 1, 4], ["FU", 6, [2, 3]], ["AN", 6, 2, 6], ["FU", 3, [0, 1]], ["SP", 3, 0, 64, [1], 1], ["AN", 3, 1, 2], ["FFSP", 3, 0, [1, 0], 1, 1], ["AN", 3, 1, 6], ["FU", 1, [0, 1]], ["SP", 1, 0, 32, [1], 1], ["AN", 1, 1, 2], ["FFSP", 1, 0, [1, 0], 1, 1], ["AN", 1, 1, 6], ["PR", 4, 0, "auto_unroll_max_step$16"]]]], "r": [[3.45755e-05, 3.4575e-05, 3.45748e-05, 3.45749e-05], 0, 3.24413, 1656324005], "v": "v0.6"}
{"i": [["[\"3458e75493bb4bb042e539b5ff4818fb\", [4, 512], [1024, 512], [1, 1024], [4, 1024]]", "cuda -keys=cuda,gpu -arch=sm_80 -max_num_threads=1024 -thread_warp_size=32", [-1, 16, 64, 49152, 2147483647, 1024, 8, 32], "", 0, []], [[], [["SP", 2, 0, 4, [1, 4, 1, 1], 1], ["SP", 2, 5, 1024, [1, 64, 2, 2], 1], ["SP", 2, 10, 512, [32, 1], 1], ["RE", 2, [0, 5, 1, 6, 2, 7, 10, 11, 3, 8, 12, 4, 9]], ["FSP", 4, 0, 0, 3], ["FSP", 4, 4, 1, 3], ["RE", 4, [0, 4, 1, 5, 2, 6, 3, 7]], ["CA", 2, 4, 5], ["CHR", 1, "shared", [2]], ["CA", 2, 3, 6], ["CHR", 0, "shared", [3]], ["CA", 1, 4, 6], ["FU", 6, [0, 1]], ["AN", 6, 0, 5], ["FU", 6, [1, 2]], ["AN", 6, 1, 4], ["FU", 6, [2, 3]], ["AN", 6, 2, 6], ["FU", 3, [0, 1]], ["SP", 3, 0, 128, [1], 1], ["AN", 3, 1, 2], ["FFSP", 3, 0, [1, 0], 1, 1], ["AN", 3, 1, 6], ["FU", 1, [0, 1]], ["SP", 1, 0, 32, [4], 1], ["AN", 1, 1, 2], ["FFSP", 1, 0, [1, 0], 1, 1], ["AN", 1, 1, 6], ["PR", 4, 0, "auto_unroll_max_step$1024"]]]], "r": [[0.000110038, 0.000110041, 0.000110044, 0.000110043], 0, 3.57638, 1656324008], "v": "v0.6"}
{"i": [["[\"3458e75493bb4bb042e539b5ff4818fb\", [4, 512], [1024, 512], [1, 1024], [4, 1024]]", "cuda -keys=cuda,gpu -arch=sm_80 -max_num_threads=1024 -thread_warp_size=32", [-1, 16, 64, 49152, 2147483647, 1024, 8, 32], "", 0, []], [[], [["SP", 2, 0, 4, [4, 1, 1, 1], 1], ["SP", 2, 5, 1024, [1, 32, 1, 4], 1], ["SP", 2, 10, 512, [1, 4], 1], ["RE", 2, [0, 5, 1, 6, 2, 7, 10, 11, 3, 8, 12, 4, 9]], ["FSP", 4, 0, 0, 3], ["FSP", 4, 4, 1, 3], ["RE", 4, [0, 4, 1, 5, 2, 6, 3, 7]], ["CA", 2, 4, 5], ["CHR", 1, "shared", [2]], ["CA", 2, 3, 6], ["CHR", 0, "shared", [3]], ["CA", 1, 4, 6], ["FU", 6, [0, 1]], ["AN", 6, 0, 5], ["FU", 6, [1, 2]], ["AN", 6, 1, 4], ["FU", 6, [2, 3]], ["AN", 6, 2, 6], ["FU", 3, [0, 1]], ["SP", 3, 0, 64, [4], 1], ["AN", 3, 1, 2], ["FFSP", 3, 0, [1, 0], 1, 1], ["AN", 3, 1, 6], ["FU", 1, [0, 1]], ["SP", 1, 0, 4, [1], 1], ["AN", 1, 1, 2], ["FFSP", 1, 0, [1, 0], 1, 1], ["AN", 1, 1, 6], ["PR", 4, 0, "auto_unroll_max_step$1024"]]]], "r": [[6.10757e-05, 6.10555e-05, 6.10764e-05, 6.10833e-05], 0, 3.4902, 1656324011], "v": "v0.6"}
{"i": [["[\"3458e75493bb4bb042e539b5ff4818fb\", [4, 512], [1024, 512], [1, 1024], [4, 1024]]", "cuda -keys=cuda,gpu -arch=sm_80 -max_num_threads=1024 -thread_warp_size=32", [-1, 16, 64, 49152, 2147483647, 1024, 8, 32], "", 0, []], [[], [["SP", 2, 0, 4, [1, 1, 1, 1], 1], ["SP", 2, 5, 1024, [4, 16, 4, 1], 1], ["SP", 2, 10, 512, [1, 4], 1], ["RE", 2, [0, 5, 1, 6, 2, 7, 10, 11, 3, 8, 12, 4, 9]], ["FSP", 4, 0, 0, 3], ["FSP", 4, 4, 1, 3], ["RE", 4, [0, 4, 1, 5, 2, 6, 3, 7]], ["CA", 2, 4, 5], ["CHR", 1, "shared", [2]], ["CA", 2, 3, 6], ["CHR", 0, "shared", [3]], ["CA", 1, 4, 6], ["FU", 6, [0, 1]], ["AN", 6, 0, 5], ["FU", 6, [1, 2]], ["AN", 6, 1, 4], ["FU", 6, [2, 3]], ["AN", 6, 2, 6], ["FU", 3, [0, 1]], ["SP", 3, 0, 16, [1], 1], ["AN", 3, 1, 2], ["FFSP", 3, 0, [1, 0], 1, 1], ["AN", 3, 1, 6], ["FU", 1, [0, 1]], ["SP", 1, 0, 4, [2], 1], ["AN", 1, 1, 2], ["FFSP", 1, 0, [1, 0], 1, 1], ["AN", 1, 1, 6], ["PR", 4, 0, "auto_unroll_max_step$64"]]]], "r": [[0.000143344, 0.000143344, 0.000143344, 0.000143345], 0, 3.56671, 1656324013], "v": "v0.6"}
{"i": [["[\"3458e75493bb4bb042e539b5ff4818fb\", [4, 512], [1024, 512], [1, 1024], [4, 1024]]", "cuda -keys=cuda,gpu -arch=sm_80 -max_num_threads=1024 -thread_warp_size=32", [-1, 16, 64, 49152, 2147483647, 1024, 8, 32], "", 0, []], [[], [["SP", 2, 0, 4, [4, 1, 1, 1], 1], ["SP", 2, 5, 1024, [1, 4, 1, 32], 1], ["SP", 2, 10, 512, [2, 4], 1], ["RE", 2, [0, 5, 1, 6, 2, 7, 10, 11, 3, 8, 12, 4, 9]], ["FSP", 4, 0, 0, 3], ["FSP", 4, 4, 1, 3], ["RE", 4, [0, 4, 1, 5, 2, 6, 3, 7]], ["CA", 2, 4, 5], ["CHR", 1, "shared", [2]], ["CA", 2, 3, 6], ["CHR", 0, "shared", [3]], ["CA", 1, 4, 6], ["FU", 6, [0, 1]], ["AN", 6, 0, 5], ["FU", 6, [1, 2]], ["AN", 6, 1, 4], ["FU", 6, [2, 3]], ["AN", 6, 2, 6], ["FU", 3, [0, 1]], ["SP", 3, 0, 8, [1], 1], ["AN", 3, 1, 2], ["FFSP", 3, 0, [1, 0], 1, 1], ["AN", 3, 1, 6], ["FU", 1, [0, 1]], ["SP", 1, 0, 8, [1], 1], ["AN", 1, 1, 2], ["FFSP", 1, 0, [1, 0], 1, 1], ["AN", 1, 1, 6], ["PR", 4, 0, "auto_unroll_max_step$1024"]]]], "r": [[0.000288426, 0.000288281, 0.000288289, 0.000288313], 0, 5.09227, 1656324016], "v": "v0.6"}
{"i": [["[\"3458e75493bb4bb042e539b5ff4818fb\", [4, 512], [1024, 512], [1, 1024], [4, 1024]]", "cuda -keys=cuda,gpu -arch=sm_80 -max_num_threads=1024 -thread_warp_size=32", [-1, 16, 64, 49152, 2147483647, 1024, 8, 32], "", 0, []], [[], [["SP", 2, 0, 4, [2, 1, 2, 1], 1], ["SP", 2, 5, 1024, [4, 16, 2, 1], 1], ["SP", 2, 10, 512, [1, 16], 1], ["RE", 2, [0, 5, 1, 6, 2, 7, 10, 11, 3, 8, 12, 4, 9]], ["FSP", 4, 0, 0, 3], ["FSP", 4, 4, 1, 3], ["RE", 4, [0, 4, 1, 5, 2, 6, 3, 7]], ["CA", 2, 4, 5], ["CHR", 1, "shared", [2]], ["CA", 2, 3, 6], ["CHR", 0, "shared", [3]], ["CA", 1, 4, 6], ["FU", 6, [0, 1]], ["AN", 6, 0, 5], ["FU", 6, [1, 2]], ["AN", 6, 1, 4], ["FU", 6, [2, 3]], ["AN", 6, 2, 6], ["FU", 3, [0, 1]], ["SP", 3, 0, 32, [1], 1], ["AN", 3, 1, 2], ["FFSP", 3, 0, [1, 0], 1, 1], ["AN", 3, 1, 6], ["FU", 1, [0, 1]], ["SP", 1, 0, 32, [1], 1], ["AN", 1, 1, 2], ["FFSP", 1, 0, [1, 0], 1, 1], ["AN", 1, 1, 6], ["PR", 4, 0, "auto_unroll_max_step$1024"]]]], "r": [[6.79648e-05, 6.78924e-05, 6.7949e-05, 6.78639e-05], 0, 3.93699, 1656324019], "v": "v0.6"}
{"i": [["[\"3458e75493bb4bb042e539b5ff4818fb\", [4, 512], [1024, 512], [1, 1024], [4, 1024]]", "cuda -keys=cuda,gpu -arch=sm_80 -max_num_threads=1024 -thread_warp_size=32", [-1, 16, 64, 49152, 2147483647, 1024, 8, 32], "", 0, []], [[], [["SP", 2, 0, 4, [1, 4, 1, 1], 1], ["SP", 2, 5, 1024, [4, 8, 8, 2], 1], ["SP", 2, 10, 512, [2, 2], 1], ["RE", 2, [0, 5, 1, 6, 2, 7, 10, 11, 3, 8, 12, 4, 9]], ["FSP", 4, 0, 0, 3], ["FSP", 4, 4, 1, 3], ["RE", 4, [0, 4, 1, 5, 2, 6, 3, 7]], ["CA", 2, 4, 5], ["CHR", 1, "shared", [2]], ["CA", 2, 3, 6], ["CHR", 0, "shared", [3]], ["CA", 1, 4, 6], ["FU", 6, [0, 1]], ["AN", 6, 0, 5], ["FU", 6, [1, 2]], ["AN", 6, 1, 4], ["FU", 6, [2, 3]], ["AN", 6, 2, 6], ["FU", 3, [0, 1]], ["SP", 3, 0, 64, [1], 1], ["AN", 3, 1, 2], ["FFSP", 3, 0, [1, 0], 1, 1], ["AN", 3, 1, 6], ["FU", 1, [0, 1]], ["SP", 1, 0, 4, [1], 1], ["AN", 1, 1, 2], ["FFSP", 1, 0, [1, 0], 1, 1], ["AN", 1, 1, 6], ["PR", 4, 0, "auto_unroll_max_step$512"]]]], "r": [[0.000529359, 0.000529279, 0.000529301, 0.000529452], 0, 3.78791, 1656324021], "v": "v0.6"}
{"i": [["[\"3458e75493bb4bb042e539b5ff4818fb\", [4, 512], [1024, 512], [1, 1024], [4, 1024]]", "cuda -keys=cuda,gpu -arch=sm_80 -max_num_threads=1024 -thread_warp_size=32", [-1, 16, 64, 49152, 2147483647, 1024, 8, 32], "", 0, []], [[], [["SP", 2, 0, 4, [1, 1, 1, 2], 1], ["SP", 2, 5, 1024, [1, 32, 32, 1], 1], ["SP", 2, 10, 512, [1, 4], 1], ["RE", 2, [0, 5, 1, 6, 2, 7, 10, 11, 3, 8, 12, 4, 9]], ["FSP", 4, 0, 0, 3], ["FSP", 4, 4, 1, 3], ["RE", 4, [0, 4, 1, 5, 2, 6, 3, 7]], ["CA", 2, 4, 5], ["CHR", 1, "shared", [2]], ["CA", 2, 3, 6], ["CHR", 0, "shared", [3]], ["CA", 1, 4, 6], ["FU", 6, [0, 1]], ["AN", 6, 0, 5], ["FU", 6, [1, 2]], ["AN", 6, 1, 4], ["FU", 6, [2, 3]], ["AN", 6, 2, 6], ["FU", 3, [0, 1]], ["SP", 3, 0, 256, [1], 1], ["AN", 3, 1, 2], ["FFSP", 3, 0, [1, 0], 1, 1], ["AN", 3, 1, 6], ["FU", 1, [0, 1]], ["SP", 1, 0, 16, [1], 1], ["AN", 1, 1, 2], ["FFSP", 1, 0, [1, 0], 1, 1], ["AN", 1, 1, 6], ["PR", 4, 0, "auto_unroll_max_step$1024"]]]], "r": [[0.000391705, 0.00039177, 0.000391716, 0.000391756], 0, 3.78343, 1656324024], "v": "v0.6"}
{"i": [["[\"3458e75493bb4bb042e539b5ff4818fb\", [4, 512], [1024, 512], [1, 1024], [4, 1024]]", "cuda -keys=cuda,gpu -arch=sm_80 -max_num_threads=1024 -thread_warp_size=32", [-1, 16, 64, 49152, 2147483647, 1024, 8, 32], "", 0, []], [[], [["SP", 2, 0, 4, [1, 4, 1, 1], 1], ["SP", 2, 5, 1024, [1, 8, 2, 1], 1], ["SP", 2, 10, 512, [4, 2], 1], ["RE", 2, [0, 5, 1, 6, 2, 7, 10, 11, 3, 8, 12, 4, 9]], ["FSP", 4, 0, 0, 3], ["FSP", 4, 4, 1, 3], ["RE", 4, [0, 4, 1, 5, 2, 6, 3, 7]], ["CA", 2, 4, 5], ["CHR", 1, "shared", [2]], ["CA", 2, 3, 6], ["CHR", 0, "shared", [3]], ["CA", 1, 4, 6], ["FU", 6, [0, 1]], ["AN", 6, 0, 5], ["FU", 6, [1, 2]], ["AN", 6, 1, 4], ["FU", 6, [2, 3]], ["AN", 6, 2, 6], ["FU", 3, [0, 1]], ["SP", 3, 0, 1024, [1], 1], ["AN", 3, 1, 2], ["FFSP", 3, 0, [1, 0], 1, 1], ["AN", 3, 1, 6], ["FU", 1, [0, 1]], ["SP", 1, 0, 8, [1], 1], ["AN", 1, 1, 2], ["FFSP", 1, 0, [1, 0], 1, 1], ["AN", 1, 1, 6], ["PR", 4, 0, "auto_unroll_max_step$512"]]]], "r": [[1.83548e-05, 1.83533e-05, 1.83545e-05, 1.8357e-05], 0, 3.21508, 1656324026], "v": "v0.6"}
{"i": [["[\"3458e75493bb4bb042e539b5ff4818fb\", [4, 512], [1024, 512], [1, 1024], [4, 1024]]", "cuda -keys=cuda,gpu -arch=sm_80 -max_num_threads=1024 -thread_warp_size=32", [-1, 16, 64, 49152, 2147483647, 1024, 8, 32], "", 0, []], [[], [["SP", 2, 0, 4, [2, 1, 1, 2], 1], ["SP", 2, 5, 1024, [4, 16, 1, 8], 1], ["SP", 2, 10, 512, [2, 1], 1], ["RE", 2, [0, 5, 1, 6, 2, 7, 10, 11, 3, 8, 12, 4, 9]], ["FSP", 4, 0, 0, 3], ["FSP", 4, 4, 1, 3], ["RE", 4, [0, 4, 1, 5, 2, 6, 3, 7]], ["CA", 2, 4, 5], ["CHR", 1, "shared", [2]], ["CA", 2, 3, 6], ["CHR", 0, "shared", [3]], ["CA", 1, 4, 6], ["FU", 6, [0, 1]], ["AN", 6, 0, 5], ["FU", 6, [1, 2]], ["AN", 6, 1, 4], ["FU", 6, [2, 3]], ["AN", 6, 2, 6], ["FU", 3, [0, 1]], ["SP", 3, 0, 16, [1], 1], ["AN", 3, 1, 2], ["FFSP", 3, 0, [1, 0], 1, 1], ["AN", 3, 1, 6], ["FU", 1, [0, 1]], ["SP", 1, 0, 2, [1], 1], ["AN", 1, 1, 2], ["FFSP", 1, 0, [1, 0], 1, 1], ["AN", 1, 1, 6], ["PR", 4, 0, "auto_unroll_max_step$512"]]]], "r": [[0.000358876, 0.000358883, 0.000358883, 0.000358885], 0, 3.63583, 1656324029], "v": "v0.6"}
{"i": [["[\"3458e75493bb4bb042e539b5ff4818fb\", [4, 512], [1024, 512], [1, 1024], [4, 1024]]", "cuda -keys=cuda,gpu -arch=sm_80 -max_num_threads=1024 -thread_warp_size=32", [-1, 16, 64, 49152, 2147483647, 1024, 8, 32], "", 0, []], [[], [["SP", 2, 0, 4, [1, 2, 2, 1], 1], ["SP", 2, 5, 1024, [2, 64, 2, 2], 1], ["SP", 2, 10, 512, [2, 2], 1], ["RE", 2, [0, 5, 1, 6, 2, 7, 10, 11, 3, 8, 12, 4, 9]], ["FSP", 4, 0, 0, 3], ["FSP", 4, 4, 1, 3], ["RE", 4, [0, 4, 1, 5, 2, 6, 3, 7]], ["CA", 2, 4, 5], ["CHR", 1, "shared", [2]], ["CA", 2, 3, 6], ["CHR", 0, "shared", [3]], ["CA", 1, 4, 6], ["FU", 6, [0, 1]], ["AN", 6, 0, 5], ["FU", 6, [1, 2]], ["AN", 6, 1, 4], ["FU", 6, [2, 3]], ["AN", 6, 2, 6], ["FU", 3, [0, 1]], ["SP", 3, 0, 16, [1], 1], ["AN", 3, 1, 2], ["FFSP", 3, 0, [1, 0], 1, 1], ["AN", 3, 1, 6], ["FU", 1, [0, 1]], ["SP", 1, 0, 8, [8], 1], ["AN", 1, 1, 2], ["FFSP", 1, 0, [1, 0], 1, 1], ["AN", 1, 1, 6], ["PR", 4, 0, "auto_unroll_max_step$1024"]]]], "r": [[0.000135689, 0.000135687, 0.000135685, 0.000135683], 0, 3.2339, 1656324032], "v": "v0.6"}
{"i": [["[\"3458e75493bb4bb042e539b5ff4818fb\", [4, 512], [1024, 512], [1, 1024], [4, 1024]]", "cuda -keys=cuda,gpu -arch=sm_80 -max_num_threads=1024 -thread_warp_size=32", [-1, 16, 64, 49152, 2147483647, 1024, 8, 32], "", 0, []], [[], [["SP", 2, 0, 4, [1, 2, 2, 1], 1], ["SP", 2, 5, 1024, [8, 32, 2, 1], 1], ["SP", 2, 10, 512, [2, 2], 1], ["RE", 2, [0, 5, 1, 6, 2, 7, 10, 11, 3, 8, 12, 4, 9]], ["FSP", 4, 0, 0, 3], ["FSP", 4, 4, 1, 3], ["RE", 4, [0, 4, 1, 5, 2, 6, 3, 7]], ["CA", 2, 4, 5], ["CHR", 1, "shared", [2]], ["CA", 2, 3, 6], ["CHR", 0, "shared", [3]], ["CA", 1, 4, 6], ["FU", 6, [0, 1]], ["AN", 6, 0, 5], ["FU", 6, [1, 2]], ["AN", 6, 1, 4], ["FU", 6, [2, 3]], ["AN", 6, 2, 6], ["FU", 3, [0, 1]], ["SP", 3, 0, 16, [2], 1], ["AN", 3, 1, 2], ["FFSP", 3, 0, [1, 0], 1, 1], ["AN", 3, 1, 6], ["FU", 1, [0, 1]], ["SP", 1, 0, 8, [1], 1], ["AN", 1, 1, 2], ["FFSP", 1, 0, [1, 0], 1, 1], ["AN", 1, 1, 6], ["PR", 4, 0, "auto_unroll_max_step$64"]]]], "r": [[0.000139165, 0.000139269, 0.000139134, 0.000139147], 0, 3.21448, 1656324035], "v": "v0.6"}
{"i": [["[\"3458e75493bb4bb042e539b5ff4818fb\", [4, 512], [1024, 512], [1, 1024], [4, 1024]]", "cuda -keys=cuda,gpu -arch=sm_80 -max_num_threads=1024 -thread_warp_size=32", [-1, 16, 64, 49152, 2147483647, 1024, 8, 32], "", 0, []], [[], [["SP", 2, 0, 4, [2, 2, 1, 1], 1], ["SP", 2, 5, 1024, [1, 256, 2, 2], 1], ["SP", 2, 10, 512, [1, 4], 1], ["RE", 2, [0, 5, 1, 6, 2, 7, 10, 11, 3, 8, 12, 4, 9]], ["FSP", 4, 0, 0, 3], ["FSP", 4, 4, 1, 3], ["RE", 4, [0, 4, 1, 5, 2, 6, 3, 7]], ["CA", 2, 4, 5], ["CHR", 1, "shared", [2]], ["CA", 2, 3, 6], ["CHR", 0, "shared", [3]], ["CA", 1, 4, 6], ["FU", 6, [0, 1]], ["AN", 6, 0, 5], ["FU", 6, [1, 2]], ["AN", 6, 1, 4], ["FU", 6, [2, 3]], ["AN", 6, 2, 6], ["FU", 3, [0, 1]], ["SP", 3, 0, 16, [1], 1], ["AN", 3, 1, 2], ["FFSP", 3, 0, [1, 0], 1, 1], ["AN", 3, 1, 6], ["FU", 1, [0, 1]], ["SP", 1, 0, 4, [1], 1], ["AN", 1, 1, 2], ["FFSP", 1, 0, [1, 0], 1, 1], ["AN", 1, 1, 6], ["PR", 4, 0, "auto_unroll_max_step$64"]]]], "r": [[0.000222152, 0.000222142, 0.00022215, 0.000222142], 0, 3.15137, 1656324037], "v": "v0.6"}
{"i": [["[\"3458e75493bb4bb042e539b5ff4818fb\", [4, 512], [1024, 512], [1, 1024], [4, 1024]]", "cuda -keys=cuda,gpu -arch=sm_80 -max_num_threads=1024 -thread_warp_size=32", [-1, 16, 64, 49152, 2147483647, 1024, 8, 32], "", 0, []], [[], [["SP", 2, 0, 4, [1, 2, 1, 2], 1], ["SP", 2, 5, 1024, [1, 64, 2, 1], 1], ["SP", 2, 10, 512, [8, 1], 1], ["RE", 2, [0, 5, 1, 6, 2, 7, 10, 11, 3, 8, 12, 4, 9]], ["FSP", 4, 0, 0, 3], ["FSP", 4, 4, 1, 3], ["RE", 4, [0, 4, 1, 5, 2, 6, 3, 7]], ["CA", 2, 4, 5], ["CHR", 1, "shared", [2]], ["CA", 2, 3, 6], ["CHR", 0, "shared", [3]], ["CA", 1, 4, 6], ["FU", 6, [0, 1]], ["AN", 6, 0, 5], ["FU", 6, [1, 2]], ["AN", 6, 1, 4], ["FU", 6, [2, 3]], ["AN", 6, 2, 6], ["FU", 3, [0, 1]], ["SP", 3, 0, 64, [1], 1], ["AN", 3, 1, 2], ["FFSP", 3, 0, [1, 0], 1, 1], ["AN", 3, 1, 6], ["FU", 1, [0, 1]], ["SP", 1, 0, 16, [1], 1], ["AN", 1, 1, 2], ["FFSP", 1, 0, [1, 0], 1, 1], ["AN", 1, 1, 6], ["PR", 4, 0, "auto_unroll_max_step$0"]]]], "r": [[3.84468e-05, 3.85038e-05, 3.83757e-05, 3.84111e-05], 0, 3.1245, 1656324040], "v": "v0.6"}
{"i": [["[\"3458e75493bb4bb042e539b5ff4818fb\", [4, 512], [1024, 512], [1, 1024], [4, 1024]]", "cuda -keys=cuda,gpu -arch=sm_80 -max_num_threads=1024 -thread_warp_size=32", [-1, 16, 64, 49152, 2147483647, 1024, 8, 32], "", 0, []], [[], [["SP", 2, 0, 4, [4, 1, 1, 1], 1], ["SP", 2, 5, 1024, [1, 32, 2, 1], 1], ["SP", 2, 10, 512, [1, 64], 1], ["RE", 2, [0, 5, 1, 6, 2, 7, 10, 11, 3, 8, 12, 4, 9]], ["FSP", 4, 0, 0, 3], ["FSP", 4, 4, 1, 3], ["RE", 4, [0, 4, 1, 5, 2, 6, 3, 7]], ["CA", 2, 4, 5], ["CHR", 1, "shared", [2]], ["CA", 2, 3, 6], ["CHR", 0, "shared", [3]], ["CA", 1, 4, 6], ["FU", 6, [0, 1]], ["AN", 6, 0, 5], ["FU", 6, [1, 2]], ["AN", 6, 1, 4], ["FU", 6, [2, 3]], ["AN", 6, 2, 6], ["FU", 3, [0, 1]], ["SP", 3, 0, 128, [1], 1], ["AN", 3, 1, 2], ["FFSP", 3, 0, [1, 0], 1, 1], ["AN", 3, 1, 6], ["FU", 1, [0, 1]], ["SP", 1, 0, 64, [1], 1], ["AN", 1, 1, 2], ["FFSP", 1, 0, [1, 0], 1, 1], ["AN", 1, 1, 6], ["PR", 4, 0, "auto_unroll_max_step$0"]]]], "r": [[2.17123e-05, 2.17124e-05, 2.17123e-05, 2.17127e-05], 0, 3.8876, 1656324042], "v": "v0.6"}
{"i": [["[\"3458e75493bb4bb042e539b5ff4818fb\", [4, 512], [1024, 512], [1, 1024], [4, 1024]]", "cuda -keys=cuda,gpu -arch=sm_80 -max_num_threads=1024 -thread_warp_size=32", [-1, 16, 64, 49152, 2147483647, 1024, 8, 32], "", 0, []], [[], [["SP", 2, 0, 4, [2, 1, 1, 2], 1], ["SP", 2, 5, 1024, [1, 256, 1, 2], 1], ["SP", 2, 10, 512, [16, 1], 1], ["RE", 2, [0, 5, 1, 6, 2, 7, 10, 11, 3, 8, 12, 4, 9]], ["FSP", 4, 0, 0, 3], ["FSP", 4, 4, 1, 3], ["RE", 4, [0, 4, 1, 5, 2, 6, 3, 7]], ["CA", 2, 4, 5], ["CHR", 1, "shared", [2]], ["CA", 2, 3, 6], ["CHR", 0, "shared", [3]], ["CA", 1, 4, 6], ["FU", 6, [0, 1]], ["AN", 6, 0, 5], ["FU", 6, [1, 2]], ["AN", 6, 1, 4], ["FU", 6, [2, 3]], ["AN", 6, 2, 6], ["FU", 3, [0, 1]], ["SP", 3, 0, 32, [1], 1], ["AN", 3, 1, 2], ["FFSP", 3, 0, [1, 0], 1, 1], ["AN", 3, 1, 6], ["FU", 1, [0, 1]], ["SP", 1, 0, 32, [1], 1], ["AN", 1, 1, 2], ["FFSP", 1, 0, [1, 0], 1, 1], ["AN", 1, 1, 6], ["PR", 4, 0, "auto_unroll_max_step$16"]]]], "r": [[8.30267e-05, 8.30264e-05, 8.30209e-05, 8.30199e-05], 0, 3.10477, 1656324045], "v": "v0.6"}
{"i": [["[\"3458e75493bb4bb042e539b5ff4818fb\", [4, 512], [1024, 512], [1, 1024], [4, 1024]]", "cuda -keys=cuda,gpu -arch=sm_80 -max_num_threads=1024 -thread_warp_size=32", [-1, 16, 64, 49152, 2147483647, 1024, 8, 32], "", 0, []], [[], [["SP", 2, 0, 4, [1, 2, 1, 2], 1], ["SP", 2, 5, 1024, [1, 256, 4, 1], 1], ["SP", 2, 10, 512, [1, 2], 1], ["RE", 2, [0, 5, 1, 6, 2, 7, 10, 11, 3, 8, 12, 4, 9]], ["FSP", 4, 0, 0, 3], ["FSP", 4, 4, 1, 3], ["RE", 4, [0, 4, 1, 5, 2, 6, 3, 7]], ["CA", 2, 4, 5], ["CHR", 1, "shared", [2]], ["CA", 2, 3, 6], ["CHR", 0, "shared", [3]], ["CA", 1, 4, 6], ["FU", 6, [0, 1]], ["AN", 6, 0, 5], ["FU", 6, [1, 2]], ["AN", 6, 1, 4], ["FU", 6, [2, 3]], ["AN", 6, 2, 6], ["FU", 3, [0, 1]], ["SP", 3, 0, 8, [1], 1], ["AN", 3, 1, 2], ["FFSP", 3, 0, [1, 0], 1, 1], ["AN", 3, 1, 6], ["FU", 1, [0, 1]], ["SP", 1, 0, 4, [1], 1], ["AN", 1, 1, 2], ["FFSP", 1, 0, [1, 0], 1, 1], ["AN", 1, 1, 6], ["PR", 4, 0, "auto_unroll_max_step$0"]]]], "r": [[0.000321113, 0.000321121, 0.00032112, 0.000321126], 0, 3.13007, 1656324048], "v": "v0.6"}
{"i": [["[\"3458e75493bb4bb042e539b5ff4818fb\", [4, 512], [1024, 512], [1, 1024], [4, 1024]]", "cuda -keys=cuda,gpu -arch=sm_80 -max_num_threads=1024 -thread_warp_size=32", [-1, 16, 64, 49152, 2147483647, 1024, 8, 32], "", 0, []], [[], [["SP", 2, 0, 4, [1, 2, 1, 2], 1], ["SP", 2, 5, 1024, [1, 4, 64, 4], 1], ["SP", 2, 10, 512, [1, 4], 1], ["RE", 2, [0, 5, 1, 6, 2, 7, 10, 11, 3, 8, 12, 4, 9]], ["FSP", 4, 0, 0, 3], ["FSP", 4, 4, 1, 3], ["RE", 4, [0, 4, 1, 5, 2, 6, 3, 7]], ["CA", 2, 4, 5], ["CHR", 1, "shared", [2]], ["CA", 2, 3, 6], ["CHR", 0, "shared", [3]], ["CA", 1, 4, 6], ["FU", 6, [0, 1]], ["AN", 6, 0, 5], ["FU", 6, [1, 2]], ["AN", 6, 1, 4], ["FU", 6, [2, 3]], ["AN", 6, 2, 6], ["FU", 3, [0, 1]], ["SP", 3, 0, 8, [1], 1], ["AN", 3, 1, 2], ["FFSP", 3, 0, [1, 0], 1, 1], ["AN", 3, 1, 6], ["FU", 1, [0, 1]], ["SP", 1, 0, 4, [1], 1], ["AN", 1, 1, 2], ["FFSP", 1, 0, [1, 0], 1, 1], ["AN", 1, 1, 6], ["PR", 4, 0, "auto_unroll_max_step$0"]]]], "r": [[0.00233141, 0.00233148, 0.00233138, 0.0023312], 0, 2.38902, 1656324049], "v": "v0.6"}
{"i": [["[\"3458e75493bb4bb042e539b5ff4818fb\", [4, 512], [1024, 512], [1, 1024], [4, 1024]]", "cuda -keys=cuda,gpu -arch=sm_80 -max_num_threads=1024 -thread_warp_size=32", [-1, 16, 64, 49152, 2147483647, 1024, 8, 32], "", 0, []], [[], [["SP", 2, 0, 4, [1, 4, 1, 1], 1], ["SP", 2, 5, 1024, [8, 8, 2, 1], 1], ["SP", 2, 10, 512, [2, 2], 1], ["RE", 2, [0, 5, 1, 6, 2, 7, 10, 11, 3, 8, 12, 4, 9]], ["FSP", 4, 0, 0, 3], ["FSP", 4, 4, 1, 3], ["RE", 4, [0, 4, 1, 5, 2, 6, 3, 7]], ["CA", 2, 4, 5], ["CHR", 1, "shared", [2]], ["CA", 2, 3, 6], ["CHR", 0, "shared", [3]], ["CA", 1, 4, 6], ["FU", 6, [0, 1]], ["AN", 6, 0, 5], ["FU", 6, [1, 2]], ["AN", 6, 1, 4], ["FU", 6, [2, 3]], ["AN", 6, 2, 6], ["FU", 3, [0, 1]], ["SP", 3, 0, 8, [1], 1], ["AN", 3, 1, 2], ["FFSP", 3, 0, [1, 0], 1, 1], ["AN", 3, 1, 6], ["FU", 1, [0, 1]], ["SP", 1, 0, 4, [4], 1], ["AN", 1, 1, 2], ["FFSP", 1, 0, [1, 0], 1, 1], ["AN", 1, 1, 6], ["PR", 4, 0, "auto_unroll_max_step$0"]]]], "r": [[7.56901e-05, 7.57048e-05, 7.56925e-05, 7.56884e-05], 0, 3.05566, 1656324052], "v": "v0.6"}
{"i": [["[\"3458e75493bb4bb042e539b5ff4818fb\", [4, 512], [1024, 512], [1, 1024], [4, 1024]]", "cuda -keys=cuda,gpu -arch=sm_80 -max_num_threads=1024 -thread_warp_size=32", [-1, 16, 64, 49152, 2147483647, 1024, 8, 32], "", 0, []], [[], [["SP", 2, 0, 4, [1, 2, 1, 2], 1], ["SP", 2, 5, 1024, [2, 256, 1, 2], 1], ["SP", 2, 10, 512, [1, 1], 1], ["RE", 2, [0, 5, 1, 6, 2, 7, 10, 11, 3, 8, 12, 4, 9]], ["FSP", 4, 0, 0, 3], ["FSP", 4, 4, 1, 3], ["RE", 4, [0, 4, 1, 5, 2, 6, 3, 7]], ["CA", 2, 4, 5], ["CHR", 1, "shared", [2]], ["CA", 2, 3, 6], ["CHR", 0, "shared", [3]], ["CA", 1, 4, 6], ["FU", 6, [0, 1]], ["AN", 6, 0, 5], ["FU", 6, [1, 2]], ["AN", 6, 1, 4], ["FU", 6, [2, 3]], ["AN", 6, 2, 6], ["FU", 3, [0, 1]], ["SP", 3, 0, 8, [1], 1], ["AN", 3, 1, 2], ["FFSP", 3, 0, [1, 0], 1, 1], ["AN", 3, 1, 6], ["FU", 1, [0, 1]], ["SP", 1, 0, 4, [2], 1], ["AN", 1, 1, 2], ["FFSP", 1, 0, [1, 0], 1, 1], ["AN", 1, 1, 6], ["PR", 4, 0, "auto_unroll_max_step$16"]]]], "r": [[0.000469103, 0.000469121, 0.000469127, 0.000469122], 0, 3.00685, 1656324055], "v": "v0.6"}
{"i": [["[\"3458e75493bb4bb042e539b5ff4818fb\", [4, 512], [1024, 512], [1, 1024], [4, 1024]]", "cuda -keys=cuda,gpu -arch=sm_80 -max_num_threads=1024 -thread_warp_size=32", [-1, 16, 64, 49152, 2147483647, 1024, 8, 32], "", 0, []], [[], [["SP", 2, 0, 4, [1, 2, 2, 1], 1], ["SP", 2, 5, 1024, [1, 32, 8, 1], 1], ["SP", 2, 10, 512, [16, 2], 1], ["RE", 2, [0, 5, 1, 6, 2, 7, 10, 11, 3, 8, 12, 4, 9]], ["FSP", 4, 0, 0, 3], ["FSP", 4, 4, 1, 3], ["RE", 4, [0, 4, 1, 5, 2, 6, 3, 7]], ["CA", 2, 4, 5], ["CHR", 1, "shared", [2]], ["CA", 2, 3, 6], ["CHR", 0, "shared", [3]], ["CA", 1, 4, 6], ["FU", 6, [0, 1]], ["AN", 6, 0, 5], ["FU", 6, [1, 2]], ["AN", 6, 1, 4], ["FU", 6, [2, 3]], ["AN", 6, 2, 6], ["FU", 3, [0, 1]], ["SP", 3, 0, 256, [1], 1], ["AN", 3, 1, 2], ["FFSP", 3, 0, [1, 0], 1, 1], ["AN", 3, 1, 6], ["FU", 1, [0, 1]], ["SP", 1, 0, 32, [4], 1], ["AN", 1, 1, 2], ["FFSP", 1, 0, [1, 0], 1, 1], ["AN", 1, 1, 6], ["PR", 4, 0, "auto_unroll_max_step$16"]]]], "r": [[0.000133679, 0.000133652, 0.000133642, 0.000133673], 0, 3.14548, 1656324057], "v": "v0.6"}
{"i": [["[\"3458e75493bb4bb042e539b5ff4818fb\", [4, 512], [1024, 512], [1, 1024], [4, 1024]]", "cuda -keys=cuda,gpu -arch=sm_80 -max_num_threads=1024 -thread_warp_size=32", [-1, 16, 64, 49152, 2147483647, 1024, 8, 32], "", 0, []], [[], [["SP", 2, 0, 4, [1, 1, 1, 1], 1], ["SP", 2, 5, 1024, [1, 8, 2, 8], 1], ["SP", 2, 10, 512, [16, 4], 1], ["RE", 2, [0, 5, 1, 6, 2, 7, 10, 11, 3, 8, 12, 4, 9]], ["FSP", 4, 0, 0, 3], ["FSP", 4, 4, 1, 3], ["RE", 4, [0, 4, 1, 5, 2, 6, 3, 7]], ["CA", 2, 4, 5], ["CHR", 1, "shared", [2]], ["CA", 2, 3, 6], ["CHR", 0, "shared", [3]], ["CA", 1, 4, 6], ["FU", 6, [0, 1]], ["AN", 6, 0, 5], ["FU", 6, [1, 2]], ["AN", 6, 1, 4], ["FU", 6, [2, 3]], ["AN", 6, 2, 6], ["FU", 3, [0, 1]], ["SP", 3, 0, 64, [1], 1], ["AN", 3, 1, 2], ["FFSP", 3, 0, [1, 0], 1, 1], ["AN", 3, 1, 6], ["FU", 1, [0, 1]], ["SP", 1, 0, 4, [1], 1], ["AN", 1, 1, 2], ["FFSP", 1, 0, [1, 0], 1, 1], ["AN", 1, 1, 6], ["PR", 4, 0, "auto_unroll_max_step$512"]]]], "r": [[0.000109567, 0.000109568, 0.000109563, 0.000109565], 0, 3.13373, 1656324060], "v": "v0.6"}
{"i": [["[\"3458e75493bb4bb042e539b5ff4818fb\", [4, 512], [1024, 512], [1, 1024], [4, 1024]]", "cuda -keys=cuda,gpu -arch=sm_80 -max_num_threads=1024 -thread_warp_size=32", [-1, 16, 64, 49152, 2147483647, 1024, 8, 32], "", 0, []], [[], [["SP", 2, 0, 4, [2, 2, 1, 1], 1], ["SP", 2, 5, 1024, [1, 64, 1, 4], 1], ["SP", 2, 10, 512, [2, 8], 1], ["RE", 2, [0, 5, 1, 6, 2, 7, 10, 11, 3, 8, 12, 4, 9]], ["FSP", 4, 0, 0, 3], ["FSP", 4, 4, 1, 3], ["RE", 4, [0, 4, 1, 5, 2, 6, 3, 7]], ["CA", 2, 4, 5], ["CHR", 1, "shared", [2]], ["CA", 2, 3, 6], ["CHR", 0, "shared", [3]], ["CA", 1, 4, 6], ["FU", 6, [0, 1]], ["AN", 6, 0, 5], ["FU", 6, [1, 2]], ["AN", 6, 1, 4], ["FU", 6, [2, 3]], ["AN", 6, 2, 6], ["FU", 3, [0, 1]], ["SP", 3, 0, 64, [1], 1], ["AN", 3, 1, 2], ["FFSP", 3, 0, [1, 0], 1, 1], ["AN", 3, 1, 6], ["FU", 1, [0, 1]], ["SP", 1, 0, 16, [4], 1], ["AN", 1, 1, 2], ["FFSP", 1, 0, [1, 0], 1, 1], ["AN", 1, 1, 6], ["PR", 4, 0, "auto_unroll_max_step$512"]]]], "r": [[7.02672e-05, 7.02692e-05, 7.02852e-05, 7.02686e-05], 0, 3.0579, 1656324063], "v": "v0.6"}
{"i": [["[\"3458e75493bb4bb042e539b5ff4818fb\", [4, 512], [1024, 512], [1, 1024], [4, 1024]]", "cuda -keys=cuda,gpu -arch=sm_80 -max_num_threads=1024 -thread_warp_size=32", [-1, 16, 64, 49152, 2147483647, 1024, 8, 32], "", 0, []], [[], [["SP", 2, 0, 4, [1, 4, 1, 1], 1], ["SP", 2, 5, 1024, [1, 8, 4, 4], 1], ["SP", 2, 10, 512, [1, 4], 1], ["RE", 2, [0, 5, 1, 6, 2, 7, 10, 11, 3, 8, 12, 4, 9]], ["FSP", 4, 0, 0, 3], ["FSP", 4, 4, 1, 3], ["RE", 4, [0, 4, 1, 5, 2, 6, 3, 7]], ["CA", 2, 4, 5], ["CHR", 1, "shared", [2]], ["CA", 2, 3, 6], ["CHR", 0, "shared", [3]], ["CA", 1, 4, 6], ["FU", 6, [0, 1]], ["AN", 6, 0, 5], ["FU", 6, [1, 2]], ["AN", 6, 1, 4], ["FU", 6, [2, 3]], ["AN", 6, 2, 6], ["FU", 3, [0, 1]], ["SP", 3, 0, 64, [1], 1], ["AN", 3, 1, 2], ["FFSP", 3, 0, [1, 0], 1, 1], ["AN", 3, 1, 6], ["FU", 1, [0, 1]], ["SP", 1, 0, 4, [1], 1], ["AN", 1, 1, 2], ["FFSP", 1, 0, [1, 0], 1, 1], ["AN", 1, 1, 6], ["PR", 4, 0, "auto_unroll_max_step$512"]]]], "r": [[0.000148076, 0.000148073, 0.000148074, 0.00014807], 0, 3.1882, 1656324065], "v": "v0.6"}
{"i": [["[\"3458e75493bb4bb042e539b5ff4818fb\", [4, 512], [1024, 512], [1, 1024], [4, 1024]]", "cuda -keys=cuda,gpu -arch=sm_80 -max_num_threads=1024 -thread_warp_size=32", [-1, 16, 64, 49152, 2147483647, 1024, 8, 32], "", 0, []], [[], [["SP", 2, 0, 4, [1, 2, 2, 1], 1], ["SP", 2, 5, 1024, [2, 16, 8, 4], 1], ["SP", 2, 10, 512, [1, 4], 1], ["RE", 2, [0, 5, 1, 6, 2, 7, 10, 11, 3, 8, 12, 4, 9]], ["FSP", 4, 0, 0, 3], ["FSP", 4, 4, 1, 3], ["RE", 4, [0, 4, 1, 5, 2, 6, 3, 7]], ["CA", 2, 4, 5], ["CHR", 1, "shared", [2]], ["CA", 2, 3, 6], ["CHR", 0, "shared", [3]], ["CA", 1, 4, 6], ["FU", 6, [0, 1]], ["AN", 6, 0, 5], ["FU", 6, [1, 2]], ["AN", 6, 1, 4], ["FU", 6, [2, 3]], ["AN", 6, 2, 6], ["FU", 3, [0, 1]], ["SP", 3, 0, 128, [1], 1], ["AN", 3, 1, 2], ["FFSP", 3, 0, [1, 0], 1, 1], ["AN", 3, 1, 6], ["FU", 1, [0, 1]], ["SP", 1, 0, 8, [8], 1], ["AN", 1, 1, 2], ["FFSP", 1, 0, [1, 0], 1, 1], ["AN", 1, 1, 6], ["PR", 4, 0, "auto_unroll_max_step$64"]]]], "r": [[0.00102226, 0.00102223, 0.00102224, 0.00102227], 0, 3.60356, 1656324068], "v": "v0.6"}
{"i": [["[\"3458e75493bb4bb042e539b5ff4818fb\", [4, 512], [1024, 512], [1, 1024], [4, 1024]]", "cuda -keys=cuda,gpu -arch=sm_80 -max_num_threads=1024 -thread_warp_size=32", [-1, 16, 64, 49152, 2147483647, 1024, 8, 32], "", 0, []], [[], [["SP", 2, 0, 4, [1, 4, 1, 1], 1], ["SP", 2, 5, 1024, [4, 8, 8, 2], 1], ["SP", 2, 10, 512, [4, 1], 1], ["RE", 2, [0, 5, 1, 6, 2, 7, 10, 11, 3, 8, 12, 4, 9]], ["FSP", 4, 0, 0, 3], ["FSP", 4, 4, 1, 3], ["RE", 4, [0, 4, 1, 5, 2, 6, 3, 7]], ["CA", 2, 4, 5], ["CHR", 1, "shared", [2]], ["CA", 2, 3, 6], ["CHR", 0, "shared", [3]], ["CA", 1, 4, 6], ["FU", 6, [0, 1]], ["AN", 6, 0, 5], ["FU", 6, [1, 2]], ["AN", 6, 1, 4], ["FU", 6, [2, 3]], ["AN", 6, 2, 6], ["FU", 3, [0, 1]], ["SP", 3, 0, 64, [1], 1], ["AN", 3, 1, 2], ["FFSP", 3, 0, [1, 0], 1, 1], ["AN", 3, 1, 6], ["FU", 1, [0, 1]], ["SP", 1, 0, 16, [2], 1], ["AN", 1, 1, 2], ["FFSP", 1, 0, [1, 0], 1, 1], ["AN", 1, 1, 6], ["PR", 4, 0, "auto_unroll_max_step$1024"]]]], "r": [[0.000533675, 0.000533624, 0.000533642, 0.000533629], 0, 3.49641, 1656324071], "v": "v0.6"}
{"i": [["[\"3458e75493bb4bb042e539b5ff4818fb\", [4, 512], [1024, 512], [1, 1024], [4, 1024]]", "cuda -keys=cuda,gpu -arch=sm_80 -max_num_threads=1024 -thread_warp_size=32", [-1, 16, 64, 49152, 2147483647, 1024, 8, 32], "", 0, []], [[], [["SP", 2, 0, 4, [4, 1, 1, 1], 1], ["SP", 2, 5, 1024, [1, 64, 1, 1], 1], ["SP", 2, 10, 512, [2, 1], 1], ["RE", 2, [0, 5, 1, 6, 2, 7, 10, 11, 3, 8, 12, 4, 9]], ["FSP", 4, 0, 0, 3], ["FSP", 4, 4, 1, 3], ["RE", 4, [0, 4, 1, 5, 2, 6, 3, 7]], ["CA", 2, 4, 5], ["CHR", 1, "shared", [2]], ["CA", 2, 3, 6], ["CHR", 0, "shared", [3]], ["CA", 1, 4, 6], ["FU", 6, [0, 1]], ["AN", 6, 0, 5], ["FU", 6, [1, 2]], ["AN", 6, 1, 4], ["FU", 6, [2, 3]], ["AN", 6, 2, 6], ["FU", 3, [0, 1]], ["SP", 3, 0, 2, [2], 1], ["AN", 3, 1, 2], ["FFSP", 3, 0, [1, 0], 1, 1], ["AN", 3, 1, 6], ["FU", 1, [0, 1]], ["SP", 1, 0, 2, [1], 1], ["AN", 1, 1, 2], ["FFSP", 1, 0, [1, 0], 1, 1], ["AN", 1, 1, 6], ["PR", 4, 0, "auto_unroll_max_step$64"]]]], "r": [[4.17277e-05, 4.17191e-05, 4.1724e-05, 4.17237e-05], 0, 2.95523, 1656324073], "v": "v0.6"}
{"i": [["[\"3458e75493bb4bb042e539b5ff4818fb\", [4, 512], [1024, 512], [1, 1024], [4, 1024]]", "cuda -keys=cuda,gpu -arch=sm_80 -max_num_threads=1024 -thread_warp_size=32", [-1, 16, 64, 49152, 2147483647, 1024, 8, 32], "", 0, []], [[], [["SP", 2, 0, 4, [1, 2, 2, 1], 1], ["SP", 2, 5, 1024, [2, 16, 8, 4], 1], ["SP", 2, 10, 512, [4, 1], 1], ["RE", 2, [0, 5, 1, 6, 2, 7, 10, 11, 3, 8, 12, 4, 9]], ["FSP", 4, 0, 0, 3], ["FSP", 4, 4, 1, 3], ["RE", 4, [0, 4, 1, 5, 2, 6, 3, 7]], ["CA", 2, 4, 5], ["CHR", 1, "shared", [2]], ["CA", 2, 3, 6], ["CHR", 0, "shared", [3]], ["CA", 1, 4, 6], ["FU", 6, [0, 1]], ["AN", 6, 0, 5], ["FU", 6, [1, 2]], ["AN", 6, 1, 4], ["FU", 6, [2, 3]], ["AN", 6, 2, 6], ["FU", 3, [0, 1]], ["SP", 3, 0, 128, [1], 1], ["AN", 3, 1, 2], ["FFSP", 3, 0, [1, 0], 1, 1], ["AN", 3, 1, 6], ["FU", 1, [0, 1]], ["SP", 1, 0, 8, [2], 1], ["AN", 1, 1, 2], ["FFSP", 1, 0, [1, 0], 1, 1], ["AN", 1, 1, 6], ["PR", 4, 0, "auto_unroll_max_step$64"]]]], "r": [[0.00105554, 0.00105564, 0.0010554, 0.00105529], 0, 3.4448, 1656324076], "v": "v0.6"}
{"i": [["[\"3458e75493bb4bb042e539b5ff4818fb\", [4, 512], [1024, 512], [1, 1024], [4, 1024]]", "cuda -keys=cuda,gpu -arch=sm_80 -max_num_threads=1024 -thread_warp_size=32", [-1, 16, 64, 49152, 2147483647, 1024, 8, 32], "", 0, []], [[], [["SP", 2, 0, 4, [1, 1, 4, 1], 1], ["SP", 2, 5, 1024, [2, 16, 8, 4], 1], ["SP", 2, 10, 512, [1, 1], 1], ["RE", 2, [0, 5, 1, 6, 2, 7, 10, 11, 3, 8, 12, 4, 9]], ["FSP", 4, 0, 0, 3], ["FSP", 4, 4, 1, 3], ["RE", 4, [0, 4, 1, 5, 2, 6, 3, 7]], ["CA", 2, 4, 5], ["CHR", 1, "shared", [2]], ["CA", 2, 3, 6], ["CHR", 0, "shared", [3]], ["CA", 1, 4, 6], ["FU", 6, [0, 1]], ["AN", 6, 0, 5], ["FU", 6, [1, 2]], ["AN", 6, 1, 4], ["FU", 6, [2, 3]], ["AN", 6, 2, 6], ["FU", 3, [0, 1]], ["SP", 3, 0, 128, [1], 1], ["AN", 3, 1, 2], ["FFSP", 3, 0, [1, 0], 1, 1], ["AN", 3, 1, 6], ["FU", 1, [0, 1]], ["SP", 1, 0, 8, [1], 1], ["AN", 1, 1, 2], ["FFSP", 1, 0, [1, 0], 1, 1], ["AN", 1, 1, 6], ["PR", 4, 0, "auto_unroll_max_step$64"]]]], "r": [[0.00162105, 0.00161441, 0.00161292, 0.00161526], 0, 2.62192, 1656324078], "v": "v0.6"}
{"i": [["[\"3458e75493bb4bb042e539b5ff4818fb\", [4, 512], [1024, 512], [1, 1024], [4, 1024]]", "cuda -keys=cuda,gpu -arch=sm_80 -max_num_threads=1024 -thread_warp_size=32", [-1, 16, 64, 49152, 2147483647, 1024, 8, 32], "", 0, []], [[], [["SP", 2, 0, 4, [1, 4, 1, 1], 1], ["SP", 2, 5, 1024, [1, 256, 1, 4], 1], ["SP", 2, 10, 512, [1, 4], 1], ["RE", 2, [0, 5, 1, 6, 2, 7, 10, 11, 3, 8, 12, 4, 9]], ["FSP", 4, 0, 0, 3], ["FSP", 4, 4, 1, 3], ["RE", 4, [0, 4, 1, 5, 2, 6, 3, 7]], ["CA", 2, 4, 5], ["CHR", 1, "shared", [2]], ["CA", 2, 3, 6], ["CHR", 0, "shared", [3]], ["CA", 1, 4, 6], ["FU", 6, [0, 1]], ["AN", 6, 0, 5], ["FU", 6, [1, 2]], ["AN", 6, 1, 4], ["FU", 6, [2, 3]], ["AN", 6, 2, 6], ["FU", 3, [0, 1]], ["SP", 3, 0, 16, [16], 1], ["AN", 3, 1, 2], ["FFSP", 3, 0, [1, 0], 1, 1], ["AN", 3, 1, 6], ["FU", 1, [0, 1]], ["SP", 1, 0, 4, [1], 1], ["AN", 1, 1, 2], ["FFSP", 1, 0, [1, 0], 1, 1], ["AN", 1, 1, 6], ["PR", 4, 0, "auto_unroll_max_step$64"]]]], "r": [[0.000677418, 0.000677374, 0.000677419, 0.000677406], 0, 3.09867, 1656324080], "v": "v0.6"}
{"i": [["[\"3458e75493bb4bb042e539b5ff4818fb\", [4, 512], [1024, 512], [1, 1024], [4, 1024]]", "cuda -keys=cuda,gpu -arch=sm_80 -max_num_threads=1024 -thread_warp_size=32", [-1, 16, 64, 49152, 2147483647, 1024, 8, 32], "", 0, []], [[], [["SP", 2, 0, 4, [1, 2, 1, 2], 1], ["SP", 2, 5, 1024, [2, 16, 4, 1], 1], ["SP", 2, 10, 512, [4, 4], 1], ["RE", 2, [0, 5, 1, 6, 2, 7, 10, 11, 3, 8, 12, 4, 9]], ["FSP", 4, 0, 0, 3], ["FSP", 4, 4, 1, 3], ["RE", 4, [0, 4, 1, 5, 2, 6, 3, 7]], ["CA", 2, 4, 5], ["CHR", 1, "shared", [2]], ["CA", 2, 3, 6], ["CHR", 0, "shared", [3]], ["CA", 1, 4, 6], ["FU", 6, [0, 1]], ["AN", 6, 0, 5], ["FU", 6, [1, 2]], ["AN", 6, 1, 4], ["FU", 6, [2, 3]], ["AN", 6, 2, 6], ["FU", 3, [0, 1]], ["SP", 3, 0, 64, [4], 1], ["AN", 3, 1, 2], ["FFSP", 3, 0, [1, 0], 1, 1], ["AN", 3, 1, 6], ["FU", 1, [0, 1]], ["SP", 1, 0, 32, [1], 1], ["AN", 1, 1, 2], ["FFSP", 1, 0, [1, 0], 1, 1], ["AN", 1, 1, 6], ["PR", 4, 0, "auto_unroll_max_step$1024"]]]], "r": [[6.54191e-05, 6.54194e-05, 6.54193e-05, 6.54178e-05], 0, 3.17081, 1656324083], "v": "v0.6"}
{"i": [["[\"3458e75493bb4bb042e539b5ff4818fb\", [4, 512], [1024, 512], [1, 1024], [4, 1024]]", "cuda -keys=cuda,gpu -arch=sm_80 -max_num_threads=1024 -thread_warp_size=32", [-1, 16, 64, 49152, 2147483647, 1024, 8, 32], "", 0, []], [[], [["SP", 2, 0, 4, [4, 1, 1, 1], 1], ["SP", 2, 5, 1024, [2, 16, 8, 1], 1], ["SP", 2, 10, 512, [1, 4], 1], ["RE", 2, [0, 5, 1, 6, 2, 7, 10, 11, 3, 8, 12, 4, 9]], ["FSP", 4, 0, 0, 3], ["FSP", 4, 4, 1, 3], ["RE", 4, [0, 4, 1, 5, 2, 6, 3, 7]], ["CA", 2, 4, 5], ["CHR", 1, "shared", [2]], ["CA", 2, 3, 6], ["CHR", 0, "shared", [3]], ["CA", 1, 4, 6], ["FU", 6, [0, 1]], ["AN", 6, 0, 5], ["FU", 6, [1, 2]], ["AN", 6, 1, 4], ["FU", 6, [2, 3]], ["AN", 6, 2, 6], ["FU", 3, [0, 1]], ["SP", 3, 0, 32, [2], 1], ["AN", 3, 1, 2], ["FFSP", 3, 0, [1, 0], 1, 1], ["AN", 3, 1, 6], ["FU", 1, [0, 1]], ["SP", 1, 0, 4, [2], 1], ["AN", 1, 1, 2], ["FFSP", 1, 0, [1, 0], 1, 1], ["AN", 1, 1, 6], ["PR", 4, 0, "auto_unroll_max_step$0"]]]], "r": [[0.000147552, 0.000147624, 0.000147569, 0.000147579], 0, 3.09652, 1656324086], "v": "v0.6"}
{"i": [["[\"3458e75493bb4bb042e539b5ff4818fb\", [4, 512], [1024, 512], [1, 1024], [4, 1024]]", "cuda -keys=cuda,gpu -arch=sm_80 -max_num_threads=1024 -thread_warp_size=32", [-1, 16, 64, 49152, 2147483647, 1024, 8, 32], "", 0, []], [[], [["SP", 2, 0, 4, [1, 4, 1, 1], 1], ["SP", 2, 5, 1024, [2, 16, 2, 1], 1], ["SP", 2, 10, 512, [1, 32], 1], ["RE", 2, [0, 5, 1, 6, 2, 7, 10, 11, 3, 8, 12, 4, 9]], ["FSP", 4, 0, 0, 3], ["FSP", 4, 4, 1, 3], ["RE", 4, [0, 4, 1, 5, 2, 6, 3, 7]], ["CA", 2, 4, 5], ["CHR", 1, "shared", [2]], ["CA", 2, 3, 6], ["CHR", 0, "shared", [3]], ["CA", 1, 4, 6], ["FU", 6, [0, 1]], ["AN", 6, 0, 5], ["FU", 6, [1, 2]], ["AN", 6, 1, 4], ["FU", 6, [2, 3]], ["AN", 6, 2, 6], ["FU", 3, [0, 1]], ["SP", 3, 0, 64, [4], 1], ["AN", 3, 1, 2], ["FFSP", 3, 0, [1, 0], 1, 1], ["AN", 3, 1, 6], ["FU", 1, [0, 1]], ["SP", 1, 0, 32, [1], 1], ["AN", 1, 1, 2], ["FFSP", 1, 0, [1, 0], 1, 1], ["AN", 1, 1, 6], ["PR", 4, 0, "auto_unroll_max_step$16"]]]], "r": [[3.46581e-05, 3.46615e-05, 3.46414e-05, 3.46269e-05], 0, 3.01308, 1656324088], "v": "v0.6"}
{"i": [["[\"3458e75493bb4bb042e539b5ff4818fb\", [4, 512], [1024, 512], [1, 1024], [4, 1024]]", "cuda -keys=cuda,gpu -arch=sm_80 -max_num_threads=1024 -thread_warp_size=32", [-1, 16, 64, 49152, 2147483647, 1024, 8, 32], "", 0, []], [[], [["SP", 2, 0, 4, [1, 4, 1, 1], 1], ["SP", 2, 5, 1024, [1, 8, 4, 1], 1], ["SP", 2, 10, 512, [4, 2], 1], ["RE", 2, [0, 5, 1, 6, 2, 7, 10, 11, 3, 8, 12, 4, 9]], ["FSP", 4, 0, 0, 3], ["FSP", 4, 4, 1, 3], ["RE", 4, [0, 4, 1, 5, 2, 6, 3, 7]], ["CA", 2, 4, 5], ["CHR", 1, "shared", [2]], ["CA", 2, 3, 6], ["CHR", 0, "shared", [3]], ["CA", 1, 4, 6], ["FU", 6, [0, 1]], ["AN", 6, 0, 5], ["FU", 6, [1, 2]], ["AN", 6, 1, 4], ["FU", 6, [2, 3]], ["AN", 6, 2, 6], ["FU", 3, [0, 1]], ["SP", 3, 0, 32, [1], 1], ["AN", 3, 1, 2], ["FFSP", 3, 0, [1, 0], 1, 1], ["AN", 3, 1, 6], ["FU", 1, [0, 1]], ["SP", 1, 0, 8, [1], 1], ["AN", 1, 1, 2], ["FFSP", 1, 0, [1, 0], 1, 1], ["AN", 1, 1, 6], ["PR", 4, 0, "auto_unroll_max_step$64"]]]], "r": [[4.61464e-05, 4.61712e-05, 4.61809e-05, 4.61796e-05], 0, 2.98343, 1656324091], "v": "v0.6"}
{"i": [["[\"3458e75493bb4bb042e539b5ff4818fb\", [4, 512], [1024, 512], [1, 1024], [4, 1024]]", "cuda -keys=cuda,gpu -arch=sm_80 -max_num_threads=1024 -thread_warp_size=32", [-1, 16, 64, 49152, 2147483647, 1024, 8, 32], "", 0, []], [[], [["SP", 2, 0, 4, [1, 1, 1, 4], 1], ["SP", 2, 5, 1024, [1, 8, 2, 8], 1], ["SP", 2, 10, 512, [1, 4], 1], ["RE", 2, [0, 5, 1, 6, 2, 7, 10, 11, 3, 8, 12, 4, 9]], ["FSP", 4, 0, 0, 3], ["FSP", 4, 4, 1, 3], ["RE", 4, [0, 4, 1, 5, 2, 6, 3, 7]], ["CA", 2, 4, 5], ["CHR", 1, "shared", [2]], ["CA", 2, 3, 6], ["CHR", 0, "shared", [3]], ["CA", 1, 4, 6], ["FU", 6, [0, 1]], ["AN", 6, 0, 5], ["FU", 6, [1, 2]], ["AN", 6, 1, 4], ["FU", 6, [2, 3]], ["AN", 6, 2, 6], ["FU", 3, [0, 1]], ["SP", 3, 0, 64, [1], 1], ["AN", 3, 1, 2], ["FFSP", 3, 0, [1, 0], 1, 1], ["AN", 3, 1, 6], ["FU", 1, [0, 1]], ["SP", 1, 0, 4, [4], 1], ["AN", 1, 1, 2], ["FFSP", 1, 0, [1, 0], 1, 1], ["AN", 1, 1, 6], ["PR", 4, 0, "auto_unroll_max_step$512"]]]], "r": [[0.000123205, 0.000123205, 0.000123219, 0.000123219], 0, 3.2534, 1656324093], "v": "v0.6"}
{"i": [["[\"3458e75493bb4bb042e539b5ff4818fb\", [4, 512], [1024, 512], [1, 1024], [4, 1024]]", "cuda -keys=cuda,gpu -arch=sm_80 -max_num_threads=1024 -thread_warp_size=32", [-1, 16, 64, 49152, 2147483647, 1024, 8, 32], "", 0, []], [[], [["SP", 2, 0, 4, [1, 4, 1, 1], 1], ["SP", 2, 5, 1024, [1, 1, 1, 4], 1], ["SP", 2, 10, 512, [4, 4], 1], ["RE", 2, [0, 5, 1, 6, 2, 7, 10, 11, 3, 8, 12, 4, 9]], ["FSP", 4, 0, 0, 3], ["FSP", 4, 4, 1, 3], ["RE", 4, [0, 4, 1, 5, 2, 6, 3, 7]], ["CA", 2, 4, 5], ["CHR", 1, "shared", [2]], ["CA", 2, 3, 6], ["CHR", 0, "shared", [3]], ["CA", 1, 4, 6], ["FU", 6, [0, 1]], ["AN", 6, 0, 5], ["FU", 6, [1, 2]], ["AN", 6, 1, 4], ["FU", 6, [2, 3]], ["AN", 6, 2, 6], ["FU", 3, [0, 1]], ["SP", 3, 0, 32, [1], 1], ["AN", 3, 1, 2], ["FFSP", 3, 0, [1, 0], 1, 1], ["AN", 3, 1, 6], ["FU", 1, [0, 1]], ["SP", 1, 0, 64, [1], 1], ["AN", 1, 1, 2], ["FFSP", 1, 0, [1, 0], 1, 1], ["AN", 1, 1, 6], ["PR", 4, 0, "auto_unroll_max_step$64"]]]], "r": [[1.90233e-05, 1.90228e-05, 1.90191e-05, 1.90224e-05], 0, 2.89141, 1656324096], "v": "v0.6"}
{"i": [["[\"3458e75493bb4bb042e539b5ff4818fb\", [4, 512], [1024, 512], [1, 1024], [4, 1024]]", "cuda -keys=cuda,gpu -arch=sm_80 -max_num_threads=1024 -thread_warp_size=32", [-1, 16, 64, 49152, 2147483647, 1024, 8, 32], "", 0, []], [[], [["SP", 2, 0, 4, [1, 1, 1, 2], 1], ["SP", 2, 5, 1024, [1, 64, 1, 1], 1], ["SP", 2, 10, 512, [1, 4], 1], ["RE", 2, [0, 5, 1, 6, 2, 7, 10, 11, 3, 8, 12, 4, 9]], ["FSP", 4, 0, 0, 3], ["FSP", 4, 4, 1, 3], ["RE", 4, [0, 4, 1, 5, 2, 6, 3, 7]], ["CA", 2, 4, 5], ["CHR", 1, "shared", [2]], ["CA", 2, 3, 6], ["CHR", 0, "shared", [3]], ["CA", 1, 4, 6], ["FU", 6, [0, 1]], ["AN", 6, 0, 5], ["FU", 6, [1, 2]], ["AN", 6, 1, 4], ["FU", 6, [2, 3]], ["AN", 6, 2, 6], ["FU", 3, [0, 1]], ["SP", 3, 0, 4, [1], 1], ["AN", 3, 1, 2], ["FFSP", 3, 0, [1, 0], 1, 1], ["AN", 3, 1, 6], ["FU", 1, [0, 1]], ["SP", 1, 0, 8, [2], 1], ["AN", 1, 1, 2], ["FFSP", 1, 0, [1, 0], 1, 1], ["AN", 1, 1, 6], ["PR", 4, 0, "auto_unroll_max_step$512"]]]], "r": [[3.04303e-05, 3.043e-05, 3.043e-05, 3.04296e-05], 0, 2.89642, 1656324098], "v": "v0.6"}
{"i": [["[\"3458e75493bb4bb042e539b5ff4818fb\", [4, 512], [1024, 512], [1, 1024], [4, 1024]]", "cuda -keys=cuda,gpu -arch=sm_80 -max_num_threads=1024 -thread_warp_size=32", [-1, 16, 64, 49152, 2147483647, 1024, 8, 32], "", 0, []], [[], [["SP", 2, 0, 4, [2, 1, 2, 1], 1], ["SP", 2, 5, 1024, [2, 128, 2, 1], 1], ["SP", 2, 10, 512, [4, 2], 1], ["RE", 2, [0, 5, 1, 6, 2, 7, 10, 11, 3, 8, 12, 4, 9]], ["FSP", 4, 0, 0, 3], ["FSP", 4, 4, 1, 3], ["RE", 4, [0, 4, 1, 5, 2, 6, 3, 7]], ["CA", 2, 4, 5], ["CHR", 1, "shared", [2]], ["CA", 2, 3, 6], ["CHR", 0, "shared", [3]], ["CA", 1, 4, 6], ["FU", 6, [0, 1]], ["AN", 6, 0, 5], ["FU", 6, [1, 2]], ["AN", 6, 1, 4], ["FU", 6, [2, 3]], ["AN", 6, 2, 6], ["FU", 3, [0, 1]], ["SP", 3, 0, 16, [1], 1], ["AN", 3, 1, 2], ["FFSP", 3, 0, [1, 0], 1, 1], ["AN", 3, 1, 6], ["FU", 1, [0, 1]], ["SP", 1, 0, 16, [1], 1], ["AN", 1, 1, 2], ["FFSP", 1, 0, [1, 0], 1, 1], ["AN", 1, 1, 6], ["PR", 4, 0, "auto_unroll_max_step$512"]]]], "r": [[8.15636e-05, 8.15286e-05, 8.15789e-05, 8.15288e-05], 0, 3.01965, 1656324101], "v": "v0.6"}
{"i": [["[\"3458e75493bb4bb042e539b5ff4818fb\", [4, 512], [1024, 512], [1, 1024], [4, 1024]]", "cuda -keys=cuda,gpu -arch=sm_80 -max_num_threads=1024 -thread_warp_size=32", [-1, 16, 64, 49152, 2147483647, 1024, 8, 32], "", 0, []], [[], [["SP", 2, 0, 4, [1, 4, 1, 1], 1], ["SP", 2, 5, 1024, [1, 32, 8, 1], 1], ["SP", 2, 10, 512, [16, 2], 1], ["RE", 2, [0, 5, 1, 6, 2, 7, 10, 11, 3, 8, 12, 4, 9]], ["FSP", 4, 0, 0, 3], ["FSP", 4, 4, 1, 3], ["RE", 4, [0, 4, 1, 5, 2, 6, 3, 7]], ["CA", 2, 4, 5], ["CHR", 1, "shared", [2]], ["CA", 2, 3, 6], ["CHR", 0, "shared", [3]], ["CA", 1, 4, 6], ["FU", 6, [0, 1]], ["AN", 6, 0, 5], ["FU", 6, [1, 2]], ["AN", 6, 1, 4], ["FU", 6, [2, 3]], ["AN", 6, 2, 6], ["FU", 3, [0, 1]], ["SP", 3, 0, 256, [1], 1], ["AN", 3, 1, 2], ["FFSP", 3, 0, [1, 0], 1, 1], ["AN", 3, 1, 6], ["FU", 1, [0, 1]], ["SP", 1, 0, 32, [1], 1], ["AN", 1, 1, 2], ["FFSP", 1, 0, [1, 0], 1, 1], ["AN", 1, 1, 6], ["PR", 4, 0, "auto_unroll_max_step$512"]]]], "r": [[0.000109717, 0.00010972, 0.000109669, 0.000109664], 0, 3.4146, 1656324104], "v": "v0.6"}
{"i": [["[\"3458e75493bb4bb042e539b5ff4818fb\", [4, 512], [1024, 512], [1, 1024], [4, 1024]]", "cuda -keys=cuda,gpu -arch=sm_80 -max_num_threads=1024 -thread_warp_size=32", [-1, 16, 64, 49152, 2147483647, 1024, 8, 32], "", 0, []], [[], [["SP", 2, 0, 4, [1, 1, 2, 1], 1], ["SP", 2, 5, 1024, [1, 32, 16, 2], 1], ["SP", 2, 10, 512, [1, 8], 1], ["RE", 2, [0, 5, 1, 6, 2, 7, 10, 11, 3, 8, 12, 4, 9]], ["FSP", 4, 0, 0, 3], ["FSP", 4, 4, 1, 3], ["RE", 4, [0, 4, 1, 5, 2, 6, 3, 7]], ["CA", 2, 4, 5], ["CHR", 1, "shared", [2]], ["CA", 2, 3, 6], ["CHR", 0, "shared", [3]], ["CA", 1, 4, 6], ["FU", 6, [0, 1]], ["AN", 6, 0, 5], ["FU", 6, [1, 2]], ["AN", 6, 1, 4], ["FU", 6, [2, 3]], ["AN", 6, 2, 6], ["FU", 3, [0, 1]], ["SP", 3, 0, 32, [1], 1], ["AN", 3, 1, 2], ["FFSP", 3, 0, [1, 0], 1, 1], ["AN", 3, 1, 6], ["FU", 1, [0, 1]], ["SP", 1, 0, 4, [1], 1], ["AN", 1, 1, 2], ["FFSP", 1, 0, [1, 0], 1, 1], ["AN", 1, 1, 6], ["PR", 4, 0, "auto_unroll_max_step$1024"]]]], "r": [[0.000350394, 0.000350394, 0.000350426, 0.000350414], 0, 4.03895, 1656324106], "v": "v0.6"}
{"i": [["[\"3458e75493bb4bb042e539b5ff4818fb\", [4, 512], [1024, 512], [1, 1024], [4, 1024]]", "cuda -keys=cuda,gpu -arch=sm_80 -max_num_threads=1024 -thread_warp_size=32", [-1, 16, 64, 49152, 2147483647, 1024, 8, 32], "", 0, []], [[], [["SP", 2, 0, 4, [1, 1, 1, 2], 1], ["SP", 2, 5, 1024, [1, 32, 32, 1], 1], ["SP", 2, 10, 512, [1, 8], 1], ["RE", 2, [0, 5, 1, 6, 2, 7, 10, 11, 3, 8, 12, 4, 9]], ["FSP", 4, 0, 0, 3], ["FSP", 4, 4, 1, 3], ["RE", 4, [0, 4, 1, 5, 2, 6, 3, 7]], ["CA", 2, 4, 5], ["CHR", 1, "shared", [2]], ["CA", 2, 3, 6], ["CHR", 0, "shared", [3]], ["CA", 1, 4, 6], ["FU", 6, [0, 1]], ["AN", 6, 0, 5], ["FU", 6, [1, 2]], ["AN", 6, 1, 4], ["FU", 6, [2, 3]], ["AN", 6, 2, 6], ["FU", 3, [0, 1]], ["SP", 3, 0, 256, [1], 1], ["AN", 3, 1, 2], ["FFSP", 3, 0, [1, 0], 1, 1], ["AN", 3, 1, 6], ["FU", 1, [0, 1]], ["SP", 1, 0, 16, [1], 1], ["AN", 1, 1, 2], ["FFSP", 1, 0, [1, 0], 1, 1], ["AN", 1, 1, 6], ["PR", 4, 0, "auto_unroll_max_step$1024"]]]], "r": [[0.000349567, 0.000349596, 0.000349619, 0.000349658], 0, 4.06115, 1656324109], "v": "v0.6"}
{"i": [["[\"3458e75493bb4bb042e539b5ff4818fb\", [4, 512], [1024, 512], [1, 1024], [4, 1024]]", "cuda -keys=cuda,gpu -arch=sm_80 -max_num_threads=1024 -thread_warp_size=32", [-1, 16, 64, 49152, 2147483647, 1024, 8, 32], "", 0, []], [[], [["SP", 2, 0, 4, [1, 2, 2, 1], 1], ["SP", 2, 5, 1024, [1, 64, 1, 4], 1], ["SP", 2, 10, 512, [1, 8], 1], ["RE", 2, [0, 5, 1, 6, 2, 7, 10, 11, 3, 8, 12, 4, 9]], ["FSP", 4, 0, 0, 3], ["FSP", 4, 4, 1, 3], ["RE", 4, [0, 4, 1, 5, 2, 6, 3, 7]], ["CA", 2, 4, 5], ["CHR", 1, "shared", [2]], ["CA", 2, 3, 6], ["CHR", 0, "shared", [3]], ["CA", 1, 4, 6], ["FU", 6, [0, 1]], ["AN", 6, 0, 5], ["FU", 6, [1, 2]], ["AN", 6, 1, 4], ["FU", 6, [2, 3]], ["AN", 6, 2, 6], ["FU", 3, [0, 1]], ["SP", 3, 0, 128, [1], 1], ["AN", 3, 1, 2], ["FFSP", 3, 0, [1, 0], 1, 1], ["AN", 3, 1, 6], ["FU", 1, [0, 1]], ["SP", 1, 0, 64, [1], 1], ["AN", 1, 1, 2], ["FFSP", 1, 0, [1, 0], 1, 1], ["AN", 1, 1, 6], ["PR", 4, 0, "auto_unroll_max_step$1024"]]]], "r": [[7.86806e-05, 7.86795e-05, 7.87131e-05, 7.86906e-05], 0, 3.05176, 1656324112], "v": "v0.6"}
{"i": [["[\"3458e75493bb4bb042e539b5ff4818fb\", [4, 512], [1024, 512], [1, 1024], [4, 1024]]", "cuda -keys=cuda,gpu -arch=sm_80 -max_num_threads=1024 -thread_warp_size=32", [-1, 16, 64, 49152, 2147483647, 1024, 8, 32], "", 0, []], [[], [["SP", 2, 0, 4, [4, 1, 1, 1], 1], ["SP", 2, 5, 1024, [1, 16, 1, 32], 1], ["SP", 2, 10, 512, [1, 4], 1], ["RE", 2, [0, 5, 1, 6, 2, 7, 10, 11, 3, 8, 12, 4, 9]], ["FSP", 4, 0, 0, 3], ["FSP", 4, 4, 1, 3], ["RE", 4, [0, 4, 1, 5, 2, 6, 3, 7]], ["CA", 2, 4, 5], ["CHR", 1, "shared", [2]], ["CA", 2, 3, 6], ["CHR", 0, "shared", [3]], ["CA", 1, 4, 6], ["FU", 6, [0, 1]], ["AN", 6, 0, 5], ["FU", 6, [1, 2]], ["AN", 6, 1, 4], ["FU", 6, [2, 3]], ["AN", 6, 2, 6], ["FU", 3, [0, 1]], ["SP", 3, 0, 64, [1], 1], ["AN", 3, 1, 2], ["FFSP", 3, 0, [1, 0], 1, 1], ["AN", 3, 1, 6], ["FU", 1, [0, 1]], ["SP", 1, 0, 4, [1], 1], ["AN", 1, 1, 2], ["FFSP", 1, 0, [1, 0], 1, 1], ["AN", 1, 1, 6], ["PR", 4, 0, "auto_unroll_max_step$0"]]]], "r": [[0.000388739, 0.000388752, 0.00038875, 0.000388749], 0, 3.16384, 1656324114], "v": "v0.6"}
{"i": [["[\"3458e75493bb4bb042e539b5ff4818fb\", [4, 512], [1024, 512], [1, 1024], [4, 1024]]", "cuda -keys=cuda,gpu -arch=sm_80 -max_num_threads=1024 -thread_warp_size=32", [-1, 16, 64, 49152, 2147483647, 1024, 8, 32], "", 0, []], [[], [["SP", 2, 0, 4, [1, 2, 2, 1], 1], ["SP", 2, 5, 1024, [2, 64, 2, 4], 1], ["SP", 2, 10, 512, [4, 2], 1], ["RE", 2, [0, 5, 1, 6, 2, 7, 10, 11, 3, 8, 12, 4, 9]], ["FSP", 4, 0, 0, 3], ["FSP", 4, 4, 1, 3], ["RE", 4, [0, 4, 1, 5, 2, 6, 3, 7]], ["CA", 2, 4, 5], ["CHR", 1, "shared", [2]], ["CA", 2, 3, 6], ["CHR", 0, "shared", [3]], ["CA", 1, 4, 6], ["FU", 6, [0, 1]], ["AN", 6, 0, 5], ["FU", 6, [1, 2]], ["AN", 6, 1, 4], ["FU", 6, [2, 3]], ["AN", 6, 2, 6], ["FU", 3, [0, 1]], ["SP", 3, 0, 1024, [1], 1], ["AN", 3, 1, 2], ["FFSP", 3, 0, [1, 0], 1, 1], ["AN", 3, 1, 6], ["FU", 1, [0, 1]], ["SP", 1, 0, 8, [1], 1], ["AN", 1, 1, 2], ["FFSP", 1, 0, [1, 0], 1, 1], ["AN", 1, 1, 6], ["PR", 4, 0, "auto_unroll_max_step$512"]]]], "r": [[0.000287071, 0.00028707, 0.000287062, 0.000287048], 0, 3.2935, 1656324117], "v": "v0.6"}
{"i": [["[\"3458e75493bb4bb042e539b5ff4818fb\", [4, 512], [1024, 512], [1, 1024], [4, 1024]]", "cuda -keys=cuda,gpu -arch=sm_80 -max_num_threads=1024 -thread_warp_size=32", [-1, 16, 64, 49152, 2147483647, 1024, 8, 32], "", 0, []], [[], [["SP", 2, 0, 4, [2, 2, 1, 1], 1], ["SP", 2, 5, 1024, [4, 8, 8, 2], 1], ["SP", 2, 10, 512, [1, 2], 1], ["RE", 2, [0, 5, 1, 6, 2, 7, 10, 11, 3, 8, 12, 4, 9]], ["FSP", 4, 0, 0, 3], ["FSP", 4, 4, 1, 3], ["RE", 4, [0, 4, 1, 5, 2, 6, 3, 7]], ["CA", 2, 4, 5], ["CHR", 1, "shared", [2]], ["CA", 2, 3, 6], ["CHR", 0, "shared", [3]], ["CA", 1, 4, 6], ["FU", 6, [0, 1]], ["AN", 6, 0, 5], ["FU", 6, [1, 2]], ["AN", 6, 1, 4], ["FU", 6, [2, 3]], ["AN", 6, 2, 6], ["FU", 3, [0, 1]], ["SP", 3, 0, 64, [1], 1], ["AN", 3, 1, 2], ["FFSP", 3, 0, [1, 0], 1, 1], ["AN", 3, 1, 6], ["FU", 1, [0, 1]], ["SP", 1, 0, 4, [1], 1], ["AN", 1, 1, 2], ["FFSP", 1, 0, [1, 0], 1, 1], ["AN", 1, 1, 6], ["PR", 4, 0, "auto_unroll_max_step$512"]]]], "r": [[0.000449726, 0.000449733, 0.000449731, 0.000449734], 0, 3.4767, 1656324120], "v": "v0.6"}
{"i": [["[\"3458e75493bb4bb042e539b5ff4818fb\", [4, 512], [1024, 512], [1, 1024], [4, 1024]]", "cuda -keys=cuda,gpu -arch=sm_80 -max_num_threads=1024 -thread_warp_size=32", [-1, 16, 64, 49152, 2147483647, 1024, 8, 32], "", 0, []], [[], [["SP", 2, 0, 4, [1, 4, 1, 1], 1], ["SP", 2, 5, 1024, [2, 64, 1, 8], 1], ["SP", 2, 10, 512, [4, 2], 1], ["RE", 2, [0, 5, 1, 6, 2, 7, 10, 11, 3, 8, 12, 4, 9]], ["FSP", 4, 0, 0, 3], ["FSP", 4, 4, 1, 3], ["RE", 4, [0, 4, 1, 5, 2, 6, 3, 7]], ["CA", 2, 4, 5], ["CHR", 1, "shared", [2]], ["CA", 2, 3, 6], ["CHR", 0, "shared", [3]], ["CA", 1, 4, 6], ["FU", 6, [0, 1]], ["AN", 6, 0, 5], ["FU", 6, [1, 2]], ["AN", 6, 1, 4], ["FU", 6, [2, 3]], ["AN", 6, 2, 6], ["FU", 3, [0, 1]], ["SP", 3, 0, 64, [1], 1], ["AN", 3, 1, 2], ["FFSP", 3, 0, [1, 0], 1, 1], ["AN", 3, 1, 6], ["FU", 1, [0, 1]], ["SP", 1, 0, 8, [1], 1], ["AN", 1, 1, 2], ["FFSP", 1, 0, [1, 0], 1, 1], ["AN", 1, 1, 6], ["PR", 4, 0, "auto_unroll_max_step$512"]]]], "r": [[0.00046493, 0.000464927, 0.000464911, 0.000464933], 0, 3.14424, 1656324123], "v": "v0.6"}
{"i": [["[\"3458e75493bb4bb042e539b5ff4818fb\", [4, 512], [1024, 512], [1, 1024], [4, 1024]]", "cuda -keys=cuda,gpu -arch=sm_80 -max_num_threads=1024 -thread_warp_size=32", [-1, 16, 64, 49152, 2147483647, 1024, 8, 32], "", 0, []], [[], [["SP", 2, 0, 4, [1, 2, 1, 2], 1], ["SP", 2, 5, 1024, [1, 32, 32, 1], 1], ["SP", 2, 10, 512, [1, 8], 1], ["RE", 2, [0, 5, 1, 6, 2, 7, 10, 11, 3, 8, 12, 4, 9]], ["FSP", 4, 0, 0, 3], ["FSP", 4, 4, 1, 3], ["RE", 4, [0, 4, 1, 5, 2, 6, 3, 7]], ["CA", 2, 4, 5], ["CHR", 1, "shared", [2]], ["CA", 2, 3, 6], ["CHR", 0, "shared", [3]], ["CA", 1, 4, 6], ["FU", 6, [0, 1]], ["AN", 6, 0, 5], ["FU", 6, [1, 2]], ["AN", 6, 1, 4], ["FU", 6, [2, 3]], ["AN", 6, 2, 6], ["FU", 3, [0, 1]], ["SP", 3, 0, 256, [1], 1], ["AN", 3, 1, 2], ["FFSP", 3, 0, [1, 0], 1, 1], ["AN", 3, 1, 6], ["FU", 1, [0, 1]], ["SP", 1, 0, 16, [1], 1], ["AN", 1, 1, 2], ["FFSP", 1, 0, [1, 0], 1, 1], ["AN", 1, 1, 6], ["PR", 4, 0, "auto_unroll_max_step$1024"]]]], "r": [[0.000293552, 0.00029356, 0.000293553, 0.000293556], 0, 3.74911, 1656324125], "v": "v0.6"}
{"i": [["[\"3458e75493bb4bb042e539b5ff4818fb\", [4, 512], [1024, 512], [1, 1024], [4, 1024]]", "cuda -keys=cuda,gpu -arch=sm_80 -max_num_threads=1024 -thread_warp_size=32", [-1, 16, 64, 49152, 2147483647, 1024, 8, 32], "", 0, []], [[], [["SP", 2, 0, 4, [1, 1, 4, 1], 1], ["SP", 2, 5, 1024, [1, 16, 1, 1], 1], ["SP", 2, 10, 512, [2, 4], 1], ["RE", 2, [0, 5, 1, 6, 2, 7, 10, 11, 3, 8, 12, 4, 9]], ["FSP", 4, 0, 0, 3], ["FSP", 4, 4, 1, 3], ["RE", 4, [0, 4, 1, 5, 2, 6, 3, 7]], ["CA", 2, 4, 5], ["CHR", 1, "shared", [2]], ["CA", 2, 3, 6], ["CHR", 0, "shared", [3]], ["CA", 1, 4, 6], ["FU", 6, [0, 1]], ["AN", 6, 0, 5], ["FU", 6, [1, 2]], ["AN", 6, 1, 4], ["FU", 6, [2, 3]], ["AN", 6, 2, 6], ["FU", 3, [0, 1]], ["SP", 3, 0, 32, [1], 1], ["AN", 3, 1, 2], ["FFSP", 3, 0, [1, 0], 1, 1], ["AN", 3, 1, 6], ["FU", 1, [0, 1]], ["SP", 1, 0, 32, [1], 1], ["AN", 1, 1, 2], ["FFSP", 1, 0, [1, 0], 1, 1], ["AN", 1, 1, 6], ["PR", 4, 0, "auto_unroll_max_step$512"]]]], "r": [[2.29952e-05, 2.29936e-05, 2.29947e-05, 2.29964e-05], 0, 2.83113, 1656324128], "v": "v0.6"}
{"i": [["[\"3458e75493bb4bb042e539b5ff4818fb\", [4, 512], [1024, 512], [1, 1024], [4, 1024]]", "cuda -keys=cuda,gpu -arch=sm_80 -max_num_threads=1024 -thread_warp_size=32", [-1, 16, 64, 49152, 2147483647, 1024, 8, 32], "", 0, []], [[], [["SP", 2, 0, 4, [1, 1, 1, 2], 1], ["SP", 2, 5, 1024, [1, 128, 1, 1], 1], ["SP", 2, 10, 512, [1, 4], 1], ["RE", 2, [0, 5, 1, 6, 2, 7, 10, 11, 3, 8, 12, 4, 9]], ["FSP", 4, 0, 0, 3], ["FSP", 4, 4, 1, 3], ["RE", 4, [0, 4, 1, 5, 2, 6, 3, 7]], ["CA", 2, 4, 5], ["CHR", 1, "shared", [2]], ["CA", 2, 3, 6], ["CHR", 0, "shared", [3]], ["CA", 1, 4, 6], ["FU", 6, [0, 1]], ["AN", 6, 0, 5], ["FU", 6, [1, 2]], ["AN", 6, 1, 4], ["FU", 6, [2, 3]], ["AN", 6, 2, 6], ["FU", 3, [0, 1]], ["SP", 3, 0, 4, [4], 1], ["AN", 3, 1, 2], ["FFSP", 3, 0, [1, 0], 1, 1], ["AN", 3, 1, 6], ["FU", 1, [0, 1]], ["SP", 1, 0, 8, [1], 1], ["AN", 1, 1, 2], ["FFSP", 1, 0, [1, 0], 1, 1], ["AN", 1, 1, 6], ["PR", 4, 0, "auto_unroll_max_step$512"]]]], "r": [[3.24674e-05, 3.24949e-05, 3.24743e-05, 3.24918e-05], 0, 2.99713, 1656324133], "v": "v0.6"}
{"i": [["[\"3458e75493bb4bb042e539b5ff4818fb\", [4, 512], [1024, 512], [1, 1024], [4, 1024]]", "cuda -keys=cuda,gpu -arch=sm_80 -max_num_threads=1024 -thread_warp_size=32", [-1, 16, 64, 49152, 2147483647, 1024, 8, 32], "", 0, []], [[], [["SP", 2, 0, 4, [1, 2, 2, 1], 1], ["SP", 2, 5, 1024, [8, 16, 2, 2], 1], ["SP", 2, 10, 512, [8, 1], 1], ["RE", 2, [0, 5, 1, 6, 2, 7, 10, 11, 3, 8, 12, 4, 9]], ["FSP", 4, 0, 0, 3], ["FSP", 4, 4, 1, 3], ["RE", 4, [0, 4, 1, 5, 2, 6, 3, 7]], ["CA", 2, 4, 5], ["CHR", 1, "shared", [2]], ["CA", 2, 3, 6], ["CHR", 0, "shared", [3]], ["CA", 1, 4, 6], ["FU", 6, [0, 1]], ["AN", 6, 0, 5], ["FU", 6, [1, 2]], ["AN", 6, 1, 4], ["FU", 6, [2, 3]], ["AN", 6, 2, 6], ["FU", 3, [0, 1]], ["SP", 3, 0, 16, [1], 1], ["AN", 3, 1, 2], ["FFSP", 3, 0, [1, 0], 1, 1], ["AN", 3, 1, 6], ["FU", 1, [0, 1]], ["SP", 1, 0, 8, [1], 1], ["AN", 1, 1, 2], ["FFSP", 1, 0, [1, 0], 1, 1], ["AN", 1, 1, 6], ["PR", 4, 0, "auto_unroll_max_step$16"]]]], "r": [[0.000501927, 0.000501939, 0.000501898, 0.000501927], 0, 3.41189, 1656324136], "v": "v0.6"}
{"i": [["[\"3458e75493bb4bb042e539b5ff4818fb\", [4, 512], [1024, 512], [1, 1024], [4, 1024]]", "cuda -keys=cuda,gpu -arch=sm_80 -max_num_threads=1024 -thread_warp_size=32", [-1, 16, 64, 49152, 2147483647, 1024, 8, 32], "", 0, []], [[], [["SP", 2, 0, 4, [1, 2, 1, 2], 1], ["SP", 2, 5, 1024, [1, 256, 1, 4], 1], ["SP", 2, 10, 512, [1, 2], 1], ["RE", 2, [0, 5, 1, 6, 2, 7, 10, 11, 3, 8, 12, 4, 9]], ["FSP", 4, 0, 0, 3], ["FSP", 4, 4, 1, 3], ["RE", 4, [0, 4, 1, 5, 2, 6, 3, 7]], ["CA", 2, 4, 5], ["CHR", 1, "shared", [2]], ["CA", 2, 3, 6], ["CHR", 0, "shared", [3]], ["CA", 1, 4, 6], ["FU", 6, [0, 1]], ["AN", 6, 0, 5], ["FU", 6, [1, 2]], ["AN", 6, 1, 4], ["FU", 6, [2, 3]], ["AN", 6, 2, 6], ["FU", 3, [0, 1]], ["SP", 3, 0, 8, [4], 1], ["AN", 3, 1, 2], ["FFSP", 3, 0, [1, 0], 1, 1], ["AN", 3, 1, 6], ["FU", 1, [0, 1]], ["SP", 1, 0, 4, [1], 1], ["AN", 1, 1, 2], ["FFSP", 1, 0, [1, 0], 1, 1], ["AN", 1, 1, 6], ["PR", 4, 0, "auto_unroll_max_step$1024"]]]], "r": [[0.000487538, 0.000487544, 0.000487533, 0.000487538], 0, 3.18103, 1656324138], "v": "v0.6"}
{"i": [["[\"3458e75493bb4bb042e539b5ff4818fb\", [4, 512], [1024, 512], [1, 1024], [4, 1024]]", "cuda -keys=cuda,gpu -arch=sm_80 -max_num_threads=1024 -thread_warp_size=32", [-1, 16, 64, 49152, 2147483647, 1024, 8, 32], "", 0, []], [[], [["SP", 2, 0, 4, [1, 4, 1, 1], 1], ["SP", 2, 5, 1024, [1, 256, 1, 4], 1], ["SP", 2, 10, 512, [1, 2], 1], ["RE", 2, [0, 5, 1, 6, 2, 7, 10, 11, 3, 8, 12, 4, 9]], ["FSP", 4, 0, 0, 3], ["FSP", 4, 4, 1, 3], ["RE", 4, [0, 4, 1, 5, 2, 6, 3, 7]], ["CA", 2, 4, 5], ["CHR", 1, "shared", [2]], ["CA", 2, 3, 6], ["CHR", 0, "shared", [3]], ["CA", 1, 4, 6], ["FU", 6, [0, 1]], ["AN", 6, 0, 5], ["FU", 6, [1, 2]], ["AN", 6, 1, 4], ["FU", 6, [2, 3]], ["AN", 6, 2, 6], ["FU", 3, [0, 1]], ["SP", 3, 0, 8, [2], 1], ["AN", 3, 1, 2], ["FFSP", 3, 0, [1, 0], 1, 1], ["AN", 3, 1, 6], ["FU", 1, [0, 1]], ["SP", 1, 0, 4, [1], 1], ["AN", 1, 1, 2], ["FFSP", 1, 0, [1, 0], 1, 1], ["AN", 1, 1, 6], ["PR", 4, 0, "auto_unroll_max_step$0"]]]], "r": [[0.000327776, 0.000327784, 0.000327781, 0.00032779], 0, 3.12052, 1656324141], "v": "v0.6"}
{"i": [["[\"3458e75493bb4bb042e539b5ff4818fb\", [4, 512], [1024, 512], [1, 1024], [4, 1024]]", "cuda -keys=cuda,gpu -arch=sm_80 -max_num_threads=1024 -thread_warp_size=32", [-1, 16, 64, 49152, 2147483647, 1024, 8, 32], "", 0, []], [[], [["SP", 2, 0, 4, [1, 2, 2, 1], 1], ["SP", 2, 5, 1024, [1, 128, 8, 1], 1], ["SP", 2, 10, 512, [4, 1], 1], ["RE", 2, [0, 5, 1, 6, 2, 7, 10, 11, 3, 8, 12, 4, 9]], ["FSP", 4, 0, 0, 3], ["FSP", 4, 4, 1, 3], ["RE", 4, [0, 4, 1, 5, 2, 6, 3, 7]], ["CA", 2, 4, 5], ["CHR", 1, "shared", [2]], ["CA", 2, 3, 6], ["CHR", 0, "shared", [3]], ["CA", 1, 4, 6], ["FU", 6, [0, 1]], ["AN", 6, 0, 5], ["FU", 6, [1, 2]], ["AN", 6, 1, 4], ["FU", 6, [2, 3]], ["AN", 6, 2, 6], ["FU", 3, [0, 1]], ["SP", 3, 0, 128, [2], 1], ["AN", 3, 1, 2], ["FFSP", 3, 0, [1, 0], 1, 1], ["AN", 3, 1, 6], ["FU", 1, [0, 1]], ["SP", 1, 0, 8, [1], 1], ["AN", 1, 1, 2], ["FFSP", 1, 0, [1, 0], 1, 1], ["AN", 1, 1, 6], ["PR", 4, 0, "auto_unroll_max_step$64"]]]], "r": [[0.000335464, 0.000335478, 0.000335471, 0.000335476], 0, 3.16397, 1656324144], "v": "v0.6"}
{"i": [["[\"3458e75493bb4bb042e539b5ff4818fb\", [4, 512], [1024, 512], [1, 1024], [4, 1024]]", "cuda -keys=cuda,gpu -arch=sm_80 -max_num_threads=1024 -thread_warp_size=32", [-1, 16, 64, 49152, 2147483647, 1024, 8, 32], "", 0, []], [[], [["SP", 2, 0, 4, [1, 1, 1, 1], 1], ["SP", 2, 5, 1024, [2, 64, 1, 4], 1], ["SP", 2, 10, 512, [1, 16], 1], ["RE", 2, [0, 5, 1, 6, 2, 7, 10, 11, 3, 8, 12, 4, 9]], ["FSP", 4, 0, 0, 3], ["FSP", 4, 4, 1, 3], ["RE", 4, [0, 4, 1, 5, 2, 6, 3, 7]], ["CA", 2, 4, 5], ["CHR", 1, "shared", [2]], ["CA", 2, 3, 6], ["CHR", 0, "shared", [3]], ["CA", 1, 4, 6], ["FU", 6, [0, 1]], ["AN", 6, 0, 5], ["FU", 6, [1, 2]], ["AN", 6, 1, 4], ["FU", 6, [2, 3]], ["AN", 6, 2, 6], ["FU", 3, [0, 1]], ["SP", 3, 0, 64, [1], 1], ["AN", 3, 1, 2], ["FFSP", 3, 0, [1, 0], 1, 1], ["AN", 3, 1, 6], ["FU", 1, [0, 1]], ["SP", 1, 0, 64, [1], 1], ["AN", 1, 1, 2], ["FFSP", 1, 0, [1, 0], 1, 1], ["AN", 1, 1, 6], ["PR", 4, 0, "auto_unroll_max_step$1024"]]]], "r": [[8.27132e-05, 8.2714e-05, 8.27099e-05, 8.26953e-05], 0, 3.38934, 1656324146], "v": "v0.6"}
{"i": [["[\"3458e75493bb4bb042e539b5ff4818fb\", [4, 512], [1024, 512], [1, 1024], [4, 1024]]", "cuda -keys=cuda,gpu -arch=sm_80 -max_num_threads=1024 -thread_warp_size=32", [-1, 16, 64, 49152, 2147483647, 1024, 8, 32], "", 0, []], [[], [["SP", 2, 0, 4, [1, 2, 2, 1], 1], ["SP", 2, 5, 1024, [1, 128, 1, 2], 1], ["SP", 2, 10, 512, [32, 1], 1], ["RE", 2, [0, 5, 1, 6, 2, 7, 10, 11, 3, 8, 12, 4, 9]], ["FSP", 4, 0, 0, 3], ["FSP", 4, 4, 1, 3], ["RE", 4, [0, 4, 1, 5, 2, 6, 3, 7]], ["CA", 2, 4, 5], ["CHR", 1, "shared", [2]], ["CA", 2, 3, 6], ["CHR", 0, "shared", [3]], ["CA", 1, 4, 6], ["FU", 6, [0, 1]], ["AN", 6, 0, 5], ["FU", 6, [1, 2]], ["AN", 6, 1, 4], ["FU", 6, [2, 3]], ["AN", 6, 2, 6], ["FU", 3, [0, 1]], ["SP", 3, 0, 128, [1], 1], ["AN", 3, 1, 2], ["FFSP", 3, 0, [1, 0], 1, 1], ["AN", 3, 1, 6], ["FU", 1, [0, 1]], ["SP", 1, 0, 64, [1], 1], ["AN", 1, 1, 2], ["FFSP", 1, 0, [1, 0], 1, 1], ["AN", 1, 1, 6], ["PR", 4, 0, "auto_unroll_max_step$512"]]]], "r": [[6.45815e-05, 6.45708e-05, 6.4566e-05, 6.45931e-05], 0, 3.14693, 1656324149], "v": "v0.6"}
{"i": [["[\"3458e75493bb4bb042e539b5ff4818fb\", [4, 512], [1024, 512], [1, 1024], [4, 1024]]", "cuda -keys=cuda,gpu -arch=sm_80 -max_num_threads=1024 -thread_warp_size=32", [-1, 16, 64, 49152, 2147483647, 1024, 8, 32], "", 0, []], [[], [["SP", 2, 0, 4, [1, 4, 1, 1], 1], ["SP", 2, 5, 1024, [4, 16, 1, 1], 1], ["SP", 2, 10, 512, [1, 16], 1], ["RE", 2, [0, 5, 1, 6, 2, 7, 10, 11, 3, 8, 12, 4, 9]], ["FSP", 4, 0, 0, 3], ["FSP", 4, 4, 1, 3], ["RE", 4, [0, 4, 1, 5, 2, 6, 3, 7]], ["CA", 2, 4, 5], ["CHR", 1, "shared", [2]], ["CA", 2, 3, 6], ["CHR", 0, "shared", [3]], ["CA", 1, 4, 6], ["FU", 6, [0, 1]], ["AN", 6, 0, 5], ["FU", 6, [1, 2]], ["AN", 6, 1, 4], ["FU", 6, [2, 3]], ["AN", 6, 2, 6], ["FU", 3, [0, 1]], ["SP", 3, 0, 16, [1], 1], ["AN", 3, 1, 2], ["FFSP", 3, 0, [1, 0], 1, 1], ["AN", 3, 1, 6], ["FU", 1, [0, 1]], ["SP", 1, 0, 4, [1], 1], ["AN", 1, 1, 2], ["FFSP", 1, 0, [1, 0], 1, 1], ["AN", 1, 1, 6], ["PR", 4, 0, "auto_unroll_max_step$0"]]]], "r": [[2.53275e-05, 2.53149e-05, 2.53003e-05, 2.53206e-05], 0, 2.97911, 1656324152], "v": "v0.6"}
{"i": [["[\"3458e75493bb4bb042e539b5ff4818fb\", [4, 512], [1024, 512], [1, 1024], [4, 1024]]", "cuda -keys=cuda,gpu -arch=sm_80 -max_num_threads=1024 -thread_warp_size=32", [-1, 16, 64, 49152, 2147483647, 1024, 8, 32], "", 0, []], [[], [["SP", 2, 0, 4, [2, 1, 2, 1], 1], ["SP", 2, 5, 1024, [2, 512, 1, 1], 1], ["SP", 2, 10, 512, [1, 2], 1], ["RE", 2, [0, 5, 1, 6, 2, 7, 10, 11, 3, 8, 12, 4, 9]], ["FSP", 4, 0, 0, 3], ["FSP", 4, 4, 1, 3], ["RE", 4, [0, 4, 1, 5, 2, 6, 3, 7]], ["CA", 2, 4, 5], ["CHR", 1, "shared", [2]], ["CA", 2, 3, 6], ["CHR", 0, "shared", [3]], ["CA", 1, 4, 6], ["FU", 6, [0, 1]], ["AN", 6, 0, 5], ["FU", 6, [1, 2]], ["AN", 6, 1, 4], ["FU", 6, [2, 3]], ["AN", 6, 2, 6], ["FU", 3, [0, 1]], ["SP", 3, 0, 2, [1], 1], ["AN", 3, 1, 2], ["FFSP", 3, 0, [1, 0], 1, 1], ["AN", 3, 1, 6], ["FU", 1, [0, 1]], ["SP", 1, 0, 2, [1], 1], ["AN", 1, 1, 2], ["FFSP", 1, 0, [1, 0], 1, 1], ["AN", 1, 1, 6], ["PR", 4, 0, "auto_unroll_max_step$0"]]]], "r": [[0.000295568, 0.00029557, 0.000295579, 0.000295587], 0, 2.98038, 1656324154], "v": "v0.6"}
{"i": [["[\"3458e75493bb4bb042e539b5ff4818fb\", [4, 512], [1024, 512], [1, 1024], [4, 1024]]", "cuda -keys=cuda,gpu -arch=sm_80 -max_num_threads=1024 -thread_warp_size=32", [-1, 16, 64, 49152, 2147483647, 1024, 8, 32], "", 0, []], [[], [["SP", 2, 0, 4, [1, 1, 4, 1], 1], ["SP", 2, 5, 1024, [2, 64, 1, 2], 1], ["SP", 2, 10, 512, [2, 2], 1], ["RE", 2, [0, 5, 1, 6, 2, 7, 10, 11, 3, 8, 12, 4, 9]], ["FSP", 4, 0, 0, 3], ["FSP", 4, 4, 1, 3], ["RE", 4, [0, 4, 1, 5, 2, 6, 3, 7]], ["CA", 2, 4, 5], ["CHR", 1, "shared", [2]], ["CA", 2, 3, 6], ["CHR", 0, "shared", [3]], ["CA", 1, 4, 6], ["FU", 6, [0, 1]], ["AN", 6, 0, 5], ["FU", 6, [1, 2]], ["AN", 6, 1, 4], ["FU", 6, [2, 3]], ["AN", 6, 2, 6], ["FU", 3, [0, 1]], ["SP", 3, 0, 8, [4], 1], ["AN", 3, 1, 2], ["FFSP", 3, 0, [1, 0], 1, 1], ["AN", 3, 1, 6], ["FU", 1, [0, 1]], ["SP", 1, 0, 16, [4], 1], ["AN", 1, 1, 2], ["FFSP", 1, 0, [1, 0], 1, 1], ["AN", 1, 1, 6], ["PR", 4, 0, "auto_unroll_max_step$0"]]]], "r": [[7.03352e-05, 7.03368e-05, 7.03411e-05, 7.03414e-05], 0, 3.00913, 1656324157], "v": "v0.6"}
{"i": [["[\"3458e75493bb4bb042e539b5ff4818fb\", [4, 512], [1024, 512], [1, 1024], [4, 1024]]", "cuda -keys=cuda,gpu -arch=sm_80 -max_num_threads=1024 -thread_warp_size=32", [-1, 16, 64, 49152, 2147483647, 1024, 8, 32], "", 0, []], [[], [["SP", 2, 0, 4, [1, 1, 2, 2], 1], ["SP", 2, 5, 1024, [4, 64, 1, 4], 1], ["SP", 2, 10, 512, [2, 1], 1], ["RE", 2, [0, 5, 1, 6, 2, 7, 10, 11, 3, 8, 12, 4, 9]], ["FSP", 4, 0, 0, 3], ["FSP", 4, 4, 1, 3], ["RE", 4, [0, 4, 1, 5, 2, 6, 3, 7]], ["CA", 2, 4, 5], ["CHR", 1, "shared", [2]], ["CA", 2, 3, 6], ["CHR", 0, "shared", [3]], ["CA", 1, 4, 6], ["FU", 6, [0, 1]], ["AN", 6, 0, 5], ["FU", 6, [1, 2]], ["AN", 6, 1, 4], ["FU", 6, [2, 3]], ["AN", 6, 2, 6], ["FU", 3, [0, 1]], ["SP", 3, 0, 8, [1], 1], ["AN", 3, 1, 2], ["FFSP", 3, 0, [1, 0], 1, 1], ["AN", 3, 1, 6], ["FU", 1, [0, 1]], ["SP", 1, 0, 8, [1], 1], ["AN", 1, 1, 2], ["FFSP", 1, 0, [1, 0], 1, 1], ["AN", 1, 1, 6], ["PR", 4, 0, "auto_unroll_max_step$512"]]]], "r": [[0.000354895, 0.0003549, 0.0003549, 0.000354899], 0, 3.23453, 1656324159], "v": "v0.6"}
{"i": [["[\"3458e75493bb4bb042e539b5ff4818fb\", [4, 512], [1024, 512], [1, 1024], [4, 1024]]", "cuda -keys=cuda,gpu -arch=sm_80 -max_num_threads=1024 -thread_warp_size=32", [-1, 16, 64, 49152, 2147483647, 1024, 8, 32], "", 0, []], [[], [["SP", 2, 0, 4, [1, 1, 4, 1], 1], ["SP", 2, 5, 1024, [4, 32, 8, 1], 1], ["SP", 2, 10, 512, [1, 4], 1], ["RE", 2, [0, 5, 1, 6, 2, 7, 10, 11, 3, 8, 12, 4, 9]], ["FSP", 4, 0, 0, 3], ["FSP", 4, 4, 1, 3], ["RE", 4, [0, 4, 1, 5, 2, 6, 3, 7]], ["CA", 2, 4, 5], ["CHR", 1, "shared", [2]], ["CA", 2, 3, 6], ["CHR", 0, "shared", [3]], ["CA", 1, 4, 6], ["FU", 6, [0, 1]], ["AN", 6, 0, 5], ["FU", 6, [1, 2]], ["AN", 6, 1, 4], ["FU", 6, [2, 3]], ["AN", 6, 2, 6], ["FU", 3, [0, 1]], ["SP", 3, 0, 32, [2], 1], ["AN", 3, 1, 2], ["FFSP", 3, 0, [1, 0], 1, 1], ["AN", 3, 1, 6], ["FU", 1, [0, 1]], ["SP", 1, 0, 8, [1], 1], ["AN", 1, 1, 2], ["FFSP", 1, 0, [1, 0], 1, 1], ["AN", 1, 1, 6], ["PR", 4, 0, "auto_unroll_max_step$0"]]]], "r": [[0.000488018, 0.000488019, 0.000488014, 0.000488015], 0, 3.31642, 1656324162], "v": "v0.6"}
{"i": [["[\"3458e75493bb4bb042e539b5ff4818fb\", [4, 512], [1024, 512], [1, 1024], [4, 1024]]", "cuda -keys=cuda,gpu -arch=sm_80 -max_num_threads=1024 -thread_warp_size=32", [-1, 16, 64, 49152, 2147483647, 1024, 8, 32], "", 0, []], [[], [["SP", 2, 0, 4, [1, 4, 1, 1], 1], ["SP", 2, 5, 1024, [1, 16, 8, 2], 1], ["SP", 2, 10, 512, [8, 1], 1], ["RE", 2, [0, 5, 1, 6, 2, 7, 10, 11, 3, 8, 12, 4, 9]], ["FSP", 4, 0, 0, 3], ["FSP", 4, 4, 1, 3], ["RE", 4, [0, 4, 1, 5, 2, 6, 3, 7]], ["CA", 2, 4, 5], ["CHR", 1, "shared", [2]], ["CA", 2, 3, 6], ["CHR", 0, "shared", [3]], ["CA", 1, 4, 6], ["FU", 6, [0, 1]], ["AN", 6, 0, 5], ["FU", 6, [1, 2]], ["AN", 6, 1, 4], ["FU", 6, [2, 3]], ["AN", 6, 2, 6], ["FU", 3, [0, 1]], ["SP", 3, 0, 128, [2], 1], ["AN", 3, 1, 2], ["FFSP", 3, 0, [1, 0], 1, 1], ["AN", 3, 1, 6], ["FU", 1, [0, 1]], ["SP", 1, 0, 8, [1], 1], ["AN", 1, 1, 2], ["FFSP", 1, 0, [1, 0], 1, 1], ["AN", 1, 1, 6], ["PR", 4, 0, "auto_unroll_max_step$64"]]]], "r": [[0.000238531, 0.000238544, 0.00023854, 0.000238534], 0, 3.00483, 1656324165], "v": "v0.6"}
