.cache/log/kernel_tune/NVIDIA_A100_80GB_PCIe/LinearBias_forward_input_0_8_1024_output_0_8_512_in_features_1024_out_features_512.json
{"i": [["[\"3458e75493bb4bb042e539b5ff4818fb\", [8, 1024], [512, 1024], [1, 512], [8, 512]]", "cuda -keys=cuda,gpu -arch=sm_80 -max_num_threads=1024 -thread_warp_size=32", [-1, 16, 64, 49152, 2147483647, 1024, 8, 32], "", 0, []], [[], [["SP", 2, 0, 8, [1, 2, 2, 1], 1], ["SP", 2, 5, 512, [1, 64, 8, 1], 1], ["SP", 2, 10, 1024, [4, 2], 1], ["RE", 2, [0, 5, 1, 6, 2, 7, 10, 11, 3, 8, 12, 4, 9]], ["FSP", 4, 0, 0, 3], ["FSP", 4, 4, 1, 3], ["RE", 4, [0, 4, 1, 5, 2, 6, 3, 7]], ["CA", 2, 4, 5], ["CHR", 1, "shared", [2]], ["CA", 2, 3, 6], ["CHR", 0, "shared", [3]], ["CA", 1, 4, 6], ["FU", 6, [0, 1]], ["AN", 6, 0, 5], ["FU", 6, [1, 2]], ["AN", 6, 1, 4], ["FU", 6, [2, 3]], ["AN", 6, 2, 6], ["FU", 3, [0, 1]], ["SP", 3, 0, 64, [1], 1], ["AN", 3, 1, 2], ["FFSP", 3, 0, [1, 0], 1, 1], ["AN", 3, 1, 6], ["FU", 1, [0, 1]], ["SP", 1, 0, 32, [1], 1], ["AN", 1, 1, 2], ["FFSP", 1, 0, [1, 0], 1, 1], ["AN", 1, 1, 6], ["PR", 4, 0, "auto_unroll_max_step$512"]]]], "r": [[0.000303906, 0.000303869, 0.000303892, 0.000303976], 0, 3.43939, 1656398294], "v": "v0.6"}
{"i": [["[\"3458e75493bb4bb042e539b5ff4818fb\", [8, 1024], [512, 1024], [1, 512], [8, 512]]", "cuda -keys=cuda,gpu -arch=sm_80 -max_num_threads=1024 -thread_warp_size=32", [-1, 16, 64, 49152, 2147483647, 1024, 8, 32], "", 0, []], [[], [["SP", 2, 0, 8, [4, 1, 2, 1], 1], ["SP", 2, 5, 512, [2, 64, 4, 1], 1], ["SP", 2, 10, 1024, [1, 2], 1], ["RE", 2, [0, 5, 1, 6, 2, 7, 10, 11, 3, 8, 12, 4, 9]], ["FSP", 4, 0, 0, 3], ["FSP", 4, 4, 1, 3], ["RE", 4, [0, 4, 1, 5, 2, 6, 3, 7]], ["CA", 2, 4, 5], ["CHR", 1, "shared", [2]], ["CA", 2, 3, 6], ["CHR", 0, "shared", [3]], ["CA", 1, 4, 6], ["FU", 6, [0, 1]], ["AN", 6, 0, 5], ["FU", 6, [1, 2]], ["AN", 6, 1, 4], ["FU", 6, [2, 3]], ["AN", 6, 2, 6], ["FU", 3, [0, 1]], ["SP", 3, 0, 8, [1], 1], ["AN", 3, 1, 2], ["FFSP", 3, 0, [1, 0], 1, 1], ["AN", 3, 1, 6], ["FU", 1, [0, 1]], ["SP", 1, 0, 4, [2], 1], ["AN", 1, 1, 2], ["FFSP", 1, 0, [1, 0], 1, 1], ["AN", 1, 1, 6], ["PR", 4, 0, "auto_unroll_max_step$1024"]]]], "r": [[0.000513404, 0.000513402, 0.000513377, 0.000513368], 0, 3.57734, 1656398297], "v": "v0.6"}
{"i": [["[\"3458e75493bb4bb042e539b5ff4818fb\", [8, 1024], [512, 1024], [1, 512], [8, 512]]", "cuda -keys=cuda,gpu -arch=sm_80 -max_num_threads=1024 -thread_warp_size=32", [-1, 16, 64, 49152, 2147483647, 1024, 8, 32], "", 0, []], [[], [["SP", 2, 0, 8, [4, 1, 2, 1], 1], ["SP", 2, 5, 512, [1, 32, 1, 1], 1], ["SP", 2, 10, 1024, [16, 8], 1], ["RE", 2, [0, 5, 1, 6, 2, 7, 10, 11, 3, 8, 12, 4, 9]], ["FSP", 4, 0, 0, 3], ["FSP", 4, 4, 1, 3], ["RE", 4, [0, 4, 1, 5, 2, 6, 3, 7]], ["CA", 2, 4, 5], ["CHR", 1, "shared", [2]], ["CA", 2, 3, 6], ["CHR", 0, "shared", [3]], ["CA", 1, 4, 6], ["FU", 6, [0, 1]], ["AN", 6, 0, 5], ["FU", 6, [1, 2]], ["AN", 6, 1, 4], ["FU", 6, [2, 3]], ["AN", 6, 2, 6], ["FU", 3, [0, 1]], ["SP", 3, 0, 128, [1], 1], ["AN", 3, 1, 2], ["FFSP", 3, 0, [1, 0], 1, 1], ["AN", 3, 1, 6], ["FU", 1, [0, 1]], ["SP", 1, 0, 256, [1], 1], ["AN", 1, 1, 2], ["FFSP", 1, 0, [1, 0], 1, 1], ["AN", 1, 1, 6], ["PR", 4, 0, "auto_unroll_max_step$0"]]]], "r": [[4.26615e-05, 4.26607e-05, 4.26621e-05, 4.26632e-05], 0, 4.82288, 1656398300], "v": "v0.6"}
{"i": [["[\"3458e75493bb4bb042e539b5ff4818fb\", [8, 1024], [512, 1024], [1, 512], [8, 512]]", "cuda -keys=cuda,gpu -arch=sm_80 -max_num_threads=1024 -thread_warp_size=32", [-1, 16, 64, 49152, 2147483647, 1024, 8, 32], "", 0, []], [[], [["SP", 2, 0, 8, [1, 4, 2, 1], 1], ["SP", 2, 5, 512, [2, 16, 2, 1], 1], ["SP", 2, 10, 1024, [1, 64], 1], ["RE", 2, [0, 5, 1, 6, 2, 7, 10, 11, 3, 8, 12, 4, 9]], ["FSP", 4, 0, 0, 3], ["FSP", 4, 4, 1, 3], ["RE", 4, [0, 4, 1, 5, 2, 6, 3, 7]], ["CA", 2, 4, 5], ["CHR", 1, "shared", [2]], ["CA", 2, 3, 6], ["CHR", 0, "shared", [3]], ["CA", 1, 4, 6], ["FU", 6, [0, 1]], ["AN", 6, 0, 5], ["FU", 6, [1, 2]], ["AN", 6, 1, 4], ["FU", 6, [2, 3]], ["AN", 6, 2, 6], ["FU", 3, [0, 1]], ["SP", 3, 0, 256, [1], 1], ["AN", 3, 1, 2], ["FFSP", 3, 0, [1, 0], 1, 1], ["AN", 3, 1, 6], ["FU", 1, [0, 1]], ["SP", 1, 0, 128, [1], 1], ["AN", 1, 1, 2], ["FFSP", 1, 0, [1, 0], 1, 1], ["AN", 1, 1, 6], ["PR", 4, 0, "auto_unroll_max_step$64"]]]], "r": [[0.000113709, 0.00011371, 0.000113709, 0.000113708], 0, 3.53938, 1656398302], "v": "v0.6"}
{"i": [["[\"3458e75493bb4bb042e539b5ff4818fb\", [8, 1024], [512, 1024], [1, 512], [8, 512]]", "cuda -keys=cuda,gpu -arch=sm_80 -max_num_threads=1024 -thread_warp_size=32", [-1, 16, 64, 49152, 2147483647, 1024, 8, 32], "", 0, []], [[], [["SP", 2, 0, 8, [1, 1, 2, 2], 1], ["SP", 2, 5, 512, [1, 32, 4, 1], 1], ["SP", 2, 10, 1024, [16, 1], 1], ["RE", 2, [0, 5, 1, 6, 2, 7, 10, 11, 3, 8, 12, 4, 9]], ["FSP", 4, 0, 0, 3], ["FSP", 4, 4, 1, 3], ["RE", 4, [0, 4, 1, 5, 2, 6, 3, 7]], ["CA", 2, 4, 5], ["CHR", 1, "shared", [2]], ["CA", 2, 3, 6], ["CHR", 0, "shared", [3]], ["CA", 1, 4, 6], ["FU", 6, [0, 1]], ["AN", 6, 0, 5], ["FU", 6, [1, 2]], ["AN", 6, 1, 4], ["FU", 6, [2, 3]], ["AN", 6, 2, 6], ["FU", 3, [0, 1]], ["SP", 3, 0, 4, [2], 1], ["AN", 3, 1, 2], ["FFSP", 3, 0, [1, 0], 1, 1], ["AN", 3, 1, 6], ["FU", 1, [0, 1]], ["SP", 1, 0, 4, [2], 1], ["AN", 1, 1, 2], ["FFSP", 1, 0, [1, 0], 1, 1], ["AN", 1, 1, 6], ["PR", 4, 0, "auto_unroll_max_step$16"]]]], "r": [[9.78145e-05, 9.78324e-05, 9.78191e-05, 9.78495e-05], 0, 3.40391, 1656398305], "v": "v0.6"}
{"i": [["[\"3458e75493bb4bb042e539b5ff4818fb\", [8, 1024], [512, 1024], [1, 512], [8, 512]]", "cuda -keys=cuda,gpu -arch=sm_80 -max_num_threads=1024 -thread_warp_size=32", [-1, 16, 64, 49152, 2147483647, 1024, 8, 32], "", 0, []], [[], [["SP", 2, 0, 8, [1, 4, 1, 2], 1], ["SP", 2, 5, 512, [1, 64, 1, 2], 1], ["SP", 2, 10, 1024, [16, 4], 1], ["RE", 2, [0, 5, 1, 6, 2, 7, 10, 11, 3, 8, 12, 4, 9]], ["FSP", 4, 0, 0, 3], ["FSP", 4, 4, 1, 3], ["RE", 4, [0, 4, 1, 5, 2, 6, 3, 7]], ["CA", 2, 4, 5], ["CHR", 1, "shared", [2]], ["CA", 2, 3, 6], ["CHR", 0, "shared", [3]], ["CA", 1, 4, 6], ["FU", 6, [0, 1]], ["AN", 6, 0, 5], ["FU", 6, [1, 2]], ["AN", 6, 1, 4], ["FU", 6, [2, 3]], ["AN", 6, 2, 6], ["FU", 3, [0, 1]], ["SP", 3, 0, 64, [1], 1], ["AN", 3, 1, 2], ["FFSP", 3, 0, [1, 0], 1, 1], ["AN", 3, 1, 6], ["FU", 1, [0, 1]], ["SP", 1, 0, 128, [1], 1], ["AN", 1, 1, 2], ["FFSP", 1, 0, [1, 0], 1, 1], ["AN", 1, 1, 6], ["PR", 4, 0, "auto_unroll_max_step$0"]]]], "r": [[0.000114609, 0.000114604, 0.000114602, 0.000114606], 0, 3.33611, 1656398308], "v": "v0.6"}
{"i": [["[\"3458e75493bb4bb042e539b5ff4818fb\", [8, 1024], [512, 1024], [1, 512], [8, 512]]", "cuda -keys=cuda,gpu -arch=sm_80 -max_num_threads=1024 -thread_warp_size=32", [-1, 16, 64, 49152, 2147483647, 1024, 8, 32], "", 0, []], [[], [["SP", 2, 0, 8, [1, 2, 1, 4], 1], ["SP", 2, 5, 512, [1, 2, 1, 2], 1], ["SP", 2, 10, 1024, [8, 2], 1], ["RE", 2, [0, 5, 1, 6, 2, 7, 10, 11, 3, 8, 12, 4, 9]], ["FSP", 4, 0, 0, 3], ["FSP", 4, 4, 1, 3], ["RE", 4, [0, 4, 1, 5, 2, 6, 3, 7]], ["CA", 2, 4, 5], ["CHR", 1, "shared", [2]], ["CA", 2, 3, 6], ["CHR", 0, "shared", [3]], ["CA", 1, 4, 6], ["FU", 6, [0, 1]], ["AN", 6, 0, 5], ["FU", 6, [1, 2]], ["AN", 6, 1, 4], ["FU", 6, [2, 3]], ["AN", 6, 2, 6], ["FU", 3, [0, 1]], ["SP", 3, 0, 64, [1], 1], ["AN", 3, 1, 2], ["FFSP", 3, 0, [1, 0], 1, 1], ["AN", 3, 1, 6], ["FU", 1, [0, 1]], ["SP", 1, 0, 128, [1], 1], ["AN", 1, 1, 2], ["FFSP", 1, 0, [1, 0], 1, 1], ["AN", 1, 1, 6], ["PR", 4, 0, "auto_unroll_max_step$1024"]]]], "r": [[5.12928e-05, 5.12926e-05, 5.12917e-05, 5.1292e-05], 0, 3.43468, 1656398310], "v": "v0.6"}
{"i": [["[\"3458e75493bb4bb042e539b5ff4818fb\", [8, 1024], [512, 1024], [1, 512], [8, 512]]", "cuda -keys=cuda,gpu -arch=sm_80 -max_num_threads=1024 -thread_warp_size=32", [-1, 16, 64, 49152, 2147483647, 1024, 8, 32], "", 0, []], [[], [["SP", 2, 0, 8, [1, 1, 4, 1], 1], ["SP", 2, 5, 512, [2, 64, 1, 4], 1], ["SP", 2, 10, 1024, [1, 4], 1], ["RE", 2, [0, 5, 1, 6, 2, 7, 10, 11, 3, 8, 12, 4, 9]], ["FSP", 4, 0, 0, 3], ["FSP", 4, 4, 1, 3], ["RE", 4, [0, 4, 1, 5, 2, 6, 3, 7]], ["CA", 2, 4, 5], ["CHR", 1, "shared", [2]], ["CA", 2, 3, 6], ["CHR", 0, "shared", [3]], ["CA", 1, 4, 6], ["FU", 6, [0, 1]], ["AN", 6, 0, 5], ["FU", 6, [1, 2]], ["AN", 6, 1, 4], ["FU", 6, [2, 3]], ["AN", 6, 2, 6], ["FU", 3, [0, 1]], ["SP", 3, 0, 16, [1], 1], ["AN", 3, 1, 2], ["FFSP", 3, 0, [1, 0], 1, 1], ["AN", 3, 1, 6], ["FU", 1, [0, 1]], ["SP", 1, 0, 16, [4], 1], ["AN", 1, 1, 2], ["FFSP", 1, 0, [1, 0], 1, 1], ["AN", 1, 1, 6], ["PR", 4, 0, "auto_unroll_max_step$16"]]]], "r": [[0.000281492, 0.000281494, 0.000281485, 0.000281485], 0, 3.34652, 1656398313], "v": "v0.6"}
{"i": [["[\"3458e75493bb4bb042e539b5ff4818fb\", [8, 1024], [512, 1024], [1, 512], [8, 512]]", "cuda -keys=cuda,gpu -arch=sm_80 -max_num_threads=1024 -thread_warp_size=32", [-1, 16, 64, 49152, 2147483647, 1024, 8, 32], "", 0, []], [[], [["SP", 2, 0, 8, [2, 4, 1, 1], 1], ["SP", 2, 5, 512, [1, 8, 1, 1], 1], ["SP", 2, 10, 1024, [4, 1], 1], ["RE", 2, [0, 5, 1, 6, 2, 7, 10, 11, 3, 8, 12, 4, 9]], ["FSP", 4, 0, 0, 3], ["FSP", 4, 4, 1, 3], ["RE", 4, [0, 4, 1, 5, 2, 6, 3, 7]], ["CA", 2, 4, 5], ["CHR", 1, "shared", [2]], ["CA", 2, 3, 6], ["CHR", 0, "shared", [3]], ["CA", 1, 4, 6], ["FU", 6, [0, 1]], ["AN", 6, 0, 5], ["FU", 6, [1, 2]], ["AN", 6, 1, 4], ["FU", 6, [2, 3]], ["AN", 6, 2, 6], ["FU", 3, [0, 1]], ["SP", 3, 0, 4, [2], 1], ["AN", 3, 1, 2], ["FFSP", 3, 0, [1, 0], 1, 1], ["AN", 3, 1, 6], ["FU", 1, [0, 1]], ["SP", 1, 0, 4, [1], 1], ["AN", 1, 1, 2], ["FFSP", 1, 0, [1, 0], 1, 1], ["AN", 1, 1, 6], ["PR", 4, 0, "auto_unroll_max_step$16"]]]], "r": [[2.87613e-05, 2.87666e-05, 2.87681e-05, 2.87655e-05], 0, 3.05479, 1656398315], "v": "v0.6"}
{"i": [["[\"3458e75493bb4bb042e539b5ff4818fb\", [8, 1024], [512, 1024], [1, 512], [8, 512]]", "cuda -keys=cuda,gpu -arch=sm_80 -max_num_threads=1024 -thread_warp_size=32", [-1, 16, 64, 49152, 2147483647, 1024, 8, 32], "", 0, []], [[], [["SP", 2, 0, 8, [1, 4, 1, 1], 1], ["SP", 2, 5, 512, [1, 8, 8, 2], 1], ["SP", 2, 10, 1024, [2, 8], 1], ["RE", 2, [0, 5, 1, 6, 2, 7, 10, 11, 3, 8, 12, 4, 9]], ["FSP", 4, 0, 0, 3], ["FSP", 4, 4, 1, 3], ["RE", 4, [0, 4, 1, 5, 2, 6, 3, 7]], ["CA", 2, 4, 5], ["CHR", 1, "shared", [2]], ["CA", 2, 3, 6], ["CHR", 0, "shared", [3]], ["CA", 1, 4, 6], ["FU", 6, [0, 1]], ["AN", 6, 0, 5], ["FU", 6, [1, 2]], ["AN", 6, 1, 4], ["FU", 6, [2, 3]], ["AN", 6, 2, 6], ["FU", 3, [0, 1]], ["SP", 3, 0, 128, [4], 1], ["AN", 3, 1, 2], ["FFSP", 3, 0, [1, 0], 1, 1], ["AN", 3, 1, 6], ["FU", 1, [0, 1]], ["SP", 1, 0, 8, [1], 1], ["AN", 1, 1, 2], ["FFSP", 1, 0, [1, 0], 1, 1], ["AN", 1, 1, 6], ["PR", 4, 0, "auto_unroll_max_step$64"]]]], "r": [[0.000233385, 0.00023334, 0.00023335, 0.000233411], 0, 3.40411, 1656398318], "v": "v0.6"}
{"i": [["[\"3458e75493bb4bb042e539b5ff4818fb\", [8, 1024], [512, 1024], [1, 512], [8, 512]]", "cuda -keys=cuda,gpu -arch=sm_80 -max_num_threads=1024 -thread_warp_size=32", [-1, 16, 64, 49152, 2147483647, 1024, 8, 32], "", 0, []], [[], [["SP", 2, 0, 8, [1, 1, 1, 2], 1], ["SP", 2, 5, 512, [2, 32, 2, 2], 1], ["SP", 2, 10, 1024, [8, 1], 1], ["RE", 2, [0, 5, 1, 6, 2, 7, 10, 11, 3, 8, 12, 4, 9]], ["FSP", 4, 0, 0, 3], ["FSP", 4, 4, 1, 3], ["RE", 4, [0, 4, 1, 5, 2, 6, 3, 7]], ["CA", 2, 4, 5], ["CHR", 1, "shared", [2]], ["CA", 2, 3, 6], ["CHR", 0, "shared", [3]], ["CA", 1, 4, 6], ["FU", 6, [0, 1]], ["AN", 6, 0, 5], ["FU", 6, [1, 2]], ["AN", 6, 1, 4], ["FU", 6, [2, 3]], ["AN", 6, 2, 6], ["FU", 3, [0, 1]], ["SP", 3, 0, 32, [1], 1], ["AN", 3, 1, 2], ["FFSP", 3, 0, [1, 0], 1, 1], ["AN", 3, 1, 6], ["FU", 1, [0, 1]], ["SP", 1, 0, 8, [1], 1], ["AN", 1, 1, 2], ["FFSP", 1, 0, [1, 0], 1, 1], ["AN", 1, 1, 6], ["PR", 4, 0, "auto_unroll_max_step$64"]]]], "r": [[0.000200032, 0.000200035, 0.000200039, 0.000200032], 0, 3.24387, 1656398321], "v": "v0.6"}
{"i": [["[\"3458e75493bb4bb042e539b5ff4818fb\", [8, 1024], [512, 1024], [1, 512], [8, 512]]", "cuda -keys=cuda,gpu -arch=sm_80 -max_num_threads=1024 -thread_warp_size=32", [-1, 16, 64, 49152, 2147483647, 1024, 8, 32], "", 0, []], [[], [["SP", 2, 0, 8, [4, 1, 2, 1], 1], ["SP", 2, 5, 512, [2, 32, 1, 2], 1], ["SP", 2, 10, 1024, [1, 2], 1], ["RE", 2, [0, 5, 1, 6, 2, 7, 10, 11, 3, 8, 12, 4, 9]], ["FSP", 4, 0, 0, 3], ["FSP", 4, 4, 1, 3], ["RE", 4, [0, 4, 1, 5, 2, 6, 3, 7]], ["CA", 2, 4, 5], ["CHR", 1, "shared", [2]], ["CA", 2, 3, 6], ["CHR", 0, "shared", [3]], ["CA", 1, 4, 6], ["FU", 6, [0, 1]], ["AN", 6, 0, 5], ["FU", 6, [1, 2]], ["AN", 6, 1, 4], ["FU", 6, [2, 3]], ["AN", 6, 2, 6], ["FU", 3, [0, 1]], ["SP", 3, 0, 4, [1], 1], ["AN", 3, 1, 2], ["FFSP", 3, 0, [1, 0], 1, 1], ["AN", 3, 1, 6], ["FU", 1, [0, 1]], ["SP", 1, 0, 16, [8], 1], ["AN", 1, 1, 2], ["FFSP", 1, 0, [1, 0], 1, 1], ["AN", 1, 1, 6], ["PR", 4, 0, "auto_unroll_max_step$1024"]]]], "r": [[0.00021595, 0.000216024, 0.000216051, 0.000216034], 0, 3.15921, 1656398324], "v": "v0.6"}
{"i": [["[\"3458e75493bb4bb042e539b5ff4818fb\", [8, 1024], [512, 1024], [1, 512], [8, 512]]", "cuda -keys=cuda,gpu -arch=sm_80 -max_num_threads=1024 -thread_warp_size=32", [-1, 16, 64, 49152, 2147483647, 1024, 8, 32], "", 0, []], [[], [["SP", 2, 0, 8, [1, 1, 1, 2], 1], ["SP", 2, 5, 512, [1, 64, 4, 1], 1], ["SP", 2, 10, 1024, [8, 4], 1], ["RE", 2, [0, 5, 1, 6, 2, 7, 10, 11, 3, 8, 12, 4, 9]], ["FSP", 4, 0, 0, 3], ["FSP", 4, 4, 1, 3], ["RE", 4, [0, 4, 1, 5, 2, 6, 3, 7]], ["CA", 2, 4, 5], ["CHR", 1, "shared", [2]], ["CA", 2, 3, 6], ["CHR", 0, "shared", [3]], ["CA", 1, 4, 6], ["FU", 6, [0, 1]], ["AN", 6, 0, 5], ["FU", 6, [1, 2]], ["AN", 6, 1, 4], ["FU", 6, [2, 3]], ["AN", 6, 2, 6], ["FU", 3, [0, 1]], ["SP", 3, 0, 128, [1], 1], ["AN", 3, 1, 2], ["FFSP", 3, 0, [1, 0], 1, 1], ["AN", 3, 1, 6], ["FU", 1, [0, 1]], ["SP", 1, 0, 64, [2], 1], ["AN", 1, 1, 2], ["FFSP", 1, 0, [1, 0], 1, 1], ["AN", 1, 1, 6], ["PR", 4, 0, "auto_unroll_max_step$512"]]]], "r": [[8.20941e-05, 8.20976e-05, 8.20786e-05, 8.2093e-05], 0, 3.61388, 1656398326], "v": "v0.6"}
{"i": [["[\"3458e75493bb4bb042e539b5ff4818fb\", [8, 1024], [512, 1024], [1, 512], [8, 512]]", "cuda -keys=cuda,gpu -arch=sm_80 -max_num_threads=1024 -thread_warp_size=32", [-1, 16, 64, 49152, 2147483647, 1024, 8, 32], "", 0, []], [[], [["SP", 2, 0, 8, [4, 1, 1, 2], 1], ["SP", 2, 5, 512, [2, 128, 1, 2], 1], ["SP", 2, 10, 1024, [4, 1], 1], ["RE", 2, [0, 5, 1, 6, 2, 7, 10, 11, 3, 8, 12, 4, 9]], ["FSP", 4, 0, 0, 3], ["FSP", 4, 4, 1, 3], ["RE", 4, [0, 4, 1, 5, 2, 6, 3, 7]], ["CA", 2, 4, 5], ["CHR", 1, "shared", [2]], ["CA", 2, 3, 6], ["CHR", 0, "shared", [3]], ["CA", 1, 4, 6], ["FU", 6, [0, 1]], ["AN", 6, 0, 5], ["FU", 6, [1, 2]], ["AN", 6, 1, 4], ["FU", 6, [2, 3]], ["AN", 6, 2, 6], ["FU", 3, [0, 1]], ["SP", 3, 0, 16, [1], 1], ["AN", 3, 1, 2], ["FFSP", 3, 0, [1, 0], 1, 1], ["AN", 3, 1, 6], ["FU", 1, [0, 1]], ["SP", 1, 0, 8, [4], 1], ["AN", 1, 1, 2], ["FFSP", 1, 0, [1, 0], 1, 1], ["AN", 1, 1, 6], ["PR", 4, 0, "auto_unroll_max_step$0"]]]], "r": [[0.000248482, 0.000248481, 0.000248486, 0.000248484], 0, 3.18905, 1656398329], "v": "v0.6"}
{"i": [["[\"3458e75493bb4bb042e539b5ff4818fb\", [8, 1024], [512, 1024], [1, 512], [8, 512]]", "cuda -keys=cuda,gpu -arch=sm_80 -max_num_threads=1024 -thread_warp_size=32", [-1, 16, 64, 49152, 2147483647, 1024, 8, 32], "", 0, []], [[], [["SP", 2, 0, 8, [4, 1, 2, 1], 1], ["SP", 2, 5, 512, [1, 128, 1, 1], 1], ["SP", 2, 10, 1024, [1, 64], 1], ["RE", 2, [0, 5, 1, 6, 2, 7, 10, 11, 3, 8, 12, 4, 9]], ["FSP", 4, 0, 0, 3], ["FSP", 4, 4, 1, 3], ["RE", 4, [0, 4, 1, 5, 2, 6, 3, 7]], ["CA", 2, 4, 5], ["CHR", 1, "shared", [2]], ["CA", 2, 3, 6], ["CHR", 0, "shared", [3]], ["CA", 1, 4, 6], ["FU", 6, [0, 1]], ["AN", 6, 0, 5], ["FU", 6, [1, 2]], ["AN", 6, 1, 4], ["FU", 6, [2, 3]], ["AN", 6, 2, 6], ["FU", 3, [0, 1]], ["SP", 3, 0, 64, [1], 1], ["AN", 3, 1, 2], ["FFSP", 3, 0, [1, 0], 1, 1], ["AN", 3, 1, 6], ["FU", 1, [0, 1]], ["SP", 1, 0, 64, [1], 1], ["AN", 1, 1, 2], ["FFSP", 1, 0, [1, 0], 1, 1], ["AN", 1, 1, 6], ["PR", 4, 0, "auto_unroll_max_step$16"]]]], "r": [[4.9518e-05, 4.95194e-05, 4.95208e-05, 4.95169e-05], 0, 4.0384, 1656398331], "v": "v0.6"}
{"i": [["[\"3458e75493bb4bb042e539b5ff4818fb\", [8, 1024], [512, 1024], [1, 512], [8, 512]]", "cuda -keys=cuda,gpu -arch=sm_80 -max_num_threads=1024 -thread_warp_size=32", [-1, 16, 64, 49152, 2147483647, 1024, 8, 32], "", 0, []], [[], [["SP", 2, 0, 8, [2, 1, 1, 4], 1], ["SP", 2, 5, 512, [2, 128, 1, 1], 1], ["SP", 2, 10, 1024, [2, 1], 1], ["RE", 2, [0, 5, 1, 6, 2, 7, 10, 11, 3, 8, 12, 4, 9]], ["FSP", 4, 0, 0, 3], ["FSP", 4, 4, 1, 3], ["RE", 4, [0, 4, 1, 5, 2, 6, 3, 7]], ["CA", 2, 4, 5], ["CHR", 1, "shared", [2]], ["CA", 2, 3, 6], ["CHR", 0, "shared", [3]], ["CA", 1, 4, 6], ["FU", 6, [0, 1]], ["AN", 6, 0, 5], ["FU", 6, [1, 2]], ["AN", 6, 1, 4], ["FU", 6, [2, 3]], ["AN", 6, 2, 6], ["FU", 3, [0, 1]], ["SP", 3, 0, 2, [1], 1], ["AN", 3, 1, 2], ["FFSP", 3, 0, [1, 0], 1, 1], ["AN", 3, 1, 6], ["FU", 1, [0, 1]], ["SP", 1, 0, 8, [1], 1], ["AN", 1, 1, 2], ["FFSP", 1, 0, [1, 0], 1, 1], ["AN", 1, 1, 6], ["PR", 4, 0, "auto_unroll_max_step$1024"]]]], "r": [[0.000205488, 0.000205498, 0.00020548, 0.000205493], 0, 3.17399, 1656398334], "v": "v0.6"}
{"i": [["[\"3458e75493bb4bb042e539b5ff4818fb\", [8, 1024], [512, 1024], [1, 512], [8, 512]]", "cuda -keys=cuda,gpu -arch=sm_80 -max_num_threads=1024 -thread_warp_size=32", [-1, 16, 64, 49152, 2147483647, 1024, 8, 32], "", 0, []], [[], [["SP", 2, 0, 8, [4, 1, 2, 1], 1], ["SP", 2, 5, 512, [1, 128, 1, 1], 1], ["SP", 2, 10, 1024, [1, 64], 1], ["RE", 2, [0, 5, 1, 6, 2, 7, 10, 11, 3, 8, 12, 4, 9]], ["FSP", 4, 0, 0, 3], ["FSP", 4, 4, 1, 3], ["RE", 4, [0, 4, 1, 5, 2, 6, 3, 7]], ["CA", 2, 4, 5], ["CHR", 1, "shared", [2]], ["CA", 2, 3, 6], ["CHR", 0, "shared", [3]], ["CA", 1, 4, 6], ["FU", 6, [0, 1]], ["AN", 6, 0, 5], ["FU", 6, [1, 2]], ["AN", 6, 1, 4], ["FU", 6, [2, 3]], ["AN", 6, 2, 6], ["FU", 3, [0, 1]], ["SP", 3, 0, 64, [1], 1], ["AN", 3, 1, 2], ["FFSP", 3, 0, [1, 0], 1, 1], ["AN", 3, 1, 6], ["FU", 1, [0, 1]], ["SP", 1, 0, 64, [4], 1], ["AN", 1, 1, 2], ["FFSP", 1, 0, [1, 0], 1, 1], ["AN", 1, 1, 6], ["PR", 4, 0, "auto_unroll_max_step$16"]]]], "r": [[4.9596e-05, 4.95966e-05, 4.95969e-05, 4.95957e-05], 0, 4.16994, 1656398337], "v": "v0.6"}
{"i": [["[\"3458e75493bb4bb042e539b5ff4818fb\", [8, 1024], [512, 1024], [1, 512], [8, 512]]", "cuda -keys=cuda,gpu -arch=sm_80 -max_num_threads=1024 -thread_warp_size=32", [-1, 16, 64, 49152, 2147483647, 1024, 8, 32], "", 0, []], [[], [["SP", 2, 0, 8, [2, 1, 4, 1], 1], ["SP", 2, 5, 512, [1, 64, 1, 2], 1], ["SP", 2, 10, 1024, [2, 4], 1], ["RE", 2, [0, 5, 1, 6, 2, 7, 10, 11, 3, 8, 12, 4, 9]], ["FSP", 4, 0, 0, 3], ["FSP", 4, 4, 1, 3], ["RE", 4, [0, 4, 1, 5, 2, 6, 3, 7]], ["CA", 2, 4, 5], ["CHR", 1, "shared", [2]], ["CA", 2, 3, 6], ["CHR", 0, "shared", [3]], ["CA", 1, 4, 6], ["FU", 6, [0, 1]], ["AN", 6, 0, 5], ["FU", 6, [1, 2]], ["AN", 6, 1, 4], ["FU", 6, [2, 3]], ["AN", 6, 2, 6], ["FU", 3, [0, 1]], ["SP", 3, 0, 128, [2], 1], ["AN", 3, 1, 2], ["FFSP", 3, 0, [1, 0], 1, 1], ["AN", 3, 1, 6], ["FU", 1, [0, 1]], ["SP", 1, 0, 64, [1], 1], ["AN", 1, 1, 2], ["FFSP", 1, 0, [1, 0], 1, 1], ["AN", 1, 1, 6], ["PR", 4, 0, "auto_unroll_max_step$512"]]]], "r": [[8.28361e-05, 8.2886e-05, 8.28943e-05, 8.28126e-05], 0, 3.0765, 1656398339], "v": "v0.6"}
{"i": [["[\"3458e75493bb4bb042e539b5ff4818fb\", [8, 1024], [512, 1024], [1, 512], [8, 512]]", "cuda -keys=cuda,gpu -arch=sm_80 -max_num_threads=1024 -thread_warp_size=32", [-1, 16, 64, 49152, 2147483647, 1024, 8, 32], "", 0, []], [[], [["SP", 2, 0, 8, [1, 4, 1, 1], 1], ["SP", 2, 5, 512, [1, 128, 2, 1], 1], ["SP", 2, 10, 1024, [1, 4], 1], ["RE", 2, [0, 5, 1, 6, 2, 7, 10, 11, 3, 8, 12, 4, 9]], ["FSP", 4, 0, 0, 3], ["FSP", 4, 4, 1, 3], ["RE", 4, [0, 4, 1, 5, 2, 6, 3, 7]], ["CA", 2, 4, 5], ["CHR", 1, "shared", [2]], ["CA", 2, 3, 6], ["CHR", 0, "shared", [3]], ["CA", 1, 4, 6], ["FU", 6, [0, 1]], ["AN", 6, 0, 5], ["FU", 6, [1, 2]], ["AN", 6, 1, 4], ["FU", 6, [2, 3]], ["AN", 6, 2, 6], ["FU", 3, [0, 1]], ["SP", 3, 0, 16, [1], 1], ["AN", 3, 1, 2], ["FFSP", 3, 0, [1, 0], 1, 1], ["AN", 3, 1, 6], ["FU", 1, [0, 1]], ["SP", 1, 0, 8, [1], 1], ["AN", 1, 1, 2], ["FFSP", 1, 0, [1, 0], 1, 1], ["AN", 1, 1, 6], ["PR", 4, 0, "auto_unroll_max_step$512"]]]], "r": [[0.000133736, 0.000133721, 0.000133738, 0.000133729], 0, 3.04844, 1656398342], "v": "v0.6"}
{"i": [["[\"3458e75493bb4bb042e539b5ff4818fb\", [8, 1024], [512, 1024], [1, 512], [8, 512]]", "cuda -keys=cuda,gpu -arch=sm_80 -max_num_threads=1024 -thread_warp_size=32", [-1, 16, 64, 49152, 2147483647, 1024, 8, 32], "", 0, []], [[], [["SP", 2, 0, 8, [1, 1, 2, 2], 1], ["SP", 2, 5, 512, [1, 32, 2, 8], 1], ["SP", 2, 10, 1024, [1, 4], 1], ["RE", 2, [0, 5, 1, 6, 2, 7, 10, 11, 3, 8, 12, 4, 9]], ["FSP", 4, 0, 0, 3], ["FSP", 4, 4, 1, 3], ["RE", 4, [0, 4, 1, 5, 2, 6, 3, 7]], ["CA", 2, 4, 5], ["CHR", 1, "shared", [2]], ["CA", 2, 3, 6], ["CHR", 0, "shared", [3]], ["CA", 1, 4, 6], ["FU", 6, [0, 1]], ["AN", 6, 0, 5], ["FU", 6, [1, 2]], ["AN", 6, 1, 4], ["FU", 6, [2, 3]], ["AN", 6, 2, 6], ["FU", 3, [0, 1]], ["SP", 3, 0, 64, [1], 1], ["AN", 3, 1, 2], ["FFSP", 3, 0, [1, 0], 1, 1], ["AN", 3, 1, 6], ["FU", 1, [0, 1]], ["SP", 1, 0, 16, [8], 1], ["AN", 1, 1, 2], ["FFSP", 1, 0, [1, 0], 1, 1], ["AN", 1, 1, 6], ["PR", 4, 0, "auto_unroll_max_step$512"]]]], "r": [[0.000442702, 0.000442578, 0.000442554, 0.000442609], 0, 3.31915, 1656398345], "v": "v0.6"}
{"i": [["[\"3458e75493bb4bb042e539b5ff4818fb\", [8, 1024], [512, 1024], [1, 512], [8, 512]]", "cuda -keys=cuda,gpu -arch=sm_80 -max_num_threads=1024 -thread_warp_size=32", [-1, 16, 64, 49152, 2147483647, 1024, 8, 32], "", 0, []], [[], [["SP", 2, 0, 8, [1, 1, 1, 4], 1], ["SP", 2, 5, 512, [8, 64, 1, 1], 1], ["SP", 2, 10, 1024, [1, 4], 1], ["RE", 2, [0, 5, 1, 6, 2, 7, 10, 11, 3, 8, 12, 4, 9]], ["FSP", 4, 0, 0, 3], ["FSP", 4, 4, 1, 3], ["RE", 4, [0, 4, 1, 5, 2, 6, 3, 7]], ["CA", 2, 4, 5], ["CHR", 1, "shared", [2]], ["CA", 2, 3, 6], ["CHR", 0, "shared", [3]], ["CA", 1, 4, 6], ["FU", 6, [0, 1]], ["AN", 6, 0, 5], ["FU", 6, [1, 2]], ["AN", 6, 1, 4], ["FU", 6, [2, 3]], ["AN", 6, 2, 6], ["FU", 3, [0, 1]], ["SP", 3, 0, 16, [1], 1], ["AN", 3, 1, 2], ["FFSP", 3, 0, [1, 0], 1, 1], ["AN", 3, 1, 6], ["FU", 1, [0, 1]], ["SP", 1, 0, 16, [16], 1], ["AN", 1, 1, 2], ["FFSP", 1, 0, [1, 0], 1, 1], ["AN", 1, 1, 6], ["PR", 4, 0, "auto_unroll_max_step$16"]]]], "r": [[0.000266545, 0.000266533, 0.00026654, 0.000266541], 0, 3.09933, 1656398347], "v": "v0.6"}
{"i": [["[\"3458e75493bb4bb042e539b5ff4818fb\", [8, 1024], [512, 1024], [1, 512], [8, 512]]", "cuda -keys=cuda,gpu -arch=sm_80 -max_num_threads=1024 -thread_warp_size=32", [-1, 16, 64, 49152, 2147483647, 1024, 8, 32], "", 0, []], [[], [["SP", 2, 0, 8, [1, 1, 8, 1], 1], ["SP", 2, 5, 512, [4, 8, 4, 2], 1], ["SP", 2, 10, 1024, [4, 2], 1], ["RE", 2, [0, 5, 1, 6, 2, 7, 10, 11, 3, 8, 12, 4, 9]], ["FSP", 4, 0, 0, 3], ["FSP", 4, 4, 1, 3], ["RE", 4, [0, 4, 1, 5, 2, 6, 3, 7]], ["CA", 2, 4, 5], ["CHR", 1, "shared", [2]], ["CA", 2, 3, 6], ["CHR", 0, "shared", [3]], ["CA", 1, 4, 6], ["FU", 6, [0, 1]], ["AN", 6, 0, 5], ["FU", 6, [1, 2]], ["AN", 6, 1, 4], ["FU", 6, [2, 3]], ["AN", 6, 2, 6], ["FU", 3, [0, 1]], ["SP", 3, 0, 64, [1], 1], ["AN", 3, 1, 2], ["FFSP", 3, 0, [1, 0], 1, 1], ["AN", 3, 1, 6], ["FU", 1, [0, 1]], ["SP", 1, 0, 8, [1], 1], ["AN", 1, 1, 2], ["FFSP", 1, 0, [1, 0], 1, 1], ["AN", 1, 1, 6], ["PR", 4, 0, "auto_unroll_max_step$512"]]]], "r": [[0.00114032, 0.00114031, 0.00114041, 0.00114033], 0, 4.52863, 1656398350], "v": "v0.6"}
{"i": [["[\"3458e75493bb4bb042e539b5ff4818fb\", [8, 1024], [512, 1024], [1, 512], [8, 512]]", "cuda -keys=cuda,gpu -arch=sm_80 -max_num_threads=1024 -thread_warp_size=32", [-1, 16, 64, 49152, 2147483647, 1024, 8, 32], "", 0, []], [[], [["SP", 2, 0, 8, [1, 4, 2, 1], 1], ["SP", 2, 5, 512, [1, 8, 4, 1], 1], ["SP", 2, 10, 1024, [16, 1], 1], ["RE", 2, [0, 5, 1, 6, 2, 7, 10, 11, 3, 8, 12, 4, 9]], ["FSP", 4, 0, 0, 3], ["FSP", 4, 4, 1, 3], ["RE", 4, [0, 4, 1, 5, 2, 6, 3, 7]], ["CA", 2, 4, 5], ["CHR", 1, "shared", [2]], ["CA", 2, 3, 6], ["CHR", 0, "shared", [3]], ["CA", 1, 4, 6], ["FU", 6, [0, 1]], ["AN", 6, 0, 5], ["FU", 6, [1, 2]], ["AN", 6, 1, 4], ["FU", 6, [2, 3]], ["AN", 6, 2, 6], ["FU", 3, [0, 1]], ["SP", 3, 0, 128, [1], 1], ["AN", 3, 1, 2], ["FFSP", 3, 0, [1, 0], 1, 1], ["AN", 3, 1, 6], ["FU", 1, [0, 1]], ["SP", 1, 0, 256, [1], 1], ["AN", 1, 1, 2], ["FFSP", 1, 0, [1, 0], 1, 1], ["AN", 1, 1, 6], ["PR", 4, 0, "auto_unroll_max_step$16"]]]], "r": [[7.56813e-05, 7.56835e-05, 7.56827e-05, 7.56821e-05], 0, 2.99746, 1656398353], "v": "v0.6"}
{"i": [["[\"3458e75493bb4bb042e539b5ff4818fb\", [8, 1024], [512, 1024], [1, 512], [8, 512]]", "cuda -keys=cuda,gpu -arch=sm_80 -max_num_threads=1024 -thread_warp_size=32", [-1, 16, 64, 49152, 2147483647, 1024, 8, 32], "", 0, []], [[], [["SP", 2, 0, 8, [1, 1, 1, 8], 1], ["SP", 2, 5, 512, [2, 128, 1, 1], 1], ["SP", 2, 10, 1024, [1, 8], 1], ["RE", 2, [0, 5, 1, 6, 2, 7, 10, 11, 3, 8, 12, 4, 9]], ["FSP", 4, 0, 0, 3], ["FSP", 4, 4, 1, 3], ["RE", 4, [0, 4, 1, 5, 2, 6, 3, 7]], ["CA", 2, 4, 5], ["CHR", 1, "shared", [2]], ["CA", 2, 3, 6], ["CHR", 0, "shared", [3]], ["CA", 1, 4, 6], ["FU", 6, [0, 1]], ["AN", 6, 0, 5], ["FU", 6, [1, 2]], ["AN", 6, 1, 4], ["FU", 6, [2, 3]], ["AN", 6, 2, 6], ["FU", 3, [0, 1]], ["SP", 3, 0, 8, [1], 1], ["AN", 3, 1, 2], ["FFSP", 3, 0, [1, 0], 1, 1], ["AN", 3, 1, 6], ["FU", 1, [0, 1]], ["SP", 1, 0, 32, [2], 1], ["AN", 1, 1, 2], ["FFSP", 1, 0, [1, 0], 1, 1], ["AN", 1, 1, 6], ["PR", 4, 0, "auto_unroll_max_step$1024"]]]], "r": [[9.49031e-05, 9.48864e-05, 9.48308e-05, 9.47405e-05], 0, 3.04502, 1656398355], "v": "v0.6"}
{"i": [["[\"3458e75493bb4bb042e539b5ff4818fb\", [8, 1024], [512, 1024], [1, 512], [8, 512]]", "cuda -keys=cuda,gpu -arch=sm_80 -max_num_threads=1024 -thread_warp_size=32", [-1, 16, 64, 49152, 2147483647, 1024, 8, 32], "", 0, []], [[], [["SP", 2, 0, 8, [1, 1, 8, 1], 1], ["SP", 2, 5, 512, [4, 32, 1, 1], 1], ["SP", 2, 10, 1024, [8, 8], 1], ["RE", 2, [0, 5, 1, 6, 2, 7, 10, 11, 3, 8, 12, 4, 9]], ["FSP", 4, 0, 0, 3], ["FSP", 4, 4, 1, 3], ["RE", 4, [0, 4, 1, 5, 2, 6, 3, 7]], ["CA", 2, 4, 5], ["CHR", 1, "shared", [2]], ["CA", 2, 3, 6], ["CHR", 0, "shared", [3]], ["CA", 1, 4, 6], ["FU", 6, [0, 1]], ["AN", 6, 0, 5], ["FU", 6, [1, 2]], ["AN", 6, 1, 4], ["FU", 6, [2, 3]], ["AN", 6, 2, 6], ["FU", 3, [0, 1]], ["SP", 3, 0, 64, [4], 1], ["AN", 3, 1, 2], ["FFSP", 3, 0, [1, 0], 1, 1], ["AN", 3, 1, 6], ["FU", 1, [0, 1]], ["SP", 1, 0, 512, [1], 1], ["AN", 1, 1, 2], ["FFSP", 1, 0, [1, 0], 1, 1], ["AN", 1, 1, 6], ["PR", 4, 0, "auto_unroll_max_step$16"]]]], "r": [[0.000100558, 0.000100558, 0.000100552, 0.000100555], 0, 3.2357, 1656398358], "v": "v0.6"}
{"i": [["[\"3458e75493bb4bb042e539b5ff4818fb\", [8, 1024], [512, 1024], [1, 512], [8, 512]]", "cuda -keys=cuda,gpu -arch=sm_80 -max_num_threads=1024 -thread_warp_size=32", [-1, 16, 64, 49152, 2147483647, 1024, 8, 32], "", 0, []], [[], [["SP", 2, 0, 8, [1, 1, 2, 2], 1], ["SP", 2, 5, 512, [1, 64, 8, 1], 1], ["SP", 2, 10, 1024, [4, 2], 1], ["RE", 2, [0, 5, 1, 6, 2, 7, 10, 11, 3, 8, 12, 4, 9]], ["FSP", 4, 0, 0, 3], ["FSP", 4, 4, 1, 3], ["RE", 4, [0, 4, 1, 5, 2, 6, 3, 7]], ["CA", 2, 4, 5], ["CHR", 1, "shared", [2]], ["CA", 2, 3, 6], ["CHR", 0, "shared", [3]], ["CA", 1, 4, 6], ["FU", 6, [0, 1]], ["AN", 6, 0, 5], ["FU", 6, [1, 2]], ["AN", 6, 1, 4], ["FU", 6, [2, 3]], ["AN", 6, 2, 6], ["FU", 3, [0, 1]], ["SP", 3, 0, 64, [1], 1], ["AN", 3, 1, 2], ["FFSP", 3, 0, [1, 0], 1, 1], ["AN", 3, 1, 6], ["FU", 1, [0, 1]], ["SP", 1, 0, 32, [32], 1], ["AN", 1, 1, 2], ["FFSP", 1, 0, [1, 0], 1, 1], ["AN", 1, 1, 6], ["PR", 4, 0, "auto_unroll_max_step$16"]]]], "r": [[0.000245423, 0.00024548, 0.000245508, 0.000245486], 0, 3.07701, 1656398361], "v": "v0.6"}
{"i": [["[\"3458e75493bb4bb042e539b5ff4818fb\", [8, 1024], [512, 1024], [1, 512], [8, 512]]", "cuda -keys=cuda,gpu -arch=sm_80 -max_num_threads=1024 -thread_warp_size=32", [-1, 16, 64, 49152, 2147483647, 1024, 8, 32], "", 0, []], [[], [["SP", 2, 0, 8, [4, 2, 1, 1], 1], ["SP", 2, 5, 512, [2, 16, 4, 1], 1], ["SP", 2, 10, 1024, [16, 1], 1], ["RE", 2, [0, 5, 1, 6, 2, 7, 10, 11, 3, 8, 12, 4, 9]], ["FSP", 4, 0, 0, 3], ["FSP", 4, 4, 1, 3], ["RE", 4, [0, 4, 1, 5, 2, 6, 3, 7]], ["CA", 2, 4, 5], ["CHR", 1, "shared", [2]], ["CA", 2, 3, 6], ["CHR", 0, "shared", [3]], ["CA", 1, 4, 6], ["FU", 6, [0, 1]], ["AN", 6, 0, 5], ["FU", 6, [1, 2]], ["AN", 6, 1, 4], ["FU", 6, [2, 3]], ["AN", 6, 2, 6], ["FU", 3, [0, 1]], ["SP", 3, 0, 64, [1], 1], ["AN", 3, 1, 2], ["FFSP", 3, 0, [1, 0], 1, 1], ["AN", 3, 1, 6], ["FU", 1, [0, 1]], ["SP", 1, 0, 16, [1], 1], ["AN", 1, 1, 2], ["FFSP", 1, 0, [1, 0], 1, 1], ["AN", 1, 1, 6], ["PR", 4, 0, "auto_unroll_max_step$16"]]]], "r": [[0.000145652, 0.00014565, 0.000145654, 0.000145667], 0, 3.07016, 1656398363], "v": "v0.6"}
{"i": [["[\"3458e75493bb4bb042e539b5ff4818fb\", [8, 1024], [512, 1024], [1, 512], [8, 512]]", "cuda -keys=cuda,gpu -arch=sm_80 -max_num_threads=1024 -thread_warp_size=32", [-1, 16, 64, 49152, 2147483647, 1024, 8, 32], "", 0, []], [[], [["SP", 2, 0, 8, [1, 4, 1, 2], 1], ["SP", 2, 5, 512, [1, 8, 16, 1], 1], ["SP", 2, 10, 1024, [8, 8], 1], ["RE", 2, [0, 5, 1, 6, 2, 7, 10, 11, 3, 8, 12, 4, 9]], ["FSP", 4, 0, 0, 3], ["FSP", 4, 4, 1, 3], ["RE", 4, [0, 4, 1, 5, 2, 6, 3, 7]], ["CA", 2, 4, 5], ["CHR", 1, "shared", [2]], ["CA", 2, 3, 6], ["CHR", 0, "shared", [3]], ["CA", 1, 4, 6], ["FU", 6, [0, 1]], ["AN", 6, 0, 5], ["FU", 6, [1, 2]], ["AN", 6, 1, 4], ["FU", 6, [2, 3]], ["AN", 6, 2, 6], ["FU", 3, [0, 1]], ["SP", 3, 0, 1024, [1], 1], ["AN", 3, 1, 2], ["FFSP", 3, 0, [1, 0], 1, 1], ["AN", 3, 1, 6], ["FU", 1, [0, 1]], ["SP", 1, 0, 128, [1], 1], ["AN", 1, 1, 2], ["FFSP", 1, 0, [1, 0], 1, 1], ["AN", 1, 1, 6], ["PR", 4, 0, "auto_unroll_max_step$512"]]]], "r": [[0.000225589, 0.000225588, 0.000225585, 0.000225583], 0, 3.94141, 1656398366], "v": "v0.6"}
{"i": [["[\"3458e75493bb4bb042e539b5ff4818fb\", [8, 1024], [512, 1024], [1, 512], [8, 512]]", "cuda -keys=cuda,gpu -arch=sm_80 -max_num_threads=1024 -thread_warp_size=32", [-1, 16, 64, 49152, 2147483647, 1024, 8, 32], "", 0, []], [[], [["SP", 2, 0, 8, [2, 1, 1, 1], 1], ["SP", 2, 5, 512, [4, 64, 1, 2], 1], ["SP", 2, 10, 1024, [4, 2], 1], ["RE", 2, [0, 5, 1, 6, 2, 7, 10, 11, 3, 8, 12, 4, 9]], ["FSP", 4, 0, 0, 3], ["FSP", 4, 4, 1, 3], ["RE", 4, [0, 4, 1, 5, 2, 6, 3, 7]], ["CA", 2, 4, 5], ["CHR", 1, "shared", [2]], ["CA", 2, 3, 6], ["CHR", 0, "shared", [3]], ["CA", 1, 4, 6], ["FU", 6, [0, 1]], ["AN", 6, 0, 5], ["FU", 6, [1, 2]], ["AN", 6, 1, 4], ["FU", 6, [2, 3]], ["AN", 6, 2, 6], ["FU", 3, [0, 1]], ["SP", 3, 0, 16, [1], 1], ["AN", 3, 1, 2], ["FFSP", 3, 0, [1, 0], 1, 1], ["AN", 3, 1, 6], ["FU", 1, [0, 1]], ["SP", 1, 0, 8, [1], 1], ["AN", 1, 1, 2], ["FFSP", 1, 0, [1, 0], 1, 1], ["AN", 1, 1, 6], ["PR", 4, 0, "auto_unroll_max_step$16"]]]], "r": [[0.000163552, 0.00016353, 0.000163512, 0.00016352], 0, 3.04501, 1656398369], "v": "v0.6"}
{"i": [["[\"3458e75493bb4bb042e539b5ff4818fb\", [8, 1024], [512, 1024], [1, 512], [8, 512]]", "cuda -keys=cuda,gpu -arch=sm_80 -max_num_threads=1024 -thread_warp_size=32", [-1, 16, 64, 49152, 2147483647, 1024, 8, 32], "", 0, []], [[], [["SP", 2, 0, 8, [2, 4, 1, 1], 1], ["SP", 2, 5, 512, [2, 8, 4, 1], 1], ["SP", 2, 10, 1024, [4, 4], 1], ["RE", 2, [0, 5, 1, 6, 2, 7, 10, 11, 3, 8, 12, 4, 9]], ["FSP", 4, 0, 0, 3], ["FSP", 4, 4, 1, 3], ["RE", 4, [0, 4, 1, 5, 2, 6, 3, 7]], ["CA", 2, 4, 5], ["CHR", 1, "shared", [2]], ["CA", 2, 3, 6], ["CHR", 0, "shared", [3]], ["CA", 1, 4, 6], ["FU", 6, [0, 1]], ["AN", 6, 0, 5], ["FU", 6, [1, 2]], ["AN", 6, 1, 4], ["FU", 6, [2, 3]], ["AN", 6, 2, 6], ["FU", 3, [0, 1]], ["SP", 3, 0, 256, [1], 1], ["AN", 3, 1, 2], ["FFSP", 3, 0, [1, 0], 1, 1], ["AN", 3, 1, 6], ["FU", 1, [0, 1]], ["SP", 1, 0, 16, [1], 1], ["AN", 1, 1, 2], ["FFSP", 1, 0, [1, 0], 1, 1], ["AN", 1, 1, 6], ["PR", 4, 0, "auto_unroll_max_step$512"]]]], "r": [[0.000136099, 0.000136117, 0.000136196, 0.000136218], 0, 3.23973, 1656398371], "v": "v0.6"}
{"i": [["[\"3458e75493bb4bb042e539b5ff4818fb\", [8, 1024], [512, 1024], [1, 512], [8, 512]]", "cuda -keys=cuda,gpu -arch=sm_80 -max_num_threads=1024 -thread_warp_size=32", [-1, 16, 64, 49152, 2147483647, 1024, 8, 32], "", 0, []], [[], [["SP", 2, 0, 8, [1, 1, 1, 4], 1], ["SP", 2, 5, 512, [1, 64, 8, 1], 1], ["SP", 2, 10, 1024, [4, 1], 1], ["RE", 2, [0, 5, 1, 6, 2, 7, 10, 11, 3, 8, 12, 4, 9]], ["FSP", 4, 0, 0, 3], ["FSP", 4, 4, 1, 3], ["RE", 4, [0, 4, 1, 5, 2, 6, 3, 7]], ["CA", 2, 4, 5], ["CHR", 1, "shared", [2]], ["CA", 2, 3, 6], ["CHR", 0, "shared", [3]], ["CA", 1, 4, 6], ["FU", 6, [0, 1]], ["AN", 6, 0, 5], ["FU", 6, [1, 2]], ["AN", 6, 1, 4], ["FU", 6, [2, 3]], ["AN", 6, 2, 6], ["FU", 3, [0, 1]], ["SP", 3, 0, 64, [1], 1], ["AN", 3, 1, 2], ["FFSP", 3, 0, [1, 0], 1, 1], ["AN", 3, 1, 6], ["FU", 1, [0, 1]], ["SP", 1, 0, 32, [32], 1], ["AN", 1, 1, 2], ["FFSP", 1, 0, [1, 0], 1, 1], ["AN", 1, 1, 6], ["PR", 4, 0, "auto_unroll_max_step$0"]]]], "r": [[0.000321493, 0.000321495, 0.0003215, 0.000321494], 0, 3.0761, 1656398374], "v": "v0.6"}
{"i": [["[\"3458e75493bb4bb042e539b5ff4818fb\", [8, 1024], [512, 1024], [1, 512], [8, 512]]", "cuda -keys=cuda,gpu -arch=sm_80 -max_num_threads=1024 -thread_warp_size=32", [-1, 16, 64, 49152, 2147483647, 1024, 8, 32], "", 0, []], [[], [["SP", 2, 0, 8, [1, 8, 1, 1], 1], ["SP", 2, 5, 512, [4, 8, 8, 2], 1], ["SP", 2, 10, 1024, [4, 2], 1], ["RE", 2, [0, 5, 1, 6, 2, 7, 10, 11, 3, 8, 12, 4, 9]], ["FSP", 4, 0, 0, 3], ["FSP", 4, 4, 1, 3], ["RE", 4, [0, 4, 1, 5, 2, 6, 3, 7]], ["CA", 2, 4, 5], ["CHR", 1, "shared", [2]], ["CA", 2, 3, 6], ["CHR", 0, "shared", [3]], ["CA", 1, 4, 6], ["FU", 6, [0, 1]], ["AN", 6, 0, 5], ["FU", 6, [1, 2]], ["AN", 6, 1, 4], ["FU", 6, [2, 3]], ["AN", 6, 2, 6], ["FU", 3, [0, 1]], ["SP", 3, 0, 64, [1], 1], ["AN", 3, 1, 2], ["FFSP", 3, 0, [1, 0], 1, 1], ["AN", 3, 1, 6], ["FU", 1, [0, 1]], ["SP", 1, 0, 8, [1], 1], ["AN", 1, 1, 2], ["FFSP", 1, 0, [1, 0], 1, 1], ["AN", 1, 1, 6], ["PR", 4, 0, "auto_unroll_max_step$512"]]]], "r": [[0.000937911, 0.000937955, 0.000937966, 0.00093796], 0, 2.99771, 1656398376], "v": "v0.6"}
{"i": [["[\"3458e75493bb4bb042e539b5ff4818fb\", [8, 1024], [512, 1024], [1, 512], [8, 512]]", "cuda -keys=cuda,gpu -arch=sm_80 -max_num_threads=1024 -thread_warp_size=32", [-1, 16, 64, 49152, 2147483647, 1024, 8, 32], "", 0, []], [[], [["SP", 2, 0, 8, [1, 1, 1, 1], 1], ["SP", 2, 5, 512, [1, 128, 2, 1], 1], ["SP", 2, 10, 1024, [1, 8], 1], ["RE", 2, [0, 5, 1, 6, 2, 7, 10, 11, 3, 8, 12, 4, 9]], ["FSP", 4, 0, 0, 3], ["FSP", 4, 4, 1, 3], ["RE", 4, [0, 4, 1, 5, 2, 6, 3, 7]], ["CA", 2, 4, 5], ["CHR", 1, "shared", [2]], ["CA", 2, 3, 6], ["CHR", 0, "shared", [3]], ["CA", 1, 4, 6], ["FU", 6, [0, 1]], ["AN", 6, 0, 5], ["FU", 6, [1, 2]], ["AN", 6, 1, 4], ["FU", 6, [2, 3]], ["AN", 6, 2, 6], ["FU", 3, [0, 1]], ["SP", 3, 0, 16, [2], 1], ["AN", 3, 1, 2], ["FFSP", 3, 0, [1, 0], 1, 1], ["AN", 3, 1, 6], ["FU", 1, [0, 1]], ["SP", 1, 0, 8, [1], 1], ["AN", 1, 1, 2], ["FFSP", 1, 0, [1, 0], 1, 1], ["AN", 1, 1, 6], ["PR", 4, 0, "auto_unroll_max_step$1024"]]]], "r": [[8.4179e-05, 8.41752e-05, 8.41794e-05, 8.41745e-05], 0, 2.95045, 1656398378], "v": "v0.6"}
{"i": [["[\"3458e75493bb4bb042e539b5ff4818fb\", [8, 1024], [512, 1024], [1, 512], [8, 512]]", "cuda -keys=cuda,gpu -arch=sm_80 -max_num_threads=1024 -thread_warp_size=32", [-1, 16, 64, 49152, 2147483647, 1024, 8, 32], "", 0, []], [[], [["SP", 2, 0, 8, [2, 1, 4, 1], 1], ["SP", 2, 5, 512, [1, 512, 1, 1], 1], ["SP", 2, 10, 1024, [4, 1], 1], ["RE", 2, [0, 5, 1, 6, 2, 7, 10, 11, 3, 8, 12, 4, 9]], ["FSP", 4, 0, 0, 3], ["FSP", 4, 4, 1, 3], ["RE", 4, [0, 4, 1, 5, 2, 6, 3, 7]], ["CA", 2, 4, 5], ["CHR", 1, "shared", [2]], ["CA", 2, 3, 6], ["CHR", 0, "shared", [3]], ["CA", 1, 4, 6], ["FU", 6, [0, 1]], ["AN", 6, 0, 5], ["FU", 6, [1, 2]], ["AN", 6, 1, 4], ["FU", 6, [2, 3]], ["AN", 6, 2, 6], ["FU", 3, [0, 1]], ["SP", 3, 0, 16, [1], 1], ["AN", 3, 1, 2], ["FFSP", 3, 0, [1, 0], 1, 1], ["AN", 3, 1, 6], ["FU", 1, [0, 1]], ["SP", 1, 0, 64, [1], 1], ["AN", 1, 1, 2], ["FFSP", 1, 0, [1, 0], 1, 1], ["AN", 1, 1, 6], ["PR", 4, 0, "auto_unroll_max_step$0"]]]], "r": [[0.000229609, 0.000229617, 0.000229611, 0.000229617], 0, 3.03173, 1656398381], "v": "v0.6"}
{"i": [["[\"3458e75493bb4bb042e539b5ff4818fb\", [8, 1024], [512, 1024], [1, 512], [8, 512]]", "cuda -keys=cuda,gpu -arch=sm_80 -max_num_threads=1024 -thread_warp_size=32", [-1, 16, 64, 49152, 2147483647, 1024, 8, 32], "", 0, []], [[], [["SP", 2, 0, 8, [1, 4, 1, 1], 1], ["SP", 2, 5, 512, [1, 16, 1, 32], 1], ["SP", 2, 10, 1024, [16, 1], 1], ["RE", 2, [0, 5, 1, 6, 2, 7, 10, 11, 3, 8, 12, 4, 9]], ["FSP", 4, 0, 0, 3], ["FSP", 4, 4, 1, 3], ["RE", 4, [0, 4, 1, 5, 2, 6, 3, 7]], ["CA", 2, 4, 5], ["CHR", 1, "shared", [2]], ["CA", 2, 3, 6], ["CHR", 0, "shared", [3]], ["CA", 1, 4, 6], ["FU", 6, [0, 1]], ["AN", 6, 0, 5], ["FU", 6, [1, 2]], ["AN", 6, 1, 4], ["FU", 6, [2, 3]], ["AN", 6, 2, 6], ["FU", 3, [0, 1]], ["SP", 3, 0, 512, [1], 1], ["AN", 3, 1, 2], ["FFSP", 3, 0, [1, 0], 1, 1], ["AN", 3, 1, 6], ["FU", 1, [0, 1]], ["SP", 1, 0, 16, [1], 1], ["AN", 1, 1, 2], ["FFSP", 1, 0, [1, 0], 1, 1], ["AN", 1, 1, 6], ["PR", 4, 0, "auto_unroll_max_step$64"]]]], "r": [[0.000869695, 0.000869719, 0.000869722, 0.0008697], 0, 3.08139, 1656398384], "v": "v0.6"}
{"i": [["[\"3458e75493bb4bb042e539b5ff4818fb\", [8, 1024], [512, 1024], [1, 512], [8, 512]]", "cuda -keys=cuda,gpu -arch=sm_80 -max_num_threads=1024 -thread_warp_size=32", [-1, 16, 64, 49152, 2147483647, 1024, 8, 32], "", 0, []], [[], [["SP", 2, 0, 8, [1, 1, 2, 2], 1], ["SP", 2, 5, 512, [1, 32, 4, 1], 1], ["SP", 2, 10, 1024, [1, 4], 1], ["RE", 2, [0, 5, 1, 6, 2, 7, 10, 11, 3, 8, 12, 4, 9]], ["FSP", 4, 0, 0, 3], ["FSP", 4, 4, 1, 3], ["RE", 4, [0, 4, 1, 5, 2, 6, 3, 7]], ["CA", 2, 4, 5], ["CHR", 1, "shared", [2]], ["CA", 2, 3, 6], ["CHR", 0, "shared", [3]], ["CA", 1, 4, 6], ["FU", 6, [0, 1]], ["AN", 6, 0, 5], ["FU", 6, [1, 2]], ["AN", 6, 1, 4], ["FU", 6, [2, 3]], ["AN", 6, 2, 6], ["FU", 3, [0, 1]], ["SP", 3, 0, 4, [1], 1], ["AN", 3, 1, 2], ["FFSP", 3, 0, [1, 0], 1, 1], ["AN", 3, 1, 6], ["FU", 1, [0, 1]], ["SP", 1, 0, 4, [1], 1], ["AN", 1, 1, 2], ["FFSP", 1, 0, [1, 0], 1, 1], ["AN", 1, 1, 6], ["PR", 4, 0, "auto_unroll_max_step$16"]]]], "r": [[0.000130999, 0.000130983, 0.000130967, 0.000131], 0, 3.03229, 1656398386], "v": "v0.6"}
{"i": [["[\"3458e75493bb4bb042e539b5ff4818fb\", [8, 1024], [512, 1024], [1, 512], [8, 512]]", "cuda -keys=cuda,gpu -arch=sm_80 -max_num_threads=1024 -thread_warp_size=32", [-1, 16, 64, 49152, 2147483647, 1024, 8, 32], "", 0, []], [[], [["SP", 2, 0, 8, [1, 2, 2, 1], 1], ["SP", 2, 5, 512, [1, 128, 1, 1], 1], ["SP", 2, 10, 1024, [16, 1], 1], ["RE", 2, [0, 5, 1, 6, 2, 7, 10, 11, 3, 8, 12, 4, 9]], ["FSP", 4, 0, 0, 3], ["FSP", 4, 4, 1, 3], ["RE", 4, [0, 4, 1, 5, 2, 6, 3, 7]], ["CA", 2, 4, 5], ["CHR", 1, "shared", [2]], ["CA", 2, 3, 6], ["CHR", 0, "shared", [3]], ["CA", 1, 4, 6], ["FU", 6, [0, 1]], ["AN", 6, 0, 5], ["FU", 6, [1, 2]], ["AN", 6, 1, 4], ["FU", 6, [2, 3]], ["AN", 6, 2, 6], ["FU", 3, [0, 1]], ["SP", 3, 0, 16, [1], 1], ["AN", 3, 1, 2], ["FFSP", 3, 0, [1, 0], 1, 1], ["AN", 3, 1, 6], ["FU", 1, [0, 1]], ["SP", 1, 0, 32, [1], 1], ["AN", 1, 1, 2], ["FFSP", 1, 0, [1, 0], 1, 1], ["AN", 1, 1, 6], ["PR", 4, 0, "auto_unroll_max_step$64"]]]], "r": [[5.37122e-05, 5.36842e-05, 5.36915e-05, 5.37026e-05], 0, 2.98512, 1656398389], "v": "v0.6"}
{"i": [["[\"3458e75493bb4bb042e539b5ff4818fb\", [8, 1024], [512, 1024], [1, 512], [8, 512]]", "cuda -keys=cuda,gpu -arch=sm_80 -max_num_threads=1024 -thread_warp_size=32", [-1, 16, 64, 49152, 2147483647, 1024, 8, 32], "", 0, []], [[], [["SP", 2, 0, 8, [1, 8, 1, 1], 1], ["SP", 2, 5, 512, [4, 8, 4, 2], 1], ["SP", 2, 10, 1024, [4, 2], 1], ["RE", 2, [0, 5, 1, 6, 2, 7, 10, 11, 3, 8, 12, 4, 9]], ["FSP", 4, 0, 0, 3], ["FSP", 4, 4, 1, 3], ["RE", 4, [0, 4, 1, 5, 2, 6, 3, 7]], ["CA", 2, 4, 5], ["CHR", 1, "shared", [2]], ["CA", 2, 3, 6], ["CHR", 0, "shared", [3]], ["CA", 1, 4, 6], ["FU", 6, [0, 1]], ["AN", 6, 0, 5], ["FU", 6, [1, 2]], ["AN", 6, 1, 4], ["FU", 6, [2, 3]], ["AN", 6, 2, 6], ["FU", 3, [0, 1]], ["SP", 3, 0, 64, [1], 1], ["AN", 3, 1, 2], ["FFSP", 3, 0, [1, 0], 1, 1], ["AN", 3, 1, 6], ["FU", 1, [0, 1]], ["SP", 1, 0, 8, [1], 1], ["AN", 1, 1, 2], ["FFSP", 1, 0, [1, 0], 1, 1], ["AN", 1, 1, 6], ["PR", 4, 0, "auto_unroll_max_step$64"]]]], "r": [[0.000476431, 0.000476467, 0.000476545, 0.000476512], 0, 3.16178, 1656398392], "v": "v0.6"}
{"i": [["[\"3458e75493bb4bb042e539b5ff4818fb\", [8, 1024], [512, 1024], [1, 512], [8, 512]]", "cuda -keys=cuda,gpu -arch=sm_80 -max_num_threads=1024 -thread_warp_size=32", [-1, 16, 64, 49152, 2147483647, 1024, 8, 32], "", 0, []], [[], [["SP", 2, 0, 8, [1, 2, 2, 1], 1], ["SP", 2, 5, 512, [1, 8, 1, 2], 1], ["SP", 2, 10, 1024, [4, 4], 1], ["RE", 2, [0, 5, 1, 6, 2, 7, 10, 11, 3, 8, 12, 4, 9]], ["FSP", 4, 0, 0, 3], ["FSP", 4, 4, 1, 3], ["RE", 4, [0, 4, 1, 5, 2, 6, 3, 7]], ["CA", 2, 4, 5], ["CHR", 1, "shared", [2]], ["CA", 2, 3, 6], ["CHR", 0, "shared", [3]], ["CA", 1, 4, 6], ["FU", 6, [0, 1]], ["AN", 6, 0, 5], ["FU", 6, [1, 2]], ["AN", 6, 1, 4], ["FU", 6, [2, 3]], ["AN", 6, 2, 6], ["FU", 3, [0, 1]], ["SP", 3, 0, 16, [1], 1], ["AN", 3, 1, 2], ["FFSP", 3, 0, [1, 0], 1, 1], ["AN", 3, 1, 6], ["FU", 1, [0, 1]], ["SP", 1, 0, 32, [1], 1], ["AN", 1, 1, 2], ["FFSP", 1, 0, [1, 0], 1, 1], ["AN", 1, 1, 6], ["PR", 4, 0, "auto_unroll_max_step$64"]]]], "r": [[3.71564e-05, 3.71563e-05, 3.71566e-05, 3.71562e-05], 0, 2.95506, 1656398394], "v": "v0.6"}
{"i": [["[\"3458e75493bb4bb042e539b5ff4818fb\", [8, 1024], [512, 1024], [1, 512], [8, 512]]", "cuda -keys=cuda,gpu -arch=sm_80 -max_num_threads=1024 -thread_warp_size=32", [-1, 16, 64, 49152, 2147483647, 1024, 8, 32], "", 0, []], [[], [["SP", 2, 0, 8, [1, 1, 1, 8], 1], ["SP", 2, 5, 512, [1, 128, 1, 1], 1], ["SP", 2, 10, 1024, [2, 1], 1], ["RE", 2, [0, 5, 1, 6, 2, 7, 10, 11, 3, 8, 12, 4, 9]], ["FSP", 4, 0, 0, 3], ["FSP", 4, 4, 1, 3], ["RE", 4, [0, 4, 1, 5, 2, 6, 3, 7]], ["CA", 2, 4, 5], ["CHR", 1, "shared", [2]], ["CA", 2, 3, 6], ["CHR", 0, "shared", [3]], ["CA", 1, 4, 6], ["FU", 6, [0, 1]], ["AN", 6, 0, 5], ["FU", 6, [1, 2]], ["AN", 6, 1, 4], ["FU", 6, [2, 3]], ["AN", 6, 2, 6], ["FU", 3, [0, 1]], ["SP", 3, 0, 2, [2], 1], ["AN", 3, 1, 2], ["FFSP", 3, 0, [1, 0], 1, 1], ["AN", 3, 1, 6], ["FU", 1, [0, 1]], ["SP", 1, 0, 2, [1], 1], ["AN", 1, 1, 2], ["FFSP", 1, 0, [1, 0], 1, 1], ["AN", 1, 1, 6], ["PR", 4, 0, "auto_unroll_max_step$1024"]]]], "r": [[0.000116938, 0.000116933, 0.000116863, 0.000116895], 0, 3.00724, 1656398397], "v": "v0.6"}
{"i": [["[\"3458e75493bb4bb042e539b5ff4818fb\", [8, 1024], [512, 1024], [1, 512], [8, 512]]", "cuda -keys=cuda,gpu -arch=sm_80 -max_num_threads=1024 -thread_warp_size=32", [-1, 16, 64, 49152, 2147483647, 1024, 8, 32], "", 0, []], [[], [["SP", 2, 0, 8, [1, 2, 1, 1], 1], ["SP", 2, 5, 512, [2, 32, 1, 2], 1], ["SP", 2, 10, 1024, [1, 64], 1], ["RE", 2, [0, 5, 1, 6, 2, 7, 10, 11, 3, 8, 12, 4, 9]], ["FSP", 4, 0, 0, 3], ["FSP", 4, 4, 1, 3], ["RE", 4, [0, 4, 1, 5, 2, 6, 3, 7]], ["CA", 2, 4, 5], ["CHR", 1, "shared", [2]], ["CA", 2, 3, 6], ["CHR", 0, "shared", [3]], ["CA", 1, 4, 6], ["FU", 6, [0, 1]], ["AN", 6, 0, 5], ["FU", 6, [1, 2]], ["AN", 6, 1, 4], ["FU", 6, [2, 3]], ["AN", 6, 2, 6], ["FU", 3, [0, 1]], ["SP", 3, 0, 128, [1], 1], ["AN", 3, 1, 2], ["FFSP", 3, 0, [1, 0], 1, 1], ["AN", 3, 1, 6], ["FU", 1, [0, 1]], ["SP", 1, 0, 64, [4], 1], ["AN", 1, 1, 2], ["FFSP", 1, 0, [1, 0], 1, 1], ["AN", 1, 1, 6], ["PR", 4, 0, "auto_unroll_max_step$0"]]]], "r": [[7.79743e-05, 7.79728e-05, 7.79843e-05, 7.79835e-05], 0, 2.98167, 1656398400], "v": "v0.6"}
{"i": [["[\"3458e75493bb4bb042e539b5ff4818fb\", [8, 1024], [512, 1024], [1, 512], [8, 512]]", "cuda -keys=cuda,gpu -arch=sm_80 -max_num_threads=1024 -thread_warp_size=32", [-1, 16, 64, 49152, 2147483647, 1024, 8, 32], "", 0, []], [[], [["SP", 2, 0, 8, [2, 1, 1, 1], 1], ["SP", 2, 5, 512, [4, 32, 1, 4], 1], ["SP", 2, 10, 1024, [8, 1], 1], ["RE", 2, [0, 5, 1, 6, 2, 7, 10, 11, 3, 8, 12, 4, 9]], ["FSP", 4, 0, 0, 3], ["FSP", 4, 4, 1, 3], ["RE", 4, [0, 4, 1, 5, 2, 6, 3, 7]], ["CA", 2, 4, 5], ["CHR", 1, "shared", [2]], ["CA", 2, 3, 6], ["CHR", 0, "shared", [3]], ["CA", 1, 4, 6], ["FU", 6, [0, 1]], ["AN", 6, 0, 5], ["FU", 6, [1, 2]], ["AN", 6, 1, 4], ["FU", 6, [2, 3]], ["AN", 6, 2, 6], ["FU", 3, [0, 1]], ["SP", 3, 0, 32, [1], 1], ["AN", 3, 1, 2], ["FFSP", 3, 0, [1, 0], 1, 1], ["AN", 3, 1, 6], ["FU", 1, [0, 1]], ["SP", 1, 0, 8, [2], 1], ["AN", 1, 1, 2], ["FFSP", 1, 0, [1, 0], 1, 1], ["AN", 1, 1, 6], ["PR", 4, 0, "auto_unroll_max_step$0"]]]], "r": [[0.000406126, 0.000406151, 0.000406154, 0.000406159], 0, 3.06439, 1656398402], "v": "v0.6"}
{"i": [["[\"3458e75493bb4bb042e539b5ff4818fb\", [8, 1024], [512, 1024], [1, 512], [8, 512]]", "cuda -keys=cuda,gpu -arch=sm_80 -max_num_threads=1024 -thread_warp_size=32", [-1, 16, 64, 49152, 2147483647, 1024, 8, 32], "", 0, []], [[], [["SP", 2, 0, 8, [1, 1, 8, 1], 1], ["SP", 2, 5, 512, [1, 32, 8, 1], 1], ["SP", 2, 10, 1024, [4, 4], 1], ["RE", 2, [0, 5, 1, 6, 2, 7, 10, 11, 3, 8, 12, 4, 9]], ["FSP", 4, 0, 0, 3], ["FSP", 4, 4, 1, 3], ["RE", 4, [0, 4, 1, 5, 2, 6, 3, 7]], ["CA", 2, 4, 5], ["CHR", 1, "shared", [2]], ["CA", 2, 3, 6], ["CHR", 0, "shared", [3]], ["CA", 1, 4, 6], ["FU", 6, [0, 1]], ["AN", 6, 0, 5], ["FU", 6, [1, 2]], ["AN", 6, 1, 4], ["FU", 6, [2, 3]], ["AN", 6, 2, 6], ["FU", 3, [0, 1]], ["SP", 3, 0, 128, [1], 1], ["AN", 3, 1, 2], ["FFSP", 3, 0, [1, 0], 1, 1], ["AN", 3, 1, 6], ["FU", 1, [0, 1]], ["SP", 1, 0, 128, [1], 1], ["AN", 1, 1, 2], ["FFSP", 1, 0, [1, 0], 1, 1], ["AN", 1, 1, 6], ["PR", 4, 0, "auto_unroll_max_step$64"]]]], "r": [[0.000244839, 0.000244844, 0.000244842, 0.00024484], 0, 3.17539, 1656398405], "v": "v0.6"}
{"i": [["[\"3458e75493bb4bb042e539b5ff4818fb\", [8, 1024], [512, 1024], [1, 512], [8, 512]]", "cuda -keys=cuda,gpu -arch=sm_80 -max_num_threads=1024 -thread_warp_size=32", [-1, 16, 64, 49152, 2147483647, 1024, 8, 32], "", 0, []], [[], [["SP", 2, 0, 8, [1, 2, 2, 1], 1], ["SP", 2, 5, 512, [1, 16, 1, 32], 1], ["SP", 2, 10, 1024, [1, 4], 1], ["RE", 2, [0, 5, 1, 6, 2, 7, 10, 11, 3, 8, 12, 4, 9]], ["FSP", 4, 0, 0, 3], ["FSP", 4, 4, 1, 3], ["RE", 4, [0, 4, 1, 5, 2, 6, 3, 7]], ["CA", 2, 4, 5], ["CHR", 1, "shared", [2]], ["CA", 2, 3, 6], ["CHR", 0, "shared", [3]], ["CA", 1, 4, 6], ["FU", 6, [0, 1]], ["AN", 6, 0, 5], ["FU", 6, [1, 2]], ["AN", 6, 1, 4], ["FU", 6, [2, 3]], ["AN", 6, 2, 6], ["FU", 3, [0, 1]], ["SP", 3, 0, 4, [1], 1], ["AN", 3, 1, 2], ["FFSP", 3, 0, [1, 0], 1, 1], ["AN", 3, 1, 6], ["FU", 1, [0, 1]], ["SP", 1, 0, 2, [2], 1], ["AN", 1, 1, 2], ["FFSP", 1, 0, [1, 0], 1, 1], ["AN", 1, 1, 6], ["PR", 4, 0, "auto_unroll_max_step$64"]]]], "r": [[0.00190449, 0.00190457, 0.0019047, 0.00190486], 0, 2.1613, 1656398407], "v": "v0.6"}
{"i": [["[\"3458e75493bb4bb042e539b5ff4818fb\", [8, 1024], [512, 1024], [1, 512], [8, 512]]", "cuda -keys=cuda,gpu -arch=sm_80 -max_num_threads=1024 -thread_warp_size=32", [-1, 16, 64, 49152, 2147483647, 1024, 8, 32], "", 0, []], [[], [["SP", 2, 0, 8, [1, 4, 1, 1], 1], ["SP", 2, 5, 512, [1, 16, 1, 16], 1], ["SP", 2, 10, 1024, [8, 4], 1], ["RE", 2, [0, 5, 1, 6, 2, 7, 10, 11, 3, 8, 12, 4, 9]], ["FSP", 4, 0, 0, 3], ["FSP", 4, 4, 1, 3], ["RE", 4, [0, 4, 1, 5, 2, 6, 3, 7]], ["CA", 2, 4, 5], ["CHR", 1, "shared", [2]], ["CA", 2, 3, 6], ["CHR", 0, "shared", [3]], ["CA", 1, 4, 6], ["FU", 6, [0, 1]], ["AN", 6, 0, 5], ["FU", 6, [1, 2]], ["AN", 6, 1, 4], ["FU", 6, [2, 3]], ["AN", 6, 2, 6], ["FU", 3, [0, 1]], ["SP", 3, 0, 128, [1], 1], ["AN", 3, 1, 2], ["FFSP", 3, 0, [1, 0], 1, 1], ["AN", 3, 1, 6], ["FU", 1, [0, 1]], ["SP", 1, 0, 32, [1], 1], ["AN", 1, 1, 2], ["FFSP", 1, 0, [1, 0], 1, 1], ["AN", 1, 1, 6], ["PR", 4, 0, "auto_unroll_max_step$0"]]]], "r": [[0.000251679, 0.000251686, 0.000251684, 0.000251657], 0, 3.02618, 1656398409], "v": "v0.6"}
{"i": [["[\"3458e75493bb4bb042e539b5ff4818fb\", [8, 1024], [512, 1024], [1, 512], [8, 512]]", "cuda -keys=cuda,gpu -arch=sm_80 -max_num_threads=1024 -thread_warp_size=32", [-1, 16, 64, 49152, 2147483647, 1024, 8, 32], "", 0, []], [[], [["SP", 2, 0, 8, [1, 2, 2, 2], 1], ["SP", 2, 5, 512, [2, 32, 1, 8], 1], ["SP", 2, 10, 1024, [1, 1], 1], ["RE", 2, [0, 5, 1, 6, 2, 7, 10, 11, 3, 8, 12, 4, 9]], ["FSP", 4, 0, 0, 3], ["FSP", 4, 4, 1, 3], ["RE", 4, [0, 4, 1, 5, 2, 6, 3, 7]], ["CA", 2, 4, 5], ["CHR", 1, "shared", [2]], ["CA", 2, 3, 6], ["CHR", 0, "shared", [3]], ["CA", 1, 4, 6], ["FU", 6, [0, 1]], ["AN", 6, 0, 5], ["FU", 6, [1, 2]], ["AN", 6, 1, 4], ["FU", 6, [2, 3]], ["AN", 6, 2, 6], ["FU", 3, [0, 1]], ["SP", 3, 0, 4, [1], 1], ["AN", 3, 1, 2], ["FFSP", 3, 0, [1, 0], 1, 1], ["AN", 3, 1, 6], ["FU", 1, [0, 1]], ["SP", 1, 0, 4, [1], 1], ["AN", 1, 1, 2], ["FFSP", 1, 0, [1, 0], 1, 1], ["AN", 1, 1, 6], ["PR", 4, 0, "auto_unroll_max_step$16"]]]], "r": [[0.000615938, 0.000615972, 0.000616013, 0.000615986], 0, 3.07397, 1656398412], "v": "v0.6"}
{"i": [["[\"3458e75493bb4bb042e539b5ff4818fb\", [8, 1024], [512, 1024], [1, 512], [8, 512]]", "cuda -keys=cuda,gpu -arch=sm_80 -max_num_threads=1024 -thread_warp_size=32", [-1, 16, 64, 49152, 2147483647, 1024, 8, 32], "", 0, []], [[], [["SP", 2, 0, 8, [1, 1, 1, 4], 1], ["SP", 2, 5, 512, [1, 64, 1, 2], 1], ["SP", 2, 10, 1024, [2, 2], 1], ["RE", 2, [0, 5, 1, 6, 2, 7, 10, 11, 3, 8, 12, 4, 9]], ["FSP", 4, 0, 0, 3], ["FSP", 4, 4, 1, 3], ["RE", 4, [0, 4, 1, 5, 2, 6, 3, 7]], ["CA", 2, 4, 5], ["CHR", 1, "shared", [2]], ["CA", 2, 3, 6], ["CHR", 0, "shared", [3]], ["CA", 1, 4, 6], ["FU", 6, [0, 1]], ["AN", 6, 0, 5], ["FU", 6, [1, 2]], ["AN", 6, 1, 4], ["FU", 6, [2, 3]], ["AN", 6, 2, 6], ["FU", 3, [0, 1]], ["SP", 3, 0, 8, [1], 1], ["AN", 3, 1, 2], ["FFSP", 3, 0, [1, 0], 1, 1], ["AN", 3, 1, 6], ["FU", 1, [0, 1]], ["SP", 1, 0, 16, [1], 1], ["AN", 1, 1, 2], ["FFSP", 1, 0, [1, 0], 1, 1], ["AN", 1, 1, 6], ["PR", 4, 0, "auto_unroll_max_step$0"]]]], "r": [[8.84247e-05, 8.84251e-05, 8.84324e-05, 8.84211e-05], 0, 2.92266, 1656398415], "v": "v0.6"}
{"i": [["[\"3458e75493bb4bb042e539b5ff4818fb\", [8, 1024], [512, 1024], [1, 512], [8, 512]]", "cuda -keys=cuda,gpu -arch=sm_80 -max_num_threads=1024 -thread_warp_size=32", [-1, 16, 64, 49152, 2147483647, 1024, 8, 32], "", 0, []], [[], [["SP", 2, 0, 8, [1, 2, 4, 1], 1], ["SP", 2, 5, 512, [4, 32, 1, 1], 1], ["SP", 2, 10, 1024, [64, 1], 1], ["RE", 2, [0, 5, 1, 6, 2, 7, 10, 11, 3, 8, 12, 4, 9]], ["FSP", 4, 0, 0, 3], ["FSP", 4, 4, 1, 3], ["RE", 4, [0, 4, 1, 5, 2, 6, 3, 7]], ["CA", 2, 4, 5], ["CHR", 1, "shared", [2]], ["CA", 2, 3, 6], ["CHR", 0, "shared", [3]], ["CA", 1, 4, 6], ["FU", 6, [0, 1]], ["AN", 6, 0, 5], ["FU", 6, [1, 2]], ["AN", 6, 1, 4], ["FU", 6, [2, 3]], ["AN", 6, 2, 6], ["FU", 3, [0, 1]], ["SP", 3, 0, 64, [1], 1], ["AN", 3, 1, 2], ["FFSP", 3, 0, [1, 0], 1, 1], ["AN", 3, 1, 6], ["FU", 1, [0, 1]], ["SP", 1, 0, 128, [2], 1], ["AN", 1, 1, 2], ["FFSP", 1, 0, [1, 0], 1, 1], ["AN", 1, 1, 6], ["PR", 4, 0, "auto_unroll_max_step$64"]]]], "r": [[0.000129325, 0.000129328, 0.000129323, 0.000129324], 0, 2.98205, 1656398417], "v": "v0.6"}
{"i": [["[\"3458e75493bb4bb042e539b5ff4818fb\", [8, 1024], [512, 1024], [1, 512], [8, 512]]", "cuda -keys=cuda,gpu -arch=sm_80 -max_num_threads=1024 -thread_warp_size=32", [-1, 16, 64, 49152, 2147483647, 1024, 8, 32], "", 0, []], [[], [["SP", 2, 0, 8, [4, 2, 1, 1], 1], ["SP", 2, 5, 512, [1, 32, 4, 4], 1], ["SP", 2, 10, 1024, [8, 2], 1], ["RE", 2, [0, 5, 1, 6, 2, 7, 10, 11, 3, 8, 12, 4, 9]], ["FSP", 4, 0, 0, 3], ["FSP", 4, 4, 1, 3], ["RE", 4, [0, 4, 1, 5, 2, 6, 3, 7]], ["CA", 2, 4, 5], ["CHR", 1, "shared", [2]], ["CA", 2, 3, 6], ["CHR", 0, "shared", [3]], ["CA", 1, 4, 6], ["FU", 6, [0, 1]], ["AN", 6, 0, 5], ["FU", 6, [1, 2]], ["AN", 6, 1, 4], ["FU", 6, [2, 3]], ["AN", 6, 2, 6], ["FU", 3, [0, 1]], ["SP", 3, 0, 256, [1], 1], ["AN", 3, 1, 2], ["FFSP", 3, 0, [1, 0], 1, 1], ["AN", 3, 1, 6], ["FU", 1, [0, 1]], ["SP", 1, 0, 16, [1], 1], ["AN", 1, 1, 2], ["FFSP", 1, 0, [1, 0], 1, 1], ["AN", 1, 1, 6], ["PR", 4, 0, "auto_unroll_max_step$1024"]]]], "r": [[0.000269666, 0.000269631, 0.000269681, 0.000269628], 0, 4.45657, 1656398423], "v": "v0.6"}
{"i": [["[\"3458e75493bb4bb042e539b5ff4818fb\", [8, 1024], [512, 1024], [1, 512], [8, 512]]", "cuda -keys=cuda,gpu -arch=sm_80 -max_num_threads=1024 -thread_warp_size=32", [-1, 16, 64, 49152, 2147483647, 1024, 8, 32], "", 0, []], [[], [["SP", 2, 0, 8, [1, 1, 2, 2], 1], ["SP", 2, 5, 512, [1, 32, 4, 1], 1], ["SP", 2, 10, 1024, [1, 1], 1], ["RE", 2, [0, 5, 1, 6, 2, 7, 10, 11, 3, 8, 12, 4, 9]], ["FSP", 4, 0, 0, 3], ["FSP", 4, 4, 1, 3], ["RE", 4, [0, 4, 1, 5, 2, 6, 3, 7]], ["CA", 2, 4, 5], ["CHR", 1, "shared", [2]], ["CA", 2, 3, 6], ["CHR", 0, "shared", [3]], ["CA", 1, 4, 6], ["FU", 6, [0, 1]], ["AN", 6, 0, 5], ["FU", 6, [1, 2]], ["AN", 6, 1, 4], ["FU", 6, [2, 3]], ["AN", 6, 2, 6], ["FU", 3, [0, 1]], ["SP", 3, 0, 4, [2], 1], ["AN", 3, 1, 2], ["FFSP", 3, 0, [1, 0], 1, 1], ["AN", 3, 1, 6], ["FU", 1, [0, 1]], ["SP", 1, 0, 4, [2], 1], ["AN", 1, 1, 2], ["FFSP", 1, 0, [1, 0], 1, 1], ["AN", 1, 1, 6], ["PR", 4, 0, "auto_unroll_max_step$512"]]]], "r": [[0.000269655, 0.000269599, 0.000269678, 0.000269655], 0, 3.18962, 1656398426], "v": "v0.6"}
{"i": [["[\"3458e75493bb4bb042e539b5ff4818fb\", [8, 1024], [512, 1024], [1, 512], [8, 512]]", "cuda -keys=cuda,gpu -arch=sm_80 -max_num_threads=1024 -thread_warp_size=32", [-1, 16, 64, 49152, 2147483647, 1024, 8, 32], "", 0, []], [[], [["SP", 2, 0, 8, [1, 4, 1, 1], 1], ["SP", 2, 5, 512, [1, 16, 4, 8], 1], ["SP", 2, 10, 1024, [16, 1], 1], ["RE", 2, [0, 5, 1, 6, 2, 7, 10, 11, 3, 8, 12, 4, 9]], ["FSP", 4, 0, 0, 3], ["FSP", 4, 4, 1, 3], ["RE", 4, [0, 4, 1, 5, 2, 6, 3, 7]], ["CA", 2, 4, 5], ["CHR", 1, "shared", [2]], ["CA", 2, 3, 6], ["CHR", 0, "shared", [3]], ["CA", 1, 4, 6], ["FU", 6, [0, 1]], ["AN", 6, 0, 5], ["FU", 6, [1, 2]], ["AN", 6, 1, 4], ["FU", 6, [2, 3]], ["AN", 6, 2, 6], ["FU", 3, [0, 1]], ["SP", 3, 0, 512, [2], 1], ["AN", 3, 1, 2], ["FFSP", 3, 0, [1, 0], 1, 1], ["AN", 3, 1, 6], ["FU", 1, [0, 1]], ["SP", 1, 0, 16, [4], 1], ["AN", 1, 1, 2], ["FFSP", 1, 0, [1, 0], 1, 1], ["AN", 1, 1, 6], ["PR", 4, 0, "auto_unroll_max_step$16"]]]], "r": [[0.000836917, 0.000836908, 0.000836902, 0.000836912], 0, 3.4411, 1656398428], "v": "v0.6"}
{"i": [["[\"3458e75493bb4bb042e539b5ff4818fb\", [8, 1024], [512, 1024], [1, 512], [8, 512]]", "cuda -keys=cuda,gpu -arch=sm_80 -max_num_threads=1024 -thread_warp_size=32", [-1, 16, 64, 49152, 2147483647, 1024, 8, 32], "", 0, []], [[], [["SP", 2, 0, 8, [1, 1, 8, 1], 1], ["SP", 2, 5, 512, [4, 16, 2, 1], 1], ["SP", 2, 10, 1024, [4, 16], 1], ["RE", 2, [0, 5, 1, 6, 2, 7, 10, 11, 3, 8, 12, 4, 9]], ["FSP", 4, 0, 0, 3], ["FSP", 4, 4, 1, 3], ["RE", 4, [0, 4, 1, 5, 2, 6, 3, 7]], ["CA", 2, 4, 5], ["CHR", 1, "shared", [2]], ["CA", 2, 3, 6], ["CHR", 0, "shared", [3]], ["CA", 1, 4, 6], ["FU", 6, [0, 1]], ["AN", 6, 0, 5], ["FU", 6, [1, 2]], ["AN", 6, 1, 4], ["FU", 6, [2, 3]], ["AN", 6, 2, 6], ["FU", 3, [0, 1]], ["SP", 3, 0, 64, [1], 1], ["AN", 3, 1, 2], ["FFSP", 3, 0, [1, 0], 1, 1], ["AN", 3, 1, 6], ["FU", 1, [0, 1]], ["SP", 1, 0, 512, [1], 1], ["AN", 1, 1, 2], ["FFSP", 1, 0, [1, 0], 1, 1], ["AN", 1, 1, 6], ["PR", 4, 0, "auto_unroll_max_step$0"]]]], "r": [[0.000215138, 0.000215136, 0.000215136, 0.000215137], 0, 3.39074, 1656398431], "v": "v0.6"}
{"i": [["[\"3458e75493bb4bb042e539b5ff4818fb\", [8, 1024], [512, 1024], [1, 512], [8, 512]]", "cuda -keys=cuda,gpu -arch=sm_80 -max_num_threads=1024 -thread_warp_size=32", [-1, 16, 64, 49152, 2147483647, 1024, 8, 32], "", 0, []], [[], [["SP", 2, 0, 8, [2, 1, 1, 1], 1], ["SP", 2, 5, 512, [2, 32, 4, 2], 1], ["SP", 2, 10, 1024, [8, 1], 1], ["RE", 2, [0, 5, 1, 6, 2, 7, 10, 11, 3, 8, 12, 4, 9]], ["FSP", 4, 0, 0, 3], ["FSP", 4, 4, 1, 3], ["RE", 4, [0, 4, 1, 5, 2, 6, 3, 7]], ["CA", 2, 4, 5], ["CHR", 1, "shared", [2]], ["CA", 2, 3, 6], ["CHR", 0, "shared", [3]], ["CA", 1, 4, 6], ["FU", 6, [0, 1]], ["AN", 6, 0, 5], ["FU", 6, [1, 2]], ["AN", 6, 1, 4], ["FU", 6, [2, 3]], ["AN", 6, 2, 6], ["FU", 3, [0, 1]], ["SP", 3, 0, 64, [1], 1], ["AN", 3, 1, 2], ["FFSP", 3, 0, [1, 0], 1, 1], ["AN", 3, 1, 6], ["FU", 1, [0, 1]], ["SP", 1, 0, 8, [1], 1], ["AN", 1, 1, 2], ["FFSP", 1, 0, [1, 0], 1, 1], ["AN", 1, 1, 6], ["PR", 4, 0, "auto_unroll_max_step$0"]]]], "r": [[0.000406659, 0.00040665, 0.000406662, 0.000406664], 0, 3.25483, 1656398434], "v": "v0.6"}
{"i": [["[\"3458e75493bb4bb042e539b5ff4818fb\", [8, 1024], [512, 1024], [1, 512], [8, 512]]", "cuda -keys=cuda,gpu -arch=sm_80 -max_num_threads=1024 -thread_warp_size=32", [-1, 16, 64, 49152, 2147483647, 1024, 8, 32], "", 0, []], [[], [["SP", 2, 0, 8, [1, 8, 1, 1], 1], ["SP", 2, 5, 512, [1, 32, 1, 8], 1], ["SP", 2, 10, 1024, [2, 8], 1], ["RE", 2, [0, 5, 1, 6, 2, 7, 10, 11, 3, 8, 12, 4, 9]], ["FSP", 4, 0, 0, 3], ["FSP", 4, 4, 1, 3], ["RE", 4, [0, 4, 1, 5, 2, 6, 3, 7]], ["CA", 2, 4, 5], ["CHR", 1, "shared", [2]], ["CA", 2, 3, 6], ["CHR", 0, "shared", [3]], ["CA", 1, 4, 6], ["FU", 6, [0, 1]], ["AN", 6, 0, 5], ["FU", 6, [1, 2]], ["AN", 6, 1, 4], ["FU", 6, [2, 3]], ["AN", 6, 2, 6], ["FU", 3, [0, 1]], ["SP", 3, 0, 64, [1], 1], ["AN", 3, 1, 2], ["FFSP", 3, 0, [1, 0], 1, 1], ["AN", 3, 1, 6], ["FU", 1, [0, 1]], ["SP", 1, 0, 8, [2], 1], ["AN", 1, 1, 2], ["FFSP", 1, 0, [1, 0], 1, 1], ["AN", 1, 1, 6], ["PR", 4, 0, "auto_unroll_max_step$512"]]]], "r": [[0.000411089, 0.000411082, 0.000411099, 0.00041104], 0, 3.32914, 1656398437], "v": "v0.6"}
{"i": [["[\"3458e75493bb4bb042e539b5ff4818fb\", [8, 1024], [512, 1024], [1, 512], [8, 512]]", "cuda -keys=cuda,gpu -arch=sm_80 -max_num_threads=1024 -thread_warp_size=32", [-1, 16, 64, 49152, 2147483647, 1024, 8, 32], "", 0, []], [[], [["SP", 2, 0, 8, [1, 8, 1, 1], 1], ["SP", 2, 5, 512, [2, 4, 4, 16], 1], ["SP", 2, 10, 1024, [1, 1], 1], ["RE", 2, [0, 5, 1, 6, 2, 7, 10, 11, 3, 8, 12, 4, 9]], ["FSP", 4, 0, 0, 3], ["FSP", 4, 4, 1, 3], ["RE", 4, [0, 4, 1, 5, 2, 6, 3, 7]], ["CA", 2, 4, 5], ["CHR", 1, "shared", [2]], ["CA", 2, 3, 6], ["CHR", 0, "shared", [3]], ["CA", 1, 4, 6], ["FU", 6, [0, 1]], ["AN", 6, 0, 5], ["FU", 6, [1, 2]], ["AN", 6, 1, 4], ["FU", 6, [2, 3]], ["AN", 6, 2, 6], ["FU", 3, [0, 1]], ["SP", 3, 0, 64, [4], 1], ["AN", 3, 1, 2], ["FFSP", 3, 0, [1, 0], 1, 1], ["AN", 3, 1, 6], ["FU", 1, [0, 1]], ["SP", 1, 0, 1, [1], 1], ["AN", 1, 1, 2], ["FFSP", 1, 0, [1, 0], 1, 1], ["AN", 1, 1, 6], ["PR", 4, 0, "auto_unroll_max_step$16"]]]], "r": [[0.00157771, 0.00157772, 0.00157773, 0.00157772], 0, 3.42437, 1656398439], "v": "v0.6"}
{"i": [["[\"3458e75493bb4bb042e539b5ff4818fb\", [8, 1024], [512, 1024], [1, 512], [8, 512]]", "cuda -keys=cuda,gpu -arch=sm_80 -max_num_threads=1024 -thread_warp_size=32", [-1, 16, 64, 49152, 2147483647, 1024, 8, 32], "", 0, []], [[], [["SP", 2, 0, 8, [1, 4, 1, 1], 1], ["SP", 2, 5, 512, [2, 16, 16, 1], 1], ["SP", 2, 10, 1024, [1, 2], 1], ["RE", 2, [0, 5, 1, 6, 2, 7, 10, 11, 3, 8, 12, 4, 9]], ["FSP", 4, 0, 0, 3], ["FSP", 4, 4, 1, 3], ["RE", 4, [0, 4, 1, 5, 2, 6, 3, 7]], ["CA", 2, 4, 5], ["CHR", 1, "shared", [2]], ["CA", 2, 3, 6], ["CHR", 0, "shared", [3]], ["CA", 1, 4, 6], ["FU", 6, [0, 1]], ["AN", 6, 0, 5], ["FU", 6, [1, 2]], ["AN", 6, 1, 4], ["FU", 6, [2, 3]], ["AN", 6, 2, 6], ["FU", 3, [0, 1]], ["SP", 3, 0, 32, [1], 1], ["AN", 3, 1, 2], ["FFSP", 3, 0, [1, 0], 1, 1], ["AN", 3, 1, 6], ["FU", 1, [0, 1]], ["SP", 1, 0, 4, [1], 1], ["AN", 1, 1, 2], ["FFSP", 1, 0, [1, 0], 1, 1], ["AN", 1, 1, 6], ["PR", 4, 0, "auto_unroll_max_step$16"]]]], "r": [[0.000694939, 0.000694915, 0.000694902, 0.000694931], 0, 3.18383, 1656398442], "v": "v0.6"}
{"i": [["[\"3458e75493bb4bb042e539b5ff4818fb\", [8, 1024], [512, 1024], [1, 512], [8, 512]]", "cuda -keys=cuda,gpu -arch=sm_80 -max_num_threads=1024 -thread_warp_size=32", [-1, 16, 64, 49152, 2147483647, 1024, 8, 32], "", 0, []], [[], [["SP", 2, 0, 8, [1, 4, 2, 1], 1], ["SP", 2, 5, 512, [1, 8, 4, 1], 1], ["SP", 2, 10, 1024, [16, 1], 1], ["RE", 2, [0, 5, 1, 6, 2, 7, 10, 11, 3, 8, 12, 4, 9]], ["FSP", 4, 0, 0, 3], ["FSP", 4, 4, 1, 3], ["RE", 4, [0, 4, 1, 5, 2, 6, 3, 7]], ["CA", 2, 4, 5], ["CHR", 1, "shared", [2]], ["CA", 2, 3, 6], ["CHR", 0, "shared", [3]], ["CA", 1, 4, 6], ["FU", 6, [0, 1]], ["AN", 6, 0, 5], ["FU", 6, [1, 2]], ["AN", 6, 1, 4], ["FU", 6, [2, 3]], ["AN", 6, 2, 6], ["FU", 3, [0, 1]], ["SP", 3, 0, 128, [64], 1], ["AN", 3, 1, 2], ["FFSP", 3, 0, [1, 0], 1, 1], ["AN", 3, 1, 6], ["FU", 1, [0, 1]], ["SP", 1, 0, 256, [1], 1], ["AN", 1, 1, 2], ["FFSP", 1, 0, [1, 0], 1, 1], ["AN", 1, 1, 6], ["PR", 4, 0, "auto_unroll_max_step$16"]]]], "r": [[0.000130633, 0.000130655, 0.000130651, 0.000130647], 0, 3.18796, 1656398445], "v": "v0.6"}
{"i": [["[\"3458e75493bb4bb042e539b5ff4818fb\", [8, 1024], [512, 1024], [1, 512], [8, 512]]", "cuda -keys=cuda,gpu -arch=sm_80 -max_num_threads=1024 -thread_warp_size=32", [-1, 16, 64, 49152, 2147483647, 1024, 8, 32], "", 0, []], [[], [["SP", 2, 0, 8, [2, 1, 4, 1], 1], ["SP", 2, 5, 512, [1, 64, 8, 1], 1], ["SP", 2, 10, 1024, [1, 1], 1], ["RE", 2, [0, 5, 1, 6, 2, 7, 10, 11, 3, 8, 12, 4, 9]], ["FSP", 4, 0, 0, 3], ["FSP", 4, 4, 1, 3], ["RE", 4, [0, 4, 1, 5, 2, 6, 3, 7]], ["CA", 2, 4, 5], ["CHR", 1, "shared", [2]], ["CA", 2, 3, 6], ["CHR", 0, "shared", [3]], ["CA", 1, 4, 6], ["FU", 6, [0, 1]], ["AN", 6, 0, 5], ["FU", 6, [1, 2]], ["AN", 6, 1, 4], ["FU", 6, [2, 3]], ["AN", 6, 2, 6], ["FU", 3, [0, 1]], ["SP", 3, 0, 8, [1], 1], ["AN", 3, 1, 2], ["FFSP", 3, 0, [1, 0], 1, 1], ["AN", 3, 1, 6], ["FU", 1, [0, 1]], ["SP", 1, 0, 4, [4], 1], ["AN", 1, 1, 2], ["FFSP", 1, 0, [1, 0], 1, 1], ["AN", 1, 1, 6], ["PR", 4, 0, "auto_unroll_max_step$512"]]]], "r": [[0.000694228, 0.000694221, 0.000694231, 0.000694219], 0, 3.10168, 1656398447], "v": "v0.6"}
{"i": [["[\"3458e75493bb4bb042e539b5ff4818fb\", [8, 1024], [512, 1024], [1, 512], [8, 512]]", "cuda -keys=cuda,gpu -arch=sm_80 -max_num_threads=1024 -thread_warp_size=32", [-1, 16, 64, 49152, 2147483647, 1024, 8, 32], "", 0, []], [[], [["SP", 2, 0, 8, [1, 1, 1, 2], 1], ["SP", 2, 5, 512, [4, 32, 1, 2], 1], ["SP", 2, 10, 1024, [16, 2], 1], ["RE", 2, [0, 5, 1, 6, 2, 7, 10, 11, 3, 8, 12, 4, 9]], ["FSP", 4, 0, 0, 3], ["FSP", 4, 4, 1, 3], ["RE", 4, [0, 4, 1, 5, 2, 6, 3, 7]], ["CA", 2, 4, 5], ["CHR", 1, "shared", [2]], ["CA", 2, 3, 6], ["CHR", 0, "shared", [3]], ["CA", 1, 4, 6], ["FU", 6, [0, 1]], ["AN", 6, 0, 5], ["FU", 6, [1, 2]], ["AN", 6, 1, 4], ["FU", 6, [2, 3]], ["AN", 6, 2, 6], ["FU", 3, [0, 1]], ["SP", 3, 0, 64, [1], 1], ["AN", 3, 1, 2], ["FFSP", 3, 0, [1, 0], 1, 1], ["AN", 3, 1, 6], ["FU", 1, [0, 1]], ["SP", 1, 0, 32, [1], 1], ["AN", 1, 1, 2], ["FFSP", 1, 0, [1, 0], 1, 1], ["AN", 1, 1, 6], ["PR", 4, 0, "auto_unroll_max_step$64"]]]], "r": [[0.000175939, 0.000175863, 0.000175848, 0.000175957], 0, 3.00972, 1656398450], "v": "v0.6"}
{"i": [["[\"3458e75493bb4bb042e539b5ff4818fb\", [8, 1024], [512, 1024], [1, 512], [8, 512]]", "cuda -keys=cuda,gpu -arch=sm_80 -max_num_threads=1024 -thread_warp_size=32", [-1, 16, 64, 49152, 2147483647, 1024, 8, 32], "", 0, []], [[], [["SP", 2, 0, 8, [1, 8, 1, 1], 1], ["SP", 2, 5, 512, [4, 2, 16, 2], 1], ["SP", 2, 10, 1024, [1, 2], 1], ["RE", 2, [0, 5, 1, 6, 2, 7, 10, 11, 3, 8, 12, 4, 9]], ["FSP", 4, 0, 0, 3], ["FSP", 4, 4, 1, 3], ["RE", 4, [0, 4, 1, 5, 2, 6, 3, 7]], ["CA", 2, 4, 5], ["CHR", 1, "shared", [2]], ["CA", 2, 3, 6], ["CHR", 0, "shared", [3]], ["CA", 1, 4, 6], ["FU", 6, [0, 1]], ["AN", 6, 0, 5], ["FU", 6, [1, 2]], ["AN", 6, 1, 4], ["FU", 6, [2, 3]], ["AN", 6, 2, 6], ["FU", 3, [0, 1]], ["SP", 3, 0, 64, [1], 1], ["AN", 3, 1, 2], ["FFSP", 3, 0, [1, 0], 1, 1], ["AN", 3, 1, 6], ["FU", 1, [0, 1]], ["SP", 1, 0, 8, [1], 1], ["AN", 1, 1, 2], ["FFSP", 1, 0, [1, 0], 1, 1], ["AN", 1, 1, 6], ["PR", 4, 0, "auto_unroll_max_step$1024"]]]], "r": [[0.000513844, 0.000513757, 0.000513769, 0.000513777], 0, 3.55095, 1656398453], "v": "v0.6"}
{"i": [["[\"3458e75493bb4bb042e539b5ff4818fb\", [8, 1024], [512, 1024], [1, 512], [8, 512]]", "cuda -keys=cuda,gpu -arch=sm_80 -max_num_threads=1024 -thread_warp_size=32", [-1, 16, 64, 49152, 2147483647, 1024, 8, 32], "", 0, []], [[], [["SP", 2, 0, 8, [1, 2, 2, 1], 1], ["SP", 2, 5, 512, [8, 8, 1, 2], 1], ["SP", 2, 10, 1024, [1, 64], 1], ["RE", 2, [0, 5, 1, 6, 2, 7, 10, 11, 3, 8, 12, 4, 9]], ["FSP", 4, 0, 0, 3], ["FSP", 4, 4, 1, 3], ["RE", 4, [0, 4, 1, 5, 2, 6, 3, 7]], ["CA", 2, 4, 5], ["CHR", 1, "shared", [2]], ["CA", 2, 3, 6], ["CHR", 0, "shared", [3]], ["CA", 1, 4, 6], ["FU", 6, [0, 1]], ["AN", 6, 0, 5], ["FU", 6, [1, 2]], ["AN", 6, 1, 4], ["FU", 6, [2, 3]], ["AN", 6, 2, 6], ["FU", 3, [0, 1]], ["SP", 3, 0, 128, [1], 1], ["AN", 3, 1, 2], ["FFSP", 3, 0, [1, 0], 1, 1], ["AN", 3, 1, 6], ["FU", 1, [0, 1]], ["SP", 1, 0, 64, [1], 1], ["AN", 1, 1, 2], ["FFSP", 1, 0, [1, 0], 1, 1], ["AN", 1, 1, 6], ["PR", 4, 0, "auto_unroll_max_step$16"]]]], "r": [[0.000293558, 0.000293554, 0.000293583, 0.000293577], 0, 3.09242, 1656398455], "v": "v0.6"}
